,newsId,title,summary,link
668,6507921,AI基建大贏家！開拓重工衝破1000美元大關 今年飆78%稱霸道瓊,,https://m.cnyes.com/news/id/6507921
669,6508235,生技中心參與北美生物科技大展 大秀兩項新模態藥物平台技術,生物技術開發中心 (DCB) 今年再度參與 2026 年北美生物科技大展 (US BIO)，並於展會中展示 2 項新模態藥物關鍵平台技術，包括自主研發的抗體核酸藥物複合體 (AOC) 鏈結技術平台，以及精準肝靶向 LNP 平台。 ,https://m.cnyes.com/news/id/6508235
670,6508216,富喬M9等級石英布材料進行認證 高階玻纖布下半年動能續強,富喬今股東會並通過對 2025 年獲利配發案，配發 0.5 元股息及 0.5 元股票股利，合計爲 1 元。富喬並指出，針對 M9 等級的石英布材料，富喬已研製成功。,https://m.cnyes.com/news/id/6508216
671,6507972,降價也賣不動 中國合資燃油車開始主動撤出門市,2026 年即將過半，燃油車在中國市場的退潮速度超出了年初多數判斷。乘聯會的數據顯示，5 月常規燃油乘用車零售量年降 39%，同期全國乘用車整體降幅為 22.1%。,https://m.cnyes.com/news/id/6507972
672,6508142,美暫緩伊朗石油禁令有助運量恢復？專家示警：荷姆茲海峽恐低限度開放 庫存耗盡危機猶存,,https://m.cnyes.com/news/id/6508142
673,6508138,瓦城加速美國展店 下半年再推2個新品牌 引進台菜,瓦城美國將再推 2 個新品牌 引進台菜,https://m.cnyes.com/news/id/6508138
674,6507952,SpaceX股價再暴跌16%！發債200億美元引爆賣壓、AI大單也難救？,"SpaceX 股價週一重挫 16.43%，連續第三個交易日收黑。市場認為，公司宣布發行至少 200 億美元優先無擔保債券償還過渡性貸款，是引發賣壓的主因。儘管 SpaceX 持有超過 1,008 億美元現金，旗下 SpaceXAI 也與 Re",https://m.cnyes.com/news/id/6507952
675,6507897,Strategy又開始買比特幣 市場真正擔心的卻是另一件事,曾名為 MicroStrategy 的 Strategy(MSTR-US) 在多年來首次賣出比特幣引發市場熱議後，如今又恢復買進比特幣。但對公司而言，那場爭議其實並非目前最大的問題。,https://m.cnyes.com/news/id/6507897
676,6508132,〈房產〉小宅化浪潮席捲下新竹也難逃  1房格局成交比重上升居七都之冠,高房價與少子化夾擊，讓全台房市在過去 10 年間遭「小宅化」浪潮席捲。根據市調機構統計，2025 年七都住宅成交房型與 2016 年相比，10 年之間 1 房格局住宅成交比重上升高達 7.3 個百 分點居七都之冠。,https://m.cnyes.com/news/id/6508132
677,6507970,日元部分面額硬幣鑄造成本 超過幣面價值,由於鑄造硬幣的有色金屬價格不斷上漲、日元持續貶值，10 日元硬幣作為金屬的價值不斷提高，已超過幣面價值。,https://m.cnyes.com/news/id/6507970
678,6508119,〈南山人壽股東會〉工會籲上市前解決勞資紛爭 公司盼理性協商、依法釐清承攬爭議,南山人壽今 (23) 日召開股東常會，由董事長尹崇堯親自主持，然而，場外卻充斥抗議聲浪，台北市南山人壽企業工會要求公司上市前要先解決勞資爭議,https://m.cnyes.com/news/id/6508119
679,6508120,研調：Q1全球智慧手錶出貨量年增4% 蘋果年增21%成長動能最強勁,研調機構 Counterpoint Research 最新報告研究，2026 年第一季全球智慧手錶出貨量較去年同期成長 4%。成長動能主要來自 Apple 新一代產品持續獲得消費者青睞，以及具備進階健康監測功能的高階智慧手錶需求增加,https://m.cnyes.com/news/id/6508120
680,6508106,〈台股開盤〉連漲6天後震盪加劇 衝上4萬8新高後翻黑 上沖下洗逾900點,"台股今 (23) 日開盤後再度上攻，一度大漲近 500 點，最高達 48,218 點，續創歷史新高，但隨著創高後賣壓湧現，指數迅速拉回，翻黑跌逾 400 點，最低下探至 47,310 點，高低點震盪超過 900 點，預計今日成交量將達 1.7 兆元",https://m.cnyes.com/news/id/6508106
681,6507955,IPO狂歡結束了？SpaceX三日重挫後再拋200億美元發債計畫 市場轉盯解禁賣壓,甫轟動上市的 SpaceX，近期股價急速降溫，連續重跌三日。市場除了消化高達 200 億美元的發債計畫外，更擔憂未來大規模限售股解禁將帶來沉重賣壓。儘管華爾街仍看好其太空與 AI 布局，但投資人開始重新審視其高估值與資金需求。,https://m.cnyes.com/news/id/6507955
682,6508108,〈焦點股〉可成伺服器動能轉強、搭AI題材走揚 漲逾半根停板攻月線,伺服器機殼廠可成 (2474-TW) 於股東會透露成功切入伺服器領域，伺服器動能逐步轉強，預期今年伺服器營收比重上看 2 成，激勵近日股價相對弱勢的可成走揚，大漲逾半根停板，攻上月線。 ,https://m.cnyes.com/news/id/6508108
683,6507948,Palantir跌破關鍵支撐！還會跌多少？分析師怎這樣說,Palantir 股價週一重挫近 7%，跌破 127 美元關鍵技術支撐，創逾一年來新低。今年累計跌幅已達 32%，較歷史高點回落 41%。儘管估值偏高、市場擔憂 AI 衝擊軟體產業，但華爾街分析師平均目標價仍達 189.87 美元，隱含 57,https://m.cnyes.com/news/id/6507948
684,6508089,三年營收翻3倍！「物理AI第一股」Momenta將登陸港股 專家：開啟物理AI兆元級產業周期,,https://m.cnyes.com/news/id/6508089
685,6507962,伊朗公布已故最高領袖葬禮儀式安排,伊朗革命烈士領袖紀念委員會 22 日（周一）宣布，已故最高領袖哈米尼的告別、送葬和安葬儀式，7 月 4 日起將在德黑蘭、庫姆和馬什哈德舉行。,https://m.cnyes.com/news/id/6507962
686,6507923,AI顛覆SaaS模式 Salesforce慘陷史上最長14連跌 年跌幅已達43%,AI 代理浪潮正重塑軟體產業格局，Salesforce 股價連跌 14 日，創公司史上最長連跌紀錄，且今年已暴跌 43%，市場擔憂企業未來可能自行打造 AI 代理系統，削弱傳統 SaaS 商業模式與 Agentforce 平台價值。,https://m.cnyes.com/news/id/6507923
687,6507872,iPhone Fold走出「狼來了」時代？傳三星顯示獲蘋果批准量產、首批供貨300萬片,三星顯示 (Samsung Display) 傳出已獲蘋果批准生產可摺疊顯示模組，顯示外界傳聞多年的 iPhone Fold 計畫正逐步邁向量產。,https://m.cnyes.com/news/id/6507872
688,6507977,美國戰略原油庫存 創43年新低,美國能源情報署（EIA）周一（22 日）發布的數據顯示，美國原油庫存進一步刷新 1983 年以來新低，位於俄克拉何馬州庫欣地區的原油存儲數據，也逼近營運警戒線。,https://m.cnyes.com/news/id/6507977
689,6507963,10年間 英國6位首相辭職,英國首相施凱爾（Keir Starmer）22 日（周一）發表講話，宣布他將辭去工黨黨首職務。施凱爾是過去 10 年辭職的第 6 位英國首相。以下是過去 10 年英國首相辭職情況：,https://m.cnyes.com/news/id/6507963
690,6507894,川普簽2行政命令 拚2028年前打造商業級量子電腦,美國總統川普周一 (22 日) 簽署兩項聚焦量子運算的行政命令，目標是在其任期結束前推動具備「商業實用價值」的量子電腦發展，並加速政府因應量子運算所帶來網路攻擊風險的準備工作。,https://m.cnyes.com/news/id/6507894
691,6507870,Jefferies估：記憶體價格每季漲幅高達50% 供需失衡至2028年,Jefferies 最新全球科技產業報告指出，在雲端巨頭提前鎖定產能、AI 伺服器需求持續擴張，以及主要供應商無意大幅擴產的情況下，全球記憶體價格漲勢可能遠超市場預期,https://m.cnyes.com/news/id/6507870
692,6507760,美股重點新聞摘要2026年6月23日,美股重點新聞摘要 2026 年 6 月 23 日,https://m.cnyes.com/news/id/6507760
693,6507918,Fed古爾斯比示警服務通膨頑強 關注物價漲幅是否停留在3-4%,,https://m.cnyes.com/news/id/6507918
694,6507938,數十年最重大讓步！美國首次允許伊朗賣油以美元結算 為期60天,,https://m.cnyes.com/news/id/6507938
695,6507937,手握千億美元現金！SpaceX首發公司債  支撐AI與星艦野心,,https://m.cnyes.com/news/id/6507937
696,6507889,美超微升超15%創一年來最佳 與輝達合作帶來利多,伺服器製造商美超微電腦 (Super Micro Computer)(SMCI-US) 股價周一 (22 日) 大漲 15.7%，因投資人對該公司與 AI 巨頭輝達 (Nvidia)(NVDA-US) 的合作關係有了更進一步了解。,https://m.cnyes.com/news/id/6507889
697,6507919,甲骨文年報首揭AI裁員效應！12個月內大砍2.1萬人 裁員規模高達13%,,https://m.cnyes.com/news/id/6507919
698,6507871,蘋果供應鏈再添佐證 iPhone Fold有望9月亮相,蘋果首款摺疊手機 iPhone Fold 上市時程傳聞反覆，但最新供應鏈消息顯示，產品可能已進入小量出貨階段，有望與 iPhone 18 Pro 一同於今年 9 月亮相。,https://m.cnyes.com/news/id/6507871
699,6507933,伊朗曝與美談判後續磋商機制：設4個工作小組、美簽發伊朗石油許可、啟動120億美元資產解凍,,https://m.cnyes.com/news/id/6507933
700,6507917,〈貴金屬盤後〉美伊和平協議壓低油價 金價從一周低點反彈,,https://m.cnyes.com/news/id/6507917
701,6507910,劍指輝達！傳高通以40億美元洽購AI新創Modular,,https://m.cnyes.com/news/id/6507910
702,6507873,美光獲Anthropic記憶體長約訂單 股價飆近7%登史上新高,美光科技 (MU-US) 與人工智慧新創 Anthropic 達成策略合作，合作範圍涵蓋技術研發、長期供應、企業 AI 應用與資本投資。,https://m.cnyes.com/news/id/6507873
703,6507895,SpaceX暴跌16% IPO後漲幅幾乎全回吐,SpaceX(SPCX-US)股價周一 (22 日) 再度大跌，連續第三個交易日收黑。這家本月稍早才上市的公司，在 IPO 後曾出現驚人漲勢，如今快速回落。此外，SpaceX 也在一份文件中證實將進行首次債券發行。,https://m.cnyes.com/news/id/6507895
704,6507905,SpaceX槓桿ETF登場！2倍做多SPCH、2倍做空SSPC同步上市,SpaceX(SPCX-US) 兩倍槓桿基金：SPCH（看多）和 SSPC（看空）為活躍交易者提供了高性價比的兩倍每日看多及看空槓桿敞口，以參與具有歷史意義的 IPO。,https://m.cnyes.com/news/id/6507905
705,6506512,川普：荷姆兹海峽已完全通航,,https://m.cnyes.com/news/id/6506512
706,6507876,郭明錤駁傳聞 Google尚未敲定採購長鑫存儲記憶體,郭明錤週一稍晚發文指出：「與市場近期的傳言不同，我最新的產業調查指出，Google 目前並沒有任何明確向長鑫存儲採購記憶體晶片的計畫。」,https://m.cnyes.com/news/id/6507876
707,6507759,〈紐約匯市〉美元升至逾一年高點 升息預期升溫,美元周一 (22 日) 升至逾一年來高點，市場對美國聯準會 (Fed) 採取更強硬立場的預期升溫，抵消了中東局勢改善及油價下跌所帶來影響。,https://m.cnyes.com/news/id/6507759
708,6507844,〈能源盤後〉盤中震盪後 美伊談判釋出緩和訊號 Brent油價挫逾3%摜破78美元,美伊在瑞士重啟談判並延長停火安排，市場對中東原油供應中斷的憂慮明顯降溫。隨著荷姆茲海峽恢復通行、伊朗石油出口重啟，以及美國放寬伊朗原油銷售限制，國際油價周一自盤中高點大幅回落，終場跌逾 3%。,https://m.cnyes.com/news/id/6507844
709,6507853,諾貝爾AI大將跳槽+模型商品化疑慮 Alphabet挫逾5% 創一年最大跌幅,Alphabet 周一挫逾 5%，創一年多來最大單日跌幅。兩名 DeepMind 與 Gemini 核心人員出走，且市場質疑 AI 模型是否走向商品化，以及 Gmail、YouTube 傳出服務異常，引發市場擔憂其龐大 AI 投資的回報能力。,https://m.cnyes.com/news/id/6507853
710,6507869,〈美股盤後〉美解除伊朗石油制裁60天 那指標普收黑 SpaceX遭血洗 美光飆近7%,市場持續關注美伊和平談判進展，美股週一 (22 日) 漲跌互見，標普 500 指數與那斯達克指數雙雙收黑，道瓊工業指數則在開拓重工 (CAT-US) 領軍下逆勢收高。,https://m.cnyes.com/news/id/6507869
711,6507823,〈台股盤前要聞〉台積電市值衝上65兆元、DRAM缺貨漲價潮延燒到DDR2,台股盤前要聞,https://m.cnyes.com/news/id/6507823
712,6507839,【袁志峰專欄】恒指技術超賣，反彈可期,"今日推介 - 京東健康 (6618, $33.88), 目標價 $37.5, 止損價 $32.5",https://m.cnyes.com/news/id/6507839
713,6507848,華許效應來了？Citadel看好長債 大摩警告短債波動升溫,隨著聯準會 (Fed) 主席華許 (Kevin Warsh) 上任後首度主持利率決策會議，市場正重新評估美國公債走勢。Citadel Securities 認為，華許展現出強烈的抗通膨立場與政策執行決心，有助提升 Fed 公信力，進而,https://m.cnyes.com/news/id/6507848
714,6507843,Alphabet盤中重挫領跌 科技股承壓反映AI投資焦慮,美國科技巨頭周一 (22 日) 遭遇賣壓，投資人對 AI 基礎建設支出持續攀升感到憂心，拖累 Alphabet(GOOGL-US)、亞馬遜 (AMZN-US)、微軟(MSFT-US) 及 Meta(META-US)等大型科技股走低。其中，,https://m.cnyes.com/news/id/6507843
715,6507798,不只做晶片！輝達瞄準人形機器人2000億美元商機,AI 晶片龍頭輝達 (Nvidia)(NVDA-US) 正積極推動人形機器人 (humanoid robots) 發展，並將「安全性」視為產業邁向大規模商用的關鍵門檻。輝達周一宣布推出一套專為人形機器人設計的軟硬體方案，希望讓機器,https://m.cnyes.com/news/id/6507798
716,6507821,鉅亨速報 - Factset 最新調查：希捷科技STX-US的目標價調升至983元，幅度約3.31%,FactSet 最新調查：希捷科技STX-US目標價調升，最高估值、最低估值、中位數、綜合評級、近5日股價、標普、即時新聞資訊,https://m.cnyes.com/news/id/6507821
717,6507737,Lucid再裁員18%並取消營運長職位 全力推動成本重整,電動車製造商 Lucid Group(LCID-US) 周一 (22 日) 宣布，將裁減約 18% 的美國員工，同時營運長 (COO)Marc Winterhoff 離職，成為公司今年以來第二波大規模裁員行動。面對電動車市場競爭加劇、需求,https://m.cnyes.com/news/id/6507737
718,6507786,SpaceX盤中股價一度重挫10% 上市蜜月行情降溫,太空探索公司 SpaceX(SPCX-US) 周一股價重挫 10%，延續近期回檔走勢，若跌勢持續，將連續第三個交易日收黑。這家由馬斯克創立的太空與人工智慧公司，雖然上市初期掀起市場熱潮，但在股價快速飆升後，投資人開始獲利了結，,https://m.cnyes.com/news/id/6507786
719,6507757,馬雲帶隊！阿里巴巴、螞蟻核心高層下田插秧,阿里巴巴合夥人、高德董事長劉振飛在阿里內網發文《手裡有秧，才能確保未來有糧》，記錄了近日阿里管理層在杭州一次下田插秧的團建活動。,https://m.cnyes.com/news/id/6507757
720,6507784,美伊和談露曙光、美放寬伊朗石油限制 國際油價走低,國際油價周一 (22 日) 走低，主因美國與伊朗和談傳出進展，加上華府宣布對部分伊朗石油出口提供 60 天豁免授權，市場預期波斯灣原油供應將逐步恢復，緩解先前因中東戰事引發的供應疑慮。,https://m.cnyes.com/news/id/6507784
721,6507676,半導體爆史上最擁擠交易！56%美銀美林經理人挺AI非泡沫 正值「繁榮期」,六月份美銀美林經理人調查報告顯示，受訪的全球經理人雖維持強勢看多立場，但因夏季來臨傾向先行獲利了結，導致整體樂觀程度較五月略為降溫，現金水位也回升至 4.1%。值得關注的是，儘管「AI 泡沫」高居尾端風險第二名，但有 56% 的,https://m.cnyes.com/news/id/6507676
722,6507653,台日半導體股齊發威 這幾檔主題型ETF狂飆再創掛牌新高,受美伊停戰利多激勵，今 (22) 日亞股勁揚，台股漲逾千點直逼 48000 大關；日經 225 指數突破 72000 點大關，半導體族群仍是領頭羊，台、日掛牌的半導體主題 ETF 也同步走強。,https://m.cnyes.com/news/id/6507653
723,6507770,鉅亨速報 - Factset 最新調查：美光科技MU-US的目標價調升至1162.5元，幅度約3.33%,FactSet 最新調查：美光科技MU-US目標價調升，最高估值、最低估值、中位數、綜合評級、近5日股價、標普、即時新聞資訊,https://m.cnyes.com/news/id/6507770
724,6507769,鉅亨速報 - Factset 最新調查：艾司摩爾ASML-US的目標價調升至1950元，幅度約11.43%,FactSet 最新調查：艾司摩爾ASML-US目標價調升，最高估值、最低估值、中位數、綜合評級、近5日股價、標普、即時新聞資訊,https://m.cnyes.com/news/id/6507769
725,6507720,施凱爾辭職！英國再迎首相爭奪戰,英國首相施凱爾（Keir Starmer）周一（22 日）在唐寧街 10 號首相府前宣布，他將辭去英國工黨黨魁和英國首相職務，並啟動接班程序。,https://m.cnyes.com/news/id/6507720
726,6507755,美伊會談取得突破！伊朗原油出口獲准延續至8月底,美國財政部周一 (23 日) 宣布，在美伊雙方於瑞士舉行會談並取得進展後，將允許伊朗在未來 60 天內持續進行原油生產、交付與銷售，作為雙方外交協商框架的一部分。,https://m.cnyes.com/news/id/6507755
727,6507621,〈美股早盤〉市場聚焦美伊談判與PCE數據 主要指數小幅走高,美股周一 (23 日) 開盤表現平淡，主要指數在歷史高點附近震盪整理。隨著美國與伊朗核談判傳出進展，市場對中東局勢升溫的擔憂有所緩解，帶動國際油價下跌。不過投資人仍保持觀望態度，一方面消化長周末假期後的市場變化，另一方面靜待本,https://m.cnyes.com/news/id/6507621
728,6507685,微軟AI資料中心找上雪佛龍 簽20年供氣協議,石油巨擘雪佛龍 (CVX-US) 周一 (22 日) 宣布，已與微軟 (MSFT-US) 簽署為期 20 年的合作協議，將透過天然氣為位於美國德州西部的大型資料中心「Project Kilby」提供電力，凸顯人工智慧 (AI) 浪潮正推升科技,https://m.cnyes.com/news/id/6507685
729,6507622,Getty Images攜手OpenAI 授權合作激勵股價盤前飆逾120%,圖片授權平台 Getty Images(GETY-US) 周一盤前股價暴漲逾 120%，主因公司宣布與 OpenAI 達成授權合作協議，未來 Getty 龐大的圖庫內容將整合至 ChatGPT 搜尋與探索功能中，成為 OpenAI 擴展內容生,https://m.cnyes.com/news/id/6507622
730,6507698,鉅亨速報 - Factset 最新調查：SpaceX(SPCX-US)EPS預估下修至-0.89元，預估目標價為238.50元,FactSet 最新調查：SpaceX(SPCX-US)EPS預估下修，預估EPS、預估營收、目標價、歷史獲利表現、即時新聞資訊,https://m.cnyes.com/news/id/6507698
731,6507693,鉅亨速報 - Factset 最新調查：高通QCOM-US的目標價調升至187.5元，幅度約3.02%,FactSet 最新調查：高通QCOM-US目標價調升，最高估值、最低估值、中位數、綜合評級、近5日股價、標普、即時新聞資訊,https://m.cnyes.com/news/id/6507693
732,6507169,中國又對美國稀土出手！「這兩家」稀土生產商遭列入出口管制名單,中國宣布將 MP 材料與 USA Rare Earth 列入出口管制清單，禁止取得中國原產軍民兩用物項。此舉被視為回應美國制裁中國企業，也凸顯全球稀土供應鏈與 G7 去中國化戰略競爭持續升溫。,https://m.cnyes.com/news/id/6507169
733,6507674,前腳互嗆後腳談判！范斯：美伊已取得重大進展,美國副總統范斯 (JD Vance) 周一 (22 日) 表示，儘管談判過程中一度出現相互施壓與緊張言論，但美國與伊朗在瑞士布爾根施托克 (Bürgenstock) 舉行的會談已取得「重大進展」，雙方並持續推進有關伊朗核問題及區域安全,https://m.cnyes.com/news/id/6507674
734,6507646,郭明鑑辭任國泰投信董事 國泰金：受影響基金投資人啟動從優補償,國泰金控 (2882-TW) 今 (22) 日晚間代子公司國泰投信公告董事異動，原國泰投信董事郭明鑑辭任董事職務。國泰金表示，為維護基金受益人權益，公司已依最高標準建立公司治理機制,https://m.cnyes.com/news/id/6507646
735,6507648,原料走低下游縮手 豐興鋼筋盤價每公噸轉跌300元,原料走低下游縮手 豐興鋼筋盤價再度轉跌,https://m.cnyes.com/news/id/6507648
736,6507620,瞄準AIDC大需求 大同策略性砸1.2億元投資廣運旗下金運科技,廣運 (6125-TW) 集團旗下盛新材料 (6930-TW) 及金運科技營運轉強，且都預計辦理現增籌資案在市場籌資，同時，盛新材料與金運科技都預計在 10 月登錄興櫃叩關資本市朝申請上市邁進。,https://m.cnyes.com/news/id/6507620
737,6507617,麗清機器人關節控制模組產品Q3小量生產 汽車本業訂單能見度達2029年,麗清墨西哥新廠 Q3 量產 訂單能見度達 2029 年,https://m.cnyes.com/news/id/6507617
738,6507623,「Fed傳奇掌門人」葛林斯潘辭世 享嵩壽100歲,曾帶領美國聯準會 (Fed) 長達近 19 年的前主席葛林斯潘 (Alan Greenspan) 於當地時間周一 (22 日) 辭世，享嵩壽 100 歲。其妻、《NBC》新聞首席華府與外交事務記者米契爾 (Andrea Mitchell) 表示，,https://m.cnyes.com/news/id/6507623
739,6507534,滙豐Q3投資展望：AI浪潮引領全球 成長型科技股仍是主旋律,滙豐銀行今 (22) 日發布 2026 年第三季投資展望，報告指出，人工智慧 (AI)、能源與國家安全已成為推動全球經濟與企業盈利增長的三大核心引擎。,https://m.cnyes.com/news/id/6507534
740,6507582,〈台幣〉股匯兩樣情！連3貶收31.631元 探近半月新低,端午連假過後，台北股匯市今 (22) 日開盤走勢不同調，在 AI 熱潮延續、科技股群起攻之下，加權指數大漲逾千點站上 47000 點，不過，由於聯準會上周 FOMC 會議釋出偏鷹訊號，帶動資金回流美元，,https://m.cnyes.com/news/id/6507582
741,6507535,華新科衝新高價 5月自結純益年增近2倍 EPS 0.88元,華新科股價寫新天價 5 月自結純益年增近 2 倍 EPS0.88 元,https://m.cnyes.com/news/id/6507535
742,6507536,光麗收購嘉蒂保100%股權10家藥局納入版圖 擴大健康服務,光麗 - KY(6431-TW) 今 (22) 日宣布，旗下子公司宸曜醫務管理顧問已完成收購嘉蒂保醫藥 100% 股權，交易完成後，嘉蒂保醫藥旗下 10 家藥局門市將以「達昌宸曜」作為藥局品牌名稱，正式納入光麗醫療健康服務版圖。 ,https://m.cnyes.com/news/id/6507536
743,6507488,宏碁宣布處分無形資產與儲能股份 合計利益約5億元,宏碁 (2353-TW) 今 (22) 日正式決議通過兩大資產處分案，同步處分旗下儲能案場股份以及通訊相關專利一批。宏碁表示，本次大動作雙管齊下，主要是為了活化公司資產並優化有價證券之長期投資組合。兩項處分案合計將為宏碁帶進近新,https://m.cnyes.com/news/id/6507488
744,6507481,溢泰自明起實施上市來首度庫藏股 買回上限3000張護盤,溢泰 (7818-TW) 在上市掛牌歷經 26 個交易日後，今 (22) 日董事會通過首度買回庫藏股護盤，溢泰將在每股 96.69 元以下在兩個月內買回 3000 張庫藏股，將用於維護公司信用及股東權益。,https://m.cnyes.com/news/id/6507481
745,6507479,大聯大攜手東芝 搶AI伺服器HVDC電源商機,隨著 AI 運算需求快速攀升，全球通路大廠大聯大 (3702-TW) 旗下詮鼎集團攜手東芝 (Toshiba) 舉辦線上研討會，公司表示，東芝最新的矽基半導體與 SiC 元件產品，為 AI 伺服器、資料中心及工業電源提供高功率密度與高效率設,https://m.cnyes.com/news/id/6507479
746,6507433,國喬估石化市場面臨關鍵挑戰 三大面向擴廠布局低碳氫獲利可期,國喬估 2029 年可望成為市場復甦的轉折點。國喬近期推廣低碳高純氫產品，主要基於三大面向考量，也預計目前許多半導體及封裝電子業上皆應用到許多氫氣使用，國喬近期透過現增擴產，除了未來市場值得期待，獲利也符合投資的規劃。,https://m.cnyes.com/news/id/6507433
747,6507432,京鼎訂單滿手兩地同步擴產 營收增逾2成創新高,隨著 AI 帶動邏輯晶片與記憶體需求爆發，設備廠京鼎 (3413-TW) 也受惠半導體設備需求暢旺，訂單已看到明年上半年，為因應客戶訂單，京鼎在台灣、泰國同步啟動擴產，法人估，京鼎今年營收將增長超過 2 成，創下歷史新高。,https://m.cnyes.com/news/id/6507432
748,6507474,森崴能源明日下市 董事長郭台強向股東致歉 離岸風電二期目標今年完工,森崴能源旗下子公司富崴能源承攬台電離岸風電二期，導致虧損持續擴大，股票將於明日下市，對此，董事長郭台強於今日股東會中向股東致歉。總經理林坤煌也於會後表示，目前優先完成離岸風電二期，希望能在今年完工。 ,https://m.cnyes.com/news/id/6507474
749,6507386,〈消費趨勢〉統一超APP免費星座運勢上線 提升每日會員活躍度,超商拚提升會員活躍度 統一超 APP 免費星座運勢上線,https://m.cnyes.com/news/id/6507386
750,6507401,群益00997A首次配息出爐估年化逾10% 7/3最後買進日,根據群益投信官網最新配息公告顯示，主動群益美國增長 ETF (00997A) 公告上市以來首次配息，本次預估每股配發金額為 0.37 元，若以 6 月 22 日收盤價 14.74 元來推算，,https://m.cnyes.com/news/id/6507401
