,newsId,title,summary,link
669,6260802,〈台新投資論壇〉二大AI巨頭硬體「決戰紫禁之巔」就在2026 台灣供應鏈再噴高峰,台新銀行舉辦 2026 投資展望論壇，針對台灣經濟成長狀況，台新新光金控 (2887-TW) 首席經濟學家李鎮宇指出，今年 10 月就率先上修全年 GDP 成長率破七，預期明年仍有近 4% 水準,https://m.cnyes.com/news/id/6260802
670,6260805,美銀展望：2026年亞太股市表現回歸「平均」 看多日、中、韓、印尼,根據美銀全球最新報告，2026 年亞太股市將從強勢表現回歸平均水平，儘管估值處於歷史高位，但盈利增長仍將成為市場的核心驅動力。分析指出，科技硬件和電商等板塊將領漲，而美聯準會政策的不確定性則可能成為主要風險。,https://m.cnyes.com/news/id/6260805
671,6260796,工廠被關稅拖慢！美9月製造業訂單增速放緩 AI設備需求成少數支撐,綜合外媒報導，美國 9 月工廠訂單增幅不及市場預期，顯示製造業在關稅影響下仍面臨限制。不過耐久財與核心資本財訂單持續成長，企業設備投資需求仍顯韌性，部分受到人工智慧 (AI) 相關支出的支撐。,https://m.cnyes.com/news/id/6260796
672,6260798,〈台新投資論壇〉李鎮宇估美國再激進降息6碼以上 2026進入「三低經濟」,「2026 台新投資展望論壇」4 日登場，台新新光金控 (2887-TW) 首席經濟學家李鎮宇發表演講，一開場便犀利回顧 2025 年經濟學家普遍的預測失準現象，就是犯了二大錯誤：誤判川普與低估 AI，若不矯正思維,https://m.cnyes.com/news/id/6260798
673,6260782,正德歸納散裝航運三大利多 市況呈「量少價漲」強勢格局,正德歸納散裝航運三大利多 市況呈「量少價漲」強勢格局,https://m.cnyes.com/news/id/6260782
674,6260770,最糟情況來了？四大因素恐讓美國明年陷停滯性通膨,據《商業內幕》周四 (4 日) 報導，加拿大皇家銀行 (RY-US) 警告，美國經濟明年恐面臨「輕度停滯性通膨」，經濟成長放緩但通膨卻居高不下的處境。,https://m.cnyes.com/news/id/6260770
675,6260790,就業數據「互相打臉」！美債殖利率走高 市場一面倒押降息,根據《彭博》周四 (4 日) 報導，美國上周初領失業金人數降至 2022 年以來最低，顯示企業仍在保留人力。然而這與民間機構 ADP 日前發布的裁員數據呈現矛盾，對勞動市場發出不同訊號。儘管數據互有分歧，市場對聯準會 (Fed) 下周再度,https://m.cnyes.com/news/id/6260790
676,6260789,沙國調降明年1月亞洲原油溢價至2021年來最低,據《彭博》周四 (4 日) 報導，沙烏地阿拉伯將銷往亞洲的主力原油價格調降至五年來最低，反映全球石油市場持續供應過剩。,https://m.cnyes.com/news/id/6260789
677,6260735,〈美股早盤〉科技反彈、Fed降息預期升溫！主要指數小幅開高,美股主要指數周四 (4 日) 小幅開高，投資人持續消化最新勞動市場數據，評估聯準會 (Fed) 下周會議降息的可能性。科技大型股反彈推動大盤逼近歷史高點，市場押注寬鬆政策將延續對企業獲利的支撐。與此同時，美債走弱、美元震盪，反映市,https://m.cnyes.com/news/id/6260735
678,6260785,彭博：已燒掉700億美元！Meta擬大砍元宇宙資源轉攻AI,據《彭博》周四 (4 日) 報導，Meta 執行長祖克柏預計大砍元宇宙資源，這項曾被視為公司未來並促成改名的計畫，明年預算可能削減最多 30%，並可能在 1 月裁員。該部門自 2021 年來已虧損逾 700 億美元。,https://m.cnyes.com/news/id/6260785
679,6260786,鉅亨速報 - Factset 最新調查：賽富時(CRM-US)EPS預估上修至11.75元，預估目標價為327.50元,FactSet 最新調查：賽富時(CRM-US)EPS預估上修，預估EPS、預估營收、目標價、歷史獲利表現、即時新聞資訊,https://m.cnyes.com/news/id/6260786
680,6260773,美國就業市場冷卻！官方數據還沒來 民間統計已看到「暗潮」,綜合外媒周四 (4 日) 報導，雖然美國企業 11 月裁員計畫較 10 月高峰回落，但仍創三年來同月新高，同時就業市場替代數據顯示企業持續減少人力。市場認為，這些訊號將成為聯準會 (Fed) 下周利率決策的重要參考，可能增加降息的政治與市,https://m.cnyes.com/news/id/6260773
681,6260778,美上周初領失業金人數創逾三年新低 裁員有限但招聘同樣疲軟,根據美國勞工部 (DOL) 周四 (4 日) 公布數據，上周初領失業金人數大降 2.7 萬人至 19.1 萬人，創下 2022 年 9 月以來新低，也遠低於路透調查經濟學家預估中位數 22 萬人。,https://m.cnyes.com/news/id/6260778
682,6260716,川普「親信」將掌舵聯準會引市場關注：政策寬鬆預期升溫、獨立性擔憂浮現,美國總統川普已表示，他已將下一任聯準會主席的候選人範圍縮小到一人。幾乎所有跡象都指向他長期的經濟顧問、現任國家經濟委員會主任哈塞特 (Kevin Hassett)。儘管總統表示要到明年年初才會正式宣布人選，但當記者問及是否,https://m.cnyes.com/news/id/6260716
683,6260776,川普一刀改市場！油耗規定放寬 歐洲車廠股價大漲,根據《路透》周四 (4 日) 報導，美國總統川普宣布推翻前任拜登政府制定的新車燃油效率標準後，歐洲車廠股價大幅走揚，市場普遍預期放寬規範將有利汽車業銷售更多燃油車，並降低企業在電動車轉型上的壓力。,https://m.cnyes.com/news/id/6260776
684,6260771,貝萊德：AI明年續熱 但市場將顛簸、恐再現上月急跌,據《路透》周四 (4 日) 報導，全球最大資產管理公司貝萊德認為，AI 在 2026 年仍將是市場主流，但投機交易和槓桿操作增加，投資人恐將面臨 11 月的急跌風險。,https://m.cnyes.com/news/id/6260771
685,6260671,阿特曼太空運算野心曝光：曾探索收購SpaceX勁敵 與馬斯克展開「全面競爭」,OpenAI 共同創辦人兼執行長阿特曼 (Sam Altman) 據報曾探索一項旨在收購或與火箭公司合作的交易，此舉將使他與馬斯克 (Elon Musk) 的商業太空飛行公司 SpaceX，形成直接競爭態勢。,https://m.cnyes.com/news/id/6260671
686,6260756,北美貿易恐再洗牌？川普考慮退出USMCA 或改與加墨分別談判,美國《Politico》引述美國貿易代表辦公室 (USTR) 官員表示，美國總統川普可能在明年決定退出美墨加協定(USMCA)，或將協議拆分，改與加拿大及墨西哥分別談判。,https://m.cnyes.com/news/id/6260756
687,6260768,台灣金融業唯一登上FT全球銀行高峰會 高麗雪揭密中信金致勝關鍵,中信金控 (2891-TW) 再度登上國際舞台，聚集全球金融業領袖、監理機關主管的「Global Banking Summit 2025」(全球銀行高峰會)12 月 2 日至 4 日在倫敦登場，中信金總經理高麗雪受邀於今 (4) 日參與,https://m.cnyes.com/news/id/6260768
688,6260753,光通訊廠強強聯手 光聖與IET-KY換股結盟 布局AI與矽光子新戰略,光通訊股光聖 (6442-TW) 與三五族通訊廠 IET-KY(4971-TW) 英特磊今 (4) 日分別召開董事會，也分別在晚間 8 時於證交所、櫃買舉行重訊記者會，決議雙方通過以股份交換方式，深化雙方策略合作，共同布局 AI 與矽光子。,https://m.cnyes.com/news/id/6260753
689,6260750,人民幣衝14個月高點 卻被中國國有銀行「踩煞車」！,《路透》周四 (4 日) 援引知情人士消息報導，中國多家國有大型銀行本周在在岸市場大量買入美元，並未進行常見的換匯再交易操作，而是直接持有美元，顯示官方正以更強力的方式放緩人民幣升值速度。,https://m.cnyes.com/news/id/6260750
690,6260748,金管會鬆綁！ETF連結基金不再侷限台股 海外、主動式也可發,金管會自 2018 年起開放投信公司可募集發行「ETF 連結基金」，目前市場上共有 7 檔，合計規模新台幣 429 億元，皆由元大投信發行。,https://m.cnyes.com/news/id/6260748
691,6260723,大佬Gave警告：明年美債恐先崩、亞幣走強將終結黃金牛市、AI市場風向已轉,知名投資人、Gavekal 集團首席執行官 Louis-Vincent Gave 於 12 月 4 日接受採訪時做出驚人預測，為全球金融市場的未來走向描繪出警示性藍圖。Gave 指出，無論美國聯準會是否在 12 月降息，或在 2026 年進行更,https://m.cnyes.com/news/id/6260723
692,6260755,驊陞預計12/22上市 競拍底價32元,驊陞競拍底價 32 元 預計 12/22 上市,https://m.cnyes.com/news/id/6260755
693,6260751,外資買超103億元連三買 狂掃6檔金控股合計敲進15.8萬張,台股今 (4) 日量能急凍，終場翻紅小漲 2 點，收在 27795 點，外資再度加碼，呈現連三買，尤其看好金控股，今日買超前 10 名中就有 6 檔金控股，光 6 檔合計就高達 15.8 萬張，也青睞華邦電、聯電與群創等電子族群。,https://m.cnyes.com/news/id/6260751
694,6260763,鉅亨速報 - Factset 最新調查：加拿大皇家銀行(RY-US)EPS預估上修至11.08元，預估目標價為163.11元,FactSet 最新調查：加拿大皇家銀行(RY-US)EPS預估上修，預估EPS、預估營收、目標價、歷史獲利表現、即時新聞資訊,https://m.cnyes.com/news/id/6260763
695,6260747,友達醫療事業明年營收估續增雙位數 跨域整合3D、AI技術,友達醫療事業明年營收估續增雙位數 跨域整合 3D、AI 技術,https://m.cnyes.com/news/id/6260747
696,6260736,WhatsApp AI惹禍？Meta遭歐盟盯上 正式展開反壟斷調查,綜合外媒報導，歐盟執委會周四 (4 日) 宣布對社群龍頭 Meta Platforms(META-US)展開正式的反壟斷調查，聚焦其在 WhatsApp 中導入人工智慧 (AI) 工具與政策變動是否阻礙競爭。此案反映歐盟持續加強對美國科,https://m.cnyes.com/news/id/6260736
697,6260743,〈台幣〉連2升收31.338元 美降息預期升溫美元指數跌破99,美國就業數據遜於預期，帶動降息預期升溫，美元指數應聲跌破 99 關卡，新台幣兌美元匯率今 (4) 日一度升上 31.2 字頭，但尾盤升幅幾乎回吐，終場收在 31.338 元,https://m.cnyes.com/news/id/6260743
698,6260746,半導體大擴產！投資台灣3家共302億元 晶兆成砸245億 昇陽投資56億,投資台灣事務所今 (4) 日通過 3 家企業擴大投資台灣，包含台商回台方案的晶兆成科技、根留企業方案的昇陽國際半導體 (8028-TW)，以及中小企業方案的久德電子科技。三家企業合計投資金額超過 302 億元，其中兩家為半導體業,https://m.cnyes.com/news/id/6260746
699,6260745,能率亞洲明起上櫃前競拍投標 底價每股15元 擬12/22掛牌,"能率亞洲 (7777-TW) 首次上櫃案將於明 (5) 日至 9 日展開上櫃前競拍投標作業，並採「美國標」方式 進行，競拍張數共 10,200 張，最低投標價格為 15 元。本案將於 12 月 11 日開標。",https://m.cnyes.com/news/id/6260745
700,6260724,日本首相高市早苗涉嫌超限收受獻金 遭教授控告違規,日本政壇再爆出政治獻金爭議。據日本《共同社》報導，日本首相高市早苗因涉嫌違規收受企業政治捐款，已於 4 日遭神戶學院大學教授上脇博之向檢察機關提告。,https://m.cnyes.com/news/id/6260724
701,6260742,八貫11月營收年月雙增 訂單能見度已至明年4月、停辦尾牙持續趕工,八貫 (1342-TW) 今 (4) 日公告 11 月營收為 2.2 億元、月增 17.43%、年增 4.91％，累計今年前 11 月營收為 25.06 億元、年增 12.26％。受惠於戶外、醫療與軍工產品線客戶需求，公司在手訂單能見度已到明年 4 月。,https://m.cnyes.com/news/id/6260742
702,6260669,Anthropic啟動IPO 公司CEO：堅持企業級AI路線 不與OpenAI正面肉搏,人工智慧初創公司 Anthropic 傳近日啟動首次公開募股 (IPO) 的籌備工作，該公司已聘請 Wilson Sonsini 律師事務所，計畫最早在 2026 年上市。,https://m.cnyes.com/news/id/6260669
703,6260737,不能靠輝達！寒武紀目標擴產三倍搶市 中國AI晶片拚自立,《彭博》周四 (4 日) 援引知情人士消息報導，中國人工智慧 (AI) 晶片設計商寒武紀科技 (Cambricon Technologies Corp.)(688256-CN) 正大幅擴產，目標在 2026 年把產量提高,https://m.cnyes.com/news/id/6260737
704,6260741,元山今年營收有望創高 明年拚高階運算營收比重至45%,元山總經理劉賢文指出，今年前 10 月營收 35.6 億元，年增 9.37%，法人預估，今年營收有望突破 40 億大關。劉賢文指出，明年將持續擴大高階運算布局，目標明年高階運算營收比重提升至 45%，明年營收有望雙位數成長。 ,https://m.cnyes.com/news/id/6260741
705,6260720,台積電 鴻海下週變盤? 華邦電 新興買點? 【國碩 第2】目標翻倍,,https://m.cnyes.com/news/id/6260720
706,6260672,BDI創高!!!,,https://m.cnyes.com/news/id/6260672
707,6260732,LINE Pay Money電支上線首日太踴躍 逾56萬名會員完成帳戶開通,LINE Pay(7722-TW) 今 (4) 日表示，子公司連加電支全新服務「LINE Pay Money」已於昨 (3) 日正式開通上線，截至今天下午 14 時即已突破 56 萬名會員完成帳戶開通，顯見忠誠用戶高度響應新電,https://m.cnyes.com/news/id/6260732
708,6248936,台期里程碑！台灣波動率(VIX)指數正式納入芝交所Cboe 同步即時傳送全球,"期交所今（4）日表示，以台指選擇權編製的 TAIWAN VIX，正式上線 Cboe 全球指數資訊傳輸服務 (Cboe Global Indices Feed, CGI)，將與 Cboe VIX 指數同步即時傳送至全球市場",https://m.cnyes.com/news/id/6248936
709,6260712,半導體關稅開獎在即 謝金河：台美應有高度默契 台企投資美國已是必然趨勢,財訊傳媒董事長謝金河今 (4) 日出席 2026 台新投資展望論壇，會前受訪時談及半導體關稅開獎在即，他認為台美應有「很高的默契」，,https://m.cnyes.com/news/id/6260712
710,6260670,從三菱、養樂多到佳能 「日本製造」在中國大撤退,據陸媒《證券時報》報導，日本佳能中山工廠近日宣布停止生產經營，這家已在中國深耕二十餘年的重要電射印表機生產基地正式落幕。,https://m.cnyes.com/news/id/6260670
711,6260730,搶攻擴大在美自有品牌市場銷售 愛地雅在美新設公司元月營運,自行車組裝廠愛地雅 (8933-TW) 在產業的庫存趨於健康之際，公司除見到市場訂單的回溫之外，也正在積極在自有品牌產品的行銷進行努力，愛地雅在美國成立新公司，將在 2026 年 1 月起進入營運，管理在美國自有品牌銷售。,https://m.cnyes.com/news/id/6260730
712,6260728,聯電宣布攜手Polar 評估美國本土八吋晶圓製造的合作機會,"聯電 (2303-TW)(UMC-US) 今 (4) 日宣布與專攻高壓、功率及感測半導體的美國晶圓代工廠 Polar Semiconductor, LLC (Polar)簽署合作備忘錄(MOU)，雙方將展開洽談，共同探索在美國本",https://m.cnyes.com/news/id/6260728
713,6260719,晶豪科：記憶體市況如「洗三溫暖」 明年上半年樂觀看,晶豪科 (3006-TW) 今 (4) 日舉辦法說會表示，公司表示，記憶體市場自今年第二季的極度悲觀，短時間便急轉為嚴重缺貨，形容「市場像洗三溫暖」，受惠第三季起 DRAM 現貨大漲、需求急速升溫，預期第四季單季可望轉盈，2026 年,https://m.cnyes.com/news/id/6260719
714,6260727,美元走軟且日銀升息預期升溫 日元升破155關卡,受美元走軟和美國公債殖利率下降的影響，美元兌日元匯率在周四 (4 日) 亞洲下午時段跌破 155.00 關口。,https://m.cnyes.com/news/id/6260727
715,6260725,台股補漲亂竄之際，趨勢股展現關鍵強度：中砂、昇陽半導體、世芯-KY,,https://m.cnyes.com/news/id/6260725
716,6260722,【量大強漲股整理】12月份選股的三大關鍵為何?未來主流股已呼之欲出?,,https://m.cnyes.com/news/id/6260722
717,6260717,韓媒：三星奪下輝達 2026年SOCAMM 2晶片大單 供應量占比過半,據韓媒《經濟日報》報導，業界內部人士透露，三星電子已成功從輝達 (NVDA-US) 獲得 2026 年第二代 SOCAMM 晶片的重大訂單。輝達計畫向全球 DRAM 產業採購總計約 2000 億 GB 的 SOCAMM 2 晶片。,https://m.cnyes.com/news/id/6260717
718,6260718,工商協進會攜手工研院簽MOU 合力打造產業升級、加速生醫創新,工商協進會與工研院於今 (4) 日於南港展覽館簽訂 MOU，工商協進會理事長吳東亮表示，目前台灣生醫產業是台灣非常重要的下一代產業，雙方策略合作，是推動台灣產業轉型升級與生醫創新加速的重要里程碑。,https://m.cnyes.com/news/id/6260718
719,6260721,〈醫療科技展〉緯創醫學科技展示兩大核心技術 與多方夥伴展開策略合作,緯創旗下緯創醫學科技參與 2025 台灣醫療科技展，展示兩大核心技術，智慧照護系統 BestShape Night 以及智慧輔具外骨骼 Exia。同時，宣布與多家醫院與企業展開策略合作，打造全齡健康與行動力的新生態。,https://m.cnyes.com/news/id/6260721
720,6260715,多元產品線行銷奏功 鮮活果汁-KY 11月營收年、月雙增,鮮活果汁 - KY(1256-TW) 今 (4) 日公布最新營收資訊，2025 年 11 月營收為 2.4 億元，月增 3.55%，年增 24.45%，雖第四季進入新茶飲行業傳統淡季，鮮活果汁 - KY 多元產品線、強化市場通路布局奏功。,https://m.cnyes.com/news/id/6260715
721,6260709,〈房產〉北市仲介公會：房市明年未脫離盤整 可望譜「價跌量出」走勢,根據最新推估數字顯示，2025 年全台全年建物買賣移轉量僅勉強守住 26 萬棟大關，但仍創下近 9 年來新低紀錄，有不少業者都是在苦撐待變。台北市不動產仲介公會認為，2026 年房市並未脫離盤整格局，但最壞的時刻已經過去。,https://m.cnyes.com/news/id/6260709
722,6260576,Fed恐轉鴿避險買盤湧現！近三月投資級債ETF報酬率最高飆5.4% 排行一表看,美國勞動市場降溫，最新公布的 11 月 ADP 私人就業數據意外收縮，大幅低於市場預期，創下 2023 年 3 月以來最大降幅，引發對經濟前景的擔憂，顯著提升了聯準會（Fed）12 月降息的預期。在避險情緒明顯增溫下，資,https://m.cnyes.com/news/id/6260576
723,6260700,揚秦拚明年總展店數155家 麥味登將突破千店里程碑,揚秦拚明年總展店數 155 家 麥味登將突破千店里程碑,https://m.cnyes.com/news/id/6260700
724,6260689,謝金河：台股明年上3萬點要靠台積電 留意AI賽道誰掉隊,財訊傳媒董事長謝金河今 (4) 日出席 2026 台新投資展望論壇，會前受訪時談及台股展望，他認為，指數高點不用亂猜，這取決於台積電一家，若明年 EPS 達 76 元,https://m.cnyes.com/news/id/6260689
725,6260710,賣舊換新資金效率最大化、新盛力、安國⊕、康霈⊕、接下來誰可望接棒演出？,,https://m.cnyes.com/news/id/6260710
726,6260695,群光影像產品成長推升11月營收月增4% 持續調整產品組合提升獲利,電腦周邊廠群光 (2385-TW) 今 (4) 日表示，儘管面對淡季，不過受惠於影像產品出貨成長帶動，11 月營收為 77.35 億元，月增 4％、年減 10.4％，三大產品線的鍵盤、影像與電源營收均呈現月增，累計前 11 月營收達 877.5,https://m.cnyes.com/news/id/6260695
727,6260693,ETF配息不等於到手現金！會計師提醒：你以為的「被動收入」小心傷荷包,「鉅亨買基金」今日指出，若能提前做好稅務規劃，不僅能保住到手獲利，更能讓資產累積速度明顯提升﹐會計師陳俊廷也建議，利用境內「不配息的累積型基金」打造現金流，有效避開高稅負與二代健保補充保費，比起高股息 ETF 更具稅務優勢。,https://m.cnyes.com/news/id/6260693
728,6260707,美光退出記憶體消費性市場 群聯 南亞科 華邦電 要買要賣？動作一定要快！,,https://m.cnyes.com/news/id/6260707
729,6260691,倚天酷碁受惠歐美購物旺季11月營收月年雙增 跨足抖音、Temu擴大電商市場,倚天酷碁 (2432-TW) 今 (4) 日公布 11 月營收，受惠歐美購物旺季帶動，達 2.9 億元，月成長 15.6％，年增加 29.4％；累計前 11 個月營收 28.6 億元，年增 25.7％；倚天酷碁表示，未來將積極拓展至 TikTok Sh,https://m.cnyes.com/news/id/6260691
730,6260687,是你嗎？在麥當勞花38元、Google Play訂閱50元即中千萬 超商全聯也開出共11位幸運兒,"財政部賦稅署今 (4) 日公布，114 年 9-10 月期統一發票特別獎新台幣 1,000 萬元開出 11 張，中獎號碼為 25834483。特獎獎金 200 萬元中獎號碼為 46587380，共 18 張中 200 萬元特獎，該期發票的領獎期限至 11",https://m.cnyes.com/news/id/6260687
731,6260694,〈醫療科技展〉明基佳世達楊宏培：明年成長動能主要來自透析 力拚成長優於市場平均,明基佳世達集團今 (4) 日參展台灣醫療科技展，醫療事業群總經理楊宏培指出，今年業績可以達標，明年成長動能將來自中國的透析市場，至於其他產品線，則力拚成長幅度高於全球的 6 至 8%。 ,https://m.cnyes.com/news/id/6260694
732,6260690,〈醫療科技展〉鴻海發起HiMEDt再添7位新成員 聰泰、技嘉入列,鴻海發起 HiMEDt 再添 7 位新成員 聰泰、技嘉入列,https://m.cnyes.com/news/id/6260690
733,6260661,華爾街：AI榮景稱不上投機泡沫 但需留意「空中氣穴」風險,華爾街兩大金融巨擘——貝萊德和美國銀行都認為，當前的人工智慧 (AI) 浪潮遠非投機性狂熱，並堅決否定外界將其定性為「泡沫」的說法。他們強調，這一周期是由真實的企業投資、收益和生產力提升所驅動，與定義本世紀初網路泡沫的非理性,https://m.cnyes.com/news/id/6260661
734,6260688,遭美WRO  巨大強調零招聘費全面落實、第二階段退費全數完成,針對美國海關暨邊境保護局（CBP）於 9 月 24 日（美東時間）對巨大 (9921-TW) 集團台灣製造據點發布暫扣令（WRO），暫停輸美相關產品，巨大今日指出，零招聘費全面落實、第二階段退費全數完成。,https://m.cnyes.com/news/id/6260688
735,6260696,存到錢卻不敢買房！試算後秒清醒「根本是在買人生緊箍咒」,,https://m.cnyes.com/news/id/6260696
736,6260685,〈醫療科技展〉華碩結盟富士軟片攻高階影像 醫療顯示器祭「高規平價」戰略搶市,華碩 (2357-TW) 在今年智慧醫療展上，展出與日本影像大廠富士軟片（Fujifilm）合作產品，將華碩的醫療級顯示器整合至富士軟片的 3D 術前模擬系統 ；華碩表示，華碩將發揮過往在影像顯示的經驗，主打「高規平價」策略，瞄,https://m.cnyes.com/news/id/6260685
737,6260684,〈醫療科技展〉華碩推Maestro醫院智慧指揮中樞  xHIS資訊平台落地新北聯醫,華碩 (2357-TW) 於「2025 台灣醫療科技展」展現強烈的醫療軟體佈局企圖心，不同於過往以硬體設備為主的展示，今年重磅聚焦於醫院核心資訊系統「xHIS」的正式落地，以及「Maestro 智慧指揮中樞」的平台化戰略。,https://m.cnyes.com/news/id/6260684
738,6260686,【富蘭克林坦伯頓基金集團2026年展望】 三大主題掌握全球財富新機遇,,https://m.cnyes.com/news/id/6260686
739,6260660,〈港股盤後〉恒指震盪走強收漲0.68% 生技、機器人概念爆發,香港股市周四 (4 日) 整體呈現低開高走、震盪拉升的態勢。早盤指數一度下探，但在午後尾盤再度走強，市場情緒顯著回升。,https://m.cnyes.com/news/id/6260660
740,6260683,〈房產〉房地合一稅繳納稅率20%的屋主上半年平均繳稅達88.7萬元,根據 2025 年上半年個人房地合一稅繳稅資料顯示，最多人繳納的是 20% 的房地合一稅，平均繳納房地合一稅金額爲 88.7 萬元，依此換算屋主平均獲利高達 443.6 萬元，顯示這波房市景氣大多頭，對於持有超過 5 年的屋主的資產增值。,https://m.cnyes.com/news/id/6260683
741,6260392,〈陸股盤後〉三大指數漲跌互見 滬指跌0.06%,中國股市三大指數周四（4 日）收盤漲跌互見，滬指盤中窄幅震盪，深證成指、創業板指較為強勢。,https://m.cnyes.com/news/id/6260392
742,6260681,旺季效應發酵 東陽11月營收創7個月來高點,旺季效應發酵 東陽 11 月營收創 7 個月來高點,https://m.cnyes.com/news/id/6260681
743,6260668,晶片爭端持續：荷蘭經濟大臣卡雷曼斯取消訪中 中方籲解決自身問題,荷蘭經濟事務大臣卡雷曼斯 (Vincent Karremans) 宣布取消原定於 12 月的訪中計畫，他對外宣稱的理由是日程安排衝突。這一取消被視為解決安世半導體 (Nexperia) 爭議所面臨困難的最新例證。,https://m.cnyes.com/news/id/6260668
744,6260655,機器人的救援！惠譽：AI支出規模擴大 緩衝關稅上調對美國經濟的不利影響,惠譽昨（3）日發布 12 月份《全球經濟展望》（GEO）報告，指出受惠於科技產業投資激增以及股市熱絡帶來的財富效應，美國經濟正展現出強大的韌性，足以緩衝高關稅帶來的負面衝擊。報告強調 IT 資本支出為 2025 年上半年,https://m.cnyes.com/news/id/6260655
745,6260675,鉅亨網首度舉辦「海外期貨知識影片大賽」 攜手期貨業者共同推動國際視野,,https://m.cnyes.com/news/id/6260675
