,newsId,title,summary,link
687,6358975,〈卓揆立院報告〉台美關稅 卓揆：ART法律位階高、保障1735項產品續享豁免,"行政院長卓榮泰今 (3) 日赴立法院針對台美關稅談判進行專案報告 。他指出，台美簽署投資 MOU 與對等貿易協定 (ART)，成功爭取到對等關稅 15% 且不疊加最惠國待遇稅率，並獲得 2,072 項產品豁免對等關稅，也成為全球首",https://m.cnyes.com/news/id/6358975
688,6359473,伊朗核設施所在區域 傳出巨大爆炸聲,伊朗第三大城市伊斯法罕的空軍基地和核設施所在區域周一（2 日）傳出巨大爆炸聲，伊斯法罕核技術研究中心是伊朗最大核研究中心，20 世紀 70 年代在法國援助下成立。,https://m.cnyes.com/news/id/6359473
689,6359170,美擬對輝達H200晶片祭「限購令」 單一中國客戶上限7.5萬顆,,https://m.cnyes.com/news/id/6359170
690,6359491,光寶科MWC 2026 聚焦可擴展AI Native RAN架構 整合NVIDIA及生態系夥伴加速商用化,"光寶科 (2301-TW) 在今年西班牙巴塞隆納 2026 MWC 世界行動通訊大會（Mobile World Congress, MWC），將展示其在 AI-RAN 領域的最新進程，展現 GPU 加速架構如何推動產業從創新邁向商用",https://m.cnyes.com/news/id/6359491
691,6359253,以色列華人親歷戰火：警報減少 家門口咖啡館還開著,美國、以色列與伊朗之間的衝突仍在持續，在伊朗的反擊中，以色列主要城市特拉維夫多處建築受損。,https://m.cnyes.com/news/id/6359253
692,6359320,〈台股開盤〉美伊戰事延燒 小漲後翻黑跌逾200點失守3萬5  航運、油電股續旺,市場逐步消化美伊戰事帶來風險，美股四大指數 2 日漲跌互現，台股今 (3) 日早盤以 35106.22 點開出，微幅上漲 11.13 點，一度震盪漲逾 150 點，航運、塑化類股等傳產權值股雖走強，但電子權值股走弱，指數再度,https://m.cnyes.com/news/id/6359320
693,6359210,澤倫斯基：烏克蘭已度過戰爭爆發以來最艱難冬天,「我國度過了戰爭爆發以來最艱難的一個冬天。」烏克蘭總統澤倫斯基周日（1 日）晚間發表影片講話，稱整個冬季期間俄羅斯共向烏克蘭發射 700 多枚各類飛彈，烏克蘭沒有崩潰，擊退俄軍多次大規模襲擊，守住了能源系統。,https://m.cnyes.com/news/id/6359210
694,6359428,荷姆茲海峽變死路！全球10%貨櫃船受困 ONE、MSC停收中東訂單,,https://m.cnyes.com/news/id/6359428
695,6359225,舉債併購華納壓力大 惠譽將派拉蒙降至BB+垃圾級,惠譽將派拉蒙降至垃圾級，指其 1100 億美元收購華納以舉債為主，合併後淨負債恐達 790 億美元，財務與整合風險引發市場憂慮。,https://m.cnyes.com/news/id/6359225
696,6359180,伍德ARK預測：客製化晶片才是未來的「大玩家」,伍德 (Cathie Wood) 旗下 ARK Invest 投資管理公司預測，輝達 (NVDA-US) 在未來數年所面臨的競爭將愈發激烈，到 2030 年，客製化人工智慧 (AI) 晶片將在運算市場中占超過三分之一市占。,https://m.cnyes.com/news/id/6359180
697,6359254,欣興及泰鼎-KY兩PCB股今起遭處置交易每5分鐘撮合一盤,PCB 股欣興 (3037-TW) 及泰鼎 - KY(4927-TW) 兩個股，交易所公布自今 (3) 日起至 3 月 16 日的 10 個交易日遭處置交易，每 5 分撮合一次。,https://m.cnyes.com/news/id/6359254
698,6359206,伊朗稱已封鎖荷姆茲海峽 不許一滴石油流出,《路透社》周一（2 日）援引伊朗媒體報導，一名伊朗伊斯蘭革命衛隊高階官員稱，荷姆茲海峽已關閉，伊朗將向任何企圖通過海峽的船隻開火。,https://m.cnyes.com/news/id/6359206
699,6359232,美伊衝突升級！台積電、三星和海力士遭「新興市場殺盤」波及,,https://m.cnyes.com/news/id/6359232
700,6359108,伊朗官媒證實！最高領袖哈米尼妻子遇襲身亡,伊朗官方英語新聞電視台「Press TV」周一（2 日）在社媒發布簡短消息，稱已故伊朗最高領袖哈米尼的妻子在美以襲擊中身亡。,https://m.cnyes.com/news/id/6359108
701,6359151,波克夏重挫近5% 阿貝爾股東信態度審慎,波克夏海瑟威股價周一 (2 日) 出現自巴菲特 (Warren Buffett) 宣布卸任執行長以來最大跌幅，此前該綜合企業公布的財報結果未達部分分析師預期，且對現金運用態度審慎。,https://m.cnyes.com/news/id/6359151
702,6357774,【股市焦點】AI 利潤池大挪移！新光證券：利潤排序須關注這些結構轉折情境,,https://m.cnyes.com/news/id/6357774
703,6359205,私有雲端運算遇挑戰 美媒：蘋果正與Google討論託管Siri AI算力,,https://m.cnyes.com/news/id/6359205
704,6359023,戴蒙：川普50億美元去銀行化訴訟「毫無法律依據」但他理解、同情,川普對摩根大通提告求償 50 億美元，指控政治性去銀行化。戴蒙雖稱訴訟無法律依據，卻坦言理解憤怒，並直指監管壓力才是銀行關戶主因。,https://m.cnyes.com/news/id/6359023
705,6357269,中國2026年兩會前瞻：「十五五」規劃將開啟高品質發展新典範,,https://m.cnyes.com/news/id/6357269
706,6359092,美國防長：目標不是顛覆伊朗政權 這次不是伊拉克,美國國防部長赫格塞思和參謀長聯席會議主席凱恩周一（2 日）召開記者會，通報美國打擊伊朗的情況。《CNN》指出，這是美國政府高階官員首次公開談論針對伊朗的軍事行動。,https://m.cnyes.com/news/id/6359092
707,6359208,美伊戰爭6美軍陣亡18受傷 五角大廈披露細節,,https://m.cnyes.com/news/id/6359208
708,6359145,美股重點新聞摘要2026年3月3日,美股重點新聞摘要 2026 年 3 月 3 日,https://m.cnyes.com/news/id/6359145
709,6359188,葉倫：伊朗戰事恐讓Fed更傾向「按兵不動」,,https://m.cnyes.com/news/id/6359188
710,6359025,歷史性爆發！SEC新規上路 高盛估美IPO融資或衝1600億,"高盛預測 2026 年美國 IPO 融資額可能飆升至 1,600 億美元，創歷史新高。同時 SEC 新規將於 3 月 18 日生效，外國上市公司高層須全面揭露持股與交易資訊，監管強度明顯提升。",https://m.cnyes.com/news/id/6359025
711,6359183,油氣市場震盪 魯比歐：美國將出手抑制油價飆升衝擊,中東衝突推升國際油價，美國國務卿魯比歐表示，政府將分階段推出措施抑制能源價格衝擊，相關方案預計周二由財政部與能源部對外說明。,https://m.cnyes.com/news/id/6359183
712,6359172,川普警告將對伊朗還有新一輪「大規模」攻擊 暗示戰事延長,,https://m.cnyes.com/news/id/6359172
713,6359146,美伊戰事恐持續數周 為何美股投資人不以為意？,美軍今年第二度於周末採取軍事行動，使華爾街在新的一周開始時不確定性升高。不過，投資人因先前已有類似經驗，這次顯得處變不驚。,https://m.cnyes.com/news/id/6359146
714,6358939,美伊開戰 美軍：陣亡人數增至4人,美軍中央司令部周一（2 日）在社交平台 X 上發文通報，截至美國東部時間 3 月 2 日上午 7 時 30 分，已有 4 名美軍人員陣亡，第 4 名軍人在伊朗首輪襲擊中受重傷，最終傷重不治。,https://m.cnyes.com/news/id/6358939
715,6359159,〈貴金屬盤後〉憂中東衝突長期化 避險黃金上漲,,https://m.cnyes.com/news/id/6359159
716,6359026,智慧手錶也能跑大模型！高通3nm旗艦穿戴晶片亮相 AI算力衝上10TOPS,高通在 MWC 2026 發表 3nm 製程驍龍穿戴平台至尊版，AI 算力達 10TOPS，可在裝置端運行 20 億參數模型，並提升續航與連接能力，宣示智慧手錶正式跨入本地生成式 AI 時代。,https://m.cnyes.com/news/id/6359026
717,6359143,〈紐約匯市〉美元飆至五周高點 美伊衝突推升避險需求,美元周一 (2 日) 飆升至逾五周高點，美國與以色列對伊朗發動攻擊，引發市場避險需求升溫。,https://m.cnyes.com/news/id/6359143
718,6359024,〈能源盤後〉中東戰火延燒 荷姆茲海峽受阻 Brent盤中飆13% 歐洲天然氣暴漲40%,以色列與美國空襲伊朗後，中東油氣設施與荷姆茲海峽航運受阻，布蘭特盤中飆 13%，歐洲天然氣暴漲 40%，全球能源市場劇烈震盪。,https://m.cnyes.com/news/id/6359024
719,6359150,盧比歐：美國目前未規劃向伊朗部署地面部隊 但川普握有決定權,美國國務卿盧比歐 (Marco Rubio) 周一 (2 日) 向記者表示，美國目前並未為向伊朗部署地面部隊做好準備，但美國總統川普擁有這樣的選項。,https://m.cnyes.com/news/id/6359150
720,6358936,王毅同伊朗外長阿通話 促美國、以色列立即住手,中共中央政治局委員、中國外交部長王毅周一（2 日）應約同伊朗外長阿拉格齊通話，王毅表示，中方已敦促美國、以色列立即停止軍事行動，防止戰事擴大至整個中東。,https://m.cnyes.com/news/id/6358936
721,6359144,〈美股盤後〉標普震盪收平 逢低買盤抵銷美伊戰事拋壓,美國股市周一 (2 日) 收盤接近平盤，盤中震盪劇烈。由於周末美國與以色列對伊朗發動空襲，股市早盤一度下跌，但隨著投資人逢低買進，盤中多次反彈。,https://m.cnyes.com/news/id/6359144
722,6358907,荷姆茲海峽遭封鎖 多家航運巨頭緊急漲價,美國和以色列上周六（28 日）對伊朗發動軍事打擊後，全球供應鏈陷入緊張狀態，導致全球最重要的貿易通道之一——荷姆茲海峽也遭到封鎖。,https://m.cnyes.com/news/id/6358907
723,6359117,〈台股盤前要聞〉外資落跑股匯跌、國巨不到一年漲價三次、勞動基金單月大賺近4000億,台股盤前要聞,https://m.cnyes.com/news/id/6359117
724,6358235,恐慌無處不在！高盛示警：最可怕的不是科技股崩盤 是悄悄裂開的信貸市場,,https://m.cnyes.com/news/id/6358235
725,6357054,輝達強攻6G！結盟諾基亞、軟銀  打造AI時代電信新標準,AI 晶片龍頭輝達積極布局 6G 行動網路，攜手諾基亞、軟銀與 T-Mobile 打造 AI 原生通訊架構。公司指出，5G 已無法支撐大規模 AI 應用，未來網路效率須提升數十萬倍，並導入開放式軟體與 AI 調度技術，以支援機器人、自駕車等實體,https://m.cnyes.com/news/id/6357054
726,6359022,【袁志峰專欄】港股急挫，北水積極買入,"今日推介 - 騰訊 (700, $514, 目標價 $565, 止損價 $495",https://m.cnyes.com/news/id/6359022
727,6358983,中東局勢擾動貨櫃運輸市場 部分航商暫停中東航線接貨,「我們這邊中東航線已經暫停報價了，歐洲航線與前幾天相比略有上漲。」一名海運貨代人士說。,https://m.cnyes.com/news/id/6358983
728,6358978,MWC 2026遭中東戰火攪局！參展團受困杜拜甚至被迫棄展 蘋果關閉數家當地分店,,https://m.cnyes.com/news/id/6358978
729,6358937,AI豪賭受考驗？資本支出壓力下 亞馬遜為何重挫,亞馬遜 (AMZN-US) 在人工智慧 (AI) 競賽中持續重金投入，但市場對這種「燒錢式擴張」的耐心正迅速下降。受龐大資本支出壓力影響，亞馬遜股價 2 月重挫 12%，創下 2022 年 12 月以來最差單月表現，也成為所謂「美股七雄」中表,https://m.cnyes.com/news/id/6358937
730,6359100,美伊開火最緊張的其實是中國？一條海峽牽動北京戰略算盤,美國與以色列對伊朗發動空襲，引發外界從軍事升級風險、核威懾理論與中東地緣政治角度熱烈討論。然而，真正深遠的戰略影響，可能不只發生在中東，而是延伸至亞洲。短期內面臨最直接經濟與戰略考驗的國家，或許是高度依賴全球能源流動的中,https://m.cnyes.com/news/id/6359100
731,6359099,中東戰事+關稅雙壓！美國與歐洲鋁供應警報響起,《路透》周一 (2 日) 報導，美國總統川普對伊朗動武，引發外界憂心中東鋁材出口恐長期受阻，對高度仰賴該地區供應的歐洲與美國消費者衝擊尤深。市場人士指出，若衝突持續並波及荷莫茲海峽 (Strait of Hormuz) 這條關鍵航,https://m.cnyes.com/news/id/6359099
732,6359046,美2月製造業持續擴張 價格指數卻飆近3年半高點,美國製造業 2 月延續擴張動能，但投入成本卻急速攀升，在美伊戰事推升油價之前，通膨壓力已悄然升溫。最新調查顯示，工廠支付價格指數創下逾三年新高，疊加地緣政治與關稅變數，使市場對物價回溫與利率走向更加審慎。,https://m.cnyes.com/news/id/6359046
733,6359073,鉅亨速報 - Factset 最新調查：好市多COST-US的目標價調升至1100元，幅度約4.17%,FactSet 最新調查：好市多COST-US目標價調升，最高估值、最低估值、中位數、綜合評級、近5日股價、標普、即時新聞資訊,https://m.cnyes.com/news/id/6359073
734,6358965,資料中心首成戰場目標？AWS中東設施停擺,綜合外媒體周一 (2 日) 報導，亞馬遜 (AMZN-US) 旗下雲端服務部門 AWS 在阿拉伯聯合大公國 (UAE) 的資料中心周日傳出遭「不明物體」擊中，引發火警並迫使部分設施斷電，導致中東地區出現電力與連線異常。這起事件發生之際，伊,https://m.cnyes.com/news/id/6358965
735,6359010,容量翻倍還升級晶片！蘋果iPhone 17e亮相、iPad Air換上M4,蘋果 (AAPL-US) 周一 (2 日) 發表 iPhone 17e 與搭載 M4 晶片的新款 iPad Air，為今年新一波產品更新揭開序幕。iPhone 17e 延續入門定位，起售價維持 599 美元，但基礎儲存空間,https://m.cnyes.com/news/id/6359010
736,6358679,〈美股早盤〉中東戰事推升油價與美元 主要指數開低,美股主要指數周一 (2 日) 開盤走低，中東戰事擴大推升油價與美元走強，市場憂心能源價格飆升恐再度加劇通膨壓力。道瓊工業指數早盤一度下挫約 500 點，標普 500 指數下跌約 1%，那斯達克指數同步走低。布蘭特原油創近四年最大單日漲幅,https://m.cnyes.com/news/id/6358679
737,6358976,深耕高雄再下一城！緯創投24億元建前鎮研發大樓 預計117年完工,緯創資通 (3231-TW) 今 (2) 日於高雄前鎮科技產業園區舉行研發大樓一期新建工程動土典禮， 總投資 24 億元，規劃興建 1 棟員工宿舍與 2 棟產業研發辦公大樓，預計 117 年 12 月完工。 經濟部次長賴建信指,https://m.cnyes.com/news/id/6358976
738,6359004,美伊衝突進入第三日 傷亡人數劇增且能源供應受創,美國與以色列對伊朗發動的聯合軍事行動周一 (2 日) 進入第三天，這場突如其來的衝突正迅速演變成一場波及整個中東的全面戰爭，不僅造成嚴重的人員傷亡，更導致全球能源市場動盪與海空交通全面癱瘓。,https://m.cnyes.com/news/id/6359004
739,6358964,瞄準下一代矽光子技術！輝達分別向Coherent和Lumentum投資20億美元,,https://m.cnyes.com/news/id/6358964
740,6359000,鉅亨速報 - Factset 最新調查：好市多COST-US的目標價調升至1100元，幅度約4.17%,FactSet 最新調查：好市多COST-US目標價調升，最高估值、最低估值、中位數、綜合評級、近5日股價、標普、即時新聞資訊,https://m.cnyes.com/news/id/6359000
741,6358785,馬斯克身家突破8000億美元 領銜3月全球富豪榜,根據《Forbes》截至 2026 年 3 月 1 日的最新統計數據，全球頂尖富豪的財富格局在經歷了動盪的 2 月後，呈現出顯著的兩極化走勢。特斯拉與 SpaceX 執行長埃隆 · 馬斯克 (Elon Musk)8000 億美元大關，進一步擴大了他,https://m.cnyes.com/news/id/6358785
742,6358658,經濟學家評估中東局勢影響 中國、印度等石油進口國成輸家,在過去一年中，經濟學家持續關注美國總統川普貿易戰的影響，然而現在他們必須評估一場真正的戰爭。,https://m.cnyes.com/news/id/6358658
743,6358678,伊朗衝突引發中東航空大癱瘓 全球交通與金融市場劇烈震盪,隨著中東地區衝突升級，波斯灣各國航空公司周一 (2 日) 宣布大範圍停飛，引發全球交通連鎖反應，航空類股隨之重挫。此次停飛規模被形容為「前所未有」，重創了作為全球航空「超級連接器」的中東轉運樞紐。,https://m.cnyes.com/news/id/6358678
744,6358770,不只EUV！艾司摩爾布局AI晶片設備 跨足先進封裝,荷蘭半導體設備大廠艾司摩爾 (ASML)(ASML-US) 正規劃未來 10 至 15 年的晶片製造技術藍圖，不僅持續深化極紫外光 (EUV) 微影技術優勢，還計畫進軍先進封裝與晶片連接設備領域，以掌握快速成長的人工智慧 (AI) 晶片市場,https://m.cnyes.com/news/id/6358770
745,6358924,房價波動成潛在風險！看好2大關鍵支撐 惠譽估台灣銀行業放款損失有限,惠譽信評發布最新報告指出，受惠於 2026 年 1 月台美貿易協議簽署後宏觀經濟不確定性降低，預期台灣銀行業的中小企業放款品質將保持穩健。穩定經濟環境提升企業信心，配合低失業率與具韌性的內需市場，支撐中小企業獲利與還款能力。惠譽,https://m.cnyes.com/news/id/6358924
746,6358896,歷史經驗：戰火非反轉訊號！摩根看好台股資金動能充沛 但「這件事」成波動關鍵,"受美國與以色列於昨（28）日聯手對伊朗發動大規模空襲影響，全球金融市場動盪，台股投資人須提防市場藉機拉回。摩根資產管理指出，儘管地緣衝突短期內衝擊市場，但台股基本面依然正面，且 2 月份外資回補金額達 1,259 億，加上 3 月台",https://m.cnyes.com/news/id/6358896
747,6358889,伊朗里亞爾崩跌 兩個月貶幅近30倍 匯率跌至175萬兌1美元歷史新低,隨著以色列與美國對伊朗境內目標發動軍事打擊，中東局勢驟然升級，這場衝突不僅在軍事上對抗，更在金融市場引發劇烈動盪。截至 2026 年 3 月 1 日，伊朗貨幣里亞爾 (Rial) 兌美元匯率在自由市場崩跌至歷史新低的 174.95 萬比 1，,https://m.cnyes.com/news/id/6358889
748,6358897,神基估今年營收年增5-10% 軍工成長動能強勁,神基估今年營收年增 5-10% 軍工成長動能強勁,https://m.cnyes.com/news/id/6358897
749,6358894,美伊開戰後市場震盪！軍工股走強、油價大漲,綜合外媒周一 (2 日) 報導，美國與伊朗爆發戰事後，全球金融市場劇烈震盪。整體股市走低之際，軍工股逆勢上揚，油價大幅攀升，成為資金重新配置的焦點。投資人憂心戰事延續恐衝擊經濟成長並推升通膨壓力，能源與地緣風險溢價同步升溫。,https://m.cnyes.com/news/id/6358894
750,6358069,沙烏地阿拉伯駁斥美媒爆料 否認私下催促川普動武,隨著美以聯手擊殺伊朗最高領袖哈米尼，中東局勢陷入劇烈動盪。在這場軍事行動中，有美媒爆料稱，沙烏地阿拉伯可能在幕後扮演了重要的推動角色，雖然利雅德當局在公開場合極力撇清與襲擊的關係，但仍未避免他們承受伊朗報復的直接衝擊。,https://m.cnyes.com/news/id/6358069
751,6358772,中東戰火燒向海運要道！能源與航運成本恐走高,美國與以色列上周末對伊朗發動攻擊後，中東衝突急遽升高，市場憂心關鍵海運要道可能長時間受阻，全球貿易與能源供應面臨新一輪衝擊。航運巨頭已陸續暫停通行荷莫茲海峽 (Strait of Hormuz)，並改道繞行非洲南端好望角，,https://m.cnyes.com/news/id/6358772
752,6358859,鉅亨速報 - Factset 最新調查：波音(BA-US)EPS預估下修至1.18元，預估目標價為277.50元,FactSet 最新調查：波音(BA-US)EPS預估下修，預估EPS、預估營收、目標價、歷史獲利表現、即時新聞資訊,https://m.cnyes.com/news/id/6358859
753,6358789,伊朗持續報復 宣稱擊中納坦雅胡辦公室 美軍證實3架F-15E戰機墜毀,中東局勢陷入全面動盪，伊朗伊斯蘭革命衛隊 (IRGC) 周一 (2 日) 宣稱，在對以色列發動的第十波報復行動中，利用最新式「凱巴爾」(Khyber) 中程彈道飛彈精準擊中了以色列總理納坦雅胡 (Benjamin Netanyahu),https://m.cnyes.com/news/id/6358789
754,6358793,賴清德：將助台企赴美國等地擴大投資 核心技術根留臺灣,賴清德今 (2) 日接見「美國半導體產業協會 (SIA) 訪問團」時表示，台灣身為全球半導體重鎮之一，將持續深化全球供應鏈合作，與國際夥伴共同建立穩健、可信賴的供應鏈網絡，未來將協助台灣企業在美、日、歐與東南亞等擴大投資與研發。,https://m.cnyes.com/news/id/6358793
755,6355429,股東會年報及財報「抽查」過關否？櫃買中心今發布審閱報告 聚焦6項目4缺失,櫃買中心定期針對年報及財務報告進行抽樣審閱，並將常見缺失與建議彙整成冊公告，今（2）日宣布「2024 年度上市上櫃股東會年報及財務報告審閱報告」已置於櫃買中心網站，2024 年度審閱重點涵蓋董事會職能、永續發展及資通安全等 6,https://m.cnyes.com/news/id/6355429
756,6358773,美伊戰事波及 赴中東參團旅遊解約 觀光署說明處理原則,美、以聯軍在上 (2) 月 28 日起聯手對伊朗發動大規模且持續性空襲。交通部觀光署今 (2) 日表示，為保障國人旅遊安全，若因旅客航班取消無法成行，旅行社應將已代繳之規費或履行本契約已支付之全部必要費用扣除後，將餘款退還旅客。,https://m.cnyes.com/news/id/6358773
757,6358787,台灣大布局低軌衛星領域 與AST SpaceMobile簽署合作備忘錄,台灣大 (3045-TW) 今 (2) 日宣布，與手機直連衛星的通訊業者 AST SpaceMobile 於 MWC 簽署「低軌衛星通訊服務策略合作備忘錄」，將在台灣推動太空基地台與既有行動網路協同運作。,https://m.cnyes.com/news/id/6358787
758,6358769,中國會出手軍援伊朗？目前未見直接證據,《彭博》周一 (2 日) 報導，美國總統川普對伊朗發動攻擊後，造成伊朗最高領袖身亡，並加速其飛彈庫存消耗。不過，外界觀察指出，德黑蘭目前尚難以期待北京直接出手強化其軍備。儘管近期屢傳中國防空系統可能運往伊朗，甚至有說法指中國提,https://m.cnyes.com/news/id/6358769
759,6358667,比起避險 投資人更擔憂通膨加劇 美債殖利率攀高,美國公債價格周一 (2 日) 下跌，這是由於中東衝突導致油價飆升，引發了人們對通膨加速的擔憂，並迫使交易員減少對降息幅度的押注，,https://m.cnyes.com/news/id/6358667
760,6358676,信錦去年EPS3.45元擬配息3元 今年看好低軌衛星產品需求強勁成長,信錦去年 EPS 3.45 元擬配息 3 元 今年看好低軌衛星產業需求強勁成長,https://m.cnyes.com/news/id/6358676
761,6358668,緯創高雄研發大樓一期新建工程動土 預計2028年12月興建完成,緯創 (3231-TW) 持續強化高雄研發布局，今 (2) 日於高雄前鎮科技園區舉行「高雄研發大樓一期新建工程開工動土典禮」，整體投資計畫將分為三階段逐步落實，預計 2028 年 12 月興建完成。 ,https://m.cnyes.com/news/id/6358668
762,6358666,穩懋馬年開春股價漲34% 1月每股盈餘 0.39元較去年同期轉盈,"穩懋 (3105-TW) 近期因股價漲幅劇烈，主要機關要求有價證券於市場達公布注意交易資訊標準，穩懋今 (2) 日公告上 (1) 月稅後純益為 1.64 億元，較去 (2025) 年單月同期虧損 4,000 萬元由虧轉盈，每股 EPS 0.39 元",https://m.cnyes.com/news/id/6358666
763,6358082,蘋果本週將推史上最便宜MacBook！售價或不到兩萬、對決MacBook Air值不值得買？,蘋果（Apple）最快本週發表史上最便宜 MacBook，搭載 A18 Pro 晶片與 12.9 吋螢幕，但為壓低售價在亮度、儲存與鍵盤等規格有所取捨。與 MacBook Air 相比是否更具性價比？售價落在 699 美元以下才是關鍵。,https://m.cnyes.com/news/id/6358082
764,6358068,4分錢咖啡的背後：中國速食店華萊士的流量豪賭與信任危機,2026 年開年，中國本土速食巨頭華萊士以一場激進的價格戰震撼市場，推出「9.9 元 210 杯咖啡月卡」，折合每杯咖啡僅約人民幣 4.7 分錢。這項活動目前已在超過 8000 家門店上線，消費者購卡後，30 天內每 2 小時可領取一杯現磨美,https://m.cnyes.com/news/id/6358068
765,6348940,避險需求拉高 12檔高股息ETF大比拚 00961年化配息率飆14%稱霸,受美伊緊張局勢與美股高點震盪影響，全球股市波動加劇帶動避險需求，台股投資人轉向防禦性標的，高股息 ETF 成為資金停泊首選 。3 月共有 12 檔高股息 ETF 參與配息，其中 FT 臺灣永續高息 (00961-TW) 以 14% 年化配息率,https://m.cnyes.com/news/id/6348940
766,6358664,〈仁寶法說〉第一季AI伺服器業績有望翻倍 資本支出上看180億元,仁寶今日召開法說會，總經理 Anthony Peter Bonadero 指出，今年伺服器業務主要由 AI 伺服器驅動，且今年上半年訂單能見度佳，預期第一季 AI 伺服器業績季對季有望翻倍成長。此外，今年資本支出上修至 180 億元。,https://m.cnyes.com/news/id/6358664
767,6358648,〈房產〉黃啟倫接任不動產聯盟總會理事長 籲政府滾動檢討打房政策,不動產聯盟總會今 (2) 日進行新舊全理事長交接，並由中洲建設董事長黃啟倫正式接任理事長，他指出，2026 年市場展望仍難以樂觀，並籲政府應滾動檢討打房政策，包括七波信用管制已見效、第二戶貸款應差別化管理。,https://m.cnyes.com/news/id/6358648
