,newsId,title,summary,link
359,6193282,交貨期趨緩反映供應回穩 瑞銀：iPhone 17 系列交貨期明顯縮短,瑞銀報告顯示，iPhone 17 系列在全球多數市場的交貨等待時間已由上週明顯縮短，尤其是 Pro 與 Pro Max 機型在美國等待期分別減少約 9 天與 4 天，顯示供應鏈逐步順暢。不過入門款需求仍強勁。,https://m.cnyes.com/news/id/6193282
360,6192698,人工智慧熱潮引發投機泡沫？從1929華爾街崩盤到當前AI股市風險,人工智慧（AI）投資熱潮推動股市上漲，但專家警告市場可能面臨泡沫與大幅回調。回顧 1929 年華爾街崩盤的歷史教訓，投資者應關注股市與信貸市場潛在風險，避免重蹈覆轍。,https://m.cnyes.com/news/id/6192698
361,6193288,Fed華勒：AI若能推升生產力逾2% 可提升生活水準不致通膨,聯準會理事華勒 (Christopher Waller) 周三表示，他期待 AI 能帶動持續的生產力提升，在不引發通膨的情況下提高生活水準。他指出，任何超過 2% 的持續生產力成長，都有助於支撐實質所得和生活水準提升，且不會造成通膨,https://m.cnyes.com/news/id/6193288
362,6189724,【袁志峰專欄】內地通縮持續，不利股市,"今日推介 - 滙豐 (5, $103.5), 目標價 $112, 止損價 $99",https://m.cnyes.com/news/id/6189724
363,6193170,三星正面迎擊升級版蘋果Vision Pro 下周發表安卓XR頭戴裝置,就在蘋果推出性能升級版 Vision Pro 之際，由三星、Google、高通（Qualcomm）聯合開發的旗艦安卓混合現實（XR）頭戴裝置也將迎來正式發布。,https://m.cnyes.com/news/id/6193170
364,6192926,庫克來中國為iPhone 17造勢 逛了北京公園,蘋果執行長庫克周三（15 日）現身北京將府公園，與開發者散步、交流。就在前一天，庫克還探訪上海莉莉絲遊戲公司，與莉莉絲創始人王信文和《劍與遠征：啟程》主創團隊交流。,https://m.cnyes.com/news/id/6192926
365,6192376,美國陷「未知水域」！政府停擺邁入第15天 引爆經濟與政策危機 誰買單？,,https://m.cnyes.com/news/id/6192376
366,6191657,高估值陷阱？Gavekal示警：AI不會重演智慧手機革命帶來的暴利,,https://m.cnyes.com/news/id/6191657
367,6193092,LVMH終結連兩季衰退！股價暴漲14% 創2001年來最大漲幅,精品集團 LVMH 周三 (15 日) 股價暴漲近 14%，創下 2001 年 9 月以來最大單日漲幅。該公司第三季有機成長重返正成長，優於預期的業績提振整個歐洲精品類股，帶動法國 CAC 40 指數大漲 2.7%，創下 4 月以來最大漲幅。,https://m.cnyes.com/news/id/6193092
368,6193304,Fed褐皮書：美經濟活動變化不大 就業穩中帶弱,美國聯準會 (Fed) 周三 (15 日) 公布的最新褐皮書 (Beige Book) 顯示，美國整體經濟活動在近幾週幾乎沒有明顯變化，就業水準大致穩定，但部分企業開始減少人力，顯示就業市場持續降溫。報告同時指出，關稅推升投入成本壓力,https://m.cnyes.com/news/id/6193304
369,6193281,AI競賽升溫！Meta斥資15億美元打造1GW資料中心 2028年啟用,《彭博》報導，社群媒體巨頭 Meta Platforms(META-US)周三 (15 日) 宣布，將在美國德州艾爾帕索 (El Paso) 投資超過 15 億美元，興建一座規模達 1GW(Gigawatt)的新資料中心，以支撐其人工智慧,https://m.cnyes.com/news/id/6193281
370,6193217,貝森特拋橄欖枝：若中國放棄稀土管制 美方願延長關稅暫停,根據《彭博》周三 (15 日) 報導，美國財政部長貝森特表示，若北京放棄最新稀土出口管制計畫，美方願延長對中國商品高關稅的暫停期限。,https://m.cnyes.com/news/id/6193217
371,6193269,鉅亨速報 - Factset 最新調查：摩根士丹利MS-US的目標價調升至164元，幅度約5.13%,FactSet 最新調查：摩根士丹利MS-US目標價調升，最高估值、最低估值、中位數、綜合評級、近5日股價、標普、即時新聞資訊,https://m.cnyes.com/news/id/6193269
372,6193222,擴大電動航空版圖！Archer砸逾2千萬美元收購Lilium專利 股價漲逾6%,"根據《路透》報導，美國空中計程車新創公司 Archer Aviation 周三 (15 日) 宣布，以 1,800 萬歐元 (約 2,100 萬美元) 收購競爭對手 Lilium 的約 300 項先進空中移動 (AAM) 技術專利資產，進一步擴大其自有技",https://m.cnyes.com/news/id/6193222
373,6193218,貿易戰加劇經濟風險！聯準會理事米蘭：更迫切需要快速降息,根據《彭博》周三 (15 日) 報導，聯準會理事米蘭 (Stephen Miran) 表示，近期貿易緊張情勢升溫，增加經濟成長前景的不確定性，使政策制定者更迫切需要快速降息。,https://m.cnyes.com/news/id/6193218
374,6193124,股市跌也不讓！美財長放話堅持對中強硬立場,根據《CNBC》報導，美國財政部長貝森特 (Scott Bessent) 周三 (15 日) 表示，儘管近期美股波動劇烈，美國在對中貿易談判中的強硬立場不會因此改變，強調政策決策將以國家經濟利益為優先，而非股市表現。,https://m.cnyes.com/news/id/6193124
375,6193180,反制中國不公平競爭！貝森特：對多產業設價格下限、不排除再入股戰略企業,美國財政部長貝森特周三 (15 日) 表示，川普政府將在稀土等多個產業設立價格下限，以對抗中國的市場操控。他指出，中國過去 20 年利用在精煉和加工的全球主導地位壓低價格，逼退外國競爭對手，美國必須採取產業政策因應。,https://m.cnyes.com/news/id/6193180
376,6193141,面對俄國威脅 德國宣布百億歐元無人機計畫,根據《彭博》周三 (15 日) 報導，德國國防部長皮斯托利斯表示，德國計劃在未來數年投資 100 億歐元 (約 116 億美元) 用於軍用無人機，以因應俄羅斯日益加劇的威脅，保護歐洲和北約領空。,https://m.cnyes.com/news/id/6193141
377,6193169,彭金隆：正是台灣承接資金趨勢絕佳契機 以「大贏小輸」策略打造亞資中心,金管會主委彭金隆今（15）日出席「亞洲資產管理中心發展論壇」致詞指出，隨著全球資產規模不斷擴大與財富管理需求提升，台灣具備充沛資金、堅實產業基礎與國際競爭優勢，正是承接趨勢,https://m.cnyes.com/news/id/6193169
378,6193165,M5晶片登場！蘋果iPad、MacBook、Vision Pro三大新品性能飆升,蘋果 (AAPL-US) 周三 (15 日) 宣布推出新一代 iPad Pro、14 吋 MacBook Pro 與 Vision Pro 頭戴裝置，三款產品皆搭載自家研發的最新 M5 晶片，效能全面升級。美國等地區新產品即日起開放預購，10 月 2,https://m.cnyes.com/news/id/6193165
379,6193004,〈美股早盤〉一掃貿易陰霾！主要指數開高 銀行與晶片股領漲,美股主要指數周三 (15 日) 開盤走高，投資人押注企業財報季將展現美國企業獲利韌性，同時預期聯準會 (Fed) 持續降息將延續市場動能。受主要銀行繳出亮眼成績與晶片類股領漲帶動，三大指數開高，道瓊工業指數一度上漲逾 200 點，強勁,https://m.cnyes.com/news/id/6193004
380,6193126,〈財報〉獲利大增逾四成！摩根士丹利Q3財報創五年最大驚喜,摩根士丹利 (Morgan Stanley) 周三 (15 日) 美股盤前公布 2025 會計年度第三季 (截至 9/30) 財報，受惠於投資銀行業務回溫、股票交易創紀錄與財富管理業務穩健，獲利大幅超出市場預期，創近五年來最大驚喜。,https://m.cnyes.com/news/id/6193126
381,6192653,AI搶飯碗！Anthropic執行長警告：5年內一半白領工作不保 失業率飆上20%,,https://m.cnyes.com/news/id/6192653
382,6192710,川普對普丁續戰烏克蘭表「非常失望」 稱衝突為「二戰以來最大」,在烏克蘭總統澤倫斯基 (Volodymyr Zelenskyy) 即將訪問華盛頓之際，美國總統川普周二 (14 日) 公開對俄羅斯總統普丁 (Vladimir Putin) 持續進行烏克蘭戰爭表示「非常失望」。川普在白宮與阿根廷總統米,https://m.cnyes.com/news/id/6192710
383,6193082,為何AI能改變一切？諾貝爾經濟學獎得主給出答案,根據《巴隆周刊》周二 (14 日) 報導，在 AI 成為全球焦點的此刻，將最新諾貝爾獎頒給研究技術變革的學者，時機恰到好處。,https://m.cnyes.com/news/id/6193082
384,6192722,高盛報告：AI算力盡頭是電力 核能成破局關鍵,華爾街金融巨頭高盛研究部近期發布報告指出，釋放人工智慧 (AI) 潛力的最關鍵障礙並非資本，而是電力。這場 AI 浪潮並非單純的程式碼革命，而是一場堪比鐵路、電氣化的基礎設施革命。報告認為，當前限制 AI 進步最緊迫的瓶頸，是驅動這,https://m.cnyes.com/news/id/6192722
385,6193005,〈財報〉投行業務火熱！美銀Q3獲利亮眼 上修Q4財測,美國銀行 (Bank of America) 周三 (15 日) 美股盤前公布 2025 會計年度第三季 (截至 9/30) 財報，受惠於併購活動復甦與利息收入創新高，獲利大幅超出華爾街預期，同時上修第四季淨利息收入 (NII) 財測至 156 億,https://m.cnyes.com/news/id/6193005
386,6193107,匯豐喊買輝達！目標價320美元創華爾街新高 漲幅還有80%,根據《彭博》周三 (15 日) 報導，匯豐銀行將輝達 (NVDA-US) 評級從持有上調至買入，目標價大幅提高至華爾街最高的 320 美元，較當前股價有近 80% 上漲空間。分析師認為，AI 晶片市場將持續擴大，輝達 2027 財年獲利有望大幅,https://m.cnyes.com/news/id/6193107
387,6193012,華為夥伴秀晶片設備與軟體 力證中國半導體野心未止步,根據《彭博》周三 (15 日) 報導，就在美國總統川普威脅進一步限制中國取得先進科技的幾天後，華為 (Huawei) 旗下與關聯企業本周於深圳半導體展會上集體亮相，展示涵蓋軟體、晶片製程設備等多項產品，展現中國在晶片領域追趕美國的,https://m.cnyes.com/news/id/6193012
388,6192721,摩根士丹利看好寧德時代：出口管制影響微 建議「逢低買入」,摩根士丹利近期發布研究報告，對中國電池龍頭寧德時代 (CATL)(300750-CN) 的表現表示樂觀，尤其強調即使面臨中國商務部發布的電池、設備及材料出口管制新規定，其影響預計仍「甚微」。大摩維持對寧德時代「逢低買入」(B,https://m.cnyes.com/news/id/6192721
389,6193105,鉅亨速報 - Factset 最新調查：富國銀行(WFC-US)EPS預估上修至6.25元，預估目標價為92.00元,FactSet 最新調查：富國銀行(WFC-US)EPS預估上修，預估EPS、預估營收、目標價、歷史獲利表現、即時新聞資訊,https://m.cnyes.com/news/id/6193105
390,6192708,中國「夸父」計畫重大突破：成功打造聚變堆「超級盾牌」,據中國官媒《新華社》報導，大科學裝置聚變堆主機關鍵系統綜合研究設施「夸父」(CRAFT) 於 10 月 13 日上午取得了重大進展。其偏濾器原型部件順利通過了專家組的測試與驗收。測試結果顯示，中國自主設計的國際尺寸最大、熱負荷最高,https://m.cnyes.com/news/id/6192708
391,6193009,稅法卡關！蘋果想在印度擴張先過「這一關」,《路透》周三 (15 日) 援引知情人士消息報導，蘋果 (AAPL-US) 正積極遊說印度政府修改所得稅法，以確保公司不會因提供高價 iPhone 生產設備給代工廠而被課稅。知情人士指出，這項規定被視為蘋果在印度進一步擴張的重要障礙。,https://m.cnyes.com/news/id/6193009
392,6193066,三三會林伯豐：憂心明年工資調漲企業減少雇用 建議政府四項措施因應,三三企業交流會理事長林伯豐今 (15) 日表示，明 (2026) 年最低工資調漲後，將增加台灣企業支出成本約 350 億元台幣，可能讓企業減少雇用，他提出四項呼籲，除了建議政府協助中小企業，也評估評估本國及外籍勞工脫鉤的可能性。,https://m.cnyes.com/news/id/6193066
393,6193045,外資前三季核准來台投資88億美元飆升5成 離岸風電、科技大廠成主力,"經濟部投資審議司今（15）日公布 114 年 1 月至 9 月投資統計，最大亮點為僑外來臺投資金額呈現爆發式成長，核准金額達 87 億 7,735 萬 8,000 美元，較上年同期大幅增加 50.41%，主要由離岸風電、科技等重大投資案帶動，台商",https://m.cnyes.com/news/id/6193045
394,6193042,台達電展示三大先進解決方案 驅動AI資料中心發展,台達電展示三大先進解決方案 驅動 AI 資料中心發展,https://m.cnyes.com/news/id/6193042
395,6192657,CSIS：美國EDA出口管制加速中國「去美國化」實際上是「雙面刃」,美國智庫戰略與國際研究中心 (CSIS) 本月發布報告，聚焦半導體出口管制背景下，中國在晶片設計領域的「去美國化」策略。《半導體出口管制雙面刃－電子設計自動化》指出，美國憑藉龍頭企業在晶片設計市場中占據約 70% 的份額優勢,https://m.cnyes.com/news/id/6192657
396,6193040,晶圓代工下半年產能利用率優預期 中系業者率先漲價,研調機構 TrendForce 今 (15) 日指出，今年下半年因美國半導體關稅尚未實施，以及 IC 廠庫存水位偏低、智慧型手機進入銷售旺季，加上 AI 需求持續強等因素，晶圓代工廠產能利用率並未如原先預期有所下修，部分晶圓廠第四季的表,https://m.cnyes.com/news/id/6193040
397,6193027,PCB廠T+A雙掛牌再增一家 定穎旗下超穎10月底上海A股IPO,繼臻鼎 - KY 以旗下子公司鵬鼎在深圳掛牌之後，定穎 (3715-TW) 旗下子公司超穎電子上市申請案在獲上海證券交易所上市審核委員會通過，預計在 10 月底上市掛牌，將成另一家兩岸雙掛牌 T+A 的 PCB 廠。,https://m.cnyes.com/news/id/6193027
398,6193026,中鋼、中鴻11月內銷盤價開平盤 國內需求復甦略緩,中鋼、中鴻 11 月內銷盤價開平盤 國內需求復甦略緩,https://m.cnyes.com/news/id/6193026
399,6193013,中國限稀土出口？ASML財務長信心喊話：庫存夠、供應穩！,根據《彭博》報導，荷蘭晶片設備製造商艾司摩爾 (ASML-US) 財務長達森 (Roger Dassen) 周三 (15 日) 表示，公司已「充分準備」應對中國最新的稀土出口限制措施，即使其對全球半導體生態系的影響仍難以評估。,https://m.cnyes.com/news/id/6193013
400,6193006,Fed降息＋關稅雙壓！美債殖利率下探3年低點,根據《彭博》報導，美國公債殖利率周三 (15 日) 持續下滑，因市場預期聯準會 (Fed) 將持續降息，加上美中貿易緊張升溫，引發投資人轉向避險資產。,https://m.cnyes.com/news/id/6193006
401,6192652,Google AI最大王炸曝光！Gemini 3.0測試直接復刻macOS,據《9to5google》報導，繼成功發布 Nano Banana 之後，Google(GOOGL-US) 又推出了 Gemini 3.0，據洩漏消息稱，Gemini 3.0 可能將於 10 月下旬發布。,https://m.cnyes.com/news/id/6192652
402,6193001,新光三越攜手日本伊勢丹 推全台首見男性潮流選物場域,新光三越攜手日本伊勢丹 推全台首見男性潮流選物場域,https://m.cnyes.com/news/id/6193001
403,6191345,漢康年底送件申請創新板 目標明年上半年掛牌,漢康 - KY(7827-TW) 今 (15) 日召開法說會，董事長劉世高表示，旗下抗癌融合蛋白新藥 HCB101 已啟動一 b / 二 a 期臨床收案，且已對外授權。同時，規劃今年底送件申請創新板上市，目標明年上半年掛牌。 ,https://m.cnyes.com/news/id/6191345
404,6192651,螞蟻集團重磅開源思考模型Ring-1T：推理能力直逼GPT-5天花板,螞蟻集團於正式發布上兆參數思考模型 Ring-1T，並同時全面開源模型的權重和訓練配方。Ring-1T 的問世，不僅是螞蟻集團首個上兆參數思考模型，更被視為開源 AI 正式邁入上兆參數時代的里程碑。,https://m.cnyes.com/news/id/6192651
405,6192962,永豐餘水資源回收中心轉型沼氣綠能 董座葉惠青：擁三項創舉,永豐餘旗下豐川綠能宣布，啟用龜山水資源回收中心沼氣發電系統。董事長葉惠青表示，綠能中心擁有 3 項第一，首個採 ROT 模式進行水資源回收中心轉型綠能中心、首座污水處理廠轉綠電且為台灣規模最大，以及首個申請電業執照的綠能中心。,https://m.cnyes.com/news/id/6192962
406,6192906,富旺發行6億元CB完成籌資6.18億元  明天掛牌交易,建商密集籌資鞏固營運不斷，其中由富旺國際 (6219-TW) 發行有擔保可轉換公司債 (CB) 6 億元完成募集，並將在明 (16) 日上櫃掛牌交易。,https://m.cnyes.com/news/id/6192906
407,6192794,2025灣芯展登場！新凱來旗下公司新品炸場：國產EDA補空白 90GHz示波器突破《瓦森納協定》封鎖,,https://m.cnyes.com/news/id/6192794
408,6192897,〈台北紡織展〉廣越董座：今年Q4營收將是同期最強 明年雙位數成長,廣越董座：今年 Q4 將改寫同期最強 明年營收雙位數成長,https://m.cnyes.com/news/id/6192897
409,6192893,台積電供應鏈志聖1-3季營收及獲利都創同期新高  EPS 3.78元,志聖工業 (2467-TW) 今 (15) 日公布最新獲利資訊，自結 2025 年 第三季稅後純益 2.12 億元，季增 2.08%，年 28.23%，1-9 月稅後純益 5.69 億元，年 8.56%，每股純益 3.78 元。,https://m.cnyes.com/news/id/6192893
410,6192891,智邦高層異動 資深副總李訓德接任總經理,網通廠智邦 (2345-TW) 今（15）日公告重大人事異動，原任總經理、執行長暨營收長石軍因個人生涯規劃與組織調整，決定辭任所有職務並即日生效，董事會已通過由產品生產暨營銷運籌中心資深副總經理李訓德接任新任總經理職務，執行,https://m.cnyes.com/news/id/6192891
411,6192841,創博會未來科技館明日登場 國科會：鎖定六大領域推動產業升級,創新技術博覽會 - 未來科技館於明 (16) 日 - 18 日在台北世貿一館開展。國科會表示，今 (2025) 年將展出 220 件技術，鎖定智慧機器人、量子科技、運動科技、AI 應用與產學合作、晶創台灣方案、未來科技獎等六大技術領域。,https://m.cnyes.com/news/id/6192841
412,6192793,ASML報喜+台積電寫新天價 這5檔台股ETF半年績效突破5成,雖然台股昨 (14) 日開高走低收黑，但半導體設備製造商艾司摩爾 (ASML) 訂單表現優於預期，帶領多頭展開反攻，今 (15) 日在護國神山台積電領軍創高激勵下，加權指數大漲 482.56 點，收 27275.71 點，逼近歷史高,https://m.cnyes.com/news/id/6192793
413,6192889,籌碼未鬆動不必悲觀、智通⊕、十銓⊕、至上、宜鼎、楠梓電,,https://m.cnyes.com/news/id/6192889
414,6192798,〈房產〉去年度營利事業房地合一稅達399.6億元改寫歷史新高 年增37%,根據財政部最新統計顯示，2025 年 9 月全台房地合一稅表現出明顯分歧走勢，年度的營利事業房地合一稅稅收達 399.6 億元，年增 37%，創歷年同期新高；不過今年逐月的個人房地合一稅多數呈現衰退。,https://m.cnyes.com/news/id/6192798
415,6192790,童子賢談中國稀土管制 對台灣影響小但可能使某些國家重新開採,中國商務部近日宣布擴大稀土出口管制，引起市場關注與討論。對此，和碩 (4938-TW) 董事長童子賢今 (15) 日指出，雖然稀土管制對台灣整體經濟非常間接，但若上升至政治或國安問題，可能誘導某些國家重新開採稀土。,https://m.cnyes.com/news/id/6192790
416,6192797,"【量大強漲股整理】台股站穩27,000點後，如何解讀?OCP大會登場下，潛力股鎖定誰?",,https://m.cnyes.com/news/id/6192797
417,6192839,台積法說前資金回流電子，AI與散熱族群再啟主升段：台積電、雙鴻、昇陽半導體、眾達-KY、AES-KY、良維,,https://m.cnyes.com/news/id/6192839
418,6192333,新凱來的崛起！一文看懂中國半導體設備國產化新時代的窗口,隨著中國本土半導體設備自給率預計於 2025 年達到 50%，為半導體設備研發公司新凱來（SiCarrier）創造了廣闊的發展舞台與商機。,https://m.cnyes.com/news/id/6192333
419,6192760,毅嘉Q3 EPS 0.6元今年單季次高 累計前三季賺5.7億元年增逾一成,軟板廠毅嘉 (2402-TW) 今 (15) 日公告第三季稅後純益為 1.9 億元，呈季年雙減，每股純益 0.6 元；累計前三季稅後純益 5.7 億元，年增 12.9%，每股純益 1.86 元；毅嘉表示，第三季毛利率雖然受產品組合下滑，但獲利仍為,https://m.cnyes.com/news/id/6192760
420,6192473,調查：經濟展望創史低 聖誕購物季美國人均消費預計減少10%,根據德勤 (Deloitte) 周三 (15 日) 發佈的年度調查報告，隨著美國年度假期購物旺季的臨近，大多數美國消費者對國家經濟前景持悲觀態度。這份對大約 4000 名受訪者進行的民意調查結果，為零售業在一年中最關鍵的銷售期增添了謹,https://m.cnyes.com/news/id/6192473
421,6192761,台股ETF之王0050單周吸金169億元 規模衝上8126億元締新猷,在市場正向氛圍帶動下，元大台灣 50(0050-TW) 本周獲淨申購 169 億元，稱冠台股 ETF 市場，加上權值股台積電 (2330-TW)、台達電 (2308-TW) 漲勢助攻，推升規模來到 8126 億元，持續朝國內首檔兆,https://m.cnyes.com/news/id/6192761
422,6192204,攜手廣汽跟「寧王」！京東官宣11月9日發布新車 回應稱不涉及「造車」,,https://m.cnyes.com/news/id/6192204
423,6192756,宜鼎：DRAM漲價沒有盡頭 Edge AI案件指數型成長,工業記憶體模組大廠宜鼎 (5289-TW) 董事長簡川勝今 (15) 日指出，AI 需求爆發帶動記憶體市場出現結構性缺口，特別是 DDR4 產能緊縮情況嚴重、價格「看不到盡頭」。同時，公司持續攜手輝達 (NVDA-US) 等大廠衝刺 Edg,https://m.cnyes.com/news/id/6192756
424,6192757,外資續賣超130億元 連兩日回補期貨空單 中止連5賣台積電,台股今日台積電 (2330-TW) 在法說會前走勢頑強，收盤並以 1465 元改寫歷史新高， 終場大盤上漲 482.65 點，以 27275.71 點作收，市場成交值爲 5001.09 億元，三大法人合計賣超 130.33 億元。,https://m.cnyes.com/news/id/6192757
425,6192752,星宇航空年底前迎來A350-1000新機 明年下半年有望首開歐洲航線,星宇航空年底前迎來 A350-1000 新機 明年下半年有望首開歐洲航線,https://m.cnyes.com/news/id/6192752
426,6192187,稀土管制恐引漲價潮？龔明鑫：強化稀土再精煉技術、拉高戰略物資儲存量因應,經濟部長龔明鑫今（15）日出席「2025 零碳永續高峰論壇」後受訪，針對美中貿易戰再度聚焦於稀土議題，他表示，雖然稀土問題對台灣的影響目前屬於間接性質，但政府將會密切觀察情勢發展，並與國際間同步協調，共同應對可能帶來的挑,https://m.cnyes.com/news/id/6192187
427,6192658,國泰瞄準區域型資產管理平台 李長庚：台灣有扎實產業基礎 具創富優勢,國泰金控 (2882-TW) 今 (15) 日舉辦第二屆「國泰資產管理高峰會」，吸引逾 1.2 萬人報名，此次邀請橡樹資本、PIMCO、貝萊德三大投資巨擘專家共同剖析全球投資趨勢。國泰金控總經理李長庚表示，投資人考慮要將資產配置,https://m.cnyes.com/news/id/6192658
428,6192530,〈港股盤後〉恒指強勢反彈逾400點 科技股普漲 軒竹生物首日飆升逾126%,香港股市周三 (15 日) 迎來強勁反彈，主要指數集體上漲。截至收盤，恒生指數報 25910.60 點，漲幅達 1.84%，恒指最終上升 469 點。恒生科技指數大漲 2.57%，收報 6075 點，而國企指數也上漲 1.89%。當日港股成交金,https://m.cnyes.com/news/id/6192530
429,6192725,主計總處：今年GDP低估了 下半年表現優預期 有望上調趨近5%,主計總處看我國經濟成長有點低估 今年 GDP 有望超過 4.5%,https://m.cnyes.com/news/id/6192725
430,6192723,安世半導體證實 同時遭美、中出口管制,,https://m.cnyes.com/news/id/6192723
431,6192447,〈陸股盤後〉陸通縮引發市場對刺激政策預期 滬指連三黑止步 重返3900點,,https://m.cnyes.com/news/id/6192447
432,6192335,烏克蘭：俄羅斯無人機大量使用外國零件、制裁存在「漏洞」,烏克蘭當局指出，俄羅斯無人機與導彈在攻擊烏能源系統時含有超過 10 萬個美國與西歐零件。烏克蘭制裁特使呼籲盟國加強制裁執行，並警告俄羅斯利用加密貨幣與影子艦隊規避制裁。,https://m.cnyes.com/news/id/6192335
433,6192706,〈台幣〉聯準會有意結束縮表 收升1.05角至30.656元,〈台幣〉聯準會有意結束縮表 收升 1.05 角至 30.656 元,https://m.cnyes.com/news/id/6192706
434,6192491,銅價反彈 交易商看好挑戰每噸1.2萬美元,在聯準會主席鮑爾 (Jerome Powell) 釋放本月將再次降息的訊號後，大宗商品市場受到鼓舞，銅價隨之反彈，漲幅一度高達 1.1%。參加業內規模最大的年度會議的交易員們表示，每噸 12000 美元的銅價已經不遠。,https://m.cnyes.com/news/id/6192491
435,6192662,晶技9月稅前賺2.32億元年增15% 1-9月每股稅前賺4.7元,晶技今日公布最新自結獲利資訊，2025 年 9 月營收突破 12 億元達 12.35 億元創今年來新高，自結單月稅前盈餘 2.32 億元，每股稅前賺 0.67 元，1-9 月每股稅前盈餘 4.7 元。,https://m.cnyes.com/news/id/6192662
436,6191638,黃金價格屢創新高、漲勢有撐？專家：美國散戶才剛加入派對,,https://m.cnyes.com/news/id/6191638
