,newsId,title,summary,link
683,6414349,英特爾攜手Google擴大合作 強攻AI資料中心CPU布局,綜合外媒周四 (9 日) 報導，英特爾 (INTC-US) 與 Google(GOOGL-US)宣布擴大合作關係，雙方將加深在人工智慧 (AI) 資料中心領域的布局，Google 承諾未來將持續採用多世代 Xeon 處理器，並共同開發客製化基,https://m.cnyes.com/news/id/6414349
684,6414441,台新元富證合併後APP異常 金管會：已通報重大偶發 責成證交所查核,台新證券與元富證券於 4 月 6 日正式合併，躍升全台第四大券商。然而，昨 (7) 日合併後首個交易日爆出零星災情，部分用戶反映 APP 無法登入、庫存消失。對此，金管會證期局今 (9) 日證實,https://m.cnyes.com/news/id/6414441
685,6414437,鉅亨速報 - Factset 最新調查：雪佛龍(CVX-US)EPS預估上修至9.8元，預估目標價為212.50元,FactSet 最新調查：雪佛龍(CVX-US)EPS預估上修，預估EPS、預估營收、目標價、歷史獲利表現、即時新聞資訊,https://m.cnyes.com/news/id/6414437
686,6414393,荷姆茲根本沒開、230艘油輪卡海上！國際油價再衝100美元,根據《CNBC》報導，儘管美國與伊朗達成為期兩周的停火協議，但荷姆茲海峽實際上仍未恢復正常通行，市場逐漸意識到航運受限情況未解，帶動油價再度走高。美國西德州原油期貨周四 (9 日) 盤中上漲逾 6%，重返每桶 100 美元上方，布蘭,https://m.cnyes.com/news/id/6414393
687,6414229,〈美股早盤〉美伊停火疑慮推升油價 主要指數走低,美股主要指數周四 (9 日) 開盤走低，延續前一交易日反彈後的整理走勢，市場聚焦美伊停火協議出現裂痕，雙方互控違反協議，引發油價反彈並壓抑股市表現。,https://m.cnyes.com/news/id/6414229
688,6414337,傳伊朗限制荷姆茲海峽通行 每日最多15艘船舶,俄羅斯官媒《塔斯社》(TASS) 周四 (9 日) 引述一名伊朗高層消息人士指出，伊朗在與美國達成停火協議後，將限制每日通過荷姆茲海峽的船舶數量，最多僅允許 15 艘船隻通行，顯示該戰略水道雖未完全關閉，但仍維持高度管制。,https://m.cnyes.com/news/id/6414337
689,6414334,美國經濟降溫！去年Q4經濟成長再下修至0.5%,美國商務部周四 (9 日) 公布最新數據顯示，去年第四季國內生產毛額 (GDP) 季增年率終值報 0.5%，低於市場預期與前值 0.7%，反映該季經濟動能比先前預估的更為疲弱。,https://m.cnyes.com/news/id/6414334
690,6414236,看好硬體突破及AI轉型 美股散戶重新擁抱蘋果股票,根據最新的市場數據顯示，散戶投資人正重新燃起對蘋果公司 (AAPL-US) 的投資熱情，並開始將資金從輝達 (NVDA-US) 等其他大型科技股，轉向這家老牌科技巨頭。,https://m.cnyes.com/news/id/6414236
691,6414332,通膨壓力未解！美國2月PCE難降溫 Fed降息空間受限,美國 2 月通膨與消費數據顯示，在伊朗戰事爆發前，物價壓力已居高不下，而消費動能則逐漸轉弱。隨著能源價格因中東局勢升溫而上揚，市場預期通膨壓力將在 3 月進一步加劇，聯準會 (Fed) 降息空間也隨之受到壓縮。,https://m.cnyes.com/news/id/6414332
692,6414329,營收速報  - 中工(2515)3月營收19.47億元年增率高達30.17％,"2026年3月中工(2515-TW) 營收年增成長30.17% , 盤後股價為13.25元",https://m.cnyes.com/news/id/6414329
693,6414244,AI算力大單來了！Meta豪砸210億美元與CoreWeave簽約,綜合外媒周四 (9 日) 報導，人工智慧 (AI) 雲端運算業者 CoreWeave(CRWV-US)宣布，已與 Meta Platforms(META-US)達成總額約 210 億美元的長期合作協議，將提供雲端算力支援至 2032 年，進一,https://m.cnyes.com/news/id/6414244
694,6414291,和椿3月及Q1營收雙創新高 受惠AI整合旗下機器人產品喜迎需求爆發,和椿科技 (6215-TW) 今 (9) 日公告今 (2026) 年 3 月營收 3.1 億元、月增 51.22%、年增 48.55%，累計今年首季合併營收為 7.73 億元、年增 58.7%，3 月份及第 1 季合併營收，雙雙創下和椿史上同期新高。,https://m.cnyes.com/news/id/6414291
695,6413442,GPT-4o「靈魂」背後的架構師、OpenAI女神宣布離職,人工智慧領軍企業 OpenAI 再次迎來核心人才流失的重大震盪。被社群譽為「GPT-4o 之母」的 OpenAI 模型行為 (Model Behavior) 創始負責人、OpenAI Labs 總經理 Joanne Jang,https://m.cnyes.com/news/id/6413442
696,6414252,中東戰事擾台股3月跌掉3691點 這19檔ETF強勢填息,近日美伊戰爭停火好消息激勵台股再度向歷史高點挺進，不過，檢視 3 月台股走勢大幅震盪，大盤單月下跌逾一成,https://m.cnyes.com/news/id/6414252
697,6414309,鉅亨速報 - Factset 最新調查：雪佛龍(CVX-US)EPS預估上修至9.46元，預估目標價為212.00元,FactSet 最新調查：雪佛龍(CVX-US)EPS預估上修，預估EPS、預估營收、目標價、歷史獲利表現、即時新聞資訊,https://m.cnyes.com/news/id/6414309
698,6414302,鉅亨速報 - Factset 最新調查：思愛普 ADRSAP-US的目標價調升至298元，幅度約4.2%,FactSet 最新調查：思愛普 ADRSAP-US目標價調升，最高估值、最低估值、中位數、綜合評級、近5日股價、標普、即時新聞資訊,https://m.cnyes.com/news/id/6414302
699,6414260,外資買超317億元 捧場加碼友達13萬張 賣超前4檔都是記憶體股,"美伊雖達成短期停火協議，但荷姆茲海峽仍未解封狀況下，能源供應與經濟安全面臨嚴峻挑戰，終場上漲 99.78 點，收 34,861 點，成交量為 8,442 億元與昨日持平。三大法人同步買超 394.36 億元，外資買超 317.79 億元。",https://m.cnyes.com/news/id/6414260
700,6414246,能源與外交角力！中國從旁觀到介入 美伊停火背後的權力轉移,在美伊戰事持續升溫之際，中國被指在關鍵時刻出手，協助推動停火進程，凸顯北京在中東局勢中的影響力升溫。隨著美國總統川普設定的停火期限逼近，市場逐漸意識到，能夠對伊朗施加實質影響的國家，正是美國最大戰略競爭對手——中國。,https://m.cnyes.com/news/id/6414246
701,6413089,標普500重返關鍵「雙均線」罕見多頭訊號浮現,標普 500 指數一舉重返 50 日與 200 日移動平均線之上，釋出市場罕見的技術面訊號,https://m.cnyes.com/news/id/6413089
702,6414251,威力德實驗室資訊系統效益顯現 3月營收1.02億元創新高,威力德 (7713-TW) 今 (9) 日公告 3 月營收 1.02 億元，累計今年第一季營收 2.79 億元，3 月營收分別創單月新高紀錄。威力德指出，受惠去年下半年導入的實驗室資訊系統 (LIS) 效益逐步發酵，推升營收表現。 ,https://m.cnyes.com/news/id/6414251
703,6414032,泰國央行維持低利率以抗中東衝突衝擊 經濟成長預測下修至1.3%,面對中東衝突引發的通膨加速及全球貿易緊張局勢，泰國央行總裁維泰 (Vitai Ratanakorn) 周四 (9 日) 表示，央行將盡可能長時間地將利率維持在現行水準，以支持國家經濟發展。,https://m.cnyes.com/news/id/6414032
704,6414243,1785家已公告股利 平均殖利率3.8% 37家配息「從無到有」記憶體族群佔大宗,時序進入 4 月，台股企業股利政策進入密集揭露期，年度除權息行情正式啟動。統計顯示，全台 1947 家上市櫃公司中，已有 1785 家完成股利公告，宣告比例高達 91.7%，整體配息輪廓已趨明朗。即使台股過去一年漲幅顯著，已公告公司的,https://m.cnyes.com/news/id/6414243
705,6414245,藥華藥斥資11.5億元 收購加拿大合作夥伴FORUS 100%股權,藥華藥 (6446-TW) 今 (9) 日宣布，董事會決議以加幣 5000 萬元 (約新台幣 11.5 億元) 收購加拿大藥廠 FORUS 100% 股權，進一步鞏固並拓展加拿大市場。 ,https://m.cnyes.com/news/id/6414245
706,6414210,彰銀Q1賺52.21億元創新高 EPS 0.44元 獲利3本柱皆雙位數成長,公股彰化銀行 (2801-TW) 今（9）日搶先公布 115 年 3 月份自結合併稅前盈餘達 23.01 億元，合併稅後盈餘為 19.55 億元，較上月大幅成長 22.91%；前 3 月稅後盈餘達 52.21 億元，年增 26.27%，單月與累計獲,https://m.cnyes.com/news/id/6414210
707,6414230,荷姆茲海峽要過先報備！伊朗軍方成關鍵門神,《彭博》周四 (9 日) 報導，伊朗對荷姆茲海峽通行條件釋出最新訊號。伊朗外交部副部長哈蒂柏札德 (Saeed Khatibzadeh) 接受英國《ITV》訪問時表示，油輪及其他船隻若要通過荷姆茲海峽，必須事先與伊朗軍方聯繫並取得,https://m.cnyes.com/news/id/6414230
708,6414198,路透：特斯拉正研發全新平價小型SUV 以求擴大市場,據《路透》引述多位知情人士的消息指出，特斯拉 (TSLA-US) 目前正致力於開發一款全新、體型更小且售價更低廉的電動小型 SUV。這款代號尚未公開的車型，將是一部全新的車輛，而非現有 Model 3 或 Model Y 的,https://m.cnyes.com/news/id/6414198
709,6414225,歐亞部分港口壅塞 萬海證實實施兩波漲價,歐亞部分港口壅塞 萬海證實實施兩波漲價,https://m.cnyes.com/news/id/6414225
710,6414228,大東電受惠標案持續入帳 Q1營收18.62億元創單季高,大東電 (1623-TW) 今 (9) 日公告 3 月營收 6.46 億元，第一季營收 18.62 億元，3 月及第一季營收刷新單月、單季新高紀錄，且連續 7 季創高。大東電指出，第一季受惠標案持續入帳，推升營收表現。 ,https://m.cnyes.com/news/id/6414228
711,6414171,上市櫃2025稅前賺5.75兆元創新高 僅永冠-KY年報難產最快11/18下市,金管會今 (9) 日公布，2025 年上市櫃公司累計稅前盈餘新台幣 5 兆 7515 億元，創下歷史新高紀錄，應申報財報家數為 1951 家，僅第一上市公司永冠 - KY(1589-TW) 未如期出具 2025 年財務報告,https://m.cnyes.com/news/id/6414171
712,6414170,保瑞胃食道逆流學名藥重啟拉貨 3月營收回溫達15億元,保瑞 (6472-TW) 今 (9) 日公告 3 月營收 15.28 億元，年月雙成長。保瑞指出，受惠旗下胃食道逆流學名藥 DLS 重啟拉貨，帶動整體出貨量回升，推升 3 月營收回溫。,https://m.cnyes.com/news/id/6414170
713,6414169,廣越3月營收創同期高 Q2逐步邁入出貨旺季營運升溫,廣越 3 月營收創同期高 Q2 逐步邁入出貨旺季營運升溫,https://m.cnyes.com/news/id/6414169
714,6413153,斡旋美伊獲各方讚賞 為什麼這次巴基斯坦當調停人？,,https://m.cnyes.com/news/id/6413153
715,6413450,停火協議脆弱 伊朗準備「長期戰爭」 荷姆茲海峽封鎖持續,儘管美國與伊朗達成短期停火協議，但中東局勢依然高度緊張。當地時間周四 (9 日)，伊朗軍方公開表示已做好「長期戰爭」的準備，同時至關重要的荷姆茲海峽 (Strait of Hormuz) 仍處於實質封鎖狀態，全球能源供應與經濟安,https://m.cnyes.com/news/id/6413450
716,6414164,竣邦首季營收創同期高 Q2新專案預陸續放量,竣邦首季營收創同期高 Q2 新專案預陸續放量,https://m.cnyes.com/news/id/6414164
717,6414163,朗齊生醫*聚焦代謝疾病新藥 年底向美國FDA提出IND申請,朗齊生醫 *(6876-TW) 董事長王繼賢今 (9) 日指出，公司將代謝疾病產品 LXP103 作為主軸，根據最新動物實驗結果，具整體減重及局部減脂的雙重調控，預計年底前向美國 FDA 提出 IND 申請。,https://m.cnyes.com/news/id/6414163
718,6414033,軟板廠圓裕首季營收5.77億元較去年同期略減3.77%,軟板廠圓裕 (6835-TW) 今 (9) 日公布最新營收，3 月營收 2.13 億元，月增 48.92%，年減 2.25%，首季營收接近去年同期表現；累計 1-3 月營收 5.77 億元，較去年同期略減 3.77%。,https://m.cnyes.com/news/id/6414033
719,6414029,〈車用電子展〉360°MOBILITY Mega Shows 4/14三展合一登場 展會聚焦AI與氫能技術兩亮點,「360° MOBILITY Mega Shows」將於本 (4) 月 14 日至 17 日在南港展覽館盛大登場，本展整合「台北國際汽機車零配件展」及「台灣國際智慧移動展」，「台北國際車用電子展」同場三展聯合舉行。,https://m.cnyes.com/news/id/6414029
720,6414009,鮮蛋及年節禮盒熱銷 大武山Q1營收5.61億元再創單季新高,大武山 (6952-TW) 今 (9) 日公布最新營收資訊，大武山 2026 年 3 月營收為 1.94 億元，月增 15.93%，年增 63.85%，2026 年首季營收 5.61 億元，再創單季新高，主要受惠旗下牧場鮮蛋出貨量持續提升，蛋價回穩。,https://m.cnyes.com/news/id/6414009
721,6414007,【量大強漲股整理】櫃買指數創下波段新高，下周的主流股已呼之欲出?,,https://m.cnyes.com/news/id/6414007
722,6413975,ABF 產業推手 載板大廠濕製程供應商敍豐明開上櫃前業績發表會,高階 ABF 載板濕製程設備商敍豐 (3485-TW)），預計於 5 月上旬掛牌上櫃，將於明 (10) 日舉辦上櫃前業績發表會，敍豐本次上櫃案由富邦證券擔任主辦承銷商。 敍豐今天在興櫃的最後成交價爲 248.5 元。,https://m.cnyes.com/news/id/6413975
723,6412478,債市難回戰前水位！能源價格高燒不退 專家：低利率時代已成往事,,https://m.cnyes.com/news/id/6412478
724,6413965,〈渣打投資展望〉Q2維持「股優於債」調升日、台股評等 美債4.25%現鎖利契機,渣打銀行發布 2026 年第二季全球資產配置建議，近期股市的修正主要是「評價面修正」，雖然地緣政治與通膨變數仍存，但企業獲利韌性極強，特別是科技與半導體產業。,https://m.cnyes.com/news/id/6413965
725,6413246,〈渣打投資展望〉估高油價僵局3至4周內緩解 調高黃金目標價至5750美元,美伊停戰 2 周，全球股市展開強彈，費半指數更是再創歷史新高，渣打銀行首席投資辦公室 (CIO) 發布今年第二季全球投資展望指出，目前市場震盪更多來自於恐懼，而非基本面的崩壞，預估中東衝突屬短暫性質,https://m.cnyes.com/news/id/6413246
726,6413969,不要浪費每一次的拉回、旺宏、臻鼎、大銀微⊕、聯茂⊕,,https://m.cnyes.com/news/id/6413969
727,6413262,美伊衝突重塑全球能源版圖 德銀：中國成新興能源競賽最大贏家,隨著美伊衝突為全球石油與天然氣市場注入極端的波動性，全球各國正展開一場確保能源安全的競賽。德意志銀行 (Deutsche Bank) 私人銀行部門新興市場投資長 Jacky Tang 指出，在這場地緣政治動盪引發的能源結構轉,https://m.cnyes.com/news/id/6413262
728,6413921,玉晶光首季營收61.4億元年增15.39%  Q2進入新舊機種交替期,蘋果供應鏈光學元件廠玉晶光 (3406-TW) 今 (9) 日公布最新營收資訊，2026 年 3 月營收 21.64 億元，月增 48.1%，年增 14.32%；2026 年首季營收 61.4 億元，季減 14.14%，年增 15.39%。,https://m.cnyes.com/news/id/6413921
729,6413673,中鋼串聯國內大廠 建構台灣自主機器人動力系統供應鏈,中鋼串聯國內業者 建構台灣自主機器人動力系統供應鏈,https://m.cnyes.com/news/id/6413673
730,6413675,LEO市場需求續放量 昇達科首季營收10.2億元年增逾64%,昇達科今天公布最新營收資訊，2026 年 3 月營收 3.29 億元，月增 2.11%，年增 36.25%，2026 年首季營收 10.2 億元，延續去年第四季以來的強勁動能，季增 2.25%，年增 64.25%。,https://m.cnyes.com/news/id/6413675
731,6413536,華碩伺服器與筆電雙動能發威 三月、Q1營收同創新高,PC 品牌華碩 (2357-TW) 今 (9) 日公布 3 月營收，集團營收為 860.84 億元，月增 58.38%、年增 33.85%，創單月歷史新高紀錄，華碩表示，本期營收走強，主要受益於伺服器、PC 的營收成長。,https://m.cnyes.com/news/id/6413536
732,6413920,櫃買創高揭示多頭延續，聰明錢開始卡位潛力黑馬股,,https://m.cnyes.com/news/id/6413920
733,6413676,鉅亨投資雷達》基金、ETF怎麼選？主動式與被動式差別、費用與優缺全解析,,https://m.cnyes.com/news/id/6413676
734,6413670,銷美關稅仍高 東陽穩步推進台美兩大擴廠計畫,銷美關稅仍高 東陽穩步推進台美兩大擴廠計畫,https://m.cnyes.com/news/id/6413670
735,6413429,〈港股盤後〉科網與汽車股領跌 恒生科技指數挫逾2% 地產股下挫,港股市場周四 (9 日) 主要指數集體走低，截至收盤，恒生指數下跌 0.54%，報 25752.40 點；國企指數下跌 0.75%，報 8611.83 點；恒生科技指數跌 2.06%，收於 4821.67 點。大市全日成交額約為 2449.8 億港,https://m.cnyes.com/news/id/6413429
736,6413426,世界黃金協會：金價早期企穩跡象出現 但須警惕油價長期維持在100美元之上,,https://m.cnyes.com/news/id/6413426
737,6413669,AI驅動綠電成長 天能綠電Q1營收7.22億元創新高,雲豹能源 (6869-TW) 旗下售電子公司天能綠電 (7842-TW) 將於今年 5 月掛牌上櫃，今 (9) 日公布 3 月營收 2.96 億元，創下歷史新高，月增 37%，年增 88.5%；累計第一季營收 7.22 億元，年成長 86.9%，刷新單季,https://m.cnyes.com/news/id/6413669
738,6413533,〈台幣〉主要亞幣中相對強 貶轉升收在31.748元,〈台幣〉主要亞幣中相對強 貶轉升收在 31.748 元,https://m.cnyes.com/news/id/6413533
739,6413523,Moxa串列設備伺服器率先取得IEC 62443-4-2認證 樹立邊緣連結安全新標竿,工業網通廠四零四科技（Moxa）宣布其網路安全產品屢獲殊榮後，再度達成一項指標性里程碑。Moxa NPort 6000-G2 系列是全球首款通過 IEC 62443-4-2 安全等級 2（SL2）認證的串列設備伺服器，該產,https://m.cnyes.com/news/id/6413523
740,6413522,台達電3月營收597.8億元創歷史新高 Q1創單季次高,台達電 3 月營收 597.8 億元創歷史新高 Q1 創單季次高,https://m.cnyes.com/news/id/6413522
741,6413509,倚天酷碁投資美國電腦周邊品牌Plugable 布局AI應用市場,宏碁子公司倚天酷碁 (2432-TW) 今 (9) 日宣布已於 4/1 正式完成與美國電腦周邊品牌 Plugable Technologies 之投資簽約，雙方將深化合作，聚焦高效能連接與擴充解決方案，並共同拓展 AI 運算與新世代數位工作,https://m.cnyes.com/news/id/6413509
742,6413432,彭双浪：富采整頓告終身輕如燕  2026將迎Micro LED 顯著成長,富采 (3714-TW) 於 4/8-4/10 參加 Touch Taiwan 2026，董事長彭双浪強調公司已完成組織整頓並轉化為零負債且淨現金的健康體質，富采並將資源全面聚焦於「三加一」策略。這項策略涵蓋先進顯示、感測、車用,https://m.cnyes.com/news/id/6413432
743,6413449,綠茵3月營收9938萬元年增20%改寫歷年次高 潭子新廠明年量產,國際生技保健食品原料研發生產大廠綠茵 (6846-TW) 公布最新營收 2026 年 3 月營收 9938 萬元，月增 1.32 倍，年成長 20.48%，創歷年同期新高，也是單月歷史次高；累計 2026 年 1-3 月營收 1.98 億元。,https://m.cnyes.com/news/id/6413449
744,6413508,國際社會強烈譴責以色列空襲黎巴嫩 警告美伊停火協議面臨威脅,以色列對黎巴嫩境內超過 100 個真主黨指揮中心與軍事據點發動大規模空襲，引發國際社會高度關注與譴責。各國領袖周四 (9 日) 紛紛警告，此舉不僅造成嚴重傷亡，更可能使脆弱的美伊停火協議毀於一旦。,https://m.cnyes.com/news/id/6413508
745,6413448,以色列襲擊貝魯特 真主黨領袖秘書遭擊斃 以軍澄清非卡西姆本人,黎巴嫩與以色列邊境衝突持續升溫。根據以色列軍方周四 (9 日) 發布的聲明，以軍在昨日對貝魯特地區的空襲中，擊斃了黎巴嫩真主黨 (Hezbollah) 領袖納卡西姆 (Naim Qassem) 的親信顧問兼私人秘書。,https://m.cnyes.com/news/id/6413448
746,6411954,〈陸股盤後〉美國澄清從未承諾黎巴嫩停戰 三大指數下跌,中國 A 股三大指數周四（9 日）同步走低，美國副總統范斯周三澄清，美國從未承諾將黎巴嫩納入停火協議，如果伊朗因此而談判破裂，那是他們的選擇。,https://m.cnyes.com/news/id/6411954
747,6413143,川普戰略破局、盟友信任瓦解 學者憂中俄影響力趁勢崛起,隨著由巴基斯坦主導斡旋的伊朗兩周停火協議於近日生效，美國對伊朗的戰爭暫告中止。然而，這場衝突的結果並未如美國總統川普預期的那樣展現「贏學」，反倒引發歐洲與中東盟友的深度疑慮。多位專家質疑，川普針對德黑蘭的軍事行動，不僅未,https://m.cnyes.com/news/id/6413143
748,6413427,漢測強攻矽光子測試設備 專責團隊服務美系大廠,半導體測試介面與設備廠漢測 (7856-TW) 今 (9) 日召開法說會，外界關注矽光子測試設備進展，總經理王子建指出，公司已攜手合作夥伴，啟動相關設備研發與驗證，並組建專責團隊服務客戶，可用於矽光子測試階段的 Insertion,https://m.cnyes.com/news/id/6413427
749,6413428,〈電子五哥營收〉仁寶Q1營收重返2000億元 預期Q2 AI伺服器維持倍數成長,仁寶 (2324-TW) 今 (9) 日公告 3 月營收 891.98 億元，第一季營收達 2013.04 億元，年對年、季對季皆成長。仁寶經營層表示，伺服器仍為重要成長動能，並看好第二季出貨倍數成長。 ,https://m.cnyes.com/news/id/6413428
750,6411634,美伊停火兩週 為何油價跌勢沒有更劇烈？,《巴隆周刊》 報導，美伊停火協議生效，國際油價應聲重挫。不過，在供應仍未完全恢復、地緣政治風險尚未消散的情況下，油價跌勢仍顯克制。,https://m.cnyes.com/news/id/6411634
751,6413350,樺漢3月、Q1營收創同期高 B/B Ratio維持高水位,樺漢 3 月、Q1 營收創同期高 B/B Ratio 維持高水位,https://m.cnyes.com/news/id/6413350
752,6413339,默克材料與設備雙軸布局 助攻顯示技術轉型,默克今年參與 Touch Taiwan 2026，公司指出，集團立足於顯示、光學與半導體技術的交匯處，默克帶來創新液晶顯示材料、光阻技術，以及應用於先進封裝的量測與檢測等整合解決方案，充分展現其持續驅動產業升級與創新的關鍵,https://m.cnyes.com/news/id/6413339
753,6413280,預測市場爆疑似內線交易？多個新帳戶在川普宣布美伊停火前精準豪賭獲利,在美國總統川普周二 (7 日) 正式宣布與伊朗達成停火協議前的關鍵數小時內，去中心化預測平台 Polymarket 出現了一系列異常且精準的投注行為。數據顯示，多個剛成立的新帳戶在公眾普遍預期衝突升級之際，豪擲重金押注當天「,https://m.cnyes.com/news/id/6413280
754,6413270,AI及矽光子需求旺 閎康3月營收5.38億元創單月新高,半導體檢測大廠閎康 (3587-TW) 今 (9) 日公布 3 月營收 5.38 億元，月增 24.73%，年增 21.27%，累計第一季營收 14.24 億元，季減 3.37%，年成長 15.03%。受惠 AI 晶片及矽光子開發需求帶動，材料分析(M,https://m.cnyes.com/news/id/6413270
755,6413277,聯發國際3月營收創單月次高 UG台美兩地強力展店,聯發國際 3 月營收創單月次高 UG 台美兩地強力展店,https://m.cnyes.com/news/id/6413277
756,6413267,〈智慧顯示展〉虹彩光電董座：訂單陸續放量 Q3登興櫃、明年拚IPO,膽固醇液晶 (ChLCD) 電子紙業者虹彩光電董事長廖奇璋今 (9) 日表示，今年多個概念驗證 (POC) 案子陸續放量，公司也預計第三季公發登興櫃，並計畫明年 IPO，可能上櫃或上市創新版。,https://m.cnyes.com/news/id/6413267
757,6413276,談判恐告吹？伊朗大使刪除伊朗代表團9日晚間抵達巴基斯坦的貼文,,https://m.cnyes.com/news/id/6413276
758,6413238,高盛：若荷姆茲海峽重啟延後 布蘭特原油下半年恐站穩100美元,,https://m.cnyes.com/news/id/6413238
759,6413264,拒當停火棋子？以色列成美伊談判最大變數,,https://m.cnyes.com/news/id/6413264
760,6413245,中東衝突引發能源危機 日本3月消費者信心創疫情以來最大跌幅,根據日本內閣府發布的最新報告，受到伊朗戰爭爆發及中東局勢持續惡化的影響，日本 3 月份的消費者信心出現自新冠疫情初期以來的最大跌幅。,https://m.cnyes.com/news/id/6413245
761,6413340,營收速報  - 國票金(2889)3月營收7.79億元年增率高達50.36％,"2026年3月國票金(2889-TW) 營收年增成長50.36% , 盤後股價為15.25元",https://m.cnyes.com/news/id/6413340
762,6413322,營收速報  - 台達電(2308)3月營收597.80億元年增率高達37.6％,"2026年3月台達電(2308-TW) 營收年增成長37.6% , 盤後股價為1645元",https://m.cnyes.com/news/id/6413322
763,6413266,〈房產〉房貸族平均背貸近27年  新青安後「30年還款」成購屋新常態,買房背債越來越久。根據內政部最新統計，2025 年第三季全國平均房貸達 26.75 年再創新高。信義房屋 (9940-TW) 分析，新青安政策上路後，30 年期房貸加速普及，加上房價居高不下，新世代傾向延長還款年限、保留現金投資。,https://m.cnyes.com/news/id/6413266
764,6413265,三年4度訪中超罕見！西班牙首相深化對華政策 瞄準三大貿易重頭戲,,https://m.cnyes.com/news/id/6413265
765,6413235,周六是關鍵！美媒：川普要求盟友數日內必須提交具體的荷姆茲海峽護航方案,,https://m.cnyes.com/news/id/6413235
766,6413259,餐飲市況3月淡季不淡 王品Q1營收改寫新高紀錄,餐飲市況 3 月淡季不淡 王品 Q1 營收改寫新高紀錄,https://m.cnyes.com/news/id/6413259
