,newsId,title,summary,link
975,6161152,美中熱線！川普稱APEC將見習近平 未來各自規劃互訪,美國總統川普周五 (19 日) 表示，他與中國國家主席習近平進行了一場「非常有成效」的通話，雙方在多項重要議題上取得進展，包括貿易、TikTok 交易、芬太尼問題以及俄烏戰爭。川普並透露，兩人已同意於南韓舉行的亞太經合會,https://m.cnyes.com/news/id/6161152
976,6161036,達利歐示警：美債危機恐威脅貨幣秩序 甚至終結美國霸權,據《彭博》周五 (19 日) 報導，有「鱷王」之稱的美國橋水基金 (Bridgewater Associates) 創辦人達利歐 (Ray Dalio) 警告，美國無法削減失控的支出，債務不斷攀升正威脅貨幣秩序，甚至可能終結整個美國霸,https://m.cnyes.com/news/id/6161036
977,6161140,川習通話！習近平：中方在TikTok問題上立場清楚,中國國家主席習近平周五（19 日）晚間同美國總統川普通話，就當前中美關係和共同關心的問題坦誠深入交換意見，就下階段中美關係穩定發展作出戰略指引，通話務實、積極、具建設性。,https://m.cnyes.com/news/id/6161140
978,6161115,蘋果小心了！OpenAI大舉挖角人才+搶供應鏈硬體野心曝光,據《The Information》周五 (19 日) 援引知情人士消息報導，OpenAI 正加速進軍人工智慧 (AI) 硬體領域，並與蘋果 (AAPL-US) 供應鏈密切合作。蘋果裝置代工廠立訊精密 (002475-CN) 已獲得至少一款,https://m.cnyes.com/news/id/6161115
979,6161136,普丁透露烏克蘭戰爭前線俄軍人數：超過70萬,據《今日俄羅斯》報導，俄羅斯總統普丁周四（18 日）透露，目前超過 70 萬俄羅斯士兵在烏克蘭戰爭前線作戰。,https://m.cnyes.com/news/id/6161136
980,6161113,庫克：iPhone漲價與川普關稅無關,《CNBC》報導，蘋果 (AAPL-US) 執行長庫克 (Tim Cook) 周五 (19 日) 在紐約第五大道門市表示，iPhone 機型漲價與川普關稅無關，並透露公司已調整供應鏈，從印度、越南等低關稅國家進口 iPhone 到美國。,https://m.cnyes.com/news/id/6161113
981,6161098,快手出事了！電商直播被中國官方盯上,根據《央視》周五 (19 日) 報導，中國市監總局對短影音平台快手 (01024-HK) 的電商直播業務展開調查，外界認為這可能對近年積極拓展線上零售的快手構成挑戰。,https://m.cnyes.com/news/id/6161098
982,6160458,創辦人強勢回歸 Opendoor啟動鐵腕改革 股價飆升後挑戰仍在,美國房地產科技龍頭 Opendoor (OPEN-US) 近期上演了一場引人注目的領導層大洗牌，不僅任命了 Shopify 前營運長 Kaz Nejatian 為新任執行長，兩位聯合創辦人 Keith Rabois 與 E,https://m.cnyes.com/news/id/6160458
983,6161061,SEC主席：投資人看法說會比季報更重要  擬開放企業自選報告頻率,美國證券交易委員會 (SEC) 主席阿特金斯（Paul Atkins）周五 (19 日) 表示，將推進計畫，全面檢討上市公司投資人資訊揭露規則，響應美國總統川普周一將企業季報改為半年報的呼籲。,https://m.cnyes.com/news/id/6161061
984,6160962,〈美股早盤〉Fed降息推升風險偏好 主要指數延續漲勢,美股主要指數周五 (19 日) 延續漲勢，主要指數持穩在歷史高點，標普 500 在自 4 月低點反彈近 15 兆美元後續創新紀錄。聯準會 (Fed) 啟動降息循環，市場押注企業獲利前景改善，激勵投資人持續進場。聯邦快遞 (FedEx) 公布優於預,https://m.cnyes.com/news/id/6160962
985,6160456,北京將成第二個GDP五兆人民幣城市 引領中國城市經濟新格局,根據近日一場主題發布會上的消息，北京的中國生產毛額 (GDP) 預計將在「十四五」規劃收官的 2025 年末，站上 5 兆人民幣的台階。繼上海之後，北京將成為全國第二個達到此經濟體量的城市，進一步拉開與深圳、廣州、香港等城市的差距。,https://m.cnyes.com/news/id/6160456
986,6161005,Apple Watch Series 11上市！戴手錶也能提醒血壓異常,蘋果 (AAPL-US) 周五 (19 日) 開賣的 Apple Watch Series 11，新增一項利用人工智慧 (AI) 開發的血壓通知功能，能提醒用戶可能存在高血壓風險。不同於傳統的血壓計測量，這項功能並非直接,https://m.cnyes.com/news/id/6161005
987,6160901,創新藥企勁方醫藥上市首日飆漲110% 獲3000億資金追捧,港股迎來今年第 11 家上市的創新藥公司，由海歸科學家創辦的勁方醫藥 (02595-HK) 周五 (19 日) 正式掛牌，引發市場熱烈追捧。該公司上市首日漲幅接近 110%，市值逼近 150 億港元。,https://m.cnyes.com/news/id/6160901
988,6160858,法國爆發全國性大罷工 逾50萬人上街抗議政府預算削減,法國周四 (18 日) 爆發大規模罷工與示威活動，數十萬民眾走上巴黎、里昂、馬賽等各大城市街頭。這次由十多個工會聯合發起的行動，旨在向新任總理勒科爾尼 (Sébastien Lecornu) 施壓，要求政府撤回為解決高額國債而提出,https://m.cnyes.com/news/id/6160858
989,6160963,AirPods Pro 3來了！蘋果「小改款」背後的大升級,蘋果 (AAPL-US) 最新推出的第三代 AirPods Pro 耳機，雖然外觀延續熟悉的白色柄狀設計，但內在升級幅度不小。新款耳機在心率偵測、主動降噪、音質、耐用性、麥克風效能等多方面全面強化，並新增即時語音翻譯功能，售價維,https://m.cnyes.com/news/id/6160963
990,6161012,賣台積電獲利出場後 皇翔再出手砸4.79億元改買進545張台達電,皇翔在 12 日公告完成處分台積電持股 410 張，賺 7241 萬元出場，每股貢獻 0.19 元。而皇翔今天公告再出手砸 4.795 億元買進 545 張台達電 (2308-TW)，平均每股成本爲 879.92 元。,https://m.cnyes.com/news/id/6161012
991,6160857,中國半導體產業迎政策利多 IC China 2025將於11月登場,在全球半導體產業於 2025 年上半年強勢復甦的背景下，由中國半導體行業協會與中國電子信息產業發展研究院聯合主辦的第二十二屆中國國際半導體博覽會（IC China 2025），已排定於 2025 年 11 月 23 日至 25 日在北京舉行,https://m.cnyes.com/news/id/6160857
992,6160964,Fed鴿派聲音加強 卡什卡里力挺連續降息至年底,美國明尼阿波利斯聯邦準備銀行總裁卡什卡里 (Neel Kashkari) 周五 (19 日) 表示，他支持本周聯準會 (Fed) 小幅降息的決定，並認為在今年剩下的兩次會議上，各再降息 1 碼 (25 個基點) 將是適當做法，以因應就業市場惡化,https://m.cnyes.com/news/id/6160964
993,6160992,傳川普暫停對台軍售4億美元  總統府：台美合作持續進行,外傳川普為了與中國習近平達成貿易協議，今年夏天將暫停一項超過美元 4 億元 (約新台幣 120 億元) 的對台軍援。對此，總統府發言人郭雅慧今 (19) 日表示，包括國防在內，台灣與美國在各項安全議題上都有緊密合作。,https://m.cnyes.com/news/id/6160992
994,6160446,華為官宣反擊輝達：系統級創新要引爆中國算力「大逆轉」時代,據陸媒《上海證券報》報導，本周的全聯接大會上，華為宣布超節點再升級，「超節點集群」正式亮相，算力規模可達百萬卡。這不僅是華為自身算力版圖的重要突破，也預示著全球 AI 算力基礎設施進入一個全新的時代。,https://m.cnyes.com/news/id/6160446
995,6160970,台股自歷史高點拉回近300點 外資轉賣157億元 反手大買台泥14萬張,台股今 (19) 日創 25864 點歷史新高後拉回 286 點，終場下跌 190.99 點收 25578.37 點，外資有買轉賣，賣超 157 億元，賣超台積電 8573 張、提款近 109 億元；反手大買台泥 14 萬張，並,https://m.cnyes.com/news/id/6160970
996,6160961,iPhone 17系列開賣首日 電信熱銷機型、資費出爐,蘋果 (AAPL-US)iPhone 17 系列今 (19) 日正式開賣，電信三雄中華電信 (2412-TW)、台灣大 (3045-TW) 及遠傳 (4904-TW) 也公布 iPhone 17 系列熱銷機款及資費方案。,https://m.cnyes.com/news/id/6160961
997,6160965,〈電價調漲〉工商協進會：肯定電價凍漲 但憂心民生負擔加劇、盼政府審慎能源規劃,平均電價調漲 0.71％，產業用電維持不變、民生用電小幅調漲。對此，工商協進會晚間表示，肯定審議會考量企業營運壓力，決議產業不調整，但電價調漲仍將直接影響民生用戶與小商家，造成物價上漲壓力，盼政府能審慎規劃能源轉型調整。,https://m.cnyes.com/news/id/6160965
998,6160934,OTC：漢田生技9/22起得為融資融券交易,OTC 今 (19) 日公布，在 去年 9 月 26 日上櫃掛牌的液態軟袋一站式代工廠漢田 (1294-TW)，符合相關規定，將自下周一 9 月 22 日起得為融資融券交易。,https://m.cnyes.com/news/id/6160934
999,6160932,輝達宣布斥20億英鎊 投資英國5家AI新創,輝達 (NVDA-US) 今 (19) 日宣布，將在英國市場投資 20 億英鎊，以催化該國的 AI 新創生態系，並規模化發展下一代具全球影響力的 AI 企業，投資對象包括 Accel、Air Street Capital、Bal,https://m.cnyes.com/news/id/6160932
1000,6160931,力積電、旺宏公布8月自結 每股各虧0.11元、0.19元,晶圓代工廠力積電 (6770-TW) 與記憶體廠旺宏 (2337-TW) 今 (19) 日皆公告 8 月自結，兩家營運目前仍呈現虧損，力積電 8 月每股虧損 0.11 元，旺宏 8 月每股虧損 0.19 元。,https://m.cnyes.com/news/id/6160931
1001,6160968,輝達入股英特爾 亞洲晶片廠利弊交織,根據《路透》周五 (19 日) 報導，全球最具市值的晶片大廠輝達 (NVDA-US) 宣布將斥資 50 億美元入股昔日對手英特爾 (INTC-US)，取得約 4% 的股份，並攜手開發個人電腦與資料中心晶片。這項交易震撼半導體產業，對台灣台積,https://m.cnyes.com/news/id/6160968
1002,6160930,崴寶精密IPO案再過一關 上櫃案今獲OTC董監聯席會通過,崴寶精密科技 (7744-TW) 上櫃案再過一關，今 (19) 日獲證券櫃檯買賣中心董事監察人聯席會通過， 依法人推估排程，崴寶精密科技將在今年 11 月底或 12 月初掛牌交易。今天崴寶精密的興櫃最後成交價爲 317 元。,https://m.cnyes.com/news/id/6160930
1003,6160924,〈電價調漲〉產業電價不調整 工商大老們：政府壓電價很貼心 但未解決缺電問題,今 (19) 日下午舉行 10 月份電價審議會，經決議產業電價不調整，維持原先照顧產業等措施，民生電價則微調各級距單價，平均調整約 0.71%。商總理事長許舒博認為，微調可接受，或認為政府很「貼心」，但也有大老認為無解決缺電問題。,https://m.cnyes.com/news/id/6160924
1004,6160445,中國AI晶片國產化吹響號角 美銀：三大趨勢正塑造中國AI產業的未來,在中美科技戰的背景下，中國正全力加速其人工智慧 (AI) 晶片的國產化進程。根據北京與上海等地制定的戰略目標，預計到 2027 年，中國 AI 資料中心所使用的國產晶片比例將提升至 70% 以上，最終目標是全面替換如美國輝達 (NVIDI,https://m.cnyes.com/news/id/6160445
1005,6160897,〈電價調漲〉每年挹注台電64億元！賴建信：台電已轉盈 加計開源節流今年盈餘破百億,經濟部於今 (19) 日召開 114 年度第二次電價費率審議委員會，會後由次長賴建信公布決議結果，強調平均電價調漲係為平衡台電累積虧損、物價穩定與民生用電負擔。此次平均電價調幅為 0.71%，未來每年挹注台電約 64 億元營收，截至今,https://m.cnyes.com/news/id/6160897
1006,6160457,日本央行宣布減持ETF與REITs 朝政策正常化邁出關鍵一步,日本央行在周五 (19 日) 結束的金融政策決策會議上，為其長達十年的大規模刺激計畫列出新的分水嶺，正式宣布將開始出售其持有的龐大 ETF 及不動產投資信託 (REIT)，向政策正常化再邁出關鍵一步。,https://m.cnyes.com/news/id/6160457
1007,6160925,宜進處分廣達1496張獲利1426萬元 提高資金運用效益,宜進處分廣達 1496 張 提高資金運用效益,https://m.cnyes.com/news/id/6160925
1008,6160926,巨有科技擬赴中國設子公司 投資金額50萬美元,ASIC 廠巨有科技 (8227-TW) 今 (19) 日公告，為提供客戶更彈性及完整服務，擬赴中國設立持股 100% 之子公司，投資金額為 50 萬美元，有助巨有科技進一步擴大潛在市場。,https://m.cnyes.com/news/id/6160926
1009,6160377,Figure估值達390億美元 打破全球人形機器人公司紀錄,人形機器人賽道正以前所未有的速度升溫。美國新創公司 Figure 本周宣布，其 C 輪融資已獲得超過 10 億美元的承諾資金，投後估值達到驚人的 390 億美元 (約合新台幣 1.2 兆元)。這不僅打破了全球人形機器人公司的估值紀錄，更使,https://m.cnyes.com/news/id/6160377
1010,6160856,搭AI生成商機 研勤子公司新品牌「台灣視霸FarBarAI」首亮相,搭 AI 生成商機 研勤子公司新品牌「台灣視霸 FarBarAI」首亮相,https://m.cnyes.com/news/id/6160856
1011,6160460,〈房產〉台北市議會舊址地上權案涉詐貸 海悅：爲金毓泰前經營團隊不法行為,司法單位調查指金毓泰於 2017 年至 2020 年間，利用假交易向臺企銀、聯邦銀、兆豐銀等 3 家銀行詐貸逾 5 億元一事；海悅今日澄清指出，這為金毓泰前經營團隊不法行爲，與海悅及旗下子公司完全無涉。,https://m.cnyes.com/news/id/6160460
1012,6160427,降息非轉折點！貝萊德謝宛芝：通膨等不確定性決定降息「節奏」,美國聯準會 （Fed ）於昨 (18) 日重啟今年首度降息，市場對資產配置策略的關注升溫。貝萊德投信董事長謝宛芝今 (19) 日指出，儘管市場普遍預期 2026 年將有多次降息，貝萊德仍持審慎態度，認為通膨壓力與政策不確,https://m.cnyes.com/news/id/6160427
1013,6160855,NVIDIA收購INTEL股份，利空/利多如何解讀?,,https://m.cnyes.com/news/id/6160855
1014,6160389,輝達入股英特爾最大贏家浮現？美銀大幅上調「這檔」目標價,,https://m.cnyes.com/news/id/6160389
1015,6160420,日本央行利率連5凍卻意外宣布拋售ETF 對市場影響幾何？,,https://m.cnyes.com/news/id/6160420
1016,6160443,輝達合作轉向？ 聯發科陳冠州：雙方合作不變、2至3年開花結果,輝達 (NVDA-US) 與英特爾 (INTC-US) 昨日共同宣布攜手開發一系列產品，包括客製化資料中心的 CPU 和 PC 產品，引起外界擔憂衝擊聯發科 (2454-TW)，對此，聯發科總經理暨營運長陳冠州今 (19) 日表示，與輝達的合,https://m.cnyes.com/news/id/6160443
1017,6160444,搶錢行情霸氣把握、被動元件、ABF、矽光子、設備股、軍工股,,https://m.cnyes.com/news/id/6160444
1018,6160438,台亞旗下和亞開發自動化光學對位系統 獲美系AR眼鏡客戶青睞奪千萬級訂單,"台亞 (2340-TW) 旗下興櫃股和亞智慧 (7825-TW) 深耕光學、影像與 AI 領域已久，自主開發的自動化光學對位（Active Alignment, AA）系統獲美系客戶青睞，市場傳出和亞已奪得美系客戶國際訂單，該客戶也",https://m.cnyes.com/news/id/6160438
1019,6160430,〈電價調漲〉荷包縮水！民生用電每度增加0.1-0.4元 小商家小家庭每月多70元、產業電價不變,經濟部今（19）日召開 114 年第 2 次電價費率審議會，針對台電公司財務壓力與電價結構失衡進行討論。審議會決議，產業電價維持不變，延續既有照顧措施；民生電價則微幅調整各級距單價，平均電價調幅為 0.71%，以最小影響方式促進電,https://m.cnyes.com/news/id/6160430
1020,6160435,富時指數9/19大調整！最新成分股、調整時間懶人包,,https://m.cnyes.com/news/id/6160435
1021,6160436,XM 推出全新一站式平台，全方位升級交易體驗,,https://m.cnyes.com/news/id/6160436
1022,6160404,聯準會「風險管理」式降息 華爾街看多美股後市,在股市持續創下歷史新高的背景下，美國聯準會周三 (17 日) 宣布降息 1 碼，並暗示年底前可能還有兩次降息，此舉為市場注入了新的上漲動力。聯準會主席鮑爾 (Jerome Powell) 將這次降息形容為一項「風險管理」措施，旨在為正,https://m.cnyes.com/news/id/6160404
1023,6160428,命中上週產業飆股！記憶體、被動元件接棒衝，下一波漲勢由誰領軍？,,https://m.cnyes.com/news/id/6160428
1024,6160429,原亞太用戶電信合約年底到期 遠傳井琪：目前移轉踴躍,原亞太用戶的電信合約將於年底到期，針對用戶移轉進度，遠傳 (4904-TW) 總經理井琪今 (19) 日指出，目前原亞太用戶移轉踴躍，進度超前，並陸續提醒亞太用戶盡快移轉至遠傳。 ,https://m.cnyes.com/news/id/6160429
1025,6160378,降息引爆美股！專家：Fed雖暗示繼續放水 但三大風險依舊存在,,https://m.cnyes.com/news/id/6160378
1026,6160057,別急著拍手！輝達砸錢 根本沒救到英特爾「代工大黑坑」,,https://m.cnyes.com/news/id/6160057
1027,6160425,交長陳世凱視察機捷延伸中壢及桃鐵地下化 促如期完工通車,桃園鐵路地下化及機場捷運延伸中壢站兩項重大軌道建設持續施工中，交通部長陳世凱為瞭解工程執行情形，今 (19) 日前往視察，並聽取鐵道局執行進度簡報，也勉鐵道局與桃捷工程局攜手合作，儘早完工通車營運，提供優質的大眾運輸。,https://m.cnyes.com/news/id/6160425
1028,6160422,集邦：Meta AI智慧眼鏡2026年搭載LCoS產品占比升至13% 與LEDoS競爭加劇,研調機構 TrendForce 今 (19) 日表示，Meta 近日發布的首款量產 AR 裝置 Meta Ray-Ban Display Glasses，採用 LCoS 顯示技術，預期將可帶動 LCoS 顯示產品的市場占比於 2026 年上升至 13,https://m.cnyes.com/news/id/6160422
1029,6160421,中國四地蘋果新機開售：黃牛熱炒Pro Max 標準版價格破發,蘋果新款 iPhone 17 系列手機周五（19 日）正式開售，在北京、上海、廣州、深圳等地蘋果門市，不少人在排隊，許多黃牛在的店門口加價收貨，轉手賣貨。,https://m.cnyes.com/news/id/6160421
1030,6160396,〈港股盤後〉恒指收盤持平 南向資金強勁流入成焦點,在市場靜待國際情勢發展的氛圍中，港股周五 (19 日) 表現平穩。恒生指數全日反覆，最終收盤幾乎持平，報 26545.10 點。恒生科技指數則上漲 0.37%，國企指數微漲 0.17%。恒指本周累升 0.6%，科指累升 5.1%。,https://m.cnyes.com/news/id/6160396
1031,6160423,〈台幣〉收全日最低價30.22元 貶值1.13角,〈台幣〉收全日最低價 30.22 元 貶值 1.13 角,https://m.cnyes.com/news/id/6160423
1032,6160424,台股爆量軋空結束訊號? 資金轉進「低估成長股」搶攻下一波輪動：良維、雙鴻、中砂、眾達-KY,,https://m.cnyes.com/news/id/6160424
1033,6160419,5G資費太貴影響滲透率？電信三雄這麼看,蘋果 iPhone 17 系列今日開賣，5G 資費再度成為話題，近期民進黨立委林俊憲也提出質疑，認為 5G 滲透率低的主因是資費太貴，對此，中華電信、台灣大及遠傳皆針對 5G 資費回應。 ,https://m.cnyes.com/news/id/6160419
1034,6160401,〈陸股盤後〉中美元首通話前夕 三大指數震盪走低 滬指連二黑,,https://m.cnyes.com/news/id/6160401
1035,6160367,中國電動「大車」時代來臨？,陸媒報導，當前中國汽車市場正掀起一股前所未有的「大車」熱潮，車長超過 5 米的蔚來 ES8、理想 i8、樂道 L90 等大型 SUV 一經推出，便迅速攫取市場目光，成為路上新的風景線。,https://m.cnyes.com/news/id/6160367
1036,6160416,〈日股盤後〉日銀啟動減持ETF 日股急殺、日元強漲,,https://m.cnyes.com/news/id/6160416
1037,6160415,阻詐 信義房屋9/25起全面協助客戶申辦二類謄本個資隱匿,現行「第二類謄本」是任何人均可到地政事務所申請查閱，且如未特別辦理個資隱匿，民眾戶籍地址會完整公開，信義房屋今 (19) 日宣布，25 日起全面協助客戶申請二類謄本個資隱匿，為客戶升級個資防護力。,https://m.cnyes.com/news/id/6160415
1038,6160414,〈航運指數〉SCFI連3跌 美國線運價暴挫2-3成 提防船公司轉虧,上海航交所今 (19) 日公布最新一期上海出口集裝箱運價指數 (SCFI)，較上周續跌 199.9 點至 1198.21 點，不僅連 3 跌，跌幅多達 14%，主要是因美國線運價轉為重挫 20-30%。,https://m.cnyes.com/news/id/6160414
1039,6160412,台亞被列注意股 8月虧損3600萬元 EPS -0.08元,LED 半導體廠台亞 (2340-TW) 近期傳出奪下蘋果耳機訂單，近 5 日股價飆漲逾 4 成，遭主管機關列為注意股，今 (19) 日公告 8 月自結數，稅後虧損 3600 萬元，年減 41%，每股虧損 0.08 元。,https://m.cnyes.com/news/id/6160412
1040,6160390,《經濟學人》評論：以色列如何正在失去美國,,https://m.cnyes.com/news/id/6160390
1041,6160368,年內最大港股車企IPO即將啟航,歷經 21 年的漫長等待，被稱為中國汽車史上最長 IPO 長跑的奇瑞汽車，終於叩開了資本市場的大門。,https://m.cnyes.com/news/id/6160368
1042,6160408,華航台北-鳳凰城航線確定直飛不中停,華航台北 - 鳳凰城航線確定直飛不中停,https://m.cnyes.com/news/id/6160408
1043,6160405,修理慣老板！颱風天出勤交通費誰出？勞動部：雇主買單 否則員工可拒絕上班,颱風天到底要不要冒著風雨出門上班？如果出勤，交通費誰來付？勞動部今 (19) 日修正《天然災害發生事業單位勞工出勤管理及工資給付要點》，明確規定當天然災害來襲，若勞工有出勤必要，雇主應提供通勤協助，例如支付計程車費，否則勞工,https://m.cnyes.com/news/id/6160405
1044,6160409,〈電價調漲〉外傳民生電價調漲3% 商總許舒博：面臨工資調漲雙重壓力、盼爭取調降至1%,電價審議會今 (19) 日於經濟部召開，預期拍板 10 月份全新電價，外傳民生電價微調 3% 內、產業用電凍漲。商總理事長、電價審議委員許舒博今 (19) 日會前受訪時表示，但近期還面臨基本工資調漲雙重壓力，他希望爭取調漲 1%。,https://m.cnyes.com/news/id/6160409
1045,6160398,輝達入股英特爾 施振榮：對AI發展影響要大過對晶圓代工影響,宏碁 (2353-TW) 創辦人施振榮今 (19) 日出席「共創高空風能新未來」研討會，針對輝達斥資 50 億美元入股英特爾發表看法，他認為從歷史經驗來看，IC 設計廠下單給自家晶圓代工成效並不會比委外代工佳，輝達晶片若,https://m.cnyes.com/news/id/6160398
1046,6160400,輝達最大威脅來了！華為2026年推全球最強AI集群 NVL576還未上市就已落後,,https://m.cnyes.com/news/id/6160400
1047,6160402,宏碁施振榮盼台灣轉為能源出口國 將能源技術與算力一起打包輸出,德國 SkySails 與智帆風能今 (19) 日於「如何共創高空風能新未來」研討會中，雙方正式宣佈合作計畫。宏碁與智帆創辦人施振榮表示，施振榮指出，台灣既是算力供應國，又需要大量電力，應該從能源輸入國轉為輸出國，未來可將能源技,https://m.cnyes.com/news/id/6160402
1048,6160399,創25年紀錄！美豆新產季中國訂單掛零 農業成談判桌上最新武器,據《彭博》報導，自 1990 年代以來，中國首次在出口季開始時，沒有購買任何美國黃豆，顯示北京再次利用農業作為與華盛頓進行貿易戰的籌碼。,https://m.cnyes.com/news/id/6160399
1049,6160392,馬斯克再度痛失大將 Optimus靈魂人物跳槽Meta,,https://m.cnyes.com/news/id/6160392
1050,6160410,早報完全命中！被動元件國巨、華新科、凱美怎麼選？,,https://m.cnyes.com/news/id/6160410
1051,6160045,巴隆點評：輝達入股英特爾 川普政府帳面獲利近50%,,https://m.cnyes.com/news/id/6160045
1052,6160406,台股「殺積盤」急跌 外資縮手提款157億 三大法人賣超114.52億元,,https://m.cnyes.com/news/id/6160406
1053,6160379,中國消費再升級！商務部等9部門打造「百城萬圈」 2030年建成「一刻鐘便民圈」,,https://m.cnyes.com/news/id/6160379
1054,6160366,川普意外宣布：計畫奪回阿富汗巴格蘭空軍基地,美國總統川普周四 (18 日) 與英國首相施凱爾舉行的聯合記者會上，意外透露美國正試圖重新控制位於阿富汗的巴格蘭 (Bagram) 空軍基地。川普將此消息稱為「一個小突發新聞」，並強調此舉的戰略重要性，特別是其鄰近中國的地理位置。,https://m.cnyes.com/news/id/6160366
1055,6160364,忘記密碼的好處？NBA球星杜蘭特「被迫持有」比特幣 報酬率破百倍,因遺失一組密碼而意外致富，這聽起來像是天方夜譚，但對於 NBA 球星杜蘭特 (Kevin Durant) 來說，這卻是真實上演的幸運故事。,https://m.cnyes.com/news/id/6160364
1056,6160395,〈台股盤後〉台積電帶量殺尾盤 跌190點收25578點 周線仍漲103點,〈台股盤後〉台積電帶量殺尾盤下跌 190 點收 25578 點 周線仍漲逾百點,https://m.cnyes.com/news/id/6160395
1057,6160371,中東緊張局勢再度升溫！現貨黃金今反彈逾0.3% 結束連2日跌勢,,https://m.cnyes.com/news/id/6160371
