,newsId,title,summary,link
240,6354123,李嘉誠旗下長江基建、電能實業及長實出售UK Power Networks全部股權 套現逾1100億港元,,https://m.cnyes.com/news/id/6354123
241,6354195,台積電推零配件在地化計畫 年產值逾20億元,台積電 (2330-TW)(TSM-US) 積極推動在地供應鏈，根據最新 ESG 電子報顯示，截至今年 2 月，已攜手 12 家供應商成功開發 22 項持續改善流程 (CIP) 方案，將產品驗證與開發時程縮短 50%，帶動年產值達新台幣 20 億元,https://m.cnyes.com/news/id/6354195
242,6354211,鉅亨雙週報》關稅逆轉、AI恐慌與美股韌性,,https://m.cnyes.com/news/id/6354211
243,6354167,AI替代效應發酵！全美失業人口恐暴增百萬 迎戰市場兩極化 PIMCO建議靠「這招」避險,AI 驅動的生產力浪潮正重塑經濟結構，儘管美國實質 GDP 維持穩定，但內部脆弱性已逐步顯現。PIMCO 經濟學家衛艾婷指出，大型語言模型在 2025 年開始被企業大規模採用，導致勞動報酬佔比降至數十年來最低點。研究顯示,https://m.cnyes.com/news/id/6354167
244,6353635,三大AI模型戰爭模擬 最終動用核武比例高達95%,一項最新研究顯示，來自 Google、OpenAI 與 Anthropic 的主流人工智慧模型，在模擬戰爭推演中多數情況下選擇動用核武，引發外界對 AI 決策行為的關注。,https://m.cnyes.com/news/id/6353635
245,6354206,輝達毛利率75%，成長還在加速,,https://m.cnyes.com/news/id/6354206
246,6354190,台股首檔萬金股現身 信驊飆漲衝上10275元改寫史上最高股價紀錄,"股王信驊 (5274-TW) 今 (26) 日開盤後在買盤敲進下，股價衝破萬元大關，一度達 10,275 元，不僅再創歷史新高，更一舉改寫台股新篇章，成為名符其實的萬金股。",https://m.cnyes.com/news/id/6354190
247,6354174,AI硬體紅利發燙！20檔海外股票ETF創新高 這2類主題績效馬力夯,台股馬年開市以來，展現萬馬奔騰的資金追捧氣勢，燒旺 AI 硬體紅利周邊商品，包括電力基建、半導體兩類主題 ETF，今年來股價持續表現亮眼，根據 CMoney 統計至 2/25 止，共計有 20 檔海外股票 ETF 收盤價創歷史新高。,https://m.cnyes.com/news/id/6354174
248,6354172,中裕Trogarzo未受美國第122條關稅措施影響 維持零關稅,中裕表示，市場關注美國總統川普關稅政策後續影響及相關法律判決，公司已與產品 Trogarzo 的合作生產廠商 SBL 完成確認，目前南韓出口至美國的藥品仍適用零關稅待遇，未受新公布的第 122 條關稅措施影響。 ,https://m.cnyes.com/news/id/6354172
249,6354111,輝達財報會議詳解：黃仁勳稱AI代理拐點已至、「推理即收入」、太空資料中心經濟仍「貧瘠」,輝達 (Nvidia)(NVDA-US) 以一份再創紀錄的財報，試圖回應市場對 AI 泡沫的質疑。不過在電話會後，股價漲幅收斂甚至轉跌，顯示投資人對未來 AI 資本支出與變現速度仍存疑慮。,https://m.cnyes.com/news/id/6354111
250,6354150,〈房產〉市場推案保守持續萎靡 住展風向球元月燈號仍陷衰退黃藍燈,代表北台灣新建案市場概況的「住展風向球」，在 2026 年新的一年仍未見起色，1 月燈號維持衰退的黃藍燈，分數是 35 分，爲四年半以來單月最低分，上次如此低分表現在 2021 年中，正值疫情三級警戒階段。,https://m.cnyes.com/news/id/6354150
251,6353695,AI取代軟體公司？輝達黃仁勳反駁：市場誤判威脅,,https://m.cnyes.com/news/id/6353695
252,6353056,"京東劉強東稱已接到5艘大型遊艇訂單 每艘平均賣6,000萬歐元","京東集團創始人劉強東進軍遊艇業引發關注，據《南方都市報》周三（25 日）報導，劉強東表示，已經接到五艘大型遊艇的訂單，是 72 公尺的雙體船，每艘船平均賣 6,000 萬歐元。",https://m.cnyes.com/news/id/6353056
253,6354112,中華電信攜手聯發科與諾基亞 成功達成5G上傳400Mbps里程碑,中華電信今日宣布，與聯發科與諾基亞聯手，在高雄亞灣新創園區完成重大技術突破，三方在 3GPP Release 17 標準下，首度於商用網路環境中驗證「上行發射切換」技術。根據實測結果，5G 上傳速率突破 400Mbps。,https://m.cnyes.com/news/id/6354112
254,6353642,軟體工程師職缺仍在增加！Citadel Securities駁Citrini對AI的反烏托邦論述,Citadel Securities 周三發布報告，質疑近期 Citrini 提出觀點——即 AI 慧將導致大規模白領職位被取代。該機構指出，AI 採用數據仍穩定，且在外界擔憂勞動市場遭衝擊之際，軟體工程師職缺數量仍在增加。,https://m.cnyes.com/news/id/6353642
255,6352849,中國春節民航旅客量創歷史新高 節後機票價格大跳水,"中國民航在 2 月 15 日—23 日 9 天春節假期期間累計運輸旅客 2,205 萬人次，比 2025 年春運同期（2025 年 1 月 27 日—2 月 4 日，共 9 天）增長 7.7%，其中 2 月 23 日（正月初七）運輸旅客為 266.8 萬人次，創歷史新高。",https://m.cnyes.com/news/id/6352849
256,6354087,合勤控參展MWC 2026 聚焦 Wi-Fi 8、50G PON 光纖及雲端智能管理解決方案,合勤控 (3704-TW) 將於 3 月 2 日至 5 日在西班牙巴塞隆納舉辦的世界行動通訊大會（MWC 2026），展出亮點涵蓋最新 Wi-Fi 8、50G PON 光纖技術及 Zyxel One 雲端 AI 智能管理解決方案，協助電,https://m.cnyes.com/news/id/6354087
257,6353747,美軍唯一AI模型恐生變 美國防部評估Anthropic風險 波音、洛馬受詢,美國國防部要求波音與洛克希德馬丁評估對 Anthropic AI 模型 Claude 的依賴程度，並可能將其列為供應鏈風險。此舉凸顯軍方對 AI 安全與控制權的高度敏感。,https://m.cnyes.com/news/id/6353747
258,6354041,員工離職原因8成「假的」？慰留成功率僅2成 72.3%企業選擇加薪5%至7%留才,根據 yes123 求職網最新發布的馬年離職潮與企業留才調查顯示，後疫情時代引發的缺工潮與報復性轉職潮齊發，有 79.6% 的人不會透露真實離職理由，多以職涯規劃或家庭因素作為擋箭牌 。雖然 78.3% 的企業會進行離職面談，但平均,https://m.cnyes.com/news/id/6354041
259,6354088,【ETF觀察】00996A靠「期貨避險」撐盤？主動式ETF新戰場誰能勝出？,,https://m.cnyes.com/news/id/6354088
260,6354056,強強聯手！SK海力士攜手Sandisk 正式啟動高頻寬快閃記憶體(HBF)全球標準化進程,,https://m.cnyes.com/news/id/6354056
261,6353575,AI空頭沉睡三年開始甦醒！啟動多方位放空 輝達、OpenAI都在獵殺名單,,https://m.cnyes.com/news/id/6353575
262,6353693,超大油輪日租金漲勢延續 中東油運巨頭一天20萬美元,租用一艘超大型油輪（VLCC）把原油從中東運到亞洲的價格，繼周二（24 日）突破 17 萬美元 / 日後，眼下價格又突破 20 萬美元的關口，續創 2020 年以來新高。,https://m.cnyes.com/news/id/6353693
263,6354000,〈台股開盤〉狂漲3天後震盪 台積電跌破2000元 CPO族群撐場,台北股市大盤在連漲 3 個交易日後早盤呈現震盪，早盤以記憶體、矽光子及玻纖族群表現最強勢，超高權值的台積電 (2330-TW) 走勢偏弱，指數早盤最高來到 35457.76 點，預估全場市場成交值爲 9733 億元。,https://m.cnyes.com/news/id/6354000
264,6353633,金融時報評論指川普精神狀態威脅全球 胡錫進：他沒瘋,中國前《環球時報》總編輯胡錫進針對《金融時報》於 2 月 24 日刊出評論「川普的精神狀態構成全球風險」(Donald Trump’s state of mind is a global risk) 發表觀點。,https://m.cnyes.com/news/id/6353633
265,6353455,習近平見德國總理 稱國際形勢經歷二戰結束以來最深刻演變,中國國家主席習近平周三（25 日）在北京釣魚台國賓館會見德國總理梅爾茨，稱國際形勢正在經歷第二次世界大戰結束以來最深刻演變，並對下一步中德關係發展提出三點意見。,https://m.cnyes.com/news/id/6353455
266,6353481,香港預算案出爐：經濟連三增、新股集資全球第一、兩大產業成新寵,,https://m.cnyes.com/news/id/6353481
267,6353773,台泥處分海螺水泥7687.5萬股 交易金額約78億元,台泥處分海螺水泥 7687.5 萬股 交易總金額約 78 億元,https://m.cnyes.com/news/id/6353773
268,6353732,華爾街過度反應？美財經名嘴駁AI末日論：現實沒那麼糟 軟體業仍有生機,AI 是否重創軟體產業引發華爾街激辯。Cramer 認為市場過度恐慌，雖然估值將下修，但企業仍具調整能力，AI 更可能重塑經濟而非摧毀產業。,https://m.cnyes.com/news/id/6353732
269,6353745,川普國情咨文演說 意在為11月期中選舉造勢,美國總統川普周二（24 日）在國會發表第二個任期首次國情咨文演講，他在講話中首先提及了邊境安全、移民、經濟、犯罪問題等議題。,https://m.cnyes.com/news/id/6353745
270,6353639,AI「恐慌交易」席捲今年市場 五大產業首當其衝,據《Yahoo Finance》報導，數周以來，投資人愈發擔心 AI 進展過快，可能對標普 500 指數中一些最具代表性的企業商業模式造成重大衝擊。,https://m.cnyes.com/news/id/6353639
271,6353742,紐約聯準銀行：政府債券吸引力下降 推動關鍵利率上升,,https://m.cnyes.com/news/id/6353742
272,6353636,川普國情咨文中稱「物價暴跌」數據如何打臉？,《Marketwatch》報導，美國總統川普週二在國情咨文中強調，上任一年來在壓低生活成本方面已見進展。不過，最新數據與民調顯示，，最新數據與民調顯示，多數美國家庭「 荷包無感」。,https://m.cnyes.com/news/id/6353636
273,6353694,全球第四大供應國宣布 即日暫停鋰礦出口,辛巴威周三（25 日）宣布即日起暫停鋰精礦及原礦出口，象徵著這個全球第四大鋰礦供應國在推進礦產資源本地化加工方面邁出關鍵一步。,https://m.cnyes.com/news/id/6353694
274,6353689,蘋果傻眼！三星S26爆抄襲爭議 不僅抄iOS搜索功能 連Mac的「Finder」也不放過,,https://m.cnyes.com/news/id/6353689
275,6353624,扶植本土供應鏈！DeepSeek遭爆拒向美晶片商公開V4模型 旨在削弱美硬體優勢,,https://m.cnyes.com/news/id/6353624
276,6353629,美股重點新聞摘要2026年2月26日,美股重點新聞摘要 2026 年 2 月 26 日,https://m.cnyes.com/news/id/6353629
277,6352848,6家外資齊喊多中國資產：A股步入「慢牛」新階段 驅動邏輯轉向獲利成長,,https://m.cnyes.com/news/id/6352848
278,6353649,強化AI戰略 Google吸收登月計畫機器人團隊Intrinsic 升為核心業務,Alphabet 宣布將機器人軟體公司 Intrinsic 併入 Google，結束其在 Other Bets 部門的獨立運作。此舉被視為強化 AI 與實體機器人整合、加速商業化布局的重要一步。,https://m.cnyes.com/news/id/6353649
279,6353646,葛里爾：美對中國關稅將維持現行水準,美國貿易代表葛里爾 (Jamieson Greer) 週三 (25 日) 表示，川普政府目前無意進一步升高對中國關稅，預期整體關稅水準將維持在現行區間，為市場釋出相對穩定的政策訊號。,https://m.cnyes.com/news/id/6353646
280,6353648,「傻錢」成美股關鍵力量！散戶交易規模衝5.4兆美元 年增近47%創歷史新高,2025 年散戶股票與 ETF 交易規模達 5.4 兆美元，年增近 47%，不僅創十年新高，更在市場劇烈震盪時成為逢低承接主力，顛覆「傻錢」刻板印象。,https://m.cnyes.com/news/id/6353648
281,6353671,三星發表Galaxy S26旗艦系列 第三代AI手機漲價了,三星電子週四 (26 日) 正式推出旗艦智慧手機 Galaxy S26 系列，並在美國與南韓調漲部分機型售價。在記憶體晶片價格因人工智慧 (AI) 熱潮而飆升之際，三星此舉被視為測試市場需求與轉嫁成本壓力。,https://m.cnyes.com/news/id/6353671
282,6352082,投資人面臨殘酷現實：AI若真的改變世界 失業海嘯也是真的,,https://m.cnyes.com/news/id/6352082
283,6353632,五角大廈對Anthropic下最後通牒 要求放寬AI軍事用途限制,據《路透》報導，消息人士周二 (24 日) 表示，人工智慧 (AI) 實驗室 Anthropic 無意放寬其針對軍事用途的使用限制，並補充稱，在與五角大廈會面討論未來合作後，雙方談判仍在持續進行。,https://m.cnyes.com/news/id/6353632
284,6353103,美債還安全嗎？貝萊德：長天期波動已明顯放大,貝萊德全球固定收益投資長 Rick Rieder 指出，投資人若想強化資產防禦力，關鍵在於選對存續期間。,https://m.cnyes.com/news/id/6353103
285,6353623,〈貴金屬盤後〉金價回升 川普關稅和美伊會談刺激避險需求,,https://m.cnyes.com/news/id/6353623
286,6353638,記憶體與電池成本上升 蘋果平價MacBook計畫添變數,《Appleinsider》報導，隨著記憶體與電池成本持續攀升，正為蘋果 (AAPL-US) 推動平價 MacBook 計畫增添變數。,https://m.cnyes.com/news/id/6353638
287,6353643,〈財報〉Salesforce Q4業績亮眼 但財測遜色 AI威脅產業 盤後挫逾5%,Salesforce 上季財報優於預期並宣布 500 億美元回購計畫，但 2027 財年營收指引略低於市場估算，加上生成式 AI 競爭升溫，股價盤後重挫 4%，今年以來累跌近 28%。,https://m.cnyes.com/news/id/6353643
288,6353647,美國全面圍堵中國晶片產業 封殺中芯國際、長鑫存儲、長江存儲,美國擬以政府採購為新工具，全面限制含中國半導體產品。中芯國際、長鑫存儲與長江存儲被明確點名，禁令預計 2027 年底生效，為產業供應鏈投下新變數。,https://m.cnyes.com/news/id/6353647
289,6352350,做空微軟向來是輸家！股價暴跌逼近10年死線 這次會否不同,,https://m.cnyes.com/news/id/6352350
290,6353630,〈財報〉輝達Q4優預期 AI熱推動資料中心營收大增75% 盤後續揚,人工智慧 (AI) 晶片龍頭輝 (Nvidia)(NVDA-US) 周三 (25 日) 盤後公布 2026 會計年度第四季財報，在核心資料中心業務營收成長 75% 帶動下，表現優於市場預期，同時釋出高於預估的財測，激勵盤後股價上漲。,https://m.cnyes.com/news/id/6353630
291,6353102,〈美股盤後〉輝達財報超預期 道瓊漲超300點 那指標普連二紅,道瓊週三 (25 日) 收漲超 300 點，那指強漲超 1%，標普升超 0.8%，三大指數均連續第二個交易日收紅。輝達盤後股價在亮眼財報帶動下跳漲。,https://m.cnyes.com/news/id/6353102
292,6352370,記憶體漲價潮愈演愈烈！陸國產雙雄長鑫、長江存儲傳打入蘋果供應鏈 能否藉機破局？,,https://m.cnyes.com/news/id/6352370
293,6353431,〈能源盤後〉庫存超預期大增 但市場緊盯美伊核談判 原油持穩,"美國原油庫存單周暴增 1,600 萬桶，卻未能壓低油價。市場焦點轉向美伊軍事緊張與 OPEC + 增產動向，在地緣政治與貿易政策變數交織下，國際油市維持高檔震盪格局。",https://m.cnyes.com/news/id/6353431
294,6353628,〈紐約匯市〉美元走弱 延續本周震盪走勢,美元周三 (25 日) 走弱，延續本周來回震盪的交易。市場焦點轉向 AI 晶片巨擘輝達 (Nvidia)(NVDA-US) 盤後將公布的財報，該事件過去經常引發市場大幅波動。,https://m.cnyes.com/news/id/6353628
295,6352073,AI恐慌殺過頭？Jefferies點名6檔護城河股：等情緒退燒就翻身,,https://m.cnyes.com/news/id/6352073
296,6353521,〈台股盤前要聞〉開春3天噴漲近2000點爆天量、台積電市值2兆美元、台幣升值1.21角,台股盤前要聞,https://m.cnyes.com/news/id/6353521
297,6352847,比爾蓋茲向員工道歉 認了婚外情！,科技巨頭微軟創始人比爾 · 蓋茲周二（24 日）就其與美國已故性犯罪者愛潑斯坦的關係向蓋茲基金會員工道歉，承認自己的錯誤給這個慈善組織蒙上陰影，但堅稱自己未參與愛潑斯坦的犯罪行為。,https://m.cnyes.com/news/id/6352847
298,6353430,【袁志峰專欄】預期3月港股放量突破,"今日推介 - 銀河娛樂 (27, $43.28), 目標價 $47.5, 止損價 $41.5",https://m.cnyes.com/news/id/6353430
299,6352912,中國中年人一代神車Honda Accord直降台幣45萬 合資車廠打響馬年降價第一炮,馬年伊始，中國合資車廠掀起新一輪價格競爭，曾被稱為「中年人一代神車」的雅閣（Honda Accord）也降價了。,https://m.cnyes.com/news/id/6352912
300,6352527,AI不是唯一成長引擎！小摩：傳統工業將復甦 宏觀經濟將走向多點開花,,https://m.cnyes.com/news/id/6352527
301,6353586,AI燒電誰買單？白宮找科技巨頭談判,《路透》周三 (25 日) 報導，白宮計畫於 3 月初邀集多家大型資料中心與人工智慧 (AI) 企業，包括微軟(MSFT-US)、Anthropic 與 Meta(META-US)，討論並正式敲定一項承諾機制，以避免資料中心快速擴張推升民,https://m.cnyes.com/news/id/6353586
302,6353537,德國總理首會習近平 釋出什麼訊號？,根據《彭博》報導，德國總理梅爾茨 (Friedrich Merz) 周三 (25 日) 在北京首度會晤中國國家主席習近平，表示儘管雙方在貿易與地緣政治議題上存在分歧，但仍有潛力透過對話與耐心，深化戰略合作關係。,https://m.cnyes.com/news/id/6353537
303,6351716,輝達財報開獎在即 分析師：重頭戲要等3月GTC大會登場,,https://m.cnyes.com/news/id/6351716
304,6353390,OPEC+擬4月恢復小幅增產 每日增13.7萬桶原油,綜合外媒周三 (25 日) 報導，石油輸出國組織與夥伴國 (OPEC+) 本周末將召開會議，市場預期該組織可能自 4 月起恢復小幅增產，幅度約為每日 13.7 萬桶，結束此前為期三個月的暫停增產安排。,https://m.cnyes.com/news/id/6353390
305,6353522,擠下地緣政治！美銀調查：一向穩健的債券投資人現在最擔心AI泡沫,,https://m.cnyes.com/news/id/6353522
306,6353427,美國關稅再升級？部分國家稅率恐衝15%以上,《路透》報導，美國貿易代表葛里爾 (Jamieson Greer) 周三 (25 日) 表示，美國對部分國家的關稅稅率將由目前新實施的 10% 上調至 15% 或更高，但未點名具體對象，也未透露進一步細節。,https://m.cnyes.com/news/id/6353427
307,6353113,〈美股早盤〉主要指數開盤走高 市場聚焦輝達財報,美股主要指數周三 (25 日) 開盤走高，延續前一交易日反彈走勢，市場聚焦輝達即將公布的財報，觀察人工智慧 (AI) 投資前景是否仍具支撐力。標普 500 指數連續第二日上漲，那斯達克與道瓊工業指數同步走揚，輝達與甲骨文(ORCL-U,https://m.cnyes.com/news/id/6353113
308,6353482,中美戰機對峙 駐韓美軍駁斥向韓方道歉、僅表遺憾,,https://m.cnyes.com/news/id/6353482
309,6353429,市場押注聯準會2027年續降息 利率恐降至2%,市場對聯準會 (Fed) 貨幣政策路徑的預期出現顯著轉向。原本市場共識認為降息循環將在 2026 年結束，甚至 2027 年可能重新升息，但近期美國期貨與選擇權市場押注顯示，交易員開始大舉布局聯準會將把利率一路下調至 2027 年，甚至,https://m.cnyes.com/news/id/6353429
310,6353112,輝達GTC大會3月15日登場！韓媒爆料：全球首款1.6奈米晶片Feynman將亮相,,https://m.cnyes.com/news/id/6353112
311,6353441,台股元月行情強強滾！證券商獲利翻倍狂賺252億元 自營業務年增逾5倍,進入 2026 年，台股屢屢寫下史詩級紀錄，加權指數衝破 3 萬點大關，並一路向上攻堅，帶動全體上市公司總市值突破百兆元，火熱的交投氣氛更讓證券業大發利市,https://m.cnyes.com/news/id/6353441
312,6353420,鴻海處分群創4.34萬張 已實現獲利6.18億元,鴻海處分群創 4.34 萬張 已實現獲利 6.18 億元,https://m.cnyes.com/news/id/6353420
313,6353391,〈國巨法說〉Q1營收、雙率估季增 AI需求持續暢旺,國巨 Q1 營收、雙率估季增 AI 需求持續暢旺,https://m.cnyes.com/news/id/6353391
314,6353380,摩根士丹利：AI恐慌賣壓帶來選股機會,《彭博》周三 (25 日) 報導，摩根士丹利 (MS-US) 策略師指出，市場近期因人工智慧 (AI) 顛覆疑慮引發的過度拋售，反而為選股型投資人創造進場機會。,https://m.cnyes.com/news/id/6353380
315,6353114,阿里巴巴低價推AI寫程式工具 搶攻開發者市場,《彭博》周三 (25 日) 報導，阿里巴巴 (BABA-US)(09988-HK) 正加速布局人工智慧 (AI) 程式開發工具市場，透過低價策略提供中國多款主流 AI 模型的存取服務，進一步強化其從電商轉型為 AI 領導者的定位。,https://m.cnyes.com/news/id/6353114
316,6353197,日本公平交易委員會突擊搜查微軟日本辦公室,日本公平交易委員會 (JFTC) 周三 (25 日) 對位於東京都港區的日本微軟 (MSFT-US) 辦公室發動突擊搜查。據媒體報導，監管機構懷疑，微軟涉嫌違反《獨占禁止法》中的「交易妨礙」與「附拘束條件交易」，利用其軟體市場的優勢地,https://m.cnyes.com/news/id/6353197
317,6353217,玉山投信未來3年齊備ETF產品線 陳茂欽：整體AUM挑戰3000億元,玉山投信自 2025 年加入玉山金控體系，由金控總座陳茂欽親自擔任投信董事長，為強化資產管理量能，玉山投信將補齊 ETF 產品線，推出首檔產品「玉山美元嚴選非投資等級債券 ETF」(00988B-TW),https://m.cnyes.com/news/id/6353217
318,6353216,台達電去年大賺601億元年增7成 EPS23.14元擬配息11.6元均創高,台達電去年大賺 601 億元年增 7 成 EPS23.14 元擬配息 11.6 元均創高,https://m.cnyes.com/news/id/6353216
319,6353212,對等關稅失效引大退稅潮？KPMG：川普改用法源加課10% 台灣2類產品逃過一劫,美國最高法院於 2 月 20 日裁定，總統川普引用《國際緊急經濟權力法》（IEEPA）加徵的對等關稅違法，美國海關自 24 日起停止徵收相關關稅，包含對中、墨西國的懲罰性關稅也同步失效。法律途徑受阻，川普即啟動第 122 條對全球徵收 1,https://m.cnyes.com/news/id/6353212
320,6353352,鉅亨速報 - Factset 最新調查：卡特彼勒CAT-US的目標價調升至742.5元，幅度約3.92%,FactSet 最新調查：卡特彼勒CAT-US目標價調升，最高估值、最低估值、中位數、綜合評級、近5日股價、標普、即時新聞資訊,https://m.cnyes.com/news/id/6353352
321,6353327,鉅亨速報 - Factset 最新調查：匯豐控股(HSBC-US)EPS預估上修至7.95元，預估目標價為56.00元,FactSet 最新調查：匯豐控股(HSBC-US)EPS預估上修，預估EPS、預估營收、目標價、歷史獲利表現、即時新聞資訊,https://m.cnyes.com/news/id/6353327
322,6353116,科技股今年開局不利 輝達財報能否扭轉頹勢？,《路透》周三 (25 日) 報導，美國科技股在 2026 年開年表現不振，人工智慧 (AI) 帶來的產業顛覆憂慮，以及資金轉向過去表現落後的族群，使科技類股走勢承壓。在此背景下，輝達 (NVDA-US) 即將公布的最新一季財報，被視為科技,https://m.cnyes.com/news/id/6353116
323,6353100,巴克萊：AI敘事轉向 全球股市資金仍湧入 但倉位趨於謹慎,根據巴克萊銀行 (Barclays) 的最新研究報告，強勁的宏觀經濟與盈利動能，持續支撐全球股票需求，但對人工智慧的擔憂日益加劇，正在擾亂各類資產的部位配置。,https://m.cnyes.com/news/id/6353100
324,6353213,橋椿去年Q4賺贏前三季 全年EPS0.39元擬超額配發1元股息,衛浴水五金零組件廠橋椿 (2062-TW) 今公布最新財報獲利資訊，2025 年第四季稅後純益達 4186 萬元，超越前三季獲利總和，2025 年全年稅後純益 7891 萬元，每股純益 0.39 元 ，擬超額配發 1 元現金股利。,https://m.cnyes.com/news/id/6353213
325,6353198,玻纖廠富喬自結1月稅後純益1.22億元 每股賺0.21元,富喬今 (25) 日公布最新獲利資訊，富喬 2026 年 1 月營收爲 5.71 億元，爲單月次高，月增 14.38%，年增 19.18%，單月自結稅後純益 1.22 億元，年增 32.61%，每股純益 0.21 元。,https://m.cnyes.com/news/id/6353198
326,6353117,十銓去年Q4賺近1個股本 全年EPS 13.06元 每股擬配息10元,記憶體模組大廠十銓 (4967-TW) 今 (25) 日公布去年第四季財報，受惠 DRAM、NAND Flash 價格雙雙大漲，單季稅後純益達 8.15 億元，創下歷史新高，每股稅後純益 9.59 元，單季就賺近 1 個股本，累計全年每股純益達,https://m.cnyes.com/news/id/6353117
327,6353199,〈台幣〉熱錢狂湧股匯嗨翻天！強升逾1角收31.34元 攀近1個月新高,台股驚天連五漲，今 (25) 日再飆漲逾 700 點，站上 3 萬 5 大關，外資大舉匯入買股，呈現股匯雙漲走勢，新台幣兌美元一度逼近 31.3 元關卡，,https://m.cnyes.com/news/id/6353199
328,6353200,聯電高層人事異動 王石升任執行長 徐明志接任總經理暨營運長,聯電 (2303-TW)(UMC-US) 今 (25) 日公告高階主管人事異動，為落實公司高階經理人接班規劃，並確保公司持續具備競爭力，現任共同總經理王石將升任聯電執行長，執行副總經理徐明志則獲任命為總經理暨營運長，並成為董事會,https://m.cnyes.com/news/id/6353200
