,newsId,title,summary,link
1194,6193001,新光三越攜手日本伊勢丹 推全台首見男性潮流選物場域,新光三越攜手日本伊勢丹 推全台首見男性潮流選物場域,https://m.cnyes.com/news/id/6193001
1195,6191345,漢康年底送件申請創新板 目標明年上半年掛牌,漢康 - KY(7827-TW) 今 (15) 日召開法說會，董事長劉世高表示，旗下抗癌融合蛋白新藥 HCB101 已啟動一 b / 二 a 期臨床收案，且已對外授權。同時，規劃今年底送件申請創新板上市，目標明年上半年掛牌。 ,https://m.cnyes.com/news/id/6191345
1196,6192651,螞蟻集團重磅開源思考模型Ring-1T：推理能力直逼GPT-5天花板,螞蟻集團於正式發布上兆參數思考模型 Ring-1T，並同時全面開源模型的權重和訓練配方。Ring-1T 的問世，不僅是螞蟻集團首個上兆參數思考模型，更被視為開源 AI 正式邁入上兆參數時代的里程碑。,https://m.cnyes.com/news/id/6192651
1197,6192962,永豐餘水資源回收中心轉型沼氣綠能 董座葉惠青：擁三項創舉,永豐餘旗下豐川綠能宣布，啟用龜山水資源回收中心沼氣發電系統。董事長葉惠青表示，綠能中心擁有 3 項第一，首個採 ROT 模式進行水資源回收中心轉型綠能中心、首座污水處理廠轉綠電且為台灣規模最大，以及首個申請電業執照的綠能中心。,https://m.cnyes.com/news/id/6192962
1198,6192906,富旺發行6億元CB完成籌資6.18億元  明天掛牌交易,建商密集籌資鞏固營運不斷，其中由富旺國際 (6219-TW) 發行有擔保可轉換公司債 (CB) 6 億元完成募集，並將在明 (16) 日上櫃掛牌交易。,https://m.cnyes.com/news/id/6192906
1199,6192794,2025灣芯展登場！新凱來旗下公司新品炸場：國產EDA補空白 90GHz示波器突破《瓦森納協定》封鎖,,https://m.cnyes.com/news/id/6192794
1200,6192897,〈台北紡織展〉廣越董座：今年Q4營收將是同期最強 明年雙位數成長,廣越董座：今年 Q4 將改寫同期最強 明年營收雙位數成長,https://m.cnyes.com/news/id/6192897
1201,6192893,台積電供應鏈志聖1-3季營收及獲利都創同期新高  EPS 3.78元,志聖工業 (2467-TW) 今 (15) 日公布最新獲利資訊，自結 2025 年 第三季稅後純益 2.12 億元，季增 2.08%，年 28.23%，1-9 月稅後純益 5.69 億元，年 8.56%，每股純益 3.78 元。,https://m.cnyes.com/news/id/6192893
1202,6192891,智邦高層異動 資深副總李訓德接任總經理,網通廠智邦 (2345-TW) 今（15）日公告重大人事異動，原任總經理、執行長暨營收長石軍因個人生涯規劃與組織調整，決定辭任所有職務並即日生效，董事會已通過由產品生產暨營銷運籌中心資深副總經理李訓德接任新任總經理職務，執行,https://m.cnyes.com/news/id/6192891
1203,6192841,創博會未來科技館明日登場 國科會：鎖定六大領域推動產業升級,創新技術博覽會 - 未來科技館於明 (16) 日 - 18 日在台北世貿一館開展。國科會表示，今 (2025) 年將展出 220 件技術，鎖定智慧機器人、量子科技、運動科技、AI 應用與產學合作、晶創台灣方案、未來科技獎等六大技術領域。,https://m.cnyes.com/news/id/6192841
1204,6192793,ASML報喜+台積電寫新天價 這5檔台股ETF半年績效突破5成,雖然台股昨 (14) 日開高走低收黑，但半導體設備製造商艾司摩爾 (ASML) 訂單表現優於預期，帶領多頭展開反攻，今 (15) 日在護國神山台積電領軍創高激勵下，加權指數大漲 482.56 點，收 27275.71 點，逼近歷史高,https://m.cnyes.com/news/id/6192793
1205,6192889,籌碼未鬆動不必悲觀、智通⊕、十銓⊕、至上、宜鼎、楠梓電,,https://m.cnyes.com/news/id/6192889
1206,6192798,〈房產〉去年度營利事業房地合一稅達399.6億元改寫歷史新高 年增37%,根據財政部最新統計顯示，2025 年 9 月全台房地合一稅表現出明顯分歧走勢，年度的營利事業房地合一稅稅收達 399.6 億元，年增 37%，創歷年同期新高；不過今年逐月的個人房地合一稅多數呈現衰退。,https://m.cnyes.com/news/id/6192798
1207,6192790,童子賢談中國稀土管制 對台灣影響小但可能使某些國家重新開採,中國商務部近日宣布擴大稀土出口管制，引起市場關注與討論。對此，和碩 (4938-TW) 董事長童子賢今 (15) 日指出，雖然稀土管制對台灣整體經濟非常間接，但若上升至政治或國安問題，可能誘導某些國家重新開採稀土。,https://m.cnyes.com/news/id/6192790
1208,6192797,"【量大強漲股整理】台股站穩27,000點後，如何解讀?OCP大會登場下，潛力股鎖定誰?",,https://m.cnyes.com/news/id/6192797
1209,6192839,台積法說前資金回流電子，AI與散熱族群再啟主升段：台積電、雙鴻、昇陽半導體、眾達-KY、AES-KY、良維,,https://m.cnyes.com/news/id/6192839
1210,6192333,新凱來的崛起！一文看懂中國半導體設備國產化新時代的窗口,隨著中國本土半導體設備自給率預計於 2025 年達到 50%，為半導體設備研發公司新凱來（SiCarrier）創造了廣闊的發展舞台與商機。,https://m.cnyes.com/news/id/6192333
1211,6192760,毅嘉Q3 EPS 0.6元今年單季次高 累計前三季賺5.7億元年增逾一成,軟板廠毅嘉 (2402-TW) 今 (15) 日公告第三季稅後純益為 1.9 億元，呈季年雙減，每股純益 0.6 元；累計前三季稅後純益 5.7 億元，年增 12.9%，每股純益 1.86 元；毅嘉表示，第三季毛利率雖然受產品組合下滑，但獲利仍為,https://m.cnyes.com/news/id/6192760
1212,6192473,調查：經濟展望創史低 聖誕購物季美國人均消費預計減少10%,根據德勤 (Deloitte) 周三 (15 日) 發佈的年度調查報告，隨著美國年度假期購物旺季的臨近，大多數美國消費者對國家經濟前景持悲觀態度。這份對大約 4000 名受訪者進行的民意調查結果，為零售業在一年中最關鍵的銷售期增添了謹,https://m.cnyes.com/news/id/6192473
1213,6192761,台股ETF之王0050單周吸金169億元 規模衝上8126億元締新猷,在市場正向氛圍帶動下，元大台灣 50(0050-TW) 本周獲淨申購 169 億元，稱冠台股 ETF 市場，加上權值股台積電 (2330-TW)、台達電 (2308-TW) 漲勢助攻，推升規模來到 8126 億元，持續朝國內首檔兆,https://m.cnyes.com/news/id/6192761
1214,6192204,攜手廣汽跟「寧王」！京東官宣11月9日發布新車 回應稱不涉及「造車」,,https://m.cnyes.com/news/id/6192204
1215,6192756,宜鼎：DRAM漲價沒有盡頭 Edge AI案件指數型成長,工業記憶體模組大廠宜鼎 (5289-TW) 董事長簡川勝今 (15) 日指出，AI 需求爆發帶動記憶體市場出現結構性缺口，特別是 DDR4 產能緊縮情況嚴重、價格「看不到盡頭」。同時，公司持續攜手輝達 (NVDA-US) 等大廠衝刺 Edg,https://m.cnyes.com/news/id/6192756
1216,6192757,外資續賣超130億元 連兩日回補期貨空單 中止連5賣台積電,台股今日台積電 (2330-TW) 在法說會前走勢頑強，收盤並以 1465 元改寫歷史新高， 終場大盤上漲 482.65 點，以 27275.71 點作收，市場成交值爲 5001.09 億元，三大法人合計賣超 130.33 億元。,https://m.cnyes.com/news/id/6192757
1217,6192752,星宇航空年底前迎來A350-1000新機 明年下半年有望首開歐洲航線,星宇航空年底前迎來 A350-1000 新機 明年下半年有望首開歐洲航線,https://m.cnyes.com/news/id/6192752
1218,6192187,稀土管制恐引漲價潮？龔明鑫：強化稀土再精煉技術、拉高戰略物資儲存量因應,經濟部長龔明鑫今（15）日出席「2025 零碳永續高峰論壇」後受訪，針對美中貿易戰再度聚焦於稀土議題，他表示，雖然稀土問題對台灣的影響目前屬於間接性質，但政府將會密切觀察情勢發展，並與國際間同步協調，共同應對可能帶來的挑,https://m.cnyes.com/news/id/6192187
1219,6192658,國泰瞄準區域型資產管理平台 李長庚：台灣有扎實產業基礎 具創富優勢,國泰金控 (2882-TW) 今 (15) 日舉辦第二屆「國泰資產管理高峰會」，吸引逾 1.2 萬人報名，此次邀請橡樹資本、PIMCO、貝萊德三大投資巨擘專家共同剖析全球投資趨勢。國泰金控總經理李長庚表示，投資人考慮要將資產配置,https://m.cnyes.com/news/id/6192658
1220,6192530,〈港股盤後〉恒指強勢反彈逾400點 科技股普漲 軒竹生物首日飆升逾126%,香港股市周三 (15 日) 迎來強勁反彈，主要指數集體上漲。截至收盤，恒生指數報 25910.60 點，漲幅達 1.84%，恒指最終上升 469 點。恒生科技指數大漲 2.57%，收報 6075 點，而國企指數也上漲 1.89%。當日港股成交金,https://m.cnyes.com/news/id/6192530
1221,6192725,主計總處：今年GDP低估了 下半年表現優預期 有望上調趨近5%,主計總處看我國經濟成長有點低估 今年 GDP 有望超過 4.5%,https://m.cnyes.com/news/id/6192725
1222,6192723,安世半導體證實 同時遭美、中出口管制,,https://m.cnyes.com/news/id/6192723
1223,6192447,〈陸股盤後〉陸通縮引發市場對刺激政策預期 滬指連三黑止步 重返3900點,,https://m.cnyes.com/news/id/6192447
1224,6192335,烏克蘭：俄羅斯無人機大量使用外國零件、制裁存在「漏洞」,烏克蘭當局指出，俄羅斯無人機與導彈在攻擊烏能源系統時含有超過 10 萬個美國與西歐零件。烏克蘭制裁特使呼籲盟國加強制裁執行，並警告俄羅斯利用加密貨幣與影子艦隊規避制裁。,https://m.cnyes.com/news/id/6192335
1225,6192706,〈台幣〉聯準會有意結束縮表 收升1.05角至30.656元,〈台幣〉聯準會有意結束縮表 收升 1.05 角至 30.656 元,https://m.cnyes.com/news/id/6192706
1226,6192491,銅價反彈 交易商看好挑戰每噸1.2萬美元,在聯準會主席鮑爾 (Jerome Powell) 釋放本月將再次降息的訊號後，大宗商品市場受到鼓舞，銅價隨之反彈，漲幅一度高達 1.1%。參加業內規模最大的年度會議的交易員們表示，每噸 12000 美元的銅價已經不遠。,https://m.cnyes.com/news/id/6192491
1227,6192662,晶技9月稅前賺2.32億元年增15% 1-9月每股稅前賺4.7元,晶技今日公布最新自結獲利資訊，2025 年 9 月營收突破 12 億元達 12.35 億元創今年來新高，自結單月稅前盈餘 2.32 億元，每股稅前賺 0.67 元，1-9 月每股稅前盈餘 4.7 元。,https://m.cnyes.com/news/id/6192662
1228,6191638,黃金價格屢創新高、漲勢有撐？專家：美國散戶才剛加入派對,,https://m.cnyes.com/news/id/6191638
1229,6192334,玉城雄一郎有望成日本首相？反對黨聯盟挑戰自民黨高市早苗,日本執政聯盟上週的解體，讓日本民主黨領袖玉木雄一郎在三大反對黨支持下，可能成為對抗自民黨新任領袖高市早苗（Sanae Takaichi）的首相候選人。,https://m.cnyes.com/news/id/6192334
1230,6192580,OpenAI執行長奧特曼：要讓AI融入所有政府流程 涵蓋整個經濟,,https://m.cnyes.com/news/id/6192580
1231,6192533,美英聯手打擊跨國加密詐騙 沒收價值逾140億美元比特幣,美國紐約東區檢察官辦公室和司法部國家安全部門周二 (14 日) 表示，已對一名前中國公民提起民事沒收訴訟，他被控經營一個龐大的加密貨幣詐騙網絡，並沒收價值逾 140 億美元比特幣。,https://m.cnyes.com/news/id/6192533
1232,6192500,開亞洲先河！日本計畫禁止加密貨幣內線交易,,https://m.cnyes.com/news/id/6192500
1233,6192523,輝達北市科土地爭議 林伯豐：政府應協調輝達儘速落腳、確保AI產業發展,輝達 (NVDA-US) 進駐北士科進度卡關，台北市政府已於本 (10) 月 13 日發函新壽，盼雙方能「合意解約」，解決 T17、18 地上權爭議。三三會理事長林伯豐今 (15) 日表示，輝達希望來台設廠，他建議政府應協調，爭取輝達設廠。,https://m.cnyes.com/news/id/6192523
1234,6191819,2025全球綠色科技投資激增！清潔能源、太陽能、風力與電池領跑,2025 年前三季全球對綠色科技與清潔能源的投資已突破 560 億美元，涵蓋太陽能、風力、儲能與電池領域，帶動能源科技市場反彈與投資熱潮。,https://m.cnyes.com/news/id/6191819
1235,6192493,5兆美元資產潛能讓外資「愛台」！貝萊德看好資產「代幣化」 渣打持續發展財富中心,首度舉辦的「台灣週」金融盛事於今（15）日上午舉行盛大開幕式，全球金融界目光聚焦於此。全球最大資產管理公司之一貝萊德（BlackRock）副董事長 Sir Robert Fairbairn 親臨發表演說，他揭示全球資產管,https://m.cnyes.com/news/id/6192493
1236,6192591,ABF大缺貨，欣興、南電、景碩起死回生,,https://m.cnyes.com/news/id/6192591
1237,6192522,蘋果CEO庫克承諾增資中國市場 中國當局重申優化營商環境,蘋果 (AAPL-US) 執行長庫克 (Tim Cook) 周三 (15 日) 在北京會見了中國工業部長，並承諾蘋果將增加對中國的投資，並進一步加強在中國的合作。,https://m.cnyes.com/news/id/6192522
1238,6191734,看好越南旅遊爆發 太陽富國航空大手筆狂買100架客機,,https://m.cnyes.com/news/id/6191734
1239,6192581,台股重回2萬7 外資續調節147億 三大法人賣超130.33億元,,https://m.cnyes.com/news/id/6192581
1240,6192524,傳統車廠力拚轉型但路線分化 福斯激進、日系車廠保守、通用融合 誰贏？,,https://m.cnyes.com/news/id/6192524
1241,6192336,金融時報：OpenAI制定「五年計畫」以實現1兆美元AI技術發展目標,OpenAI 正推行五年計畫，投入超過 1 兆美元發展 AI 技術，探索新收入來源、債務投資與全球合作，力求實現長期商業化與技術領先。,https://m.cnyes.com/news/id/6192336
1242,6192521,ASML Q4營收增幅上看3成 明年中國需求估大降 盤前大漲3%,微影設備龍頭艾司摩爾 (ASML-US) 今 (15) 日發佈第三季財報與第四季展望，預期第四季營收將有大幅成長，季增 23% 至 30%，不過也坦言，明年中國需求將大幅降低，遠低於 2025、2024 年的水準。,https://m.cnyes.com/news/id/6192521
1243,6192526,巨大擴大「零招聘費」政策至所有現職移工並完成新宿舍搬遷,巨大集團今 (15) 日宣布擴大「零招聘費政策」的適用範圍，規劃補償目前在職移工過去所支付的招聘費用。此舉延續自 2025 年 1 月 1 日起已實施的政策，所有新聘移工的仲介費、服務費及相關規費皆由公司全額負担。,https://m.cnyes.com/news/id/6192526
1244,6192404,美銀預測：明年黃金衝上5000美元 白銀上看65美元,根據美國銀行的最新預測，儘管短期內存在一些波動和潛在盤整的風險，黃金和白銀仍處於不可阻擋的上漲趨勢中。美銀預計明年黃金價格將達到每盎司 5000 美元，白銀則將邁向 65 美元。,https://m.cnyes.com/news/id/6192404
1245,6191733,摩根大通CEO戴蒙：當前持有黃金是「半理性」,,https://m.cnyes.com/news/id/6191733
1246,6192496,威盛旗下威宏強化AI布局 加入Arm Total Design 生態系,威盛 (2388-TW) 旗下 ASIC 廠威宏科技今 (15) 日宣布正式加入 Arm Total Design 生態系統，此合作展現威宏科技致力於提供創新設計解決方案的承諾，並針對 AI 及 HPC 應用進行最佳化。,https://m.cnyes.com/news/id/6192496
1247,6192497,技嘉旗下技鋼攜手中東硬體製造商KERNO搶攻AI商機 深化在地製造及服務,PC 品牌技嘉 (2376-TW) 旗下技鋼今 (15) 日宣布，於 2025 杜拜 GITEX 展會期間正式宣布，委任 KERNO Enterprises FZE 成為 GIGABYTE 伺服器產品於 GCC 區域的官方服務合作,https://m.cnyes.com/news/id/6192497
1248,6192332,卡內基警告：美國礦產獨立夢難實現、關鍵礦產仍嚴重依賴中國供應鏈,卡內基國際和平基金會於 10 月發布的一份深度分析報告指出，一個不容忽視的現實正在浮現，僅靠推動礦產「國產化」的雄心，美國仍難以擺脫關鍵礦產供應的結構性困境。,https://m.cnyes.com/news/id/6192332
1249,6192471,林伯豐：中美貿易衝突複雜、景氣難樂觀 政府應支援中小企業度難關,三三企業交流會理事長林伯豐今 (15) 受訪時表示，目前觀察中美經貿衝突持續複雜，中國又採取反制措施，雖然近期新台幣匯率貶回近 30 元左右，有利出口，但在船舶運輸成本的增加下，對全球經濟的看法難以樂觀。,https://m.cnyes.com/news/id/6192471
1250,6192412,中國央行意外調升人民幣中間價 釋放強烈穩匯率信號,在美中貿易關係趨緊的背景下，中國人民銀行周三 (15 日) 透過每日參考匯率 (中間價)，強化了其人民幣匯率防禦。央行意外地將人民幣兌美元中間價調升至 7.10 元強方，此舉透露出強烈的穩匯率信號。,https://m.cnyes.com/news/id/6192412
1251,6192101,美方不再堅持全額現金 韓3500億美元投資案破冰,,https://m.cnyes.com/news/id/6192101
1252,6192475,〈台股盤後〉台積電攀新高、AI股助攻跨過2萬7 漲482點收最高點,台股今日雖然有美股回檔的陰影，但早盤由半導體、ABF 等概念股及大型權值股引導資金流向，台積電法說會前走勢頑強，收盤並以 1465 元改寫歷史新高，終場大盤收盤上漲 482.65 點，以 27275.71 點作收。,https://m.cnyes.com/news/id/6192475
1253,6192472,德銀點將：Q3財報季前夕 快買這四檔晶片股 聚焦AI和汽車,德意志銀行近日發布最新分析報告，針對即將到來的第三季財報季，推薦了四檔「買入」評級的半導體股票：博通、邁威爾科技、恩智浦、安森美半導體。,https://m.cnyes.com/news/id/6192472
1254,6192438,美國政府關門，滿7天為負面影響的關鍵門檻,,https://m.cnyes.com/news/id/6192438
1255,6192136,OpenAI與軟銀旗下Arm合作開發CPU！搭配其與博通的定制AI晶片,OpenAI 與 Arm 及博通合作開發全新 CPU 和定制 AI 晶片，計畫在 2026 年底量產，擴展至 10GW 運算能力，為數據中心市場帶來重大布局與投資機會。,https://m.cnyes.com/news/id/6192136
1256,6192446,ASML訂單超預期 但預警中國需求將顯著下滑,荷蘭半導體設備製造商艾司摩爾 (ASML) 周三 (15 日) 公布季度財報，單季淨訂單超越市場預期，但公司同時發出預警，預計 2026 年來自中國的銷售額將出現顯著下滑。,https://m.cnyes.com/news/id/6192446
1257,6192090,國企民企齊發力！中國總理李強主持經濟形勢座談會 8位與會專家與企業家有哪些？,,https://m.cnyes.com/news/id/6192090
1258,6191725,川普警告阿根廷勿與中國軍事往來 否則他會「非常不悅」,,https://m.cnyes.com/news/id/6191725
1259,6192274,電動車熱度降溫！美國、歐洲市場相繼退潮 中國上百品牌面臨生存危機,,https://m.cnyes.com/news/id/6192274
1260,6192329,李長庚樂見發展資產管理第三引擎 國泰投信目標10年內AUM衝上15兆元,國泰金控 (2882-TW) 今 (15) 日盛大舉行 2025 國泰資產管理高峰會，總經理李長庚表示，十多年前國泰便有意打造第三隻腳，發展資產管理事業，歷經多次嘗試仍未能成功，如今時機已大不相同,https://m.cnyes.com/news/id/6192329
1261,6191713,蘋果iPhone 17熱銷！出貨量逼近三星、創下有史以來最好第三季業績,蘋果最新 iPhone 17 系列熱銷，帶動高階手機出貨量增長 4%，全球市場占有率逼近三星。透過舊換新方案、分期付款與生態系統整合，蘋果再次展示其高階手機策略成功。,https://m.cnyes.com/news/id/6191713
1262,6192413,〈OCP峰會〉勤誠聚焦三大商業服務模式 助力客戶部署AI與雲端運算,勤誠參與 2025 OCP 全球峰會，勤誠聚焦三大商業服務模式，包括 OTS 標準品、JDM 聯合設計製造，以及 OEM Plus 代工加值，展示從產品設計、技術整合到全球製造的全方位服務，助力客戶高效部署 AI 與雲端運算。,https://m.cnyes.com/news/id/6192413
1263,6192399,報導：亞馬遜啟動新一波裁員潮 持續押注人工智慧,據《Fortune》雜誌報導，多位知情人士透露，亞馬遜 (AMZN-US) 正準備啟動新一波裁員計畫，預計將大幅削減人力資源部門的員工，並可能波及其他核心消費業務部門。,https://m.cnyes.com/news/id/6192399
1264,6192391,〈焦點股〉外資相挺、矽基代工展望佳 嘉晶尾盤亮燈飆漲停,嘉晶 (3016-TW) 受惠於近年 AI 伺服器需求升溫，旗下 8 吋矽基代工自下半年需求轉強，今 (15) 日在外資連 2 買相挺，加上題材挹注，尾盤在大單敲進下，一度亮燈漲停。嘉晶母公司漢磊 (3707-TW) 漲幅也逾 7%。,https://m.cnyes.com/news/id/6192391
1265,6192375,〈OCP峰會〉英特爾全新GPU Crescent Island亮相 明年下半年送樣,英特爾在此次 OCP 峰會中亮相全新資料中心 GPU，代號為「Crescent Island」，專為因應日益成長的 AI 推論工作負載需求而設計，具備高記憶體容量與高能源效率的運算效能，預計將於 2026 年下半年開始提供客戶樣品。,https://m.cnyes.com/news/id/6192375
1266,6192378,〈房產〉不選南港北士科 兩IT產業公司購入北市內湖億元級商廠辦,輝達 (NVDA-US) 在台總部仍 懸而未決，不過台灣分公司下月將搬到南港「潤泰玉成辦公大樓」，房仲業者指出，內湖和南港是目前 IT 產業主要集中的兩大區塊，根據最新實價登錄，內湖區「威尼斯國際商務大樓」7 月交易 3.6 億元。,https://m.cnyes.com/news/id/6192378
1267,6192362,暉盛11/3登創新板 明日起競拍,暉盛科技 (7730-TW) 為配合創新板初次上市前公開承銷，對外競價拍賣 1841 張，競拍底價 67.92 元，最高投標張數 193 張，暫定承銷價 72 元。競拍時間為 10 月 16 日至 20 日，10 月 22 日開標，預計 11 月 3 日掛牌。,https://m.cnyes.com/news/id/6192362
1268,6192317,〈電商備戰雙11〉網家攜手小七 推超商取貨最快的「超速配服務」,網家備戰雙 11 攜手小七推超商取貨最快的「超速配服務」,https://m.cnyes.com/news/id/6192317
1269,6192373,〈OCP峰會〉華碩亮相全新B300伺服器 GB300同步出貨挹注下半年動能,2025 OCP 全球高峰會（OCP Global Summit）日前於美國聖荷西盛大登場，華碩 (2357-TW) 本次參展推出搭載 NVIDIA® HGX B300 平台的全新 XA NB3I-E12 系列 AI 伺服器，並與內建 NV,https://m.cnyes.com/news/id/6192373
1270,6192326,AI面臨泡沫化？ 鴻海劉揚偉：算力需求非常大「現在還只是開始」,AI 面臨泡沫化？ 鴻海劉揚偉：算力需求非常大「現在還只是開始」,https://m.cnyes.com/news/id/6192326
1271,6192311,台灣週金融盛事 卓揆：3大優勢打造區域金融戰略樞紐 亞洲創新籌資平台將留資引才,國家級金融盛事「臺灣週」（Taiwan Weeks 2025）活動於今（15）日盛大開幕，系列活動將橫跨至 23 日，由金管會聯合證券周邊單位與產官學界共同舉辦，旨在打造台灣成為亞洲資產管理中心（AAMC）。行政院長卓榮泰透,https://m.cnyes.com/news/id/6192311
1272,6192316,「棄債轉金」風潮再起！黃金期貨衝破4200美元創高 ETF同步狂飆,美國聯準會主席鮑爾於最新公開演說表示，勞動力市場存在下行風險，強化市場對於本月底降息預期，加上股市相對高檔，債券前景不明，催化黃金價格表現。今 (15) 日亞洲早盤紐約期金站上 4200 美元關卡，再度刷下歷史新高,https://m.cnyes.com/news/id/6192316
1273,6192309,藥華藥美國市場再報捷 完成Ropeg筆形注射器申請,藥華藥今 (15) 日宣布，已完成向美國 FDA 提出 Ropeg 筆形注射器 (Pen Device) 產品的補充性生物製劑查驗登記申請 (sBLA)。此外，Ropeg 也預計年底前送件申請新增適應症 ET，力拚 2026 年取證。,https://m.cnyes.com/news/id/6192309
1274,6192268,〈焦點股〉麗臺在台推出輝達個人超級電腦DGX Spark 股價攻觸及漲停板,輝達 (NVDA-US) 正式推出創始版個人超級電腦 NVIDIA DGX Spark，板卡廠麗臺 (2465-TW) 宣布作為亞洲總代理引進台灣，預計將帶動營運走強，並看好全年力拚轉虧為盈，激勵今 (15) 日股價走強，早盤由黑翻紅,https://m.cnyes.com/news/id/6192268
1275,6192139,美國早就讓荷蘭「動手」！聞泰科技安世半導體遭「凍結」法庭文件曝光,中國聞泰科技旗下安世半導體遭荷蘭政府凍結並接管，法庭文件顯示美國出口管制與政治壓力可能在背後施壓。事件引發中歐輿論關注，中國企業與業界呼籲理性合作。,https://m.cnyes.com/news/id/6192139
1276,6191649,如果我們身處AI泡沫中 為什麼卻沒有「泡沫感」？,我們真的在 AI 泡沫裡嗎？《Business Insider》記者 Kafka 表示，自己曾經歷過幾次泡沫。從紙面數據來看，現在的確像是泡沫，但在現實世界中，感覺卻不太一樣。,https://m.cnyes.com/news/id/6191649
1277,6192100,AI算力戰火燒向歐洲！微軟將豪租Nscale葡萄牙資料中心 1.26萬顆輝達GPU明年初投運,,https://m.cnyes.com/news/id/6192100
1278,6191642,Fed柯林斯：今年進一步降息是明智之舉,,https://m.cnyes.com/news/id/6191642
