,newsId,title,summary,link
695,6190143,1兆再加3500-5000億鎂！OpenAI虧百億還不斷下訂單 專家：把供應商綁成「債務共同體」,,https://m.cnyes.com/news/id/6190143
696,6190304,火災波及鋁供應鏈 福特多款SUV暫停生產 全力保F系列皮卡生產,福特因供應商 Novelis 的鋁材廠突發三級火災，被迫削減旗下數款 SUV 生產，受影響車型涵蓋 Expedition、Navigator、Escape 及 Corsair 等。該鋁廠估計負責美國汽車鋁板供應約 40%,https://m.cnyes.com/news/id/6190304
697,6190018,博通執行長陳福陽：AI在全球GDP中的佔比可能會進一步提升,博通（Broadcom）執行長陳福陽指出，生成式 AI 的普及可能使全球 GDP 占比從 30% 增至 40%，帶動晶片與科技產業爆發性成長。博通與 OpenAI 攜手建置 AI 加速器，搶占產業先機。,https://m.cnyes.com/news/id/6190018
698,6190266,〈焦點股〉以哈戰爭落幕 BCI報價狂飆21% 散裝股齊歡呼,〈焦點股〉以哈戰爭落幕 BCI 報價狂飆 2 成 散裝股齊歡呼,https://m.cnyes.com/news/id/6190266
699,6190257,〈台股開盤〉美中貿易情勢稍緩 反彈大漲逾500點衝27507點新高,〈台股開盤〉美中貿易情勢暫緩 反彈大漲逾 500 點衝 27507 點新高,https://m.cnyes.com/news/id/6190257
700,6190246,〈房產〉Q3全台七都推案減 新案議價率微升至7.2%  本季保守,根據市調機構統計，2025 年第三季台七都新建案總銷金額達 4938 億元，季減 12%、年減 26%，全面呈現量縮；進場個案數 351 件、戶數 2.5 萬戶，雙雙較上季及去年同期衰退。,https://m.cnyes.com/news/id/6190246
701,6190195,美國宣布對華加徵關稅 中國商務部回應！,中國商務部新聞發言人就近期美方宣布對華加徵關稅等限制措施答記者問，表示美方不能一邊要談，一邊威脅恐嚇提出新的限制措施，這不是美中相處正確之道。,https://m.cnyes.com/news/id/6190195
702,6190142,川普成幣圈巨鯨！比特幣持倉超8.7億美元 背後藏政治大棋？,在比特幣 (BTC) 價格屢創新高的 2025 年 10 月，《富比世》爆出一則消息：美國總統川普已悄悄成為美國最大的個人比特幣持有者之一，其比特幣持倉規模超過 8.7 億美元。這消息在金融市場和政治圈激起了千層浪。,https://m.cnyes.com/news/id/6190142
703,6189862,895萬資金佔用被警告！北方稀土仍逆勢漲停 今年股價飆逾1.7倍 市值破2千億人民幣,,https://m.cnyes.com/news/id/6189862
704,6189989,AI將首先顛覆汽車產業！分析師喊買特斯拉「必持有」 激勵股價漲逾5%,特斯拉股價週一反彈逾 5%，係因分析師給予「買入」評級與 520 美元目標價激勵。分析師稱 AI 將重塑汽車產業，而特斯拉具備無人能及的技術與製造優勢。雖然近期貿易緊張，但市場更聚焦其 AI 與自駕計程車業務前景。,https://m.cnyes.com/news/id/6189989
705,6190146,巴以和談突發意外 代表團人員傷亡,一場本應彰顯和平曙光的斡旋，突然被一場車禍打斷。關鍵時刻，卡達代表團在埃及發生嚴重交通事故，中國《國防時報》周二（14 日）指出，這個突發變故，似乎昭示巴以和談前景已經蒙上新的陰影。,https://m.cnyes.com/news/id/6190146
706,6190017,蘋果預計本週發表多款新品！iPad Pro、Vision Pro、MacBook Pro全面升級M5,蘋果即將於本週發布多款新品，包括新一代 iPad Pro、Vision Pro 與 14 吋 MacBook Pro，三款裝置皆搭載全新 M5 晶片，效能大幅提升。新機外觀、記憶體與配色等細節也曝光，展現蘋果在高階裝置市,https://m.cnyes.com/news/id/6190017
707,6189946,美銀預測：明年黃金漲至每盎司5000美元,"金價週一 (13 日) 首度突破每盎司 4,100 美元，再創歷史新高，白銀價格也創下歷史新高",https://m.cnyes.com/news/id/6189946
708,6127597,【Joe’s華爾街脈動】美國科技股反彈，為台灣AI與半導體產業創造強勁順風,,https://m.cnyes.com/news/id/6127597
709,6190119,庫克首次現身抖音直播間 iPhone Air中國大陸開啟預購,蘋果似乎更會接中國市場的地氣了，執行長庫克周一（13 日）出現在 Apple Store 官方旗艦店抖音直播間，親自宣布 iPhone Air 將於 10 月 17 日上午 9 點在中國大陸開啟預購，並於 10 月 22 日正式發售，這是庫克首次在中,https://m.cnyes.com/news/id/6190119
710,6190115,英自駕技術企業Wayve再傳喜訊！繼輝達後再獲微軟軟銀20億美元投資 估值80億,,https://m.cnyes.com/news/id/6190115
711,6190013,蘋果摺疊iPhone或比預期更便宜！鉸鏈價格下調、鴻海與新日興聯手掌握生產主導權,分析師郭明錤指出，蘋果首款摺疊 iPhone 生產成本將低於預期，關鍵在於鉸鏈設計優化與鴻海量產能力。新日興與鴻海合資掌握 65% 訂單，鉸鏈價格降至 70 至 80 美元，有望提升蘋果利潤並加速 2026 年量產。,https://m.cnyes.com/news/id/6190013
712,6189960,費城Fed總裁籲進一步降息 警告就業市場風險上升,費城聯準銀行總裁鮑爾森 (Anna Paulson) 周一 (13 日) 表示，鑒於就業市場風險上升，美國聯準會 (Fed) 應進一步降息，同時淡化貿易關稅對通膨的影響。,https://m.cnyes.com/news/id/6189960
713,6190024,川普赴以色列國會 演講被打斷,美國總統川普周一（13 日）在以色列國會發表演講時，突遇抗議事件，兩名左翼議員突然起身高喊口號，並展示標語，演講一度中斷。,https://m.cnyes.com/news/id/6190024
714,6189959,美股重點新聞摘要2025年10月14日,美股重點新聞摘要 2025 年 10 月 14 日,https://m.cnyes.com/news/id/6189959
715,6188568,今年更熱鬧！專家：加密貨幣春天Q4開啟 獲三大「順風組合」加持,,https://m.cnyes.com/news/id/6188568
716,6190022,營收速報 - 2025年10月14日台股大型公司9月營收一覽（新增79家）,9月台股營收公布，2025年10月針對大型公司前一日公布79家營收。截至目前9月營收公布共計240家，其中營收年增大於+25％有45家，年增小於-20％有29家。| Anue鉅亨- 台股營收,https://m.cnyes.com/news/id/6190022
717,6190008,中國對美國船舶收取特別港務費 今起正式施行,中國交通運輸部周二（14 日）宣布，交通部當天印發《對美船舶收取船舶特別港務費實施辦法》。,https://m.cnyes.com/news/id/6190008
718,6189996,三星電子乘AI浪潮 Q3獲利逾三年最佳 ,,https://m.cnyes.com/news/id/6189996
719,6189990,白銀登上空前新高 突破1980年代「亨特兄弟」高點,,https://m.cnyes.com/news/id/6189990
720,6189947,費半暴漲近5% 晶片族群嗨 OpenAI攜手博通擴建AI算力,美股晶片族群週一 (13 日) 強彈，費半指數狂飆近 5%，收復上週五市場暴跌的失地，主因是 OpenAI 與博通簽署新合作協議，同時美中關係趨於緩和。,https://m.cnyes.com/news/id/6189947
721,6189955,〈貴金屬盤後〉黃金史上首度突破4100美元 貿易緊張和降息預期點火 ,,https://m.cnyes.com/news/id/6189955
722,6189981,量子概念股大漲！小摩豪擲1.5兆美元押寶前沿科技 搶攻次世代運算力,摩根大通啟動長達十年的「安全與韌性計畫」，承諾投資 1.5 兆美元於國安與戰略科技產業，首波聚焦量子運算、航太防務與能源技術。消息公布後，量子股全面飆升，凸顯量子技術成為美國科技競賽新核心。,https://m.cnyes.com/news/id/6189981
723,6189963,摩根大通戴蒙警告美國過度依賴「不可靠來源」啟動1.5兆美元投資計畫,摩根大通 (JPMorgan Chase) 執行長戴蒙 (Jamie Dimon) 周一 (13 日) 警告，美國已變得過度依賴外國供應商，這些供應商提供了支撐美國經濟與國家安全的關鍵材料與技術。,https://m.cnyes.com/news/id/6189963
724,6189948,川普對中貿易警訊後 特斯拉為何出現反彈？,美國電動車大廠特斯拉再度成為市場焦點，該股週一 (13 日) 股價勁揚 5.4%，收報每股 435.90 美元，成功收復上週五 5.1% 的跌幅。標普 500 指數與道瓊工業指數分別上漲 1.6% 與 1.3%。,https://m.cnyes.com/news/id/6189948
725,6189958,〈紐約匯市〉美元上漲 美中貿易緊張降溫,美元周一 (13 日) 上漲，在美國總統川普語氣轉趨緩和、緩解與中國之間的貿易緊張後，美元兌歐元與日元走升。,https://m.cnyes.com/news/id/6189958
726,6189845,eSIM手機來了！蘋果：中國顧客10/17起可預購iPhone Air,"eSIM 手機還是來了，蘋果周一（13 日）宣布，中國顧客 10 月 17 日早上 9 點起可預購 iPhone Air 機型，蘋果定 10 月 22 日起正式發售，iPhone Air 價格人民幣 7,999 元起。",https://m.cnyes.com/news/id/6189845
727,6189107,華爾街集體踩雷！First Brands破產撕開私募信貸黑幕 分析師：表外信貸水太深 真實風險是謎,,https://m.cnyes.com/news/id/6189107
728,6189728,〈能源盤後〉川習會仍有望 中美試圖緩和貿易緊張局勢 原油自5個月低點上漲,原油期貨價格周一 (13 日) 上漲，係因美國總統川普承諾將於 10 月下旬與中國國家主席習近平會面，緩解了全球最大兩個經濟體之間的貿易緊張局勢。該緊張局勢導致上周五原油基準跌至五個月低點。,https://m.cnyes.com/news/id/6189728
729,6189962,IonQ大漲16% 量子化學迎突破進展,IonQ(IONQ-US) 股價周一 (13 日) 大漲 16.19%，此前該量子運算公司宣布在量子化學模擬方面取得重大進展，這項成果有望加速脫碳技術的發展。,https://m.cnyes.com/news/id/6189962
730,6189683,【袁志峰專欄】 中港股市表現優於預期,"今日推介 - 海爾智家 (6690, $24.74), 目標價 $27.5, 止損價 $24.0",https://m.cnyes.com/news/id/6189683
731,6189734,荷蘭核心子公司驟然「失控」 聞泰科技：半導體80%產能在中國,中國半導體巨頭聞泰科技 (600745-CN) 子公司安世半導體近日遭荷蘭政府與法院雙重管控，導致公司對安世暫時失去控制，受此消息影響，聞泰科技股價周一一字跌停。,https://m.cnyes.com/news/id/6189734
732,6189850,川普關稅威脅嚇跑資金！專家：國際資本加速撤離美元資產 3大非美資產獲青睞,,https://m.cnyes.com/news/id/6189850
733,6189945,〈美股盤後〉美中貿易戰降溫 道瓊回彈超580點 台積電ADR飆近8%,在美國總統川普淡化美中貿易對峙，並表示「一切都會好起來！」後，美股週一 (13 日) 自上週五暴跌中回彈，四大指數全面反彈。,https://m.cnyes.com/news/id/6189945
734,6189877,〈台股盤前要聞〉稀土限制恐引供應鏈漲價效應、記憶體4大產品線全缺貨、外資狠賣權值雙雄,台股盤前要聞,https://m.cnyes.com/news/id/6189877
735,6189730,庫克再度訪問中國 首站現身LABUBU上海展覽,據《澎湃新聞》周一（13 日）報導，蘋果執行長庫克現身上海 THE MONSTERS 十周年巡展，這是庫克此次訪問中國的第一站。,https://m.cnyes.com/news/id/6189730
736,6189846,荷蘭政府以國安為由 接管中企子公司Nexperia 中國外交部：濫用國安概念 歧視中企！,荷蘭政府以「重大治理缺失」與關鍵技術外流疑慮為由，宣布接管中國控股的晶片廠 Nexperia。政府利用《貨物可用性法案》取得干預權，法令授權可阻止有害決策，同時暫時剝奪中國母公司對其控制力，以維護歐洲經濟安全與科技主權。,https://m.cnyes.com/news/id/6189846
737,6189458,中國9月稀土出口銳減30.9% 寫下今年2月以來新低,"《觀察者網》周一（13 日）查詢中國海關總署網站獲悉，9 月中國出口稀土 4,000.3 噸，金額為 5,960 萬美元，數量較 8 月（5,791.8 噸）銳減 30.9%，連續第三個月下降，寫下今年 2 月以來新低。",https://m.cnyes.com/news/id/6189458
738,6189952,鉅亨速報 - Factset 最新調查：Novo Nordisk - ADR(NVO-US)EPS預估下修至3.68元，預估目標價為69.89元,FactSet 最新調查：Novo Nordisk - ADR(NVO-US)EPS預估下修，預估EPS、預估營收、目標價、歷史獲利表現、即時新聞資訊,https://m.cnyes.com/news/id/6189952
739,6189763,傳統銀行進軍區塊鏈 花旗搶灘加密託管與穩定幣,花旗銀行宣布將於 2026 年推出加密貨幣託管服務，並同步探索穩定幣發行可能。該行表示，此舉將結合自研技術與第三方合作，為機構客戶提供安全且合規的數位資產管理方案，象徵華爾街正全面進入加密金融新時代。,https://m.cnyes.com/news/id/6189763
740,6189457,中國9月出口大幅上行超預期 關稅波動下外貿承壓加大,面對動盪外部形勢，中國外貿頂壓前行。據海關統計顯示，今年前三季中國貨物貿易進出口人民幣 33.61 兆元，年增 4%，其中出口增長 7.1%，進口下降 0.2%。,https://m.cnyes.com/news/id/6189457
741,6189901,美股3年多頭不止步？專家看漲到2026年！,根據《CNBC》周一 (13 日) 報導，美股多頭行情迎來三周年里程碑。自 2022 年 10 月 12 日標普 500 指數在聯準會 (Fed) 啟動升息循環後觸底以來，該指數已反彈逾 89%，創下歷史新高。歷史經驗顯示，當多頭行情邁入第三年後，,https://m.cnyes.com/news/id/6189901
742,6189923,鉅亨速報 - Factset 最新調查：雪佛龍(CVX-US)EPS預估下修至7.55元，預估目標價為170.00元,FactSet 最新調查：雪佛龍(CVX-US)EPS預估下修，預估EPS、預估營收、目標價、歷史獲利表現、即時新聞資訊,https://m.cnyes.com/news/id/6189923
743,6189900,川普本周五會晤澤倫斯基 考慮升級軍援對抗俄羅斯,《CNBC》周一 (13 日) 報導，美國總統川普預計於本周五 (17 日) 在白宮與烏克蘭總統澤倫斯基會面，成為雙方三個月內第二次正式會晤。另據《NBC 新聞》報導，這次安排是在兩人周末通話兩次後敲定，雙方討論了美國可能批准向烏克蘭,https://m.cnyes.com/news/id/6189900
744,6189891,六大壽險9月合賺近300億元 前3季獲利突破千億年減57%,壽險業今年中歷經新台幣暴力升值之亂，第三季損益狀況逐漸回穩，六大壽險今 (2025) 年 9 月稅後純益合計為 297.55 億元，較前一月大增約 78%，累計前三季稅後純益突破千億、達 1008.63 億元，仍較去年同,https://m.cnyes.com/news/id/6189891
745,6189818,雲端火爆卻不賺錢？甲骨文AI大會成焦點,"《彭博》周一 (13 日) 報導，軟體巨擘甲骨文 (Oracle)(ORCL-US) 本周在拉斯維加斯舉行為期四天的 AI World 大會，外界視為公司能否延續今年近 4,000 億美元市值漲勢的關鍵時刻。此次活動焦點聚集在其快速擴張的",https://m.cnyes.com/news/id/6189818
746,6189876,北士科案現轉機？輝達願承擔補償金 新壽：待內部評估後函復北市府,輝達進駐北士科案卡關，北市府今 (13) 日已發函給新光人壽，希望對方提出具體合意解約條件與金額，台北市副市長李四川透露，輝達有意願概括承受補償金額，希望三方坐下來談,https://m.cnyes.com/news/id/6189876
747,6189864,輝達Spectrum-X震撼登場！Meta、甲骨文搶搭AI資料中心升級潮,綜合外媒報導，晶片巨擘輝達 (NVDA-US) 周一 (13 日) 宣布，社群平台業者 Meta(META-US)與雲端服務供應商甲骨文 (ORCL-US) 將採用其新一代 Spectrum-X 乙太網路交換技術，用於人工智慧 (AI) 資料中,https://m.cnyes.com/news/id/6189864
748,6189727,OPEC月報：全球石油需求預測不變 明年油市將轉趨寬鬆,石油輸出國組織 (OPEC) 周一 (13 日) 在最新月報中表示，全球石油需求展望維持不變，但隨著石油輸出國組織及盟國 (OPEC+) 持續增產，2026 年油市供應將更接近平衡，原先預期的供應缺口將顯著縮小。,https://m.cnyes.com/news/id/6189727
749,6189664,13家金控9月合賺690億元 富邦金蟬聯三冠王、玉山金前9月唯一賺贏去年,13 家上市金控 2025 年 9 月自結獲利全數出爐！新台幣匯率續貶，有利減輕壽險型金控避險壓力，加上股市維持高檔，整體獲利表現穩健。根據各公司公告，13 家金控 9 月稅後純益合計約 690 億元，較 8 月增加逾百,https://m.cnyes.com/news/id/6189664
750,6189800,不是OpenAI！博通澄清100億美元神祕客戶傳聞,晶片大廠博通 (Broadcom)(AVGO-US) 周一 (13 日) 澄清，外界盛傳的「神祕 100 億美元客戶」並非人工智慧 (AI) 新創公司 OpenAI。博通半導體解決方案事業總裁卡瓦士 (Charlie Kawwas) 在接受《C,https://m.cnyes.com/news/id/6189800
751,6189825,營收速報  - 台新新光金(2887)9月營收239.48億元年增率高達236.79％,"2025年9月台新新光金(2887-TW) 營收年增成長236.79% , 盤後股價為18.55元",https://m.cnyes.com/news/id/6189825
752,6189668,誰先眨眼？川普與習近平再陷僵局 市場神經緊繃,《彭博》周一 (13 日) 報導，美國總統川普與中國國家主席習近平間的新一輪角力本周陷入僵局，雙方互相指責對方應先行一步。分析人士警告，若對抗升溫，恐再度衝擊全球市場。,https://m.cnyes.com/news/id/6189668
753,6189794,台新新光金前9月賺260億元EPS 1.51元 合併會計調整影響獲利,台新新光金控 (2887-TW) 今 (13) 日公布 2025 年 9 月自結稅後純益 75 億元，累計前 9 月稅後純益 260.4 億元，創歷年同期新高，每股稅後純益(EPS)1.51 元。公司說明，依據國際財務報導準則第 3 號(IFRS 3，企,https://m.cnyes.com/news/id/6189794
754,6189768,從2吉瓦到33 吉瓦！OpenAI攜手博通打造兆級AI 晶片 博通盤前暴漲10%,OpenAI 宣布與晶片巨頭博通合作，大幅擴張其 AI 運算版圖，共同打造 10 吉瓦級別的人工智慧加速晶片。此舉標誌著 OpenAI 朝向自研晶片與能源效率優化的重要一步，也使博通在 AI 基礎設施市場地位再度躍升。,https://m.cnyes.com/news/id/6189768
755,6189610,〈美股早盤〉川普軟化對中立場 主要指數開高,美股主要指數周一 (13 日) 開高走揚，道瓊指數一度大漲逾 500 點。美國總統川普放軟對中國的貿易言辭，緩解市場對美中緊張升溫的憂慮，投資人重返風險資產。美中雙方皆釋出願維持談判意願的訊號，與此同時晶片大廠博通(AVGO-US,https://m.cnyes.com/news/id/6189610
756,6189746,中鋼9月營收243.84億元月減1% 鋼材需求逐漸自谷底反彈,中鋼 9 月營收 243.84 億元月減 1% 鋼材需求逐漸自谷底反彈,https://m.cnyes.com/news/id/6189746
757,6189678,四寶Q4展望僅台塑估業績成長 地緣政治影響油價下檔有撐,受惠油價與台幣匯率回穩，包括南亞 (1303-TW)、台化 (1326 -TW)、台塑化 (6505 -TW) 第 3 季皆由虧轉盈。展望未來，四寶中僅台塑表示，面臨石化需求旺季，估第 4 季營收有望季增。,https://m.cnyes.com/news/id/6189678
758,6189731,Beyond Meat股價崩逾六成 債務換股引爆恐慌,美國植物肉製造商 Beyond Meat 周一 (13 日) 盤前股價一度暴跌逾 60%，創歷史新低，因公司宣布提前結清可轉換債交換方案，導致股東持股將遭嚴重稀釋。截稿前，Beyond Meat(BYND-US)股價下跌 56.9%，,https://m.cnyes.com/news/id/6189731
759,6189626,印度與美國重啟貿易談判：新德里承諾增購美國能源以解決爭議,據《路透》報導，印度與美國本周預計將在華盛頓舉行新一輪貿易會談。據一位官員透露，新德里已承諾將增加進口美國的能源與天然氣，此舉旨在回應華盛頓方面對印度持續購買俄羅斯石油的擔憂。,https://m.cnyes.com/news/id/6189626
760,6189621,摩根大通推1.5兆美元投資計畫 聚焦美國經濟安全,綜合外媒報導，美國金融巨頭摩根大通 (JPM-US) 周一 (13 日) 宣布，未來 10 年將投入或協助籌資高達 1.5 兆美元，用於支援與美國經濟安全和戰略韌性相關的產業，涵蓋國防、能源科技、先進製造與關鍵材料供應鏈等領域。,https://m.cnyes.com/news/id/6189621
761,6189569,Ark Invest 重申以太幣強勁潛力：2030年上看2.4萬美元,由伍德 (Cathie Wood) 領導、以專注於顛覆性創新而聞名的 Ark Invest，持續看好加密貨幣領域的發展。根據 Ark Invest 對市場前景進行的最新評估，他們預計，到 2030 年，整個加密貨幣市場的總市值可能飆升,https://m.cnyes.com/news/id/6189569
762,6189712,鉅亨速報 - Factset 最新調查：阿里巴巴集團控股(BABA-US)EPS預估下修至7.38元，預估目標價為211.32元,FactSet 最新調查：阿里巴巴集團控股(BABA-US)EPS預估下修，預估EPS、預估營收、目標價、歷史獲利表現、即時新聞資訊,https://m.cnyes.com/news/id/6189712
763,6189711,鉅亨速報 - Factset 最新調查：諾華NVS-US的目標價調升至131.47元，幅度約4.63%,FactSet 最新調查：諾華NVS-US目標價調升，最高估值、最低估值、中位數、綜合評級、近5日股價、標普、即時新聞資訊,https://m.cnyes.com/news/id/6189711
764,6189638,加薩戰火熄滅！川普宣布和平協議 迎接「新中東黎明」,綜合外媒報導，美國總統川普周一 (13 日) 在以色列國會 (Knesset) 發表演說，宣布加薩戰爭正式結束，並宣告以哈和平協議生效，稱這是「中東新時代的黎明」(Dawn of a New Middle East)。這場歷時近兩,https://m.cnyes.com/news/id/6189638
765,6189658,〈電商備戰雙11〉富邦媒看好電商旺季 Q4營運樂觀,富邦媒看好 Q4 電商旺季 將備戰雙 11,https://m.cnyes.com/news/id/6189658
766,6189636,榮剛9月營收重返9億元月增2成 CC連鑄線Q4熱試車,榮剛 9 月營收重返 9 億元月增 2 成 CC 連鑄線 Q4 熱試車,https://m.cnyes.com/news/id/6189636
767,6189635,公股4金2銀報喜！前9月獲利衝破1100億元 華南金、臺企銀單月成長強勢逆襲,公股四金二銀 9 月自結盈餘出爐，累計前三季合賺 1100.67 億元，年增 5.52%，前九月獲利排名不變，仍為公股獲利王兆豐金（2886-TW）居冠，第一金（2892-TW）及華南金（2880-TW）緊追在後；單月獲利表現則重,https://m.cnyes.com/news/id/6189635
768,6189643,元山受惠AI伺服器需求旺前三季營收年增9% 2026上半年仁武新廠放量貢獻,元山受惠 AI 伺服器與晶片市場規模持續擴大，高階液冷滲透率提升，9 月營收 3.66 億元，年月雙成長，累計今年前三季營收 31.92 億元，年增 9.43%。，此外，高雄仁武新廠已完工，預計 2026 上半年放量貢獻。,https://m.cnyes.com/news/id/6189643
769,6189383,中美貿易戰新武器：中國祭出電池出口限制 鎖定華府能源命脈,分析師指出，中國最近宣布對電池出口實施的一系列限制措施，可能對美國企業造成重大影響。,https://m.cnyes.com/news/id/6189383
770,6189624,小米SU7事故掀門把安全爭議 股價一度創半年最大跌幅,中國科技巨擘小米 (01810-HK) 周一 (13 日) 股價下跌逾 5%，主因中國境內發生一起涉及該公司電動車的致命車禍，有報導指出車輛起火後車門無法打開，造成一人喪生。,https://m.cnyes.com/news/id/6189624
771,6189623,〈電信三雄財報〉電信三雄受惠iPhone 17熱銷9月營收亮眼 遠傳成長幅度居冠,電信三雄中華電信 (2412-TW)、台灣大 (3045-TW) 及遠傳 (4904-TW) 受惠蘋果 (AAPL-US)iPhone 17 系列熱銷，9 月營收表現皆亮眼。其中，遠傳 9 月營收月增逾 2 成、年增逾 1 成，成長幅度居冠。 ,https://m.cnyes.com/news/id/6189623
772,6189634,台股失守2萬7 外資猛砍563億元 甩賣台積電、鴻海各1.9萬張,"受中美貿易戰突然升溫影響，盤中在買盤拉抬下，跌幅收斂，終場收 26,923.42 點，下跌 378.5 點或 1.39%，成交量增至 6,084.6 億元。其中外資大賣 563.13 億元，賣超最多為台積電、鴻海。",https://m.cnyes.com/news/id/6189634
773,6189419,〈台塑四寶業績〉9月營收2好2壞 南亞受惠電子材料需求強勁、年月雙增最優,四寶今 (13) 日公布 9 月營收，其中南亞 (1303-TW) 電子材料產品因網通、伺服器需求穩定，客戶面對材料漲價趨勢，積極備貨帶動業績增加，單月營收 221.72 億元，月增 6.3%、年增 3.5%，為 4 寶之首。,https://m.cnyes.com/news/id/6189419
774,6189450,摩根士丹利警告：若中美貿易戰未解 美股有暴跌11%風險,摩根士丹利首席美國股票策略師 Michael Wilson 警告，如果中美之間的貿易緊張局勢，未能在 11 月期限前得到解決，美股面臨高達 11% 的下跌風險。,https://m.cnyes.com/news/id/6189450
775,6189570,安格砸1.98億元入股欣普羅 神盾集團大搶AI視覺商機,神盾 (6462-TW) 旗下安格 (6684-TW) 今 (13) 日宣布以每股 30 元參與欣普羅 (6560-TW) 私募增資，投資總額約新台幣 1.98 億元，以欣普羅今日收盤價推算，折價幅度約 26%。,https://m.cnyes.com/news/id/6189570
776,6189529,豐興鋼筋、型鋼齊跌 加速消除下游觀望氣氛,豐興鋼筋、型鋼齊跌 加速消除下游觀望氣氛,https://m.cnyes.com/news/id/6189529
777,6189504,2025年諾貝爾經濟學獎：3名學者因闡釋「創新驅動型經濟成長」獲殊榮,瑞典皇家科學院周一 (13 日) 宣布，2025 年諾貝爾經濟學獎將授予 Joel Mokyr、Philippe Aghion 以及 Peter Howitt 3 位學者。他們獲獎的原因是「解釋了創新驅動的經濟成長」。,https://m.cnyes.com/news/id/6189504
