,newsId,title,summary,link
336,6356929,今天收假！如果228連假有加班怎麼算？勞動部幫你算「這天」上班領最多,228 和平紀念日連假今結束，勞動部針對連假期間的出勤工資給付做出詳細說明。由於今年和平紀念日適逢星期六，若勞資雙方約定週六為休息日，則應於 2 月 27 日星期五補假一日。以月薪 36000 元的勞工為例，2 月 27 日補假日性質為國定,https://m.cnyes.com/news/id/6356929
337,6357048,川普曝突襲伊朗「退場方案」！加碼親揭發動空襲「兩大原因」,美國總統川普啟動「史詩怒火」軍事行動空襲伊朗，強調手握多條退路，可長期推進或 2 至 3 天內收手。川普指出談判破裂與伊朗長期行徑為動武主因，並稱「午夜重鎚」行動重創核設施，避免伊朗發展核武。未來是否轉向外交備受關注。,https://m.cnyes.com/news/id/6357048
338,6356739,周末衝突改寫金價劇本！華爾街急調升目標價至5800美元 散戶如何上車？,,https://m.cnyes.com/news/id/6356739
339,6356561,德國總理訪中敲定120架空中巴士大單！波音遭冷落或引川普不滿,德國總理默茨訪中兩天敲定最多 120 架空中巴士客機訂單，使總採購規模逼近 300 架，波音遭冷落引發關注。此行不僅穩住中德經貿基本盤，也為歐盟對中政策定調，強調反對脫鉤、深化合作，在全球供應鏈與地緣政治博弈中釋出關鍵訊號。,https://m.cnyes.com/news/id/6356561
340,6357006,伊朗啟動臨時領導機制！川普：已有「合適人選」執掌伊朗政權、伊朗報復持續,伊朗最高領袖哈米尼殉職後，德黑蘭依憲法成立臨時領導委員會，由總統與司法高層代理職權。美國總統川普稱空襲「進展順利」，警告伊朗勿升級報復。革命衛隊展開第六輪飛彈與無人機攻擊，中東局勢全面升溫。,https://m.cnyes.com/news/id/6357006
341,6356989,伊朗最高領袖遭斬首細節曝！美以精準鎖定高層會議時刻突襲、投擲30枚重磅炸彈,美國與以色列鎖定伊朗最高領袖哈米尼與高層幕僚會議時間發動突襲，成功擊斃哈米尼與多名伊斯蘭革命衛隊高層。川普證實透過精密情報與追蹤系統鎖定行蹤。中東局勢急遽升溫，伊朗展開報復性攻擊，衝突走向備受關注。,https://m.cnyes.com/news/id/6356989
342,6356927,川普不怕油價震？美國不考慮釋放戰略原油儲備、OPEC+考慮增產,美國與以色列對伊朗發動軍事打擊後，全球油市緊繃。美國能源部表示未討論動用戰略石油儲備（SPR），市場焦點轉向 OPEC + 是否擴大增產。隨荷姆茲海峽局勢升溫，供應風險攀升，油價是否突破 100 美元成關鍵觀察。,https://m.cnyes.com/news/id/6356927
343,6356926,美以襲擊伊朗引爆能源危機？油價若衝百美元通膨恐升0.7%、Fed 降息步調懸了？,美國與以色列對伊朗發動軍事打擊，市場憂心石油與 LNG 供應中斷。若荷姆茲海峽受阻，全球原油與天然氣價格恐飆升，推升通膨並影響央行政策。中東出口、OPEC + 決策與亞洲能源市場成關鍵觀察焦點。,https://m.cnyes.com/news/id/6356926
344,6356930,缺工潮新救星！瑞銀看好「具身AI」垂直應用 人形機器人出貨量衝刺500%成長,瑞銀財富管理投資總監辦公室（CIO）高度看好具身 AI（Embodied AI）在人形機器人、先進駕駛輔助系統及工業自動化的垂直應用，認為 AI 進步正開啟新成長空間。隨著視覺語言動作模型與算力的突破，機器人已能處理複雜任務，,https://m.cnyes.com/news/id/6356930
345,6355940,全球第2！GEM：台灣創業環境僅次阿聯、超車美日韓 AI與永續表現排名前4「極優」,根據全球創業觀察（GEM）最新發布的《2025/2026 全球報告》，台灣在 53 個經濟體中奪下「國家創業環境指數（NECI）」全球第 2 名的佳績，僅次於阿拉伯聯合大公國，表現遠優於南韓（第 8）、日本（第 17）及美國（第 20）,https://m.cnyes.com/news/id/6355940
346,6356920,旭東AI雙引擎發動 今年營收大爆發估轉盈,自動化設備廠旭東 (4537-TW) 近年積極轉型，受惠雲端服務供應商 (CSP) 要求 ODM 廠前往美國擴產，旭東搭上美國製造趨勢，接獲大量自動化訂單，加上半導體受惠探針卡需求激增，相關設備訂單持續向上，雙引擎驅動下，法人估，旭,https://m.cnyes.com/news/id/6356920
347,6356915,哈米尼殉職、伊朗革命衛隊誓言「嚴懲凶手」！美以空襲釀40名高官、哈米尼親屬身亡？,伊朗最高領袖哈米尼傳於美以空襲中殉職，伊朗伊斯蘭革命衛隊發聲明誓言「嚴懲凶手」，並預告展開「史上最猛烈進攻行動」。另傳約 40 名伊朗高官身亡、全國哀悼 40 天，中東局勢急遽升溫。,https://m.cnyes.com/news/id/6356915
348,6356916,伊朗最高領袖哈米尼早已佈局完整繼承體系！接班人或是「他」,伊朗證實最高領袖阿里 · 哈梅內伊於 28 日遇襲身亡，結束 37 年統治。回顧其革命歷程、健康風波與暗殺未遂紀錄，同時揭露接班布局與拉里賈尼接掌核心權力的關鍵動向，中東局勢恐再生變。,https://m.cnyes.com/news/id/6356916
349,6356398,瑞銀下調「美股」資產配置等級 投行在擔心什麼？,全球股票策略主管 Andrew Garthwaite 已將美股在全球股票資產配置等級下調至「中性配置」，認為過去多年支撐美股領先全球的動能正逐步減弱。,https://m.cnyes.com/news/id/6356398
350,6355779,免驚元宵變盤！法人：3月二大盛會接力點火科技股 非電優選軍工與金融,台股本周在 AI 題材熱度與強勁基本面支撐下，上演「萬馬奔騰」行情，馬年開市後短短 4 個交易日，大盤天天刷新歷史紀錄,https://m.cnyes.com/news/id/6355779
351,6355896,毛小孩經濟強 泰山前董事長詹岳霖創新局「愛貓工廠」4/1開幕,泰山 (1218-TW) 前董事長詹岳霖在卸下董事長職務後，在食品業界以寵物食品開創另一新局，在屏東農業科技園區設廠並砸下近 3 億元設廠，主要生產以貓咪爲主的寵物食品，屏東愛猫工廠將在 4 月 1 日正式揭幕。,https://m.cnyes.com/news/id/6355896
352,6356796,巴菲特任內最後一季財報出爐！波克夏營業利益大減近30%、保險獲利重挫,"波克夏 2025 年第四季稅後營業利益年減 30% 至 102 億美元，保險承保獲利大減 54%，並認列西方石油 57 億美元減損。儘管現金部位仍高達 3,730 億美元，公司連三年淨賣股且未回購股票。巴菲特交棒後由阿貝爾接任執行長，市場關注",https://m.cnyes.com/news/id/6356796
353,6355758,〈觀察〉隱形眼鏡廠深耕高階產品 晶碩、視陽布局效益顯現,隱形眼鏡廠陸續切入高階產品，包括矽水膠、散光鏡片、漸進多焦 (老花) 鏡片等，晶碩 (6491-TW) 及視陽 (6782-TW) 深耕高階產品，相關效益將逐步發酵。 ,https://m.cnyes.com/news/id/6355758
354,6356875,伊朗證實最高領袖哈米尼遇襲身亡 全國哀悼40天,伊朗國營電視台證實，最高領袖哈米尼遇襲身亡，享年 86 歲。,https://m.cnyes.com/news/id/6356875
355,6356872,伊朗國家媒體證實最高領袖哈米尼身亡消息,伊朗國家媒體證實，伊朗最高領袖哈米尼（Ayatollah Khamenei）在美國與以色列對伊朗發動的空襲中遇襲身亡。根據《路透》報導，此次軍事行動發生於週六（28 日），震撼中東局勢。本文整理哈米尼生平背景與事件重點，,https://m.cnyes.com/news/id/6356872
356,6356786,美國以色列聯手打擊伊朗懶人包：衝突背景、戰略目的、軍力對比全解析,以色列與美國聯手空襲伊朗總統府及多處戰略設施，引爆中東局勢急遽升溫。伊朗飛彈反擊特拉維夫並襲擊美軍中東基地，美伊核談判破局成導火線。川普與納坦雅胡揭示戰略目標，雙方軍力對比與戰局走向一次解析。,https://m.cnyes.com/news/id/6356786
357,6354815,星系部署進入密集期，低軌衛星設備與零組件需求加速放量:昇達科、啟碁、華通、燿華、耀登,,https://m.cnyes.com/news/id/6354815
358,6245072,MWC 2026 3/2開跑 台廠強攻AI與次世代通訊供應鏈,2026 年世界行動通訊大會將於 3 月 2 日在西班牙巴塞隆納盛大開幕。神準 (3558-TW)、合勤控 (3704-TW)、光寶科 (2301-TW)、正文 (4906-TW) 等台廠磨刀霍霍，鎖定人工智慧代理、次世代 Wi-,https://m.cnyes.com/news/id/6245072
359,6356780,美伊緊張局勢持續升高 將如何影響全球市場？,,https://m.cnyes.com/news/id/6356780
360,6356852,川普稱伊朗最高領袖身亡 哈米尼四位親屬據稱也身亡,美國總統川普周六（28 日）在社交媒體 Truth Social 上發文表示，伊朗最高領袖哈米尼已身亡。,https://m.cnyes.com/news/id/6356852
361,6356793,美官員揭川普攻伊朗高風險高回報算計：中東恐現世代級地緣轉折,美國啟動「史詩怒火」（Operation Epic Fury）空襲伊朗，川普在行動前獲國安高層簡報，坦言美軍恐面臨重大傷亡風險，但此舉可能帶來有利美國的中東地緣政治轉變。伊朗隨後報復，以色列與海灣,https://m.cnyes.com/news/id/6356793
362,6356843,伊朗最高領袖哈米尼傳身亡！川普：美以空襲已除掉大量領導層,美國總統川普表示，伊朗最高領袖哈米尼恐已在美國與以色列空襲中身亡。多家媒體援引以色列官員說法報導相關消息，川普稱空襲「已成功」，並指伊朗高層傷亡慘重、重建恐需數年,https://m.cnyes.com/news/id/6356843
363,6356838,伊朗革命衛隊封鎖荷姆茲海峽！油輪全面停航、全球五分之一石油運輸受阻,中東局勢升溫，歐盟海軍 Aspides 行動證實接獲伊朗革命衛隊警告，禁止船隻通過荷姆茲海峽。受美以軍事行動影響，油輪停航、能源公司暫停運輸，全球約五分之一石油供應面臨衝擊。,https://m.cnyes.com/news/id/6356838
364,6356758,〈熱門股〉低軌衛星、光通訊產品加持 穩懋周漲37.4%衝破300元大關,穩懋因手機業務飽和，近年轉向發展 AI 光通訊、低軌衛星發展，包括美國光通訊大廠持續擴大委外代工，穩懋作為其核心夥伴，受惠程度最高，加激勵穩懋周漲 37.4%，周 K 連收 2 紅，也衝破 300 元大關創近 4 年來波段新高。,https://m.cnyes.com/news/id/6356758
365,6356820,川普聲稱：伊朗最高領袖哈米尼已經身亡,美國總統川普在自家社群平台發文，宣稱伊朗最高領袖哈米尼已經身亡，並形容此舉是對伊朗人民以及全球受害者的「正義」。,https://m.cnyes.com/news/id/6356820
366,6356771,"波克夏「後巴菲特時代」首封股東信：巴菲特仍坐鎮、現金3,733億美元不是退場訊號","波克夏發布 2025 年度股東信，新任執行長阿貝爾首度執筆，宣告公司正式邁入後巴菲特時代。他強調將延續財務保守與紀律投資文化，截至 2025 年底現金部位達 3,733 億美元，並重申不發放股利政策不變，同時親自",https://m.cnyes.com/news/id/6356771
367,6356801,美伊開戰引爆能源危機！國際LNG價格飆升 台灣中油天然氣價今起調漲3%,美國與以色列於 28 日聯手對伊朗展開大規模軍事行動，美國總統川普宣布已啟動「大規模作戰行動」（Operation Epic Fury），針對德黑蘭等重要戰略目標發動空襲。受此地緣政治劇震影響，國際能源市場恐慌情緒蔓延，加上,https://m.cnyes.com/news/id/6356801
368,6356675,美以空襲伊朗 賴清德：密切注意情勢、評估原物料及能源價格波動,美國與以色列本周六 (28 日) 聯手對伊朗首都德黑蘭等多處發動飛彈攻擊，總統賴清德也表示，國安團隊已在第一時間向我彙報最新狀況，並持續掌握相關情勢發展，審慎評估可能帶來的各項影響，特別是國際原物料與能源價格波動。,https://m.cnyes.com/news/id/6356675
369,6356798,伊朗稱襲擊14處美軍基地！伊朗外長嗆：川普尋求伊朗政權更替是「不可能的任務」,伊朗軍方透露，中東地區已有 14 處美軍基地遭襲，伊斯蘭革命衛隊更宣稱發射多枚飛彈命中美軍戰鬥支援艦，並警告相關海域美軍資產已納入打擊範圍。伊朗外長阿拉格齊強調行動屬自衛，拒絕政權更替說法，同時重申不放棄鈾濃縮權利，美伊關係,https://m.cnyes.com/news/id/6356798
370,6356787,美國、以色列開戰伊朗！中國、俄羅斯發聲  要求聯合國召開緊急會議,美國與以色列對伊朗發動軍事打擊，中東局勢急速升溫。俄羅斯與中國要求聯合國安全理事會召開緊急會議審議情勢，並分別發表聲明回應。聯合國秘書長古特雷斯譴責軍事升級，呼籲立即停火並重返談判。俄中強調尊重主權、遵守國際法，警告衝突,https://m.cnyes.com/news/id/6356787
371,6356768,伊朗稱飛彈反擊釀200名美軍傷亡？革命衛隊警告川普：尚未動用「神秘武器」,中東衝突升溫，伊朗伊斯蘭革命衛隊宣稱飛彈反擊已造成約 200 名美軍傷亡，並指美軍部署於卡達的雷達系統遭摧毀。革命衛隊高層更警告唐納 · 川普，伊朗尚未啟用真正的「神秘武器」，區域局勢持續緊張。,https://m.cnyes.com/news/id/6356768
372,6356558,輝達財報越亮眼市場越焦慮？《巴隆周刊》揭「兩大隱憂」,在輝達（NVDA-US）公布亮眼財報之際，AI 熱潮持續升溫，但市場焦點轉向雲端巨頭資本支出破兆美元的隱憂。微軟、Meta、亞馬遜、Google 與甲骨文大舉投資 AI，恐壓縮現金流並衝擊 S&amp;P 50,https://m.cnyes.com/news/id/6356558
373,6356745,多國要求嚴禁通過 荷姆茲海峽油輪運輸陷入停滯,中東戰火再起，美國總統川普在社群平台 Truth Social 證實美國參與對伊朗的攻擊行動。國際油輪流量監測系統的實時數據顯示，目前荷姆茲海峽周邊海域的油輪航行速度已普遍降至零，航運陷入停滯狀態。,https://m.cnyes.com/news/id/6356745
374,6356530,美國防部封殺Anthropic後轉向OpenAI！AI自主武器與大規模監控爭議全面升級,OpenAI 與美國國防部達成協議，將 AI 模型部署至機密網路，並納入禁止國內大規模監控與自主武器須由人類負責等原則。此前 Anthropic 遭國防部列為供應鏈風險，雙方因 AI 軍事應用與監控爭議決裂，矽谷與川普政府裂痕擴大。,https://m.cnyes.com/news/id/6356530
375,6356680,美以斬首行動未果？伊朗高層全「逃過一劫」！川普宣布襲擊演講全文,以色列與美國對伊朗發動空襲，傳伊朗國防部長兼陸軍總司令哈塔米身亡但未獲證實。川普宣布展開重大作戰行動，伊朗隨即發射 50 至 70 枚彈道飛彈報復，特拉維夫響起空襲警報，中東局勢急速升溫。,https://m.cnyes.com/news/id/6356680
376,6356682,美國五大軍種出動攻伊朗！德黑蘭發布國安公告、革命衛隊啟動「誠實承諾4號」反擊,美國動員太空部隊、空軍、海軍、陸戰隊與陸軍對伊朗展開軍事行動。伊朗最高國家安全委員會發布第 1 號公告，宣布果斷回應美以攻擊，全國學校停課、政府降載運作；革命衛隊啟動「誠實承諾 4 號」跨境打擊，中東局勢持續升溫。,https://m.cnyes.com/news/id/6356682
377,6356684,伊朗局勢如何影響金價？未來48小時決定黃金走勢,中東緊張局勢升級如何影響金價？業界人士表示，這高度依賴伊朗反擊的烈度與衝擊擴散範圍。,https://m.cnyes.com/news/id/6356684
378,6356679,伊朗報復美國中東軍事基地揚言「無紅線」！科威特、阿聯、卡達等多國發生爆炸,美國與以色列對伊朗發動軍事攻擊後，伊朗隨即反擊中東多處美軍基地，巴林第五艦隊、卡達烏代德基地、科威特與阿聯相繼傳出爆炸聲。川普宣布展開「史詩怒火」行動，伊朗揚言報復無紅線，中東局勢急遽升溫。,https://m.cnyes.com/news/id/6356679
379,6356667,「小米超跑」登熱搜！巴塞隆納發表會倒數、新一代SU7安全升遷亮相,「小米超跑」話題衝上熱搜，小米將於巴塞隆納舉行小米 17 系列全球發布會。雷軍預告手機、汽車與 AI 將有新驚喜，新一代 SU7 升級 9 氣囊、2200 兆帕超強鋼與雷射雷達強化安全，同時訂下 2026 年交付 55 萬輛目標，市場高度關注。,https://m.cnyes.com/news/id/6356667
380,6356663,伊朗遭美以空襲引爆市場恐慌！比特幣跌破6.35萬美元、15萬人爆倉,"中東局勢升溫，以色列與美國聯手空襲伊朗，全球市場劇烈震盪。比特幣一度跌破 63,500 美元，SOL、DOGE 重挫逾 10%，24 小時爆倉金額高達 4.94 億美元。市場質疑比特幣避險地位，貝瑞直指其投機本質。",https://m.cnyes.com/news/id/6356663
381,6356654,伊朗展開「毀滅性」報復！射飛彈回擊以色列、拉響防空警報,美國與以色列對伊朗發動聯合軍事打擊後，伊朗隨即向以色列發射飛彈報復，全境拉響防空警報。川普宣布對伊朗展開重大作戰行動，誓言摧毀飛彈與核設施，美軍福特號、林肯號雙航母同步部署中東，區域局勢急速升溫。,https://m.cnyes.com/news/id/6356654
382,6356652,川普證實美軍對伊朗展開「重大作戰行動」！美軍從空中與海上對伊朗發動攻擊,美國總統川普證實，美軍已對伊朗展開重大作戰行動，從空中與海上發動攻擊，德黑蘭南部多個政府設施成為目標。川普指控伊朗重啟核計畫並發展長程飛彈，以色列亦同步空襲德黑蘭並攔截來襲飛彈，中東局勢急遽升溫。,https://m.cnyes.com/news/id/6356652
383,6356416,Block大裁員引發AI就業疑慮 經濟學家：不宜過度解讀,"Block 執行長 Jack Dorsey 宣布將裁減約 4,000 名員工、接近公司人力的一半，引發市場對人工智慧是否將加速企業裁員的關注。多位經濟學家指出，此舉更可能屬於個別公司策略調整，目前尚不足以視為美國就業市場",https://m.cnyes.com/news/id/6356416
384,6356646,推翻伊朗政權！川普向伊朗民眾喊話：接管你們的政府,據英國《Sky News》周六（28 日）報導，美國總統川普在社交平台 Truth Social 發布的一段 8 分鐘影片中證實，美國已對伊朗發動「重大作戰行動」，並向伊朗民眾喊話，稱「等行動結束，接管你們的政府」。,https://m.cnyes.com/news/id/6356646
385,6356616,智崴沙國市場新斬獲 取得高階大型體感設備合約,智崴沙國市場新斬獲 取得高階大型體感設備合約,https://m.cnyes.com/news/id/6356616
386,6356557,微軟傳推出「神話級」E7 Microsoft 365套裝！整合AI喊價月費99美元,微軟傳正評估推出全新 E7 企業級套裝，作為 AI 強化版 Microsoft 365，整合 Copilot 與 Agent 365，月費最高達 99 美元。在 Google 與 Salesforce 加速布局生成式 AI 之際，E7,https://m.cnyes.com/news/id/6356557
387,6356550,Anthropic嗆美防長「法院見」！拒絕淪為武器、川普下令6個月全面汰換Claude,美國國防部擬將 AI 新創 Anthropic 列為供應鏈風險，國防部長赫格塞斯下令軍方承包商全面停止合作，川普更宣布聯邦機構六個月內停用其技術。雙方爭議聚焦大規模監控與自主武器，白宮不排除動用《國防生產法》。,https://m.cnyes.com/news/id/6356550
388,6356414,Palantir再獲升評 估值不再那麼「難以下嚥」,據《MarketWatch》周五 (27 日) 報導，Palantir Technologies(PLTR-US) 股價向來深受散戶投資人青睞，如今華爾街分析師也開始對這家軟體公司轉趨樂觀。,https://m.cnyes.com/news/id/6356414
389,6356615,川普說話了！伊朗正在研製威脅美國長程飛彈,美國總統川普表示，美軍已經開始對伊朗發動軍事打擊。,https://m.cnyes.com/news/id/6356615
390,6356609,美國、以色列大規模空襲伊朗！美國官員：襲擊規模比去年6月大,以色列國防部長卡茨表示，以色列已經對伊朗發動「先發制人打擊」，關閉領空，全國進入緊急狀態。,https://m.cnyes.com/news/id/6356609
391,6356605,美官員證實美軍攻擊伊朗！以色列空襲德黑蘭：為移除威脅,美國官員證實美軍已對伊朗發動攻擊，稍早以色列亦空襲德黑蘭，引發中東局勢急遽升溫。川普表示仍願與伊朗就核計畫談判，但不排除必要時採取軍事行動。核談判僵局、美軍部署與飛彈威脅，牽動全球能源與地緣政治風險。,https://m.cnyes.com/news/id/6356605
392,6356606,動手了！以色列正在準備4天密集強力聯合進攻,以色列國防部長卡茨表示，以色列已經對伊朗發動「先發制人打擊」，關閉領空，全國進入緊急狀態。,https://m.cnyes.com/news/id/6356606
393,6356397,OpenAI估值一舉升至7300億美元 AI商業化競賽同步升溫,"​​​​​​​​​​​​​​OpenAI 再度刷新 AI 融資紀錄。根據外媒報導，亞馬遜、輝達與軟銀合計向 OpenAI 注資 1,100 億美元，使公司估值一舉升至 7,300 億美元，較 2025 年 3 月的 3,",https://m.cnyes.com/news/id/6356397
394,6356598,開戰了！美國、以色列轟炸目標是德黑蘭總統府、政府大樓,以色列國防部長卡茨表示，以色列已經對伊朗發動「先發制人打擊」，關閉領空，全國進入緊急狀態。,https://m.cnyes.com/news/id/6356598
395,6356577,開戰了！伊朗首都發生爆炸 以色列宣布襲擊伊朗,以色列國防部長卡茨表示，以色列已經對伊朗發動「先發制人打擊」，關閉領空，全國進入緊急狀態。,https://m.cnyes.com/news/id/6356577
396,6356529,川普罕見「請求」最高法院！發文問：能重審關稅案嗎？,美國總統川普公開質疑美國最高法院關稅裁決並詢問是否可重審。法院以 6 比 3 裁定《國際緊急經濟權力法》（IEEPA）未授權大規模加徵關稅，引發逾千家企業提告追討約 1300 億美元關稅款，聯邦政府面臨龐大訴訟壓力，全球貿易不,https://m.cnyes.com/news/id/6356529
397,6356517,WSJ：輝達計劃推新AI晶片 推論晶片戰略大升級,《華爾街日報》週五 (27 日) 報導，在競爭對手壓力升高與市場需求轉向之際，輝達計劃推出一款專為 AI 推論運算打造的新處理器，目標協助 OpenAI 等客戶建構更快速且更具能效的 AI 工具，外界認為此舉可能重塑 AI,https://m.cnyes.com/news/id/6356517
398,6356415,輝達周跌近7%年內轉跌 華爾街聚焦競爭壓力多於成長動能,輝達 (Nvidia)(NVDA-US) 日前公布亮眼財報，並給出優於預期的財測，顯示成長動能正在加速。執行長黃仁勳表示，「算力需求正急速飆升」。但投資人的關注點似乎不在此。,https://m.cnyes.com/news/id/6356415
399,6356543,新里程碑！ChatGPT周活躍用戶數突破9億,"OpenAI 正大步朝著大多數科技產品夢寐以求的全球級規模進一步邁進，這家 AI 巨頭周五（27 日）宣布，旗下聊天機器人 ChatGPT 周活躍用戶數已達到 9 億，目前擁有超過 5,000 萬付費訂閱用戶。",https://m.cnyes.com/news/id/6356543
400,6356528,川普再警告伊朗不得擁核！「不滿意」談判不排除動武：不得不這麼做,美國總統川普表示仍有意與伊朗達成協議，但對核談判進展感到不滿，強調伊朗不得擁有核武，尚未排除軍事選項。同時，賽普勒斯、比利時、法國等多國發布旅遊警示，呼籲避免前往伊朗及中東地區，區域局勢持續升溫。,https://m.cnyes.com/news/id/6356528
401,6356427,川普將Anthropic列入黑名單 馬斯克xAI成最大潛在贏家,市場解讀，美國總統川普 27 日下令聯邦機構立即停止使用 Anthropic，為替馬斯克旗下 xAI 及其 Grok 模型打開更多政府市場機會。,https://m.cnyes.com/news/id/6356427
402,6356533,美伊核談判重大突破！伊朗承諾「零庫存」不再持有可製核武材料  和平協議近在眼前？,美伊核談判傳出關鍵進展，阿曼外交大臣巴德爾表示，伊朗同意永遠不持有可製造核武的核材料，並將現有庫存轉為不可逆核燃料，接受國際原子能機構全面核查。談判焦點轉向「零庫存」原則，和平協議可望在三個月內落實關鍵機制。,https://m.cnyes.com/news/id/6356533
403,6356521,代工中國AI晶片組件觸美方紅線 台積電回應,半導體研究機構 TechInsights 最新初步分析指出，一款由中國燧原科技 (Enflame) 推出的 AI 處理器 S60，內含關鍵元件由台積電製造，引發市場對是否涉及違反美國出口管制的關注,https://m.cnyes.com/news/id/6356521
404,6356535,奧特曼成功卡位！川普封殺Anthropic後 OpenAI火速與五角大廈達成部署協議,美國 AI 產業震盪升溫，在川普政府封殺 Anthropic 之際，OpenAI 迅速與國防部達成模型部署協議，安全紅線與國安應用的拉鋸戰浮上檯面。,https://m.cnyes.com/news/id/6356535
405,6356436,波克夏新時代周六揭幕！阿貝爾首挑大樑 挑戰「巴菲特溢價」保衛戰,,https://m.cnyes.com/news/id/6356436
