,newsId,title,summary,link
324,6200820,聯強澳洲營收突破600億元 當地國會議員參訪台灣總部交流在澳佈局,通路商聯強 (2347-TW) 在澳洲布局長達 28 年，已成為當地第一大台灣企業，聯強澳洲營收突破 600 億元大關，澳洲跨黨派國會議員近日 (10/21) 拜訪聯強集團總部，由聯強集團執行長王其勳親自接待，雙方就聯強在澳洲投資進程與,https://m.cnyes.com/news/id/6200820
325,6200049,科技巨頭AI籌資新管道！Meta創紀錄私人信貸案 合資270億美元蓋資料中心園區,,https://m.cnyes.com/news/id/6200049
326,6200823,鉅亨雙週報》全球資金急轉、行情瞬息萬變，資產怎麼配才能站穩腳步？,,https://m.cnyes.com/news/id/6200823
327,6200674,債王葛洛斯：黃金已變迷因資產 想買入要再等等,,https://m.cnyes.com/news/id/6200674
328,6200769,報導：川普政府擬對全球藥價展開調查 為徵收新關稅奠定基礎,據報導，美國總統川普政府正準備對美國貿易夥伴的藥品定價行為展開新的調查。《金融時報》援引知情人士的說法稱，此舉將為美國政府徵收新的關稅奠定基礎。,https://m.cnyes.com/news/id/6200769
329,6200807,百年一見　AI大多頭！ 抓準產業 全力買進低估股！,,https://m.cnyes.com/news/id/6200807
330,6200729,〈台股盤後〉連續創新高後量縮跌103點 多頭休整退守5日線,台股本周再度迎來連假，隨著指數創高後，今 (22) 日早盤也回檔，一度下挫逾 260 點、探至 27490 點，也摜破五日線，但尾盤在低接買盤進場下，跌幅逐步收斂，終場下跌 103.5 點，收在 27648.91 點，守住五日線，成交量僅 4,https://m.cnyes.com/news/id/6200729
331,6200738,中國電池巨頭海外市場大爆發：出口飆升220% 國內產能過剩尋求出路,據《Oilprice》報導，儘管面臨嚴重的產能過剩問題，中國電池產業在今年上半年迎來了強勁的海外需求，出口市場呈現爆發式增長。,https://m.cnyes.com/news/id/6200738
332,6200770,摩根首檔主動ETF掛牌首日 00989A蜜月行情失靈 終場下跌0.06元,摩根投信在台灣首檔 ETF「摩根大美國領先科技主動式 ETF 基金（00989A-TW），今（22）日於證交所掛牌交易，惟「蜜月行情」失靈，該基金發行價為 15 元，淨值 15.25 元，開盤後股價一度下挫 1.1%，最低,https://m.cnyes.com/news/id/6200770
333,6200742,東元董座利明献：股價強漲「很意外」與鴻海合作效益明年發酵,東元近日股價漲勢凌厲，對此，董事長利明献今 (22) 日說「自己個人也很意外」，不過表示資本市場對於東元期待很高。至於與鴻海合作的最新進度，利明献則表示，與鴻海的合作每天都有進度，預期明年逐步發酵。,https://m.cnyes.com/news/id/6200742
334,6200727,傳奇交易員：現在買白銀 像在1美元價位買進比特幣,擁有 50 年金融市場經驗，被媒體尊稱為傳奇交易員 Peter Brandt，近日發出驚人預言，他提供一個堪比「在 1 美元價位買入比特幣」的歷史性投資機會。Brandt 這次聚焦的標的並非某種迷因幣，而是白銀。,https://m.cnyes.com/news/id/6200727
335,6200353,高市早苗驚險上位 新政權一開始就藏四大隱憂,,https://m.cnyes.com/news/id/6200353
336,6200728,微星參展參展國際智慧能源週 充電方案落地指標建案與慈濟場域,PC 品牌微星 (2377-TW) 今 (22) 日將參加將於 10 月 29 日至 31 日參加 2025 台灣國際智慧能源週，並展出 Hyper 快充、EV 與 Eco 系列 AC 充電樁、EZgo 便攜式旅充，以及 eCon,https://m.cnyes.com/news/id/6200728
337,6200673,博通CPO乙太網交換器開始出貨 採台積電COUPE技術,博通 (AVGO-US) 今 (22) 日宣布，第三代共同封裝 (CPO) 技術乙太網路交換器 Tomahawk 6  Davisson 已開始供貨，頻寬是現有 CPO 交換器的 2 倍，且因採用台積電(2330-TW)(TSM-US)COU,https://m.cnyes.com/news/id/6200673
338,6200713,〈焦點股〉康舒AI伺服器電源新布局 股價漲停率新金寶集團爆紅,〈焦點股〉康舒 AI 伺服器電源新布局 股價漲停率新金寶集團爆紅,https://m.cnyes.com/news/id/6200713
339,6200081,巴菲特60年傳奇生涯倒數計時 波克夏股價出現「黃金交叉」,,https://m.cnyes.com/news/id/6200081
340,6200711,鄭麗文表態願赴大陸訪問交流 國台辦回應！,針對國民黨主席當選人鄭麗文表態願意赴大陸訪問交流一事，國台辦發言人朱鳳蓮表示，北京願意在堅持「九二共識」、反對「台獨」的政治基礎上，與台灣各政黨一道，促進兩岸交流合作。,https://m.cnyes.com/news/id/6200711
341,6200708,貿協黃志芳: AIoT年產值到2032年有望翻4倍 協助台廠拓銷搶商機,TAITRONICS 與 AIoT Taiwan 於今 (22) 日 - 24 日在南港展覽館開展。外貿協會董事長黃志芳表示，今 (2025) 年台灣 GDP 表現亮眼，主要受惠驅動力就是 AI 產業與供應鏈，2032 年產值將成長為 2024 年的 4 倍,https://m.cnyes.com/news/id/6200708
342,6200436,今年衝刺1000座！寧德時代巧克力換電站突破700座  專家：蔚來汽車押對寶了,,https://m.cnyes.com/news/id/6200436
343,6200669,三顧與日本Megakaryon簽署MOU 共同推動iPSC衍生血小板技術與商品化,三顧 (3224-TW) 今 (22) 日宣布，與日本再生醫學公司 Megakaryon 株式會社簽署合作備忘錄 (MOU)，雙方將展開協商，共同在台灣開發 iPSC 細胞(誘導性多功能幹細胞) 衍生人工血小板技術與其商品化事宜。,https://m.cnyes.com/news/id/6200669
344,6200627,AI投資燒錢 軟銀計劃海外發債20億美元,,https://m.cnyes.com/news/id/6200627
345,6200458,高市早苗接掌日本首相 第一道命令：推經濟方案抗通膨,,https://m.cnyes.com/news/id/6200458
346,6200387,不簽「半套」協議！韓代表為3500億美元投資案赴美磋商,,https://m.cnyes.com/news/id/6200387
347,6200518,急跌不改牛市！ 華爾街：黃金仍是今年最強資產 漲勢比炒AI還猛,,https://m.cnyes.com/news/id/6200518
348,6200558,印度重大讓步！美印貿易協議傳將達陣 50%關稅大砍到15%,,https://m.cnyes.com/news/id/6200558
349,6200462,印度與美國傳將達成貿易協議 關稅降至15%~16%,,https://m.cnyes.com/news/id/6200462
350,6200034,大摩選出這家AI受惠股為最新首選標的,摩根士丹利 (Morgan Stanley) 本周將一家知名串流平台股票納入首選標的 (Top Pick) 名單，理由是其成長加速、受惠於人工智慧 (AI) 趨勢，以及具備強勁的定價動能。,https://m.cnyes.com/news/id/6200034
351,6200562,凱基證券榮獲「國家品牌玉山獎」最佳產品獎 隨身e策略APP交易平台引領創新,,https://m.cnyes.com/news/id/6200562
352,6200050,穆迪：私人信貸規模激增 美銀行曝險達3000億美元,,https://m.cnyes.com/news/id/6200050
353,6200551,OpenAI發表ChatGPT Atlas意圖切入廣告大餅，解讀 AI 巨頭的盈利壓力,,https://m.cnyes.com/news/id/6200551
354,6200027,諾貝爾獎得主：輝達終將成為遙遠的記憶 但這是好事,《Marketwatch》報導，多位最新諾貝爾經濟學獎得主指出，輝達 (NVDA-US) 不可能永遠維持全球市值最高企業的地位，因為「創造性破壞」是推動長期經濟成長的根本力量。,https://m.cnyes.com/news/id/6200027
355,6200435,泡泡瑪特今開高強彈7.8%！專家：Q3海外業績暴增3倍 股價反彈顯韌性,,https://m.cnyes.com/news/id/6200435
356,6200101,日本出口5個月首見成長 貿易支出意外逆差,,https://m.cnyes.com/news/id/6200101
357,6200463,〈焦點股〉映泰切入IPC奪歐洲智慧城市大單 早盤放量攻上漲停,板卡廠映泰 (2399-TW) 儘管今年營運承壓，不過轉型 IPC 業務後，已奪下歐洲智慧城市訂單，並將於明年迎來業務收割期，獲得市場資金追捧，今 (22) 日股價開高走高，隨即攻上漲停價 24.8 元，來到近期波段高點，成交量 2.1 萬,https://m.cnyes.com/news/id/6200463
358,6198907,全球基金經理人現金水位降至3.8% 法人：AI領軍台股行情不預設高點,美股技術面偏多驅動，目前全球基金經理人現金水位降至 3.8%，位處 2013 年以來低檔區，顯示國際資金、機構投資人積極佈局心態，第一金電子基金經理人張正中指出，市場擔心泡沫，但又怕錯過高點，,https://m.cnyes.com/news/id/6198907
359,6200466,想換人生風景？先升級你腦中的財富 GPS 導航系統,,https://m.cnyes.com/news/id/6200466
360,6200362,瀏覽器變天！ChatGPT Atlas三大功能 事情全讓AI辦了 率先支援macOS,OpenAI 推出全新瀏覽器 ChatGPT Atlas，透過對話式 AI 的深度集成，不僅提供隨行聊天、瀏覽器記憶等創新功能，還引入了代理模式，讓 AI 能夠自主執行任務，開創了智能瀏覽的新局面。,https://m.cnyes.com/news/id/6200362
361,6200453,AI大咖漲太多？主力正在卡位「第二波金礦」：5檔「高成長＋確定訂單」黑馬準備起飛,,https://m.cnyes.com/news/id/6200453
362,6200354,國際調解院在香港隆重開業 打造全球調解之都,,https://m.cnyes.com/news/id/6200354
363,6200379,雙普會喊卡 川普：不想浪費時間,美國總統川普上周與俄羅斯總統普丁通話後，宣布兩國元首近期將在匈牙利首都布達佩斯見面，但川普周二（21 日）在白宮橢圓形辦公室告訴記者，與普丁的會面安排被擱置。,https://m.cnyes.com/news/id/6200379
364,6200348,美企遊說團體敦促川普終止對中國出口的新限制,美國企業遊說團體正在敦促美國政府立即暫停一項對中國的貿易規則。該團體稱，穿透性規則導致價值數十億美元的美國出口活動受阻，並將促使中國等國家把美企從其供應鏈中剔除。,https://m.cnyes.com/news/id/6200348
365,6200361,兩大經貿議題最新進度 龔明鑫：提供輝達「雙位數」候選案址、關稅爭取不疊加,經濟部長龔明鑫今（22）日出席立法院經濟委員會前受訪，對外說明了政府在爭取輝達（Nvidia）台灣總部選址，以及台美關稅談判進度兩大重大經貿議題上的最新動態，他強調目標朝向提供「雙位數」的案址，讓輝達有更多元、更廣泛的選,https://m.cnyes.com/news/id/6200361
366,6200378,〈焦點股〉國光生三疫苗入列WHO清單 股價亮燈漲停,國光生旗下流感疫苗、破傷風疫苗以及安特羅腸病毒疫苗均被列入 WHO 清單中，激勵國光生今 (22) 日以 18.75 開出走揚，並在盤中亮燈漲停鎖住 19.5 元，一舉站回季線與半年線，排隊委買單超過 1000 張，成交量則超過 8000 張。,https://m.cnyes.com/news/id/6200378
367,6200367,〈台股開盤〉台積電熄火 開低一度挫逾260點 拉回至5日線整理,〈台股開盤〉台積電熄火 開低一度挫逾 260 點 拉回至 5 日線整理,https://m.cnyes.com/news/id/6200367
368,6200097,蘋果加速撤離中國 新款Vision Pro轉至越南生產,,https://m.cnyes.com/news/id/6200097
369,6200193,蘋果股價創歷史新高！高盛：iPhone 17系列需求強勁 超級週期或將來臨,高盛最新報告顯示，iPhone 17 系列需求強勁，交付週期延長，股價創歷史新高。分析師預計，iPhone 銷量將年增 10%，暗示可能進入超級週期。儘管如此，市場仍需觀察未來的趨勢與變化。,https://m.cnyes.com/news/id/6200193
370,6200314,【時事觀察】安世半導體被凍結！全球供應鏈震盪，台灣二極體廠迎關鍵轉單潮？,,https://m.cnyes.com/news/id/6200314
371,6200105,從中國到全球！蘋果iPhone 17新機交付時間延長 超級週期要來了？,,https://m.cnyes.com/news/id/6200105
372,6200192,Beyond Meat三天漲6倍！是復甦還是泡沫？,Beyond Meat 近期股價驚人反彈，短短三天內累計漲幅達 600%。這一波漲勢引發市場廣泛關注，分析人士警告或許暗示著市場泡沫的再現。隨著散戶資金的涌入，Beyond Meat 的未來走向值得投資者深思。,https://m.cnyes.com/news/id/6200192
373,6200026,麥格理：市場低估川普關稅案對簿高院風險,澳洲麥格理銀行 (Macquarie) 週二 (21 日) 警告，投資人對美國最高法院即將審理的關稅訴訟反應過於平靜，忽視一項可能動搖美國貿易與財政基礎的重大法律風險。若裁決不利於川普當局，恐推高長期美債殖利率並壓縮股市估值,https://m.cnyes.com/news/id/6200026
374,6200094,金價大跌是在「求救」！Fed前顧問示警系統性風險：流動性危機恐迫使Fed抗通膨轉向,,https://m.cnyes.com/news/id/6200094
375,6200109,川普即將赴韓出席APEC峰會 南韓：北韓朝東部海域發射彈道飛彈,據《韓聯社》報導，南韓聯合參謀本部（聯參）周三（22 日）表示，北韓當天向東部海域發射型號不明的彈道飛彈，軍方正在分析彈道飛彈的類型和飛行距離等具體參數。,https://m.cnyes.com/news/id/6200109
376,6193778,【Joe’s華爾街脈動】投資人拋售貴金屬，轉進價值股，道瓊指數創歷史新高,,https://m.cnyes.com/news/id/6193778
377,6200106,從醫材研發到創新農業　元樟雙軸並進展開日本市場新布局,,https://m.cnyes.com/news/id/6200106
378,6200074,亞馬遜自動化願景曝光 用好機器人可少僱60萬美國勞工,據《紐約時報》周二（21 日）披露，美國科技巨頭亞馬遜計劃實現 75% 營運流程自動化，這意味著在現有業務增長預期下，亞馬遜能在未來幾年裡少僱傭 60 萬美國勞工。,https://m.cnyes.com/news/id/6200074
379,6199820,日本「女版川普」來了！高市「日本優先」推簽證與旅遊新規 外國人日子越來越難過,,https://m.cnyes.com/news/id/6199820
380,6200035,黃金創多年來最大單日跌幅 是短暫修正還是漲勢見頂？,貴金屬周二 (21 日) 遭遇重挫，黃金創下逾十年來最大單日跌幅。許多分析師認為這波回檔早該出現，但這並不一定意味著這波將黃金推上歷史高點的漲勢已經結束。,https://m.cnyes.com/news/id/6200035
381,6199875,美股重點新聞摘要2025年10月22日,美股重點新聞摘要 2025 年 10 月 22 日,https://m.cnyes.com/news/id/6199875
382,6200072,冰島首次發現蚊子 氣候變暖讓極北島嶼變得更適宜生存,隨著全球氣溫升高，冰島的氣候正變得越來越適合昆蟲生存，科學家近日證實，當地首次發現了蚊子的蹤跡。,https://m.cnyes.com/news/id/6200072
383,6200059,黃金遭單日重擊 仍是今年來最火熱交易,,https://m.cnyes.com/news/id/6200059
384,6200068,科技巨頭搶攻算力新高地！Meta攜手Blue Owl 砸270億美元興建AI資料中心,Meta 宣布與 Blue Owl Capital 合作，投資 270 億美元在美國路易斯安那州建設其最大 AI 資料中心，預計 2030 年完工，用電量預估為新奧爾良市的兩倍，凸顯全球科技巨頭在 AI 基礎設施戰中的激烈競爭。,https://m.cnyes.com/news/id/6200068
385,6200045,微軟靠AI熱潮賺翻 CEO年薪酬暴漲至9650萬美元,,https://m.cnyes.com/news/id/6200045
386,6200025,Axelera推第二款AI推理晶片 三星代工 明年上半年開始出貨,歐洲 AI 晶片新創 Axelera AI 週二 (21 日) 宣布推出第二代產品線「Europa」晶片，延續其先前 Metis 系列的設計理念，專注於人工智慧「推理」(inference) 運算，即執行 AI 模型而非訓練。,https://m.cnyes.com/news/id/6200025
387,6200044,〈貴金屬盤後〉黃金重挫5.5%創五年來最大單日跌幅 獲利了結賣壓出籠,,https://m.cnyes.com/news/id/6200044
388,6200055,Anthropic傳與Google商議巨額雲端合作 Alphabet股價應聲上揚,人工智慧新創 Anthropic 傳出正與 Google 洽談數百億美元雲端合作協議，顯示大型科技企業正加速爭奪 AI 算力與市場主導權。消息公布後，Alphabet 股價盤後上漲逾 3%。,https://m.cnyes.com/news/id/6200055
389,6200033,〈財報〉關稅重壓 德儀財測遜預期 盤後大跌8%,"晶片製造商德州儀器 (Texas Instruments, TI)(TXN-US) 周二 (21 日) 公布 2025 會計年度第三季財報，惟每股盈餘略差於預期，且第四季財測低於華爾街預估，導致股價盤後重挫。截至發稿，跌逾 8%。",https://m.cnyes.com/news/id/6200033
390,6199352,估值比Meta低20%！高盛再喊進騰訊：仍是中國市場最具確定性的AI應用受益者,,https://m.cnyes.com/news/id/6199352
391,6199957,〈能源盤後〉市場重新評估過剩風險 聚焦中美貿易爭端走向 原油自5個月低點反彈 小幅收高,全球油價在連日下跌後出現反彈，投資人重新權衡供需情勢與美中貿易前景。儘管美國產量創新高並推升庫存，但相對低水平的燃油存量與貿易談判進展，暫時支撐油價企穩於五個月低點之上。,https://m.cnyes.com/news/id/6199957
392,6199874,〈紐約匯市〉美元上漲 日元走軟至一周低點,美元周二 (21 日) 上漲，受益於日元走弱。強硬保守派的高市早苗 (Sanae Takaichi) 當選日本首相後，日元兌美元走軟至一周低點。市場押注，她所帶領的新政府可能使利率前景更加不明朗，並帶來更大規模財政支出。,https://m.cnyes.com/news/id/6199874
393,6200009,彭博：蘋果18吋可折疊iPad遇技術瓶頸 恐延至2029年發表,據《彭博》周二 (21 日) 報導，蘋果 (AAPL-US) 研發的 18 吋可折疊 iPad 遭遇技術瓶頸，發布時間可能從 2028 年延至 2029 年或更晚。知情人士透露，重量、功能和顯示技術等工程挑戰是主因。,https://m.cnyes.com/news/id/6200009
394,6200032,〈財報〉Netflix未達預期歸因於巴西稅務爭議 盤後重挫6%,Netflix(NFLX-US) 周二 (21 日) 盤後公布 2025 會計年度第三季財報，惟業績未達預期，拖累股價盤後下挫。該公司將之歸因於與巴西稅務機關持續的爭議。截至發稿，股價跌逾 6%。,https://m.cnyes.com/news/id/6200032
395,6199922,荷蘭：願與中國密切溝通 為安世半導體尋找建設性解決方案,中國商務部部長王文濤周二（21 日）應約與荷蘭經濟大臣卡雷曼斯通話，雙方圍繞安世半導體等問題交換意見。,https://m.cnyes.com/news/id/6199922
396,6200000,貸款詐欺案引疑慮 富國執行長：對私人信貸用「擔憂」一詞言重了,據《彭博》周二報導，富國銀行執行長 Charlie Scharf 周二表示，私人信貸市場的風險不應一概而論，也未對銀行體系造成重大系統性問題。儘管上周爆發第三起貸款詐欺案引發市場恐慌，但他強調詐欺與信貸惡化本質不同。,https://m.cnyes.com/news/id/6200000
397,6199973,〈台股盤前要聞〉台股連三天刷新高挑戰2萬8、 單月外銷訂單首度衝破700億美元,台股盤前要聞,https://m.cnyes.com/news/id/6199973
398,6200021,〈美股盤後〉3M可口可樂財報捎喜 道瓊創新猷 逼近47000點大關,"受惠於可口可樂與 3M 強勁財報，道瓊指數週二 (21 日) 創新收盤新高，收盤逼近 47,000 點，標普 500 指數持平，那斯達克指數小幅下跌。",https://m.cnyes.com/news/id/6200021
399,6199912,日本養樂多 將關閉在中國首座工廠,繼去年關閉上海工廠後，養樂多又要向廣州工廠動刀，日本養樂多本社株式會社周一（20 日）宣布，廣州養樂多啟動業務重組程序。,https://m.cnyes.com/news/id/6199912
400,6198304,【袁志峰專欄】10月南向資金淨買入顯著減少,"今日推介 - 東方海外 (316, $126.6), 目標價 $140, 止損價 $120",https://m.cnyes.com/news/id/6198304
401,6199671,陸稀土管制大限倒數計時！​​全球車廠一片焦慮 競相尋求應對之策,,https://m.cnyes.com/news/id/6199671
402,6199827,多名歐洲領袖：應以俄羅斯、烏克蘭當前戰線為談判起點,法國總統府周二（21 日）發布一份多名歐洲領袖關於烏克蘭問題的聯合聲明，稱「強烈支持」美國總統川普在烏克蘭問題上的立場，即俄羅斯與烏克蘭立即停火，以當前戰線作為談判起點。,https://m.cnyes.com/news/id/6199827
403,6199863,越南燃油機車禁令惹日本不滿？日本政府：恐引發大量勞工失業,今年 7 月，越南總理范明政發布燃油機車禁令，計劃從 2026 年中期開始，禁止燃油機車進入越南首都河內市中心，以減少嚴重空氣污染。,https://m.cnyes.com/news/id/6199863
404,6199965,歐洲與烏克蘭推12點和平提案 主張沿目前戰線停火,據《彭博》周二 (21 日) 報導，歐洲國家正與烏克蘭研擬 12 點和平提案，主張沿目前戰線停火結束俄烏戰爭，反對俄國總統普丁要求烏克蘭割讓領土換取和平的立場。知情人士透露，這項提案將由美國總統川普主持的和平委員會監督執行。,https://m.cnyes.com/news/id/6199965
405,6199856,聯準會正研究推出「精簡版」主帳戶 金融科技業迎曙光,綜合外媒周二 (21 日) 報導，聯準會理事華勒 (Christopher Waller) 周二在華府支付創新研討會上宣布，聯準會正研究推出新型態「支付帳戶」，讓金融科技等非銀行業者也能直接使用聯準會的支付系統。,https://m.cnyes.com/news/id/6199856
406,6199991,嚴重影響供應鏈！中國怒批荷蘭接管晶片商安世半導體,根據《彭博》周二 (21 日) 報導，中國商務部長王文濤警告，荷蘭政府接管中資半導體公司安世半導體 (Nexperia) 的舉動，已「嚴重影響」全球供應鏈穩定，並敦促荷方儘速解決問題。,https://m.cnyes.com/news/id/6199991
407,6199831,Core Scientific股東嫌出價太低！CoreWeave：不會加價、歡迎競爭者出價,綜合外媒報導，AI 雲端服務商 CoreWeave 執行長 Michael Intrator 周二 (21 日) 表示，不會提高對 Core Scientific(CORZ-US) 的 90 億美元收購價。,https://m.cnyes.com/news/id/6199831
408,6199989,也可能不會見！川普談與習近平會晤語出保留,美國總統川普周二 (21 日) 表示，預期即將與中國國家主席習近平舉行的會晤將有助於達成「良好的貿易協議」，但他同時也承認這場備受矚目的峰會仍有可能不會舉行。,https://m.cnyes.com/news/id/6199989
409,6199830,高盛執行長：區域銀行詐欺案屬「個別」事件,綜合外媒報導，高盛 (GS-US) 執行長蘇德巍 (David Solomon) 周二(21 日) 表示，區域銀行近期接連爆發的詐欺相關損失屬個別事件，但應提醒業者保持警覺，留意承銷標準。,https://m.cnyes.com/news/id/6199830
410,6199890,AWS當機15小時重創商譽 分析師：舊客戶走不開、但恐難吸引新客戶,據《彭博》周二 (21 日) 報導，亞馬遜旗下的 AWS 周一發生長達約 15 小時的大規模故障，導致數百家企業受影響，從蘋果、麥當勞到 Epic Games 都無法倖免，使其可靠的形象受到重創。,https://m.cnyes.com/news/id/6199890
411,6199979,Beyond Meat盤中暴漲逾九成 納入迷因ETF引爆軋空行情,曾經淪為「低價股」(Penny Stock) 的植物肉公司 Beyond Meat 本周再度成為市場焦點，股價連兩日飆漲。周二 (21 日) 股價暴漲 83%，延續前一日大漲 127% 的驚人漲勢，主因是被納入「Roundhill 迷因股票,https://m.cnyes.com/news/id/6199979
412,6199990,ChatGPT Atlas登場！OpenAI挑戰Chrome地位 AI瀏覽器大戰開打,OpenAI 正式發布 AI 網頁瀏覽器「ChatGPT Atlas」，宣告進軍由 Google 與 Perplexity 主導的智慧搜尋與助理市場。Alphabet 股價隨即下跌 3%，顯示市場對 AI 瀏覽器競爭的新格局高度關注。,https://m.cnyes.com/news/id/6199990
413,6199983,15分鐘到貨！亞馬遜「即時電商」登陸印度後再推向UAE 部分地區甚至6分鐘送達,亞馬遜加快布局即時電商市場，正式在阿聯酋推出「Amazon Now」超速送服務，主打 15 分鐘內送達。繼印度之後再度拓展市場版圖，顯示亞馬遜正以物流與技術優勢搶攻全球超快配送新戰場。,https://m.cnyes.com/news/id/6199983
414,6199978,AI瀏覽器？OpenAI神秘新品引爆市場震盪 Alphabet應聲挫近4%,OpenAI 執行長奧特曼的神秘預告引發市場猜測「OpenAI 即將推出 AI 瀏覽器」，震撼 Google 生態。消息一出，Alphabet 股價立刻下跌 4%，顯示投資人憂慮人工智慧技術或將撼動 Chrome 長年壟斷的瀏覽器版圖。,https://m.cnyes.com/news/id/6199978
415,6199971,川普會普丁難實現？白宮：近期無安排計畫,根據《彭博》周二 (21 日) 報導，白宮官員表示，美國總統川普近期並無與俄羅斯總統普丁會面的計畫，這與雙方先前釋出的訊號形成對比，當時外界預期兩人可能很快舉行第二次峰會。,https://m.cnyes.com/news/id/6199971
416,6199925,2奈米反攻戰！三星放話：今年要奪回代工王座 良率衝近七成,南韓總統的首席政策顧問金永範 (Kim Yong-beom) 近日召開半導體產業會議，與三星電子、SK 海力士等主要晶片與設備企業高層共同檢視國內外產業現況。據悉，三星電子裝置解決方案 (DS) 事業部技術長宋載赫(Song Ja,https://m.cnyes.com/news/id/6199925
417,6199855,華納兄弟探索開放出售選項激勵股價大漲逾11% 傳Netflix、康卡斯特皆表達興趣,綜合外媒報導，華納兄弟探索周二宣布在收到多方主動收購興趣後，將進行全面戰略審查並開放出售選項，股價早盤大漲 9.4%。該公司表示將繼續推進原定分拆計劃，同時評估包括出售在內的所有選項，以釋放資產最大價值。,https://m.cnyes.com/news/id/6199855
