,newsId,title,summary,link
1099,6268321,〈紐約匯市〉美元上漲 就業數據優預期 Fed或釋鷹派訊號,美元周二 (9 日) 小幅上漲，在聯準會 (Fed) 即將宣布降息前夕，美國公布優於預期的就業市場數據，凸顯勞動市場仍具韌性。儘管市場普遍預期本周會降息，決策官員仍可能強調通膨風險，從而限制後續寬鬆空間。,https://m.cnyes.com/news/id/6268321
1100,6268306,〈美股盤後〉Fed召開決策會議 標普近乎持平 小摩拖累道瓊,標普 500 指數週二 (9 日) 收盤相對持平，投資人在聯準會利率決議前保持觀望氣氛。聯準會當天啟動為期兩天的政策會議，市場普遍預期將於週三宣布今年第三次降息，但部分官員近期對連續寬鬆表達疑慮，使這次決議成為近年來最具爭議的會,https://m.cnyes.com/news/id/6268306
1101,6268308,川普放行輝達H200銷售中國 市場反應冷淡,美國總統川普週一 (8 日) 表示，將允許輝達向中國出口 H200 晶片，條件是輝達需將銷售額 25% 支付給美國政府。不過，輝達股價週二仍小幅走低。,https://m.cnyes.com/news/id/6268308
1102,6268259,〈台股盤前要聞〉11月出口刷新高、中鼎遭三元能源求償46億、國安基金銀彈拚兆元,台股盤前要聞,https://m.cnyes.com/news/id/6268259
1103,6266020,【袁志峰專欄】恒指近25000點是買入機會,"今日推介 - 石藥集團 (1093, $7.53), 目標價 $8.30, 止損價 $7.25",https://m.cnyes.com/news/id/6266020
1104,6268174,立陶宛控白俄羅斯放任走私氣球 宣布進入緊急狀態,據《路透社》報導，立陶宛政府周二（9 日）宣布，由於來自白俄羅斯的「走私氣球」對立陶宛公共安全構成威脅，立陶宛已進入緊急狀態。,https://m.cnyes.com/news/id/6268174
1105,6267823,貿易協定仍遙不可及！美派2代表團本周訪問新德里 川普又盯上印度稻米：「憑啥關稅豁免？」,,https://m.cnyes.com/news/id/6267823
1106,6266193,耶誕驚喜還是驚嚇？Fed降息在即 交易員警戒「輝達財報後」震盪行情,,https://m.cnyes.com/news/id/6266193
1107,6268014,官網急撤！瑞士撤回美國降關稅公告 稱內容未確認,《路透》報導，瑞士政府周二 (9 日) 意外撤下先前公布的美國關稅下調公告，並表示該內容「因錯誤發布」，目前無法確認相關細節。瑞士政府發言人指出，聯邦行政單位已為多種可能情境進行準備，但目前「無法確認任何一項」，強調經濟部門將,https://m.cnyes.com/news/id/6268014
1108,6268012,不燒錢也能贏！蘋果AI慢半拍股價卻逆轉勝,《彭博》周二 (9 日) 報導，原本因欠缺人工智慧 (AI) 策略而遭市場詬病的蘋果(AAPL-US)，近期卻因未大舉投入 AI 資本支出而迎來股價逆轉。隨著投資人開始質疑大型科技企業是否過度砸錢布局 AI，蘋果的「保守策略」反而成為今,https://m.cnyes.com/news/id/6268012
1109,6268269,供應吃緊＋降息加持！白銀飆破60美元創新高 金價同走揚,《彭博》報導，白銀價格周二（9 日）突破每盎司 60 美元，創下歷史新高，主因市場押注聯準會（Fed）將在本周宣布再度降息，同時全球供應緊俏推升價格，金價亦同步上揚。,https://m.cnyes.com/news/id/6268269
1110,6268231,降息超過一碼也行？Fed主席熱門人選拋震撼彈,《彭博》周二 (9 日) 報導，美國白宮國家經濟會議 (NEC) 主任哈塞特 (Kevin Hassett) 表示，他認為聯準會 (Fed) 仍有足夠空間大幅調降利率，降息幅度甚至可能超過 1 碼(25 基點)。哈塞特目前被視為美國總統川普挑選,https://m.cnyes.com/news/id/6268231
1111,6268239,勞動市場持續降溫！美國10月職缺回升、裁員同步增加,綜合外媒報導，美國 10 月職缺數回升至五個月高點，但招聘減少、裁員增加，顯示勞動市場持續降溫。根據美國勞工統計局 (BLS) 周二 (9 日) 公布的職缺與勞動流動 (JOLTS) 報告，10 月職缺小幅增加至約 766.7 萬個，高於前月修,https://m.cnyes.com/news/id/6268239
1112,6268141,川普稱考慮調降部分關稅 強調進口稅能吸引企業回流,《Politico》刊登訪問指出，美國總統川普表示，他可能考慮針對部分美國商品調降關稅，但同時強調廣泛使用進口稅是其經濟策略核心，主導企業投資回流並振興汽車與半導體製造等產業。,https://m.cnyes.com/news/id/6268141
1113,6268186,台泥旗下三元提告中鼎求償46億元 主張施作消防系統失效致鉅額損失,台泥旗下三元提告中鼎求償 46 億元 主張施作消防系統失效致鉅額損失,https://m.cnyes.com/news/id/6268186
1114,6268011,〈美股早盤〉Fed利率決策前夕市場觀望 主要指數漲跌互現,華爾街在聯準會 (Fed) 公布今年最後一次利率決策前趨於觀望，美股主要指數周二 (9 日) 開盤走勢震盪，美國 10 年期公債殖利率自近兩個月高點回落，投資人暫停大額押注，等待政策指引與 2026 年貨幣路徑線索。高科技股方面，輝達股價,https://m.cnyes.com/news/id/6268011
1115,6268173,不只賣晶片！川普用輝達H200換外交空間？恐牽動台灣與稀土談判,根據《彭博》周二 (9 日) 報導，美國總統川普允許輝達 (NVDA-US) 向中國出口 H200 高階人工智慧 (AI) 晶片，象徵美國在科技安全管制方向出現重大轉向，不僅讓北京取得領先一代的演算法運算能力，也引發外界質疑華府是否將在更,https://m.cnyes.com/news/id/6268173
1116,6268154,嘉威生活11月營收年減37%  估本季表現將優於第三季,嘉威生活 (3557-TW) 今 (9) 日公布最新營收資訊，2025 年 11 月營收為 2.48 億元，月減 14.98%，年減 37.98％，主要受到部分客戶訂單遞延所致；累計前 11 月營收為 38.9 億元，年減 25.86%。,https://m.cnyes.com/news/id/6268154
1117,6268142,別再等降息了？全球貨幣寬鬆降溫 市場押「下一步可能升息」,《彭博》周二 (9 日) 報導，全球金融市場重新調整對央行政策的預期，從美國、歐洲到澳洲與日本，交易員正押注 貨幣寬鬆動能將趨緩甚至停止，部分市場甚至開始反映「下一步可能不是降息，而是升息」的可能性。,https://m.cnyes.com/news/id/6268142
1118,6267954,標普500恐在2026年跌破5000點？一項歷來精準的預測指標給了參考,進入 2025 年尾聲，投資人正帶著微笑回顧市場表現，因為主要指數基本又是豐收的一年。然而，有投資者擔心，一項歷史上準確無誤的預測指標，卻預示著華爾街在 2026 年將面臨嚴峻挑戰。,https://m.cnyes.com/news/id/6267954
1119,6268044,Fed傳聲筒：別太高興！聯準會可能降一下就停,《華爾街日報》(WSJ)資深記者、被視為「聯準傳聲筒」的 Nick Timiraos 周二 (9 日) 撰文指出，儘管決策官員對降息的意願罕見分裂，美國聯準會 (Fed) 主席鮑爾仍可能在本周的利率決策會議上帶領 Fed 再度降息，並釋出,https://m.cnyes.com/news/id/6268044
1120,6260731,公股4金2銀報喜！前11月共賺1302億年成長8.12% 5家賺贏去年全年,"公股金融機構繳出亮眼成績單！六家公股「四金二銀」兆豐金、第一金、華南金、合庫金、彰銀、臺灣中小企銀 11 月自結盈餘全數出爐，累計前 11 月合計稅後淨利高達 1,302.75 億元，相較去年同期大幅成長 8.12%。其中，有五家機構",https://m.cnyes.com/news/id/6260731
1121,6268115,交通部：電動大客車普及率已逾4成 攜手經濟部、環境部舉辦共享綠運輸論壇,交通部舉辦「共享綠運輸 淨零旗艦行」行動論壇，由交通、經濟、環境部等部會參與。據交通部指出，國內電動大客車普及率已達 40.8%，公共運輸載客量已破 18.09 億人次、成長 4 成，公共自行車成長幅度逾 95%。,https://m.cnyes.com/news/id/6268115
1122,6268010,渣打銀行大幅下調比特幣預測：2026年底目標減半至15萬美元,渣打銀行下調了未來幾年比特幣的價格預期，稱最近的市場調整，迫使其重新調整對關鍵需求來源的假設。,https://m.cnyes.com/news/id/6268010
1123,6268126,三元能源高雄廠大火遭求償逾46億元 中鼎：依法無理由 進行應訴準備,"統包工程大廠中鼎 (9933-TW) 今 (9) 日晚間召開重大訊息記者會，說明及旗下公司益鼎，遭今年 7 月 14 日發生大火的台泥 (1101-TW) 旗下三元能源科技求償 46 億 2577 萬 5 ,000 元。",https://m.cnyes.com/news/id/6268126
1124,6268095,金管會前11月開罰金融三業逾1.7億元超越去年 銀行、保險罰鍰金額雙增,2025 年即將進入尾聲，金管會今 (9) 日公布金融三業今年前 11 月裁罰統計，合計 268 件，罰鍰金額共計 1 億 7148 萬元，件數減少 9 件，金額年增 5.68%,https://m.cnyes.com/news/id/6268095
1125,6268017,美國11月小企信心回升 銷售帶動人力需求攀升,《彭博》周二 (9 日) 報導，美國小型企業在 11 月對未來景氣的信心有所好轉，主要受到銷售前景轉佳的提振。美國全國獨立企業聯盟 (NFIB) 公布的樂觀指數上升 0.8 點至 99，為近三個月高點。構成該指數的 10 項分項中，有 6 項上升、,https://m.cnyes.com/news/id/6268017
1126,6267834,避險基金Balyasny警告：AI 發展是明年最大「雙面尾部風險」,知名避險基金 Balyasny 資產管理公司共同總裁兼投資長 Dmitry Balyasny 周二 (9 日) 表示，未來一年最大的尾部風險在於人工智慧的發展不符合預期，無論是好是壞。,https://m.cnyes.com/news/id/6267834
1127,6268013,美國11月向中國下單大減近兩成 關稅不確定嚇縮手,《路透》周二 (9 日) 報導，供應鏈數據平台 Descartes Systems Group 指出，美國海運貨櫃進口量在 11 月較去年同期下滑 7.8%，主因來自對中國商品需求疲弱，以及感恩節月份工作天數較少。不過整體進口量仍維持,https://m.cnyes.com/news/id/6268013
1128,6268076,工商界希望關稅在年底定案 商總：水五金、工具機仍有近萬人放無薪假,商總許舒博受訪時表示，關稅問題一定要早點解決，目前包括中部的水五金、工具機業者還是受到影響很嚴重，尚有 9000 多人仍在放無薪價，工商界大多希望政府最慢能在本 (12) 月盡速定案，可以和美國完成談判。,https://m.cnyes.com/news/id/6268076
1129,6267992,上市櫃前3季對陸投資金額首見衰退 投資收益3941億元創新高,金管會證期局今 (9) 日公布國內上市櫃公司截至 2025 年第 3 季的海外及大陸投資狀況。統計顯示，赴大陸投資的累計獲利 3941 億元，創下近十年同期新高，但累計投資金額因匯率變動影響而首度出現衰退。,https://m.cnyes.com/news/id/6267992
1130,6268047,儘管美方已批准輝達H200晶片出口 傳北京擬設採購限制,根據《金融時報》報導，儘管美方放鬆管制，允許輝達 (NVDA-US) 出口 H200 晶片至中國，但中國可能仍將設限，或許會要求買家提交批准申請，詳細說明其購買此處理器的理由。,https://m.cnyes.com/news/id/6268047
1131,6268043,威聯通12/10公開申購承銷價暫定558元 抽中一張賺21萬元,威聯通 12/10 公開申購承銷價暫定 558 元 抽中一張賺 21 萬元,https://m.cnyes.com/news/id/6268043
1132,6268015,OTC：萬年清股票10日起得爲融資、融券交易,櫃檯買賣中心今 (9) 日公布，萬年清 (6624-TW) 股票符合相關規定，自明 (10) 日起得爲融資、融券交易。,https://m.cnyes.com/news/id/6268015
1133,6260749,合庫金前11月獲利近199億更勝去年一整年、年增5.27% 挑戰全年創新高,合庫金控 (5880-TW) 今（9）日公布最新自結獲利，受惠於銀行子公司穩健的營運表現，今年截至 11 月份，金控合併稅後淨利達到 198.89 億元 ，較去年同期的 188.94 億元，大幅增加 9.95 億元，年成,https://m.cnyes.com/news/id/6260749
1134,6268016,日銀進入升息倒數？植田和男：更接近可持續2%物價目標,綜合外媒周二 (9 日) 報導，日銀 (日本央行 / BOJ) 總裁植田和男近日連續釋出貨幣政策轉向訊號，暗示利率上調時間已愈來愈近，市場高度聚焦 12 月 19 日的利率決策是否將再度升息。植田日前在接受《金融時報》(FT)訪問時表示，日本,https://m.cnyes.com/news/id/6268016
1135,6267735,廣達  緯創  華東  欣興  下個買點? 【英特磊 第2】目標翻倍,,https://m.cnyes.com/news/id/6267735
1136,6267509,緯創營收創高，後續如何觀察,,https://m.cnyes.com/news/id/6267509
1137,6267139,DRAM漲幅堪比90年代！高盛、大摩在美光業績公布前齊唱多：「記憶體荒」紅利兌現,,https://m.cnyes.com/news/id/6267139
1138,6266198,PIMCO投資長警告信貸市場泡沫 投資級信評未必安全,,https://m.cnyes.com/news/id/6266198
1139,6267991,樺漢11月營收月增13%創同期高 智慧工廠與廠務事業群亮眼,樺漢 11 月營收月增 13% 創同期高 智慧工廠與廠務事業群亮眼,https://m.cnyes.com/news/id/6267991
1140,6267955,凱基金前11月賺282億元EPS 1.63元 銀+證獲利年增近13%,凱基金控今 (9) 日公布 11 月自結財務數據，單月稅後純益為新台幣 44.56 億元，前 11 月累計稅後純益 282.55 億元，每股稅後純益 (EPS)1.63 元。11 月台股在高檔區間震盪、成交量能放大,https://m.cnyes.com/news/id/6267955
1141,6266689,國安基金「翻倍」拚兆元！財部：「原則尊重」但建議向四大基金借款維持上限,"台３站穩 28000 點大關，面對市場波動加劇，國家金融安定基金的「銀彈」規模醞釀大升級。立法院財政委員會明（10）日將審查《國家金融安定基金設置及管理條例》修正草案，民進黨立委提案將國安基金可運用資金總額從現行的 5,000",https://m.cnyes.com/news/id/6266689
1142,6267932,缺工問題嚴重 許舒博提解方：讓逃逸移工合法回歸聘用,商總理事長許舒博會後受訪時表示，把「3K 產業」(危險、辛苦、骯髒) 開放移工納入，並增加就業機會，加上目前台灣有很多的逃逸外勞，行政院也評估非法移工可在自首後重新合法聘用，希望紓解台灣的缺工問題。,https://m.cnyes.com/news/id/6267932
1143,6267849,註銷牌照來硬的！機車強制險投保率衝9成創新高 仍有134萬輛漏保,根據交通監理機關最新統計，截至今年 9 月，全台機車登記數已達 1467 萬輛，強制汽車責任保險 (強制險) 投保率達到 90.83%，創下歷史新高。然而，金管會保險局提醒，目前仍有高達 134 萬餘輛機車未投保強制險，,https://m.cnyes.com/news/id/6267849
1144,6267913,PCB廠博智電子11月營收4.47億元再創新高年增37.43%,博智電子自 9 月起的營收持續向上創新高，博智今 (9) 日公布最新營收資訊，2025 年 11 月營收再 4.47 億元續創新高，月增 2.22%，年增 37.43%，累計 1-11 月營收 44.49 億元，已超越 2024 年全年。,https://m.cnyes.com/news/id/6267913
1145,6267910,歐盟對Google啟動反壟斷調查 質疑在AI領域濫用市場地位 助Gemini壟斷,歐盟周二 (9 日) 宣布，已對 Alphabet 旗下的 Google(GOOGL-US) 展開反壟斷調查，評估這家巨頭在人工智慧 (AI) 相關用途上使用網路出版商和 YouTube 內容的做法，是否違反歐洲競爭規則。此項調查旨在審視 Go,https://m.cnyes.com/news/id/6267910
1146,6267924,〈電子五哥營收〉仁寶前11月營收6915億年減逾1成 Q4伺服器、5G業績成長,仁寶 (2324-TW) 今 (9) 日公告 11 月營收 629.68 億元，較 10 月小幅成長，不過年減逾 2 成，累計今年前 11 月營收 6915.49 億元，年減逾 1 成。仁寶管理層預期，伺服器與 5G 新事業第四季季對季將成長。 ,https://m.cnyes.com/news/id/6267924
1147,6267897,鴻海參加IEEE GLOBECOM 2025 揭示「從太空到地面」全域通訊未來藍圖,鴻海參加 IEEE GLOBECOM 2025 揭示「從太空到地面」全域通訊未來藍圖,https://m.cnyes.com/news/id/6267897
1148,6267833,【量大強漲股整理】12月選股新方向大公開?漲價缺貨題材有機會延續嗎，關鍵看什麼?,,https://m.cnyes.com/news/id/6267833
1149,6267372,中國出口狂飆卻呼籲反保護主義！1兆美元順差引爆全球反彈,中國出口轉向非美市場，推升 1 兆美元貿易順差，引發歐洲等主要經濟體不滿。中國總理李強呼籲各國反對保護主義，但分析師警告，中國出口導向模式正加劇全球關稅與貿易緊張。,https://m.cnyes.com/news/id/6267372
1150,6267832,外資減碼58.88億元 這兩檔記憶體股獲外資大舉敲進,台股連漲 5 日後，在台積電領跌下，挑戰歷史高點 28554.61 點失利，終場跌 121.18 點或 0.43%，收 28182.6 點，成交量 5092.71 億元。外資賣超 58.88 億元，不過力積電及旺宏今天獲外資大舉敲進。,https://m.cnyes.com/news/id/6267832
1151,6267734,告別繁瑣結帳！萬事達卡「一鍵支付」明年初在台落地 首波攜手聯邦銀,萬事達卡將於 2030 年前在亞太地區實現線上購物免輸入密碼及卡號的願景，此願景將在 2026 年初在台灣逐步落地實踐。萬事達卡攜手銀行及商戶夥伴，推出一鍵支付 (Click to Pay)，讓持卡人享受免輸入卡號的線上,https://m.cnyes.com/news/id/6267734
1152,6267196,關係重回正軌？美印雙代表團密集會談 致力克服「目前的絆腳石」,據《彭博》報導，為修補雙邊關係，兩個獨立的美國代表團本周正於印度新德里與印度官員進行會談，儘管一項全面的貿易協議仍難以達成。,https://m.cnyes.com/news/id/6267196
1153,6267770,竣邦-KY運動客戶大單入袋 明年營運續衝新高,機能布料廠竣邦 - KY(4442-TW) 執行長蕭志偉今 (9) 日表示，第四季、明年首季接單量都有雙位數年增，其中，跟運動品牌大客戶合作加深、訂單能見度更達半年以上，明年營運將續創新高。,https://m.cnyes.com/news/id/6267770
1154,6267772,溢泰1-11月營收115.11億元年減4.77% 全年營運維持穩健步調,上市案已獲交易所通過的水資源股溢泰實業 (7818-TW) 今 (9) 日公布最新營收資訊，2025 年 11 月營收爲 9.22 億元，月減 13.32%，年減 17.28%，1-11 月營收 115.11 億元，年減 4.77%。,https://m.cnyes.com/news/id/6267772
1155,6267773,鼎元明年四大成長策略 布局光通訊、車用積極搶攻歐美日市場,LED 廠鼎元 (2426-TW) 今 (9) 日召開法人說明會，總經理李榮寰針對 2026 年營運展望提出四大成長策略。重點包括深化感測元件與穿戴裝置合作、擴大車載保護元件產品線、強化工控光源元件布局，並聚焦高附加價值光通訊元件，積,https://m.cnyes.com/news/id/6267773
1156,6267774,保瑞受到工作天數減少、新進競爭者加入影響 11月營收15億年月雙衰退,保瑞公告 11 月營收 15.01 億元，月對月、年對年皆呈現衰退。由於適逢感恩節工作天數減少，加上 11 月上旬取得 DLS 學名藥藥證的新進競爭者加入市場，雖未正式開賣，但影響下游通路備貨策略，使得市場觀望氣氛轉濃。 ,https://m.cnyes.com/news/id/6267774
1157,6267639,〈進出口統計〉對美出口占比38.1% 年增1.8倍 財部樂估全年出口飆上6000億美元,財政部統計處長蔡美娜今（9）日公布今年 11 月海關進出口統計，直喊「大驚喜」，結果顯示出口與進口額皆創下歷年單月新高，對美國出口額達到 244.2 億美元，不僅再創單月歷史新高，年增幅更飆升 1.8 倍，相對對中國大陸出口創民國 9,https://m.cnyes.com/news/id/6267639
1158,6267668,賴清德喊話上市櫃公司加薪 希望能將獲利果實分享給員工,賴清德今日為台灣錄影方式協會「十年共榮，企業永續驅動力論壇」致詞，除了肯定上市櫃公司不僅是台灣經濟火車頭，也強調截至今 (2025) 年 9 月底，台灣上市櫃公司的總市值已突破 3 兆美元，為員工加薪，帶動勞資良性循環。,https://m.cnyes.com/news/id/6267668
1159,6267822,營收速報  - 合庫金(5880)11月營收62.18億元年增率高達25.51％,"2025年11月合庫金(5880-TW) 營收年增成長25.51% , 盤後股價為24.1元",https://m.cnyes.com/news/id/6267822
1160,6267820,營收速報  - 遠東銀(2845)11月營收11.42億元年增率高達26.34％,"2025年11月遠東銀(2845-TW) 營收年增成長26.34% , 盤後股價為12.75元",https://m.cnyes.com/news/id/6267820
1161,6267530,虎門11月營收連9個月創同期新高 樂看明年展望續旺,虎門 11 月營收連 9 個月創同期新高 樂看明年展望續旺,https://m.cnyes.com/news/id/6267530
1162,6267747,壓回買 全驗證！五路財神全面點火行情：世芯-KY、大量、昇陽半導體,,https://m.cnyes.com/news/id/6267747
1163,6267624,環球晶上半年配發免稅現金股利2元 SOI 試產啟動、GaN 維持滿載,矽晶圓廠環球晶 (6488-TW) 今日召開董事會，通過 2025 年上半年度以資本公積發放現金股利案。2025 年上半年每股稅後純益 6.56 元，董事會於綜合考量後，決議由資本公積配發每股 2 元現金股利，合計配發金額 9,https://m.cnyes.com/news/id/6267624
1164,6267709,3 奈米滿單、2 奈米塞爆！台積電進入史上最強成長軌道,,https://m.cnyes.com/news/id/6267709
1165,6267529,金居11月營收7.16億元創46個月來新高 明將恢復一般交易,銅箔廠金居 (8358-TW) 在積極提高高階銅箔的生產比重以因應 AI 伺服器的高頻高速運算需求，營收也在向上竄升中，金居今 (9) 日公布最新營收資訊，2025 年 11 月營收 7.16 億元，改寫 46 個月來新高。,https://m.cnyes.com/news/id/6267529
1166,6267138,頂尖經濟學家警告：AI借貸規模遠超Y2K時代 恐威脅金融系統,穆迪 (Moody&#39;s Analytics) 首席經濟學家贊迪 (Mark Zandi) 近日對金融市場發出嚴峻警告，指出人工智慧 (AI) 公司的瘋狂借貸行為，已成為潛在的系統性風險。為了在激烈的 AI 軍備競賽中拔得頭籌，頂尖科技公,https://m.cnyes.com/news/id/6267138
1167,6267489,〈台幣〉升貶互見陷買賣匯拋補戰 收貶1.3分至31.215元,〈台幣〉升貶互見陷買賣匯拋補戰 收貶 1.3 分至 31.215 元,https://m.cnyes.com/news/id/6267489
1168,6267412,〈進出口統計〉大驚喜！11月出口640億美元再創新高 年增56% 今年3度贏南韓,財政部今（9）日公布 11 月海關進出口貿易初步統計，數據表現亮眼，出口值以 640.5 億美元改寫歷年單月新高紀錄 。這不僅是連續第二個月突破 600 億美元大關 ，年增率更飆升至 56.0% ，創下驚人的連 25 個月正成長 ，其增幅,https://m.cnyes.com/news/id/6267412
1169,6267144,豪賭年底行情！避險基金槓桿率飆至99%高位 連七周狂加碼全球股市 美股占大部分,,https://m.cnyes.com/news/id/6267144
1170,6267118,〈港股盤後〉指數震盪下挫 恒指寫月內新低 科指數跌1.9%,香港股市周二 (9 日) 震盪下挫，全天市場情緒表現低迷，三大指數單邊下跌。截至收盤，恒生指數下跌 1.29%，報 25434.23 點，刷新月內新低。恒生科技指數跌幅最大，收跌 1.90%，報 5554.68 點。國企指數下跌 1.62%,https://m.cnyes.com/news/id/6267118
1171,6267228,荷媒：艾司摩爾至少有一客戶與中國軍方有關聯,荷蘭媒體披露艾司摩爾（ASML）部分客戶疑與中國軍方有關，引發出口管制與國安疑慮。中國為艾司摩爾最大市場，供貨合規性再受關注。,https://m.cnyes.com/news/id/6267228
1172,6266333,〈陸股盤後〉川普同意輝達出售H200給中國 三大指數漲跌互見,中國股市三大指數周二（9 日）收盤漲跌互見，美國總統川普周一盤後宣布，將允許輝達（Nvidia）向中國及其他國家的獲准客戶運送 H200 晶片，換取銷售額 25% 分成，同時確保美國國家安全。,https://m.cnyes.com/news/id/6266333
1173,6267345,聯發國際UG展店大爆發 11月營收淡季不淡創史上第三高,聯發國際 UG 展店大爆發 11 月營收淡季不淡創史上第三高,https://m.cnyes.com/news/id/6267345
1174,6267344,卓揆指新財劃法恐違反公債法 許舒博：願召集八大工商團體做溝通橋樑,卓榮泰今 (9) 日指出，立法院甫通過的新版財劃法，計算方式恐致中央再舉債，指稱長期將導致「中央預算空虛、地方過強」，擬不執行新版財劃法。商總理事長許舒博今日則表示，八大工商團體願做朝野通橋梁，工商界希望能夠幫助朝野和解。,https://m.cnyes.com/news/id/6267344
1175,6267346,健鼎11月營收63.81億元創同期新高 記憶體模組板訂單仍熱,健鼎今 (9) 日公布最新營收資訊，2025 年 11 月營收 63.81 億元，創歷年同期新高，月增 2.17%，年增 10.34%，2025 年 1-11 月營收 670.46 億元，已 2024 年全年營收，年增 11.47%。,https://m.cnyes.com/news/id/6267346
1176,6267354,2028年在歐上市！福特與雷諾達成戰略合作 將在法國打造2款平價純電車,,https://m.cnyes.com/news/id/6267354
1177,6267115,日債殖利率飆高！日銀總裁：關注「略快漲勢」 承諾靈活購債應對,由於投資人對新政府的財政政策仍持擔憂態度，同時預期日本央行政策利率將走高，20 年期日本公債殖利率周二 (9 日) 升至歷史新高。對此一現象，日本央行總裁植田和男表示，正在關注「略快」的殖利率走勢。,https://m.cnyes.com/news/id/6267115
