,newsId,title,summary,link
0,6127138,中國國家統計局：1～7月工業企業利潤下降1.7%,中國國家統計局周三（27 日）公布的數據顯示，1～7 月份全國規模以上工業企業實現利潤總額為人民幣（下同）4.02035 兆元，較一年前下降 1.7%。,https://m.cnyes.com/news/id/6127138
1,6127514,干預Fed延伸？川普傳鎖定區域聯準銀行總裁人事,,https://m.cnyes.com/news/id/6127514
2,6127890,合水先進8/28每股39元參考價登錄興櫃 1-7月EPS 1.54元,在包括兆聯 (6944-TW)、惠民 (6971-TW)、山林水 (8473-TW) 等水務廠陸續業績表現佳並陸續 IPO 之後，水務廠商合水先進 (7857-TW) 將於明 (28) 日以參考價每股 39 元登錄興櫃交易,https://m.cnyes.com/news/id/6127890
3,6127819,趕在蘋果新品發表會前 華為定9/4發表新款三折疊機,中國華為周三（27 日）宣布，將於 9 月 4 日舉辦 Mate XTs 非凡大師及全場景新品發表會，將發表新款三折疊手機。,https://m.cnyes.com/news/id/6127819
4,6126286,浩鼎旗下鼎晉新型肉毒桿菌素醫美臨床二期報捷 預計2028年上市,浩鼎旗下鼎晉生技宣布，自主研發的新型肉毒桿菌素 OBI-858，在首項人體二期臨床試驗 (OBI-858-002) 取得正向成果。鼎晉指出，台灣 TFDA 已核准 OBI-858 進入臨床三期試驗，目標 2028 年在台上市。,https://m.cnyes.com/news/id/6126286
5,6127406,鴻海採用輝達RTX PRO伺服器 加速生成式AI部署,鴻海採用輝達 RTX PRO 伺服器 加速生成式 AI 部署,https://m.cnyes.com/news/id/6127406
6,6127571,川普：Meta最大AI資料中心將斥資500億美元,美國總統川普表示，Meta 計劃在路易斯安那州投資 500 億美元建設最大 AI 資料中心。該專案將支援人工智慧運算，並由祖克柏領軍推動 Superintelligence 戰略。,https://m.cnyes.com/news/id/6127571
7,6127720,川普：美國被「剝削」 不再直接資助烏克蘭,美國總統川普周一（25 日）在白宮記者會上公開表態，稱美國將改變對烏政策，不再直接向烏克蘭提供資金援助，烏克蘭若需武器，需通過歐洲北約（NATO）夥伴獲取。,https://m.cnyes.com/news/id/6127720
8,6127615,廣達緯創老AI為何漲不動？ 市場最大轉折來了！7檔機器人漲倍潛力股準備起飛？,,https://m.cnyes.com/news/id/6127615
9,6127595,川普急尋聯準會庫克接班人！已有「心儀人選」,美國總統川普正積極尋找聯準會理事庫克的接班人。庫克拒絕下台並準備提告維權，而川普心中已有偏好人選，傳經濟顧問米蘭有望成為聯準會理事。此舉恐引發聯準會獨立性爭議。,https://m.cnyes.com/news/id/6127595
10,6127573,關稅新規帶來不確定性 25國宣布暫停向美國寄送包裹,美國從 8 月 29 日起暫停對價值 800 美元及以下的進口包裹給予免稅待遇，屆時小額包裹需繳納適用的所有稅費。,https://m.cnyes.com/news/id/6127573
11,5990799,【Joe’s華爾街脈動】美國政治壓力衝擊債市，科技股實力則拉抬股市,,https://m.cnyes.com/news/id/5990799
12,6127521,美股重點新聞摘要2025年8月27日,美股重點新聞摘要 2025 年 8 月 27 日,https://m.cnyes.com/news/id/6127521
13,6127438,分析：聯準會的公信力是重要資產 受損恐會帶來高昂代價,,https://m.cnyes.com/news/id/6127438
14,6127548,川普玩火挑戰Fed獨立性 黃金或成「首選避險資產」,美國總統川普近日宣布開除聯準會理事庫克 (Lisa Cook)，引發市場對聯準會獨立性的疑慮，專家警告此舉恐動搖美元與美債的信任基礎，進而推升黃金等避險資產的吸引力。,https://m.cnyes.com/news/id/6127548
15,6127454,川普關稅反噬！美卡車製造商成本暴增被逼逃往墨 2026本土重卡廠產能恐蒸發11%,,https://m.cnyes.com/news/id/6127454
16,6127504,川普試圖開除Fed理事 30年期美債殖利率升至近4年高點,受聯準會擔憂影響，美國 30 年期債券週二 (26 日) 延續 2025 年下滑趨勢。,https://m.cnyes.com/news/id/6127504
17,6127513,〈能源盤後〉油價回跌2% 焦點轉向關稅和俄羅斯斷供 ,,https://m.cnyes.com/news/id/6127513
18,6127528,輝達財報將登場 華爾街5分析師怎麼看,輝達周三 (27 日) 盤後公布會計年度第二季財報，交易員關注其 4 兆美元市值是否站得住腳，以及近期與華府達成的收益分成協議將如何影響公司前景。在財報公布前，華爾街普遍保持樂觀，但指出不同風險與催化因素可能影響公司前景。,https://m.cnyes.com/news/id/6127528
19,6127505,盧特尼克專訪 曝光台積電在美投資1650億美元內幕,美國商務部長盧特尼克 (Howard Lutnick) 在接受 CNBC《Squawk Box》專訪時表示，川普政府正採取更具攻勢的產業政策，要求企業在獲取補助的同時，必須承諾更高額的投資，相關壓力之下，台積電宣布加碼投資美國,https://m.cnyes.com/news/id/6127505
20,6127520,〈紐約匯市〉美元下跌 川普解雇Fed理事驚嚇市場,美元周二 (26 日) 下跌，因美國總統川普前所未有地宣布解雇聯準會 (Fed) 理事庫克 (Lisa Cook)，再度引發市場對央行獨立性的擔憂。,https://m.cnyes.com/news/id/6127520
21,6127511,〈貴金屬盤後〉川普開除Fed理事 金價登上兩周高點,,https://m.cnyes.com/news/id/6127511
22,6127506,巴黎CAC 40指數下挫1.70% 法國政府面臨倒台風險,歐股週二 (26 日) 走低，主要受到法國股市拖累，投資人密切關注法國政府下月可能在國會信任投票中倒台的風險，法國 CAC 40 指數跌幅達 1.70%。,https://m.cnyes.com/news/id/6127506
23,6127522,美國關稅收入激增 美財長：每年或超過5000億美元,"據《路透》報導，美國財政部長貝森特 (Scott Bessent) 周二 (26 日) 表示，川普總統推動的關稅措施，所帶來的關稅收入每年可能超過 5,000 億美元，其中從 7 月到 8 月已有大幅增長，而 9 月的增幅可能更大。",https://m.cnyes.com/news/id/6127522
24,6127508,〈美股盤後〉蘋果秋季發表會9/10凌晨登場 四大指數齊揚,華爾街關注美國總統川普解除聯準會理事庫克職務的消息，同時等待晶片巨頭輝達財報，美股主指週二 (26 日) 全數收揚,https://m.cnyes.com/news/id/6127508
25,6127477,〈台股盤前要聞〉居高思危？強勢股當沖率高、 3台廠打入輝達AI機器人新大腦,台股盤前要聞,https://m.cnyes.com/news/id/6127477
26,6127507,台灣在列！美商務部對10國抗腐蝕鋼品作出反補貼/傾銷初裁,"美國商務部週二 (26 日) 宣布，對來自 10 個國家的「抗腐蝕鋼品」(Corrosion-Resistant Steel Products, CORE) 作出反傾銷（AD）與反補貼（CVD）稅初步裁定，涉及進口總額約 29 億美元。",https://m.cnyes.com/news/id/6127507
27,6127512,【袁志峰專欄】港股升勢近尾聲，不宜高追,,https://m.cnyes.com/news/id/6127512
28,6127503,聯準會首度回應Cook解職案 強調理事任期保護制度重要性,聯準會周二 (26 日）表示，將遵守法院對美國總統川普是否有權解職理事庫克（Lisa Cook）的任何裁決。同時重申，聯準會理事享有長期任期保護的重要性。,https://m.cnyes.com/news/id/6127503
29,6127502,川普稱將掌控Fed多數席次 預告房市將因降息「大幅好轉」,據《CNBC》周二報導，美國總統川普表示，將很快在聯準會理事會中擁有「多數席次」支持他大幅降息的政策。此前他試圖解職理事庫克，並已提名 Stephen Miran 接替即將退休的理事，預計將掌控七人理事會的多數席位。,https://m.cnyes.com/news/id/6127502
30,6127479,VIX空頭部位創三年新高 分析師警告：極端平靜恐預示風暴,據《彭博》周二 (26 日) 報導，避險基金正大舉做空 VIX 指數，淨空頭部位達三年新高。但歷史顯示，這種極端平靜和部位配置往往預示動盪和股市重挫，交易員可能面臨被迫回補的風險。,https://m.cnyes.com/news/id/6127479
31,6127437,日國債拋售潮加劇！10年期殖利率創16年高 30年期漲破3.2% 央行干預呼聲高漲,,https://m.cnyes.com/news/id/6127437
32,6125740,鮑爾在傑克森霍爾的豪賭 Fed能否扭轉局勢？,,https://m.cnyes.com/news/id/6125740
33,6127461,蘋果9月9日有望發布多款新品：i17新機、史上最薄iPhone Air、AirPods Pro3將陸續亮相,,https://m.cnyes.com/news/id/6127461
34,6127478,降息別想太快？Fed巴金：若經濟平穩 利率僅小幅調整,美國里奇蒙聯邦準備銀行總裁巴金 (Tom Barkin) 周二 (26 日) 表示，他的基準預測是利率將做「溫和調整」，因為他預期今年剩餘時間美國經濟活動不會出現太大波動。,https://m.cnyes.com/news/id/6127478
35,6127443,川普攻擊聯準會引全球憂慮 國際清算銀行警告：央行獨立性是控制通膨關鍵,據《彭博》周二 (26 日) 報導，國際清算銀行新任總經理 Pablo Hernandez de Cos 強調，央行獨立性對控制通膨與民眾福祉至關重要。此談話正值川普持續攻擊聯準會並要解僱理事庫克（Lisa Cook）之際。,https://m.cnyes.com/news/id/6127443
36,6127395,美8月消費者信心小幅降至97.4 就業與通膨憂慮升溫,美國消費者信心在 8 月略微下滑，主要受到就業市場前景與收入預期轉弱影響，同時通膨憂慮再度升溫。美國經濟評議會 (Conference Board) 周二 (26 日) 公布的調查顯示，消費者信心指數下滑 1.3 點至 97.4，高於市場預,https://m.cnyes.com/news/id/6127395
37,6127455,蘋果9/10舉行秋季新品發表會 iPhone 17系列登場倒數,蘋果 (AAPL-US) 周二 (26 日) 向媒體與分析師發出邀請，將於美西時間 9 月 9 日上午 10 點 (台灣時間 9 月 10 日凌晨 1 點) 舉行秋季新品發表會，主題標語為「Awe dropping」。外界普遍預期，蘋果將在這場發表會上推出新,https://m.cnyes.com/news/id/6127455
38,6127432,OpenAI醫療野心全面曝光！從幕後技術商轉向直接競爭,據《商業內幕》周二報導，OpenAI 正加速進軍醫療領域，聘請醫療社群平台 Doximity 共同創辦人 Nate Gross 及前 Instagram 產品共同主管 Ashley Alexander，分別負責醫療市場策略與產品開發。,https://m.cnyes.com/news/id/6127432
39,6127331,歐盟不畏川普威脅 堅持推進數位服務法監管,綜合外媒周二 (26 日) 報導，面對美國總統川普威脅對課徵「數位稅」國家實施報復性關稅，歐盟表示不會屈服，將繼續推進具指標性意義的數位法規。,https://m.cnyes.com/news/id/6127331
40,6127355,挑戰做美國最大廉航！邊疆航空瞄準精神航空地盤擴張,精神航空財務危機加劇，本月警告若無更多資金可能撐不過一年。據《CNBC》報導，競爭對手邊疆航空周二 (26 日) 宣布新增 20 條航線，鎖定精神航空主要市場，執行長稱若精神航空倒閉，預期將搶下大部分市佔。,https://m.cnyes.com/news/id/6127355
41,6127427,蘋果急了？傳鎖定Mistral、Perplexity收購 擺脫AI落後劣勢,根據《The Information》援引知情人士消息報導，蘋果 (AAPL-US) 內部持續討論是否收購法國新創 Mistral AI 及生成式人工智慧 (AI) 搜尋平台 Perplexity，以加速 AI 布局。這些潛在交易尚未有定,https://m.cnyes.com/news/id/6127427
42,6126666,市場罹患「傑克遜霍爾後遺症」 對降息從狂熱轉為謹慎,,https://m.cnyes.com/news/id/6126666
43,6127352,美7月核心資本財訂單增速超預期 企業支出復甦跡象浮現,美國 7 月企業設備訂單優於市場預期，顯示企業在面對貿易與稅收政策不確定性逐漸消退之際，投資意願出現回升跡象。美國商務部周二 (26 日) 公布初步數據顯示，作為設備投資指標的核心資本財訂單 (扣除飛機與軍事設備) 月增 1.1%，扭轉,https://m.cnyes.com/news/id/6127352
44,6127391,夏季蜜月期將終結？高盛：投資人面臨多重市場風險,據《彭博》周二 (26 日) 報導，高盛集團 (GS-US) 警告，美股的夏季蜜月期幾乎已經結束，投資人面臨美國經濟數據疲軟、貿易關稅威脅及川普攻擊聯準會等多重挑戰。,https://m.cnyes.com/news/id/6127391
45,6127258,〈美股早盤〉主要指數開低 川普挑戰Fed獨立性 市場信心動搖,美股主要指數周二 (26 日) 開盤小幅走低，美元走弱、長天期美債殖利率上升。市場情緒受到美國總統川普撤換聯準會 (Fed) 理事庫克 (Lisa Cook) 的行動影響，投資人再度憂心央行獨立性受威脅與通膨風險升高。,https://m.cnyes.com/news/id/6127258
46,6127333,力麗多角布局北士科推合建案 轉投資峰儀科技為輝達認證供應商,力麗多角布局北士科推合建案 轉投資峰儀科技為輝達認證供應商,https://m.cnyes.com/news/id/6127333
47,6127323,上半年外幣保單FYP占比略升仍處低檔 2原因推升台幣保單買氣,金管會今 (26) 日公布最新統計，壽險業 2025 年上半年外幣保險商品新契約保費收入折合新台幣約 2006.11 億元、年增 35%，占整體新契約保費收入 39.63%，較去年同期的 39.58% 略升,https://m.cnyes.com/news/id/6127323
48,6127337,稀土價格飆兩年高點 MP停供中國掀漲勢,根據《路透》周二 (26 日) 報導，受美國稀土公司 MP Materials(MP-US)停止對中國出口影響，加上需求回升，用於製造高性能磁鐵的兩種稀土金屬價格飆升，創下兩年多來新高。這一波漲勢凸顯全球對稀土供應的地緣政治依賴,https://m.cnyes.com/news/id/6127337
49,6127356,繼英特爾後再出手？川普政府擬收購洛克希德馬丁等國防巨頭股權,據《CNBC》周二 (26 日) 報導，美國商務部長盧特尼克 (Howard Lutnick) 表示，川普政府軍事領導層正在「考慮」美國政府是否應收購洛克希德馬丁 (LMT-US) 等頂尖國防承包商的股權。,https://m.cnyes.com/news/id/6127356
50,6127354,新光鋼粟明德：Q4需求逐漸回溫 明年展望樂觀,新光鋼粟明德：Q4 需求逐漸回溫 明年展望樂觀,https://m.cnyes.com/news/id/6127354
51,6127332,蘋果8月大漲9.4%後還有力嗎？ 分析師：若輝達暫歇會是資金輪動自然選擇,據《彭博》周二 (26 日) 報導，蘋果 (AAPL-US) 股價在 2025 年大部分時間表現低迷後，開始出現復甦跡象，先前的關稅威脅風險正在緩解。,https://m.cnyes.com/news/id/6127332
52,6127238,聯準會降息提振小型股 市場質疑漲勢持續性,在聯準會主席鮑爾 (Jerome Powell) 終於釋出 9 月降息的訊號後，市場情緒大受鼓舞，特別是利率敏感的小型股終於迎來追趕時機。羅素 2000 指數在過去一個月內飆升約 4%。然而，儘管小型股獲得提振，市場仍舊觀望這次上漲是,https://m.cnyes.com/news/id/6127238
53,6127298,傳Stellantis擱置Level 3自駕計畫 技術與成本壓力浮現,《路透》周二 (26 日) 援引知情人士消息報導，汽車製造商 Stellantis(STLA-US)已擱置首個 Level 3 自動駕駛輔助計畫，原因包括高昂成本、技術挑戰與市場需求有限，顯示該公司在軟體布局上的雄心出現退卻。這一轉,https://m.cnyes.com/news/id/6127298
54,6127297,「小台積電」0052分割擬1拆6 明起停止過戶、9/25召開受益人會議,富邦科技 (0052-TW) 將於 9 月 25 日召開受益人大會，決議是否啟動分割，截至今年 7 月底，0052 受益人數 28177 人，基金規模 145.34 億元，持有台積電權重約 67%。,https://m.cnyes.com/news/id/6127297
55,6126974,〈台聚法說〉台聚、亞聚：Q3 EVA供過於求壓力和緩 鞋材需求可逐步恢復,台聚 (1304-TW)、亞聚 (1308-TW) 今 (26) 日舉行法說會，台聚、亞聚總經理吳培基表示，第 3 季隨著美國對等關稅逐漸明朗，預期鞋廠對 EVA(乙烯) 需求將可逐步恢復正常軌道。,https://m.cnyes.com/news/id/6126974
56,6127218,路易威登160美元口紅：豪華美妝市場的「策略性舉動」,路易威登 (Louis Vuitton) 透過與知名彩妝師 Pat McGrath 合作，推出首個永久性彩妝系列「La Beauté」，以每支 160 美元 (約 4800 元新台幣) 的唇膏，重新定義了奢華美妝品的價格標準。此系列含 55 款,https://m.cnyes.com/news/id/6127218
57,6127259,禮來口服減重藥三期試驗成功 最快2026上市,綜合外媒周二 (26 日) 報導，美國製藥大廠禮來 (Eli Lilly &amp; Co.)(LLY-US) 旗下實驗性減重藥丸 orforglipron，在最新一項關鍵性臨床試驗中達成主要目標，幫助肥胖合併第二型糖尿病患者顯著減重並改善,https://m.cnyes.com/news/id/6127259
58,6127282,新華泰富連2季財報出狀況 金管會：遲未補交財報 最快明年1/2下櫃,金管會今 (26) 日表示，上櫃公司新華泰富 (5481-TW) 第一、二財報接連出狀況，已自 5 月 20 日停止買賣至今，主要因簽章董事長跟目前在經濟部登記者不同，進而無法公告申報，若業者遲未補交財報，最快明年 1 月,https://m.cnyes.com/news/id/6127282
59,6127293,外資轉賣145億元提款金融及傳產股 反手加碼電子族群,外資轉賣 145 億元提款金融及傳產股 反手加碼電子族群,https://m.cnyes.com/news/id/6127293
60,6127192,輝達財報前夕 期權市場估市值波動2600億美元 牽動AI概念股走向,輝達 (NVDA-US) 即將公布的第二季財報，成為市場關注的焦點，不僅因其自身表現，更因其對整個 AI 產業的潛在影響。,https://m.cnyes.com/news/id/6127192
61,6127242,三商美邦壽傳出售 金管會澄清未接獲函報、駁斥高層懇談說法,三商美邦人壽資本適足率長年未達法定標準，近期傳出有意出售，並採邀請制尋求買主，外界關注公司是否有向金管會保險局報告，對此，官員表示，保險公司是否出售股權主要因其商業考量,https://m.cnyes.com/news/id/6127242
62,6127263,川普動作挑戰Fed獨立性 美債殖利率曲線陡升,《CNBC》周二 (26 日) 報導，美國總統川普表示要撤換聯準會 (Fed) 理事庫克(Lisa Cook)，消息一出，美國公債殖利率曲線出現明顯陡升走勢，短天期殖利率下滑，長天期殖利率則走高，顯示投資人押注未來短期利率將下降，,https://m.cnyes.com/news/id/6127263
63,6127241,研華入列輝達Jetson Thor合作廠商 推整機系統及機器人套件新品,研華入列輝達 Jetson Thor 合作廠商 推整機系統及機器人套件新品,https://m.cnyes.com/news/id/6127241
64,6127178,法國政局風暴 總理貝魯預算案引發倒閣危機 歐元區財政前景黯淡,法國總理貝魯 (François Bayrou) 日前宣布將於下個月尋求國會信任投票，此舉可能導致法國政府垮台，進而引發市場對法國政局不確定性的擔憂。,https://m.cnyes.com/news/id/6127178
65,6126621,費城半導體指數連動台股的解析,,https://m.cnyes.com/news/id/6126621
66,6127222,輝達推最新機器人平台 達明：9月有機會採用 Jetson Thor 架構模組,輝達 (NVDA-US) 近日宣布推出「機器人新大腦」成為 AI 機器人未來落地重要推手，達明 (4585-TW) 董事長何世池今 (26) 日表示，9 月開始，達明機器人可能會採用 Jetson Thor 機器人電腦架構的樣品出現。,https://m.cnyes.com/news/id/6127222
67,6127175,〈台幣〉鮑爾放鴿題材淡化 放量貶逾1角收30.555元,美國聯準會主席鮑爾「放鴿」後，新台幣兌美元匯率昨 (25) 日強彈一天，今 (26) 日又反轉走貶，在外資擴大匯出下，失守 30.5 元關卡，終場收在全日最低 30.555 元，貶值 1.05 角，,https://m.cnyes.com/news/id/6127175
68,6126948,川普與通膨憂慮雙重夾擊 日本公債殖利率創歷史新高,日本政府公債 (JGB) 殖利率周二 (26 日) 觸及歷史新高，主要受到美國總統川普試圖罷免聯準會理事麗莎 · 庫克 (Lisa Cook) 的舉動所影響。此事件引發了市場對通膨壓力升高，以及聯準會未來可能轉向鴿派、優先勞動市場,https://m.cnyes.com/news/id/6126948
69,6127179,不用奔日「追櫻」！日本2025年版櫻花套幣跨海上市 臺銀線上線下通路均售,臺灣銀行自今（26） 日起，於臺灣銀行網站「黃金業務首頁 - 常用服務 - 紀念幣套幣訂購」區、營業部及各分行（簡易型分行除外），銷售日本 2025 年版櫻花精鑄（6300 元 / 套）及平鑄套幣（1260 元 / 套）。,https://m.cnyes.com/news/id/6127179
70,6127181,泓德能源捲綠能弊案 公司：總經理已恢復工作、靜待司法調查結果,經濟部綠能科技產業推動中心前副執行長鄭亦麟涉嫌在任內向 2 家綠能業者索賄，泓德能源 (6873-TW) 總經理周仕昌也捲入綠能弊案，並在昨日以 1 百萬元交保。公司今 (26) 日回應，總經理已恢復正常工作。本案已進入司法偵查程序，公,https://m.cnyes.com/news/id/6127181
71,6127136,林百里：機器人夢想由達明達成 與輝達將有更多合作,達明 (4585-TW) 機器人今 (26) 日舉行上市前業績發表會，針對達明日前推出的人形機器人「TM Xplore I」，廣達董事長林百里致詞時表示，孫子「登大人」，讓「做爺爺的」很開心，並表示最大夢想，由達明完成。,https://m.cnyes.com/news/id/6127136
72,6126834,跨端傳輸在即？外媒：谷歌「快速分享」將兼容蘋果iOS  AirDrop地位將不保？,,https://m.cnyes.com/news/id/6126834
73,6127001,〈永豐金法說〉「台股還是沒有敗象」黃蔭基：中秋行情高點上看26180點,永豐金 (2890-TW) 今 (26) 日舉行第二季法說會，談及台股下半年展望，首席經濟學家黃蔭基直言，目前位階來看，「台股還是沒有敗象」，預期會再越過 24551 歷史高點，今年高點上看 26180 點，中秋行情可期,https://m.cnyes.com/news/id/6127001
74,6127133,製鞋廠鈺齊-KY上半年稅後純益5.52億元 EPS 2.76元,製鞋廠鈺齊 - KY 公布最新獲利資訊，2025 年第二稅後純益 3 億元，季增 19.29%，年減 26.31%，單季每股純益 1.5 元，2025 年上半年稅後純益 5.52 億元，年減 19.92%，每股純益 2.76 元。,https://m.cnyes.com/news/id/6127133
75,6127115,國光生再獲巴西GMP認證 目標2026年底取證流感疫苗進軍南半球,國光生 (4142-TW) 今 (26) 日表示，近日接獲巴西衛生部 (ANVISA) 正式取得 GMP 認證，預計 2026 年底取得巴西流感疫苗藥證，國產流感疫苗可望進軍南半球市場。 ,https://m.cnyes.com/news/id/6127115
76,6127064,泰金-KY Q2受業外匯兌損失影響陷虧 上半年EPS爲1.48元,泰金 - KY 今 (26) 日公布最新獲利資訊，2025 年第二季因匯兌損失及需求觀望而陷入虧損，單季淨損 4651 萬元，每股虧損 1.21 元；2025 年上半年稅後純益 5672 萬元，年減 74.16%，每股純益 1.48 元。,https://m.cnyes.com/news/id/6127064
77,6127116,台股震盪翻紅，台積電在地化商機驅動特化與晶圓族群成資金焦點：昇陽半、新應材、台特化、AES-KY、台積電,,https://m.cnyes.com/news/id/6127116
78,6127004,華碩ROG擴大電競業務影響力 再下一城與電競聯賽合作,PC 品牌華碩 (2357-TW) 持續在電競市場發力，電競產品線已成為華碩最大的業務類別，年成長超過 40%，而華碩今 (26) 宣布，旗下電競品牌 ROG 玩家共和國，宣布其全系列精銳硬體獲選為 BLAST Premier 2,https://m.cnyes.com/news/id/6127004
79,6127003,〈工業生產指數〉連17紅！年增18.11% 傳產、科技冷熱兩極化更明顯,經濟部統計處今（26）日公布最新工業生產及製造業生產指數，7 月份雙雙繳出亮眼成績單，不僅分別年增 18.11% 與 19.55%，更雙雙寫下連續第 17 個月正成長的紀錄，以 AI、高效能運算為核心的資訊電子產業持續飆升，傳統產業則,https://m.cnyes.com/news/id/6127003
80,6127065,AI伺服器 x 蘋果新品 x 機器人　三箭齊發助鴻海成長,,https://m.cnyes.com/news/id/6127065
81,6126430,輝達財報公布前夕！摩根士丹利：受中國銷售不確定性影響 財測恐保守,,https://m.cnyes.com/news/id/6126430
82,6126697,美國與俄羅斯私下討論能源交易！助推烏克蘭和平談判？,據報導，美國與俄羅斯官員在烏克蘭和平談判間隙，私下討論多項能源交易方案，包括薩哈林 1 號與北極 LNG2 號項目，以促進烏克蘭和平並可能放鬆對俄羅斯制裁。,https://m.cnyes.com/news/id/6126697
83,6126949,禾榮科與佳世達簽署合作協議 攜手建置BNCT中心,禾榮科 (7799-TW) 今 (26) 日宣布，與佳世達集團簽署合作協議，為禾榮科首度將加速器硼中子捕獲治療 (AB-BNCT) 中心建置推向海外，雙方將共同投入 BNCT 中心建置。 ,https://m.cnyes.com/news/id/6126949
84,6126943,川普「大降息」將引發亞洲市場及亞幣動盪！林啟超：兩年內要密切注意匯率風險,在今（26）日惠譽台灣年會上，國泰世華首席經濟學家林啟超對美國未來的貨幣政策，以及其對台灣乃至整個亞洲地區帶來的潛在衝擊，發出重要警告。他指出，儘管市場普遍預期聯準會（Fed）將在明年降息，但美國總統川普恐將導致一場超乎,https://m.cnyes.com/news/id/6126943
85,6126770,德國工業危機加劇 汽車業一年裁員逾5萬人 總職位流失逾11萬,根據顧問公司安永 (EY) 的分析報告，德國工業在經濟危機中面臨嚴峻挑戰，特別是汽車產業，在過去一年中裁員超過 5 萬人，成為受創最重的工業部門。這場危機不僅導致大量職位流失，也引發了關於德國是否正走向「去工業化」的激烈辯論。,https://m.cnyes.com/news/id/6126770
