,newsId,title,summary,link
331,6206325,1兆薪酬案阻力重重！特斯拉董事長急喊話：留不住馬斯克估值恐不保,據《CNBC》周一 (27 日) 報導，特斯拉 (TSLA-US) 董事長丹霍姆 (Robyn Denholm) 周一呼籲股東支持執行長馬斯克的薪酬方案。她警告，若無法留住馬斯克，特斯拉可能失去重大價值。,https://m.cnyes.com/news/id/6206325
332,6206312,調查：金價看多至2026年 分析師喊均價破4千美元,"黃金漲勢預料將延續至明年，分析師預測 2026 年平均金價將首度突破每盎司 4,000 美元。《路透》周一 (27 日) 公布最新調查顯示，在全球經濟與地緣政治動盪持續之下，避險需求推動金價強勢上行。",https://m.cnyes.com/news/id/6206312
333,6205954,張一鳴向雙11「投豆包」 抖音以AI應用導流電商,「AI 導購」已成為中美科技巨頭競逐的焦點，正重塑購物體驗。在中國電商巨頭積極佈局雙 11 之際，字節跳動旗下的 AI 應用「豆包」悄然加入這場「AI 導購」暗戰，並效仿國外做法，直接讓 AI APP 給電商業務導流。,https://m.cnyes.com/news/id/6205954
334,6206359,川普：若對中談判順利 可能放棄上周啟動的對中貿易調查,據《彭博》周一 (27 日) 報導，美國總統川普同日在空軍一號上表示，若與本周四與中國國家主席習近平的會談順利，可能放棄上周開始，對中國違反第一任期貿易協議的調查。,https://m.cnyes.com/news/id/6206359
335,6206284,礦災不斷＋美中局勢緩和 LME銅價漲到快破紀錄,"根據《彭博》報導，受美中貿易協議前景樂觀及全球多座大型礦場供應中斷帶動，銅價周一 (27 日) 續漲，逼近歷史新高。倫敦金屬交易所 (LME) 銅價盤中一度上漲 1.2%，至每公噸 11,094 美元，距離 2024 年 5 月創下的紀錄高點僅",https://m.cnyes.com/news/id/6206284
336,6205958,沃爾瑪中國換帥 前阿里高管劉鵬接掌山姆中國 衝刺千億業績大關,沃爾瑪中國周一 (27 日) 宣布重大人事變動，原阿里巴巴集團高管劉鵬已加入沃爾瑪中國，並擔任山姆會員店業態總裁。此任命即日起生效，劉鵬將直接向沃爾瑪中國總裁及首席執行官朱曉靜彙報。,https://m.cnyes.com/news/id/6205958
337,6206340,鉅亨速報 - Factset 最新調查：特斯拉TSLA-US的目標價調升至420元，幅度約3.45%,FactSet 最新調查：特斯拉TSLA-US目標價調升，最高估值、最低估值、中位數、綜合評級、近5日股價、標普、即時新聞資訊,https://m.cnyes.com/news/id/6206340
338,6206317,「屋頂」優先、占比逾64%！經部：擴大獎勵屋頂型光電 「每瓩3000元」催生綠能,針對今 (27) 日環保團體發表加嚴光電環評聯合聲明一事，經濟部能源署說明，強調台灣太陽光電的推動策略始終堅持「屋頂優先、地面複合利用」兩大原則，且所有設置案均須嚴格依循相關法令規範與審查機制，確保避開環境敏感區位。為回應社,https://m.cnyes.com/news/id/6206317
339,6206318,台鐵平溪線搶修作業 交長指示：明年過年前為修復通車目標,台鐵平溪線多處路段出現災損，包括 K9+820-920 路段路基流失共 7 處致災點。交通部長陳世凱前往當地視察時表示，搶修工作除要確保路廊安全外，以明 (2026) 年過年前能搶通為明確目標，全力恢復通車。,https://m.cnyes.com/news/id/6206318
340,6206313,國邑*系統性硬化症新藥發表臨床一期試驗成果 加速推進後續臨床試驗,國邑 *(6875-TW) 宣布，旗下自主開發的吸入新藥 L608(微脂體 - 伊洛前列素) 在 2025 年美國風濕學會年會 (ACR 2025) 發表臨床一期試驗結果，除數據具突破性優勢，目前加速推進後續臨床試驗。,https://m.cnyes.com/news/id/6206313
341,6206090,搶先美國 首檔Solana現貨ETF香港獲批 27日正式掛牌,香港證券及期貨事務監察委員會（SFC）近日正式核准了亞洲首檔 Solana（SOL）現貨 ETF。這項產品由中國資產管理（香港）有限公司（ChinaAMC）/ 華夏基金（香港）發行，使得 Solana 成為繼比特幣（BTC,https://m.cnyes.com/news/id/6206090
342,6206260,利多變利空？美中稀土休戰 礦商股價瞬間跳水,根據《路透》周一 (27 日) 報導，美中兩國在稀土及關鍵礦物領域達成暫時「停火」協議後，美國上市稀土礦商周一美股盤前股價一度重挫逾 8%，反映市場對供應中斷疑慮的降溫。這項框架協議將暫緩美國原定自 11 月 1 日生效的對中關稅計畫，,https://m.cnyes.com/news/id/6206260
343,6206285,降息加持 全球投等債ETF單周淨流入50億美元 台灣反向流出133億元,儘管美國就業市場持續降溫、政府停擺陰影未散，以及關稅帶來的成本上揚壓力籠罩，使得整體經濟下滑風險陡增，市場普遍預期聯準會（Fed）將在月底的會議上再次調降利率。在這樣的市況下，具備高品質與相對殖利率優勢的投資等級債券，格,https://m.cnyes.com/news/id/6206285
344,6205989,中國「人造太陽」預計2027年竣工 有望全球首個實現聚變發電,中國外交部發言人毛寧於 10 月 25 日向世界分享了中國「人造太陽」項目的最新進展，她指出該裝置預計將在 2027 年竣工，並有望成為人類歷史上首個實現聚變發電的裝置。,https://m.cnyes.com/news/id/6205989
345,6206280,大同攜台北高爾夫俱樂部導入表後儲能 具需量管理及時間電價兩大效益,大同 (2371-TW) 旗下大同智能今 (27) 日宣布，攜手台北高爾夫俱樂部導入表後儲能暨能源管理系統。大同指出，此案規劃的儲能系統具備兩大應用效益，包括需量管理及時間電價。,https://m.cnyes.com/news/id/6206280
346,6206264,新莊到林口縮短20分鐘 五股國道北出匝道今16:00提前完工通車,高速公路局與新北市共同推動「國道 1 號五股交流道增設北入北出匝道改善工程」，今 (27) 日宣布第一階段北出匝道已提前 1 年半完工，交通部長陳世凱表示，新增北出匝道啟用後，可有效分散尖峰時間車流，也提升通行安全與效率。,https://m.cnyes.com/news/id/6206264
347,6206261,美債風向轉變！Fed降息還沒來 投資人已先撤長天期,在美國聯準會 (Fed) 本周即將召開為期兩天的貨幣政策會議之際，市場普遍預期決策官員將於美國時間周三 (29 日) 宣布再降息 1 碼(25 個基點)，推動美債殖利率小幅走高，同時促使部分債券投資人重新調整持倉，減碼長天期公債部位。,https://m.cnyes.com/news/id/6206261
348,6205977,近6成A股三季報報喜 高盛看好中國股市再漲約30%,Wind 數據顯示，截至 10 月 24 日晚間，A 股共有 1083 家上市公司對外披露三季報，647 家實現歸屬於上市公司股東的淨利潤同比增長，占比約爲 59.74%。從行業角度看，業績大幅回暖的上市公司，主要集中在通信設備、半導體、化,https://m.cnyes.com/news/id/6205977
349,6206256,長榮營運需求 斥資15.4億元向榮運承租3.3萬只貨櫃,長榮 (2603-TW) 及榮運 (2607-TW) 今 (27) 日共同召開重大訊息說明會，長榮海運的子公司長榮海運（亞洲）有限公司，因應營運需要，決議向關係人 Gaining Enterprise S.A.（立盛企業）承租貨櫃。,https://m.cnyes.com/news/id/6206256
350,6206258,LEO元件廠昇達科1-9月稅後純益3.03億元 EPS達4.6元,昇達科今 (27) 日公布最新獲利資訊，今年第三季營收 4.84 億元，前三季營收達 16.18 億元，第三季稅後純益 8848 萬元，每股純益 1.33 元，前三季營收達 16.18 億，稅後純益 3.03 億元，每股純益 4.6 元。,https://m.cnyes.com/news/id/6206258
351,6206204,聯華林德10/29展出氫能卡車 宣告氫能移動、工業應用優勢,國際智慧能源周、淨零永續展即將於本周三 (29 日) 起，一連 3 日於南港展覽館登場，聯華林德氣體此次將以「氫領轉型，碳索永續」為主軸，首度展示台灣首輛氫燃料電池重型卡車，也持續連結產業夥，推動氫能在移動與工業上的應用進程。,https://m.cnyes.com/news/id/6206204
352,6206205,順藥中風新藥明年啟動臨床三期試驗 目標2030年上市,晟德子公司順藥近日揭露旗下中風新藥 LT3001 臨床二期試驗數據，而順藥今 (27) 日召開法說會，總經理葉聖文進一步說明未來規劃，指出目前正在規劃設計臨床三期方案，預計明年啟動，並以 2030 年上市為目標。,https://m.cnyes.com/news/id/6206205
353,6206185,集保私募商品查詢專區上線 三箭齊發打造商品投資價值鏈,集保結算所今 (27) 日宣布，推出「私募商品查詢專區」，該專區整合了投信事業發行的私募證券投資信託基金，以及投信事業轉投資子公司擔任普通合夥人之私募股權基金等資訊，便利合格投資人一站式查詢。,https://m.cnyes.com/news/id/6206185
354,6206016,〈台幣〉本日最強亞幣！股匯雙漲收30.719元 聚焦本周Fed利率決策,上周美國 CPI 數據報捷，為聯準會本周降息再添底氣，台北股匯今 (27) 日收假恢復交易上演雙漲走勢，在熱錢湧入下，大盤一度衝破 2 萬 8 大關，,https://m.cnyes.com/news/id/6206016
355,6206122,研調：AI PC仍處前瞻導入期 各大廠積極布局2026年後將迎出貨成長期,研調機構 Counterpoint Research 報告指出，2025 第三季 PC 市場回升，出貨量年成長 8.1%，不僅是為了汰換老舊系統，更代表整體產業正為未來發展做準備。許多企業即使當前尚未有明確的 AI 運算需求，也,https://m.cnyes.com/news/id/6206122
356,6206116,賴清德重申：美關稅談判秉持4大原則爭取調降、不疊加及232最惠國待遇,賴清德今 (27) 日表示，針對美台對等關稅談判進度，強調將秉持國家利益、產業利益、國民健康、糧食安全 4 大原則，並持續爭取最好條件，也希望將暫行稅率 20% 再調降、不疊加，也將爭取《232 條款》稅率獲得最惠國待遇。&#39;,https://m.cnyes.com/news/id/6206116
357,6206017,中國車廠現有產能涵蓋北美市場！福特執行長：若放任競爭 我們沒有活路,,https://m.cnyes.com/news/id/6206017
358,6206121,Q4強勢多頭下一檔漲停飆股、至上⊕、國巨⊕、華新科⊕、楠梓電⊕、下一檔？務必跟上,,https://m.cnyes.com/news/id/6206121
359,6206003,國內鋼筋市場買氣低迷 豐興盤價每公噸跌200元,國內鋼筋市場買氣低迷 豐興盤價每公噸跌 200 元,https://m.cnyes.com/news/id/6206003
360,6205985,3大利多驅動！日經指數漲破5萬點里程碑 2檔半導體ETF單日漲逾4%最強,美中貿易磋商達成初步共識，加上美國上周公布 CPI 年增率低於預期，增添聯準會降息機率，帶動四大指數創高。今 (27) 日亞股全面走揚,https://m.cnyes.com/news/id/6205985
361,6205986,台股2萬8閃電戰！外資大買326億元 力捧記憶體族群加碼力積電15.4萬張,台股今 日大盤終場以 27993.63 點作收，收漲 461.37 點或 1.68%，市場成交值爲 5480.52 億元。三大法人合計買超 510.03 億元。外資在期貨空單縮手，現貨市場主攻買超重點族群在記憶體族群。,https://m.cnyes.com/news/id/6205986
362,6205984,李強出席東協與中日韓會議 聚焦開放合作、科技創新與區域穩定,中國國務院總理李強周一 (27 日) 在馬來西亞吉隆坡，出席了第 28 次東協與中日韓領導人會議。李強在會上強調，中方願與各方加強發展戰略對接，堅持開放合作，持續釋放東亞經濟潛力，以開拓更廣闊的發展空間。他並指出，「東亞奇蹟不是過,https://m.cnyes.com/news/id/6205984
363,6205911,金融時報解析川普復仇之旅與權力擴張：掃除「內部敵人」、掌握權力,《金融時報》報導，美國總統川普利用第二任期展開復仇之旅，掃除內部對手、重塑軍隊、擴張家族與加密貨幣利益，政治氛圍呈現寒蟬效應，美國民主面臨挑戰。,https://m.cnyes.com/news/id/6205911
364,6206087,【量大強漲股整理】台股創新高後，被動元件噴出，下一個接棒的是誰？,,https://m.cnyes.com/news/id/6206087
365,6206088,兩萬八黑K收最低，電源+散熱 找機會：良維、AES-KY、雙鴻、奇鋐,,https://m.cnyes.com/news/id/6206088
366,6205979,告別俄羅斯！墨西哥登頂中國車最大買家 阿聯緊追其後 歐洲仍是電動車出口「基本盤」,,https://m.cnyes.com/news/id/6205979
367,6205983,智慧能源周、淨零永續展10/29登場 推低碳能源與綠色創新加速企業轉型新契機,SEMI 國際半導體產業協會全球行銷長暨台灣區總裁曹世綸今 (27) 日表示，此次展區強化淨零行動與低碳能源供給，為推動產業升級與維持競爭力的關鍵要務，未來企業不僅取決於技術創新，更在於能否兼具綠色韌性與永續治理。,https://m.cnyes.com/news/id/6205983
368,6205857,法律 × 科技 × 財富管理三強聯手　盈科(律所)、CMA+、SESG打造一站式海外服務平台,,https://m.cnyes.com/news/id/6205857
369,6205701,黃金牛市上周劇烈回調後 全球「抄底客」湧入市場,貴金屬市場上周經歷了一次戲劇性的急劇修正，金價曾飆升至接近每盎司 4400 美元的歷史高點，並在尾盤觸及 4381 美元上方的峰值。隨後，黃金價格在周二暴跌多達 6.3%，創下自 2013 年以來最大的單日跌幅。,https://m.cnyes.com/news/id/6205701
370,6205799,聯準會主席五位最終候選人確認！川普將於年底做出決定,美國財政部長貝森特確認聯準會主席接任五名最終候選人，川普預計年底前做出決定。現任主席鮑爾面臨降息壓力，市場關注新任主席對經濟政策影響。,https://m.cnyes.com/news/id/6205799
371,6205959,友達攜21家夥伴建智慧能源生態圈 迎表後儲能元年,友達攜 21 家夥伴建智慧能源生態圈 迎表後儲能元年,https://m.cnyes.com/news/id/6205959
372,6204972,AI狂潮變金手銬！輝達、AMD員工被股權套牢 直言離職成本太高,,https://m.cnyes.com/news/id/6204972
373,6205791,〈港股盤後〉中美貿易共識提振市場 恒指升1.05% 科技股領漲,受中美貿易關係傳出利好消息的影響，香港股市周一主要指數 (27 日) 集體上漲，結束緊張討論後，雙方形成初步共識，激勵市場情緒。美國總統川普此前預告美中很可能達成全面協議。,https://m.cnyes.com/news/id/6205791
374,6205938,TOYOTA bZ4X新款純電128萬元上市 和泰車：10月已預售300台 年目標4000台,和泰車 (2207-TW) 今 (27) 日召開新款 TOYOTA 日本進口純電休旅 bZ4X 發表會，並公布價格為 128 萬元，相較改款前 2025 年式打了「95 折」，和泰本部長賴志偉表示，價格較第一次導入時實惠許多，主要是在台灣積極爭取,https://m.cnyes.com/news/id/6205938
375,6205804,川普稱不會以「副總統」身份參與2028年大選：這想法「太可愛」,美國總統川普排除了以副總統身份參加 2028 年大選的想法。一些支持者一直敦促川普尋找方法，規避憲法對總統不得連任三屆的限制。,https://m.cnyes.com/news/id/6205804
376,6205696,新石器無人車獲6億美元融資 無人配送為何吸引資本關注？,,https://m.cnyes.com/news/id/6205696
377,6204727,"〈陸股盤後〉美國財長稱中國稀土出口管制將延後1年 滬指接近4,000點","中國股市三大指數周一（27 日）收盤同步走高，滬指接近 4,000 點，美國財政部長貝森特周日透露，預計中國將暫緩稀土出口管制 1 年，並恢復購買美國黃豆。",https://m.cnyes.com/news/id/6204727
378,6205744,全球首個日元掛鈎穩定幣在日本正式發行,全球首個與日元掛鉤的穩定幣周一 (27 日) 在日本正式推出。此舉雖然規模尚小，但在日本這個長期以來由現金和信用卡等傳統支付手段主導的國家中，卻具有重要的意義。,https://m.cnyes.com/news/id/6205744
379,6205697,加州州長紐森擬競選2028年美國總統：中期選舉後做出決定,加州州長紐森表示正在考慮參選 2028 年美國總統，將在 2026 年中期選舉後做出最終決定。他在黨內聲名鵲起，並致力提升民主黨國會影響力。,https://m.cnyes.com/news/id/6205697
380,6205859,〈日股盤後〉早苗經濟學助燃行情 日經指數漲破5萬點、國防股狂飆,,https://m.cnyes.com/news/id/6205859
381,6205747,韓股KOSPI指數今年表現在G20稱冠 外資搶買助力飆升,周一 (27 日) 公布的數據顯示，受外國投資者大舉購買半導體及其他藍籌股的強勁推動，南韓基準股指在 G20 主要股指中，於今年錄得了最快的漲幅。,https://m.cnyes.com/news/id/6205747
382,6205892,【時事觀察】川普亞洲行橫掃 APEC：川習會前哨戰啟動，關稅停火與供應鏈重排將引爆行情？,,https://m.cnyes.com/news/id/6205892
383,6205334,女首相氣勢如虹 高市早苗內閣支持率達74%,,https://m.cnyes.com/news/id/6205334
384,6205858,製鞋廠鈺齊-KY第三季獲利倍增 1-3季每股賺進4.26元,製鞋廠鈺齊 - KY(9802-TW) 今 (27) 日公布最新水利資訊，2025 年第三季稅後純益爲 3.01 億元，季增 0.17%，年增 1.94 倍，單季每股純益 1.5 元，2025 年前三季稅後純益 8.53 億元，年增 7.74%，,https://m.cnyes.com/news/id/6205858
385,6205793,美財長：美中達成TikTok出售「最終協議」 川普可能在周四簽署,美國總統川普表示，他可能在周四 (30 日) 就 TikTok 簽署最終協議，並已獲得中國國家主席習近平的「臨時批准」。預計川普本周稍晚將在亞洲之行期間在南韓與習近平舉行會晤。,https://m.cnyes.com/news/id/6205793
386,6205638,OpenAI要上市了？傳軟銀追加225億美元押注OpenAI年底前成功改組 但錢從哪來？,,https://m.cnyes.com/news/id/6205638
387,6205670,美中經貿磋商 新華社：相向而行 為兩國經貿關係注入穩定性,新一輪中美經貿磋商周日（26 日）在馬來西亞吉隆坡落下帷幕。本次磋商受到國際社會高度關注。雙方以今年以來兩國元首歷次通話共識為引領，圍繞美對華海事物流和造船業 301 措施、延長對等關稅暫停期、芬太尼關稅和執法合作、農產品貿易,https://m.cnyes.com/news/id/6205670
388,6205787,買卡車討川普歡心？高市早苗上任首個外交大考祭出「見面禮」,,https://m.cnyes.com/news/id/6205787
389,6205822,重量級科技股財報　聯準會再放鴿　AI大多頭進行式！　,,https://m.cnyes.com/news/id/6205822
390,6205821,台股2萬8擦身而過 外資回補326億 三大法人買超510.03億元,,https://m.cnyes.com/news/id/6205821
391,6205641,中國加速將AI融入軍事！偏好DeepSeek、仍依賴輝達晶片,中國加速將 AI 融入軍事，包括 DeepSeek 技術和輝達晶片應用。Norinco P60 無人車展現自主作戰能力，解放軍利用 AI 縮短戰場決策時間，提升目標識別效率，推動算法主權。,https://m.cnyes.com/news/id/6205641
392,6205786,德國企業向中國提交供應鏈數據 換取稀土出口許可,,https://m.cnyes.com/news/id/6205786
393,6205695,前人行顧問倡議：中國應重推2008年4兆元人民幣刺激方案,中國社會科學院學部委員兼前人行貨幣政策委員余永定表示，在經濟增速放緩及總需求不足的困境下，中國應讓投資在促進經濟發展中發揮更大的作用。他呼籲中國政府應在「十五五」規畫期間實施大規模投資計畫，並可以參考 2008 年「4 兆元人,https://m.cnyes.com/news/id/6205695
394,6204970,「雙普二會」告吹？俄外長曝露溝通細節,,https://m.cnyes.com/news/id/6204970
395,6205694,比銀行高2到3倍！全球黃金熱潮催生人才爭奪戰  避險基金、貿易商高薪搶專業交易員,,https://m.cnyes.com/news/id/6205694
396,6205555,安華與川普會談：半導體關稅「目前不是問題」、會在適當時機解決,馬來西亞總理安華表示，美國總統川普承諾將於適當時機處理半導體關稅問題。美馬簽署新貿易協議，馬來西亞未來十年計畫在美國投資 700 億美元，加強半導體合作。,https://m.cnyes.com/news/id/6205555
397,6205675,賽力斯啟動港股招股 成首家「A+H豪華新能源車企」,中國領先的新能源汽車 (NEV) 製造商賽力斯於 10 月 27 日正式啟動港股招股程序，招股期將持續至 10 月 31 日。根據計畫，賽力斯股票 (代碼「9927」) 預計將於 11 月 5 日正式在香港交易所主板掛牌。此次上市將標誌著首家「A+H」,https://m.cnyes.com/news/id/6205675
398,6205702,〈台股盤後〉漲價概念股漲風強灌刷新高 大漲461點尾盤惜敗2萬8,台股今 (27) 日台股由電子股擔綱演出，除元帥台積電 (2330-TW) 大漲以 1500 元平歷史高點之外，包括被動元件、ABF 載板及 DRAM 漲價的訊息助攻，同時，亞洲區域股市也走高帶動，大盤終場以 27993.63 點作收。,https://m.cnyes.com/news/id/6205702
399,6202065,【台股操盤人筆記】資金寬鬆與AI動能雙引擎，支撐台股震盪偏多格局,,https://m.cnyes.com/news/id/6202065
400,6205667,茅台集團5年4度易帥 貴州能源局長陳華跨界接掌,中國貴州茅台 (600519-CN) 近日再次迎來高層巨震，5 年內第 4 度更換掌門人。據新華財經和上海證券報消息，茅台集團已於 25 日上午召開大會，宣布重大人事調整：原董事長張德芹不再擔任茅台集團董事長職務，另有任用。接替他的是,https://m.cnyes.com/news/id/6205667
401,6181089,【Joe’s華爾街脈動】專題：AI 的循環融資是否會加劇泡沫化？,,https://m.cnyes.com/news/id/6181089
402,6205672,合勤控資安實力獲國際認可 加入國際資安組織FIRST團隊,網通廠合勤投控 (3704-TW) 今 (27) 日宣布，旗下的產品安全事件應變團隊（PSIRT），於 10/16 正式通過國際資安組織 FIRST（Forum of Incident Response and Security T,https://m.cnyes.com/news/id/6205672
403,6205666,川普啟程去日本見高市早苗！首站會見德仁天皇、美日峰會週二展開,美國總統川普正式訪問日本，將與首相高市早苗舉行首次高峰會，並於皇居獲德仁天皇親自接見。此次會談聚焦美日防衛合作、關稅與區域安全，被視為川普重返亞洲外交舞台的重要一站。,https://m.cnyes.com/news/id/6205666
404,6205652,國會大選結果出爐！阿根廷總統米萊取得壓倒性勝利：這是轉捩點 選後改組內閣,,https://m.cnyes.com/news/id/6205652
405,6205649,比特幣突破11.5萬美元：宏觀利好與數億美元空頭爆倉加速漲勢,受交易員對宏觀經濟條件的樂觀情緒，以及過去一天大量空頭倉位爆倉的推動，比特幣、以太幣和其他主要加密貨幣價格普遍上漲，比特幣一舉突破 11.5 萬美元。,https://m.cnyes.com/news/id/6205649
406,6205671,〈焦點股〉國巨挾漲價題材衝漲停 市值突破5100億元,〈焦點股〉國巨挾漲價題材衝漲停 市值突破 5100 億元,https://m.cnyes.com/news/id/6205671
407,6205656,瑩碩口服A酸獲台灣首發學名藥明年上半年鋪貨 攻原廠缺藥4億元商機,瑩碩今 (27) 日表示，旗下治療嚴重痤瘡 (青春痘) 藥品「敵痘軟膠囊」獲台灣 TFDA 核發領證通知，為國內口服 A 酸軟膠囊首家學名藥，預計明年上半年正式鋪貨，且因近年原廠供貨不穩定，可望搶攻每年 4 億元市場。,https://m.cnyes.com/news/id/6205656
408,6204587,群聯晉級準千金股！AI浪潮引爆NAND商機 5檔含「聯」高比例ETF全攻略,今（27）日台股在記憶體族群領軍下表現強勁，加權指數開盤即大漲 600 餘點。其中，NAND 控制晶片龍頭群聯（8299-TW）在美國指標廠美光股價創高激勵下，開盤即強勢鎖漲停，股價飆至 968 元歷史新高，正式向千元大關發起總攻,https://m.cnyes.com/news/id/6204587
409,6205634,〈焦點股〉2檔美股50 ETF新兵對決 009811股價領跑改寫上市新高,在台股掛牌的美股 ETF 市場中，大多數產品持有上百檔甚至數百檔成分股，但專注於 50 檔精選標的的 ETF 相當稀有，目前市場上僅有統一美國 50(009811-TW) 與貝萊德標普卓越 50(009813-TW) 採取此策略,https://m.cnyes.com/news/id/6205634
410,6205474,算力爭奪白熱化！谷歌用TPU搶Anthropic 亞馬遜AWS的「AI基建老大」地位保不住了？​,,https://m.cnyes.com/news/id/6205474
411,6205454,《人民日報》鐘聲呼籲美國：共同維護來之不易的成果,中美貿易談判在馬來西亞取得進展，川普與習近平本週將正式簽署協議，涵蓋關稅、運費與出口管制，市場對雙方合作持樂觀態度。,https://m.cnyes.com/news/id/6205454
412,6205589,〈焦點股〉海外ETF股王00757飆破120元改寫新高 00662躋身百元俱樂部,美中貿易戰降溫！就在川習會前，傳出中國稀土管制延後 1 年實施的好消息，加上美國通膨報佳音，再度提振本周 Fed 降息預期，台股今 (27) 日為連假後首個交易日，個股及 ETF 應聲補漲，,https://m.cnyes.com/news/id/6205589
