,newsId,title,summary,link
684,6120586,康全電訊印度客戶庫存水位過高 保守看待下半年營運,訊舟 (3047-TW) 旗下康全電訊 (8089-TW) 今 (21) 日召開法說會，發言人王淑靜指出，由於印度電信商客戶庫存水位過高，影響新訂單釋出，影響第二季，儘管對新訂單有信心，但仍要等待客戶消化庫存，保守看待下半年。,https://m.cnyes.com/news/id/6120586
685,6120647,中國組織在日本設據點 走私合成毒品芬太尼原料 日經：美國要查,走私合成毒品「芬太尼」原料的中國組織，在日本名古屋設立名為「FIRSKY 株式會社」的公司。《日經新聞》6 月獨家報導，認為可能是芬太尼原料的走私據點，美國禁毒署（DEA）已就此正式展開調查。,https://m.cnyes.com/news/id/6120647
686,6120548,中國多家銀行下調存款利率 淨利差承壓成主因,中國多家銀行，特別是村鎮銀行和城商行等中小銀行，近期紛紛宣布調降存款利率，此舉旨在應對激烈的市場競爭與貸款利率普遍下行所帶來的淨息差壓力。業內人士普遍預計，未來存款利率仍有進一步調降的可能性。,https://m.cnyes.com/news/id/6120548
687,6119630,香港交易所：IPO重回全球榜首 外資參與度顯著提升,,https://m.cnyes.com/news/id/6119630
688,6120554,訊舟AIOT產品出貨日本販賣機產品 下半年仍有專案挹注,網通廠訊舟 (3047-TW) 今 (21) 日召開法說會，副總經理潘良榮表示，儘管零售商用業務成長，但是在電信部分 (康全電訊) 衰退以及匯兌損失下，及業外損失達 1.36 億元，第二季獲利衰退，不過 AIOT 部門在出貨日本情形順利下，,https://m.cnyes.com/news/id/6120554
689,6120583,大研生醫暫訂承銷價158元 8/25啟動上市前競拍  9/9上市IPO,大研生醫 (7780-TW) 預計在 9 月 9 日上市掛牌交易，上市前釋股作業 日程上 ，於 8 月 25 日展開上市前競拍投標，競拍張數為 1 萬 5120 張，最低投標價格每股為 147.66 元，暫定承銷價為 158 元。,https://m.cnyes.com/news/id/6120583
690,6120465,川普關稅下為何美國通膨還未狂飆？經濟學家曝4大主要原因,,https://m.cnyes.com/news/id/6120465
691,6120552,台股強彈外資反手調節101億 三大法人賣超61.03億元,,https://m.cnyes.com/news/id/6120552
692,6120338,車市迎利多！汰舊換新加碼納入新車 汽機車貨物稅減徵延至2030年最高可省10萬,立法院財政委員會今 (21) 日完成《貨物稅條例》第 12 條之 5 修正草案的協商，朝野立委達成共識，決定將汽機車汰舊換新減徵貨物稅的優惠措施延長至民國 119 年（2030 年）12 月 31 日止，並首次將「新購車輛」納入減徵範圍。此舉不,https://m.cnyes.com/news/id/6120338
693,6120535,和康生啟動轉型擴大OBM比重 目標2030年提升至80%,和康生 (1783-TW) 總經理陳敬亭今 (21) 日指出，和康生持續擴大 OBM(自有品牌) 業務比重，以提高整體毛利率及品牌價值，目前 OBM 約占 60%，OEM(客戶代工) 則占 40%，目標在 2030 年前將 OBM 比重提升至 80%。,https://m.cnyes.com/news/id/6120535
694,6120436,橡樹資本：美股處於泡沫「初期階段」宜增強防禦性投資,橡樹資本管理公司 (Oaktree Capital Management LP) 共同創辧人 Howard Marks 警告，美國股市目前正處於泡沫的「初期階段」。,https://m.cnyes.com/news/id/6120436
695,6120506,軍公教確定明年不加薪 行政院：考量3大不利因素 財政壓力沉重需審慎評估,行政院長卓榮泰於今（21）日正式公布 115 年度中央政府總預算案，行政院指出今年經濟成長率比去年趨緩，加上新版財劃法、對等關稅影響企業、普發現金等三大因素影響，外界高度關注的「軍公教加薪 3%」方案最終未被納入。卓榮泰表示，,https://m.cnyes.com/news/id/6120506
696,6120435,LV全球首家美妝店在中國南京開業 一支口紅賣逾5100比愛馬仕都瘋,,https://m.cnyes.com/news/id/6120435
697,6120246,AI前景受質疑 百度估值跌至中國網路股最低,,https://m.cnyes.com/news/id/6120246
698,6120462,20年期日債殖利率飆升至1999年以來新高 外資需求減弱,日本政府債券殖利率近期大幅攀升，周四 (21 日) 達到數十年來的新高點，這主要受財政擴張的持續擔憂和主要投資者需求減弱的影響。,https://m.cnyes.com/news/id/6120462
699,6119905,藏了10年曝光！北韓在中國邊境附近 建造秘密飛彈基地,,https://m.cnyes.com/news/id/6119905
700,6120461,8月21日熱門股TOP10揭曉！台股電子股續弱，AI與PCB族群在關稅與輝達效應下的抗壓挑戰,,https://m.cnyes.com/news/id/6120461
701,6120457,〈台股盤後〉神山再奮起配合智慧眼鏡族群強攻 收漲336點站上5日線,台股今日仍處於歷史高檔震盪整理，台積電 (2330-TW) 股價再奮起，收盤上漲 15 元或 1.32%，加上 PCB 族群及智慧眼鏡相關個股助攻，大盤收盤上漲 336.69 點，站上 5 日線，大盤指數以 23962.13 點收盤。,https://m.cnyes.com/news/id/6120457
702,6120458,2025工業展熱鬧開場，大盤卻「跌跌不休」破月線！PCB漲多修正，主流族群「誰來Carry」成迷因話題,,https://m.cnyes.com/news/id/6120458
703,6120347,〈2025自動化展〉達明自製機器人TM Xplore I 力拚2026年下半年逐步量產,廣達 (2382-TW) 旗下的達明 (4585-TW) 機器人公司今 (21) 日舉行上市前媒體茶敘，達明董事長何世池表示，不少客戶對公司展出的 TM Xplore I 人形機器人產品有興趣，已規劃 2026 年自家工廠內部操作及生產。,https://m.cnyes.com/news/id/6120347
704,6120388,知名大空頭貝瑞大膽轉為看多 專家分析其策略調整,華爾街知名空頭、《大賣空》一書與電影原型貝瑞 (Michael Burry) 的投資策略，在上一季出現了顯著轉變，似乎已從看跌轉向看好股市的走向。,https://m.cnyes.com/news/id/6120388
705,6120437,聯準會9月降息預期升溫！Fed點陣圖、FOMC會議重點一次學會，市場動向輕鬆解析,,https://m.cnyes.com/news/id/6120437
706,6120432,宏碁旗下安圖斯科技推出全新AI伺服器 瞄準企業AI應用,宏碁 (2357-TW) 旗​下安​圖斯科技今 (21)​日宣布推出​最新一代 A​I 伺服器 A​ltos BrainSphere™ R680 F7，將於 8 月底正式上市，專為 AI 推論、AI 模型優化、資料分析、視覺運算、工業 AI 與虛,https://m.cnyes.com/news/id/6120432
707,6120431,OTC吞噬！台股大逆襲！ AI、BBU、IC三箭齊發！  海景第一排 還有誰？,,https://m.cnyes.com/news/id/6120431
708,6120423,群聯傳Windows更新致SSD出包 公司：文件純屬偽造,群聯 (8299-TW) 近期傳出因微軟 (MSFT-US) 的 Windows 11 更新，導致搭載其控制晶片的 SSD 運作異常，更有文件顯示群聯承認相關錯誤，公司今 (21) 日，該文件屬偽造文件，公司已啟動法律處理程序，強調公司正積,https://m.cnyes.com/news/id/6120423
709,6120430,為什麼大多數人看得到行情，卻賺不到？,,https://m.cnyes.com/news/id/6120430
710,6120381,英特爾第6代Xeon處理器 導入AWS EC2,英特爾 (INTC-US) 今 (21) 日宣布，搭載效能核心 (P-core) 的 Intel Xeon 6 處理器現已在 AWS 雲端上運行，用於 Amazon EC2 R8i 和 R8I-flex 執行個體，在雲端環境中同級的英特爾處理器中，,https://m.cnyes.com/news/id/6120381
711,6119629,滬指直指3800再創十年新高！高盛交易台：做多中國 精彩不止於此,,https://m.cnyes.com/news/id/6119629
712,6120389,〈焦點股〉中國整頓石化產能 台化漲停領台塑三寶齊揚,塑化族群受惠在中國計畫對石化產業實施調控政策，市場認為此舉有望改善產業結構，減少產業價格競爭，相關塑化股今聞訊量價齊揚，台化 (2330-TW) 開高走高，盤中點燈鎖漲停，領集團台塑化 (6505-TW) 一度漲 9%。,https://m.cnyes.com/news/id/6120389
713,6120427,《價值型投資 最新產業研究報告》嘉澤（3533-TW）AI伺服器升級關鍵供應商　高速連接模組引爆成長動能,,https://m.cnyes.com/news/id/6120427
714,6120372,高盛：穩定幣有望迎來數兆美元增長 瑞銀質疑對美債的影響力,高盛在近期的研究報告大膽預測，穩定幣領域即將迎來估值達數兆美元的爆炸性增長，目前是潛在的「穩定幣淘金熱」的開啟。,https://m.cnyes.com/news/id/6120372
715,6120348,強化國際競爭力 政院拍板企業併購法修正草案 目標5年內成立15家產業控股,為協助企業於關鍵轉型期突破成長瓶頸、提升營運效率，透過整合成立產業控股公司，藉由控股架構整合人力、財務、製造、技術及品牌，分攤風險與成本，提升企業議價與國際應變能力，行政院於今 (21) 日通過經濟部、國發會、財政部共同擬具,https://m.cnyes.com/news/id/6120348
716,6120337,〈2025自動化展〉富采跨域自動化機器人應用 攜手凌華展出Mini LED/Micro LED人機介面,富采 (3714-TW) 今年首度與生態系夥伴凌華 (6166-TW) 聯手參加「台灣機器人與智慧自動化展」，展現進軍機器人自動化與次世代應用的能力。本次展出亮點包括 Mini LED/Micro LED 人機介面顯示器與自動化感測,https://m.cnyes.com/news/id/6120337
717,6120333,裕山：全面檢視內部管控機制 全力配合查核防止弊端,裕山今日指出，公司於 2020-2022 年承攬「屏東縣政府加強農業廢棄物露天燃燒稽查管制及紙錢減量焚燒處理計畫」，案件爲鼓勵農民配合政府政策並提供農民補助款，裕山當時執行稽查作業時疏失，裕山已提供相關資料，全力配合調查。,https://m.cnyes.com/news/id/6120333
718,6119625,現代期貨市場之父痛批川普「謊言治國」 美國領導地位恐讓給中國,,https://m.cnyes.com/news/id/6119625
719,6120282,〈焦點股〉台灣打造AI機器人供應鏈中心 工具機廠卡位商機獲買盤點火,2025 台灣機器人與智慧自動化展昨 (20) 日起一連四天登場，行政院長卓榮泰宣示將祭出千億元級投資，打造台灣成為全球 AI 機器人供應鏈中心。機器人概念股今 (21) 日群起反彈，其中工具機族群方面,https://m.cnyes.com/news/id/6120282
720,6118531,小型股逆襲良機 羅素2000終於有望超越標普,《MarketWatch》報導，隨著小型股與大型股的估值差距擴大，市場正關注羅素 2000 指數 (RUT-US) 是否有望迎來資金回流，甚至挑戰標普 500 指數 (SPX-US) 的長期優勢。,https://m.cnyes.com/news/id/6118531
721,6120331,俄羅斯外長：只會同意俄方擁有否決權的烏克蘭保障方案,俄羅斯外交部長拉夫羅夫周三（20 日）表示，俄羅斯支持向烏克蘭提供可靠的安全保障，但他同時警告，在沒有俄方參與的情況下討論這個問題沒有出路。,https://m.cnyes.com/news/id/6120331
722,6120269,〈房產〉新北市預售市場買氣急凍 板橋這重劃區交易量年減近9成,房仲業者統計 2025 上半年新北市各個重劃區，對比去年同期，預售屋交易量的變化。板橋江翠北側重劃區今年上半年預售屋交易僅 48 件，相較去年同期 389 件，減幅達 87.7%，居新北重劃區之首。,https://m.cnyes.com/news/id/6120269
723,6119612,英特爾翻身希望？軟銀入股或成轉機 股價上看40美元,一些分析師認為，軟銀 (SoftBank Group) 對英特爾 (Intel)(INTC-US) 投資 20 億美元，可能成為這家陷入困境的晶片製造商翻身的關鍵催化劑。,https://m.cnyes.com/news/id/6119612
724,6119939,棄長投短！債券ETF受益人周減138人 短債增近千人最受青睞,根據集保中心最新公布的債券 ETF 受益人數統計，近一周債券 ETF(不含槓反型與主動型) 受益人數減少 138 人，總人數來到 188 萬 5960 人，其中以長天期債 ETF 減少 1169 人最多,https://m.cnyes.com/news/id/6119939
725,6119906,彭博：台灣勞動基金要求 排除在香港註冊實體管理資金,,https://m.cnyes.com/news/id/6119906
726,6119859,大長老引退 波克夏難熬今夏 巴菲特能否再助推一掌？,股神巴菲特並不習慣落後於市場。這位億萬富翁麾下的波克夏（Berkshire Hathaway）投資集團在過去五年中穩定超越標普 500 指數，1965 年投資在波克夏的每 100 美元價值如今已達 390 萬美元。,https://m.cnyes.com/news/id/6119859
727,6120233,印度頂著美國壓力 決定繼續採購俄羅斯石油,據俄羅斯《消息報》周四（21 日）報導，印度已經就俄羅斯能源問題做出最終決定，印度駐俄羅斯大使庫馬爾表示，儘管面臨美國的壓力，新德里仍會繼續採購俄羅斯石油。,https://m.cnyes.com/news/id/6120233
728,6119632,京東方被三星告了！美國ITC初裁侵權 恐面臨失去關鍵市場,,https://m.cnyes.com/news/id/6119632
729,6119894,山林水上半年EPS達1.51元年增5成 大力搶攻水資源市場,環工業者山林水 (8473-TW)）受惠於水處理及工程承攬業務推升，上半年營收年增 50%；稅後純益 3.14 億元，每股純益達 1.51 元，較去年同期成長 54%。董事長郭又綺表示，山林水已連續兩年維持獲利，並重回正成長軌道。,https://m.cnyes.com/news/id/6119894
730,6119884,〈焦點股〉宏達電AI眼鏡題材狂熱 5天狂飆4根漲停板站上60元,VR 軟硬體整合商宏達電 (2498-TW) 自 14 日發布全新 AI 智慧眼鏡「VIVE EAGLE」後，引爆市場話題性，近期股價不斷狂飆，今 (21) 日早盤攻上漲停價 60 元，成交量逾 8 萬張，委買張數逾 2 萬張，自 14 日以來股價已飆漲,https://m.cnyes.com/news/id/6119884
731,6119892,【台股操盤人筆記】AI趨勢明確但短線留意回檔風險,,https://m.cnyes.com/news/id/6119892
732,6119771,振大環球9月上旬含息上市  8/25-27競拍底價178元,振大環球 8/25-27 上市前競拍 底價 178 元,https://m.cnyes.com/news/id/6119771
733,6119624,越南股市飆漲60%創新高 狂歡背後卻隱憂重重,,https://m.cnyes.com/news/id/6119624
734,6119833,華航攻北美轉機市場 與西南航空聯程機票開賣,華航攻北美轉機市場 與西南航空聯程機票開賣,https://m.cnyes.com/news/id/6119833
735,6119849,台股大跌股民瘋搶便宜！00878單日爆量13萬張 居高股息ETF第一,台股創新高後昨 (20) 日重挫 728 點，創下台股史上單日第十大收盤跌點，跌幅達 2.99%，成交量飆 5459.63 億元，市場法人指出，「價跌量增」屬於價量背離的型態，在多頭走勢中代表空方進場，形成強烈賣壓,https://m.cnyes.com/news/id/6119849
736,6119839,〈房產〉受限台灣央行限貸發威 住展：輝達利多跨不出北士科,國際科技大廠輝達在 5 月宣布進駐台北市北投士林科技園區，被視作房市冷氣團下一大暖流，除了北士科本身的區域房市外，包括北投區、士林區，以及新北市的三重區、淡水區也寄望因為地緣性而有所帶動。,https://m.cnyes.com/news/id/6119839
737,6119626,中國六部會聯手整頓太陽能業 嚴打內捲、加強調控,,https://m.cnyes.com/news/id/6119626
738,6119619,28兆美元美債市場正釋放潛在警訊,《MarketWatch》報導，美國 28 兆美元國債市場正釋放潛在警訊，殖利率曲線近期明顯趨陡，反映投資人一方面預期聯準會 9 月可能降息，另一方面擔憂長期通膨與財政赤字風險升溫。,https://m.cnyes.com/news/id/6119619
739,6039085,〈焦點股〉東元進軍無人機市場成長可期 爆量衝漲停,東元 (1504-TW) 總經理高飛鳶指出，由於國際間對於無人機「非紅」供應鏈的需求，東元藉由其技術優勢，在無人機領域發展較快，伺機搶進無人機領域，且已有客戶洽談中，後市成長可期，激勵東元今 (21) 日爆量衝漲停。 ,https://m.cnyes.com/news/id/6039085
740,6119794,〈焦點股〉華通高檔拉回仍獲外資加碼補血 挺股價出量走高,PCB 廠華通 (2313-TW) 對業務加速在地區及產品上加速擴張，除在泰國的第一座工廠 100% 供給低軌衛星 (LEO) 市場，且目前進入蘋果旗艦手機旺季，同時，除了打入目前小米推出的 AI 眼鏡供應鏈，外資買超。,https://m.cnyes.com/news/id/6119794
741,6119768,喊盼匯率維持31？經濟部發逐字稿澄清 郭智輝僅反映業者對匯率期待,有關媒體報導「郭部長希望新台幣匯價維持 31 元」，經濟部於今 (21) 日嚴正澄清，部長郭智輝昨 (20) 日於立法院答詢時已明確向委員說明不能操縱匯率。有關匯率數字的討論，係郭智輝向委員說明過去六年新台幣兌美元平均水準約為 31 元,https://m.cnyes.com/news/id/6119768
742,6119758,光隆精密-KY北美接單展開 樂看營運將顯著成長,光隆精密 - KY 北美接單展開 樂看營運將顯著成長,https://m.cnyes.com/news/id/6119758
743,6119631,港交所考慮推行24小時交易機制 分析師：券商股將受益,,https://m.cnyes.com/news/id/6119631
744,6119784,大盤指數急探底，進場甜甜價浮現，多方控盤不變!,,https://m.cnyes.com/news/id/6119784
745,6119807,鉅亨速報 - Factset 最新調查：豐田汽車(TM-US)EPS預估下修至16.78元，預估目標價為216.93元,FactSet 最新調查：豐田汽車(TM-US)EPS預估下修，預估EPS、預估營收、目標價、歷史獲利表現、即時新聞資訊,https://m.cnyes.com/news/id/6119807
746,6119786,鉅亨速報 - Factset 最新調查：家得寶HD-US的目標價調升至450元，幅度約4.17%,FactSet 最新調查：家得寶HD-US目標價調升，最高估值、最低估值、中位數、綜合評級、近5日股價、標普、即時新聞資訊,https://m.cnyes.com/news/id/6119786
747,6119763,友霖藥證布局全球12國 28元掛牌上櫃首日維持小漲,友霖 (4166-TW) 今 (21) 日以承銷價 28 元正式掛牌上櫃交易，友霖聚焦 505(b)(2)新藥與利基型學名藥開發，透過核心技術平台深化研發策略，目前已將營運觸角擴及全球 12 個國家，並取得超過 50 張藥證。 ,https://m.cnyes.com/news/id/6119763
748,6119611,Fed若在傑克森霍爾放鷹 這些類股首當其衝,巴克萊銀行 (Barclays) 分析指出，如果聯準會 (Fed) 在傑克森霍爾 (Jackson Hole) 央行年度會議上採取鷹派立場，小型股與房屋建商將面臨最大風險。,https://m.cnyes.com/news/id/6119611
749,6119603,輝達下調歐洲RTX 50系列部分售價近10%,輝達近期調降歐洲市場部分 RTX 50 系列 Founders Edition 顯示卡的建議售價 (MSRP),https://m.cnyes.com/news/id/6119603
750,6119732,〈台股開盤〉台積電回穩 AI、塑化族群點火 反彈逾350點拚收復2萬4,〈台股開盤〉台積電回穩 AI、塑化族群點火 反彈逾 350 點拚收復 2 萬 4 失土。,https://m.cnyes.com/news/id/6119732
751,6119545,國際金價回落至三周低點 但黃金股淨利集體暴漲 誰在主導市場？,,https://m.cnyes.com/news/id/6119545
752,6106143,告別選擇困難！這檔ETF聚焦世界級龍頭成長股 專家把關，主動贏擊!,,https://m.cnyes.com/news/id/6106143
753,6119573,安盛生現增銀彈到位 H2優於H1全年轉盈目標不變,安盛生現金增資案順利完成，以每股 6 元折價發行新股 1 萬張，總計募集 6000 萬元資金全數到位。安盛生指出，下半年進入傳統旺季，在既有產品需求暢旺，加上 OMO 商業模式可望展現初步效益，預期下半年營運將優於上半年，轉盈目標不變。,https://m.cnyes.com/news/id/6119573
754,6119634,馬斯克被曝擱置「建黨計畫」本人回應：假新聞！,《華爾街日報》披露，全球首富馬斯克悄然暫停啟動新黨「美國黨」（The America Party）的計畫，馬斯克對此回應道：「永遠不要認為《華爾街日報》說的任何話是真實的。」,https://m.cnyes.com/news/id/6119634
755,6119628,〈晶技展望〉全年營收維持3-5%成長 下半年營收估仍將優於上半年,全球頻率元件龍頭廠晶技 (3042-TW) 提出最新營運展望，執行長林萬興對全年營收表示仍將成長，且第三季營收將較上季再小幅成長同時，但全年的上、下年營收比重將維持於 49%：51%。,https://m.cnyes.com/news/id/6119628
756,6119623,〈晶技展望〉車用市場需求強大 達成營收占比3成目標將大幅提前,晶技執行長林萬興對全年營收表示仍將成長同時，同時晶技頻率元件在 AI 及汽車應用仍在營運版圖仍有大幅度的擴張，在汽車應用在陸續打入全球 Tier 1 構裝廠，預估汽車應用達成營收比重 30% 的目標將提前在明、後年達成。,https://m.cnyes.com/news/id/6119623
757,6119627,美國副總統：烏克蘭安全保障主要應由歐洲承擔,美國副總統范斯在接受《Fox News》周三（20 日）採訪時表示，歐洲國家必須承擔烏克蘭安全保障的主要責任。,https://m.cnyes.com/news/id/6119627
758,6119572,今年僅漲2%！加拿大皇家銀行：美小型股動力嚴重不足 IPO熱潮或有助受市場青睞,,https://m.cnyes.com/news/id/6119572
759,6119617,赫茲計劃在亞馬遜上賣車 股價大漲6% 線上二手車商Carvana股價下滑,汽車租賃公司赫茲 (Hertz Global)(HTZ-US) 周三股價大漲近 6%，係因該公司宣布計劃在亞馬遜 (AMZN-US) 上銷售汽車。,https://m.cnyes.com/news/id/6119617
760,6119597,〈台股盤前要聞〉股匯雙殺 外資狂賣台積電、上海南僑7月首虧、旺矽MEMS探針卡急擴產,台股盤前要聞,https://m.cnyes.com/news/id/6119597
761,6119622,韓國政府考慮引入「快樂星期一」 形成三天小長假,為刺激消費、提振經濟，韓國政府正在探討效仿美國、日本推行「長周末」制度，即將部分固定日期的法定節假日調整至周一，形成三天小長假。,https://m.cnyes.com/news/id/6119622
762,6119604,美科技股拋售潮 凸顯AI交易脆弱性,LSEG Datastream 數據顯示，科技板塊 12 個月預估本益比已達 30 倍，創近一年新高，科技股市值占標普 500 總市值比重接近 2000 年網路泡沫高峰。,https://m.cnyes.com/news/id/6119604
763,6119621,川普將簽行政令 限制焚燒美國國旗,《NewsNation》報導，美國總統川普計劃於週四 (21 日) 簽署一項行政命令，針對焚燒美國國旗的相關行為加強管制，並尋求在現行法律框架下的刑事追訴途徑。,https://m.cnyes.com/news/id/6119621
764,6119561,馬斯克：特斯拉六人座版Model Y 可能永遠不會在美國上市,美國電動車大廠特斯拉（Tesla）執行長馬斯克周三（20 日）表示，旗下全新六人座版 Model Y（Model Y L）可能永遠不會在美國上市。,https://m.cnyes.com/news/id/6119561
765,6119620,台股暴跌728點 慣性改變 波段起跌開始？,,https://m.cnyes.com/news/id/6119620
766,6119609,美股重點新聞摘要2025年8月21日,美股重點新聞摘要 2025 年 8 月 21 日,https://m.cnyes.com/news/id/6119609
767,6108482,【Joe’s華爾街脈動】股市強勢遇新挑戰，政策逆風來襲,,https://m.cnyes.com/news/id/6108482
768,6119602,高盛：Skechers、特斯拉、DoorDash成避險基金新寵,高盛公布最新對沖基金「VIP 股票清單」 Skechers、特斯拉、DoorDash 躍居新寵。,https://m.cnyes.com/news/id/6119602
769,6119618,AI概念股Palantir慘烈一周 空軍爽賺數十億美元,《彭博》報導，AI 概念股 Palantir (PLTR-US) 近一週遭遇重挫，股價連續六個交易日下跌，市值蒸發約 730 億美元，為今年來一度在這檔熱門科技股上遭受重創的空頭帶來難得的喘息機會。,https://m.cnyes.com/news/id/6119618
770,6119551,全球第五家市值逾1000億美元獨角獸公司即將誕生！市場急問：何時IPO？,AI 數據分析平台 Databricks 周二 (20 日) 宣布已簽署 K 輪融資條款，預計將在現有投資者的支持下完成這一輪融資，公司估值已超過 1000 億美元，使其躋身全球未上市初創「獨角獸」的特定「俱樂部」。,https://m.cnyes.com/news/id/6119551
771,6119613,特斯拉投資人應關注的三大嚴重問題,對特斯拉 (Tesla)(TSLA-US) 的投資人來說，2025 年的道路並不平坦。這家電動汽車製造商正感受到來自各方面的壓力：媒體、消費者、分析師，應有盡有。,https://m.cnyes.com/news/id/6119613
772,6119605,KeyBanc：中國不確定性升高 輝達財測恐低於市場預期,KeyBanc Capital Markets 在最新報告中警告，雖然輝達下週公布的財報仍將強勁，但由於中國市場的不確定性，公司對財測可能低於華爾街共識預期。,https://m.cnyes.com/news/id/6119605
773,6119552,這兩國是幕後黑手！中概股爆7檔「殺豬盤」 社媒成幫兇,英國《金融時報》報導指出，七家在納斯達克上市的小型中概股在 7 月經歷了劇烈的股價波動，給投資者造成了數十億美元的損失。這些股票在社群媒體上受到大力宣傳後不久便出現暴跌，明顯呈現出「殺豬盤」的特徵，甚至引起 FBI 的關注。,https://m.cnyes.com/news/id/6119552
774,6119614,昔日晶片霸主 落後台積電兩代 英特爾如何陷入20年衰退,英特爾 (Intel)(INTC-US) 這幾天占據新聞版面，從執行長曾被川普要求下台，到美國政府有意入股，股價大起大落，回首 20 年前，這家公司曾是全球最大、最先進的電腦晶片製造商，又是如何失去優勢、陷入衰退？,https://m.cnyes.com/news/id/6119614
