,newsId,title,summary,link
756,6196746,「恐慌指數」飆升！美股平靜期結束了？,在貿易戰、區域銀行風險及 AI 投資質疑下，美股近期波動加劇，恐慌指數 VIX 飆升至半年高位。投資資金明顯轉向防禦性板塊，高風險資產承壓，華爾街對市場健康修正與潛在風險分歧加大。,https://m.cnyes.com/news/id/6196746
757,6196716,中國官員試圖緩解全球對稀土限制的擔憂：不會損害正常的貿易往來,中國近期升級稀土出口管控，引發歐洲、日本及美國對全球供應鏈穩定性的擔憂。中國官員在華盛頓表示措施非出口禁令，強調建立長期機制並回應美國貿易挑釁。,https://m.cnyes.com/news/id/6196716
758,6195960,AI黃金週期進行式，從算力戰到能源戰的產業新格局： 台積電、雙鴻、華城、中興電,,https://m.cnyes.com/news/id/6195960
759,6196700,美國2026年賈伯斯紀念幣揭曉！創新精神登上硬幣,美國鑄幣局公布 2026 年美國創新 1 美元硬幣設計，加州硬幣向蘋果創始人賈伯斯致敬。這枚紀念幣展現賈伯斯的創新精神與科技成就，並將於明年發售。,https://m.cnyes.com/news/id/6196700
760,6196687,富國債務高企使通膨成為解決手段！經濟學人：財富將「任意重組」,全球富裕國家面臨公共債務攀升與不可持續財政政策，《經濟學人》警示，若政府無法有效應對，高額債務與國債壓力可能引發通膨浪潮，重塑財富分配並威脅中產階級與社會穩定。,https://m.cnyes.com/news/id/6196687
761,6196682,蘋果摺疊iPhone上市或延期至2027年！鉸鏈與螢幕設計成大挑戰,蘋果首款摺疊 iPhone 可能因鉸鏈與螢幕設計複雜度而 上市延期至 2027 年。面板產量下降與技術挑戰凸顯蘋果追求耐用性與產品完整性策略。,https://m.cnyes.com/news/id/6196682
762,6196679,美英打擊柬埔寨詐騙！泰國與新加坡也展開跨國調查,因詐騙與洗錢指控，太子集團董事長陳志遭美國與英國制裁，泰國與新加坡當局正對該柬埔寨房地產集團展開調查，追查資產並檢視金融往來。,https://m.cnyes.com/news/id/6196679
763,6196665,Meta可能使用你手機的影像訓練AI！Facebook新照片拼貼功能引隱私擔憂,Meta 在 Facebook 推出全新 AI 照片拼貼與編輯工具，使用者可從手機相簿生成趣味照片作品。分享內容將用於 AI 訓練，了解如何保護隱私與管理相簿設定。,https://m.cnyes.com/news/id/6196665
764,6196666,川普將「考慮」俄羅斯白令海峽海底隧道提議！馬斯克The Boring Company或承建,美國總統川普對俄羅斯提出的白令海峽海底隧道計畫表興趣，該隧道由馬斯克與 The Boring Company 可能承建。普丁投資特使稱隧道象徵團結，建造成本可大幅降低。,https://m.cnyes.com/news/id/6196666
765,6196661,中國已超越美國！諾貝爾經濟獎得主：川普政策或讓美永遠無法追上,諾貝爾經濟獎得主克魯格曼指出，中國經濟與科技實力已超越美國，川普政府削減科研與可再生能源支持，恐讓美國永遠落後中國，影響全球領導地位。,https://m.cnyes.com/news/id/6196661
766,6196658,歐盟擬強制中國企業技術轉讓！中方三個「反對」明確表態,歐盟計畫要求中國企業在歐洲進行技術轉讓，中方以三個「反對」回應，專家指出此舉具有針對性，可能影響中歐經貿合作與未來市場布局。,https://m.cnyes.com/news/id/6196658
767,6195953,高盛看好鴻海AI潛力　預估EPS三年翻倍、目標價上修至400元,,https://m.cnyes.com/news/id/6195953
768,6196656,蘋果Apple Intelligence將進入中國市場？庫克這樣回應,蘋果執行長庫克在上海論壇透露，蘋果正將 Apple Intelligence 推向中國市場。他指出 AI 已深度融入蘋果營運，從工廠到銷售培訓無所不在，並強調 AI 在健康、教育及創新產品中的重要性。,https://m.cnyes.com/news/id/6196656
769,6196637,中國稀土出口管制衝擊美國供應鏈！美稀土公司CEO：電動車與軍事產業首當其衝,隨著中國對稀土出口實施的新管制措施，美國稀土公司表示，他們最擔心的情況是中國可能會將鈰、鑭、釹、鏷等「大宗稀土」的價格壓至極低，同時完全切斷對鏑、鋱等「稀有稀土」的出口。,https://m.cnyes.com/news/id/6196637
770,6196503,美區域銀行踩雷 10年期美債開啟新一波漲勢,,https://m.cnyes.com/news/id/6196503
771,6196611,GPT-6要來了？OpenAI投資人爆料：年底發布、將「階躍式改進」,OpenAI 投資人 Brad Gerstner 透露 GPT-6 將在今年年底前發布，標誌 AI 技術再度提升。網友熱烈討論新一代 AI 模型的功能與影響，OpenAI 生態系統投資前景備受關注。,https://m.cnyes.com/news/id/6196611
772,6196634,中國強化出口管制 9月稀土產品出口轉跌,,https://m.cnyes.com/news/id/6196634
773,6196635,黃金大漲穩定幣「功不可沒」！金價仍具上行空間,今年黃金價格持續刷新歷史新高，市場對黃金穩定幣擴容抱有高度預期。穩定幣需求與央行購金雙重推動，成為投資者看好金價的重要因素。,https://m.cnyes.com/news/id/6196635
774,6196608,俄羅斯外長：俄方不會與美國或任何人聯手對抗中國,俄羅斯外交部長拉夫羅夫強調，俄方不會與美國聯手向中國施壓，並重申俄中合作關係與核裁軍立場。中國核力量維持國家安全最低水準，堅持自衛防禦政策，核彈政策對世界和平至關重要。,https://m.cnyes.com/news/id/6196608
775,6196624,美光退出中國伺服器晶片業務 轉攻其他市場抵銷損失,美光科技 (Micron)(MU-US) 計劃停止向中國境內資料中心供應伺服器晶片，此舉標誌著該公司在 2023 年遭北京禁止產品用於中國關鍵基礎設施後，其在中國相關業務復甦失利。,https://m.cnyes.com/news/id/6196624
776,6196618,今年來大漲80%！三星家族趁高賣股變現 分析師：散戶信心恐受衝擊,,https://m.cnyes.com/news/id/6196618
777,6196620,輝達中國市場降至零！黃仁勳：美國失去中國市場是個錯誤,輝達執行長黃仁勳指出，公司在中國 AI 市場的晶片銷售已降至零，強調美國在全球 AI 市場必須平衡技術領先與人才吸引，並呼籲政策制定者謹慎行動。,https://m.cnyes.com/news/id/6196620
778,6196499,美政府已關門17天！分析師：恐一路拖到感恩節創史上最久,,https://m.cnyes.com/news/id/6196499
779,6196129,〈熱門股〉強茂獲轉單加持 周漲16%創波段新高,功率半導體大廠安世半導體 (Nexperia) 被荷蘭政府接管後，面臨出口限制令，造成供應鏈大亂，客戶急尋替代方案，由於強茂 (2481-TW) 產品線與安世相近，也接獲轉單，推升股價本周一度達 92.4 元，創下三年半新高，終場收,https://m.cnyes.com/news/id/6196129
780,6196621,川普推「最惠國藥價」策略 強壓GLP-1降價至150美元 製藥巨頭重挫,美總統川普擬將熱門減重藥 GLP-1 類藥品價格破盤降至每月 150 美元，引發醫藥產業震盪。Eli Lilly 與 Novo Nordisk 應聲下挫，市場關注美國「最惠國藥價」政策是否重塑全球減重藥市場格局。,https://m.cnyes.com/news/id/6196621
781,6196571,買賣未上市股別亂「稅」！國稅局教你如何報稅不踩雷 弄錯還能這樣補救,您是否曾私下買賣過未上市櫃的股票，卻對證券交易稅（簡稱證交稅）的報繳程序感到困惑？財政部北區國稅局特別提醒民眾，私人間的未上市股票交易，稅務規定和透過券商買賣大不相同。掌握正確的「眉角」，才能避免資料錯誤或溢繳，保障自身,https://m.cnyes.com/news/id/6196571
782,6196607,美國不支持烏克蘭了？川普白宮會澤倫斯基拒談戰斧飛彈援助、呼籲烏俄立即停火,烏克蘭總統澤倫斯基赴美尋求「戰斧」飛彈支援，卻遭美國總統川普冷淡回應。川普強調希望烏克蘭與俄羅斯立即停火，並預告將與普丁會晤，引發外界對美方援烏政策及俄美關係的關注。,https://m.cnyes.com/news/id/6196607
783,6196487,黃金明年漲至每盎司5000美元？分析師這樣看,"滙豐銀行 (HSBC) 分析師上調了對黃金價格的預測，預期該貴金屬明年將升至每盎司 5,000 美元，主因是全球不確定性升高。",https://m.cnyes.com/news/id/6196487
784,6196602,荷中晶片對峙升溫！安世中國員工被斷薪 荷蘭否認受美施壓 有意談判,荷蘭政府與中國在半導體領域的對抗持續升溫。隨著荷蘭接管中資晶片商 Nexperia 並解職中國籍執行長，中方祭出出口禁令，導致全球車用晶片供應告急。安世中國隨後宣布停薪，供應鏈危機一觸即發。,https://m.cnyes.com/news/id/6196602
785,6196373,台積電法說、南亞科法說、GDP有望上調 本周大事回顧,台積電周四 (16 日) 召開法說會，第三季獲利創高，並二度上調全年展望；南亞科周一 (13 日) 召開法說會，總經理李培瑛表示，DDR4 缺口還有點大；主計總處主計長陳淑姿表示，下半年經濟成長表現優於預期，GDP 有望超過 4.5%。,https://m.cnyes.com/news/id/6196373
786,6196509,〈熱門股〉高力散熱與燃料電池雙箭頭強勁 獲外資力挺股價創新高,高力在 AI 伺服器散熱系統與燃料電池反應盒需求大增，且已反應的業績上的實質推升數字，本周獲三大法人買盤的大力買超 7194 張，本周股價表現亮麗並以 554 元創新高，外資持股高達 30.8%，17 日收盤價報 543 元。,https://m.cnyes.com/news/id/6196509
787,6196115,台股ETF 10月除息秀進入高峰 2檔高配息+高含積「黑馬」單位數猛增,台積電法說報佳音，台股吃下定心丸，下周將有 18 檔台股 ETF 密集展開除息，根據 CMoney 統計，當中單位數成長最多的 ETF 有 2 檔,https://m.cnyes.com/news/id/6196115
788,6196517,法國債信遭突襲式降評 標普：財政不確定性仍高,,https://m.cnyes.com/news/id/6196517
789,6196361,〈熱門股〉Google AI模型研究成果點名生華科新藥 周漲逾1成,生華科旗下開發中新藥 Silmitasertib(CX-4945)，近日被 Google 在官方部落格提及。Google DeepMind 發現 CX-4945 啟動冷腫瘤免疫反應抗癌新契機，激勵生華科本周漲逾 1 成。 ,https://m.cnyes.com/news/id/6196361
790,6193776,【Joe’s華爾街脈動】AI動能確立，台灣半導體供應鏈蓄勢待發,,https://m.cnyes.com/news/id/6193776
791,6196364,〈熱門股〉中航領銜Q4散裝旺季行情 周漲逾16%,〈熱門股〉中航領銜 Q4 散裝旺季行情 周漲逾 16%,https://m.cnyes.com/news/id/6196364
792,6190399,〈熱門股〉宏碁「小虎隊」及AI策略逐漸發酵 吸引外資買盤連三點讚,"PC 品牌宏碁 (2353-TW) 受惠於旗下 AI 伺服器業務與非 PC 事業獲利持續增長，營運前景備受市場看好，在多項利多消息激勵下，17 日股價收 30.65 元，周漲約 4%，周成交量 75812 張，其中外資買超逾 4,000",https://m.cnyes.com/news/id/6190399
793,6196516,川普簽新令 11月起卡車加稅25%、延長汽車生產關稅抵減,,https://m.cnyes.com/news/id/6196516
794,6196529,75%市值來自未收益項目！特斯拉遭法巴喊賣 市場信心卻未動搖,特斯拉股價週五收漲 2.5%，全週勁揚 6.2%，儘管分析師警告其高達兆美元的市值有 75% 來自尚未產生銷售的 AI 業務，但市場熱度不減，讓該股成功擺脫華爾街最新「賣出」評級的影響。,https://m.cnyes.com/news/id/6196529
795,6196018,AI算力戰爭轉捩點！為何微軟坐視Op​​enAI扶持對手甲骨文？專家：賺翻！避開燒錢陷阱,,https://m.cnyes.com/news/id/6196018
796,6196485,美股重點新聞摘要2025年10月18日,美股重點新聞摘要 2025 年 10 月 18 日,https://m.cnyes.com/news/id/6196485
797,6196512,輝達、台積電聯手 首款美國製AI晶圓正式亮相,,https://m.cnyes.com/news/id/6196512
798,6196488,美財長籲IMF、世銀對中國採取更強硬立場,美國財政部長貝森特 (Scott Bessent) 周五 (17 日) 明確要求國際貨幣基金 (IMF) 與世界銀行 (World Bank) 對中國以國家為導向的經濟政策採取更強硬的態度，他正推動這兩家全球主要貸款機構回歸核心使命。,https://m.cnyes.com/news/id/6196488
799,6196505,大利多！波音737 MAX獲准提高產量 盤後漲逾1%,波音公司週五傳來重大利多，聯邦航空管理局已批准將其 737 系列客機的月產量上限從 38 架提高至 42 架。這項決定標誌著波音在修復製造信心與消化積壓訂單上邁出關鍵一步，最快 11 月可達標，消息激勵波音盤後上漲。,https://m.cnyes.com/news/id/6196505
800,6196504,避險需求降溫+軋空緩解 白銀單日一度暴跌6%創半年最大跌幅,國際白銀價格週五自歷史高點急劇回落，盤中跌幅一度觸及 6%，創下近六個月以來最大單日跌幅。這波回調的主要原因是中美貿易和信貸緊張局勢緩和，以及地區銀行業績穩定，導致市場避險需求銳減。,https://m.cnyes.com/news/id/6196504
801,6194935,〈貴金屬盤後〉川普軟化 黃金衝上4300美元後回跌逾2% 本周仍大漲4.8% ,,https://m.cnyes.com/news/id/6194935
802,6196484,〈紐約匯市〉美元周線收黑 投資人仍憂心貿易緊張局勢,美元周五 (17 日) 上漲，惟周線仍跌，主要因貿易緊張情勢未解，以及市場對美國部分地區銀行狀況的擔憂。,https://m.cnyes.com/news/id/6196484
803,6196489,川普稱對中國課徵100%關稅難以持續 證實將會晤習近平,美國總統川普周五 (17 日) 表示，他所提議對中國商品加徵 100% 關稅的措施是不可持續的，但他將貿易談判的最新僵局歸咎於北京，稱中國當局加強稀土出口管制是導火線。,https://m.cnyes.com/news/id/6196489
804,6196379,〈能源盤後〉週五小幅收漲 但IEA過剩預期+全球衝突緩解 本週原油挫近3%,原石油價格週五 (17 日) 收盤時略有上漲，但本週整體仍將面臨近 3% 的跌幅，主要原因是國際能源總署（IEA）預測石油供應將出現過剩，以及全球地緣政治緊張局勢有所緩和。,https://m.cnyes.com/news/id/6196379
805,6196483,〈美股盤後〉三大指數齊揚周線收紅 銀行壞帳擔憂與美中貿易緊張緩解,美國股市周五 (17 日) 收漲，投資人消化美國在與中國貿易談判上語氣轉趨緩和的消息，同時試圖擺脫前一天地區銀行股暴跌所引發的信貸疑慮。,https://m.cnyes.com/news/id/6196483
806,6196472,甲骨文2030年樂觀展望遭質疑 股價創1月來最大跌幅,據《CNBC》周五 (17 日) 報導，甲骨文 (ORCL-US) 股價同日重挫 7%，創下 1 月以來最大單日跌幅，為該公司因 AI 熱潮而持續的漲勢按下暫停鍵。,https://m.cnyes.com/news/id/6196472
807,6196455,連二年反對！代理投票機構籲特斯拉股東否決馬斯克天價薪酬案,據《彭博》周五 (17 日) 報導，代理投票諮詢機構 ISS 建議特斯拉股東否決馬斯克高達 1 兆美元的薪酬計畫，這是 ISS 連續第二年反對馬斯克的薪酬方案。,https://m.cnyes.com/news/id/6196455
808,6196451,為川習會暖場！貝森特今晚與何立峰通話後、下周赴大馬會談,據《彭博》報導，美國財政部長貝森特周五 (17 日) 表示，將於當晚與中國國務院副總理何立峰通話，並預計一周後在馬來西亞舉行面對面會談，為川習會做準備。這將是雙方第五輪談判。,https://m.cnyes.com/news/id/6196451
809,6196443,中美港口費戰升級 港府強調不跟進：維持自由港地位,據《彭博》周五 (17 日) 報導，儘管中美兩國針對彼此船舶開徵特別港口費，香港政府周五明確表示不會跟進。港府強調香港作為單獨關稅區，將維持自由港地位，不會對特定國家船隻徵收特別費用。,https://m.cnyes.com/news/id/6196443
810,6196407,聖路易斯Fed總裁：可能支持再降息 但空間有限,據《彭博》周五 (17 日) 報導，聖路易聯準銀行總裁穆薩勒姆 (Alberto Musalem) 表示，為了支撐放緩的勞動市場，他可能支持再次降息，但強調在經濟不確定性之下，決策官員應逐次會議做出決策。,https://m.cnyes.com/news/id/6196407
811,6196376,WTO總幹事示警：美中若持續脫鉤 全球GDP恐減7%,《路透》周五 (17 日) 報導，世界貿易組織 (WTO) 總幹事伊衛拉 (Ngozi Okonjo-Iweala) 警告，美中兩大經濟體若持續升高貿易衝突或進一步脫鉤，恐在長期內使全球經濟產出減少多達 7%。她呼籲雙方「立即降溫」，並,https://m.cnyes.com/news/id/6196376
812,6196354,川普稱減重藥將大幅降價 諾和諾德、禮來等藥廠股價下挫,綜合外媒周五 報導，美國總統川普表示將降低諾和諾德 (NVO-US) 熱門減重藥 Ozempic 的價格後，引發減重藥廠股價重挫。截稿前，諾和諾德股價跌近 4%，暫報 53.88 美元，禮來 (LLY-US) 也跌超 3%。,https://m.cnyes.com/news/id/6196354
813,6196291,Meta 強化兒童安全 家長可封鎖特定 AI 角色並監督對話內容,Meta 周五 (17 日) 宣布推出新的家長控制功能，讓家長能監督並管理青少年與 AI 角色的互動，甚至可完全關閉一對一聊天。此舉正值聯邦貿易委員會調查 AI 聊天機器人對未成年人潛在危害之際。,https://m.cnyes.com/news/id/6196291
814,6196283,OpenAI造王效應擴散！AI晶片供應鏈全面洗牌,人工智慧 (AI) 龍頭 OpenAI 與超微半導體 (AMD-US) 及博通 (AVGO-US) 達成晶片採購協議，顯示 AI 產業的成長潛力遠超市場預期，也為輝達 (NVDA-US) 長期主導的晶片生態系注入更多競爭。,https://m.cnyes.com/news/id/6196283
815,6196292,政府關門未公布數據 彭博估上周初領失業金降至21.5萬人,由於美國聯邦政府關門，勞工部已近一個月未發布失業救濟數據。根據《彭博》分析各州原始數據顯示，美國上周初領失業救濟金人數降至約 21.5 萬人，顯示裁員情況仍維持低檔。,https://m.cnyes.com/news/id/6196292
816,6196349,美中高層再聯繫！貝森特將與何立峰通話 為川習會前暖身,根據《CNBC》報導，美國財政部長貝森特 (Scott Bessent) 預定於美國時間周五 (17 日) 與中國國務院副總理何立峰進行電話會談，討論美中貿易談判進展。這是近期雙方高層首次正式聯繫，被視為兩國關係在緊張局勢下出現的,https://m.cnyes.com/news/id/6196349
817,6196315,川普經濟施政支持度崩跌！美民調：通膨比關門更傷,根據《CNBC》周五 (17 日) 報導，美國總統川普在經濟議題上的支持度因政府關門與通膨壓力而下滑，最新《CNBC 全美經濟民調》(All-America Economic Survey) 顯示，美國民眾對就業、市場與物價前景的,https://m.cnyes.com/news/id/6196315
818,6196329,鉅亨速報 - Factset 最新調查：甲骨文ORCL-US的目標價調升至364元，幅度約4%,FactSet 最新調查：甲骨文ORCL-US目標價調升，最高估值、最低估值、中位數、綜合評級、近5日股價、標普、即時新聞資訊,https://m.cnyes.com/news/id/6196329
819,6196295,F1要上Apple TV了！蘋果砸重金搶攻體育串流市場,蘋果 (AAPL-US) 周五 (17 日) 宣布與一級方程式賽車 (Formula 1，F1) 簽訂為期五年的媒體權協議，將自 2026 年起在 Apple TV 平台播出所有 F1 賽事，全面進軍頂級運動串流市場。,https://m.cnyes.com/news/id/6196295
820,6196178,〈美股早盤〉主要指數漲跌互現 川普安撫中美貿易緊張,美股主要指數周五 (17 日) 開盤漲跌互現，市場在美國總統川普確認將與中國國家主席習近平會晤後情緒稍獲安撫，緩解近期圍繞中美貿易的緊張情緒。道瓊指數持平，標普 500 小跌，那斯達克走低。先前因信貸疑慮大跌的地區銀行股出現反彈，,https://m.cnyes.com/news/id/6196178
821,6196244,委內瑞拉緊張局勢升溫之際 美國軍方將領霍爾西突宣布年底退役,在美國於加勒比海域對涉嫌「販毒船」進行軍事打擊，以及美國與委內瑞拉緊張局勢不斷升級的背景下，美國國防部長赫格塞思 (Pete Hegseth) 於當地時間周四 (16 日) 在社群媒體上宣布，負責監督美國在拉丁美洲、中美洲和加勒比,https://m.cnyes.com/news/id/6196244
822,6196186,比AI股更猛？金價屢創新高 黃金股狂飆卻還沒追上,《華爾街日報》(WSJ)周五 (17 日) 報導，全球金礦股近期表現強勁，漲幅甚至超越工智慧 (AI) 概念股，但即使金價屢創新高，這些礦業公司股票的估值仍未完全反映實體黃金的火熱行情。,https://m.cnyes.com/news/id/6196186
823,6196243,光復節連假出遊  高公局：首2日為南向尖峰、多利用這些時段避開壅塞,連假 (10 月 24 日 - 26 日) 為今 (2025) 年最後連假，預期有許多觀光計畫出遊或返鄉車潮，交通部高速公路局今 (17) 日提醒，連假國道交通需求大增，尖峰時段容易有壅塞情形。依高公局分析結果，連假首 2 日為南向尖峰日。,https://m.cnyes.com/news/id/6196243
824,6196245,燁輝攜子公司斥10.8億元參與義享樂現增 取得17%股權,燁輝攜子公司斥 10.8 億元參與義享樂現增 取得 17% 股權,https://m.cnyes.com/news/id/6196245
825,6196217,鴻海子公司鴻佰斥11.7億元 擴大台、越產能,鴻海子公司鴻佰斥資 11.7 億元 擴大台灣、越南布局,https://m.cnyes.com/news/id/6196217
826,6196214,港務公司1.6億推動漁光島大月牙灣沙灘設施升級  紓解停車、旅遊品質,「漁光島藝術節」更為海灘注入豐富的文化與創意氣息。台灣港務公司今 (17) 日表示，目前該處車輛停等基建量能及道路服務水準已不足負荷，政府已規劃 1.6 億元推動當地基礎設施升級，改善工程將於明 (2026) 年初完工。,https://m.cnyes.com/news/id/6196214
827,6196230,國產替代需求爆發！「中國輝達」寒武紀第三季營收暴增逾13倍,"據《彭博》周五 (17 日) 報導，中國 AI 晶片商寒武紀 (688256-CN) 第三季營收達到 17.3 億人民幣，較去年同期暴增 14 倍，並從去年同期虧損 1.94 億人民幣轉為獲利 5.67 億人民幣 (約 7,960 萬美元)。",https://m.cnyes.com/news/id/6196230
828,6196138,澳洲掀起搶金熱潮 實體黃金需求暴增 排隊人龍達60公尺,隨著貴金屬價格日復一日創下新高，市場跡象顯示，實體黃金需求已從中央銀行擴散到更廣泛的投資者群體。在英國，皇家鑄幣廠已被實體銀幣的強勁需求所淹沒。而在地球的另一端，澳洲雪梨街頭的搶購景象，更是散發出濃厚的「魏瑪氛圍」。,https://m.cnyes.com/news/id/6196138
829,6196212,AI玩過頭？OpenAI停用金恩博士影片生成引熱議,人工智慧 (AI) 公司 OpenAI 周五 (17 日) 宣布，暫停生成美國民權領袖金恩博士 (Martin Luther King Jr.) 的影像內容，原因是部分用戶利用旗下影片生成工具 Sora 製作出「不敬」的深偽影片，引發外界不滿,https://m.cnyes.com/news/id/6196212
830,6196227,川普軟化？稱對中關稅不可持續 盼習近平會面達成公平協議,據《彭博》周五 (17 日) 報導，美國總統川普在接受《福斯商業新聞》(Fox Business) 坦言，對中國威脅徵收的高關稅「不可持續」，但強調是北京逼他採取這項措施。,https://m.cnyes.com/news/id/6196227
831,6196153,受政治危機緩解與避險需求提振 英法債市迎來強漲,法國和英國債券市場本周迎來今年表現最佳的數周之一，主要受到周五 (17 日) 對美國區域銀行健康狀況擔憂引發的避險買盤，以及國內政治因素的雙重推動。,https://m.cnyes.com/news/id/6196153
832,6196184,Fed降息快來了？鮑爾釋鴿派訊號 但明年恐沒那麼快,根據《彭博》周五 (17 日) 報導，美國聯準會 (Fed) 準備在本月再度降息，因就業市場疲弱的風險目前凌駕通膨疑慮。不過，這種平衡恐難持續太久，2026 年前的利率走向正變得愈發不確定。,https://m.cnyes.com/news/id/6196184
833,6196188,史上最AI「台灣專利超級站」40件國發獎情境式展示 緯創、鴻海等大廠專利一次看,亞洲最具指標性的技術交易平台——「2025 台灣創新技術博覽會」（tie）已於昨（16）起盛大開展，展期至明（18）日。為協助優良專利業者開拓商機，經濟部智慧財產局（智慧局）在發明競賽區特別設置「台灣專利超級站」專館，集中,https://m.cnyes.com/news/id/6196188
834,6196179,任天堂傳增產Switch 2 首年衝2500萬台 廣宇受惠,任天堂傳增產 Switch 2 首年衝 2500 萬台 廣宇受惠,https://m.cnyes.com/news/id/6196179
835,6196171,投資台灣 物流巨頭捷盟行銷再砸45億升級「AI物流」布局桃園台中,"投資台灣事務所今 (17) 日通過捷盟行銷擴大投資台灣 45 億元，將擴大布局，於桃園航空城及台中港自由貿易港區建構智動化物流設施。目前「投資台灣三大方案」已吸引 1,683 家企業超過 2 兆 5,531 億元投資。",https://m.cnyes.com/news/id/6196171
836,6196065,美國區域銀行再陷信貸危機 高盛直喊「太瘋狂」,美國區域銀行股再次遭遇劇烈的信貸風暴，股價在周四 (16 日) 集體暴跌，錄得自 2023 年 3 月矽谷銀行 (SIVB) 倒閉以來表現第二差的交易日。市場恐慌情緒迅速蔓延，區域銀行集體下跌 7%，貨幣中心銀行下跌 3.9%。其中，Zion,https://m.cnyes.com/news/id/6196065
