,newsId,title,summary,link
0,6356679,伊朗報復美國中東軍事基地揚言「無紅線」！科威特、阿聯、卡達等多國發生爆炸,美國與以色列對伊朗發動軍事攻擊後，伊朗隨即反擊中東多處美軍基地，巴林第五艦隊、卡達烏代德基地、科威特與阿聯相繼傳出爆炸聲。川普宣布展開「史詩怒火」行動，伊朗揚言報復無紅線，中東局勢急遽升溫。,https://m.cnyes.com/news/id/6356679
1,6356667,「小米超跑」登熱搜！巴塞隆納發表會倒數、新一代SU7安全升遷亮相,「小米超跑」話題衝上熱搜，小米將於巴塞隆納舉行小米 17 系列全球發布會。雷軍預告手機、汽車與 AI 將有新驚喜，新一代 SU7 升級 9 氣囊、2200 兆帕超強鋼與雷射雷達強化安全，同時訂下 2026 年交付 55 萬輛目標，市場高度關注。,https://m.cnyes.com/news/id/6356667
2,6356663,伊朗遭美以空襲引爆市場恐慌！比特幣跌破6.35萬美元、15萬人爆倉,"中東局勢升溫，以色列與美國聯手空襲伊朗，全球市場劇烈震盪。比特幣一度跌破 63,500 美元，SOL、DOGE 重挫逾 10%，24 小時爆倉金額高達 4.94 億美元。市場質疑比特幣避險地位，貝瑞直指其投機本質。",https://m.cnyes.com/news/id/6356663
3,6356654,伊朗展開「毀滅性」報復！射飛彈回擊以色列、拉響防空警報,美國與以色列對伊朗發動聯合軍事打擊後，伊朗隨即向以色列發射飛彈報復，全境拉響防空警報。川普宣布對伊朗展開重大作戰行動，誓言摧毀飛彈與核設施，美軍福特號、林肯號雙航母同步部署中東，區域局勢急速升溫。,https://m.cnyes.com/news/id/6356654
4,6356652,川普證實美軍對伊朗展開「重大作戰行動」！美軍從空中與海上對伊朗發動攻擊,美國總統川普證實，美軍已對伊朗展開重大作戰行動，從空中與海上發動攻擊，德黑蘭南部多個政府設施成為目標。川普指控伊朗重啟核計畫並發展長程飛彈，以色列亦同步空襲德黑蘭並攔截來襲飛彈，中東局勢急遽升溫。,https://m.cnyes.com/news/id/6356652
5,6356416,Block大裁員引發AI就業疑慮 經濟學家：不宜過度解讀,"Block 執行長 Jack Dorsey 宣布將裁減約 4,000 名員工、接近公司人力的一半，引發市場對人工智慧是否將加速企業裁員的關注。多位經濟學家指出，此舉更可能屬於個別公司策略調整，目前尚不足以視為美國就業市場",https://m.cnyes.com/news/id/6356416
6,6356646,推翻伊朗政權！川普向伊朗民眾喊話：接管你們的政府,據英國《Sky News》周六（28 日）報導，美國總統川普在社交平台 Truth Social 發布的一段 8 分鐘影片中證實，美國已對伊朗發動「重大作戰行動」，並向伊朗民眾喊話，稱「等行動結束，接管你們的政府」。,https://m.cnyes.com/news/id/6356646
7,6356616,智崴沙國市場新斬獲 取得高階大型體感設備合約,智崴沙國市場新斬獲 取得高階大型體感設備合約,https://m.cnyes.com/news/id/6356616
8,6356557,微軟傳推出「神話級」E7 Microsoft 365套裝！整合AI喊價月費99美元,微軟傳正評估推出全新 E7 企業級套裝，作為 AI 強化版 Microsoft 365，整合 Copilot 與 Agent 365，月費最高達 99 美元。在 Google 與 Salesforce 加速布局生成式 AI 之際，E7,https://m.cnyes.com/news/id/6356557
9,6356550,Anthropic嗆美防長「法院見」！拒絕淪為武器、川普下令6個月全面汰換Claude,美國國防部擬將 AI 新創 Anthropic 列為供應鏈風險，國防部長赫格塞斯下令軍方承包商全面停止合作，川普更宣布聯邦機構六個月內停用其技術。雙方爭議聚焦大規模監控與自主武器，白宮不排除動用《國防生產法》。,https://m.cnyes.com/news/id/6356550
10,6356414,Palantir再獲升評 估值不再那麼「難以下嚥」,據《MarketWatch》周五 (27 日) 報導，Palantir Technologies(PLTR-US) 股價向來深受散戶投資人青睞，如今華爾街分析師也開始對這家軟體公司轉趨樂觀。,https://m.cnyes.com/news/id/6356414
11,6356615,川普說話了！伊朗正在研製威脅美國長程飛彈,美國總統川普表示，美軍已經開始對伊朗發動軍事打擊。,https://m.cnyes.com/news/id/6356615
12,6356609,美國、以色列大規模空襲伊朗！美國官員：襲擊規模比去年6月大,以色列國防部長卡茨表示，以色列已經對伊朗發動「先發制人打擊」，關閉領空，全國進入緊急狀態。,https://m.cnyes.com/news/id/6356609
13,6356605,美官員證實美軍攻擊伊朗！以色列空襲德黑蘭：為移除威脅,美國官員證實美軍已對伊朗發動攻擊，稍早以色列亦空襲德黑蘭，引發中東局勢急遽升溫。川普表示仍願與伊朗就核計畫談判，但不排除必要時採取軍事行動。核談判僵局、美軍部署與飛彈威脅，牽動全球能源與地緣政治風險。,https://m.cnyes.com/news/id/6356605
14,6356606,動手了！以色列正在準備4天密集強力聯合進攻,以色列國防部長卡茨表示，以色列已經對伊朗發動「先發制人打擊」，關閉領空，全國進入緊急狀態。,https://m.cnyes.com/news/id/6356606
15,6356397,OpenAI估值一舉升至7300億美元 AI商業化競賽同步升溫,"​​​​​​​​​​​​​​OpenAI 再度刷新 AI 融資紀錄。根據外媒報導，亞馬遜、輝達與軟銀合計向 OpenAI 注資 1,100 億美元，使公司估值一舉升至 7,300 億美元，較 2025 年 3 月的 3,",https://m.cnyes.com/news/id/6356397
16,6356598,開戰了！美國、以色列轟炸目標是德黑蘭總統府、政府大樓,以色列國防部長卡茨表示，以色列已經對伊朗發動「先發制人打擊」，關閉領空，全國進入緊急狀態。,https://m.cnyes.com/news/id/6356598
17,6356577,開戰了！伊朗首都發生爆炸 以色列宣布襲擊伊朗,以色列國防部長卡茨表示，以色列已經對伊朗發動「先發制人打擊」，關閉領空，全國進入緊急狀態。,https://m.cnyes.com/news/id/6356577
18,6356529,川普罕見「請求」最高法院！發文問：能重審關稅案嗎？,美國總統川普公開質疑美國最高法院關稅裁決並詢問是否可重審。法院以 6 比 3 裁定《國際緊急經濟權力法》（IEEPA）未授權大規模加徵關稅，引發逾千家企業提告追討約 1300 億美元關稅款，聯邦政府面臨龐大訴訟壓力，全球貿易不,https://m.cnyes.com/news/id/6356529
19,6356517,WSJ：輝達計劃推新AI晶片 推論晶片戰略大升級,《華爾街日報》週五 (27 日) 報導，在競爭對手壓力升高與市場需求轉向之際，輝達計劃推出一款專為 AI 推論運算打造的新處理器，目標協助 OpenAI 等客戶建構更快速且更具能效的 AI 工具，外界認為此舉可能重塑 AI,https://m.cnyes.com/news/id/6356517
20,6356415,輝達周跌近7%年內轉跌 華爾街聚焦競爭壓力多於成長動能,輝達 (Nvidia)(NVDA-US) 日前公布亮眼財報，並給出優於預期的財測，顯示成長動能正在加速。執行長黃仁勳表示，「算力需求正急速飆升」。但投資人的關注點似乎不在此。,https://m.cnyes.com/news/id/6356415
21,6356543,新里程碑！ChatGPT周活躍用戶數突破9億,"OpenAI 正大步朝著大多數科技產品夢寐以求的全球級規模進一步邁進，這家 AI 巨頭周五（27 日）宣布，旗下聊天機器人 ChatGPT 周活躍用戶數已達到 9 億，目前擁有超過 5,000 萬付費訂閱用戶。",https://m.cnyes.com/news/id/6356543
22,6356528,川普再警告伊朗不得擁核！「不滿意」談判不排除動武：不得不這麼做,美國總統川普表示仍有意與伊朗達成協議，但對核談判進展感到不滿，強調伊朗不得擁有核武，尚未排除軍事選項。同時，賽普勒斯、比利時、法國等多國發布旅遊警示，呼籲避免前往伊朗及中東地區，區域局勢持續升溫。,https://m.cnyes.com/news/id/6356528
23,6356427,川普將Anthropic列入黑名單 馬斯克xAI成最大潛在贏家,市場解讀，美國總統川普 27 日下令聯邦機構立即停止使用 Anthropic，為替馬斯克旗下 xAI 及其 Grok 模型打開更多政府市場機會。,https://m.cnyes.com/news/id/6356427
24,6356533,美伊核談判重大突破！伊朗承諾「零庫存」不再持有可製核武材料  和平協議近在眼前？,美伊核談判傳出關鍵進展，阿曼外交大臣巴德爾表示，伊朗同意永遠不持有可製造核武的核材料，並將現有庫存轉為不可逆核燃料，接受國際原子能機構全面核查。談判焦點轉向「零庫存」原則，和平協議可望在三個月內落實關鍵機制。,https://m.cnyes.com/news/id/6356533
25,6356521,代工中國AI晶片組件觸美方紅線 台積電回應,半導體研究機構 TechInsights 最新初步分析指出，一款由中國燧原科技 (Enflame) 推出的 AI 處理器 S60，內含關鍵元件由台積電製造，引發市場對是否涉及違反美國出口管制的關注,https://m.cnyes.com/news/id/6356521
26,6356535,奧特曼成功卡位！川普封殺Anthropic後 OpenAI火速與五角大廈達成部署協議,美國 AI 產業震盪升溫，在川普政府封殺 Anthropic 之際，OpenAI 迅速與國防部達成模型部署協議，安全紅線與國安應用的拉鋸戰浮上檯面。,https://m.cnyes.com/news/id/6356535
27,6356436,波克夏新時代周六揭幕！阿貝爾首挑大樑 挑戰「巴菲特溢價」保衛戰,,https://m.cnyes.com/news/id/6356436
28,6356527,美伊戰爭風險急升！美國撤離駐以人員、「福特號」航母抵達  伊朗警告毀滅性回擊,中東局勢急速升溫，美國批准撤離駐以色列非必要人員，美軍「福特號」與「林肯號」雙航母同步部署中東。加拿大與印度呼籲公民離開伊朗，伊朗軍方警告將對美方任何侵略行動作出毀滅性回擊，美伊戰爭風險正迅速升高。,https://m.cnyes.com/news/id/6356527
29,6356444,道瓊「Citrini 賣壓」捲土重來 這次矛頭指向Block,隨著 Block 執行長杜錫 (Jack Dorsey) 宣布大規模裁員，這波被市場稱為「Citrini 賣壓」的陰影再度浮現，華爾街對人工智慧 (AI) 引發失業的焦慮再度升溫，道瓊 27 日重挫超 520 點,https://m.cnyes.com/news/id/6356444
30,6356471,資金45%流向海外！瑞銀降評美股 轉向中性配置 示警三重壓力來襲,瑞銀將美股評級下調至中性，警告美元走軟、估值溢價與政策不確定性構成三重壓力。資金流向海外市場，美股相對優勢面臨近 15 年來最大考驗。,https://m.cnyes.com/news/id/6356471
31,6356513,Anthropic被列「供應鏈風險」遭美國防部全面封殺,美國國防部長赫格塞斯 (Pete Hegseth) 週五 (27 日) 宣布，將把 Anthropic 列為國家安全供應鏈風險,https://m.cnyes.com/news/id/6356513
32,6356435,,,https://m.cnyes.com/news/id/6356435
33,6355800,巴隆：關稅退款若啟動 1750億美元恐衝擊債券投組,華爾街警告，相關變數仍可能在未來衝擊債券價格。多位策略師指出，若後續政策發展推升利率，現有債券持有人恐面臨壓力。,https://m.cnyes.com/news/id/6355800
34,6356477,三巨頭豪砸1100億投OpenAI 背後是各取所需的算力布局？,"OpenAI 周五 (27 日) 宣布敲定新一輪 1,100 億美元融資，投前估值達 7,300 億美元。這是公司繼去年 410 億美元融資後，又一次創下紀錄的募資，也是迄今規模最大的私人科技公司融資。",https://m.cnyes.com/news/id/6356477
35,6356355,〈報稅看這裡〉報稅季「孝子」大戰！重複申報扶養誰說了算？國稅局4大認定順序全解析,每到綜合所得稅申報期間，不少晚輩為了減輕稅務負擔，紛紛將長輩列為扶養親屬，希望能扣除免稅額。財政部南區國稅局指出，當多位子女同時申報扶養同一位直系尊親屬，且無法達成共識時，過去常造成查核上的困難。為了建立一致的判斷標準，,https://m.cnyes.com/news/id/6356355
36,6356412,Salesforce執行長：這不是我們第一次面對SaaS末日,據《TechCrunch》報導，Salesforce(CRM-US) 日前公布第四季財報時，可說是使出渾身解數，試圖說服投資人：AI 革命不會成為公司的末日。,https://m.cnyes.com/news/id/6356412
37,6356054,聯發科斥9千萬美元入股Ayar Labs 搶光學互連商機,"IC 設計大廠聯發科 (2454-TW) 今 (27) 日公布，以每單位約 52.24 美元，取得美國共封裝光學 (CPO) 新創 Ayar Labs 特別股 1,722,759 股，總交易總金額約 9,000 萬美元，持股比例約 2.4%。業界解讀",https://m.cnyes.com/news/id/6356054
38,6356485,高盛、大摩跌超6% 英國MFS倒閉波及美股金融股重挫,AI 顛覆性擔憂持續疊加私募信貸領域風險集中爆發，美國金融股周五 (27 日) 遭遇重挫，美股三大指數集體收跌。,https://m.cnyes.com/news/id/6356485
39,6356476,全球車市洗牌 中國三強殺入前十 比亞迪超車特斯拉 日本只剩兩田,2025 年全球十大車企排名出爐，中國比亞迪、上汽與吉利同時進榜，日本僅剩豐田與本田。比亞迪純電銷量首超特斯拉，中國車市實力全面崛起。,https://m.cnyes.com/news/id/6356476
40,6356105,冠德建設去年EPS2.61元 3/2起將買回6000張庫藏股護盤,營建股績優生冠德 (2520-TW) 公布最新獲利成績，2025 年全年財報稅後純益爲 15.56 億元，年減 71.96%，每股純益爲 2.61 元；同時，冠德並決議自 3 月 2 日起兩個月內進場在每股 48 元以下買回 6000 張庫藏股護盤。,https://m.cnyes.com/news/id/6356105
41,6356434,「信貸蟑螂」現身、AI亂流攪局 美銀行股重挫創去年春季以來最慘,,https://m.cnyes.com/news/id/6356434
42,6356470,史上最大AI融資誕生！OpenAI狂攬1100億美元 亞馬遜、輝達、軟銀聯手押注,"OpenAI 宣布完成 1,100 億美元史上最大 AI 融資，亞馬遜、輝達與軟銀聯手投資，並擴大雲端與晶片合作。公司估值達 7,300 億美元，在衝刺 AGI 與上市壓力下，加速全球算力布局。",https://m.cnyes.com/news/id/6356470
43,6355137,護國神山台積電「產業風向球」重點整理，快速掌握成長動能、資本支出、AI趨勢與風險(二),,https://m.cnyes.com/news/id/6355137
44,6355766,銅金比40年一遇的低點！FXTM富拓：AI帶動銅價補漲 全球資金正悄悄布局,近期全球市場焦點由 AI 熱潮帶動的科技股行情，逐步轉向對產業結構與就業影響的重新評估。在大型語言模型能力持續提升之際,https://m.cnyes.com/news/id/6355766
45,6208776,客單價成長支撐  PC市場產值有望逆勢走揚,隨著記憶體漲價，PC 出貨受到衝擊，各大研調機構紛紛下調今年出貨量，不過 PC 品牌宏碁 (2353-TW) 及聯強 (2347-TW) 紛紛指出，即便記憶體與處理器等零組件報價調升，整體電腦產業產值仍受惠於客單價成長而走揚。業者分析,https://m.cnyes.com/news/id/6208776
46,6356411,川普媒體擬分拆Truth Social上市 聚焦AI電力布局,"據《路透》報導，美國總統川普創立的川普媒體與科技集團 (Trump Media &amp; Technology Group, TMTG)(DJT-US) 正考慮將旗下社群媒體平台 Truth Social 分拆為一家公開上市公司。",https://m.cnyes.com/news/id/6356411
47,6356323,怕召喚出天網？美國防部限時施壓 Anthropic拒鬆綁軍用AI紅線,美國國防部與 AI 新創 Anthropic 爆發公開對峙，圍繞軍事用途與技術紅線展開激辯。這場衝突揭示 AI 時代軍政與產業權力重組的深層變化。,https://m.cnyes.com/news/id/6356323
48,6355982,AI催生投資新寵！專家：HALO交易興起 重資產企業強國日本有望成終極贏家,,https://m.cnyes.com/news/id/6355982
49,6355988,川普大讚美國經濟好棒棒 民調：蛤？,川普在創紀錄的國情咨文中高調宣示經濟復甦，強調股市、就業與減稅成果，但多項民調顯示，多數選民仍對通膨與生活成本不滿，經濟體感與官方數據之間的落差，正為中期選舉投下變數。,https://m.cnyes.com/news/id/6355988
50,6356263,美股重點新聞摘要2026年2月28日,,https://m.cnyes.com/news/id/6356263
51,6356420,美12月原油產量降至去年6月以來最低點 需求卻創數月高峰,"美國 12 月原油產量連兩月下滑，降至 2025 年 6 月以來最低，但石油總需求攀升至 2,085 萬桶 / 日，天然氣產量更創歷史新高，能源市場供需走勢呈現分化。",https://m.cnyes.com/news/id/6356420
52,6356341,財報後重挫近20% 「輝達親兒子」CoreWeave執行長捍衛自家350億美元AI基建計畫,CoreWeave 財報後股價重挫近 20%，市場憂心 300 億至 350 億美元資本支出計畫恐壓縮獲利空間。執行長強調訂單龐大與資本成本下降，力圖化解高槓桿疑慮。,https://m.cnyes.com/news/id/6356341
53,6356400,對伊朗核談不滿意 川普放話「必要時動武」油價飆升至七個月高點,美國總統川普週五 (27 日) 在白宮外受訪時表示，他「希望不要」動用美軍攻擊伊朗，但也坦言「有時候你必須這麼做」，並強調最終決定尚未拍板，市場正為潛在衝突重新定價油市。,https://m.cnyes.com/news/id/6356400
54,6356408,戴爾暴漲22%創兩年最大漲幅 AI伺服器銷售前景亮眼,戴爾科技 (Dell Technologies)(DELL-US) 周五 (27 日) 股價大漲近 22%，創下兩年來最大漲幅，此前公司釋出優於市場預期的 AI 伺服器銷售展望，顯示支撐 AI 資料中心建設的設備需求依然強勁。,https://m.cnyes.com/news/id/6356408
55,6356413,軟體股齊跌 Block大裁員加劇AI疑慮,"軟體股周五 (27 日) 下跌，原因是數位支付公司 Block(SQ-US) 宣布將裁員逾 4,000 人，進一步加劇市場對人工智慧 (AI) 可能大幅削減員工數並衝擊軟體需求的擔憂。",https://m.cnyes.com/news/id/6356413
56,6356399,彭博：SpaceX擬秘密申請上市 估值衝超1.75兆美元,《彭博》報導，馬斯克旗下太空與衛星公司 SpaceX 正考慮以保密方式申請首次公開募股 (IPO) ，公司估值可望突破 1.75 兆美元，若成行，將躋身史上規模最大的上市案之一。,https://m.cnyes.com/news/id/6356399
57,6356133,〈貴金屬盤後〉金價2月上漲7.6% 月線連七紅,,https://m.cnyes.com/news/id/6356133
58,6356396,〈美股盤後〉輝達續挫4% 費半跌超1% 那指月跌幅逾 3% 創去年3月以來最差,美股主指週五 (27 日) 集體收黑，主因最新生產者物價指數 (PPI) 遠高於預期，市場對通膨黏著性的憂慮升溫，加上人工智慧 (AI) 不確定性持續發酵、美伊緊張情勢升溫，投資人風險情緒明顯降溫。金融與景氣循環族群同步承壓。,https://m.cnyes.com/news/id/6356396
59,6356262,〈紐約匯市〉美元創去年10月來首見月漲 Fed偏鷹與地緣局勢撐盤,美元周五 (27 日) 小幅走低，但在地緣政治緊張升溫與聯準會 (Fed) 轉趨鷹派的帶動下，美元仍迎自去年 10 月以來的首次單月漲幅。,https://m.cnyes.com/news/id/6356262
60,6356321,〈能源盤後〉美伊談判延長 油市押注衝突風險 油價飆升逾2%,美國與伊朗延長核談判，但市場對協議前景存疑，地緣政治風險推升油價單日大漲逾 2%，布蘭特與 WTI 雙雙創下數月新高，市場並計入每桶 8 至 10 美元風險溢價。,https://m.cnyes.com/news/id/6356321
61,6356395,AI政策轉彎 川普下令聯邦機構全面停用Anthropic,川普週五 (27 日) 指出，他正要求美國政府各聯邦機構全面終止與 Anthropic 的技術往來，強調美方「不需要、不想要，也不會再與其做生意」。,https://m.cnyes.com/news/id/6356395
62,6356340,關稅違法後遺症來了！逾兩千件訴訟壓境 川普政策風暴未完,"美國最高法院日前裁定總統川普多數全球性關稅措施違法後，企業提告潮迅速升溫。根據《彭博》統計，相關關稅訴訟數量已突破 2,000 件，僅在裁決後數日內，就有逾百家公司新提訴訟，凸顯企業對於政府是否願意退還已徵收巨額關稅的疑慮。",https://m.cnyes.com/news/id/6356340
63,6356166,財報超神股價卻大跌 輝達怎麼了？,輝達 (NVDA-US) 在最新財報中繳出亮眼成績單，營收與財測雙雙優於市場預期，展現強勁成長動能。然而，股價卻在財報後重挫，估值水準甚至看似接近「價值股」，形成基本面與股價表現之間的明顯落差。,https://m.cnyes.com/news/id/6356166
64,6356322,阿特曼：OpenAI洽談國防部合作 盼化解Anthropic僵局,《華爾街日報》(WSJ)周五 (27 日) 報導，OpenAI 執行長阿特曼 (Sam Altman) 表示，公司正與美國國防部洽談合作事宜，盼在符合自身安全原則的前提下，讓旗下 AI 模型能部署於機密環境，並嘗試化解競爭對手 Anthr,https://m.cnyes.com/news/id/6356322
65,6355784,AI成投資神器？霍華馬克斯揭示人類不被取代的優勢,,https://m.cnyes.com/news/id/6355784
66,6356182,晶片被AI搶光！今年智慧型手機出貨恐創史上最大跌幅,《CNBC》周五 (27 日) 報導，隨著記憶體供應持續吃緊、價格攀升，分析機構預測 2026 年全球智慧手機市場恐出現歷來最大跌幅。國際數據資訊公司 (IDC) 指出，在記憶體危機惡化下，2026 年全球個人電腦 (PC) 與智慧手機市場,https://m.cnyes.com/news/id/6356182
67,6355780,全球最大主權基金實證！AI多次攔截投資地雷 成功避險,,https://m.cnyes.com/news/id/6355780
68,6356164,〈美股早盤〉AI疑慮與PPI偏強拖累 主要指數開低,美股主要指數周五 (27 日) 開盤走低，延續近期科技股回檔走勢，市場聚焦人工智慧 (AI) 需求疑慮與強於預期的生產者物價指數 (PPI) 數據。科技股承壓拖累那斯達克指數，本月跌幅擴大，投資人重新評估聯準會 (Fed) 降息時機點。資,https://m.cnyes.com/news/id/6356164
69,6355997,波克夏被低估？分析師估內在價值1.1兆美元、未來10年年報酬上看12%,長期追蹤波克夏的分析師 Chris Bloomstran 指出，波克夏內在價值達 1.1 兆美元，較現價仍高出 13%，預估未來十年年報酬率可達 10% 至 12%。隨巴菲特 2025 年卸任、阿貝爾接棒，3500 億美元現金部署策略與保險事,https://m.cnyes.com/news/id/6355997
70,6356260,亞馬遜豪砸500億美元！OpenAI完成1100億美元史上最大融資,"綜合外媒周五 (27 日) 報導，OpenAI 宣布完成 1,100 億美元募資案，交易前估值達 7,300 億美元，若計入本輪資金，交易後估值升至 8,400 億美元，創下這家 ChatGPT 開發商成立以來最大規模融資，也凸顯人工智慧(AI",https://m.cnyes.com/news/id/6356260
71,6356165,通膨升溫訊號浮現！美1月PPI升幅超預期 Fed降息更添阻力,美國 1 月生產者物價指數 (PPI) 高於市場預期，核心 PPI 亦明顯升溫，顯示上游通膨壓力仍具韌性。服務價格大幅上揚成為主要推手，抵銷能源價格回落影響。數據強化市場對聯準會 (Fed) 短期內維持利率不變的預期，並為即將公布的個人,https://m.cnyes.com/news/id/6356165
72,6355921,輝達財報驚豔卻陷「贏家詛咒」？WSJ：AI暴利正削弱科技巨頭現金流,輝達第四季營收達 681 億美元、年增 73%，財測更大幅超越華爾街預期，自由現金流上看 1650 億美元。然而，在 AI 焦慮升溫與科技巨頭現金流承壓之際，股價仍下跌逾 5%。解析 AI 投資熱潮背後的風險與市場隱憂。,https://m.cnyes.com/news/id/6355921
73,6356252,美債迎來一年最佳單月表現 10年期殖利率跌破4%,在全球風險升溫背景下，美國公債迎來近一年來最佳單月表現，顯示投資人仍將美債視為動盪時期的首選避風港。2 月期間，美國 10 年期公債殖利率下滑 25 個基點，為一年來最大單月跌幅，並自去年 11 月以來首度跌破 4%。彭博美債指數 2 月上,https://m.cnyes.com/news/id/6356252
74,6356120,惹到川普遭清洗？美國FBI解雇10名「機密文件案」調查員,美國聯邦調查局（FBI）證實解雇約 10 名曾參與川普機密文件案調查的人員。該案涉及海湖莊園文件與妨礙司法指控，並曾由特別檢察官史密斯主導。FBI 探員協會批評此舉削弱專業能力與組織穩定性，引發外界對司法獨立與政治影響的關注。,https://m.cnyes.com/news/id/6356120
75,6356167,CagriSema表現遜色！諾和諾德單周重挫21% 抹去Wegovy帶動多年漲幅,《彭博》周五 (27 日) 報導，丹麥藥廠諾和諾德 (NOV-US) 本周股價重挫 21%，將創下自 8 月以來最大單周跌幅，幾乎抹去自 2021 年減重藥 Wegovy 在美國獲批以來累積的漲幅。這波跌勢主因是公司次世代減重針劑 CagriSe,https://m.cnyes.com/news/id/6356167
76,6356223,鉅亨速報 - Factset 最新調查：諾華NVS-US的目標價調升至149.48元，幅度約3.52%,FactSet 最新調查：諾華NVS-US目標價調升，最高估值、最低估值、中位數、綜合評級、近5日股價、標普、即時新聞資訊,https://m.cnyes.com/news/id/6356223
77,6356193,鉅亨速報 - Factset 最新調查：波音(BA-US)EPS預估下修至1.3元，預估目標價為277.50元,FactSet 最新調查：波音(BA-US)EPS預估下修，預估EPS、預估營收、目標價、歷史獲利表現、即時新聞資訊,https://m.cnyes.com/news/id/6356193
