,newsId,title,summary,link
340,6276266,不只靠OpenAI！微軟真正的AI王牌 華爾街已經買單,,https://m.cnyes.com/news/id/6276266
341,6276374,30萬級瑪莎拉蒂兩天被搶光！中國經銷商：6點下班 被客戶堵到9點,曾經最受微商喜愛的「神車」，如今價格開始打「骨折」了。,https://m.cnyes.com/news/id/6276374
342,6276318,美股重點新聞摘要2025年12月16日,美股重點新聞摘要 2025 年 12 月 16 日,https://m.cnyes.com/news/id/6276318
343,6276372,掃地機器人鼻祖iRobot聲請破產保護 股價暴跌70%,掃地機器人先驅 iRobot 公司周日（14 日）聲請破產保護，計劃由中國主要供應商、代工廠接盤，並下市。這家曾經市值高達 35.6 億美元的公司股價周一開盤暴跌 72%，早盤跌幅一度達 75.2%，收跌 72.7%。,https://m.cnyes.com/news/id/6276372
344,6276228,高盛提出四種情境 警告AI資料中心恐悲劇收場,,https://m.cnyes.com/news/id/6276228
345,6276320,SpaceX籌備IPO 馬斯克身價突破6000億美元,"富比世 (Forbes) 雜誌周一 (15 日) 表示，特斯拉 (Tesla)(TSLA-US) 創辦人馬斯克成為史上首位身價達到 6,000 億美元的人，市場正傳出其太空新創 SpaceX 可能以 8,000 億美元估值進行 IPO。",https://m.cnyes.com/news/id/6276320
346,6276332,降息潮下的異數！日本估升1碼、利率挑戰1995年新高,,https://m.cnyes.com/news/id/6276332
347,6276354,囤銅潮席捲美國 華爾街2026年全面看多 銅價恐飆至「平流層」每噸上看1.5萬美元,銅價今年以來狂飆逾三成，在供應受擾、能源轉型與 AI 需求升溫，以及美國囤銅與關稅疑慮交織下，投行預期漲勢將延續至 2026 年，甚至挑戰每噸 1.5 萬美元的歷史新高。,https://m.cnyes.com/news/id/6276354
348,6276306,量子運算公司宣布以1.1億收購Luminar半導體,量子運算公司 (Quantum Computing；QCi) 週一 (15 日) 宣布，已同意以全現金方式收購 Luminar 半導體 (LSI），交易金額為 1.1 億美元。,https://m.cnyes.com/news/id/6276306
349,6276345,那斯達克擬延長交易時段 朝每週五天 每天交易23小時邁進,知情人士指出，那斯達克計劃週一向美國證券交易委員會提交相關文件，為每週五天、每日 23 小時的股票交易制度鋪路，以回應全球投資人對美國股票持續升溫的需求。,https://m.cnyes.com/news/id/6276345
350,6276210,破7預期升溫！機構估人民幣2026年漲至6.8 專家：出口+Fed降息雙引擎啟動,,https://m.cnyes.com/news/id/6276210
351,6276305,美光學雷達廠Luminar聲請破產保護 股價血崩超60%,美國光達 (LiDAR) 設計商 Luminar 科技在經歷數月裁員、高層離職，以及與最大客戶 Volvo 的法律糾紛後，週一 (15 日) 已聲請第 11 章破產保護。,https://m.cnyes.com/news/id/6276305
352,6276231,挑戰台積電壟斷地位！三星傳與AMD洽談2奈米晶片供應,,https://m.cnyes.com/news/id/6276231
353,6276331,〈貴金屬盤後〉金價下跌 等待美國就業數據 白金登14年新高,,https://m.cnyes.com/news/id/6276331
354,6276340,司法之路封閉 白宮成大麻改革最後希望 川普行政命令或點燃320億美元產業,美國最高法院拒絕受理大麻企業挑戰聯邦禁令之際，總統川普表態正考慮以行政命令重新分級大麻，讓改革焦點從司法轉向白宮。對市值 320 億美元的合法產業而言，行政手段被視為突破僵局的關鍵。,https://m.cnyes.com/news/id/6276340
355,6276308,〈美股盤後〉等待美非農與CPI開獎 四大指數盡墨 台積電ADR跌近1.5%,美股主指週一 (15 日) 盡墨，投資人等待週二公布的 11 月就業報告，以及本週一連串經濟數據，以協助市場評估 2026 年降息預期。,https://m.cnyes.com/news/id/6276308
356,6276327,特斯拉升超3% 馬斯克證實Robotaxi無駕駛測試 華爾街多頭看好成「金雞母」,特斯拉 (Tesla)(TSLA-US) 股價周一 (15 日) 上漲 3.56%，主要因其無人計程車 Robotaxi 業務再傳利多進展，華爾街知名多頭更直言，這家電動車製造商的「自動駕駛篇章」已正式展開。,https://m.cnyes.com/news/id/6276327
357,6276222,〈能源盤後〉全球供應過剩 俄烏和平現曙光 蓋過美委關係激化 原油承壓走跌,國際油價周一走跌，市場一方面關注美國加大制裁導致委內瑞拉原油出口受阻，另一方面更憂慮全球供應過剩與俄烏和平談判可能釋放新增供給。在需求疲弱與經濟數據不佳影響下，油市情緒偏空。,https://m.cnyes.com/news/id/6276222
358,6276317,〈紐約匯市〉美元小跌 市場預測日央本周升息,美元周一 (15 日) 小幅走低，本周央行決策與美國重要經濟數據密集公布，市場試圖從中判斷聯準會 (Fed) 短期政策走向。,https://m.cnyes.com/news/id/6276317
359,6275517,25兆美元機器人市場爆炸！大摩：2050年硬體銷售破紀錄 中國掌控六成命脈,,https://m.cnyes.com/news/id/6275517
360,6276319,川普談柏林會談：「史上最接近」結束俄烏戰爭,美國總統川普周一 (15 日) 表示，在其特使與烏克蘭總統澤倫斯基 (Volodymyr Zelenskiy) 於德國柏林會談後，結束俄羅斯對烏克蘭戰爭的協議「比以往任何時候都更為接近」。,https://m.cnyes.com/news/id/6276319
361,6276307,輝達收購SchedMD推動開源AI布局 股價小幅收高近1%,美國晶片大廠輝達週一 (15 日) 收紅近 1%，此前公司宣布完成對軟體公司 SchedMD 的收購。SchedMD 主要提供用於管理人工智慧（AI）工作負載與高效能運算 (HPC) 的軟體解決方案。,https://m.cnyes.com/news/id/6276307
362,6276265,〈台股盤前要聞〉股匯雙殺 外資提錢落跑、憲政首例 閣揆不予副署,台股盤前要聞,https://m.cnyes.com/news/id/6276265
363,6276206,【袁志峰專欄】中國11月經濟數據遜預期,"今日推介 - 商湯 (20, $2.13), 目標價 $2.35, 止損價 $2.05",https://m.cnyes.com/news/id/6276206
364,6276296,美提「北約級」安全保障要烏克蘭快點頭 但領土問題懸而未決,根據《彭博》與《Politico》周一 (15 日) 報導，美國在柏林和談中向烏克蘭提出類似北約第五條的「強力安全保障」，這是川普政府迄今最強而明確的承諾，但帶有隱含最後通牒：現在接受，否則下次條件不會更好。,https://m.cnyes.com/news/id/6276296
365,6276227,美銀點名Alphabet：下一階段 AI浪潮中的最大贏家,美銀認為，全球 AI 發展已進入「變現與回報」的新階段。Alphabet 為最具優勢的股票，因其在基礎模型、雲端、晶片及分發管道上擁有四大結構性優勢。在這些因素驅動下，AI 將在未來五年內為市場帶來逾 1 兆美元的增量營收機會。,https://m.cnyes.com/news/id/6276227
366,6276226,歐盟宣布對俄羅斯「影子艦隊」相關方祭出新制裁,歐盟理事會周一（15 日）發布兩份公告，宣布就俄羅斯「影子艦隊」相關活動以及俄方「混合威脅」分別採取新一輪制裁措施。,https://m.cnyes.com/news/id/6276226
367,6276194,戴爾打響PC漲價第一槍！記憶體晶片短缺逼商用產品線漲價10%到30%,,https://m.cnyes.com/news/id/6276194
368,6276256,川普政府組千人「科技部隊」 聯手科技巨頭拚AI競爭力,"據《CNBC》周一 (15 日) 報導，川普政府推出「美國科技部隊 (U.S. Tech Force)」計劃，將招募約 1,000 名工程師和技術專家，投入聯邦政府 AI 基礎建設和科技專案。",https://m.cnyes.com/news/id/6276256
369,6276311,鉅亨速報 - Factset 最新調查：默克藥廠MRK-US的目標價調升至111元，幅度約5.71%,FactSet 最新調查：默克藥廠MRK-US目標價調升，最高估值、最低估值、中位數、綜合評級、近5日股價、標普、即時新聞資訊,https://m.cnyes.com/news/id/6276311
370,6275953,真無人駕駛來了！馬斯克：特斯拉啟動無安全員Robotaxi路測,一名 X 用戶周日（14 日）拍到一輛特斯拉 Model Y 在美國奧斯汀街頭行駛的畫面，車內似乎空無一人，甚至沒有安全監督員。,https://m.cnyes.com/news/id/6275953
371,6276283,柯林斯稱上周支持降息是「艱難抉擇」 通膨仍是隱憂,綜合外媒周一 (15 日) 報導，波士頓聯邦準備銀行總裁柯林斯 (Susan Collins) 表示，她支持上周降息決定，但強調這是一個「艱難的抉擇」。,https://m.cnyes.com/news/id/6276283
372,6276268,加碼開源AI布局！輝達收購軟體商SchedMD,根據《路透》報導，輝達 (NVDA-US) 周一 (15 日) 宣布收購人工智慧 (AI) 軟體公司 SchedMD，進一步擴大在開源 AI 領域的布局，並加碼投資 AI 生態系，以因應競爭加劇的市場環境。,https://m.cnyes.com/news/id/6276268
373,6276233,甲骨文信用風險飆至16年高點 摩根大通：AI豪賭需拿出實績,根據《彭博》周一 (15 日) 報導，甲骨文 (ORCL-US) 財報不如預期，股價上周創近 11 個月最大跌幅，信用風險指標觸及 16 年高點。摩根大通分析師警告，該公司大舉投資 AI 需「用實績說話」。,https://m.cnyes.com/news/id/6276233
374,6276271,川普一句話！哈塞特Fed主席勝算大跳水 華許聲勢上升,《CNBC》周一 (15 日) 援引知情人士消息報導，原本被市場視為幾乎篤定出線的白宮國家經濟會議 (NEC) 主任哈塞特 (Kevin Hassett)，其角逐聯準會(Fed) 主席的聲勢，近期遭到多名與美國總統川普關係密切的高層人,https://m.cnyes.com/news/id/6276271
375,6276224,聯準會政策怎麼走？Fed三把手談降息後的下一步,綜合外媒周一 (15 日) 報導，紐約聯準銀行總裁威廉斯 (John Williams) 表示，聯準會 (Fed) 上周降息後，貨幣政策已處於良好位置，有能力因應未來一年經濟與通膨走勢。他指出，隨著就業市場逐步降溫，通膨風險已有所緩解,https://m.cnyes.com/news/id/6276224
376,6276124,不裁員、不關廠！Netflix為華納兄弟併購案降溫 高層親上火線說明,綜合外媒周一 (15 日) 報導，Netflix(NFLX-US)共同執行長彼得斯 (Greg Peters) 與薩蘭多斯 (Ted Sarandos) 向員工表示，對於收購華納兄弟探索(Warner Bros Discovery)(,https://m.cnyes.com/news/id/6276124
377,6276163,紐約州製造業12月意外萎縮 未來展望卻創年內新高,綜合外媒周一 (15 日) 報導，美國紐約州 12 月製造業活動意外萎縮，在連續兩個月擴張後出現逆轉，主要受出貨量大跌拖累。不過未來展望指標大幅上升至年初以來最高，顯示企業對前景轉趨樂觀。,https://m.cnyes.com/news/id/6276163
378,6276190,Fed米蘭：實際通膨接近2%目標 過度緊縮恐傷就業,綜合外媒周一 (15 日) 報導，聯準會理事米蘭 (Stephen Miran) 表示，實際通膨已接近聯準會 2% 目標，「價格現在再次穩定」，目前高於目標的通膨數據並未反映真實的供需動態。,https://m.cnyes.com/news/id/6276190
379,6276147,不只補助了！川普政府直接入股關鍵產業 強化美國戰略供應鏈,根據《路透》周一 (15 日) 報導，川普政府正調整產業政策方向，改以直接入股的方式，強化美國在關鍵礦物與半導體等戰略產業的供應鏈安全，藉此降低對中國的依賴。根據彙整，華府已在多家企業中取得股權，或正就投資入股進行討論，顯示政,https://m.cnyes.com/news/id/6276147
380,6276189,不只賣晶片！輝達新一代開源AI模型Nemotron 3正式亮相,《路透》報導，輝達 (NVDA-US) 周一 (15 日) 發布新一代開源人工智慧 (AI) 模型，推出第三代「Nemotron」大型語言模型系列，主打效能更快、成本更低、能力更強，正值中國 AI 實驗室的開源模型在全球科技圈迅速擴散之際,https://m.cnyes.com/news/id/6276189
381,6276173,木頭姐又賣特斯拉 巴隆：只是風控操作非看法改變,根據《巴隆周刊》周一 (15 日) 報導，長期看多特斯拉的 ARK 投資管理公司創辦人「木頭姐」Cathie Wood 上周五再度賣出特斯拉股票，但這應該只是投資組合管理操作，而非看法改變。,https://m.cnyes.com/news/id/6276173
382,6276015,〈美股早盤〉數據大周登場！美股反彈迎考驗 主要指數開高,華爾街主要指數周一 (15 日) 開盤走高，擺脫上周科技股回檔壓力，在股債齊揚的帶動下展開 2025 年最後一個完整交易周。投資人正為本周密集公布的就業與通膨等關鍵經濟數據做準備，市場押注數據將顯示經濟活動仍具韌性、通膨持續降溫，,https://m.cnyes.com/news/id/6276015
383,6276091,烏克蘭為和談讓步放棄加入北約 歐洲國防股周一走跌,根據《CNBC》周一 (15 日) 報導，烏克蘭總統澤倫斯基周末與美國官員會談時表示，願意放棄加入北約以換取安全保障，作為結束近四年戰爭的和平協議一部分。受此消息影響，歐洲國防股周一普遍下跌。,https://m.cnyes.com/news/id/6276091
384,6276140,MIH：電池產業正發生結構性轉變 從能源載體走向能源資產,MIH：電池產業正發生結構性轉變 從能源載體走向能源資產,https://m.cnyes.com/news/id/6276140
385,6276110,雙11不旺？五大發卡行11月刷卡量因「兩原因」縮水 中信銀蟬聯雙冠王,國內五大發卡行 2025 年 11 月信用卡財務數據出爐，據統計，單月合計刷卡量 2847 億元，月減 13.29%、年增 3.87%；前 11 月累計簽帳金額約 3 兆 2391 億元，較去年同期成長 7.63%。中國,https://m.cnyes.com/news/id/6276110
386,6271999,民間參與公建將破2500億寫歷年次高！兆元投資方案助攻民間投資年增6成,「兆元投資國家發展方案」的強力推動，旨在透過公私協力的創新模式，有效引導龐大的民間資金投入國家重大建設，不僅活絡經濟，也加速台灣基礎設施的升級。國發會表示，根據最新估計，今 (114) 年民間參與公共建設的簽約金額預計將達到,https://m.cnyes.com/news/id/6271999
387,6276159,中國自動駕駛產業迎分水嶺：L3級車型獲准,中國工業和信息化部周一（15 日）正式公佈了首批 L3 級有條件自動駕駛車型准入許可。此次獲准入的車型分別來自長安汽車和北汽極狐兩家汽車企業，象徵著中國 L3 級自動駕駛正式跨越測試階段，進入指定區域上路試點的新階段。,https://m.cnyes.com/news/id/6276159
388,6276149,中國11月房市：70城房價總體下降 年率跌幅全面擴大,據中國國家統計局網站周一 (15 日) 公布數據，2025 年 11 月份，70 個大中城市商品住宅銷售價格較上月整體下降、年減幅度擴大。,https://m.cnyes.com/news/id/6276149
389,6276093,彭博調查：2026美國衰退機率30% 經濟可望過關、但4大支柱不容閃失,《彭博》周一報導，過去幾年美國經濟屢次閃過衰退警訊，2025 年，AI 推動部分產業蓬勃發展，但就業市場停滯、房市冰凍、通膨回升。展望明年，經濟學家謹慎樂觀，但警告勞動市場、通膨、消費者與 AI 四大支柱任一崩塌都可能引發衰退。,https://m.cnyes.com/news/id/6276093
390,6276125,AI還沒退燒！花旗看好後市 估明年底標普500指數上看7700點,"《路透》周一 (15 日) 報導，花旗集團 (C-US) 設定標普 500 指數在 2026 年底的目標水準為 7,700 點，主要看好企業獲利表現穩健，以及人工智慧 (AI) 投資持續帶來支撐動能。花旗在上周五發布的報告中指出，AI 基礎建設仍將",https://m.cnyes.com/news/id/6276125
391,6276074,利空先放一邊！空單回補推升銅價,《路透》報導，銅價周一 (15 日) 上漲，主因部分交易員在本周合約到期前回補或展期部位，短線支撐價格表現，暫時淡化市場對中國疲弱經濟數據及房市前景的憂慮。,https://m.cnyes.com/news/id/6276074
392,6273174,儲能需求大爆發！鋰價告別低谷 2026年可望將「由供轉缺」,,https://m.cnyes.com/news/id/6273174
393,6275990,利率下降與價值重估成雙重推力 市場看好美股小型股明年續強,在經歷了今年的長期沉寂之後，小型股近期出現了快速反彈。華爾街許多專家認為，小型股這波漲勢是由利率下降與經濟增長這兩個利好因素共同推動的，預計將促使這個風險較高的群體，在明年實現市場領先的收益。,https://m.cnyes.com/news/id/6275990
394,6276018,傳統銀行也玩區塊鏈！摩根大通推代幣化貨幣基金,根據《華爾街日報》(WSJ)周一 (15 日) 報導，摩根大通 (JPM-US) 進一步擴大對加密與區塊鏈領域的布局，正式將代幣化技術引入傳統投資商品之一的貨幣市場基金。該行旗下資產管理規模約 4 兆美元的事業部，推出首檔運行於以太坊,https://m.cnyes.com/news/id/6276018
395,6276082,中光電智能感測發表全球最小TPMS加速度感測晶片 明年上半年量產,中光電智能感測發表全球最小 TPMS 加速度感測晶片 明年上半年量產,https://m.cnyes.com/news/id/6276082
396,6276081,禁團令不解、兩岸觀光逆差反達1520億元 觀光署：已釋出善意 中方不回應,"交通部在去 (2024) 年 2 月以「中國未對等開放」為由，宣布從該年 6 月起禁止組團赴中國觀光，視中方是否釋出善意再重啟，今 (2025) 年兩岸觀光旅客人次相差近 380 萬人次，觀光逆差將達到台幣 1,520 億元。",https://m.cnyes.com/news/id/6276081
397,6275955,富時100指數邁向16年最佳 但投資人對英國國內市場普遍憂慮,儘管英國富時 100 指數在 2025 年表現強勁，上漲了 19%，有望錄得 16 年來最佳成績，甚至超越了標普 500 和歐元斯托克 50 指數，但更側重國內市場的富時 250 指數，卻難以擺脫困境。,https://m.cnyes.com/news/id/6275955
398,6272027,打造亞資中心！KPMG發表台灣CEO報告：81%對內需樂觀 71%擁抱AI ,KPMG 安侯業聯合會計師事務所與台灣董事學會今（15）日共同舉辦 2025 安侯建業領袖學院論壇，深入探討全球變局下的產業趨勢，以及亞洲資產管理中心（AAC）為台灣企業與金融市場帶來的策略優勢與挑戰。會中發表《2026 KP,https://m.cnyes.com/news/id/6272027
399,6275956,電腦公會完成理監事改選 彭双浪卸任理事長,電腦公會完成理監事改選 彭双浪卸任理事長,https://m.cnyes.com/news/id/6275956
400,6276017,比執行長更吸睛？特斯拉董事報酬逾30億美元 規模遠超科技同業,《路透》周一 (15 日) 報導，根據薪酬與公司治理研究機構 Equilar 進行的分析，特斯拉 (TSLA-US) 董事會成員透過股票獎酬累積獲利超過 30 億美元，金額遠高於同期間美國大型科技同業董事所獲得的水準。,https://m.cnyes.com/news/id/6276017
401,6276072,彭双浪：期待政府或產業公協會主導 建立海外產業群聚,彭双浪：期待政府或產業公協會主導 建立海外產業群聚,https://m.cnyes.com/news/id/6276072
402,6276064,政院不副署財劃法 總統批示：財劃法修正案破壞財政永續,總統府發言人郭雅慧今 (15) 日表示，總統賴清德今 (15) 日在公布財政收支劃分法修正條文令文案批示，本法修正破壞財政永續，在行政院長卓榮泰加註不予副署之意見下，總統府以示恪盡憲法忠誠義務與維護國家財政健全之嚴正立場。,https://m.cnyes.com/news/id/6276064
403,6275893,日本央行報告證實薪資動能不減 市場預測本周升息機率94%,日本央行周一 (15 日) 發布一份特別薪資報告，為本周的利率決策會議奠定基礎。報告顯示，儘管許多企業正為美國關稅對利潤的衝擊做準備，但日本企業界看來仍渴望在下一財年繼續提高薪資。,https://m.cnyes.com/news/id/6275893
404,6276063,波力-KY明起兩個月內在每股220元以下買回庫藏股2000張,碳纖冰上曲棍球製造商波力 (8467-TW) 董事會決議，將在明 (16) 日起在每股 220 元以下買庫藏股 2000 張，目的在維護公司信用及股東權益。,https://m.cnyes.com/news/id/6276063
405,6276016,馬斯克旗下SpaceX助攻！意法半導體星鏈晶片出貨兩年拚翻倍,根據《路透》周一 (15 日) 報導，歐洲晶片大廠意法半導體 (STMicroelectronics)(STM-US) 高層透露，過去十年來，該公司已為馬斯克旗下太空探索科技公司 (SpaceX) 的星鏈 (Starlink) 衛星網路，,https://m.cnyes.com/news/id/6276016
406,6276019,慧康*-KY再獲日立及NTT選用企業健康保險組合 帶動營收倍速成長,慧康 *-KY 今 (15) 日宣布，與日本企業健康保險組合 (Kenpo) 的服務，再次獲得日立 (Hitachi) 與 NTT 選用，明年將持續提供兩大企業集團員工相關照護計劃，有望進一步提升在日企業健保市占率，帶動營收倍速成長。,https://m.cnyes.com/news/id/6276019
407,6275721,馬斯克：在地球上蓋小型核電「愚蠢至極」,主張在太空蓋資料中心的億萬富翁馬斯克 (Elon Musk)，周一 (15 日) 在社群平台 X 上，公開表達對核電的強烈質疑，他批評，在地球上建造小型核電反應爐「簡直愚蠢至極」。,https://m.cnyes.com/news/id/6275721
408,6275992,保健食品開發商遠東生技2026年拚雙位數成長 將尋求儘快上櫃,微藻生技應用及保健食品開發業遠東生技董事長闕壯群今日指出，遠東生技登錄興櫃交易已逾 2 年，將儘速申請上櫃交易。,https://m.cnyes.com/news/id/6275992
409,6275993,穩定幣論壇登場 金管會副主委：虛擬資產專法最快明年H1起執行,貿協今 (15) 日心舉辦「穩定幣與國際貿易未來論壇」，也邀新加坡 Circle、日、韓等產業協會及 Visa 等亞洲鄰國支付業者來台分享穩定幣相關規範。金管會表示，預計針對穩定幣立專法，專法估最快將於明年上半年開始執行。,https://m.cnyes.com/news/id/6275993
410,6275848,台積電 鴻海 旺宏 精測 下個買點? 【凱崴 第2】目標翻倍,,https://m.cnyes.com/news/id/6275848
411,6274497,華爾街認為2026科技巨頭「非主流」！資金將轉向醫療、工業等產業與小型股,華爾街共識浮現：科技七巨頭高估值引發疑慮，美銀、摩根士丹利看好 2026 年資金大輪動，資金可望轉向金融、工業、醫療與中小型股，標普 493 盈餘成長成關鍵指標。,https://m.cnyes.com/news/id/6274497
412,6275388,禾榮科攜新加坡醫學研究中心 共同建置東南亞AB-BNCT研發中心,禾榮科 (7799-TW) 今 (15) 日宣布，與新加坡國立大學醫院 (NUH) 及新加坡科技研究局生物處理技術研究院 (A*STAR BT1) 簽署合作協議，將在新加坡共同建置東南亞首座加速硼中子捕獲 (AB-BNCT) 研發中心。,https://m.cnyes.com/news/id/6275388
413,6275986,公司戶也適用！台中銀逆勢推美元優利定存 短存期最高享4.25%限時搶,美國聯準會 (Fed) 連三降息，台中銀行逆勢推出限時美元優利定存「美利 SUPER HIGH」專案，以具市場競爭力的高利率協助客戶提早布局。本專案採三個月短存期設計，即日起至 2025 年 12 月 31 日限時受理,https://m.cnyes.com/news/id/6275986
414,6275549,持續14年的新興市場貨幣周期改變？川普似乎真的帶來改變,長期以來，諸如匈牙利元福林 (forint) 這類貨幣，一直被視為新興市場 (EM) 的小眾。但自美國總統川普 1 月就職以來，福林的交易量已成長超過一倍，尤其是在他宣布「解放日」全面進口關稅政策之後，交易員對福林的興趣更是與日俱增,https://m.cnyes.com/news/id/6275549
415,6275854,〈國泰金看經濟〉徐之強示警AI紅利下一挑戰 程淑芬看硬體設備廠明年機會都不錯,國泰金 (2882-TW) 攜手台大產學團隊今 (15) 日舉辦 2025 年第 4 季台灣「經濟氣候暨金融情勢」發表會，教授徐之強指出，受惠全球 AI 投資大爆發，台灣今年經濟成長率預測值大幅上修至 7.4%，,https://m.cnyes.com/news/id/6275854
416,6274668,谷歌、OpenAI被捲入？神秘帳戶一夜狂賺百萬 預測市場再掀內線爭議,,https://m.cnyes.com/news/id/6274668
417,6275951,瑞鼎強攻Micro LED 取得品牌客戶訂單, 瑞鼎 (3592-TW) 今 (15) 日宣布，自主研發的「穿戴式微發光二極體顯示驅動積體電路(Wearable Micro LED Display Driver IC)」已成功導入品牌客戶，並已進入量產，該方案也榮獲「114,https://m.cnyes.com/news/id/6275951
418,6275894,聯電致力ESG 四度榮獲CDP氣候變遷與水安全雙A殊榮,聯電 (2303-TW)(UMC-US) 今 (15 日) 宣布於 2025 年度 CDP 評比中，在「氣候變遷」與「水安全」兩大領域再度獲得最高「A」評級，成為全球半導體業唯一連續四年獲得雙 A 領導級殊榮的企業，在溫室氣體減量及水資源管理,https://m.cnyes.com/news/id/6275894
419,6275892,晶技1-11月稅前盈餘19.99億元年減15% 每股稅前賺5.82元,晶技今 (15) 日公布最新獲利資訊，11 月單月稅前盈餘爲 2.05 億元，月增 10.81%，但年減 8.4%，單月每股稅前盈餘 0.58 元。晶技自結 1-11 月自結稅前盈餘 19.99 億元，年減 15.4%，每稅前盈餘爲 5.82 元。,https://m.cnyes.com/news/id/6275892
420,6275856,穩定幣論壇今登場 吸引近400位台灣企業業者到場汲取亞洲各國經驗,貿協今日舉辦「穩定幣與國際貿易未來論壇」，邀集新加坡 Circle，日、韓等產業協會，全球支付領導企業 Visa 等國內外業者分享，以完整的跨國亞洲視角，協助企業掌握更充分、可靠的資訊，並吸引來自近 400 位傳產、科技業者到場。,https://m.cnyes.com/news/id/6275856
