,newsId,title,summary,link
1039,6185851,外媒評中國加強稀土出口管制：提升貿易談判籌碼,中國商務部發布最新稀土出口管制規定，涵蓋半導體及高科技材料，旨在維護國家安全並應對美國出口限制，此舉引發國際關注並影響美國供應鏈。,https://m.cnyes.com/news/id/6185851
1040,6185611,麥格理：Fed仍是「不情願的鴿派」,市場普遍押注聯準會 (Fed) 將於 10 月 29 日再次降息，但投行麥格理 (Macquarie) 警告，這項預期「過於樂觀」，實際降息機率可能僅為市場估計的一半。,https://m.cnyes.com/news/id/6185611
1041,6185289,〈熱門股〉10月載板漲價逾1成 景碩三天飆漲22%,外資本周指出 ABF 載板及 BT 載板後續價格看漲，10 月漲幅至少 1 成，推升整體族群走強，景碩 (3189-TW) 漲勢最為兇猛，本周三個工作天漲幅高達 22.77%，並創下近三年來新高，南電 (8046-TW) 與欣興 (3034-TW,https://m.cnyes.com/news/id/6185289
1042,6185802,蘋果組織大搬風！健康團隊擬併入服務部門 打造新營收動能,,https://m.cnyes.com/news/id/6185802
1043,6185684,超越DeepSeek、Gemini 與 OpenAI！三星AI小模型TRM超強,三星最新 AI 小模型 TRM 以僅 7 百萬參數，透過自我遞迴與多輪推理，超越大型語言模型（LLM），效能媲美 DeepSeek R1、Google Gemini 2.5 Pro 及 OpenAI o3-mini。,https://m.cnyes.com/news/id/6185684
1044,6182828,美股進入泡沫了嗎？高盛：至少目前還沒,高盛 (Goldman Sachs) 表示，股市確實出現了「與以往泡沫時期相似的跡象」，但強調當前漲勢，特別是科技股的上漲，「迄今主要仍是由基本面成長所推動，而不是非理性投機」。,https://m.cnyes.com/news/id/6182828
1045,6185471,〈熱門股〉精誠營收寫新猷 股價反彈逾1成寫半年來高點,〈熱門股〉精誠營收寫新猷 股價反彈逾 1 成寫半年來高點,https://m.cnyes.com/news/id/6185471
1046,6185612,全球資金轉向價值股「成長型基金」成最大贖回目標,全球投資人資金流向出現明顯轉變，隨著美股估值高企與財政壓力升溫，投資人正加速撤出美國「成長型」基金，轉而投入美國以外的「價值型」與中小型股票。,https://m.cnyes.com/news/id/6185612
1047,6185500,大立光法說、台積電Q3營收創高、CPI創近4年半以來新低 本周大事回顧,大立光 9 日召開法說會，執行長林恩平指出，客戶 10 月拉貨力道與 9 月相當，預期 11 月將下滑；台積電 9 月營收 3309 億元，第三季營收 9899 億元，創單季新高；行政院主計總處 8 日發布 9 月物價變動概況，CPI 創近 4 年半最低水準。,https://m.cnyes.com/news/id/6185500
1048,6185660,CPI報告趕工中！BLS召回員工 有望趕在Fed本月會議前發布,,https://m.cnyes.com/news/id/6185660
1049,6185501,〈熱門股〉台積、台達神助攻！0050再寫新天價 分割以來噴漲逾3成,輝達執行長黃仁勳接受採訪時強調 AI 晶片需求強勁，此外，聯準會會議記錄「鴿聲嘹亮」，推升後續降息預期，台股 9 日由權值股領軍攻上 27463 點歷史新高，絕不錯過台股漲勢的元大台灣 50(0050-TW),https://m.cnyes.com/news/id/6185501
1050,6185799,AI產業金流成閉環 宛如洗錢交易？大摩：別怕！這些AI交易屬實 但企業應公布更多細節,人工智慧的發展正在形成一個封閉而強大的循環：晶片讓 AI 更聰明，AI 推動雲端成長，雲端又反過來創造更多 AI 需求。輝達、微軟與 OpenAI 成為這場科技革命的核心推手，並引發了對 AI 需求透明度的討論。,https://m.cnyes.com/news/id/6185799
1051,6185710,特斯拉薪酬方案驚人！路透：馬斯克未達高難度目標也可入袋數百億,"特斯拉董事會為馬斯克設計企業史上最大薪酬方案，價值高達 8,780 億美元股票。即使未完成全部目標，馬斯克仍可能輕鬆獲得數百億薪資，方案涉及自動駕駛、機器人技術及公司市值增長。",https://m.cnyes.com/news/id/6185710
1052,6185421,〈熱門股〉麗臺認列輝達工作站專案營收暴衝 轉骨動能激勵本周飆漲逾3成,板卡廠麗臺 (2465-TW) 日前公告受惠於認列中國移動的 AI 輝達伺服器專案營收， 9 月營收暴衝至 14.26 億元，創歷史新高，市場看好麗臺 AI 伺服器業務已發酵，激勵本周股價走強，飆出三根漲停，9 日收 75.5 元，周,https://m.cnyes.com/news/id/6185421
1053,6185677,俄羅斯批准與古巴、多哥軍事合作協議！普丁對俄烏戰爭強硬表態,俄羅斯聯邦委員會批准與古巴、多哥簽署軍事合作協議，普丁強調將無條件完成烏克蘭戰爭目標。協議凸顯俄羅斯在拉美與非洲的軍事擴張，並引發古巴、多哥卷入戰爭的爭議。,https://m.cnyes.com/news/id/6185677
1054,6185452,〈熱門股〉iPhone 17熱賣推升台虹亮麗業績 股價爆量突圍周漲10.8%,蘋果 iPhone 17 於市場熱賣的推升之下，FCCL 廠台虹 (8039-TW) 9 月營收以 10.39 億元創史上第四高紀錄，月增 10.76%，年增 18.78%，預估 10 月仍有強勢營收，股價本周連三日上漲，收在 65.5 元。,https://m.cnyes.com/news/id/6185452
1055,6185383,〈熱門股〉銅價飆升、台電強韌電網計畫挹注 華新起飛周漲逾2成,全球第二大銅礦「印尼 Grasberg」礦場發生事故，市場擔心銅供應短缺，銅價於周三 (8 日) 一度觸及 16 個月以來高點，達 10815 美元，華新 (1605-TW) 受此消息激勵，加上台電強韌電網計畫挹注，本周大漲逾 2 成。 ,https://m.cnyes.com/news/id/6185383
1056,6185422,客戶端仍在調整供應鏈 榮惠-KY 9月營收1.21億元年減21%,PCB 廠榮惠 - KY 公布最新營收資訊，2025 年 9 月營收 1.21 億元，月減 7.74%，年減 21.38%，1-9 月營收 12.67 億元，年減 1.99%，榮惠 - KY 董事長劉世璘指出，目前營運表現仍受客戶供應鏈調整影響。,https://m.cnyes.com/news/id/6185422
1057,6185676,美國將派200名士兵赴以色列！監督加薩停火協議與哈瑪斯人員交換,美國宣布將派遣約 200 名士兵前往以色列，監督加薩停火協議執行情況。以色列政府已批准與哈瑪斯的停火協議，規劃以軍重新部署、釋放被扣押人員，並允許人道援助進入加薩。,https://m.cnyes.com/news/id/6185676
1058,6185617,美股重點新聞摘要2025年10月10日,美股重點新聞摘要 2025 年 10 月 10 日,https://m.cnyes.com/news/id/6185617
1059,6185610,經濟學家：美國已出現「精簡版」殖利率曲線控制,美國政府正採取行動限制美債殖利率上升。分析指出，財政部與聯準會 (Fed) 聯手操作，實質上已形成「精簡版」殖利率曲線控制，以確保龐大財政赤字籌資順利進行。,https://m.cnyes.com/news/id/6185610
1060,6184940,投資級債新王誕生！AI企業佔比14% 背後藏1.2兆美元風險​ 專家：AI信貸崩潰比股災更致命​,,https://m.cnyes.com/news/id/6184940
1061,6185674,營收速報 - 2025年10月10日台股大型公司9月營收一覽（新增123家）,9月台股營收公布，2025年10月針對大型公司前一日公布123家營收。截至目前9月營收公布共計184家，其中營收年增大於+25％有35家，年增小於-20％有26家。| Anue鉅亨- 台股營收,https://m.cnyes.com/news/id/6185674
1062,6185670,李強拜會金正恩 金正恩：堅決反對台獨分裂行徑,中共中央政治局常委、中國國務院總理李強周四（9 日）在平壤北韓勞動黨中央委員會拜會勞動黨總書記、國務委員長金正恩，金正恩說，堅決反對台獨分裂行徑。,https://m.cnyes.com/news/id/6185670
1063,6185662,中國收緊稀土出口管制 新增五種受限稀土元素 封鎖晶片、軍用應用,中國週四 (9 日) 大幅擴大稀土出口管制範圍，新增五種稀土元素進入受限名單，並強化對半導體應用用戶的審查，意在於科技與國防領域加強掌控。,https://m.cnyes.com/news/id/6185662
1064,6185492,歐元區首例！盧森堡主權財富基金投資比特幣,盧森堡金融中心發展署一位代表表示，盧森堡主權財富基金已將資產的 1% 投入比特幣 ETF，成為歐元區首個進行此類投資的國家級基金。,https://m.cnyes.com/news/id/6185492
1065,6185613,挪威因川普施壓而繃緊神經 諾貝爾和平獎前夕氣氛緊張,在 2025 年諾貝爾和平獎公布前夕，挪威政界正緊張觀察美國總統川普的動向，擔憂一旦他未獲獎，可能對美挪關係帶來衝擊。分析人士警告，川普可能祭出關稅、要求提高北約分攤，甚至宣稱挪威是敵國。,https://m.cnyes.com/news/id/6185613
1066,6185626,哪來的泡沫？分析師稱輝達「為奔馳而生」市值上看7兆美元,輝達股價周四 (9 日) 收漲 1.8%，盤中一度漲 2.5%，創下 52 周新高，此前 Cantor Fitzgerald 分析師 C.J. Muse 將該 AI 巨頭的目標價調升至每股 300 美元，為華爾街最高預期。,https://m.cnyes.com/news/id/6185626
1067,6185631,萬聖節巧克力恐變貴！西非產量崩跌 全球可可短缺49.4 萬公噸 逾60年最大缺口,由豪雨與乾旱攪動的西非氣候危機，使全球可可供應驟降；象牙海岸、加納產量大幅萎縮，造成近五十萬公噸缺口。加上美國對進口國徵高關稅，巧克力成本被迫翻倍上揚，恐讓節日甜點的價格短期難以回落。,https://m.cnyes.com/news/id/6185631
1068,6185654,航空競爭升溫 川普政府擬禁中國航班經俄羅斯飛美,據《路透》報導，美國川普政府周四 (9 日) 提出新規，擬禁止中國航空公司在往返美國的航班中飛越俄羅斯領空，理由是這種做法讓美國航空業者處於劣勢。,https://m.cnyes.com/news/id/6185654
1069,6185628,再敢向伊朗買油！美拿中國煉油廠開刀 祭100個制裁目標,美國宣布針對約 100 人與機構實施制裁，包括中國山東晉城石化及日照石化碼頭，指控其長期從伊朗購油並協助石油網絡運作。此舉在以色列與哈馬斯達成停火協議之際，再次凸顯美政府對中東與能源交易路線的高度警戒。,https://m.cnyes.com/news/id/6185628
1070,6185632,〈貴金屬盤後〉獲利了結賣壓湧現 金價跌破4000美元 白銀從歷史高點回跌,,https://m.cnyes.com/news/id/6185632
1071,6185633,美國金援阿根廷滙市 簽200億美元貨幣互換框架,美國財政部長貝森特週四 (9 日) 宣布，美國與阿根廷央行敲定了一項 200 億美元的貨幣互換框架。,https://m.cnyes.com/news/id/6185633
1072,6185649,鉅亨速報 - Factset 最新調查：超微半導體AMD-US的目標價調升至234.72元，幅度約6.69%,FactSet 最新調查：超微半導體AMD-US目標價調升，最高估值、最低估值、中位數、綜合評級、近5日股價、標普、即時新聞資訊,https://m.cnyes.com/news/id/6185649
1073,6185620,摩根大通戴蒙：美股正面臨急劇下跌風險,摩根大通 (JPMorgan Chase) 執行長戴蒙 (Jamie Dimon) 表示，美國股市正面臨嚴重下跌的風險，未來 6 個月至 2 年內可能出現急劇修正。,https://m.cnyes.com/news/id/6185620
1074,6185453,〈能源盤後〉加薩停火協議簽定 Brent應聲下跌1.6%,以色列與巴勒斯坦激進組織哈馬斯簽署加薩停火協議後，原油期貨價格周四 (9 日) 收低。,https://m.cnyes.com/news/id/6185453
1075,6185616,〈紐約匯市〉美元觸及兩個月新高 市場關注全球政治動向,美元周四 (9 日) 上漲，由於美國缺乏新的經濟數據，海外政治風險成為市場焦點，美元一度升至兩個月來最強水準。,https://m.cnyes.com/news/id/6185616
1076,6185609,〈美股盤後〉美股漲勢暫歇 標普那指自歷史高點回落,投資人消化聯準會官員談話與企業財報表現，科技股則暫時降溫，標普 500 指數週四 (9 日) 自盤中創下歷史新高後回落，終場收低 0.3%。,https://m.cnyes.com/news/id/6185609
1077,6185417,老牌德系豪華車 加速失去中國市場,在經歷上半年銷量滑坡後，德系豪華車廠第三季在中國市場的表現並未改善。,https://m.cnyes.com/news/id/6185417
1078,6185579,路由器龍頭TP-Link陷國安風暴 美國考慮限制或禁令,《彭博》周四 (9 日) 引述知情人士報導，川普政府正考慮限制中國路由器製造商 TP-Link Systems 在美業務，可能發布「初步裁定」認定其構成國安威脅。此舉正值川普與習近平本月底會談前夕，引發市場關注。,https://m.cnyes.com/news/id/6185579
1079,6180833,【袁志峰專欄】港股表現分化，國企股上揚,"今日推介 - 華潤電力 (836, $18.29), 目標價 $20.0, 止損價 $17.5",https://m.cnyes.com/news/id/6180833
1080,6185242,"睽違十年！中國A股再上3,900點 每6人就有1名股民","節後首個交易日，中國 A 股三大指數周四（9 日）集體高開，上證指數盤中震盪上行，成功突破 3,900 點關口，創下近十年以來新高。",https://m.cnyes.com/news/id/6185242
1081,6185555,93億美元也不賣！墨國礦業大亨收購碰壁 花旗堅守Banamex出售原計劃,綜合外媒周四 (9 日) 報導，花旗集團 (C-US) 拒絕墨西哥礦業大亨 German Larrea 旗下集團 Grupo Mexico 對其墨西哥金融業務 Banamex 的 93 億美元收購提案。,https://m.cnyes.com/news/id/6185555
1082,6185271,娃哈哈宗馥莉傳被「帶走」 知情人士回應！,近日繼娃哈哈董事長宗馥莉心腹嚴學峰被曝「被調查」的消息之後，杭州坊間傳出宗馥莉被帶走的消息。據《第一財經》報導，一位接近娃哈哈知情人士透露，宗馥莉周四（9 日）正常上班。,https://m.cnyes.com/news/id/6185271
1083,6182862,科技巨頭財報季倒數 華爾街聚焦「AI投資成績單」,,https://m.cnyes.com/news/id/6182862
1084,6185564,美國政府關門第九天 川普放話切斷民主黨資金,美國總統川普周四 (9 日) 表示，他的政府計畫藉由正在進行的政府關門，永久削減部分受到民主黨支持的計畫與經費，進一步加深國會僵局。這場關門始於 10 月 1 日，截至目前已進入第九天，仍看不到化解跡象。,https://m.cnyes.com/news/id/6185564
1085,6185493,美股要小心了！估值過高引發泡沫爭議,《路透》周四 (9 日) 報導，美股今年強勁上漲，標普 500 與那斯達克本周再創新高，道瓊工業指數也累計上漲約 10%，在人工智慧題材推動下，市場情緒高昂。然而，隨著估值持續升高，投資人愈來愈擔心泡沫風險，部分機構領袖更警告可能出,https://m.cnyes.com/news/id/6185493
1086,6185515,達拉斯Fed：溫和就業成長非疲軟 而是市場的新平衡,據《彭博》周四 (9 日) 報導，達拉斯聯邦儲備銀行最新研究指出，美國移民放緩使維持失業率穩定所需的就業成長大幅下降。「損益兩平就業率」已從 2023 年約 25 萬人降至今年中的 3 萬人，意味近期就業數據疲軟可能不如外界擔憂。,https://m.cnyes.com/news/id/6185515
1087,6185479,Shein接連遭歐洲重罰逾1.9億歐元 急推改革計畫止血,《路透》周四 (9 日) 報導，快時尚電商巨頭 Shein 近月在歐洲連環遭罰，涉及用戶隱私、假折扣與漂綠等爭議，罰款總額逾 1.9 億歐元。該公司高層在致投資人的信件中表示，已啟動內部治理改革，包括成立「商業誠信小組」(Busine,https://m.cnyes.com/news/id/6185479
1088,6185503,貝森特：赤字改善證明川普經濟政策有效,據《彭博》周四 (9 日) 報導，美國財政部長貝森特援引國會預算辦公室 (CBO) 數據指出，2025 財年赤字占 GDP 比例估計為 5.9%，低於 2024 年財政部公布的 6.4%，證明川普經濟政策奏效且未引發衰退。,https://m.cnyes.com/news/id/6185503
1089,6185394,高市早苗核心經濟顧問：日銀不宜急於再升息,根據《路透》報導，日本前內閣特別顧問、本田悅朗 (Etsuro Honda) 周四 (9 日) 受訪表示，日本經濟仍處於復甦初期，建議日銀 (日本央行 / BOJ) 在利率政策上保持謹慎，避免過早再度升息。他是自民黨總裁選舉新任黨魁高市早,https://m.cnyes.com/news/id/6185394
1090,6185489,Sora五天破百萬下載 版權爭議卻成燙手山芋,據《CNBC》周四 (9 日) 報導，OpenAI 生成式影音 AI 應用程式 Sora，在 9 月底推出後不到五天，下載量就突破 100 萬次，但同時也因版權爭議陷入風暴。電影協會 (MPA) 指控該平台充斥侵權內容，要求立即採取行動。,https://m.cnyes.com/news/id/6185489
1091,6185472,高市早苗淡化「升息愚蠢論」 力圖平息市場疑慮,據《彭博》周四 (9 日) 報導，日本新任自民黨總裁高市早苗試圖澄清市場對其政策立場的疑慮。她在專訪中強調無意讓日圓過度貶值，並淡化過去對日銀升息的批評言論，試圖緩解市場對其寬鬆政策取向可能延緩日銀升息步伐的擔憂。,https://m.cnyes.com/news/id/6185472
1092,6185491,「小台積」0052分割案通過1拆7 每張入手價可望降到3萬多元,有「小台積」之稱的富邦科技 ETF(0052-TW) ，於今年 8 月初正式啟動分割計畫，並於 9 月 25 日以書面方式召開受益人會議，最終以贊成率達 98.78% 高票通過分割案，將以「1 拆 7」方式進行分割，,https://m.cnyes.com/news/id/6185491
1093,6185451,AI筆電新武器！英特爾首款18A製程晶片Panther Lake年底前出貨,晶片大廠英特爾 (INTC-US) 周四 (9 日) 公布即將推出的新一代筆電處理器「Panther Lake」細節，這將是該公司首款採用 18A 先進製程打造的個人電腦 (PC) 晶片。此舉被視為英特爾昂貴轉型計畫的重要里程碑，市場將藉,https://m.cnyes.com/news/id/6185451
1094,6185443,AI泡沫警報響不停 華爾街：安啦！企業體質遠勝.Com時期,根據《商業內幕》周四報導，儘管傳統估值指標顯示美國股市過熱，但摩根士丹利 (MS-US) 和高盛 (GS-US) 本周發布研究報告指出，考量獲利成長、現金流和利潤率後，AI 股票估值並未過高，當前企業體質遠優於網路泡沫時期。,https://m.cnyes.com/news/id/6185443
1095,6185319,特斯拉FSD再遭美監管機構調查 涉多起闖紅燈與碰撞事件,《彭博》周四 (9 日) 報導，美國國家公路交通安全管理局 (NHTSA) 對特斯拉 (TSLA-US) 的「完全自動駕駛」(Full Self-Driving，FSD)系統展開新一輪調查，原因是部分車輛在啟用後出現闖紅燈與違反交通法,https://m.cnyes.com/news/id/6185319
1096,6185332,美國第三季充電站佈建數創新高 業者看好需求持續,《彭博》周四 (9 日) 報導，儘管美國取消電動車聯邦稅收抵免，充電基礎設施仍快速擴張。第三季新增 780 座公共高速充電站，創歷史新高，今年前九個月充電設施成長 19%。,https://m.cnyes.com/news/id/6185332
1097,6185416,街口電支8月代收付金額連3跌 金管會：業務已回穩、持續監理,金管會公布最新統計，全支付 8 月穩居電支交易霸主，代理收付實質交易款項金額逆勢成長 16%，街口電支則呈連 3 月下滑，母公司街口金科與泰山公司股權交易糾紛近期再度槓上，引發外界憂心,https://m.cnyes.com/news/id/6185416
1098,6185365,Fed三把手：支持今年再降息 就業市場降溫仍非衰退訊號,紐約聯準銀行總裁威廉斯 (John Williams) 表示，考量到就業市場可能進一步放緩，他支持今年再降息，與聯準會 (Fed) 最新會議紀錄釋出的訊號一致。不過他同時強調，雖然勞動市場出現降溫，但這並不意味經濟即將陷入衰退。,https://m.cnyes.com/news/id/6185365
1099,6185427,康舒9月營收31億元月增15% Q3季增近1成,康舒 9 月營收 31 億元月增 15% Q3 季增近 1 成,https://m.cnyes.com/news/id/6185427
1100,6185263,〈美股早盤〉主要指數平盤波動 投資人等待新訊號,美股主要指數周四 (9 日) 開盤走勢平淡，標普 500 指數在前一日創下歷史新高後暫歇整理。在聯準會 (Fed) 主席鮑爾釋出新的政策訊號之前，投資人只能依賴既有經濟數據來研判前景，市場同時也出現漲多後的降溫跡象，顯示華爾街自 4 月低,https://m.cnyes.com/news/id/6185263
1101,6185384,國人前8月信用卡刷出3.27兆元創史上新高 總流通卡數首破6000萬張,金管會今 (9) 日公布統計，2025 年 8 月全台信用卡簽帳金額 3763 億元，創歷年同期新高，但較上月衰退逾 4 成；累計前 8 月簽帳金額達 3 兆 2794 億元，同為歷史新高，年增 5.54%。,https://m.cnyes.com/news/id/6185384
1102,6185401,亞泥9月營收月增12.8% 兩岸市場發貨穩定,亞泥 9 月營收月增 10% 兩岸市場發貨穩定,https://m.cnyes.com/news/id/6185401
1103,6184721,Sora爆紅 首周下載量超越ChatGPT 確立AI影音新浪潮,繼 ChatGPT 創造歷史性的發布紀錄後，OpenAI 的影片生成應用程式 Sora 在 iOS 平台上的首次亮相，成功複製了其驚人的下載動能，甚至在首周總下載量上略勝一籌。,https://m.cnyes.com/news/id/6184721
1104,6185357,Google搶攻AI市場推Gemini企業版 與微軟、OpenAI競爭,綜合外媒周四 (9 日) 報導，Google 雲端部門推出 AI 平台 Gemini Enterprise 鎖定大企業用戶，另針對小企業推出 Gemini Business 方案，直接挑戰微軟、OpenAI 同類產品。,https://m.cnyes.com/news/id/6185357
1105,6185266,法拉利股價一度崩16% 電動車夢縮水讓投資人心碎,義大利超跑製造商法拉利 (Ferrari)(RACE-US) 周四 (9 日) 歐洲股價重挫逾 16%，盤中一度創下 2016 年在米蘭掛牌以來最大單日跌幅。公司在資本市場日 (CMD) 上調今年財測，但對 2030 年長期營,https://m.cnyes.com/news/id/6185266
1106,6184634,AI熱潮推動資料中心電力需求激增 美國家庭面臨「電力危機」,隨著人工智慧 (AI) 技術的迅猛發展，對算力的需求空前激增，美國資料中心的電力消耗正以驚人的速度飆升。這一浪潮正在直接推高美國的居民用電價格，且漲幅遠超通貨膨脹率，導致電費帳單已成為美國普通民眾「生命不能承受之重」。,https://m.cnyes.com/news/id/6184634
1107,6185333,諾和諾德52億美元購併Akero 搶攻肥胖併發症市場,丹麥藥廠諾和諾德 (Novo Nordisk) 周四 (9 日) 宣布將以最高 52 億美元收購美國肝病生技公司 Akero Therapeutics，藉此擴大產品線，降低對減肥藥 Wegovy 和糖尿病藥 Ozempic 的依賴。,https://m.cnyes.com/news/id/6185333
1108,6185316,俄油繞道！台灣與印度成石腦油大買家 8月進口量倍增,《路透》周四 (9 日) 報導，根據 LSEG 與市場來源數據，俄羅斯 8 月的海運石腦油 (Naphtha) 出口主要流向台灣與印度，因價格較低吸引買家。自 2023 年 2 月歐盟全面禁止進口俄羅斯石油產品以來，中東與亞洲國家逐漸成為俄羅斯石,https://m.cnyes.com/news/id/6185316
1109,6184627,蔡崇信深度解析中美科技競局與阿里巴巴轉型：AI應用才是勝負關鍵,在近期的 All-In 2025 峰會上，阿里巴巴集團共同創辦人兼董事局主席蔡崇信，與被譽為「白宮 AI 沙皇」的 David Sacks 展開深度對談，就中美科技競爭、阿里巴巴的戰略轉型，以及通用人工智慧 (AGI) 的未來等熱點議題,https://m.cnyes.com/news/id/6184627
1110,6185354,鉅亨速報 - Factset 最新調查：超微半導體AMD-US的目標價調升至220元，幅度約4.76%,FactSet 最新調查：超微半導體AMD-US目標價調升，最高估值、最低估值、中位數、綜合評級、近5日股價、標普、即時新聞資訊,https://m.cnyes.com/news/id/6185354
1111,6185340,鉅亨速報 - Factset 最新調查：奇異GE-US的目標價調升至324元，幅度約3.18%,FactSet 最新調查：奇異GE-US目標價調升，最高估值、最低估值、中位數、綜合評級、近5日股價、標普、即時新聞資訊,https://m.cnyes.com/news/id/6185340
1112,6185338,鉅亨速報 - Factset 最新調查：聯合健康保險UNH-US的目標價調升至378元，幅度約8%,FactSet 最新調查：聯合健康保險UNH-US目標價調升，最高估值、最低估值、中位數、綜合評級、近5日股價、標普、即時新聞資訊,https://m.cnyes.com/news/id/6185338
1113,6185320,合庫金前三季賺162億 EPS 1.03元 銀行前9月獲利創同期新高,合庫金控（5880-TW）今（9）日公布自結盈餘，9 月合併稅後純益 19.09 億元，較上月的 19.47 億元月減 1.95%，較去年同期的 15.32 億元年增 24.61%；累計 2025 年前九月稅後純益 162.38 億元，年增 0.0,https://m.cnyes.com/news/id/6185320
1114,6185264,EA收購後試金石：《戰地風雲6》能撼動《決勝時刻》市場地位？,《路透》周四 (9 日) 報導，遊戲大廠美商藝電 (Electronic Arts)(EA-US) 本周將推出射擊遊戲新作《戰地風雲 6》(Battlefield 6)，寄望這款作品能扭轉系列前作《戰地風雲 2042》(Battlef,https://m.cnyes.com/news/id/6185264
1115,6184720,中國官方：8天國內出遊8.88億人次 總花費逾8千億,據陸媒《證券時報》報導，2025 年國慶與中秋假期疊加形成長達八天的超級黃金周，帶動中國文旅市場熱度攀升，多項指標創下歷史新高。據文化和旅遊部數據中心測算，國慶中秋假日期間，全國國內出遊人次達到 8.88 億，相較於 2024 年,https://m.cnyes.com/news/id/6184720
