,newsId,title,summary,link
0,6279675,雲端五強瘋蓋資料中心 克雷默：甲骨文若「有點分寸」 過熱的AI投資可望降溫,《CNBC》名嘴克雷默指出，若甲骨文在 AI 投資上展現財務紀律，可能迫使雲端巨頭放慢資料中心擴張腳步。隨著 OpenAI 承諾的數千億美元支出與甲骨文發債引發疑慮，市場開始關注 AI 燒錢競賽是否即將降溫。,https://m.cnyes.com/news/id/6279675
1,6279538,逾120%！白銀今年較黃金多漲逾一倍 憑什麼成貴金屬「黑馬」？,,https://m.cnyes.com/news/id/6279538
2,6278944,年輕人崩潰預警！38兆美債「吸血」未來 經濟成長、利率、薪資三面被鎖死,,https://m.cnyes.com/news/id/6278944
3,6279656,博通五天跌逾19% 輝達挫近4% AI股票怎麼了？,近幾周對資料中心建設所需債務融資能力的疑慮持續攪動人工智慧 (AI) 題材，晶片製造商博通 (Broadcom)(AVGO-US) 股價周三重挫 4.48%，連續第五個交易日走低，其他晶片股也同步走弱。,https://m.cnyes.com/news/id/6279656
4,6279653,〈紐約匯市〉美元漲 英鎊跌 英通膨數據暗示英央將降息 ,美元周三 (17 日) 走升，投資人等待其他央行的政策決議，並消化美國聯準會 (Fed) 官員的最新談話。英鎊則因英國通膨意外下滑走弱，幾乎確定英國央行 (BoE) 將降息。,https://m.cnyes.com/news/id/6279653
5,6279369,〈能源盤後〉川普下令封鎖委內瑞拉油輪 緩解供應過剩擔憂 原油自五年低點反彈逾1%,川普下令封鎖受制裁油輪進出委內瑞拉，引發地緣政治緊張升溫，國際油價自近五年低點反彈逾 1%。不過，美國燃料庫存增加，與供應實際影響仍不明朗，令後市走勢充滿變數。,https://m.cnyes.com/news/id/6279369
6,6279667,受AI融資不確定性拖累 費半重挫超3.7%,《Marketwatch》週三 (17 日) 報導，AI 概念股週三再度遭遇沉重賣壓，市場對資料中心建設舉債融資風險的疑慮升高，拖累輝達、博通等科技巨頭同步下挫。,https://m.cnyes.com/news/id/6279667
7,6279595,〈台股盤前要聞〉外資三天賣超1408億元、「太空板王」華通股價飛天、聯電認購欣興現增,台股盤前要聞,https://m.cnyes.com/news/id/6279595
8,6279550,大型投資人樂觀情緒創四年半新高 為何美銀卻說這是最大逆風？,據《商業內幕》周三 (17 日) 報導，美國銀行 (BAC-US)12 月的最新基金經理人調查顯示，機構投資人情緒創下多年新高，多項指標達到數年極值。然美銀警告，投資人可能過度樂觀，接近觸發該行逆向指標的賣出訊號。,https://m.cnyes.com/news/id/6279550
9,6279537,普丁宣布：榛樹飛彈系統年底前進入戰鬥值班狀態,《共青團真理報》等多家媒體周三（17 日）報導，俄羅斯總統普丁在國防部一場會議上宣布，「榛樹」彈道飛彈系統將於今年年底前進入戰鬥值班狀態，有關準備工作正按計畫進行。,https://m.cnyes.com/news/id/6279537
10,6276214,【袁志峰專欄】港股今月仍屬整固階段,"今日推介 - 中信証券 (6030, $27.98), 目標價 $31.0, 止損價 $26.5",https://m.cnyes.com/news/id/6276214
11,6279463,泰軍出動坦克 炮擊柬埔寨境內賭場、電詐基地,據泰國《民族報》報導，臉書上多個賬號周二（16 日）發布泰軍軍事行動影片，泰軍第二軍區裝甲部隊當天動用坦克，炮擊位於賽達古通道（Chong Sai Taku）地區的柬埔寨賭場建築及詐騙團伙基地。,https://m.cnyes.com/news/id/6279463
12,6279356,《大賣空》貝瑞高喊「熊來了」：RMPs計畫凸顯美銀行體系的脆弱 特別點名輝達、特斯拉,《大賣空》麥可 · 貝瑞，因成功預測 2008 年金融危機而聞名，近日再度發出熊市警告，指出美國家庭股票財富已超過房地產，歷史上僅在特定時期出現過此現象，投資者需保持警惕。,https://m.cnyes.com/news/id/6279356
13,6279352,中國前11月財政數據發布 財政收入延續低成長態勢,中國財政部周三（17 日）公布 2025 年 1-11 月財政收支情況，從收入端來看，財政收入延續低增長態勢。,https://m.cnyes.com/news/id/6279352
14,6279629,亞馬遜AGI部門主管年底離職 執行長重組AI團隊因應「關鍵發展期」,據《CNBC》周三 (17 日) 報導，亞馬遜周三證實，通用人工智慧部門主管 Rohit Prasad 將於年底離職。執行長賈西表示，AI 技術已進入關鍵發展期，公司將重組 AI 團隊，由資深副總裁 Peter DeSantis 領導。,https://m.cnyes.com/news/id/6279629
15,6279555,"華爾街搶捧川普兒童投資帳戶！達里歐捐7,500萬美元、貝萊德配對員工子女存款",綜合外媒周三報導，橋水基金創辦人達里歐宣布將為康州約 30 萬名兒童各捐 250 美元，加入「川普帳戶」計畫。貝萊德、紐約梅隆銀行等企業也宣布配對員工子女存款，華爾街競相表態支持川普這項兒童儲蓄計畫。,https://m.cnyes.com/news/id/6279555
16,6279582,關稅真的來了！美國落實瑞士貿易協議,《路透》報導，美國政府周三 (17 日) 確認，已正式啟動與瑞士及列支敦斯登達成的貿易協議架構中，與關稅相關的部分內容。美國貿易代表署 (USTR) 指出，相關關稅措施將依據去年 11 月達成的協議框架執行，並回溯適用至 11 月 14 日。,https://m.cnyes.com/news/id/6279582
17,6279410,騰訊混元世界模型1.5上線 輸入一句話就能生成3D遊戲世界,騰訊周三發布開源的混元世界模型 1.5，用戶只需輸入文字描述或圖片，就能創建可互動的虛擬世界。該模型具備空間記憶能力，可呈現前後一致的場景，支援用戶在生成的世界裡自由移動探索，可應用於 AI 遊戲開發、影視製作和 VR。,https://m.cnyes.com/news/id/6279410
18,6279609,Google再出招！低成本Gemini 3 Flash全面上線 AI戰火升溫,Alphabet 旗下 Google(GOOGL-US)周三 (17 日) 宣布，正式在旗下產品中推出更高效率、成本更低的人工智慧 (AI) 模型「Gemini 3 Flash」，延續近期 Gemini 3 系列成功推出後的市場動能，並進,https://m.cnyes.com/news/id/6279609
19,6279412,晶片廠沐曦上市即收漲近700% 中國算力三雄市值突破兆元人民幣,中國高階晶片製造商沐曦周三在上海掛牌，收盤漲幅 692%。繼本月初摩爾線程 IPO 首日飆漲 425% 後，中國本土 AI 晶片廠再掀投資熱潮。中國算力三雄寒武紀、摩爾線程和沐曦總市值已突破 1 兆元。,https://m.cnyes.com/news/id/6279412
20,6279604,AI資料中心金主退場？甲骨文急澄清 盤中股價仍挫近5%,綜合外媒周三 (17 日) 報導，甲骨文 (Oracle) 表示，其位於美國密西根州的資料中心計畫仍「按計畫推進」，並否認私募信貸業者藍鴞資本 (Blue Owl Capital) 參與該專案。此番說法回應英國《金融時報》(FT)引述,https://m.cnyes.com/news/id/6279604
21,6279599,Fed理事華勒釋偏鴿訊號 穩住美債跌勢,美國公債價格周三 (17 日) 跌勢收斂，聯準會 (Fed) 理事華勒 (Christopher Waller) 再度釋出偏鴿訊號，提振市場對利率前景的信心。華勒在《CNBC》論壇上形容美國就業市場「非常疲軟」，並指出目前利率水準仍高,https://m.cnyes.com/news/id/6279599
22,6279487,創46年最大漲幅後多頭未歇！黃金下一站5000美元？,據《路透》周三 (17 日) 報導，黃金在 2025 年寫下自 1979 年石油危機以來最大年度漲幅，過去兩年價格幾乎翻倍，原本這樣的走勢往往意味著市場將迎來一波劇烈修正。不過，隨著投資人結構持續擴大，加上美國政策走向、俄烏戰爭等多重,https://m.cnyes.com/news/id/6279487
23,6279552,Google出手了！不只拚晶片還要拆輝達軟體護城河,《路透》周三 (17 日) 援引知情人士消息報導，Google(GOOGL-US)正展開一項全新行動，試圖從軟體層面削弱輝達 (NVDA-US) 在人工智慧 (AI) 運算市場的長期優勢。據悉，Google 正在推動一項內部稱為「Tor,https://m.cnyes.com/news/id/6279552
24,6279525,Fed華勒支持續降息但強調不急著行動 公債殖利率回穩,據《彭博》周三 (17 日) 報導，聯準會理事華勒表示支持進一步降息，以讓利率回到中性水準，但強調決策者不必急於行動。他重申鴿派立場後，美國公債殖利率回穩。,https://m.cnyes.com/news/id/6279525
25,6279536,西方壟斷要破了？傳中國祕密打造AI晶片設備 半導體戰線升溫,根據《路透》周三 (17 日) 獨家報導，在深圳一處高度戒備的實驗室內，中國科學家打造出一項華府多年來試圖阻止的技術突破——一台可用於製造最先進半導體晶片的原型設備。這種晶片是人工智慧(AI)、智慧型手機與現代武器系統的核心，,https://m.cnyes.com/news/id/6279536
26,6279411,輝達迎來勁敵？亞馬遜砸百億美元投資OpenAI 推自研晶片搶市,綜合外媒報導，OpenAI 正與亞馬遜 (AMZN-US) 初步洽談募資至少 100 億美元，並將採用亞馬遜旗下 AWS 的自研 AI 晶片 Trainium。此交易有助亞馬遜擴大 AI 市場影響力，強化與輝達 (NVDA-US) 的競爭實力。,https://m.cnyes.com/news/id/6279411
27,6279343,〈美股早盤〉Fed理事華勒談話偏鴿 市場押注降息 主要指數漲跌互現,在美國通膨數據即將公布之際，華爾街投資人提前調整部位，美股周三 (17 日) 開盤小幅走高，美國公債跌勢收斂。聯準會 (Fed) 理事華勒 (Christopher Waller) 釋出支持進一步降息的訊號，提振市場情緒，但同時也提醒,https://m.cnyes.com/news/id/6279343
28,6279500,接班鮑爾？Fed華勒本周接受川普面試 強調央行獨立性不容妥協,據《CNBC》周三 (17 日) 報導，聯準會 (Fed) 理事華勒 (Christopher Waller) 表示，本周接受美國總統川普面試時將「絕對會」強調央行獨立性的重要。,https://m.cnyes.com/news/id/6279500
29,6279370,一個會計數字牽動股價！甲骨文RPO成焦點 AI合約錢拿得到嗎？,《華爾街日報》(WSJ) 周三 (17 日) 報導，甲骨文 (ORCL-US) 股價近期劇烈波動，背後關鍵並不只是 AI 題材本身，而是一個過去鮮少受到市場關注、卻逐漸成為投資人檢視未來成長真實性的財務指標——「剩餘履約義務」(Rema,https://m.cnyes.com/news/id/6279370
30,6279414,英國前財長加入OpenAI 推動星門計畫海外擴張,"據《商業內幕》周三 (17 日) 報導，OpenAI 聘請英國前財政大臣 George Osborne 負責「OpenAI for Countries」計畫，推動總額 5,000 億美元的 Stargate AI 基礎建設國際擴張。",https://m.cnyes.com/news/id/6279414
31,6279413,比特幣單月暴跌36%！加密交易所HashKey IPO首日震盪 董事長肖風：野蠻生長時代結束、合規交易所商機大,HashKey 周三 (16 日) 正式登陸港交所，首日走勢劇烈震盪，最終收盤微跌 0.15%。儘管比特幣單月暴跌 36%，董事長兼執行長肖風仍看好產業前景，強調「野蠻生長的時代結束了」，合規交易所將迎來巨大商機。,https://m.cnyes.com/news/id/6279413
32,6279464,電動車逆風未退沒在怕？特斯拉股價狂甩美股七雄,《彭博》周三 (17 日) 報導，特斯拉股價近期強勢走高，刷新歷史新高，漲勢明顯領先多數大型科技股，儘管公司正面臨電動車需求放緩、監管風險升高以及多個主要市場市占下滑等不利因素，但投資人對其人工智慧 (AI) 與自駕技術布局的期待,https://m.cnyes.com/news/id/6279464
33,6279480,壽險業近7年避險支出1.6兆元侵蝕獲利 金管會：四面向改革,面對國內壽險業長期承受沉重的避險負擔，金管會向立法院提交專案報告，將研議調整壽險業匯率會計評價制度，未來可能偏離國際會計準則 (IAS 21) 現行規定，例如將未實現兌換差額改為「分期攤銷」,https://m.cnyes.com/news/id/6279480
34,6279345,〈財報前瞻〉博通、甲骨文失利後AI股信心動搖！美光財報能救場？,美光 (MU-US) 將於美股周三 (17 日) 收盤後公布最新一季財報，市場高度關注。在人工智慧 (AI) 概念股近期震盪加劇、投資人信心出現動搖之際，這家今年表現最亮眼的半導體股之一，正面臨關鍵考驗。投資人關切的不只是業績成長本身,https://m.cnyes.com/news/id/6279345
35,6279451,LINE Pay Money年底註冊估破200萬戶 明年加入北捷、雙北公車乘車碼,LINE Pay(7722-TW) 今 (17) 日舉行首屆「LINE Pay Vision Day」，揭露未來十年發展藍圖，市場最關注的莫過於 12/3 開通服務的 LINE Pay Money，,https://m.cnyes.com/news/id/6279451
36,6279376,OpenAI前研究員加入！騰訊迎來AI強將,《彭博》周三 (17 日) 報導，騰訊 (00700-HK) 任命曾任職於 OpenAI 的研究員姚順雨 (Yao Shunyu)，出任集團首席人工智慧(AI) 科學家，負責統籌公司整體 AI 發展方向。根據騰訊內部備忘錄，姚順雨將直接向總裁,https://m.cnyes.com/news/id/6279376
37,6279415,WBD連七次拒絕派拉蒙收購案！董事會力挺Netflix交易 稱前者報價風險高,據《商業內幕》周三 (17 日) 報導，華納兄弟探索 (WBD-US) 董事會周三 (17 日) 再度拒絕派拉蒙天空舞的收購提案，稱其每股 30 美元的全現金報價「不足且對股東帶來重大風險」，並重申支持 Netflix(NFLX-US) 的現金,https://m.cnyes.com/news/id/6279415
38,6279371,線材廠太空梭11月自結純益年增249% EPS 0.03元,線材廠太空梭 (2440-TW) 今 (17) 日公告 11 月自結損益，稅後純益 400 萬元、年曾 249%、每股純益 0.03 元。,https://m.cnyes.com/news/id/6279371
39,6279377,宏碁董座陳俊聖接任TCA理事長 期許共同致力產業國際化,宏碁董座陳俊聖接任 TCA 理事長 期許共同致力產業國際化,https://m.cnyes.com/news/id/6279377
40,6279373,炎洲處分聯發科212張股票 認列累積盈餘6118萬元,"塑化包材材料股炎洲 (4306-TW) 今 (17) 日發重訊，強調為實現投資，公司處分聯發科 (2454-TW) 有價證券共 21.2 萬股，每單位價格 1462.14 元，交易總金額為 3.09 億元，認列累積盈餘 6,118 萬元。",https://m.cnyes.com/news/id/6279373
41,6279346,普丁若拒停戰？美國制裁大刀已磨好,根據《彭博》周三 (17 日) 援引知情人士消息報導，美國正準備對俄羅斯祭出新一輪制裁，一旦俄羅斯總統普丁拒絕接受與烏克蘭的和平協議，相關措施可能最快在本周公布。據悉，美方此舉旨在加大對莫斯科的施壓力道，特別鎖定俄羅斯能源出口,https://m.cnyes.com/news/id/6279346
42,6278796,AI新創估值過熱成泡沫！Google DeepMind執行長示警：恐難長期維持,Google DeepMind 執行長 Demis Hassabis 警告 AI 新創估值過熱，指出部分早期新創恐形成投資泡沫，並分析 Google 等科技巨頭與 AI 新創估值背後的關鍵差異。,https://m.cnyes.com/news/id/6278796
43,6279355,〈鮮活果汁展望〉要打「世界盃」資金無虞 黃國晃：90%幹部願意追隨,鮮活果汁董事長黃國晃表示，鮮活果汁 -KY 在中國大陸已經營長達 27 年，也規劃要進一步邁向海外打「世界盃」，並已在 12 月赴美國成立據點。,https://m.cnyes.com/news/id/6279355
44,6279344,福特砍掉65億美元電池訂單 與LG能源解決方案合作喊停,南韓電池大廠 LG 能源解決方案 (LG Energy Solution，LGES) 周三 (17 日) 表示，美國車廠福特 (F-US) 已終止一項價值約 9.6 兆韓元、折合約 65 億美元的電動車電池供應合約。LGES 在提交給監管機構的文件,https://m.cnyes.com/news/id/6279344
45,6278088,博通股價三日暴跌18%華爾街反視為買點？摩根大通點名半導體首選,博通股價近日大幅修正，引發市場關注。摩根大通指出，短線回檔反而是布局良機，看好博通在 AI 晶片與網路業務帶動下，未來營收與股價具備強勁成長潛力。,https://m.cnyes.com/news/id/6278088
46,6279347,台對印度出口今年來增3成 三三會籲建立單一窗口協助鴻海等台廠布局,"台灣對印度的出口值為 82.83 億美元,，年增 30.1%，包括三三會企業鴻海、台達電等台廠在當地設廠。三三會理事長林伯豐表示，有台商反應在當地投資上，在土地、電力供給上，遇到問題，希望透過印度政府設立單一窗口，協助台商。",https://m.cnyes.com/news/id/6279347
47,6279291,AI精彩「待續」非泡沫！野村看好2026台股長多 AI驅動鎖定這些周邊產業,隨著聯準會 12 月降息機率大增，全球寬鬆貨幣環境有望支撐風險資產估值。野村投信今（17）日發布 2026 年台股投資展望，強調 AI 產業發展仍十分精彩且並非泡沫 。在資金寬鬆與 AI 供應鏈動能續旺的雙重支撐下，預估,https://m.cnyes.com/news/id/6279291
48,6279287,超商雙雄響應數發部政策 導入「數位憑證皮夾」服務,超商雙雄響應數發部政策 導入「數位憑證皮夾」,https://m.cnyes.com/news/id/6279287
49,6277109,Evercore ISI點名AI風口下7檔工業股！「賣鏟人」策略卡位AI與電力商機,Evercore ISI 看好 AI 資料中心、電氣化與製造業回流帶動電力需求，點名西門子能源、GE Vernova、Hubbell、施耐德電氣等 7 檔工業股並給予買進評等，稱電力市場正迎來 20 年最強設備投資循環。,https://m.cnyes.com/news/id/6277109
50,6279253,〈台幣〉亞幣齊挫！貶破31.5元關鍵價位 續創7個半月新低,美國公布多項因政府關門延後公布的經濟數據，呈現喜憂參半，市場維持聯準會溫和降息預期。主要亞幣今 (17) 日偏貶，台北股匯同步走弱，新台幣兌美元盤中直逼 31.6 元關卡，終場貶勢略收斂，以 31.526 元作收,https://m.cnyes.com/news/id/6279253
51,6279001,外資再砍323億元三天賣超1408億元 轉進這7檔金控大買18.6萬張,台股今 (17) 日遇台指期結算，午盤後翻黑，終場小跌 11 點，收在 27525 點，摜破月線、守季線，外資瞄準電子、傳產進行提款，並將資金轉進金控股，光 7 檔金控股就掃貨 18.6 萬張。,https://m.cnyes.com/news/id/6279001
52,6279257,和泰車明日暫停交易 可能與重大投資案有關,和泰車明日暫停交易 可能與重大投資案有關,https://m.cnyes.com/news/id/6279257
53,6279255,〈鮮活果汁展望〉Q4業績將優於去年同期表現 明年展望也正向,鮮活果汁 - KY (1256-TW) 在旺季效應挹注之下，1-9 月稅後純益 3.15 億元，年增 13.5%，每股純益達 9.32 元，鮮活果汁董事長黃國晃對於業績的展望則提出正向看法。,https://m.cnyes.com/news/id/6279255
54,6278087,輝達股價抗泡沫疑慮！瑞銀：疑慮被過度放大、未看到投資泡沫跡象,市場對 AI 泡沫一度影響輝達股價，但瑞銀分析指出全球 AI 資本支出將持續上升，至 2030 年總可達市場潛力將達 3.1 兆美元，顯示 AI 市場前景穩健。,https://m.cnyes.com/news/id/6278087
55,6279203,墨西哥調高亞洲關稅最高達50% 童子賢：自相矛盾的政策,墨西哥近日調高亞洲關稅，稅率最高達 50%，台灣可能因此受到影響。和碩董事長童子賢今日指出，墨西哥鼓勵國內建置製造基地，以扶植製造業，不過卻對外商在當地工廠需進口的原料課徵高關稅，直言「這不是自己矛盾的政政策嗎」。 ,https://m.cnyes.com/news/id/6279203
56,6279104,不再只是支付！LINE Pay Vision Day揭十年戰略 導入AR實景地圖、AI分析助手,LINE Pay(7722-TW) 今 (17) 日舉行首場「LINE Pay Vision Day」，正式揭櫱下一個十年的發展核心「Be Better」。董事長丁雄注宣布，隨公司成功上市並取得電子支付執照，LINE Pay,https://m.cnyes.com/news/id/6279104
57,6279171,跨境網購族注意！明年3月起EZ WAY沒按「確認」收不到貨 預先委任制全面上路,跨境網購族請留意，未來海外包裹通關流程將有重大轉變！為有效防堵民眾個資遭盜用進行冒名報關，財政部今（17） 日正式預告修正相關法規，宣布自明年（115 年）3 月 1 日起，所有簡易申報進口之快遞貨物將全面實施「預先確認,https://m.cnyes.com/news/id/6279171
58,6278947,2025年是「美國例外論」終結元年？專家點名兩大致命隱憂,,https://m.cnyes.com/news/id/6278947
59,6278701,AI重塑經濟與就業生態 Fed主席鮑爾釋訊息,,https://m.cnyes.com/news/id/6278701
60,6279172,方法對了→獲利就來了、漢唐、華邦電、智邦、順達、下一檔？請跟上,,https://m.cnyes.com/news/id/6279172
61,6279103,聯合國教科文組織發起「量子百強」全球倡議 鴻海董事張慶瑞入列,聯合國教科文組織發起「量子百強」全球倡議 鴻海董事張慶瑞入列,https://m.cnyes.com/news/id/6279103
62,6279128,雲端物聯網論壇登場 聚焦節能算力、光通訊與機器人新未來,雲端物聯網產業協會今 (17) 日舉行年度會員大會，因應 AI 與機器人黃金交會，產業邁入智能化機器人應用大爆發之際，舉辦「2025 台灣雲端物聯網論壇~ 一起讓人型機器人跑起來」，台日產業專家共同探討人型機器人如何從想像到實現。,https://m.cnyes.com/news/id/6279128
63,6279129,朗齊生醫*非小細胞肺癌新藥 明年申請美國FDA臨床三期試驗,朗齊生醫 *(6876-TW) 今年完成董事與獨立董事改組，總經理陳丘泓說明旗下新藥產品進度，其中以 LXP109 進展較快，預計明年向美國 FDA 申請臨床三期試驗。 ,https://m.cnyes.com/news/id/6279129
64,6279095,數位看板需求旺 星亞豪擲5.1億擴產資本支出年增近六倍,數位廣告看板商星亞 (7753-TW) 於 17 日召開董事會，決議通過民國 115 年（2026 年）資本支出預算案，預計投資金額高達新台幣 5.1 億元，將用於擴建廠房與購置機器設備。為因應新產品開發及未來業務成長需求。,https://m.cnyes.com/news/id/6279095
65,6279028,鈺邦看好AI需求明年擴產2成 營運估續創高,鈺邦今 (17) 日召開法說會，總經理林溪東表示，AI 伺服器及 AI PC 市場需求成長，也持續針對 Vchip、CAP 等產品擴產，預計明年總產能平均成長 2 成，將帶動營運逐季成長，全年營收及獲利將續創創高。,https://m.cnyes.com/news/id/6279028
66,6278973,日元要變天了？日債殖利率直逼2% 高市18兆「財政炸彈」成壓力源,,https://m.cnyes.com/news/id/6278973
67,6278970,歐盟定了！撤回2035年燃油車禁令、改採90%減排目標,在汽車產業壓力與德國領頭斡旋下，歐盟正式撤回 2035 年燃油車全面禁售計畫，改以 90% 二氧化碳減排目標取代，為燃油車與混合動力車留生路，同時推出 M1E 小型電動車與「超級積分」補貼機制，引發電動車投資與氣候政策新,https://m.cnyes.com/news/id/6278970
68,6279037,【量大強漲股整理】漲價缺貨題材股持續表現，這波會延續到哪個時候?潛力股留意誰?,,https://m.cnyes.com/news/id/6279037
69,6279038,燦坤瞄準新市鎮紅利拓店 積極鎖定AI家電與寵物市場,通識傷燦坤 (2430-TW) 今 (17) 日舉行法人說明會，面對傳統家電市場挑戰，財務協理王友良揭示未來三大營運重心，將全力衝刺「AI 與智能家電」、「寵物與銀髮商機」及「異業結盟生態圈」，透過導入差異化商品與跨界合作接觸新客,https://m.cnyes.com/news/id/6279038
70,6278908,賣一輛虧一輛！福特棄純電改抱混動 馬斯克直批：自作孽不可活,,https://m.cnyes.com/news/id/6278908
71,6279000,〈一詮法說〉訂單強勁「被產能追著跑」 打入北美AI龍頭供應鏈已小量出貨,LED 導線架暨散熱元件廠一詮 (2486-TW) 今 (17) 日召開法說會，發言人劉秀興表示，今年成功導入北美 AI 龍頭客戶，第四季已開始小量出貨，明年將大量放量出貨，預期散熱元件營收將從今年的 16 至 17 億元，明年挑戰突破 40 億,https://m.cnyes.com/news/id/6279000
72,6278968,雍智AI晶片需求熱 訂單看至明年上半年,測試介面廠雍智科技 (6683-TW) 積極搶佔 AI 晶片市場，預期在測試流程複雜化、規格升級等多樣測試需求同步推進下，明年三大產品線將同步成長，整體訂單能見度達明年上半年，營運審慎樂觀。,https://m.cnyes.com/news/id/6278968
73,6278993,〈一詮法說〉散熱元件營收翻倍 明年產能拚增100%,LED 導線架廠一詮 (2486-TW) 於 17 日召開法人說明會，發言人劉秀興表示，公司轉型有成，受惠於 AI 先進封裝需求強勁，旗下高階散熱元件出貨暢旺，營收佔比已於 11 月攀升至 37%，一詮將啟動為期三年的擴產計畫，預計明年產能,https://m.cnyes.com/news/id/6278993
74,6278972,ASG男性性功能障礙新藥獲美國FDA通過IND 明年上半年於台灣啟動,亞證環球藥業今日宣布，旗下主力藥物 Beta1 獲得美國 FDA 核准通過新藥臨床試驗 (IND) 申請，預計 2026 年上半年在台灣啟動臨床一期試驗。,https://m.cnyes.com/news/id/6278972
75,6278844,〈港股盤後〉科技、金融集體回暖 恒指終止連二黑 恒科從數周低點反彈,,https://m.cnyes.com/news/id/6278844
76,6277490,大盤拉回中見強勢，聯發科 AI ASIC 進度獲市場認可,,https://m.cnyes.com/news/id/6277490
77,6278905,日銀升息箭在弦上！日元套利恐瓦解 華爾街開始擔心美債,,https://m.cnyes.com/news/id/6278905
