,newsId,title,summary,link
1007,6356182,晶片被AI搶光！今年智慧型手機出貨恐創史上最大跌幅,《CNBC》周五 (27 日) 報導，隨著記憶體供應持續吃緊、價格攀升，分析機構預測 2026 年全球智慧手機市場恐出現歷來最大跌幅。國際數據資訊公司 (IDC) 指出，在記憶體危機惡化下，2026 年全球個人電腦 (PC) 與智慧手機市場,https://m.cnyes.com/news/id/6356182
1008,6355780,全球最大主權基金實證！AI多次攔截投資地雷 成功避險,,https://m.cnyes.com/news/id/6355780
1009,6356164,〈美股早盤〉AI疑慮與PPI偏強拖累 主要指數開低,美股主要指數周五 (27 日) 開盤走低，延續近期科技股回檔走勢，市場聚焦人工智慧 (AI) 需求疑慮與強於預期的生產者物價指數 (PPI) 數據。科技股承壓拖累那斯達克指數，本月跌幅擴大，投資人重新評估聯準會 (Fed) 降息時機點。資,https://m.cnyes.com/news/id/6356164
1010,6355997,波克夏被低估？分析師估內在價值1.1兆美元、未來10年年報酬上看12%,長期追蹤波克夏的分析師 Chris Bloomstran 指出，波克夏內在價值達 1.1 兆美元，較現價仍高出 13%，預估未來十年年報酬率可達 10% 至 12%。隨巴菲特 2025 年卸任、阿貝爾接棒，3500 億美元現金部署策略與保險事,https://m.cnyes.com/news/id/6355997
1011,6356260,亞馬遜豪砸500億美元！OpenAI完成1100億美元史上最大融資,"綜合外媒周五 (27 日) 報導，OpenAI 宣布完成 1,100 億美元募資案，交易前估值達 7,300 億美元，若計入本輪資金，交易後估值升至 8,400 億美元，創下這家 ChatGPT 開發商成立以來最大規模融資，也凸顯人工智慧(AI",https://m.cnyes.com/news/id/6356260
1012,6356165,通膨升溫訊號浮現！美1月PPI升幅超預期 Fed降息更添阻力,美國 1 月生產者物價指數 (PPI) 高於市場預期，核心 PPI 亦明顯升溫，顯示上游通膨壓力仍具韌性。服務價格大幅上揚成為主要推手，抵銷能源價格回落影響。數據強化市場對聯準會 (Fed) 短期內維持利率不變的預期，並為即將公布的個人,https://m.cnyes.com/news/id/6356165
1013,6355921,輝達財報驚豔卻陷「贏家詛咒」？WSJ：AI暴利正削弱科技巨頭現金流,輝達第四季營收達 681 億美元、年增 73%，財測更大幅超越華爾街預期，自由現金流上看 1650 億美元。然而，在 AI 焦慮升溫與科技巨頭現金流承壓之際，股價仍下跌逾 5%。解析 AI 投資熱潮背後的風險與市場隱憂。,https://m.cnyes.com/news/id/6355921
1014,6356252,美債迎來一年最佳單月表現 10年期殖利率跌破4%,在全球風險升溫背景下，美國公債迎來近一年來最佳單月表現，顯示投資人仍將美債視為動盪時期的首選避風港。2 月期間，美國 10 年期公債殖利率下滑 25 個基點，為一年來最大單月跌幅，並自去年 11 月以來首度跌破 4%。彭博美債指數 2 月上,https://m.cnyes.com/news/id/6356252
1015,6356120,惹到川普遭清洗？美國FBI解雇10名「機密文件案」調查員,美國聯邦調查局（FBI）證實解雇約 10 名曾參與川普機密文件案調查的人員。該案涉及海湖莊園文件與妨礙司法指控，並曾由特別檢察官史密斯主導。FBI 探員協會批評此舉削弱專業能力與組織穩定性，引發外界對司法獨立與政治影響的關注。,https://m.cnyes.com/news/id/6356120
1016,6356167,CagriSema表現遜色！諾和諾德單周重挫21% 抹去Wegovy帶動多年漲幅,《彭博》周五 (27 日) 報導，丹麥藥廠諾和諾德 (NOV-US) 本周股價重挫 21%，將創下自 8 月以來最大單周跌幅，幾乎抹去自 2021 年減重藥 Wegovy 在美國獲批以來累積的漲幅。這波跌勢主因是公司次世代減重針劑 CagriSe,https://m.cnyes.com/news/id/6356167
1017,6356223,鉅亨速報 - Factset 最新調查：諾華NVS-US的目標價調升至149.48元，幅度約3.52%,FactSet 最新調查：諾華NVS-US目標價調升，最高估值、最低估值、中位數、綜合評級、近5日股價、標普、即時新聞資訊,https://m.cnyes.com/news/id/6356223
1018,6356193,鉅亨速報 - Factset 最新調查：波音(BA-US)EPS預估下修至1.3元，預估目標價為277.50元,FactSet 最新調查：波音(BA-US)EPS預估下修，預估EPS、預估營收、目標價、歷史獲利表現、即時新聞資訊,https://m.cnyes.com/news/id/6356193
1019,6356109,中國「兩會」前大清洗！撤銷19名人大代表資格、包括9名軍方官員,中國兩會登場前夕，北京宣布撤銷 19 名全國人大代表資格，其中包括 9 名解放軍將領、5 名上將。此舉發生在習近平撤換張又俠後不久，外界關注軍中整肅與反腐行動升溫，以及即將公布的五年規劃與經濟目標。,https://m.cnyes.com/news/id/6356109
1020,6356171,倫敦新一波信貸風暴來襲！華爾街銀行急追數十億美元曝險,根據《彭博》周五 (27 日) 報導，英國非銀行金融機構 Market Financial Solutions Ltd.(MFS)近日瀕臨崩潰，再度引爆信貸市場對詐欺與資產擔保風險的憂慮。事件雖發生在倫敦，但情節與近年美國多起信,https://m.cnyes.com/news/id/6356171
1021,6356137,人民幣終結10連漲！中國央行出手：取消售匯準備金、中間價創最大偏弱,中國人民銀行宣布取消外匯遠期 20% 風險準備金，降低做空人民幣成本，結束人民幣自 2010 年以來最長 10 連漲。央行同時將中間價設定偏弱 793 點，釋放放緩升值訊號。市場關注人民幣匯率走勢與年底是否升至 6.50。,https://m.cnyes.com/news/id/6356137
1022,6356008,天堂裡的麻煩！輝達淨利逾1200億美元卻慘跌失守月線 投資人預警AI泡沫風險,,https://m.cnyes.com/news/id/6356008
1023,6356027,川普遭美情報界打臉：伊朗飛彈威脅美國還有8年,川普在國情咨文中稱伊朗即將擁有可打擊美國本土的飛彈能力，但美國情報評估顯示，伊朗最快恐至 2035 年才具備軍事可行性的洲際彈道飛彈。專家指出，即使獲中國或北韓技術支援，仍需數年時間，美伊核談判僵局下局勢持續升溫。,https://m.cnyes.com/news/id/6356027
1024,6353668,AI吸金效應！全球資金瘋買三星、海力士股票 跨海引發ETF異常波動,,https://m.cnyes.com/news/id/6353668
1025,6356104,派拉蒙剛奪標華納兄弟探索就遇阻！加州檢察長警告：交易尚未通過監管審查,Netflix 放棄對華納兄弟探索（WBD-US）的收購競標，由派拉蒙天舞（PSKY-US）以每股 31 美元勝出。不過，加州檢察長 Rob Bonta 宣布展開反壟斷調查，強調交易尚未通過監管審查，影視產業整併面臨變數。,https://m.cnyes.com/news/id/6356104
1026,6355980,AI成軟體股血洗「救世主」！Anthropic扭轉市場恐慌、華爾街重新評價,在軟體股連番重挫之際，Anthropic 發表 Claude Cowork 更新，帶動 Salesforce、Workday 與 Snowflake 股價回穩，IGV 自低點反彈 7%。AI 提升生產力 10 倍引發產業轉型，Block 裁員 40,https://m.cnyes.com/news/id/6355980
1027,6356007,OpenAI揭發中國秘密行動！ChatGPT拒助抹黑日相高市早苗、指控北京展開大規模洗腦,OpenAI 最新報告指出，ChatGPT 拒絕協助與中國執法部門有關人士策劃抹黑日本首相高市早苗的網路行動，並揭露多起疑似中國影響力操作、愛情詐騙與資訊蒐集行為。中國外交部否認指控，AI 安全與地緣政治風險再掀討論。,https://m.cnyes.com/news/id/6356007
1028,6355808,波克夏阿貝爾談「後巴菲特時代」布局 首封股東信備受矚目,據《路透》報導，波克夏海瑟威 (新任執行長阿貝爾 (Greg Abel) 在接棒傳奇投資人巴菲特 (Warren Buffett) 後，面臨諸多挑戰。本周六，華爾街將看到他如何處理一項波克夏特有的任務：備受期待的年度致股東信。,https://m.cnyes.com/news/id/6355808
1029,6355934,〈財報〉戴爾獲利創新高、AI伺服器今年營收有望翻倍 盤後大漲11%,,https://m.cnyes.com/news/id/6355934
1030,6355803,輝達非得向中國銷售AI晶片嗎？美官員、輝達與分析師各自表態,美國是否應允許輝達 (NVDA-US) 持續向中國銷售先進 AI 晶片，正引發華府、企業與市場分析師之間的激烈辯論。隨著 AI 技術被視為戰略資產，相關政策走向也成為市場高度關注焦點。,https://m.cnyes.com/news/id/6355803
1031,6355963,聯準會槓上聯邦檢察官！Fed向法院申請撤銷傳票、翻修案調查恐拖累華許提名進程,美國聯準會因華盛頓總部翻修工程遭聯邦檢察官發出大陪審團傳票，與檢方對峙已進入第二個月。主席鮑爾指出調查涉及其國會證詞，並暗指政治施壓。事件衝擊市場情緒，也讓川普提名華許接任主席面臨阻礙，聯準會獨立性備受關注。,https://m.cnyes.com/news/id/6355963
1032,6355841,10年期美債殖利率觸及三個月低點 可能與AI有關,LPL Financial 策略師 Lawrence Gillum 表示，過去一個月美債市場持續出現買盤，其中一部分與市場擔心 AI 可能取代大量工作有關。他認為，所謂「AI 焦慮交易」正在壓低長天期殖利率。,https://m.cnyes.com/news/id/6355841
1033,6355981,巴基斯坦宣布與阿富汗「公開開戰」！空襲喀布爾、坎達哈  塔利班反擊釀重大傷亡,巴基斯坦國防部長阿西夫宣布與阿富汗進入「公開戰爭」狀態，巴軍空襲喀布爾與坎達哈，塔利班隨即展開大規模反擊。雙方互控無端攻擊，停火協議破裂，邊境衝突升溫並傳出重大傷亡。,https://m.cnyes.com/news/id/6355981
1034,6355943,〈熱門股〉MCU產業谷底回升 雅特力-KY單周飆漲46%,隨著 MCU 產業開始自谷底回升，雅特力 - KY(6907-TW) 本周自台股開紅盤以來，獲買盤青睞，股價天天漲停，大展馬年開局氣勢，週四終場收在 85.6 元，單周漲幅高達 45.83%。,https://m.cnyes.com/news/id/6355943
1035,6355964,〈熱門股〉睿生光電馬年首周飆漲45% 重返百元創2年半高點,〈熱門股〉睿生光電馬年首周飆漲 45% 重返百元創 2 年半高點,https://m.cnyes.com/news/id/6355964
1036,6355985,這兩個鄰國大打出手 巴基斯坦：決戰時刻已到,巴基斯坦和阿富汗周四（26 日）晚在兩國邊境地區爆發激烈交火，周五凌晨巴方發起空襲，目前雙方衝突仍在持續。,https://m.cnyes.com/news/id/6355985
1037,6355936,晶片漲價潮持續席捲！中國A股半導體龍頭集體漲價,一場事關全行業的漲價潮在半導體產業鏈持續席捲，年初至今，華潤微、中微半導、必易微、國科微、英集芯、美芯晟，以及歐姆龍、ADI、英飛凌等多家半導體及晶片企業陸續宣布產品漲價通知，漲幅普遍在 10% 至 80% 區間，覆蓋 MCU、N,https://m.cnyes.com/news/id/6355936
1038,6355920,輝達財報雙雙超標卻重挫5%！AI疲勞浮現？華爾街：門檻已高到「沒有夠好」,全球 AI 晶片龍頭輝達最新財報營收與獲利雙雙超越華爾街預期，但股價卻單日下跌逾 5%。隨著 AI 熱潮降溫與市場出現「AI 疲勞」，投資人對成長與資本支出的質疑升溫。分析師指出，儘管估值僅略高於標普 500，輝達仍可能被,https://m.cnyes.com/news/id/6355920
1039,6355855,分析師力挺輝達上調目標價 交易員轉而評估整體AI經濟,輝達 (Nvidia)(NVDA-US) 財報超出預期，股價卻重挫，據《Quartz》報導，在分析師看來，整體立場仍偏正面，儘管理由不同，但結論相似：需求仍強勁、商業模式依然成立，且輝達仍是 AI 基礎建設投資周期最大受益者。,https://m.cnyes.com/news/id/6355855
1040,6355910,《大賣空》貝瑞評輝達財報再發嚴厲警告：採購承諾飆升恐面臨「災難性」打擊,"曾精準預測美國房市泡沫的投資人貝瑞（Michael Burry）示警，輝達（Nvidia）為搶攻 AI 晶片需求，大舉提高供應鏈採購承諾至 1,170 億美元，風險遠高於過往水準。一旦 AI 熱潮降溫，恐對獲利與資產負債表造成災難性",https://m.cnyes.com/news/id/6355910
1041,6355802,馬斯克、阿特曼搶攻人機介面 千億美元商機浮現,《Marketwatch》報導，人機介面（BCI）技術雖仍處早期發展階段，但潛在商機已迅速升溫。從馬斯克到阿特曼，再到中國官方與新創企業，各方勢力正加速卡位，市場競爭態勢日益白熱化。,https://m.cnyes.com/news/id/6355802
1042,6355576,〈熱門股〉台虹W底成型獲外資大力回補 股價周漲近20%,台虹 (8039-TW) 本周以包括高速銅箔基板及進入半導體領域開發案獲市場欽點出線，26 日獲外資強力回補 4714 張，本周外資買超 6007 張，股價收在 97 元，周漲 19.9%。,https://m.cnyes.com/news/id/6355576
1043,6355942,〈金融業徵才〉搶人大戰！彰銀擴大招募首度發放5千元新人獎金、非主管薪資中位數139萬領跑業界,彰化銀行 (2801-TW) 啟動年度校園徵才計畫，以展翅高飛再創新局為核心，自 3 月 2 日起展開全台巡迴說明會。本次徵才規模擴大並釋出 11 類職缺。為提升招募競爭力，彰銀首度祭出新進人員獎勵金制度，針對通過試用的新員工發放 5,https://m.cnyes.com/news/id/6355942
1044,6355935,〈金融業徵才〉金飯碗搶人！合庫釋400個職缺搶攻畢業季 5年3度調薪且年終平均近7個月,合庫金 (5880-TW) 旗下合庫銀行宣布啟動 115 年度第 2 波徵才，預計招募 400 名新進人員，3 月 2 日起報名，涵蓋儲備菁英、一般金融、金融科技及資安等 20 類別，其中儲備菁英與一般金融人員不限科系，並開放應屆畢業生報考。,https://m.cnyes.com/news/id/6355935
1045,6355771,〈熱門股〉金控股比價效應！凱基金獲外資連14買 周漲14%創24年新高,台股金馬年開紅盤後展現強勁多頭氣勢，不僅電子股領軍，金融族群本周也成為買盤焦點，在比價效應下，凱基金控 (2883-TW) 表現相當亮眼，26 日股價強勢噴漲逾 5%，最終收在 21.95 元,https://m.cnyes.com/news/id/6355771
1046,6355743,台股馬年首周狂飆1808點、台達電法說、玉山金法說 本周大事回顧,台股馬年開春首周狂飆 1808 點；台達電周四召開法說會，董事長鄭平指出，今年 AI 持續帶旺整體營運；玉山金周二召開法說會，將今年定調為「玉山金控 2.0 元年」。,https://m.cnyes.com/news/id/6355743
1047,6355909,Anthropic拒絕五角大廈AI合約要求！美國軍方揚言列供應鏈風險、動用《國防生產法》,美國 AI 新創 Anthropic 拒絕五角大廈最新合約提案，堅持禁止其 Claude AI 技術用於監控美國公民與無人類介入的自主致命攻擊。國防部警告，若不撤回限制將列為供應鏈風險，甚至動用《國防生產法》。此爭議正值美國推動「A,https://m.cnyes.com/news/id/6355909
1048,6355846,〈財報〉「輝達親兒子」CoreWeave盤後重挫8% 營收倍增但虧損擴大、財測失利 ,,https://m.cnyes.com/news/id/6355846
1049,6355714,〈熱門股〉是方受惠AIDC帶動2025年賺逾1.5個股本 日K線連6紅,是方 (6561-TW)2025 年受惠聯雲 AI 智能資料中心 (LY2) 進駐率提升，帶動業績成長，2025 年營收 39.44 億元，稅後純益 12.27 億元，每股純益 15.75 元，賺逾 1.5 個股本，激勵是方本周漲逾 1 成。 ,https://m.cnyes.com/news/id/6355714
1050,6355815,川普誇耀美國經濟好轉 選民卻感受不到？,川普這次國情咨文演說盤算的是，要說服美國人，讓他們相信經濟比許多人想像的要好。但民調發現，美國人對川普處理經濟的方式不滿意。,https://m.cnyes.com/news/id/6355815
1051,6355908,義联集團林義守：歐盟CBAM上路碳控制力成關鍵 RC鋼材已具銷歐實績,義联集團林義守：碳控制力成關鍵 RC 鋼材已具銷歐實績,https://m.cnyes.com/news/id/6355908
1052,6250425,〈熱門股〉耀登單周強漲逾27％ 衛星地面終端、AI題材雙點火,射頻天線廠耀登 (3138-TW) 科技受惠低軌衛星與人工智慧題材發酵，本周股價表現亮眼，26 日由黑轉紅，攻上漲停價 198 元，周漲幅 27.3%，周成交量 27109 張。,https://m.cnyes.com/news/id/6250425
1053,6355811,Fed古爾斯比：今年仍可能多次降息 但不會很快行動,芝加哥聯準銀行總裁古爾斯比周四 (26 日) 表示，他預測今年稍晚將進行多次降息，讓他成為聯準會 (Fed) 官員中相對「偏樂觀」的一員，但他強調，央行在採取行動時需保持「謹慎」，以免經濟與通膨過熱。,https://m.cnyes.com/news/id/6355811
1054,6355133,護國神山台積電「產業風向球」重點整理，快速掌握成長動能、資本支出、AI趨勢與風險(一),,https://m.cnyes.com/news/id/6355133
1055,6355810,華爾街分析師仍看多輝達 交易員卻不買單？,輝達周四收盤跌 5%，讓這份再創紀錄的財報幾乎不是重點。公司完成了它該做的事，但股價似乎需要另一件事：一個能讓市場相信，AI 建設下一階段能在華爾街可接受時間內轉化為現金的理由。,https://m.cnyes.com/news/id/6355810
1056,6355818,美科技新聞網站：Meta內部晶片設計遭遇瓶頸,Meta 在內部晶片設計工作上遭遇阻礙，《The Information》報導。Meta 上週已取消其正在開發、用於訓練 AI 模型的最先進晶片，原因是該晶片設計過程中遭遇困難。,https://m.cnyes.com/news/id/6355818
1057,6355807,川普關稅立場強硬 策略師揭美元關鍵風險,據《MarketWatch》報導，市場策略師在周二 (24 日) 晚間聆聽美國總統川普的國情咨文演說後，認為其中對美元有幾項重要啟示。,https://m.cnyes.com/news/id/6355807
1058,6355845,Netflix放棄競購華納兄弟 股價拉漲10%！CEO坦言：此交易已不再有財務吸引力,,https://m.cnyes.com/news/id/6355845
1059,6355862,傳Meta租用Google TPU 簽數十億美元AI晶片協議,《The Information》週四 (26 日) 引述知情人士報導，Alphabet 旗下 Google 已與 Meta Platforms (META-US) 簽署一項為期多年的人工智慧晶片合作協議，金額達數十億美元,https://m.cnyes.com/news/id/6355862
1060,6355806,美股重點新聞摘要2026年2月27日,美股重點新聞摘要 2026 年 2 月 27 日,https://m.cnyes.com/news/id/6355806
1061,6353688,1899年來新低！日新生兒人數連十年下滑 人口結構壓力加劇引政策效力質疑,,https://m.cnyes.com/news/id/6353688
1062,6355781,輝達財報超優也救不了股價 晶片定價權巔峰恐將成過去式？,,https://m.cnyes.com/news/id/6355781
1063,6355851,為何輝達回檔引爆連鎖效應 標普500幾乎注定走低？,《Marketwatch》報導，輝達 (NVDA-US) 財報雖再度優於預期，但股價重挫引發連鎖效應，拖累美股主要指數走低。市場人士指出，在大型科技股權重過高與 AI 投資疑慮升溫下，標普 500 幾乎難以「置身事外」。,https://m.cnyes.com/news/id/6355851
1064,6355655,〈能源盤後〉關注美伊談判進展 油價震盪走低,,https://m.cnyes.com/news/id/6355655
1065,6355817,華納認定派拉蒙出價更優 Netflix面臨四天加碼壓力,華納兄弟探索公司週四 (26 日) 盤後表示，派拉蒙天舞提出的修訂收購案在整體條件上優於目前與 Netflix (NFLX-US) 的既有交易，並正式啟動四個工作日回應期限，為這場備受矚目的好萊塢資產爭奪戰增添變數。,https://m.cnyes.com/news/id/6355817
1066,6355837,ASML稱次世代EUV設備已可用於量產 AI晶片生產迎關鍵轉折,據《路透》報導，艾司摩爾 (ASML Holding)(ASML-US) 一名高層表示，該公司次世代晶片製造設備已準備好供製造商開始啟動量產，對晶片產業而言是一大重要里程碑。,https://m.cnyes.com/news/id/6355837
1067,6355654,〈貴金屬盤後〉靜待美伊核談結果 金價持平,,https://m.cnyes.com/news/id/6355654
1068,6355804,輝達暴跌近5.5% 市值一夕蒸發2590億美元,"雖公布第四季營收與獲利雙雙優於市場預期，AI 巨頭輝達 (NVDA-US) 週四 (26 日) 重挫 5.49% 至每股 184.89 美元，市值一夕蒸發 2,590 億美元，創下自 2025 年 3 月以來最大跌幅。",https://m.cnyes.com/news/id/6355804
1069,6355776,記憶體漲價風暴來襲！IDC估2026年智慧手機萎縮近13% 創史上最大跌幅,,https://m.cnyes.com/news/id/6355776
1070,6355814,RAM荒來襲 智慧手機出貨量恐寫十年最慘跌幅 低階品牌面臨淘汰,隨著 AI 帶動電腦與資料中心需求攀升，隨機存取記憶體 (RAM) 出現嚴重短缺，推升記憶體價格大幅上漲。如今，研究機構 IDC 預測，這將導致今年智慧型手機出貨量暴跌 12.9%，創逾十年來最大年度降幅。,https://m.cnyes.com/news/id/6355814
1071,6355801,〈美股盤後〉輝達市值蒸發超2590億美元 費半重挫超3% 台積電ADR跌逾2.8%,輝達與軟體大廠 Salesforce 最新財報未能提振大盤，標普 500 指數下跌 0.54%，那斯達克指數下跌 1.18%，道瓊指數近乎持平，費半指數重挫超 3%。,https://m.cnyes.com/news/id/6355801
1072,6355805,〈紐約匯市〉美元小漲 華爾街下挫帶動買盤,美元周四 (26 日) 小幅上揚，因 AI 龍頭輝達 (Nvidia)(NVDA-US) 強勁財報未能提振股市，投資人避開股票，轉而布局其他資產。,https://m.cnyes.com/news/id/6355805
1073,6355809,Block宣布裁員近一半員工 盤後股價飆升超20%,"支付公司 Block 週四 (26 日) 宣布大規模裁員計畫，將裁減逾 4,000 名員工、約占整體人力近半。消息激勵市場情緒，該公司股價在盤後交易中飆升逾 20%。",https://m.cnyes.com/news/id/6355809
1074,6355775,輝達高層：遊戲晶片短缺恐持續到今年年底,,https://m.cnyes.com/news/id/6355775
1075,6355430,又一輪變相降價！特斯拉中國再推5年零息促銷方案,特斯拉中國周四（26 日）宣布新一輪購車金融優惠政策，消費者在 3 月 31 日前下單，全系車型均可享受 7 年超低息貸款，其中 Model 3、Model Y 及 Model Y L 三款主力車型，可額外選擇 5 年零息方案，貸款購車無需支付利,https://m.cnyes.com/news/id/6355430
1076,6355653,【袁志峰專欄】今年以來人民幣兌美元漲1.9%,,https://m.cnyes.com/news/id/6355653
1077,6355431,90年來首次！去年美國遷出人口超過遷入人口,去年美國遷出人口數量超過遷入人口，自 1935 年以來首次出現人口淨流出。許多美國人對持續攀升的生活成本壓力和糟糕的治安感到擔憂，希望在美國以外找到更好的生活環境。,https://m.cnyes.com/news/id/6355431
1078,6355680,Fed理事米蘭：通膨非問題、就業仍需支撐 今年應降息4次,綜合外媒周四 (26 日) 報導，聯準會 (Fed) 理事米蘭 (Stephen Miran) 表示，儘管 1 月就業成長強勁是一項「非常好的消息」，但現在宣告就業市場已完全無虞仍為時過早。他認為，今年仍有必要合計降息 1 個百分點，也就是進,https://m.cnyes.com/news/id/6355680
1079,6355732,Google推出Nano Banana 2 強化AI影像生成能力,綜合外媒周四 (26 日) 報導，Google 母公司 Alphabet(GOOGL-US)宣布推出 Nano Banana 2，升級旗下爆紅的人工智慧 (AI) 影像生成工具，強調在速度、解析度與指令理解能力上全面提升，進一步強化其在,https://m.cnyes.com/news/id/6355732
1080,6355733,一紙協議還是一場戰爭？川普面臨伊朗抉擇,《華爾街日報》(WSJ)周四 (26 日) 報導，美國總統川普正站在人生與政治生涯可能最具指標性的十字路口：是與伊朗達成限制其核計畫的協議，還是走向一場後果難以預測的軍事衝突。外交談判能否成功，將成為左右其歷史定位的關鍵。,https://m.cnyes.com/news/id/6355733
1081,6355731,美伊核談判緊張升溫 國際油價反彈,國際油價周四 (26 日) 走高，美國與伊朗在日內瓦舉行第三輪核談判之際，市場對談判前景轉趨謹慎，軍事衝突風險再度成為焦點。紐約西德州中級原油 (WTI) 一度回升至每桶 66 美元上方，抹去盤中最大 2.8% 的跌幅。此前伊朗國營媒體報,https://m.cnyes.com/news/id/6355731
1082,6355592,三年內三度裁員！eBay裁撤800人 占全球人力6%,電商平台 eBay 周四 (26 日) 宣布裁減約 800 名員工，約占全球全職人力 6%，以調整組織架構並配合長期策略布局。該公司表示，此舉旨在重新配置資源，將人力投入優先發展領域，同時使組織結構與戰略目標更加一致。,https://m.cnyes.com/news/id/6355592
1083,6355547,研華每股擬配息11.2元創新高 啟動現金股利加碼計畫三年共52億元,研華每股擬配息 11.2 元創新高 啟動現金股利加碼計畫三年共 52 億元,https://m.cnyes.com/news/id/6355547
1084,6355577,參加蘭花展開幕 賴清德：持續與美洽談確保多項農產品輸美零關稅,針對我國農產品近期是否因為川普對於關稅政策下，蝴蝶蘭銷美零關稅即將生變? 總統賴清德回應，政府將持續與美國洽談，先前取得的談判成果沒有改變，他也希望美方各項承諾維持不變，確保台灣蘭花銷到美國市場維持零關稅。,https://m.cnyes.com/news/id/6355577
