,newsId,title,summary,link
0,6420854,以色列黎巴嫩首輪談判結束 實質共識仍不明朗,以色列與黎巴嫩週二 (14 日) 在美國華府展開直接會談，為雙方自 1993 年以來首次正式對話,https://m.cnyes.com/news/id/6420854
1,6420868,軟體股終於加入科技股漲勢 美股有望更快創新高,一度受創的科技族群正逐漸回神。但在這波由科技股帶動的反彈中，軟體股一直是缺席的一塊拼圖，如今情況可能正在改變。,https://m.cnyes.com/news/id/6420868
2,6420885,兩大高層又出手！蘋果庫克、執行長Hill再次加碼持股 Nike盤後漲2%,Nike 周二 (14 日) 盤後股價上漲 2%，主因董事庫克 (Tim Cook) 與執行長 Elliott Hill 近日相繼買進自家股票。兩筆內部人交易曝光後，市場對公司前景信心升溫。,https://m.cnyes.com/news/id/6420885
3,6420864,亞馬遜七連漲創近兩年最佳 收購Globalstar助攻,,https://m.cnyes.com/news/id/6420864
4,6420879,川普：美伊和平談判可能未來兩天內恢復,美國與伊朗的和平談判可望在未來兩天內重啟，地點可能仍在伊斯蘭馬巴德。川普同時點名巴基斯坦陸軍參謀長穆尼爾 (Asim Munir) 在斡旋過程中扮演關鍵角色，稱其表現「非常出色」。,https://m.cnyes.com/news/id/6420879
5,6420863,〈紐約匯市〉美元走軟 停火談判露曙光、PPI低於預期,美元周二 (14 日) 走低，投資人轉向風險資產，因市場對美國與伊朗停火談判可能取得進展抱持期待，即便美方在波斯灣持續進行海上封鎖。,https://m.cnyes.com/news/id/6420863
6,6420883,博通Meta簽署多年期AI晶片合作協議 博通盤後漲近3%,社群媒體巨頭 Meta Platforms(META-US) 與晶片大廠博通 (AVGO-US) 週二 (14 日) 宣布建立策略合作關係。,https://m.cnyes.com/news/id/6420883
7,6420844,〈美股盤後〉標普逼近歷史新高 那指連漲10天 創2021年以來最佳戰績,在美伊談判希望與生產者物價指數 (PPI) 數據帶動下，美股三大指數週二 (14 日) 同步走高，標普 500 指數逼近歷史收盤高點。,https://m.cnyes.com/news/id/6420844
8,6420828,AI資料中心需求爆發 甲骨文擴大電力布局 股價連日上漲 Bloom Energy飆升22%,甲骨文擴大與 Bloom Energy 合作，推動資料中心電力布局，帶動股價連續上漲。隨著 AI 需求爆發，能源與軟體產業同步受惠，但市場仍關注技術變革帶來的長期風險。,https://m.cnyes.com/news/id/6420828
9,6420796,〈能源盤後〉荷姆茲海峽變數降溫 市場押注美伊重啟談判 原油跌近8% Brent摜破95美元,市場預期美國與伊朗可能恢復談判，帶動油價大幅回落，但荷姆茲海峽運輸仍受阻，供應壓力未解。在地緣風險與供需緊張交織下，能源市場波動持續升高。,https://m.cnyes.com/news/id/6420796
10,6420841,CAPE系統正式上線 美政府下週一退還違法關稅 逾33萬進口商受惠,"美國下週一 (20 日) 將啟動關稅退款系統，退還高達 1,660 億美元違法關稅，涵蓋超過 33 萬家進口商。隨著最高法院裁決生效，大規模退款將影響企業資金流與供應鏈運作。",https://m.cnyes.com/news/id/6420841
11,6420789,〈台股盤前要聞〉台積電法說前帶飛台股飆出新天價、公股四金二銀Q1合賺近400億元,台股盤前要聞,https://m.cnyes.com/news/id/6420789
12,6420799,劍指中國進口！歐盟鋼鐵關稅翻倍至50% 強化鋼鐵保護政策,歐盟計畫將鋼鐵關稅提高至 50%，並大幅削減免稅配額，以應對進口增加與本地產能下滑壓力。此舉不僅反映歐洲產業保護趨勢升溫，也可能加劇與中國的貿易摩擦。,https://m.cnyes.com/news/id/6420799
13,6420792,【袁志峰專欄】中國3月進口高於預期,"今日推介 - 友邦保險 (1299, $87.0), 目標價 $95.5, 止損價 $83.5",https://m.cnyes.com/news/id/6420792
14,6420847,法巴人壽總座黃宥甄揭經營三主軸 今年FYP拚雙位數成長、分紅保單醞釀新作,法國巴黎人壽台灣分公司總經理黃宥甄 14 日首度亮相，這位被稱為「財務寶寶」、擁有近 40 年外商保險資歷的專業經理人，強調將秉持集團穩健經營的核心深耕台灣,https://m.cnyes.com/news/id/6420847
15,6420833,訂單破兆美元 輝達強勢反彈 10天累漲18% 2023年以來最長漲勢,輝達股價連續 10 日上漲，累計漲幅超過 18%，反映 AI 需求持續爆發。在科技巨頭大舉採購晶片與資料中心投資帶動下，公司訂單規模突破兆美元，成長動能強勁。,https://m.cnyes.com/news/id/6420833
16,6420820,中東供應受阻 IEA警告：歐洲最快6月恐現航空燃油短缺,國際能源署警告，若歐洲無法有效替代中東航空燃油供應，最快 6 月恐出現短缺。隨著庫存逼近警戒水準與旅遊旺季來臨，能源供應壓力正逐步升高，恐衝擊航空市場與票價。,https://m.cnyes.com/news/id/6420820
17,6420788,沒船過得去！美國封鎖荷姆茲海峽首日6艘船全掉頭,綜合外媒周二 (14 日) 報導，美國對伊朗實施海上封鎖進入首日，軍方表示尚無任何船隻成功突破封鎖，已有 6 艘商船依指示折返，顯示措施初步發揮效果。此舉是在美伊談判破局後，由總統川普下令執行，進一步升高中東局勢緊張。,https://m.cnyes.com/news/id/6420788
18,6420821,停火未解危機 南韓向伊朗提供50萬美元人道援助,南韓宣布向伊朗提供 50 萬美元人道援助，協助緩解戰後危機。在停火仍不穩定之際，中東衝突已造成數千人死亡與數百萬人流離失所，並對亞洲能源供應與經濟帶來連鎖衝擊。,https://m.cnyes.com/news/id/6420821
19,6420809,美國出手加壓！傳將終止伊朗石油制裁豁免 收緊能源壓力,《路透》周二 (14 日) 報導，知情官員透露，美國總統川普政府將於本周稍晚讓針對伊朗海運石油的制裁豁免到期，不再延長相關措施。此舉正值美國對伊朗港口與航運實施封鎖之際，顯示華府正同步收緊能源與金融壓力，進一步壓縮伊朗石油出口,https://m.cnyes.com/news/id/6420809
20,6420602,油價衝擊成關鍵！日銀擬大幅上修通膨預測 政策路徑面臨重估,《彭博》周二 (14 日) 報導，知情人士透露，日本銀行 (日本央行 / BOJ) 官員在本月政策會議上，可能大幅上修通膨預測，主因為中東戰事推升油價所帶來的成本壓力。自美伊衝突爆發以來，油價已上漲約五成，促使決策官員重新評估物價走勢,https://m.cnyes.com/news/id/6420602
21,6419294,美伊戰爭重塑能源版圖 WTI原油由定價基準晉升為「戰略資產」,,https://m.cnyes.com/news/id/6419294
22,6420524,投資人開始悲觀？美銀最新調查揭市場轉折,美國銀行 (Bank of America)(BAC-US) 最新基金經理人調查顯示，受中東戰事衝擊，全球投資人對經濟成長前景的預期大幅下修，降幅創下近四年最大，市場情緒轉趨保守；同時，通膨預期升至近五年高點，反映能源價格飆,https://m.cnyes.com/news/id/6420524
23,6420740,Fed接班人有多有錢？華許資產曝光 身價遠超歷任主席,根據《CNBC》周二 (14 日) 報導，美國總統川普提名的聯準會 (Fed) 主席人選華許(Kevin Warsh)，最新財務揭露顯示其個人資產規模遠超近年歷任主席，成為史上最富有的 Fed 主席候選人之一，市場關注其財務背景對央行,https://m.cnyes.com/news/id/6420740
24,6420757,停火期限逼近！美伊擬重啟談判 白宮：第二輪對話仍在討論,《CNBC》周二 (14 日) 報導，白宮官員表示，美國與伊朗正討論展開第二輪和平談判，儘管目前尚未確定具體時間，但雙方有望在本周稍晚或下周初恢復面對面協商。此一進展正值為期兩周的脆弱停火協議即將到期之際，市場對外交解方的期待,https://m.cnyes.com/news/id/6420757
25,6420600,Fed接班人要來了！華許下周面對關鍵聽證 政策立場與獨立性受關注,《彭博》周二 (14 日) 報導，美國總統川普提名的聯準會 (Fed) 主席人選華許 (Kevin Warsh)，將於下周接受參議院銀行委員會確認聽證。委員會主席、共和黨參議員史考特(Tim Scott) 表示，聽證將聚焦經濟前景、通,https://m.cnyes.com/news/id/6420600
26,6420491,算力引爆供需博弈 高盛：記憶體超級周期預計持續至2027年,據格隆匯報導，全球科技巨頭爭奪算力的背後，記憶體晶片正上演一場史詩級的供需博弈。由人工智慧 (AI) 算力需求引爆的記憶體晶片超級周期，正以前所未有的強度席捲全球產業鏈。,https://m.cnyes.com/news/id/6420491
27,6420666,伊朗考慮暫停荷姆茲航運 避免影響美伊談判進程,根據《彭博》周二 (14 日) 報導，為避免衝突升級並確保新一輪談判順利推進，伊朗正考慮短暫暫停經由荷姆茲海峽的石油運輸。知情人士指出，此舉旨在避免直接挑戰美國對伊朗港口的海上封鎖，並為美伊雙方籌備下一輪面對面會談爭取時間。,https://m.cnyes.com/news/id/6420666
28,6420449,中國3月集成電路出口暴增84.92% 高端製造引擎發力帶動「科技出海」,根據中國海關總署最新公布的 2026 年 3 月外貿數據，中國外貿在高端製造領域展現出強大韌性。以美元計價，3 月出口同比增長 2.5%，進口同比則大幅增長 27.8%，單月貿易順差達 511.3 億美元。其中，集成電路,https://m.cnyes.com/news/id/6420449
29,6420521,〈美股早盤〉中東戰事降溫預期提振情緒！主要指數開高 那指拚寫近5年最長連勝,美股主要指數周二 (14 日) 開盤走高，市場對美國與伊朗可能重啟談判的預期升溫，帶動油價回落並提振風險偏好情緒；科技股領軍上攻，那斯達克 100 指數有望寫下 2021 年以來最長連漲紀錄。投資人同時消化企業財報與 3 月生產者物價指數,https://m.cnyes.com/news/id/6420521
30,6420450,AI恐慌升級 OpenAI執行長豪宅48小時內「遭丟汽油彈＋槍擊」,人工智慧 (AI) 巨頭 OpenAI 的執行長阿特曼 (Sam Altman) 位於舊金山的豪宅，在 48 小時內接連遭遇兩次暴力襲擊，反映出美國社會對 AI 技術的負面情緒正演變為危險的行動。,https://m.cnyes.com/news/id/6420450
31,6420663,國銀第三家插旗！金管會同意兆豐銀申設印度GIFT City分行,金管會今 (14) 日宣布，同意兆豐銀行向印度主管機關申請設立古吉拉特邦金融特區 (簡稱 GIFT City) 分行。截至目前，國銀僅有中信銀申設 GIFT City 分行並已開業，而北富銀去年 7 月也獲准申設 GIFT City 分行,https://m.cnyes.com/news/id/6420663
32,6420653,Fed政策添變數！美3月PPI僅升0.5% 能源衝擊未全面擴散,美國 3 月生產者物價指數 (PPI) 升幅低於市場預期，顯示通膨壓力尚未全面擴散，儘管中東戰事推升能源價格，但服務成本持平與核心物價溫和，對整體物價形成抑制。市場認為，這份數據將影響聯準會 (Fed) 後續政策路徑。,https://m.cnyes.com/news/id/6420653
33,6420442,摩根大通警告：封鎖前庫存即將告罄 石油衝擊進入「最危險階段」,隨著荷姆茲海峽封鎖的持續影響，全球石油供應危機正從預警階段轉向實質性的全面衝擊。摩根大通在最新報告中發出嚴厲警告，指出全球原油緩衝庫存即將歸零，石油市場正步入最危險的關鍵時刻。,https://m.cnyes.com/news/id/6420442
34,6420652,TWQR Inbound服務開通！日星旅客掃碼通 玉山、星展擔綱清算行,行動支付跨境合作再展歷史新頁！由財金公司、銀行公會及電支公會主導的我國 QR Code 共通支付標準「TWQR」，今 (14) 日正式宣告啟動「Inbound」服務。,https://m.cnyes.com/news/id/6420652
35,6420594,〈財報〉交易部門狂賺！花旗上季獲利增逾四成 轉型計畫見效,花旗集團 (Citigroup) 周二 (14 日) 美股盤前公布 2026 會計年度第一季 (截至 3/31) 財報，在市場波動推升交易業務與投行活動回溫帶動下，營收與獲利雙雙優於市場預期。儘管信用成本上升與費用增加，整體表現仍展現轉型成,https://m.cnyes.com/news/id/6420594
36,6420642,正2魅力無法擋！00631L分割後狂漲29% 投資人數激增4.9萬人,美伊戰事訊息鈍化，市場情緒回溫推升台股改寫新高，元大台灣 50 正 2(00631L-TW) 單日再大漲 5.12%，,https://m.cnyes.com/news/id/6420642
37,6420598,光環自結3月虧損1200萬元、EPS-0.1元 較去年同期由盈轉虧,"光通訊廠光環 (3234-TW) 近期因有價證券遭列注意股，主管機關要求公告財務資訊，光環今 (14) 日公布上 (3) 月自結財報，3 月稅後淨損為 1,200 萬元，單月 EPS 為 - 0.1 元，較去 (2025) 年同期 0.03 由盈轉虧。",https://m.cnyes.com/news/id/6420598
38,6420603,亞馬遜出手了！每股90美元收購衛星公司Globalstar 對決馬斯克星鏈,亞馬遜 (AMZN-US) 周二 (14 日) 宣布，已同意收購衛星通訊公司 Globalstar(GSAT-US)，進一步強化其低軌衛星布局，挑戰由馬斯克主導的星鏈 (Starlink) 市場地位。,https://m.cnyes.com/news/id/6420603
39,6420490,AI浪潮引爆記憶體晶片奇蹟 淨利飆升6714% 帶動A股半導體設備喜迎春天,2026 年開年以來，全球半導體市場由「記憶體晶片」領銜開啟了一場史詩級的復甦。隨著 AI 算力需求從模型訓練轉向大規模推理應用，高性能存儲資源已成為核心戰略資源。這股熱潮不僅讓相關企業交出驚人的業績成績單，更帶動了半導,https://m.cnyes.com/news/id/6420490
40,6420584,國泰世華系統大塞車元凶找到了！金管會：客訴逾400件 4/21前須交報告,國泰世華銀行上周五 (4/10) 發生網銀與 App 交易延遲事件，導致換匯與交割功能受阻。金管會銀行局官員今 (14) 日表示，事發期間交易成功率一度降至 7 成，截至目前銀行端已接獲逾 400 多件客訴，,https://m.cnyes.com/news/id/6420584
41,6420595,〈智慧移動展〉研華攜手生態系夥伴 合作強固型車載Edge AI多元應用,研華攜手生態系夥伴 合作強固型車載 Edge AI 多元應用,https://m.cnyes.com/news/id/6420595
42,6420560,〈財報〉摩根大通Q1業績報喜 下修全年淨利息收入拖累股價,摩根大通 (JPMorgan Chase) 周二 (14 日) 美股盤前公布 2026 會計年度第一季 (截至 3/31) 財報，受惠於交易與投行業務表現強勁，營收與獲利雙雙優於市場預期；不過，由於下修全年淨利息收入 (NII) 展望，市場反應,https://m.cnyes.com/news/id/6420560
43,6420525,宏泰人壽遭搜索與不動產交易有關 營運、保戶權益不受影響,宏泰集團旗下宏泰人壽傳出遭台北地檢署依違反證券交易法非常規交易，至總公司搜索調查。保險局官員表示，應與不動產交易案有關，目前仍在檢調偵查當中，不便做相關評論，也未證實是金管會主動移送,https://m.cnyes.com/news/id/6420525
44,6420580,晟德擬配發每股0.5元股票股利、1.75元現金股利 殖利率逾4%,晟德 (4123-TW) 董事會今 (14) 日通過盈餘分派案，決議配發每股 0.5 元股票股利、1.75 元現金股利，合計配發 2.25 元，若以今天收盤價 40.25 元計算，現金殖利率為 4.34%，創歷年新高，連續 21 年發放股利。 ,https://m.cnyes.com/news/id/6420580
45,6420582,外資史上第5大買超689億元 回補台積電1.89萬張 掃貨面板、台塑四寶,台股漲 838 點創新高外資回補 689 億元第五多 狂掃面板雙虎、台塑四寶,https://m.cnyes.com/news/id/6420582
46,6420566,基米5月上旬創新板掛牌 法人估今年營收上看10億元,基米預計 5 月上旬於創新板掛牌上市。總經理江俊奇預期，今年四大業務都將成長，包括多體學服務、臨床檢測、CRDMO，以及儀器代理，法人也預估，在四大業務同步成長下，今年營收有望年增 2 至 3 成，全年營收上看 10 億元。 ,https://m.cnyes.com/news/id/6420566
47,6420523,公股4金2銀首季合賺397億元激增21% 華南金彰銀成長居前段班,2026 年首季公股金融業成績單全數出爐，受惠於台股交投火熱帶動手續費收益，加上利差穩定與匯兌收益進帳，公股四金二銀首季合賺達 397.62 億元，較去年同期的 326.11 億元成長超過 21%，整體獲利動能強勁。其中，華南金（2,https://m.cnyes.com/news/id/6420523
48,6420480,香港控菸再升級 4月30日起持電子菸即違法 訪港旅客不豁免,根據香港特區政府衛生署的最新公告，香港控菸法例將迎來重大升級。自 2026 年 4 月 30 日起，香港將全面禁止任何人在公眾場所管有（持有）另類吸菸產品，包括電子菸、草本菸及加熱菸。此舉意味著消費者即便只是隨身攜帶而並未吸食，亦屬,https://m.cnyes.com/news/id/6420480
49,6420489,〈台北汽車零配件展〉建通展出三大利基產品 聚焦四大領域應用,建通展出三大利基產品 聚焦四大領域應用,https://m.cnyes.com/news/id/6420489
50,6420522,大成水產飼料廠+土雞加工廠加入 滿載生產可貢獻33億元營收,大成 (1210-TW)2025 年營收達 1012 億元，稅後純益 36.24 億元，每股純益 4.33 元，擬配息 3 元爲 4 年來新高，同時，大成今 (14) 日召開法人說明會，總經理韓芳豪指出，大成水產飼料廠及土雞加工廠陸續投產。,https://m.cnyes.com/news/id/6420522
51,6420567,美債市大轉向！投資人轉向「短穩長升」策略 押注Fed降息,美國公債市場出現結構性押注轉向，債券投資人近期大舉加碼「殖利率曲線陡峭化」(Curve Steepener)交易，反映市場預期聯準會 (Fed) 最終仍將重啟降息，同時長天期公債因通膨與財政壓力面臨上行風險。,https://m.cnyes.com/news/id/6420567
52,6420510,〈台幣〉熱錢湧入股匯雙漲 升近1角創逾1個月新高,台股今 (14) 日氣勢如虹大漲逾 800 點、站上 3 萬 6 千點大關，在熱錢湧入下，新台幣兌美元同步走強，一度強升超過 1 角,https://m.cnyes.com/news/id/6420510
53,6420486,盟友集體拒絕參與！川普封鎖伊朗港口 北約內部分裂危機再起,美國政府周一 (13 日) 正式啟動對伊朗的海上交通封鎖，並威脅將擊毀任何靠近封鎖區域的伊朗艦艇。然而，此舉遭到北約 (NATO) 主要盟友的集體冷遇，英國、法國及西班牙等國紛紛表態拒絕被捲入衝突，此一動向預料將使美國與北約盟邦間,https://m.cnyes.com/news/id/6420486
54,6420443,DeepSeek V4預計4月下旬發布 傳徹底轉向華為昇騰晶片,根據陸媒援引多位知情人士報導，DeepSeek 創辦人梁文鋒已明確指出，新一代旗艦大模型 DeepSeek V4 將於 2026 年 4 月下旬正式亮相。這款備受期待的模型不僅在技術參數上大幅躍進，更因其與國產晶片的深度,https://m.cnyes.com/news/id/6420443
55,6420036,晶片封鎖是場徒勞！紐時專欄：美國無法戰勝中國AI,,https://m.cnyes.com/news/id/6420036
56,6419249,美光正在「印鈔票」還有望再漲40%？,在人工智慧 (AI) 需求持續升溫帶動下，記憶體大廠美光 (MU-US) 股價今年以來已上漲約 47%，過去 12 個月更大幅飆升逾 5 倍。儘管漲勢驚人，KeyBanc 仍看好其後市表現，認為隨著即將公布的財報帶來催化,https://m.cnyes.com/news/id/6419249
57,6420495,應材搶埃米製程商機 新一代邏輯晶片沉積系統已獲採用,應用材料 (AMAT-US) 近日推出兩款晶片製造系統，專為打造全球最先進邏輯晶片中的最微小特徵結構而設計，該技術透過原子級的精度控制材料沉積，協助晶片製造商打造更快速、節能的電晶體，目前皆已獲領先的邏輯晶片製造商採用，應用,https://m.cnyes.com/news/id/6420495
58,6420507,〈台北汽車零配件展〉東元攻農用、商用無人機市場 無人機動力系統下半年量產出貨,東元今 (14) 日參與台北國際車用零配件展，於展會中展示無人機布局成果，目前主打高酬載農用、商用無人機動力系統，並已在中壢廠建置無人機動力系統產線，電機機電事業群總經理王榮邦表示，相關產品將於下半年量產出貨。,https://m.cnyes.com/news/id/6420507
59,6420448,台新證併元富後二度異常 金管會：依錯帳處理 券商須承擔反向沖銷損失,台新證券與元富證券 4/6 正式合併後，繼 4 月 7 日發生系統緩慢後，今 (14) 日再度爆出電子交易成交回報異常，部分投資人因收不到回報通知而「重複下單」，傳出將面臨上億元的錯帳。金管會證期局副局長黃厚銘證實接獲重大資安通報,https://m.cnyes.com/news/id/6420448
60,6420506,〈稅收統計〉3月稅收年增近3成 Q1突破6千億 證交稅連8紅535億創單月新高,"進入 2026 年第二季，財政部今（14）日公布 3 月全國賦稅收入初步統計，單月實徵淨額達 2,989 億元，較上年同月大幅增加 665 億元，增幅達 28.6%。累計 1 至 3 月實徵淨額為 6,555 億元，較上年同期成長 18.3%。本月稅收",https://m.cnyes.com/news/id/6420506
61,6420492,鞋材廠百和Q1營收及獲利下滑 單季稅後賺2.6億元EPS0.87元,百和今日公布最新自結獲利資訊，2026 年 3 月稅後純益 1.29 億元，較上月稅後純益 2435 萬元，月增 4.31 倍，年減 41.62%，單月每股純益 0.43 元；累計 2026 年 1-3 月每股稅後純益 0.87 元。,https://m.cnyes.com/news/id/6420492
62,6420487,威盛攜手兩業者 發表全球首創AI雙監控伸縮充電樁,威盛 (2388-TW) 今 (14) 日宣布，攜手電動車維修與車規產品開發的專家亞勁車電與漢裕航，於 2026 台北國際汽機車零配件展 (Taipei AMPA)，首度公開亮相 「雙監控安全伸縮充電樁」，為電動車充電安全提供全方,https://m.cnyes.com/news/id/6420487
63,6420447,同欣電上修今年展望 光通訊業務下半年放量,封測廠同欣電 (6271-TW) 今 (14) 日召開法說會，總經理呂紹萍表示，原預估今年營收年增中個位數百分比，約 4-6%，但現階段看起來優於該區間，主要受惠 AI 帶動光纖通訊相關業務成長，並預期在機台陸續進駐與驗證通過後，光通,https://m.cnyes.com/news/id/6420447
64,6420433,美伊重啟對話現曙光 國際油價跌破100美元大關,隨著市場對美伊重啟對話的預期升溫，緩解了對供應中斷的擔憂，國際油價於周二 (14 日) 亞洲交易時段走低，失守每桶 100 美元大關。布蘭特原油期貨下跌 1.87% 至每桶 97.50 美元，美國西德州中質原油下跌 2.27%,https://m.cnyes.com/news/id/6420433
65,6420426,兆豐金Q1大賺近百億年增逾16% EPS 0.63元 證券受惠台股獲利翻4倍,公股金控龍頭兆豐金 (2886-TW) 今 (14) 日公布 2026 年 3 月自結獲利，單月稅後純益 24.01 億元，累計今年第一季稅後純益達 93.97 億元，較去年同期增長 16.46%，每股稅後純益（EPS）為 0.63 元。儘管核心,https://m.cnyes.com/news/id/6420426
66,6420479,營收速報  - 台新新光金(2887)3月營收129.38億元年增率高達1118.75％,"2026年3月台新新光金(2887-TW) 營收年增成長1118.75% , 盤後股價為24.45元",https://m.cnyes.com/news/id/6420479
67,6420432,中信金Q1大賺231億元創同期新高 EPS 1.18元,中信金控 (2891-TW) 今 (14) 日公告 2026 年 3 月自結財報，單月稅後純益 75.77 億元，累計第一季合併稅後純益 231.04 億元，創下歷年同期新高記錄，每股稅後純益 (EPS) 為 1.18 元。,https://m.cnyes.com/news/id/6420432
68,6420428,〈車用電子展〉華碩旗下宇碩電子三大車用創新齊發 重塑駕駛視覺與安全新世代,華碩 (2357-TW) 集團旗下宇碩電子今 (14) 日參與年度汽車產業盛會「台北國際汽機車零配件展 TAIPEI AMPA」，並於南港展覽館一館 4 樓「AI CAR 主題館」亮相。,https://m.cnyes.com/news/id/6420428
69,6420429,台鐵台中原員工宿舍「包租代管」變搶手宅 活化資產出租率近8成,台鐵為響應政府推動包租代管政策，近年辦理資產多角化經營，活化資產挹注營收，並釋出台中四維街集合式住宅，創造包租代管 2.0 標租案，經耐震補強及管線更新後，去 (2025) 年 10 月竣工，目前出租率近 8 成。,https://m.cnyes.com/news/id/6420429
70,6412439,兩大機構一致看多 標普反彈有望延續,儘管美國總統川普 (Donald Trump) 政府對荷姆茲海峽採取海上封鎖行動，市場不確定性升高，但兩大機構策略師一致認為，標普 500 指數已經觸底,https://m.cnyes.com/news/id/6412439
71,6420425,〈車用電子展〉鴻海高雄電池廠今年大量產 新款Model C將搶先北美在台上市,鴻海高雄電池廠今年量產 新款 Model C 將搶先北美在台上市,https://m.cnyes.com/news/id/6420425
72,6420419,〈台北汽車零配件展〉東元發表新世代電巴扁線油冷高功率動力系統 扁線馬達2027年量產,東元 (1504-TW) 今 (14) 日參展台北國際車用零配件展，於展會中首度發表「T Power Pro 400kW 扁線油冷直驅馬達」，並持續推進商用車布局，電機機電事業群總經理王榮邦也指出，扁線馬達預計 2027 年量產。 ,https://m.cnyes.com/news/id/6420419
