,newsId,title,summary,link
932,6411330,共信-KY衝刺全球取證 預計Q3提交肺癌新藥馬、菲上市許可申請,共信 - KY 衝刺全球取證與國際市長准入速度，總經理林懋元今日表示旗下肺癌新藥 PTS-302，預計今年第三季分別向馬來西亞國家藥品管理局 (NPRA) 及菲律賓食品藥品管理局 (PhFDA) 提交上市許可申請。,https://m.cnyes.com/news/id/6411330
933,6411314,綠色證券標章正式上路！櫃買、證交所聯手初評 先淘汰ESG評鑑20%「末段班」,綠色證券認證制度於 115 年正式實施！櫃買中心今 (8) 日表示，將與台灣證券交易所於 115 年 8 月 31 日前，針對上市櫃公司公開資訊主動進行評估，若企業綠色收入占全年度營收達一定比率且符合特定條件，將授予一級或二級「綠色證券標章,https://m.cnyes.com/news/id/6411314
934,6411316,玉山金首季賺逾百億創同期新高 EPS達0.62元,玉山金控 (2884-TW) 今 (8) 日公布 2026 年 3 月自結財務數據，單月稅後純益 30.1 億元，第一季累計稅後純益 100.57 億元，創歷年同期新高，較去年同期增加 14.39%，每股稅後純益 (EPS) 為,https://m.cnyes.com/news/id/6411316
935,6411329,【量大強漲股整理】台股價量齊揚，還有便宜可以撿嗎？,,https://m.cnyes.com/news/id/6411329
936,6411053,日本首相高市早苗與伊朗總統通話！聚焦停火協議與中東局勢降溫,日本首相高市早苗於美伊達成兩週停火後，與伊朗總統佩澤希齊揚進行約 25 分鐘電話會談，討論停火協議與中東局勢降溫。日本也加速尋求不經荷姆茲海峽的原油替代供應路線。,https://m.cnyes.com/news/id/6411053
937,6411327,川普：美國能輕易恢復對伊朗動武,美國總統川普周三（8 日）表示，如果美國同伊朗談判不順，美方能輕易恢復對伊朗的軍事行動。,https://m.cnyes.com/news/id/6411327
938,6409935,Fed二把手：不確定性正在升高 利率處在良好位置,,https://m.cnyes.com/news/id/6409935
939,6411104,上銀3月營收創3年半新高 攜大銀參展攻面板級封裝,傳動元件大廠上銀科技 (2049-TW) 今 (8) 日公布 3 月自結合併營收達 23.57 億元，月增 26%、年增 17.4%，寫下自 2022 年 10 月以來的新高紀錄。今年第一季營收累計達 63.79 億元，,https://m.cnyes.com/news/id/6411104
940,6410670,最終期限前90分鐘大反轉！從「毀滅文明」到「TACO兩週」：川普的12小時驚魂極限施壓,,https://m.cnyes.com/news/id/6410670
941,6411219,水啦~賺到外太空、旺宏⊕、臻鼎⊕、大銀微⊕,,https://m.cnyes.com/news/id/6411219
942,6411223,〈電子五哥營收〉廣達GB300出貨動能強勁 3月、Q1營收雙寫新猷,廣達今 (8) 日公告 3 月營收 3628.03 億元，第一季營收 8092.21 億元，3 月與第一季營收雙雙創下歷史新高。廣達指出，第一季輝達 GB300 出貨順暢，出貨量已高於 GB200，也是推升營收的主要動能。 ,https://m.cnyes.com/news/id/6411223
943,6411196,〈富邦媒展望〉價格只是競爭一部分 三大履約體驗成電商勝出分水嶺,價格只是競爭一部分 履約體驗成電商勝出分水嶺,https://m.cnyes.com/news/id/6411196
944,6411105,駿吉 3月營收5002萬元年增2218%  邁向半導體平台收成期,駿吉 - KY(1591-TW) 轉型效益全面顯現，公司公布 3 月營收達 5002 萬元，月增 30.57%，年增率高達 2218%，已連續 4 個月呈現明顯成長態勢，駿吉 - KY 已從對半導體轉型建置期跨入實質收成階段。,https://m.cnyes.com/news/id/6411105
945,6411213,營收速報  - 大成鋼(2027)3月營收113.77億元年增率高達25.12％,"2026年3月大成鋼(2027-TW) 營收年增成長25.12% , 盤後股價為38.5元",https://m.cnyes.com/news/id/6411213
946,6411052,中東達成兩周停火 日元受油價重挫與升息預期激勵強勢反彈,日元兌美元匯率周三 (8 日) 出現強勢反彈，從本周早些時候逼近 160 的關鍵水位顯著回升，一度突破 158.5 關口，觸及約 158.34。此次升值主要受到中東地緣政治緊張局勢大幅緩解、國際油價崩跌以及日本央行升息預期的多重支撐。,https://m.cnyes.com/news/id/6411052
947,6411106,〈富邦媒展望〉看終端有通膨壓力 瞄準兩大版圖拚GMV,富邦媒看終端有通膨壓力 瞄準兩大版圖拚 GMV,https://m.cnyes.com/news/id/6411106
948,6411085,〈電子五哥營收〉緯創3月、Q1營收雙創高 預期Q2伺服器動能持續走強,緯創 (3231-TW) 今 (8) 日公告 3 月營收 3330.43 億元，第一季營收 8463.03 億元，年增超過 1 倍，再度創歷史單月、單季新高紀錄。緯創預期，伺服器業務將持續走強，第二季表現有望優於第一季。 ,https://m.cnyes.com/news/id/6411085
949,6411049,〈智慧顯示展〉兆元產值挺AI！卓揆：Micro LED技術成算力關鍵 13項戰略產業與AI強強聯手,行政院長卓榮泰今 (8) 日出席 2026 Touch Taiwan 系列展，強調顯示器產業年產值高達 1 兆元，是台灣經濟重要支柱。他指出，台灣電子紙技術市占率達 90% 領先全球，且 Micro LED 技術已成為支援 AI 算力的關鍵。政,https://m.cnyes.com/news/id/6411049
950,6411170,美伊停火利多引爆多頭！掌握三月「關鍵密碼」提前卡位,,https://m.cnyes.com/news/id/6411170
951,6410968,法國牽頭15國協助恢復荷姆茲海峽航運！馬克宏呼籲美伊協議納入黎巴嫩,在美國與伊朗宣布停火後，法國總統馬克宏表示約有 15 國參與規劃，協助恢復荷姆茲海峽航運，並呼籲確保黎巴嫩納入停火協議，以維護地區安全與能源供應穩定。,https://m.cnyes.com/news/id/6410968
952,6410449,美以伊局勢急轉彎 全球市場應聲狂歡 分析師：目前行情更像是「算法狂歡」,,https://m.cnyes.com/news/id/6410449
953,6411040,中東暫停戰火投資該進或退? 鉅亨買基金點名「這關鍵」將決定市場走向,川普於美國時間 4 月 7 日宣布，將對伊朗的軍事行動暫停 2 周，伊朗方面亦接受此一臨時停火安排，雙方後續將轉向談判桌。對此協議，「鉅亨買基金」今 (8) 日指出，未來應聚焦「交換條件」是否能真正落實。,https://m.cnyes.com/news/id/6411040
954,6411043,麗臺3月營收亮眼年增逾8成 AI應用需求噴發助攻,板卡廠麗臺 (2465-TW) 今 (8) 日公布 3 月營收為 6.2 億元，受惠於台灣市場 AI 應用相關產品需求所致，月年雙增，其中年成長逾八成；儘管麗臺夥伴美超微 (SMCI-US) 近期捲入美國司法調查導致股價震盪，但麗臺基本面仍具強,https://m.cnyes.com/news/id/6411043
955,6411013,TPK-KY推進切入半導體領域 先進封裝TGV核心技術7月試產送樣,TPK-KY(3673-TW) 參與 2026 Touch Taiwan 創新技術展開幕活動，並於今 (8) 日正式宣布將以先進封裝 Through Glass Via（下稱 “TGV”）玻璃通孔技術為核心戰略，開發未來運用於高階,https://m.cnyes.com/news/id/6411013
956,6410714,《紐約時報》揭為何Anthropic要「克制」發表Claude Mythos,美國 AI 公司 Anthropic 推出最新大語言模型 Claude Mythos Preview，僅向 40 家科技公司聯盟開放。模型能快速發現全球主流系統漏洞，對網路安全與國家安全帶來深遠影響，專家呼籲美中合作防範,https://m.cnyes.com/news/id/6410714
957,6411039,〈港股盤後〉地緣局勢緩和引爆漲勢 恒指升逾3% 科技與半導體領漲,"港股主要指數周三 (8 日) 受地緣政治利好消息刺激，迎來久違的強勁反彈。恒生指數全日大漲 776 點，漲幅達 3.09%，報 25,893 點；恒生科技指數更是暴漲 5.22%，成功站上 4,900 點關口。",https://m.cnyes.com/news/id/6411039
958,6411003,市場快訊》美伊停火不等於落幕，市場接下來看這兩大關鍵,,https://m.cnyes.com/news/id/6411003
959,6409990,"〈陸股盤後〉美國、伊朗同意停戰兩周 滬指接近4,000點","中國 A 股三大指數周三（8 日）同步走高，滬指接近 4,000 點，在美國對伊朗設下最後期限截止前不到兩小時，美國總統川普表示，他已同意暫緩對伊朗基礎設施的預定攻擊，為期兩周。",https://m.cnyes.com/news/id/6409990
960,6410970,永笙-KY 暫定承銷價21元 4月下旬掛牌上市 細胞三箭助攻營運,永笙 - KY(4178-TW) 將於明 (9) 日召開上市前法說會，預計 4 月下旬以暫定承銷價 21 元掛牌上市。執行長李冬陽指出，細胞三箭為公司重要成長動能，且已進入收割期，包括細胞新藥、細胞供應以及細胞服務。 ,https://m.cnyes.com/news/id/6410970
961,6410969,〈台幣〉避險情緒降溫 股匯雙漲強升1.82角至31.785元,〈台幣〉避險情緒降溫 股匯雙漲強升 1.82 角至 31.785 元,https://m.cnyes.com/news/id/6410969
962,6410770,中東85%原油流向亞洲！韓日鬆綁結算限制 「石油人民幣」加速成形,,https://m.cnyes.com/news/id/6410770
963,6410738,V4快來了？DeepSeek網頁上線快速與專家雙模式 首次引入模式分層設計、擅長處理複雜問題,,https://m.cnyes.com/news/id/6410738
964,6410610,壽司郎中國市場面臨營運與食安雙重大考,日本迴轉壽司巨頭壽司郎在中國市場正經歷一場「成長的煩惱」。儘管業績呈現爆發式增長，但近期因嚴厲的預約審核制度與食品安全風波，使其陷入輿論中心，面臨營運秩序與品牌信任的雙重挑戰。,https://m.cnyes.com/news/id/6410610
965,6410952,〈房產〉跨足房產買租管售 房仲業者住商機構發布第三品牌「安家地產」,住商機構今 (8) 日宣布「全房聯 X 雙產業共構」會中，住商機構董事長陳錫琮宣布，首度跨足包租代管領域，創立第三品牌「安家地產」，透過雙產業共構，重新定義「安家服務」，並宣告台灣房仲業正式邁入「買、租、管、售」一條龍服務。,https://m.cnyes.com/news/id/6410952
966,6410996,營收速報  - 華邦電(2344)3月營收145.01億元年增率高達91.49％,"2026年3月華邦電(2344-TW) 營收年增成長91.49% , 盤後股價為95.6元",https://m.cnyes.com/news/id/6410996
967,6410888,聯嘉連3個月營收創新高 切入智慧城市領域開始貢獻,聯嘉連 3 個月營收創新高 切入智慧城市領域開始貢獻,https://m.cnyes.com/news/id/6410888
968,6410887,大立光敲定4/16與台積電同日召開法說會 林恩平將釋營運展望,大立光敲定於 4 月 16 日與台積電同日召開召開法人說明會，除公布 2026 年第一季最新獲利成績之外，並將由執行長林恩平釋出營運展望，法人關注新廠一再加入後的大立光產能利用率能狀況以及毛利率能否持穩。,https://m.cnyes.com/news/id/6410887
969,6410641,鎧俠考慮發放上市首筆股利 股價狂飆18%創歷史新高,,https://m.cnyes.com/news/id/6410641
970,6410768,北韓連續兩日發射導彈 駁斥和平共存論調,南韓聯合參謀本部公布，北韓周三 (8 日) 上午再次向東部海域發射多枚短程彈道飛彈。此舉被視為對南韓政府近期試圖緩和兩韓緊張局勢的直接回絕，並明確畫清界線。,https://m.cnyes.com/news/id/6410768
971,6410832,川普TACO點火台股！主被動ETF搶先創高 00894年報酬124%稱冠,美國總統川普宣布美伊戰事停火兩周，台股迎來報復性反彈，今 (8) 日大漲 1531.56 點，創史上第二大漲點紀錄。加權指數雖然尚未回到 35000 點，但已有多檔主動台股 ETF 率先創高,https://m.cnyes.com/news/id/6410832
972,6410852,需求湧現 尖點3月、Q1營收進入歷史高檔 新增產能拓展中,PCB 鑽針及代鑽服務廠尖點科技 (8021-TW) 今 (8) 日公布最新營收資訊，3 月營收 4.73 億元，月增 14.46%，年增 51.36%，2026 年第一季營收 13.4 億元，年增 50.96%，尖點 3 月營收創新高。,https://m.cnyes.com/news/id/6410852
973,6410758,〈智慧顯示展〉群創洪進揚：「能漲的都漲了」先進封裝產能滿載 今年訂單沒問題,群創洪進揚：上半年毛利率正向 先進封裝產能滿載今年訂單沒問題,https://m.cnyes.com/news/id/6410758
974,6410854,川皇之亂有解？介紹你三檔多頭好標的！,,https://m.cnyes.com/news/id/6410854
975,6410769,美伊暫時停火 人民幣離岸價創3年新高,,https://m.cnyes.com/news/id/6410769
976,6409988,《彭博》駁斥蘋果摺疊機難產報導：9月與iPhone 18同步推出,知情人士透露，蘋果首款摺疊式 iPhone 將按計畫於 9 月與 iPhone 18 Pro 同步發表，儘管工程測試曾引發延遲疑慮，但目前上市時程未變。新機預計採用大螢幕設計、優化摺痕與耐用性，價格可能突破 2000 美元，成為蘋果擴展,https://m.cnyes.com/news/id/6409988
977,6410761,美以伊同意暫時停火！阿布達比股市大漲3.5%  杜拜股市飆逾10%創2014年12月來最大漲幅紀錄,,https://m.cnyes.com/news/id/6410761
978,6410654,音樂龍頭易主？阿克曼砸640億美元想買環球音樂 騰訊是第二大股東,,https://m.cnyes.com/news/id/6410654
979,6410721,文明消亡的邊緣？華爾街日報：川普對伊最後通牒驚魂全紀錄,美東時間周二 (7 日) 上午 8 時 06 分，美國總統川普透過社群媒體發布了其任內最令人震驚的最後通牒。他在這篇僅 85 個英文單詞的帖子中警告，除非伊朗在未來 12 小時內與美國達成協議，否則「整個文明將在今晚消亡，永不,https://m.cnyes.com/news/id/6410721
980,6410753,伊朗勝利！德黑蘭市民湧上街頭  揮舞國旗慶祝「美國和以色列的失敗」,,https://m.cnyes.com/news/id/6410753
981,6410663,川普：美國將協助緩解荷姆茲海峽航運,美國總統川普宣布將協助緩解荷姆茲海峽航運壅塞，並與伊朗達成為期兩週的停火協議。隨著封鎖解除，超過 1.3 億桶原油與數千萬桶燃料可望重返市場，牽動全球油價走勢。,https://m.cnyes.com/news/id/6410663
982,6410132,通膨警報大作！油價狂飆 美3月CPI恐見史上最大漲幅之一,,https://m.cnyes.com/news/id/6410132
983,6410645,船東緊盯荷姆茲海峽停火窗口期 渴望撤出被困的800多艘船隻,隨著美國與伊朗周二 (7 日) 達成停火協議，受困於波斯灣數周的航運業終於迎來一線曙光。據《彭博》報導，目前約有超過 800 艘船隻滯留在波斯灣內，船東們正急於解讀協議細節，期盼能利用這段暫時開放的窗口期，將船隻與數萬名船員安全撤,https://m.cnyes.com/news/id/6410645
984,6410698,"營收速報  - 緯創(3231)3月營收3,330.43億元年增率高達117.7％","2026年3月緯創(3231-TW) 營收年增成長117.7% , 盤後股價為131元",https://m.cnyes.com/news/id/6410698
985,6410696,"營收速報  - 廣達(2382)3月營收3,628.03億元年增率高達88.42％","2026年3月廣達(2382-TW) 營收年增成長88.42% , 盤後股價為307.5元",https://m.cnyes.com/news/id/6410696
986,6410647,和碩展示最新AI伺服器解決方案 深化日本市場布局,和碩將於 Japan IT Week 2026 展出最新 AI 基礎架構技術，展示垂直整合策略如何協助客戶以更高效率與彈性加速 AI 部署。此外，為深化日本市場布局，和碩於其東京服務中心，提供即時的在地化技術支援與售後服務。,https://m.cnyes.com/news/id/6410647
987,6410652,面對盧比疲軟與通膨壓力 印度維持關鍵利率不變,印度央行周三 (8 日) 以 6 比 0 的票數一致通過，將基準回購利率維持在 5.25% 不變。這是自中東危機爆發以來，印度央行的首個利率決策。儘管面臨地緣政治動盪與本國貨幣盧比走軟的雙重壓力，央行仍決定採取「觀察與等待」的,https://m.cnyes.com/news/id/6410652
988,6410620,〈台股盤後〉停火開狂歡趴 噴出史上第二大漲點1531點 4天狂漲3038點,受到美國總統川普同意美伊停火兩周消息激勵，台股今 (8) 日開盤即展現強勁上攻力道，在電、金、傳產多頭齊發下，盤中最高狂飆 1478.99 點、觸及 34708.81 點，創下史上第三大漲點紀錄。終場收 34761.38 點,https://m.cnyes.com/news/id/6410620
989,6410569,川普：中國協助伊朗重返談判桌 達成停火協議,,https://m.cnyes.com/news/id/6410569
990,6410609,面對小米挖角大將 馬斯克豪擲5000萬人民幣能否鎖住核心人才？,近期一系列跡象顯示，特斯拉 (TSLA-US) 正處於一場戰略轉型與人才危機的交匯點。一方面，執行長馬斯克 (Elon Musk) 正帶領公司進行高風險的豪賭；另一方面，公司內部高層卻出現了顯著的拋售潮與人才流失。,https://m.cnyes.com/news/id/6410609
991,6410125,伊朗戰火擾亂市場 資金湧入中國銀行股避險,,https://m.cnyes.com/news/id/6410125
992,6410627,TaipeiPLAS 2026以塑造未來為主軸9/15登場 聚焦塑橡膠產業三大升級發展,「台北國際塑橡膠工業展 (TaipeiPLAS)」將於今 (2026) 年 9 月 15 日至 19 日在南港展覽館登場，目前已開放線上參觀登記，邀請國內外業者掌握產業升級與發展契機。,https://m.cnyes.com/news/id/6410627
993,6410446,誰在收割18兆美元紅利？麥肯錫揭秘18個增長最快產業,麥肯錫最新報告揭示，2026 年全球經濟增長由 18 大未來競技場主導，AI、電動車、雲端運算及太空領域高速擴張。9 家全能規模者（Omniscalers）跨賽道競爭，總收入達 2.7 兆美元，美中企業掌握 90% 市值，全球產業格局清,https://m.cnyes.com/news/id/6410446
994,6409885,IMF擬下修全球經濟成長預測 要各國「繫好安全帶」,,https://m.cnyes.com/news/id/6409885
995,6410454,伊朗對美拋停戰10項條件：解制裁、支付賠償金、主導關鍵海域,,https://m.cnyes.com/news/id/6410454
996,6410567,〈焦點股〉美伊談判停火 波若威、光環亮燈漲停領族群紅光滿面,台股盤面上，今日光通訊族群受惠 SpaceX 傳推進上市時程，加上 Touch Taiwan 今起開展，包括波若威 (4979-TW)、光環 (3234-TW)、環宇 - KY(4991-TW) 一度亮燈漲停，領族群多檔紅光滿面。,https://m.cnyes.com/news/id/6410567
997,6410527,國票金董事改選25搶15超額大混戰 四大陣營名單一次看,國票金控 (2889-TW) 今年 5 月 29 日股東常會將進行董事改選，昨 (7) 日為候選人提名截止日，觀察此次名單呈現「超額提名」態勢，共計 25 位候選人角逐 15 席董事,https://m.cnyes.com/news/id/6410527
998,6410565,川普發文：荷姆茲海峽將創造「巨大財富」,美國總統川普周三（8 日）表示，美國將幫助處理荷姆茲海峽航運擁堵的問題，「將會有許多積極的行動，巨大財富將被創造」。,https://m.cnyes.com/news/id/6410565
999,6410526,〈焦點股〉晶技最強首季營收33.39億元 股價爆量突破前高,晶技 2026 年第一季營收達 33.39 億元，還較上一季成長 0.44%，爲史上最強的第一季營收，第二季還有產品價格上揚的挹注，今晶技成交量放大爲 4400 張以上，超過昨日全場成交量，股價最高達 98.5 元，突破前波高點。,https://m.cnyes.com/news/id/6410526
1000,6410482,中油負債比92.5%瀕破產！經部：三管齊下 爭取增資能源轉型 提高能源自主率到10%,受地緣政治衝擊與配合穩定物價政策影響，中油目前的負債比已高達 92.5%，幾乎面臨破產邊緣，今（8）日於立法院經濟委員會，立委要求經濟部與中油應積極爭取增資案通過，改變過度仰賴能源進口的現狀。經濟部長龔明鑫坦言中油財務嚴,https://m.cnyes.com/news/id/6410482
1001,6410333,福特鋁關稅豁免遭拒！川普政府政策重創F-150皮卡,美國福特汽車 F-150 鋁製外殼供應因 Novelis 奧斯威戈工廠火災中斷，福特及其他美國汽車製造商申請關稅減免被川普政府拒絕。進口鋁材 50% 關稅及運輸附加費推升成本，汽車業面臨壓力。,https://m.cnyes.com/news/id/6410333
1002,6410367,《大西洋月刊》DeepSeek只是暖身 中國最安靜超車──科技權力轉移,當中國以工程化與產業鏈優勢加速科技突破，美國卻因內部政策與開放性流失面臨結構性挑戰。《大西洋月刊》指出，這場競爭的轉折並非突發，而是長期積累下的靜默變局，正重新定義全球科技權力版圖。,https://m.cnyes.com/news/id/6410367
1003,6410506,預測成真！油價崩跌，台股飆漲！台股大漲1400點後的下一波佈局？,,https://m.cnyes.com/news/id/6410506
1004,6410437,不含黎巴嫩！以總理：支持川普對伊朗停火決定 伊朗：同意談判 但對美「完全不信任」,,https://m.cnyes.com/news/id/6410437
1005,6410478,川普：美伊停火是徹底且完全勝利 伊朗濃縮鈾問題將完美處理,美國總統川普周二 (7 日) 接受《法新社》採訪時表示，伊朗濃縮鈾問題將「完美處理」。,https://m.cnyes.com/news/id/6410478
1006,6410435,〈焦點股〉沒開槓桿也能噴！主動式00988A單日飆漲10% 創掛牌新高,清明連假結束後，台股氣勢如虹連漲二日，今 (8) 日盤中加權指數一度大漲逾 1400 點，重新站回 34000 點關卡。觀察全市場 ETF 漲幅前五名，前四名清一色由槓桿型的正 2 ETF 包辦,https://m.cnyes.com/news/id/6410435
1007,6409915,分析師：市場全錯看AI支出 亞馬遜有望上漲50%,"隨著今年計劃投入 2,000 億美元於人工智慧 (AI) 資本支出，亞馬遜可能成為科技巨頭中支出最高者。部分投資人擔心，公司將數十億美元投入昂貴的資料中心建設，短期內卻難見成效，但法國巴黎銀行分析師並不這麼認為。",https://m.cnyes.com/news/id/6409915
1008,6410450,〈房產〉信義代銷：重劃區「板塊協作」發威 中央新村挾三大優勢成核心亮點,北台灣房產邁向「板塊協作」趨勢，新店中央新村與央北重劃區成指標。信義房屋 (9940-TW) 旗下信義代銷指出，中央新村憑藉低密度、成熟機能與親水地利三大優勢，與央北形成「新舊互補」效應，在區域發展紅利下展現強大保值力。,https://m.cnyes.com/news/id/6410450
1009,6410470,還在觀望就錯過！資金瘋狂卡位，AI主流族群即將噴出,,https://m.cnyes.com/news/id/6410470
1010,6410438,〈焦點股〉美伊停火2周 國際油價應聲崩跌逾13% 台聚四寶一度亮燈跌停,"台股盤中大漲超過 1,400 點，受到原油近期高漲的塑化股，因暫時停戰訊息影響，加上原油期貨大跌超過 10% 以上，多檔遭沉重獲利賣壓，包括台聚 (1304-TW) 集團 4 寶開低走低，盤中亮燈跌停，塑化股多檔下殺重挫。",https://m.cnyes.com/news/id/6410438
1011,6410237,川普揭與北約關係破裂前因後果！一切都始於「這件事」,美國總統川普重申對北約失望，指格陵蘭爭議及對伊朗戰事態度引發分歧。北約秘書長呂特將與川普及美國高層會面，試圖修復關係。,https://m.cnyes.com/news/id/6410237
1012,6410403,越南股市正式升格新興市場9月生效 千億資金活水湧動,全球資本市場迎來關鍵結構性轉變！富時羅素 (FTSE Russell) 正式確認，越南股市將由「邊境市場」升級為「新興市場」，並預計於 2026 年 9 月生效，此舉不僅象徵越南資本市場發展邁入新階段,https://m.cnyes.com/news/id/6410403
1013,6410399,望隼Q1營收10.31億元創高 日本矽水膠Q2量產出貨,望隼 (4771-TW) 受惠終端消費者對美瞳片及功能型鏡片需求強勁，帶動 3 月達營收 3.48 億元，年月雙成長，累計今年第一季營收 10.31 億元，年增逾 2 成，創歷史單季新高紀錄。此外，2 月已取得日本矽水膠證照，第二季量產出貨。,https://m.cnyes.com/news/id/6410399
1014,6404047,魚與熊掌想兼得？獨特3D鎖息策略*，主動出擊穿越牛熊！00999A 控波動追收益，主動選股靈活,,https://m.cnyes.com/news/id/6404047
1015,6410330,通膨與經濟寒冬風暴來襲！高油價推升通膨之際 紐西蘭央行緊急按兵不動 紐元應聲漲逾1.5%,,https://m.cnyes.com/news/id/6410330
1016,6410372,環球時報：鄭麗文訪陸呼應台灣主流民意,應中共中央總書記習近平邀請，國民黨主席鄭麗文周二（7 日）率團經上海抵達南京，開始 6 天大陸參訪行程。這是國民黨主席睽違近 10 年再次率團訪問大陸，受到兩岸媒體和國際輿論高度關注。,https://m.cnyes.com/news/id/6410372
1017,6410356,美媒：AI基建卡關 美國關鍵設備受制中國,數千名工人日夜趕工，試圖為 OpenAI 等科技巨頭打造龐大的算力堡壘。然而，這些手握重金的建造者們此刻卻陷入了前所未有的焦慮——阻擋他們通往 AI 霸權的，不是被封鎖的高端晶片，而是看似平平無奇的關鍵設備：變壓器。,https://m.cnyes.com/news/id/6410356
1018,6410360,萬金股王信驊漲停創新高率40檔千金股同台 12檔高掛漲停紅燈,隨著美伊協議停火，日韓股紛紛大漲表態，台股今 (8) 日也暴力反彈，盤中一度大漲約 1500 點，創下一個月來新高，尤其高價股表現最為強勢，由股王信驊 (5274-TW) 領軍 40 千金股上攻，有多達 12 檔個股出現漲停板，漲勢相當凌厲,https://m.cnyes.com/news/id/6410360
1019,6410236,美以伊開戰第39天戰況彙整：川普宣布兩週停火、伊朗承諾開放荷姆茲海峽,週三（4 月 8 日），美國總統川普宣布與伊朗達成為期兩週停火條件，前提是荷姆茲海峽重新開放。伊朗最高國家安全委員會確認談判將於巴基斯坦展開，以色列同意暫停空襲。海灣多國防空警報響起，局勢仍高度不確定。,https://m.cnyes.com/news/id/6410236
