,newsId,title,summary,link
346,6347913,美最高法院給川普的屈辱大禮！從查理一世到川普 徵稅權的歷史警示,專欄作家 David Frum 在《大西洋月刊》以社論指出，最高法院否決川普以緊急權力徵收關稅的主張，重申徵稅與支出權專屬國會。 2.3 兆美元的財政構想雖因此落空，但美國憲政結構暫時穩固。,https://m.cnyes.com/news/id/6347913
347,6345460,〈潛力股〉榮昌啖Wi-Fi 7、低軌衛星趨勢商機 今年營運強勁成長,〈潛力股〉榮昌啖 Wi-Fi 7、低軌衛星趨勢商機 今年營運強勁成長,https://m.cnyes.com/news/id/6345460
348,6345110,〈馬年景氣展望〉台電強韌電網計畫、AI基建需求旺 重電四雄展望佳,北美四大 CSP 持續上調資本支出，且近一半用於建置資料中心，帶動美國資料中心電力需求，電網商機可期，加上台電強韌電網計畫持續挹注，台廠重電四雄華城、士電、亞力及中興電接受惠，今年展望正向。,https://m.cnyes.com/news/id/6345110
349,6344930,〈人物專訪〉擺脫紅海市場競爭 晶技林萬興：要在AI、網通應用發光,林萬興指出，晶技原就看好 2026 年由網通、AI 伺服器等基建帶動的高階頻率元件需求成長， 帶來新的市場機會，晶技 2026 年在營收有機會再小幅成長；同時，晶技在每年都投入占營收 7-8% 的研發費用，在競爭力也不容忽視。,https://m.cnyes.com/news/id/6344930
350,6347912,《華爾街日報》社論：法院不是橡皮圖章！真正關稅解放日,最高法院以 6 比 3 否決川普依緊急權力徵收大規模關稅，強調徵稅權專屬國會，並重申重大問題須經明確授權，為行政擴權劃下清晰界線。,https://m.cnyes.com/news/id/6347912
351,6347716,《華爾街時報》全球十大機器狗榜出爐：中國企業拿下八席！,《華爾街時報》2025 年度全球四足機器人榜單顯示，中國企業以 8 席壓倒性優勢登榜，從消費級到工業級全面覆蓋，展現技術、產能與全球化市場的領先地位，改寫全球機器人產業格局。,https://m.cnyes.com/news/id/6347716
352,6342305,AI測試難度大增 測試介面四雄今年營運續攀峰,AI 基礎建設進入高速成長期，AI GPU、AI ASIC 需求同步暢旺，在晶片功耗大增、訊號傳輸提升以及小晶片架構趨勢延續下，測試介面為 AI 晶片量產前的守門員，也持續迎來大升級，產業迎來量價齊揚，台廠包括旺矽 (6223-T,https://m.cnyes.com/news/id/6342305
353,6347893,川普單邊課稅遭最高法院打臉 蘋果32億美元恐掀退款風暴,美國最高法院以 6 比 3 裁定川普對等關稅違法，推翻實施 10 個月的政策。蘋果已承擔約 32 億美元關稅，退款機制未明，企業與市場仍面臨不確定性。,https://m.cnyes.com/news/id/6347893
354,6345126,投信法人看旺開紅盤金馬報喜！AI供應鏈迎收割期 企業獲利看增逾3成,台股金蛇年完美收官！在權值王台積電與 AI 供應鏈帶動下，以 33605.71 點創下史上最強封關紀錄，全年累計狂飆 10080 點。展望金馬年，安聯、新光、台新及玉山等投信業者一致認為，,https://m.cnyes.com/news/id/6345126
355,6347876,英國政府考慮將英王胞弟安德魯踢出王位繼承順序,英國政府周五（20 日）正考慮制定新法，將前王子安德魯 · 蒙巴頓 - 溫莎踢出王位繼承順序。,https://m.cnyes.com/news/id/6347876
356,6347701,〈美股13F報告〉貝萊德調倉：加倉核心科技股輝達、蘋果 布局新材料、化工 持倉市值達5.92兆美元,貝萊德近日發布的第四季持倉報告顯示，其持倉總市值達到 5.92 兆美元，季增 3.67%。報告中提到，貝萊德對輝達、蘋果等科技股進行增持，同時在新能源車和新材料領域展現新的佈局策略。,https://m.cnyes.com/news/id/6347701
357,6345461,0050勇奪2025親子存股冠軍！壓歲錢22年翻15倍 滾出百萬留學基金,元大台灣 50(0050-TW)2025 年風光無限，席捲定期定額、總投資人數冠軍，大型證券商公布的親子理財熱門標的，同樣由 0050 拔得頭籌，顯示新時代的爸媽相對更加重視理財成長性，不少人在孩子出生後馬上開立帳戶,https://m.cnyes.com/news/id/6345461
358,6343094,台灣太空供應鏈關鍵機會、暨低軌衛星五檔爆發潛力股,,https://m.cnyes.com/news/id/6343094
359,6347868,遊戲營收下滑10% 微軟38年老將退場 Xbox轉型AI時代,微軟宣布，任職 38 年的 Xbox 負責人 Phil Spencer 將退休，由 AI 高層 Asha Sharma 接任。此時遊戲營收下滑 10%、主機銷量落後對手，微軟正加速整合 AI 與遊戲布局。,https://m.cnyes.com/news/id/6347868
360,6347855,川普簽行政命令 2月24日起全球加徵10%關稅、豁免範圍出爐,,https://m.cnyes.com/news/id/6347855
361,6345463,馬年紅包理財術 主動型債券ETF殖利率穩守6% 搭月配機制成小資心頭好,農曆新年後，如何運用年終獎金與紅包打造長期增值潛力，成為投資人關注焦點。法人指出，2026 年全球經濟雖穩健成長，但關稅與通膨變數猶存，且股市基期已高，建議投資人將資金投入「主動式債券 ETF」透過專業經理人動態調整投組,https://m.cnyes.com/news/id/6345463
362,6347875,多國敦促在伊朗公民儘快撤離,德國、瑞典、斯洛伐克等國周五（20 日）敦促在伊朗的本國公民儘快撤離。此前一天，波蘭總理圖斯克也發出類似呼籲。,https://m.cnyes.com/news/id/6347875
363,6347687,〈紐約匯市〉最高法院推翻關稅案 美元先跌後穩 周線強彈1% 仍創三個月最強周漲幅,美國最高法院以 6 比 3 否決川普關稅權限，引發匯市震盪。美元指數跌至 97.72，但在聯準會偏鷹與地緣風險支撐下，全周仍上漲約 1%，創近三個月最佳表現。,https://m.cnyes.com/news/id/6347687
364,6345681,AI驅動光通訊發光 法人：矽光ASP有望隨傳輸速度提升而成長,台廠供應鏈從高速光模組製造到系統設備廠，受惠於北美雲服務巨頭 (CSP) 的資本支出持續增加，法人預期矽光 (CPO) 的 ASP(產品均價) 有望隨速度提升，將持續挹注業績成長。,https://m.cnyes.com/news/id/6345681
365,6347688,堪稱「AlphaFold 4」！谷歌旗下AI製藥公司推新引擎IsoDDE 性能翻倍卻全面閉源,谷歌旗下 Isomorphic Labs 發布新一代 AI 藥物設計引擎 IsoDDE，在多項測試中性能遠超 AlphaFold 3，但選擇全面閉源，引發學界對 AI 科學工具未來開放與商業化走向的討論。,https://m.cnyes.com/news/id/6347688
366,6347829,〈美股盤後〉川普全球關稅被推翻 美股歡漲 三大指數周線攀高,,https://m.cnyes.com/news/id/6347829
367,6325757,〈馬年景氣展望〉低軌衛星引爆商機 網通廠布局多年迎收割期,隨著全球對高速網路與無死角通訊的需求日益增長，低軌衛星（LEO）技術正成為繼 5G 之後的通訊新戰場。台灣網通廠在地面設備、衛星通訊晶片與射頻元件等領域積極佈局，力圖在 SpaceX、OneWeb 等國際巨頭的供應鏈中佔據一席之,https://m.cnyes.com/news/id/6325757
368,6347715,繼紐約聯準會報告打臉後 川普關稅又遭美最高法院否決依據 民調也不利,最高法院以 6 比 3 裁定川普加徵關稅逾越權限，多份研究顯示企業與消費者承擔近九成成本，貿易逆差仍高達 1.241 兆美元，政策成效備受質疑。,https://m.cnyes.com/news/id/6347715
369,6343930,〈潛力股〉立碁搶攻矽光子商機 今年營運拚優於去年,LED 封裝廠立碁 (8111-TW) 近年積極轉型，全力衝刺利基型產品與前瞻技術佈局，並已成功加入矽光子國家隊，今年將以利基產品放量與矽光子研發推進為雙主軸，持續降低傳統 LED 元件比重，並預計第 1 季投入千萬元資金擴充無塵室與,https://m.cnyes.com/news/id/6343930
370,6347717,川普關稅遭最高法院判無授權 美股勁揚 市場押注7月才降息,美國最高法院否決川普關稅法律依據，引發市場震盪，美股走揚；同時核心 PCE 升至 3%，GDP 放緩至 1.4%，聯準會降息時點再添變數。,https://m.cnyes.com/news/id/6347717
371,6347783,川普考慮對伊朗發動有限軍事打擊！10至15天內決定、油價飆升、荷莫茲海峽成最大風險,美國總統川普表示正考慮對伊朗核計畫發動有限軍事打擊，並將在 10 至 15 天內做出決定。美軍加強中東部署，市場憂心美伊衝突恐衝擊荷莫茲海峽石油運輸，國際油價本週大漲逾 5%。,https://m.cnyes.com/news/id/6347783
372,6347775,川普宣布對全球商品徵收10%新關稅！反擊最高法院裁定,在美國最高法院裁定緊急關稅違法後，川普宣布依《1974 年貿易法》第 122 條對全球加徵 10% 關稅為期 150 天，並強調第 232 條與第 301 條關稅持續生效，未來恐再推新一輪貿易調查與關稅措施。,https://m.cnyes.com/news/id/6347775
373,6347758,川普訪中會習近平日期出爐！最高法院撤銷關稅打亂談判 貿易休兵現變數？,美總統川普預計於 3 月 31 日至 4 月 2 日訪問中國，與習近平會談，雙方將討論貿易休兵延長、最高法院撤銷美國出口關稅影響，以及台灣等地緣政治議題。,https://m.cnyes.com/news/id/6347758
374,6347686,地緣政治風險推升美元！歐元承壓逼近一個月低點,,https://m.cnyes.com/news/id/6347686
375,6347702,美最高法院駁回川普關稅政策！歐盟尋求美國澄清後續措施,,https://m.cnyes.com/news/id/6347702
376,6347712,違憲徵稅！最高法院KO川普全球關稅政策 美財政意外之財「泡湯」,,https://m.cnyes.com/news/id/6347712
377,6347268,台灣爸媽最怕「美國人」子女離婚被分走財產？PwC授3絕招幫你守「金庫」,資誠（PwC Taiwan）指出，台灣父母在規劃贈與或遺產給美籍子女時，最擔心的莫過於子女若面臨離婚，財產是否會被視為婚姻共有而遭對半平分。資誠美國業務負責人蘇宥人強調，資產是否具備個別性，關鍵在於居住州的法律規定以及是,https://m.cnyes.com/news/id/6347268
378,6341809,馬年第3位2千萬元幸運兒！土城房仲新鮮人領錢再戰 刮出超級紅包,新北市土城區迎來春節最強財神爺，一名 20 多歲的房仲業新鮮人，在土城常生錢彩券行幸運刮中 2000 萬超級紅包頭獎。這名幸運兒最初連刮 3 張皆未如願，原本打算收手，但在老闆娘一句「會等你」的溫情喊話下，決定領錢再戰，沒想到回頭購,https://m.cnyes.com/news/id/6341809
379,6347645,韓國軍方揭露：美中戰機在黃海上空對峙,據《韓聯社》周五（20 日）報導，韓軍多名消息人士透露，駐韓美軍日前在黃海公海上空進行訓練期間，曾與中方戰機對峙。,https://m.cnyes.com/news/id/6347645
380,6347553,日本機器人大國保衛戰：從「硬體精度」轉向「物理 AI」的生存突圍,長期以來，機器人產業一直是日本的強項，1990 年代日本製造的機器人曾占據全球 80% 的市場份額。然而，隨著全球競爭重心從單純的硬體製造，轉向操控機器人的數據規模與人工智慧，日本企業的存在感正逐漸減弱。,https://m.cnyes.com/news/id/6347553
381,6347509,高殖利率吸金！外資1月狂掃日債6.04兆日元 規模創歷史次高紀錄,,https://m.cnyes.com/news/id/6347509
382,6347552,港股馬年首個交易日大盤下挫 但AI概念、機器人飆漲,港股周五 (20 日) 迎來農曆馬年首個交易日。儘管大盤整體承壓，恒生指數收盤下跌 1.1%，報 26413.35 點，恒生科技指數更重挫 2.91%，但市場中的人工智能應用及機器人概念股卻呈現爆發式增長，成為市場焦點。,https://m.cnyes.com/news/id/6347552
383,6347500,價格波動劇烈致央行購金速度放緩！高盛：暫時現象 大型新興國家央行配置仍低,,https://m.cnyes.com/news/id/6347500
384,6347511,Google正式發表Gemini 3.1 Pro 全面強化複雜任務處理能力,Google(GOOGL-US) 周四 (19 日) 透過官方部落格，突然宣布推出其最新的人工智慧核心模型 Gemini 3.1 Pro。這款模型被定位為處理最複雜任務的「智慧升級版」，象徵著 Google 在 AI 核心推理能,https://m.cnyes.com/news/id/6347511
385,6347506,最後通牒？川普給伊朗設定15天期限否則遭遇「不幸」布蘭特原油應聲漲破72美元,,https://m.cnyes.com/news/id/6347506
386,6347487,美伊關係緊繃！美國在中東集結伊拉克戰爭以來最大空中兵力,連日來美伊緊張局勢不斷升溫，美軍向中東大幅增兵，頻頻釋放要動手的信號。,https://m.cnyes.com/news/id/6347487
387,6347481,快訊！高市早苗：暫停徵收食品和飲料銷售稅兩年,日本首相高市早苗周五（20 日）在向國會發表的施政演說中表示，將在不依賴赤字融資債券的情況下，暫停徵收食品和飲料的銷售稅兩年。,https://m.cnyes.com/news/id/6347481
388,6347356,AI一天生成2億美元大片！德國工作室短片媲美好萊塢 評價兩極,德國一間創意工作室近日發布一部三分鐘的科幻短片，引發廣泛關注。該工作室稱，這支影片在視覺效果與規模上可媲美一部耗資 2 億美元的好萊塢製作電影，且完全由人工智慧 (AI) 在一天內生成。,https://m.cnyes.com/news/id/6347356
389,6347350,美最高法院即將裁決IEEPA權限 1300億美元與貿易權力懸而未決,"美國最高法院預計於美東時間周五 (20 日) 上午 10 時開庭，全球市場正高度屏息，關注一項可能對美國貿易政策產生震盪影響的裁決。此案名為「Learning Resources, Inc. 訴川普案」(Learning Reso",https://m.cnyes.com/news/id/6347350
390,6342894,〈觀察〉IC設計業者資源轉向 搶食雲端AI ASIC商機,隨著 AI 雲端資料中心與相關 ASIC 需求快速攀升，帶動 ASIC 市場規模持續擴大，台灣 IC 設計業者過往普遍在消費型電子領域，過去數年也加速將資源轉向 AI 與雲端運算領域布局，當中以聯發科 (2454-TW) 進度最為領先，不僅已成,https://m.cnyes.com/news/id/6342894
391,6345732,〈觀察〉AI 用電激增 電源廠「電源+能源基建」雙軌並進布局搶商機,〈觀察〉AI 用電激增 電源廠「電源 + 能源基建」雙軌並進布局搶商機,https://m.cnyes.com/news/id/6345732
392,6347312,三登中國春晚 宇樹科技訂單暴漲150% 目標年出貨兩萬台邁向IPO,2026 年中國馬年春晚中，人形機器人組成的「主角團」成為今年最吸睛的科技亮點。宇樹科技、銀河通用、松延動力及魔法原子等企業的機器人，在舞台上展示了從武術特技到家務處理的全方位能力，這股「科技風」也直接吹向消費市場。據統計,https://m.cnyes.com/news/id/6347312
393,6347427,知情人士：川普考慮對伊朗發動「有限規模」初步打擊,美國方面消息稱，美國總統川普正權衡對伊朗發動一次「有限規模」的初步軍事打擊，以迫使伊朗接受美國提出的核協議要求。,https://m.cnyes.com/news/id/6347427
394,6345098,〈馬年景氣展望〉關稅底定 藥華藥、保瑞及美時營運看增,我國談判團隊已與美國完成「台美對等貿易協定 (ART)」簽署，確立對等關稅調降至 15% 且不疊加。對於藥華藥 (6446-TW)、保瑞 (6472-TW) 及美時 (1795-TW) 等積極布局美國的藥廠，無疑是利多，今年營運看增。 ,https://m.cnyes.com/news/id/6345098
395,6347355,輝達的不敗神話或許終有盡頭？,然而，一小部分敏銳的觀察者卻看到了隱憂。他們認為，輝達為維持霸主地位所建構的複雜生態暗藏風險，即透過投資和融資安排「餵養」客戶，從而刺激並鎖定對其產品的需求。,https://m.cnyes.com/news/id/6347355
396,6347311,中國穩居ASML最大市場 自主化鏈條加速成形,儘管美國與荷蘭政府持續加強對先進半導體設備的出口管制，2025 年最新的財報數據卻呈現出令市場意外的結果—中國依然是 ASML 全球最大的買家。在極紫外光 (EUV) 與先進浸潤式深紫外光 (DUV) 曝光機 (光刻機) 遭到禁售的情況,https://m.cnyes.com/news/id/6347311
397,6341372,〈馬年景氣展望〉元月出口開紅盤！工具機迎「反轉年」 人形機器人零組件成新戰場,台灣工具機產業自 2025 年底陸續出現復甦跡象，隨著台美關稅敲定 15% 不疊加，加上 AI 應用落地、半導體擴廠需求，以及市場熱議的「人形機器人」題材，不少工具機廠商與公會看好今年景氣回溫，,https://m.cnyes.com/news/id/6341372
398,6347354,德銀報告：這五大產業最容易被AI顛覆,德意志銀行於 2 月 16 日發表題為〈人工智慧如何看待自身及對世界的影響〉(What AI says about AI eating itself and the world...) 報告，解析最容易受到 AI 顛覆的五大產業。,https://m.cnyes.com/news/id/6347354
399,6343919,〈馬年景氣展望〉筆電面臨成本通膨逆風 PC、板卡廠強攻AI伺服器與非PC應用突圍,全球筆電市場近期面臨嚴峻挑戰，研調機構 TrendForce 預估 2026 年首季全球筆電出貨量將季減 14.8%，全年出貨恐衰退 9.4%。儘管 PC 市況蒙塵，國內大廠華碩 (2357-TW)、宏碁 (2353-TW)、華,https://m.cnyes.com/news/id/6343919
400,6347388,UFO真相要揭曉？川普下令解密外星檔案,美國總統川普周四 (19 日) 表示，他將指示國防部長赫格塞斯 (Pete Hegseth) 及其他相關機構，開始辨識並公布與外星人及外星生命、不明空中現象 (UAP) 以及不明飛行物 (UFO) 相關的政府檔案。,https://m.cnyes.com/news/id/6347388
401,6343060,光通訊產業概述、最具爆發性成長潛力的五檔(二),,https://m.cnyes.com/news/id/6343060
402,6347313,從北京「減量」到廣深「疏解」 中國要求超特大城市告別規模擴張時代,中國在 1 月透過《求是》雜誌，發表了中央城市工作會議上的講話，其中有句話為未來中國頂級城市的發展指明了方向：「要推動超大特大城市『強身健體』，做強做精核心功能，控制超大城市規模，合理有序疏解非核心功能，打造高質量發展主引擎,https://m.cnyes.com/news/id/6347313
403,6347314,突破6G關鍵瓶頸 中國科學家首創「一體化融合通信」系統刷新三項世界紀錄,由中國北京大學電子學院王興軍教授團隊領銜，聯合鵬城實驗室、上海科技大學及國家信息光電子創新中心等科研團隊，在光通信與 6G 領域取得重大進展。該研究成功研發出「光纖—無線一體化融合通信系統」，有效解決了光纖通信與無線通信在信,https://m.cnyes.com/news/id/6347314
404,6337793,〈名人書單〉聲寶總裁陳盛沺暢談經營哲學 借鏡孫子兵法與蒙格智慧看透局勢,聲寶 (1604-TW) 集團總裁陳盛沺分享其個人閱讀書單及對當前地緣政治局勢的看法。他特別推崇《孫子兵法》與波克夏副董事長查理蒙格的著作，並透露已自掏腰包購入二十套《孫子兵法》分送給公司內部高層研讀，強調商場競爭如同兵法戰,https://m.cnyes.com/news/id/6337793
405,6347205,三星HBM4傳調漲三成 記憶體荒恐一路燒到2027年,,https://m.cnyes.com/news/id/6347205
406,6347359,日本通膨跌破日銀2%目標 2022年3月以來首見 ,據《CNBC》報導，日本 1 月整體通膨率降至 1.5%，為 2022 年 3 月以來最低水準。這項數據終結了通膨連續 45 個月高於日本銀行 (BoJ)2% 目標的紀錄。,https://m.cnyes.com/news/id/6347359
407,6342514,〈潛力股〉敬鵬擴泰國營運量能逐步到位有利業績向上,敬鵬 (2355-TW) 在泰國的舊廠完成整修陸續投產，而新廠也正式動工，同時，在汽車板之外，敬鵬在泰國的產能並朝向開發通訊與工業電子相關應用布局，敬鵬股價 2 月 11 日收在 38.35 元仍低於每股淨值 41.2 元。,https://m.cnyes.com/news/id/6342514
408,6347310,黃仁勳罕見逐桌敬酒 預告GTC 2026將推出「震驚世界」的新晶片,輝達 (NVDA-US) 執行長黃仁勳近期展開一系列罕見的戰略行動，不僅在公開場合預告即將推出劃時代的產品，更私下展現其對合作夥伴工程團隊的高度重視,https://m.cnyes.com/news/id/6347310
409,6347341,〈紐約匯市〉美元升至近一個月高點 Fed會議紀錄暗示可能升息,美元周四 (19 日) 上漲，在聯準會 (Fed) 會議紀錄暗示未來可能升息以對抗通膨後，美元升至接近一個月高點。,https://m.cnyes.com/news/id/6347341
410,6345217,高市早苗勝選後日股攻勢再起 鉅亨買基金：弱勢日圓反助企業獲利,「鉅亨買基金」總經理張榮仁表示，日本政府後續政策走向，將可能採取發債搭配央行調節利率的路徑，雖可能帶動日圓走弱，卻有助提升企業競爭力，整體仍偏多看待日股。,https://m.cnyes.com/news/id/6345217
411,6347340,〈美股盤後〉四大指數收低 私募股權股急挫 蘋果拖累標普,美國股市周四 (19 日) 收低，私募股權公司下跌，加上蘋果 (AAPL-US) 與沃爾瑪 (Walmart)(WMT-US) 走弱拖累大盤，受財報激勵的工業股上漲則抑制了跌幅。,https://m.cnyes.com/news/id/6347340
412,6347309,聯想在美遭集體訴訟 被控非法轉移大宗數據至中國,聯想集團 (00992-HK) 正於美國加州面臨一項重大的集體訴訟。由 Almeida 律師事務所代表原告 Spencer Christy 提出的訴狀指控，聯想違反了美國司法部 (DOJ) 於 2025 年 4 月實施的「大宗敏,https://m.cnyes.com/news/id/6347309
413,6347177,亞馬遜超車沃爾瑪登頂全球營收王 卻是一場「空洞勝利」,,https://m.cnyes.com/news/id/6347177
414,6347308,〈貴金屬盤後〉Fed鷹派立場與地緣政治風險拉扯 金價掙扎於5000美元下方,黃金現貨價格周四 (19 日) 橫盤整理，價格在 5000 美元大關下方持續掙扎。儘管金價在周三曾一度跳升 2.1% 並觸及 5021 美元的高點，但隨著強勢美元與聯準會鷹派立場的雙重夾擊，漲勢隨後受到抑制。,https://m.cnyes.com/news/id/6347308
415,6347307,〈能源盤後〉國際油價飆升至6個月高位 市場憂慮供應中斷,受軍事衝突風險及美國原油庫存意外大幅下降的雙重刺激，國際油價周四 (19 日) 延續漲勢，觸及半年以來新高。,https://m.cnyes.com/news/id/6347307
416,6346841,AI震盪下的避風港！Wedbush點名一領域「3大股」,在 AI 技術快速普及下，網路安全成為科技產業中兼具防禦與成長性的關鍵領域。Wedbush 指出，隨著攻擊頻率與風險升高，企業資安支出將持續攀升。Gartner 預估 2026 年全球 AI 資安支出達 510 億美元。分析師看好 Palo,https://m.cnyes.com/news/id/6346841
417,6347001,AI將終結軟體工程師！Anthropic Claude Code開發者：職稱恐成歷史,隨著 AI 快速進化，Anthropic 旗下 Claude Code 開發者 Boris Cherny 預測，2026 年人工智慧將全面改寫軟體產業，「軟體工程師」職稱恐逐步消失。AI 代理正重塑開發流程，工程師角色轉向產品規,https://m.cnyes.com/news/id/6347001
418,6347214,【袁志峰專欄】外圍股市做好，港股追落後,"今日推介 - 中國移動 (941, $78.4), 目標價 $86.0, 止損價 $75.5",https://m.cnyes.com/news/id/6347214
419,6347192,黃仁勳預告3月發布「前所未有」的晶片 強調AI泡沫不存在,,https://m.cnyes.com/news/id/6347192
420,6347176,美國去年貿易逆差衝上9015億美元 逼近1960年來高點,,https://m.cnyes.com/news/id/6347176
421,6347175,美初領失業金人數創3個月最大減幅 就業市場趨穩但隱憂浮現,,https://m.cnyes.com/news/id/6347175
422,6346842,美股恐續墊底？避險基金經理人放空美國、押注新興市場：溢價高達40%,億萬富豪避險基金經理人 Rob Citrone 表示已放空美股、做多全球市場，認為美國資產估值溢價高達 40%，且 AI 投資變現前景不明，恐持續落後新興市場。過去一年 S&amp;P 500 僅漲 11%，遠不及 iShares Co,https://m.cnyes.com/news/id/6346842
423,6347025,美對台軍售卡關原因曝！美官員：習近平施壓、川普避欲免影響4月初訪中行程,在習近平施壓與川普即將訪問北京的背景下，美國對台軍售案陷入停擺。白宮權衡貿易休兵與台海穩定，峰會前展開成果談判。台灣議題仍是美中關係核心摩擦焦點。,https://m.cnyes.com/news/id/6347025
424,6346919,蘋果與那指相關性創20年新低！AI熱潮下成「異類」？本益比30倍仍獲市場青睞,在 AI 熱潮引發科技股劇烈震盪之際，蘋果與那斯達克 100 指數相關性降至 2006 年來新低，成為市場「避風港」。儘管營收成長趨緩、本益比高達 30 倍，分析師仍認為蘋果在 AI 動盪中具防禦優,https://m.cnyes.com/news/id/6346919
425,6347015,批美眾議員AOC回應台灣問題「很丟臉」！范斯：她應先去讀書,美國副總統范斯抨擊歐加修 - 寇蒂茲在慕尼黑安全會議上對「若中國入侵台灣美國是否出兵」的回應「令人尷尬」，相關言論引發兩黨爭議，也讓 2028 總統潛在人選的外交立場備受關注。,https://m.cnyes.com/news/id/6347015
426,6347074,行為不端！英國國王弟弟安德魯被捕,據《BCC》報導，英國國王查爾斯三世的弟弟安德魯周四（19 日）因涉嫌擔任公職期間行為不端被警方逮捕。,https://m.cnyes.com/news/id/6347074
