,newsId,title,summary,link
339,6417916,美伊談判破局！美國：4/13起封鎖伊朗港口海上交通,美國、伊朗談判破局，美國中央司令部周日（12 日）在社交平台發表聲明，稱根據總統公告，美國中央司令部部隊將於美國東部時間 4 月 13 日上午 10 時起，封鎖所有進出伊朗港口的海上交通。,https://m.cnyes.com/news/id/6417916
340,6417915,美伊談崩後 川普考慮重啟「精準轟炸」打破僵局,,https://m.cnyes.com/news/id/6417915
341,6417830,荷姆茲復航恐延至7月 小摩警告油價恐再衝120美元,,https://m.cnyes.com/news/id/6417830
342,6417506,SanDisk納入那指前「上漲行情」來了？一年暴漲2500%、分析師齊看好,那斯達克宣布將 SanDisk 納入那斯達克 100 指數，取代 Atlassian 成分股。受惠 AI 帶動的儲存晶片超級週期，SanDisk 股價今年暴漲逾 200%，過去一年更飆升超過 2500%。市場預期指數資金流入將進一步推升股價與,https://m.cnyes.com/news/id/6417506
343,6417912,大盤暴漲不敢買？這族群剛打底完成，錯過再等下半年！,,https://m.cnyes.com/news/id/6417912
344,6417828,傳奇大佬警告「聯準會賣權」已死 別指望Fed出手救市,,https://m.cnyes.com/news/id/6417828
345,6417846,美股重回「戰前主題」！高盛：引人注目的是「金礦股」沒跟上大盤反彈,,https://m.cnyes.com/news/id/6417846
346,6417865,米爾斯海默警告：以色列恐絕望到動用核武 美國是殘酷推手,,https://m.cnyes.com/news/id/6417865
347,6417827,美伊談判破局 周一開盤怎麼走？分析師警告這3大變數,,https://m.cnyes.com/news/id/6417827
348,6417814,普丁、伊朗總統通話 討論中東局勢、雙邊合作,克里姆林宮表示，俄羅斯總統普丁周日（12 日）與伊朗總統佩澤希齊揚通話，討論中東局勢進展。,https://m.cnyes.com/news/id/6417814
349,6417852,和平憲法岌岌可危！日本首相高市喊「修憲時機已到」國內掀反對浪潮  19日再聚國會前抗議,,https://m.cnyes.com/news/id/6417852
350,6417284,德銀看好美股財報季！估標普500獲利年增19%   投資人卻轉趨保守,美股財報季將登場，德意志銀行預估標普 500 企業獲利年增 19%，優於市場共識。然而投資人因伊朗戰爭與 AI 疑慮轉趨保守，導致投資部位與獲利前景出現罕見脫節，市場分歧加劇。,https://m.cnyes.com/news/id/6417284
351,6417277,Anthropic Mythos找漏洞太強！美財政部、Fed促華爾街採用並「認真看待」,在川普政府官員推動下，摩根大通、高盛與花旗等華爾街銀行正測試 Anthropic 旗下 Mythos AI 模型，用於偵測資安漏洞與強化數位防禦。該模型具備自主發現漏洞與攻擊路徑能力，引發監管機構與金融業高度關注。,https://m.cnyes.com/news/id/6417277
352,6417282,特斯拉遭看空至25美元目標價、恐再崩逾九成！分析師警告「估值泡沫」與「結構性衰退」,特斯拉股價 2026 年已下跌約 25%，但市場研究機構 GLJ Research 執行長警告跌勢尚未結束，甚至可能跌至 25 美元目標價。分析指出高估值、需求疲弱與 Robotaxi 進度延宕，使特斯拉面臨結構性壓力，市場看空情緒升溫。,https://m.cnyes.com/news/id/6417282
353,6417809,日本自民黨提修憲 高市早苗：時機成熟,日本執政黨自由民主黨周日（12 日）在東京召開黨大會，日本首相兼自民黨總裁高市早苗的表態，以及大會發布的新願景和 2026 年運動方針文件，均反覆提及推進修憲。,https://m.cnyes.com/news/id/6417809
354,6417847,〈台股盤前要聞〉美國宣布封鎖荷姆茲、台股攻歷史高點添變數、群聯：NAND缺貨難解,台股盤前要聞,https://m.cnyes.com/news/id/6417847
355,6417397,特斯拉股價連跌8週！100億英里FSD里程碑能否救市？,特斯拉股價連跌八週累計下跌 17%，市場聚焦 FSD 自動駕駛里程逼近 100 億英里與 Robotaxi 商業化進展。同時期權交易動能降溫，影響股價支撐力，投資人關注 AI 自駕能否成為估值關鍵。,https://m.cnyes.com/news/id/6417397
356,6417790,大陸宣布對台十大禮包 陸委會回應！,應中共中央和習近平總書記邀請，國民黨主席鄭麗文率團於 4 月 7 日至 12 日訪問大陸。習近平會見鄭麗文，並發表講話。,https://m.cnyes.com/news/id/6417790
357,6417826,繞過荷姆茲海峽！沙國「東西向油管」輸油能力完全恢復,,https://m.cnyes.com/news/id/6417826
358,6417461,人民日報：把兩岸關係牢牢掌握在中國人自己手中,睽違 10 年，國民黨主席再次率團訪問大陸，備受矚目，中共中央總書記習近平上周五（10 日）在北京會見鄭麗文主席率領的國民黨訪問團。,https://m.cnyes.com/news/id/6417461
359,6417429,〈走進中國〉網路巨頭加速駛入汽車賽道 京東、美團、阿里都開始賣車了,中國網路平台正在加速駛入汽車賽道，京東、美團、阿里巴巴旗下天貓平台近期均在汽車銷售與服務領域展開新動作，網路巨頭賣車的戰局再度升級。,https://m.cnyes.com/news/id/6417429
360,6417376,富士山要噴發了？日本官方首次開會商討大噴發應對方案,富士山沉寂逾 300 年引發關注，日本政府首度召開跨部門會議應對可能的大規模噴發。專家警告岩漿壓力累積，最壞情況恐導致東京交通、電力與通訊全面癱瘓。,https://m.cnyes.com/news/id/6417376
361,6417823,力拚國防與經濟自主！加拿大總理：每花1加元軍費便有七成流入美國的日子已結束,,https://m.cnyes.com/news/id/6417823
362,6417837,美伊談判逾20小時無果而終！美副總統范斯晚來又早走 一切早有預兆？,,https://m.cnyes.com/news/id/6417837
363,6417872,伊朗革命衛隊：若敵方誤判情勢 將陷入荷姆茲「致命漩渦」,IRGC 海軍司令部聲稱，荷姆茲海峽的所有海上交通「已完全處於伊朗軍方掌控之中」，並警告若敵方誤判情勢，「將會被陷入海峽中的致命漩渦之中」。,https://m.cnyes.com/news/id/6417872
364,6417862,川普再威脅：美軍可一天內摧毀伊朗 摧毀所有能源設施,美國總統川普 (Donald Trump) 再度升高對伊朗的強硬立場，警告若無法達成結束戰爭的協議，美方將對伊朗能源基礎設施展開全面打擊,https://m.cnyes.com/news/id/6417862
365,6417851,伊朗總統：伊朗已做好準備達成平衡且公平協議,伊朗總統裴澤斯基安 (Masoud Pezeshkian) 在與俄羅斯總統普丁通話時表示，伊朗已準備好達成一項「平衡且公平」的協議，以確保穩定的和平與安全。,https://m.cnyes.com/news/id/6417851
366,6417845,川普：部署美軍封鎖荷姆茲 「可能需要一點時間」,美國總統川普週日 (11 日) 宣布美軍將立即封鎖荷姆茲海峽後，他在接受《Fox News》電話訪問時坦言，相關行動「需要一點時間」才能完成部署。,https://m.cnyes.com/news/id/6417845
367,6417844,美艦試圖通過荷姆茲海峽！伊朗： 企圖製造「成功通行」虛假宣傳 並影響在巴基斯坦的談判,,https://m.cnyes.com/news/id/6417844
368,6417831,CNN分析：荷姆茲已被伊朗控制 川普為何仍揚言「封鎖」？,美國總統川普 (Donald Trump) 週日 (12 日) 威脅美軍將立即封鎖荷姆茲海峽，引發市場與國際社會高度關注，為何他要威脅封鎖一條伊朗已封鎖的海峽呢？,https://m.cnyes.com/news/id/6417831
369,6417829,美伊緊張再升溫！伊朗：已取得對荷姆茲海峽的完全控制 將對任何「錯誤行為」予以報復,,https://m.cnyes.com/news/id/6417829
370,6416901,本週操盤筆記：美股Q1財報季登場、高油價連鎖效應、戰事成關鍵變數,本周投資人將關注，美國企業獲利動能是否仍維持強勁，以及中東戰爭與能源成本飆升，是否開始動搖企業前景。市場仍高度關注中東局勢，預期未來一周將持續影響股市波動。,https://m.cnyes.com/news/id/6416901
371,6417774,知情人士：美伊談判過程情緒起伏大 伊朗全員著黑衣以表哀悼,美伊高層周日 (12 日) 在經歷長達 20 多個小時的拉鋸後，最終因核心分歧未能達成協議。據知情人士向媒體透露，談判過程中氣氛極度緊張且情緒起伏巨大，美方由副總統范斯率領，堅持伊朗必須放棄核武開發與濃縮鈾庫存，而伊方則對解凍海外,https://m.cnyes.com/news/id/6417774
372,6417806,川普：美伊談判失敗 美國將封鎖荷姆茲海峽,美國總統川普 (Donald Trump) 週日 (12 日) 宣布，由於在巴基斯坦舉行的美伊停火談判進展受挫，美方決定對荷姆茲海峽採取封鎖行動。,https://m.cnyes.com/news/id/6417806
373,6417775,伊朗副議長：荷姆茲海峽是「紅線」 完全由伊朗掌控,據伊朗邁赫爾通訊社 (Mehr News Agency) 報導，伊朗伊斯蘭議會副議長巴巴埃 (Haji Babaei) 周日 (12 日) 公開向美國發出強硬警告，強調荷姆茲海峽是伊朗的「紅線」，此戰略水道完全由伊朗掌控，且未來所有通,https://m.cnyes.com/news/id/6417775
374,6417755,紐約時報：美伊會談無結果不意外 關鍵在後續應對,美國與伊朗圍繞核問題進行長達 21 小時的談判未達致共識，《紐約時報》報導，會談無果並不令人意外，但接下來如何應對才是關鍵。,https://m.cnyes.com/news/id/6417755
375,6417606,台積電法說周四登場 外界聚焦斷鏈等五大議題,台積電 (2330-TW)(TSM-US) 將於本周四 (16 日) 召開法說會，將成為本季 AI 產業的風向球，外界除關注財報與展望外，也聚焦 AI 相關晶片需求、資本支出有無上調、2 奈米量產進度、美伊戰爭帶來的斷鏈風險以及英特爾與馬斯,https://m.cnyes.com/news/id/6417606
376,6417658,瀚荃AI電源客戶需求暢旺上修訂單 今年相關業績估增5成,瀚荃 AI 電源客戶需求暢旺上修訂單 今年相關業績估增 5 成起跳,https://m.cnyes.com/news/id/6417658
377,6415832,櫃買債券ETF突破100檔 復華金融傘型15日雙掛牌,櫃買中心 ETF 市場再添生力軍，由復華投信發行之「復華金融股債雙收傘型證券投資信託基金」將於下週三 (15 日) 正式掛牌，包含主動復華金融股息 (00998A-TW) 與主動復華金融債息 (00986D-TW) 兩檔 ETF,https://m.cnyes.com/news/id/6415832
378,6417601,信立3月營收年月雙增 受惠產品需求回溫、客戶提前拉貨挹注業績增長,信立 3 月因受惠於消費市場對於機能性服飾的需求回溫，帶動 PU 合成皮在農曆年後出貨增加，加上因地緣政治影響，致塑化原料價格上漲，致主要國際客戶，為應對戰爭造成供貨緊張下提前拉貨，單月營收月增 87.5％、年增 24.89％。,https://m.cnyes.com/news/id/6417601
379,6417689,金益鼎新竹西濱路廠區火警已在下午2時撲滅無人員傷亡,金益鼎 (8390-TW) 位於新竹西濱路六段的廠區，在今 (12) 日清晨發生火警並竄出濃煙，新竹警消在上午 7 時 49 分獲報並前往灌救，一度提升爲三級火警，新竹市政府消防局並在今天下午 2 時 19 分宣布撲滅火勢，並無人員傷亡傳出。,https://m.cnyes.com/news/id/6417689
380,6417516,千億挹注桃園航空城！國1甲拚5年完工 卓揆：4大效益銜接4500萬人次旅運,行政院長卓榮泰 昨 (11) 日出席國道 1 號甲線新建工程動土典禮，強調該計畫總經費達 805.86 億元，預計 4 到 5 年內完工。此工程將串聯國道 1 號與台 61 線，完工後可縮短雙北至機場路程，並分擔國 2 約,https://m.cnyes.com/news/id/6417516
381,6417751,馬克宏與沙、土元首通話 呼籲停火範圍擴及黎巴嫩,法國總統馬克宏周六 (11 日) 針對當前緊張的中東局勢展開密集的電話外交。馬克宏於當天分別與沙烏地阿拉伯王儲沙爾曼 (Mohammed bin Salman) 及土耳其總統艾爾段 (Tayyip Erdogan) 通話，旨在針對正在,https://m.cnyes.com/news/id/6417751
382,6417750,美伊和談之際 納坦雅胡強硬表態：對伊軍事任務尚未結束,美國、伊朗展開談判之際，以色列總理納坦雅胡 (Benjamin Netanyahu) 於當地時間 11 日發表強硬聲明，宣稱以色列在針對伊朗及其代理人的軍事行動中已取得「歷史性成就」。納坦雅胡指出，這場始於 2 月 28 日的行動已成功,https://m.cnyes.com/news/id/6417750
383,6417749,川普：美伊談判結果無關緊要 無論如何美國都贏了,美國總統川普周日 (12 日) 在美伊談判進行期間公開表示，他對於是否能達成協議感到「無所謂」，並強調這對他來說「沒有區別」，因為他認為美國早已贏得這場戰爭。,https://m.cnyes.com/news/id/6417749
384,6417744,美伊外交途徑未斷 巴基斯坦：將繼續扮演調解角色、停火依舊,由巴基斯坦居中斡旋、旨在緩解美伊緊張局勢的「伊斯蘭堡會談」，在周日 (12 日) 馬拉松式的談判後宣告結束，雙方未能達成正式協議。儘管如此，巴基斯坦政府強調將繼續扮演調解角色，促進兩國對話，並呼籲雙方恪守當前的停火承諾以維持地,https://m.cnyes.com/news/id/6417744
385,6417740,美伊立場差距仍大 全球能源危機持續 川普：無論結果為何美國都贏了,美國與伊朗在巴基斯坦首都伊斯蘭馬巴德進行了長達 21 小時的馬拉松式高層談判後，最終因雙方在核武承諾及區域安全議題上存在嚴重分歧，未能達成任何正式協議。美國副總統范斯 (JD Vance) 於周日 (12 日) 早晨宣布，由於德黑,https://m.cnyes.com/news/id/6417740
386,6417288,蘋果挖角Uber高層！強化亞太布局、加速供應鏈多元化戰略,蘋果從 Uber 挖角亞太區公共政策與政府關係主管 Mike Orgill，強化在印度、越南與東南亞的供應鏈布局。此舉被視為蘋果加速降低對中國依賴、推動全球製造多元化的重要戰略一步。,https://m.cnyes.com/news/id/6417288
387,6417287,OpenAI三大AI主管跳槽Meta！AI基礎建設競賽升溫、「星際之門」計劃受挫,OpenAI 負責大規模 AI 數據中心建設的三名核心主管轉投 Meta，引發 AI 基礎設施與算力競爭升溫。Meta 持續加碼 AI 投資，OpenAI「Stargate」計畫亦同步調整，顯示全球 AI 軍備競賽進入新階段。,https://m.cnyes.com/news/id/6417287
388,6417286,《經濟學人》日本汽車業陷結構性危機  產業競爭力正快速流失？,根據《經濟學人》報導，日本汽車產業正面臨嚴峻結構性危機，本田可能出現近 70 年來首次虧損，日產持續重整。電動化轉型落後與中國電動車崛起，使日本車廠全球市佔持續下滑，產業競爭力面臨重大挑戰。,https://m.cnyes.com/news/id/6417286
389,6417349,OpenAI執行長奧特曼住家遭汽油彈攻擊！嫌犯威脅縱火總部後遭逮捕,美國警方表示，一名男子涉嫌向 OpenAI 執行長奧特曼住家投擲汽油彈，並威脅縱火焚燒 OpenAI 舊金山總部，隨後遭警方逮捕。OpenAI 證實事件並表示無人受傷，案件仍在調查中。,https://m.cnyes.com/news/id/6417349
390,6417567,〈台股風向球〉衝破歷史高點在望 台積電法說促多頭接力賽,〈台股風向球〉衝破歷史高點在望 台積電法說促多頭接力賽,https://m.cnyes.com/news/id/6417567
391,6417627,鄭麗文見習近平 大陸宣布十項兩岸交流合作政策,應中共中央和習近平總書記邀請，國民黨主席鄭麗文率團於 4 月 7 日至 12 日訪問大陸。習近平會見鄭麗文，並發表講話。,https://m.cnyes.com/news/id/6417627
392,6417336,肥料燃料雙漲衝擊稻作！東南亞稻農陷「棄收、減種」困境 ,,https://m.cnyes.com/news/id/6417336
393,6417604,美國、伊朗21小時談判破局！范斯：伊朗拒絕美國條件,美國副總統范斯表示，美伊在伊斯蘭瑪巴德進行長達 21 小時談判仍未達成協議，伊朗拒絕美方紅線條件。談判聚焦荷姆茲海峽、停火延長與制裁議題，破局恐讓中東局勢再度升溫。,https://m.cnyes.com/news/id/6417604
394,6417592,北基土地處分收益入帳挹注 3月、Q1營收齊創同期新高,北基受惠於去 (2025) 第 4 季起，處分高雄市鼓山區不動產土地案，挹注今年 3 月營收 15.81 億，月增 116.76％、年增 41.47％，首季營收 33.63 億元、年增 29.84％，3 月及第 1 季營收創雙雙創下同期新高。,https://m.cnyes.com/news/id/6417592
395,6417398,台商汽車板陷下滑 前三大仍各撑百億元營收 健鼎去年出貨139億元續稱霸,健鼎 (3044-TW) 以擁有兩岸每月千萬呎產能及高階 HDI 製程競爭優勢下，且在 2023 年一舉擊敗敬鵬 (2355TW) 拿下台商 PCB 的出貨冠軍的健鼎，在 2025 年汽車板出貨值下滑爲 139.16 億元，年減 12.9%。,https://m.cnyes.com/news/id/6417398
396,6417562,〈熱門股〉外資連5買相挺 光環周漲37%日K連收4紅,近期光通訊族群的多頭氣勢，盤面資金持續圍繞光通訊、矽光子 (CPO) 題材，市場對 800G、400G 等高速光通產品接單看佳，激勵光環上周股價周漲 37.18%，獲得外資連 5 買按讚相挺，日 K 連收 4 紅，股價成功攻上百元大關。,https://m.cnyes.com/news/id/6417562
397,6417121,經理人揭秘日股隱形冠軍 建商議價權大逆襲、機器人組件擁絕對優勢,日本經濟正站在一個前所未有的結構性轉折點，談到日股投資機會，多數人都會聯想到半導體關鍵材料、商社股等，路博邁日本股票投資部基金經理人城源子翼受訪時指出，,https://m.cnyes.com/news/id/6417121
398,6416252,演算法突破降低記憶體依賴，網通CPE族群迎轉機：啟碁、中磊、智易、正文,,https://m.cnyes.com/news/id/6416252
399,6417069,光進銅退大趨勢 錼創、富采、鼎元強攻Micro LED光通訊商機,2026 年智慧顯示大展盛大登場，人工智慧算力引爆的光通訊技術成為產業焦點。錼創 (6854-TW) 與富采 (3714-TW) 兩大光電龍頭先後指出，MicroLED 跨入共同封裝光學元件 CPO 的進度超乎預期。產業界看好光,https://m.cnyes.com/news/id/6417069
400,6417500,美軍艦突穿荷姆茲海峽！未與伊朗協調  巴基斯坦急斡旋避免衝突升級,美國海軍艦艇在未與伊朗協調下穿越荷姆茲海峽，引發伊朗強烈警告並全程監控，最終迫使美艦撤離。當前美伊衝突已進入第二個月，雙方雖處兩週停火期，仍由巴基斯坦在伊斯蘭瑪巴德斡旋和平談判，區域局勢持續緊繃。,https://m.cnyes.com/news/id/6417500
401,6417497,美伊談判有可能延長一天！川普：美國正「清理」荷姆茲海峽,,https://m.cnyes.com/news/id/6417497
402,6417489,美伊已開始直接會談！伊朗外交部：隨時準備應對違反停火行為,,https://m.cnyes.com/news/id/6417489
403,6417283,美股恐陷崩跌風險？小摩前量化專家稱美伊停火無實質依據、點名「做空」記憶體,美國與伊朗宣布兩週停火協議後，美股大幅反彈，那斯達克單日勁升近 5%。然而前摩根大通量化主管 Marko Kolanovic 警告，市場漲勢建立在脆弱基礎上，可能出現大幅回落，動能科技股風險升溫。,https://m.cnyes.com/news/id/6417283
404,6416217,AI算力擴張催化CPO進入主升段！2026發展元年啟動：欣興、臻鼎-KY、環宇-KY、正文,,https://m.cnyes.com/news/id/6416217
405,6417442,中國否認在美伊停火中扮關鍵角色！玉淵譚天：別把責任推給我們,針對外界將中國視為促成伊朗兩週停火的幕後關鍵推手，中國官媒相關微信帳號「玉淵潭天」發文澄清，強調北京並未在停火談判中扮演決定性角色，並指相關敘事為誤導性解讀，重申中國在衝突中採取平衡與中立立場。,https://m.cnyes.com/news/id/6417442
406,6417391,塑膠袋不「荒」了！中油台塑聯手給力 下周12.5億個塑袋鋪貨全國1350個商圈市場,經濟部次長賴建信今 (11) 日針對民生實化產品供應表示，透過與中油、台塑合作，已擴大輕油提煉以增加下游原料供應。賴建信宣布，平價專案已於 4 月 10 日投產，預計可額外生產 12.5 億個塑膠袋供應國內市場，這批平價產品預計於下週透,https://m.cnyes.com/news/id/6417391
407,6365287,200萬桶原油卡「灣」？經部：已有備案 保證能源調度至7月都安全無虞 ,面對國際地緣政治衝突引發的能源供應疑慮，以及目前卡在波斯灣的 200 萬桶原油，經濟部次長賴建信與中油董事長方振仁於今（11）日說明因應措施，必要時可轉往延布港口（Yanbu）裝貨以避開紅海，並擴大採購美國、澳洲、非洲等地的,https://m.cnyes.com/news/id/6365287
408,6417386,《路透》伊朗新領袖穆吉塔巴重傷未癒！毀容、失一腿仍遠端掌權,伊朗新任最高領袖穆吉塔巴在空襲中重傷，傳出臉部毀容、可能失去一條腿，目前仍透過遠端方式參與決策。在伊朗面臨數十年來最嚴峻局勢之際，其健康狀況與領導能力備受關注，同時美伊將於 Islamabad 展開關,https://m.cnyes.com/news/id/6417386
409,6417344,Apple Pay新詐騙席捲全球！蘋果發聲警告iPhone用戶,新型 Apple Pay 詐騙正針對 iPhone 用戶快速蔓延，假冒蘋果官方簡訊誘導撥打電話，藉機竊取個資與金錢。專家警告此類詐騙依賴恐慌與偽裝身份，受害者可能瞬間損失數千美元，並提醒用戶提高警覺。,https://m.cnyes.com/news/id/6417344
410,6417377,荷姆茲海峽成「海上監獄」：2000艘貨輪受困、海員與亡者共處「心理崩潰」,荷姆茲海峽危機持續惡化，約 2000 艘船與 2 萬名海員受困波斯灣逾一個月。物資短缺、攻擊威脅與心理壓力交織，已演變為全球航運與供應鏈重大隱憂。,https://m.cnyes.com/news/id/6417377
411,6417158,恐慌指標VIX訊號來了 標普或推升至7400點,華爾街出現新的多頭訊號，被視為市場「恐慌指標」的 VIX 近期快速回落，引發市場關注,https://m.cnyes.com/news/id/6417158
412,6417354,川普向北約下「最後通牒」：不提交確保荷姆茲海峽安全具體軍事計畫就「退出」,美伊與以色列衝突引發連鎖效應，美國與北約盟友在荷姆茲海峽護航議題上出現嚴重分歧。川普政府傳出考慮調整駐歐美軍部署、撤出部分盟國並重新分配軍力，加劇跨大西洋關係緊張。北約內部在軍費、戰略配合與合法性問題上意見分歧擴大，歐洲,https://m.cnyes.com/news/id/6417354
413,6417378,科威特24小時攔截7架無人機！伊朗否認涉案,科威特國防部表示，過去 24 小時內成功攔截 7 架侵入領空的敵對無人機，並通報國民警衛隊設施遭攻擊致多人受傷。伊朗否認涉案，並指責相關指控可能指向以色列或美國。,https://m.cnyes.com/news/id/6417378
414,6417360,年飆2000%驚人動力！SanDisk 4月20日躋身那斯達克100指數 帶動卡位行情,,https://m.cnyes.com/news/id/6417360
415,6417368,美伊能談攏嗎？荷姆茲海峽、濃縮鈾與黎巴嫩真主黨成關鍵變數,美國與伊朗在巴基斯坦展開新一輪談判，但在荷姆茲海峽通航、伊朗濃縮鈾計畫及黎巴嫩真主黨等議題上立場嚴重對立，三大核心爭議恐成停火協議破局關鍵。,https://m.cnyes.com/news/id/6417368
416,6417161,SCFI連三紅！波斯灣航線運價首度突破4000美元 寫「史上最貴」,"上海航交所出口貨櫃運價指數 (SCFI) 連續三周走揚，其中中東航線運價更首度突破每 20 呎櫃 (TEU) 4,000 美元大關，創下歷史新高",https://m.cnyes.com/news/id/6417161
417,6417190,追趕台積電！日本加碼40億美元補貼「國家隊」Rapidus 衝刺2奈米晶片量產,,https://m.cnyes.com/news/id/6417190
418,6417343,賀錦麗鬆口考慮參選2028美國總統！稱「可能」參選釋重大政治訊號,美國前副總統賀錦麗近日表示「可能」參選 2028 年總統大選，並稱仍在考慮中，引發外界關注。她回顧白宮經歷，並透露對美國當前政治與經濟現況的看法。,https://m.cnyes.com/news/id/6417343
419,6417191,私募信貸面臨壓力測試！標普道瓊推新型CDS指數 釋放看空動能,,https://m.cnyes.com/news/id/6417191
420,6417339,智冠今年業績估優於去年 成立AI發展中心聚焦三主軸,智冠今年業績估優於去年 成立 AI 發展中心聚焦三主軸,https://m.cnyes.com/news/id/6417339
421,6417340,熙特爾Q1營收31億元10倍增速飆新高 下半年喜迎海外貢獻,熙特爾新能源 (7740-TW) 公告 3 月營收 18.26 億元，月增 292.36%，年增 3063%，累計第一季合併營收 30.91 億元，年增 1151.64%，顯示指標性案場工進推動與電池出貨雙引擎同步催動，營運邁入高,https://m.cnyes.com/news/id/6417340
422,6417335,〈熱門股〉先進封裝需求旺 辛耘本周連飆４根漲停創新高,隨著 AI 帶動先進封裝多元化，CoWoS、WMCM、SoIC、CoPoS 等封裝技術百花齊放，帶動半導體設備營運全面起飛，辛耘 (3583-TW) 本周受惠市場青睞，股價連續多日漲停，週五衝上漲停板 673 元，創下歷史新高價，單,https://m.cnyes.com/news/id/6417335
423,6417303,美伊談判登場前緊繃！伊朗警告反制、美國堅持核武紅線並增兵中東,美伊談判將於伊斯蘭瑪巴德展開前局勢升溫，伊朗代表團抵達並警告若協議破裂將強力反制，美國則強調阻止伊朗取得核武並持續增兵中東，雙方立場對峙加劇。,https://m.cnyes.com/news/id/6417303
