,newsId,title,summary,link
1057,6157104,HIMS減重藥品廣告遭FDA點名 股價急挫逾5%,美國食品藥物管理局 (FDA) 近日向遠距醫療公司 Hims &amp; Hers Health 發出警告信，指出該公司在推廣其調製版本的糖尿病藥物 Ozempic 與減重療法 Wegovy 時，存在虛假或誤導性宣傳。,https://m.cnyes.com/news/id/6157104
1058,6157625,〈2025周慶〉新光三越首波周慶10/2開打 活動全面升級一次看,新光三越首波周慶 10/2 開打 活動全面升級一次看,https://m.cnyes.com/news/id/6157625
1059,6157622,PayPal支付大進化！讓比特幣、以太幣像傳訊息一樣流通,,https://m.cnyes.com/news/id/6157622
1060,6157482,大摩2026年美國網路業展望——點名科技股三巨頭 ,摩根士丹利指出，2026 年北美網路產業將由 4 大生成式人工智慧（GenAI）催化劑（模型迭代、智慧代理、資本開支、客製化晶片）及細分領域辯論驅動，同時看好共享經濟、網路旅遊、中小盤股發展機遇。,https://m.cnyes.com/news/id/6157482
1061,6157202,被問財富氣炸！川普開嗆澳洲記者：傷害兩國關係,,https://m.cnyes.com/news/id/6157202
1062,6157561,台灣鬧房貸荒卻見外籍人士手捧現金買豪宅 台北成資產布局熱區,最新實價揭露，中正區豪宅「新光人壽總統傑仕堡」，今年 6 月有中樓層交易，總價約 1.1 億元、單價 151.1 萬元，特別的是，購入這戶的買方，是擁有外國籍的自然人，且採無貸款方式購入。凸顯台灣豪宅市場對於國際資金的吸引力。,https://m.cnyes.com/news/id/6157561
1063,6157500,AI驅動一切！華為：2035年全社會算力總量將成長10萬倍 AI存儲需求激增500倍,,https://m.cnyes.com/news/id/6157500
1064,6157505,〈台股開盤〉高檔整理跌逾百點 台積電稍息 塑化、碳化矽族群竄紅,市場靜待聯準會公布利率，觀望氣氛濃厚，台股今 (17) 日開低以 25543.91 點開出，下跌 85.73 點，儘管塑化、面板以及碳化矽族群走強，不過在台積電等電子權值股並無表現下，指數一路走低，跌近 150 點。早盤估量 4951 億元,https://m.cnyes.com/news/id/6157505
1065,6157508,【產業觀察】台積電CoWoS技術換碳化矽？AI散熱黑馬股浮現?,,https://m.cnyes.com/news/id/6157508
1066,6156541,AI題材一波波，市值型主動式ETF前景看好 ！,,https://m.cnyes.com/news/id/6156541
1067,6157175,蘋果AirPods Pro 3推出全新耳塞與聲學密封測試！提升音質與降噪體驗,蘋果最新推出的 AirPods Pro 3 採用全新耳塞設計與聲學密封測試，確保最佳音質與降噪效果，並提供多種尺寸以提升佩戴舒適度與心率測量準確性。,https://m.cnyes.com/news/id/6157175
1068,6157166,面對藥品關稅威脅 GSK加碼投資美國300億美元,,https://m.cnyes.com/news/id/6157166
1069,6157472,〈焦點股〉瀚宇博強化在台投資AI板及庫藏股助威 爆量跳空攻高,華科事業群 PCB 廠瀚宇博 (5469-TW) 今 (17) 日起倆個月執行庫藏股措施，將在 88 元以下買回 2000 張庫藏股，用於轉讓給員工，股價跳空開高，最高價達 87 元，漲幅達 9.43%。,https://m.cnyes.com/news/id/6157472
1070,6157468,阿里巴巴開盤漲近3%續創4年新高 市值重上3兆港元大關,,https://m.cnyes.com/news/id/6157468
1071,6157119,基金經理人：川普施壓Fed 美債殖利率曲線恐更陡,債券基金經理人周二 (16 日) 表示，隨著川普政府對美國聯準會 (Fed) 的壓力升高，投資人可能會要求更高的補償以承擔財政和政治風險，這可能導致美國公債殖利率曲線更為陡峭。,https://m.cnyes.com/news/id/6157119
1072,6157164,輝達加碼英國110億英鎊 打造最大AI基礎設施、部屬6萬顆GPU,,https://m.cnyes.com/news/id/6157164
1073,6157397,歐盟執委會出手！將進一步制裁以色列,據《路透社》報導，歐盟執委會發言人皮尼奧宣布，歐盟將於周三（17 日）批准對以色列實施新一輪制裁。,https://m.cnyes.com/news/id/6157397
1074,6157168,輝達與英國合作 斥資110億英鎊興建AI基礎設施,輝達 (NVDA-US)宣布與 CoreWeave (CRWV-US)、微軟 (MSFT-US) 和 Nscale (SMR-US)等公司合作，在英國建造人工智慧基礎設施，並計劃在 2026 年底投資高達 110 億英鎊。,https://m.cnyes.com/news/id/6157168
1075,6157122,用戶忠誠度高！Bernstein：蘋果處在AI硬體革命「最佳位置」,,https://m.cnyes.com/news/id/6157122
1076,6157304,以色列首度披露：曾在伊朗部署100名外國特工 摧毀飛彈發射器,在今年 6 月以伊衝突開始時，以色列情報和特勤局（摩薩德）在伊朗部署了 100 名外國特工。,https://m.cnyes.com/news/id/6157304
1077,6157305,阿里巴巴受益最大！高盛：中國AI基礎設施敘事重燃 企業級大模型Token消耗量暴漲363%,,https://m.cnyes.com/news/id/6157305
1078,6157306,芝浦電子正式表態支持國巨公開收購提案 建議股東參與投標,芝浦電子正式表態支持國巨公開收購提案 建議股東參與投標,https://m.cnyes.com/news/id/6157306
1079,6157174,美國與印度重啟貿易談判！川普與莫迪通話、俄羅斯石油爭議成焦點,美國總統川普與印度總理莫迪通話，釋出雙邊關係緩和訊號。正值美印貿易談判重啟之際，俄羅斯石油進口爭議與關稅衝突成為兩國合作的關鍵挑戰。,https://m.cnyes.com/news/id/6157174
1080,6157106,反聖嬰現象加劇乾旱 咖啡期貨飆破每磅4美元,《彭博》報導，咖啡期貨價格每磅突破 4 美元，主因市場再度擔憂反聖嬰現象可能延長巴西主要產區的乾旱天氣，威脅作物收成。,https://m.cnyes.com/news/id/6157106
1081,6157134,禮來執行長：昔日生物製藥霸主英國已式微 海外漲價難 美當局應重視,禮來公司執行長 Dave Ricks 近日受訪時表示，英國在生物製藥領域的地位正逐漸下滑，美當局應留心此點。,https://m.cnyes.com/news/id/6157134
1082,6157201,英特爾中國區換帥 那個最了解中國區業務的人要走了,美國晶片大廠英特爾（Intel）周二（16 日）宣布，中國區董事長王銳將於本月退休，英特爾說，這是自今年 2 月對王稚聰任命以來，按計畫進行的管理層交接。,https://m.cnyes.com/news/id/6157201
1083,6157125,川普人馬米蘭Fed初登板 首場挑戰：是否參加SEP經濟預測？,,https://m.cnyes.com/news/id/6157125
1084,6150825,【Joe’s華爾街脈動】聯準會利率決策前市場盤整,,https://m.cnyes.com/news/id/6150825
1085,6157173,美國與中國的TikTok新協議「與今年稍早的方案高度相似」,美國總統川普確認與中國達成新協議，允許 TikTok 繼續在美國營運。新協議與四月版本相似，字節跳動保留 19.9% 持股，美中雙方仍在協商細節。,https://m.cnyes.com/news/id/6157173
1086,6157195,台積電非首選！外資連11天砸2500億~3大AI主流股才是你的「財富密碼」？,,https://m.cnyes.com/news/id/6157195
1087,6157193,Fed本周降息1碼機率 升至96.1%,目前投資者普遍預料美國聯準會（Fed）周三（17 日）將宣布降息 25 個基點（1 碼），以因應勞動力市場持續惡化的趨勢，這一狀況已在近期多項經濟數據中有所體現。,https://m.cnyes.com/news/id/6157193
1088,6157121,日產將關閉美國、巴西設計工作室 縮減倫敦與日本業務,日產汽車 (Nissan Motor) 周二 (16 日) 表示，將關閉其位於美國加州與巴西聖保羅的設計中心，並縮減在英國倫敦與日本的業務，作為其全球設計組織重整的一部分。,https://m.cnyes.com/news/id/6157121
1089,6157176,95歲巴菲特生活罕見曝光 熬夜看拳王爭霸,美國當地時間上周六（13 日）深夜，傳奇拳擊手特倫斯 · 克勞福德在拉斯維加斯擊敗墨西哥拳王卡內洛 · 阿爾瓦雷斯，以職業生涯 42 勝 0 敗的成績，成為世界拳擊史上首位統一三個級別四大組織金腰帶的拳王。,https://m.cnyes.com/news/id/6157176
1090,6157117,美股重點新聞摘要2025年9月17日,美股重點新聞摘要 2025 年 9 月 17 日,https://m.cnyes.com/news/id/6157117
1091,6157165,輝達、微軟領投 美英達成420億美元《科技繁榮協議》,,https://m.cnyes.com/news/id/6157165
1092,6157169,美國總統川普抵達英國 展開國是訪問,美國總統川普所乘飛機周二（16 日）在英國降落，川普攜夫人梅蘭妮亞抵達英國，展開國是訪問，這是川普繼今年 7 月訪問英國後，兩個月內第二度訪英。,https://m.cnyes.com/news/id/6157169
1093,6157129,政治陰影籠罩！Fed本周降息幾乎成定局 市場緊盯經濟預測,,https://m.cnyes.com/news/id/6157129
1094,6157151,美商務部：考慮對汽車零件再加徵國安關稅,美國商務部週二 (16 日) 表示，未來數週內將考慮是否依產業界的建議，對更多進口汽車零件徵收新的「國家安全」關稅。,https://m.cnyes.com/news/id/6157151
1095,6157105,Fed傳聲筒：央行本周降息基本已成定局,《華爾街日報》資深記者、素有「聯準會傳聲筒」之稱的 Nick Timiraos 週二 (16 日) 撰文指出，本週聯準會會議已幾乎確定將啟動降息，市場正聚焦主席鮑爾如何進一步闡述政策立場。,https://m.cnyes.com/news/id/6157105
1096,6157004,暴跌九成！中國機器人租賃價格大跳水 日租金從近13萬暴跌到只剩不到9000,,https://m.cnyes.com/news/id/6157004
1097,6157135,AI交易還不到泡沫！高盛：AI真能推動成長才能贏 這幾檔目前落後,人工智慧 (AI) 交易再次蓬勃發展，也引起「AI 泡沫化」的討論，但高盛分析師認為當前的市場動向表明，可能還不是宣告泡沫破裂的時候。市場似乎正在像往常一樣決定 AI 的贏家和輸家，關鍵在於未來利潤增長的預期速度。,https://m.cnyes.com/news/id/6157135
1098,6157128,蘋果從AI落後變身大贏家？分析師看好跑贏大盤,蘋果 (AAPL-US) 近來始終擺脫不了「人工智慧 (AI) 落後者」形象，今年股價下跌逾 2%，與多數科技股大漲的走勢形成對比。但 Bernstein 分析師 Mark Newman 認為，對有耐心的投資人來說，這正蘊藏著龐大機會。,https://m.cnyes.com/news/id/6157128
1099,6157103,川習預計週五通話 聚焦棘手的台灣、TikTok、稀土議題,《彭博》週二 (16 日) 報導，美國總統川普與中國國家主席習近平將於本週五 (19 日) 通話，這是兩人自六月以來首次直接交流，討論議題涵蓋 TikTok、波音飛機、稀土磁鐵及台灣等多項敏感問題,https://m.cnyes.com/news/id/6157103
1100,6155546,〈貴金屬盤後〉期待Fed展開寬鬆循環 金價一度突破3700美元 ,,https://m.cnyes.com/news/id/6155546
1101,6157024,最憂第二波通膨！美銀調查：投資人情緒升至7個月最高 近半數經理人估Fed激進寬鬆,,https://m.cnyes.com/news/id/6157024
1102,6157102,〈FOMC會議前瞻〉Fed本週再度召開利率會議 五大看點解析,美國聯準會 (Fed) 於 9 月 16 至 17 日召開聯邦公開市場委員會(FOMC) 會議，在降息預期、政治角力與央行獨立性爭議交織下，這場會議被視為今年最受矚目的政策決策時刻之一。,https://m.cnyes.com/news/id/6157102
1103,6157118,甲骨文投資人期待TikTok協議 分析師看好利多 延期卻再添變數,隨著甲骨文與 TikTok 母公司字節跳動持續推進一項攸關 TikTok 命運的關鍵交易，白宮將可能的美國禁令期限再度延長至 12 月 16 日。甲骨文投資人期待協議能成形，周二開盤一度大漲 4%，但最終僅收高 1.5%。,https://m.cnyes.com/news/id/6157118
1104,6157144,川普透露TikTok已有買家 再延交易期限至12/16,美國總統川普週二 (16 日) 宣布，美中雙方已就短影音分享平台 TikTok 達成協議，該協議將確保 TikTok 繼續在美國營運，並把其美國資產自中國母公司字節跳動轉移至美國買方手中,https://m.cnyes.com/news/id/6157144
1105,6156349,跌破眼鏡！美債今年來表現 超越全球前15大主權債市,,https://m.cnyes.com/news/id/6156349
1106,6157116,〈紐約匯市〉Fed決策在即 美元兌歐元跌至四年低點,美元周二 (16 日) 下跌，兌歐元跌至四年低點，投資人加碼押注聯準會 (Fed) 本周將降息。,https://m.cnyes.com/news/id/6157116
1107,6157009,〈能源盤後〉烏克蘭無人機襲擊俄港口、煉油廠 俄供應恐中斷 原油漲逾1%,原油期貨價格周二 (16 日) 漲逾 1 美元 / 桶，係因烏克蘭無人機襲擊俄羅斯港口和煉油廠後，交易員權衡俄羅斯供應中斷的可能性，並等待聯準會 (FED) 的利率決定。,https://m.cnyes.com/news/id/6157009
1108,6157044,SpaceX夥晶片商攻衛星直連手機 新衛星兩年內升空、明年下半手機測試,據《彭博》周二報導，SpaceX 正與晶片製造商合作，將相關晶片嵌入手機以支援其衛星直連手機服務。該公司總裁 Gwynne Shotwell 表示，SpaceX 計劃在未來兩年內發射支援此服務的新衛星，並於明年底進行手機測試。,https://m.cnyes.com/news/id/6157044
1109,6157051,〈台股盤前要聞〉台股再刷新高、聯發科首款2奈米晶片明年底上市、無薪假災情加重,台股盤前要聞,https://m.cnyes.com/news/id/6157051
1110,6157096,把小孩、寵物做成公仔！Gemini新功能吸引逾1300萬人 助攻App Store排名超車ChatGPT,據《CNBC》周二 (16 日) 報導，Google 一直在生成式 AI 領域追趕 OpenAI，現在似乎終於在用戶端取得進展。,https://m.cnyes.com/news/id/6157096
1111,6155434,【袁志峰專欄】關注香港施政報告,"今日推介 - 滙豐控股 (5, $107.2), 目標價 $118, 止損價 $102",https://m.cnyes.com/news/id/6155434
1112,6157002,〈美股盤後〉等待Fed利率決定 標普自歷史高位回落,投資人於聯準會利率決策前獲利了結，美股週二 (16 日) 小幅回落。標普 500 指數收跌 0.13%，盤中曾創歷史新高，那斯達克指數跌 0.07%，道瓊指數下挫 125.55 點。,https://m.cnyes.com/news/id/6157002
1113,6156985,貝森特支持川普半年報提議 稱有利投資人,據《CNBC》周二 (16 日) 報導，美國財政部長貝森特表示，美國總統川普提議企業改採半年報制對投資人是好消息。,https://m.cnyes.com/news/id/6156985
1114,6157095,微軟砸300億美元投資英國AI基建 建最大超級電腦,據《CNBC》周二 (16 日) 報導，微軟 (MSFT-US) 宣布計劃至 2028 年在英國投資 300 億美元建設 AI 基礎設施，其中包括 150 億美元資本支出和 150 億美元營運投資，將與英國雲端運算公司 Nscale 合作打造英國最大超級,https://m.cnyes.com/news/id/6157095
1115,6156933,瑞幸進軍美國 折扣策略能否複製中國成功？,據《CNBC》周二 (16 日) 報導，中國最大咖啡連鎖瑞幸咖啡正在挑戰美國市場。家這曾因會計造假醜聞下市的企業，憑藉大幅折扣策略在中國超越星巴克(SBUX-US)，現瞄準星巴克大本營擴張。,https://m.cnyes.com/news/id/6156933
1116,6156995,美房市持續疲軟 建商信心指數維持低檔、近4成業者降價求售,據《彭博》周二 (16 日) 報導，美國全國房屋建築商協會調查顯示，儘管房貸利率近期下降，但 9 月建商信心指數維持在 32 的低檔，反映房市持續疲軟。39% 建商報告降價銷售，創疫情後新高。,https://m.cnyes.com/news/id/6156995
1117,6157075,PIMCO籲Fed停止縮表 重啟MBS投資盼降房貸利率,綜合外媒周二 (16 日) 報導，Pacific Investment Management Co.(PIMCO) 呼籲美國聯準會 (Fed) 重新思考資產負債表操作，停止持續縮減抵押貸款支持證券 (MBS) 的規模，甚至採取更積極的「,https://m.cnyes.com/news/id/6157075
1118,6157072,幣安監察脫身倒數？傳與美司法部磋商,根據《彭博》周二 (16 日) 報導，全球最大加密貨幣交易所幣安 (Binance) 據傳正與美國司法部 (DOJ) 接觸，討論提前解除原本在和解協議中設定的外部合規監察 (Compliance Monitor)。這一監察,https://m.cnyes.com/news/id/6157072
1119,6156993,美8月工業生產僅溫和反彈 製造業仍受關稅拖累,美國工業生產 8 月僅小幅上升，延續近月疲弱走勢，顯示製造業復甦仍面臨挑戰。聯準會 (Fed) 周二 (16 日) 公布數據顯示，工廠、礦業及公用事業整體產出月增 0.1%，略優於市場預期的持平，但前值被下修為萎縮 0.4%。,https://m.cnyes.com/news/id/6156993
1120,6156902,川普施壓Fed削弱獨立性！專家：經濟恐迎高通膨＋失業潮,美國總統川普對聯準會 (Fed) 的施壓行動，引發市場與經濟學界廣泛關注。《CNBC》周二 (16 日) 公布的 9 月最新調查顯示，多數受訪者認為，這些舉動可能限制甚至消除 Fed 的獨立性，並帶來通膨升高、經濟成長放緩與失業率上升的風,https://m.cnyes.com/news/id/6156902
1121,6156994,「口袋裡的好萊塢？」迪士尼等影業巨擘怒告中國AI公司MiniMax,根據《路透》報導，華特迪士尼 (Walt Disney)(DIS-US)、康卡斯特(CMCSA-US) 旗下環球影業 (Universal) 與華納兄弟探索 (WBD-US) 周二 (16 日) 在加州聯邦地方法院共同提起訴訟，指控中國人,https://m.cnyes.com/news/id/6156994
1122,6156917,前歐洲央行總裁：歐盟行動緩慢！競爭力倒退、成長模式正在消失,據《金融時報》周二 (16 日) 報導，前歐洲央行（ECB）總裁德拉吉（Mario Draghi）警告，歐盟和各國政府「無所作為」使得該地經濟競爭力正在倒退。,https://m.cnyes.com/news/id/6156917
1123,6156955,TikTok命運新轉折？傳新投資人入局 甲骨文續當「數據管家」,《CNBC》周二 (16 日) 援引知情人士消息報導，短影音應用程式 TikTok 的協議框架將納入新投資人，同時保留母公司字節跳動 (ByteDance) 的既有股東。協議預計在未來 30 至 45 天內完成，作為協議的一部分，甲骨文 (OR,https://m.cnyes.com/news/id/6156955
1124,6156905,中國裁定輝達違反反壟斷法 貝森特：失望 但稱不影響兩國貿易談判,據《彭博》周二 (16 日) 報導，美國財政部長貝森特表示，當美中貿易談判期間得知中國裁定輝達 2020 年收購案違反反壟斷法時，美方談判代表向中方表達失望。貝森特強調，輝達案與正在進行的談判無關，不影響談判結果。,https://m.cnyes.com/news/id/6156905
1125,6156916,G7制裁俄油出現分歧 日本不願跟進美國關稅提案,據《彭博》周二 (16 日) 報導，美國呼籲 G7 盟友對中國和印度課徵高達 100% 關稅，理由是兩國持續進口俄羅斯石油，但日本官員予以婉拒。,https://m.cnyes.com/news/id/6156916
1126,6156950,信邦擴大美墨產能布局 評估赴東南亞設廠,信邦擴大美墨產能布局 評估赴東南亞設廠,https://m.cnyes.com/news/id/6156950
1127,6156940,美8月零售銷售連3月成長 消費韌性與就業隱憂並存,美國商務部周二 (16 日) 公布數據顯示，8 月零售銷售連續第三個月成長，漲幅優於市場預期，顯示消費支出在暑期展現韌性。然而，隨著就業市場疲軟與關稅推升物價，經濟前景仍蒙上陰影。,https://m.cnyes.com/news/id/6156940
1128,6156733,外資中國購房迎來重大變革 結匯支付流程簡化但「限外令」未除,歷經十餘年等待，境外人士在中國購房時面臨的「付款難題」終於獲得解決。中國國家外匯管理局（簡稱「外匯局」）日前發布《關於深化跨境投融資外匯管理改革有關事宜的通知》，推出兩項外匯新政，旨在便利境外資金在境內購房，被市場視為一,https://m.cnyes.com/news/id/6156733
1129,6156924,季報對投資人的價值何在？川普推動降低財報頻率惹議,美國總統川普周一重提取消上市公司季報義務，改為半年報告一次的想法，但投資界並未大力支持此變革。分析認為，減少財報頻率將降低資訊透明度，增加投資風險，且可能加劇股價波動。,https://m.cnyes.com/news/id/6156924
1130,6156834,〈美股早盤〉主要指數平盤波動 投資人靜待Fed利率決策,美股主要指數周二 (16 日) 平盤波動，投資人一方面消化優於預期的 8 月零售銷售數據，顯示消費動能仍穩健；另一方面則保持觀望，等待聯準會 (Fed) 周三 (17 日) 的利率決策。市場普遍押注 Fed 將宣布降息，以支撐走弱的就業市場，股,https://m.cnyes.com/news/id/6156834
1131,6156730,馬雲強勢回歸 傳聞掌舵「讓阿里巴巴再次偉大」計畫,根據外媒報導，在中國科技業經歷數年嚴格監管後，阿里巴巴 (09988-HK)(BABA-US) 內部正燃起「MAGA」（Make Alibaba Great Again，讓阿里巴巴再次偉大）的呼聲，而實現此一使命的關鍵武器，,https://m.cnyes.com/news/id/6156730
1132,6156845,Fed暫避撤換理事衝擊：庫克續任參與會議、米蘭確認補缺,根據《路透》報導，美國聯準會 (Fed) 周二 (16 日) 展開兩天政策會議，在美國總統川普前所未有試圖撤換現任理事的爭議下，暫時避免了對央行獨立性的直接衝擊。不過，白宮持續向 Fed 施壓，要求貨幣政策更貼近行政部門意志，仍讓市場,https://m.cnyes.com/news/id/6156845
1133,6156936,防詐也防胖手指！金管會推轉帳顯示「受款人戶名」 32家銀行9月底上線,過去民眾轉帳僅憑一組帳號，可能出現按錯帳號數字轉帳給陌生人的情形，金管會今 (16) 日表示，32 家銀行 (包含中華郵政及 8 家公股銀) 將於今年 9 月底前，推出新台幣轉帳顯示「受款人戶名」功能，但會遮掩部分字元，,https://m.cnyes.com/news/id/6156936
1134,6156736,「車頂維權」案逆轉？女車主告中國特斯拉獲勝訴 法院判令提供完整行車數據,歷經 4 年的法律纏鬥，備受關注的特斯拉「車頂維權」事件迎來關鍵轉折。2025 年 9 月 16 日，北京市大興區人民法院就車主張女士控告特斯拉的買賣合約糾紛案作出一審判決，認定特斯拉作為經營者應保障消費者的知情權，判令其必須在判決生,https://m.cnyes.com/news/id/6156736
1135,6156925,貝森特：中國已意識到貿易協議可能性 11月關稅生效前雙方還會再見面,美國財政部長貝森特 (Scott Bessent) 周二 (16 日) 表示，美、中貿易協議已接近達成，預期在 11 月互惠關稅生效前將進行進一步談判。他在接受《CNBC》訪問時透露，中國已開始意識到達成貿易協議的可能性。,https://m.cnyes.com/news/id/6156925
1136,6156885,從熄燈到協議：美財長稱川普強硬立場推動TikTok談判進展,根據《CNBC》報導，美國財政部長貝森特 (Scott Bessent) 周二 (16 日) 表示，美國總統川普願意讓 TikTok 在美國「熄燈」的強硬態度，是推動與中國達成協議框架的關鍵轉折點。,https://m.cnyes.com/news/id/6156885
1137,6156818,揮別RBC、迎接ICS！保險業接軌初期波動大 金管會放寬「資本不足」標準,保險業 2026 年起正式接軌新一代清償能力 (TW-ICS)，取代現行保險風險資本額 (RBC) 制度，金管會今 (16) 日預告「保險業資本適足性管理辦法」修正草案，本次修正 9 條並刪除 1 條，以往主管機關緊盯 ,https://m.cnyes.com/news/id/6156818
1138,6156858,特斯拉Model Y疑車門失靈 美NHTSA調查17.4萬輛電動車,美國國家公路交通安全管理局 (NHTSA) 周二 (16 日) 表示，已對約 17.4 萬輛 2021 年款特斯拉(TSLA-US)Model Y 汽車展開調查，原因是電子車門把手可能失靈，導致車門無法正常開啟。,https://m.cnyes.com/news/id/6156858
1139,6156731,Alphabet市值衝破3兆美元後 股價依然便宜嗎？,Google 母公司 Alphabet Inc.(GOOGL-US) 本周寫下歷史新頁，其市值在周一 (15 日) 收盤時首次突破 3 兆美元大關，正式加入由輝達 (NVDA-US)、微軟 (MSFT-US) 及蘋果 (AAPL,https://m.cnyes.com/news/id/6156731
1140,6156900,外資買超270億元連11買 狂買半導體股 掃貨DRAM雙雄9.3萬張,台股續創高外資連 11 買 掃貨 DRAM 雙雄 9.3 萬張,https://m.cnyes.com/news/id/6156900
1141,6156910,鉅亨速報 - Factset 最新調查：Novo Nordisk - ADRNVO-US的目標價調降至69.31元，幅度約10.95%,FactSet 最新調查：Novo Nordisk - ADRNVO-US目標價調降，最高估值、最低估值、中位數、綜合評級、近5日股價、標普、即時新聞資訊,https://m.cnyes.com/news/id/6156910
1142,6156908,鉅亨速報 - Factset 最新調查：艾伯維ABBV-US的目標價調升至227元，幅度約3.18%,FactSet 最新調查：艾伯維ABBV-US目標價調升，最高估值、最低估值、中位數、綜合評級、近5日股價、標普、即時新聞資訊,https://m.cnyes.com/news/id/6156908
1143,6156837,電池不夠用！日產新款Leaf電動車產量砍半,根據《日經》周二 (16 日) 報導，日產汽車 (Nissan) 因電池採購延誤，下修新款 Leaf 電動車 9 月至 11 月的產量計畫，幅度超過一半。《日經》指出，電池供應問題來自日產旗下關係企業的產能不如預期，迫使公司調整生產規劃。新款,https://m.cnyes.com/news/id/6156837
1144,6156884,戰略性高科技貨品出口新增279個涉武擴實體名單 累計納管逾萬個實體與個人,為強化我國出口管制機制，防範高科技貨品流入涉武擴散實體，經濟部國際貿易署今（16）日宣布更新「戰略性高科技貨品出口實體管理名單」，新增 279 個實體，並移除 7 個實體。此次更新涵蓋巴基斯坦、伊朗、墨西哥、中國大陸、葉門等地區,https://m.cnyes.com/news/id/6156884
