,newsId,title,summary,link
362,6167456,孫正義AI豪賭逆襲 身價衝上390億美元新高 ,,https://m.cnyes.com/news/id/6167456
363,6167011,即使超級富豪也該把資金配置在指數基金,最新發布的 2025 年版《富比世》美國 400 大富豪榜顯示，榜單成員在截至 9 月初的 12 個月內，合計財富增加 1200 億美元，年增幅約 22%，表現優於標普 500 同期的 16%。,https://m.cnyes.com/news/id/6167011
364,6167452,黃仁勳連續4個月賣出輝達股票 套現數億美元,美國證券交易委員會（SEC）揭露的文件顯示，晶片大廠輝達（Nvidia）執行長黃仁勳通過多次交易，以每次賣出約 5 萬股或 7.5 萬股的頻率，連續 4 個月減持輝達股票，成交價區間為每股 174.82 美元至 184.38 美元。,https://m.cnyes.com/news/id/6167452
365,6167460,連 18 紅！8 月製造業指數創歷史新高，推升景氣循環股？,,https://m.cnyes.com/news/id/6167460
366,6167444,奇瑞汽車上市首日一度漲超13% 成港股今年最大車企IPO,,https://m.cnyes.com/news/id/6167444
367,6167448,東聯互動競拍底價138.84元 10/16掛牌上櫃,東聯互動競拍底價 138.84 元 10/16 掛牌上櫃,https://m.cnyes.com/news/id/6167448
368,6167392,最低工資可望10連升 調查有74%企業會調薪 95%勞方憂通膨6成2想兼差,最低工資審議會明 (26) 日即將舉行，雖然今年經濟成長率有望「保四」，不過持續面臨通膨壓力，以及關稅貿易戰衝擊，時薪與月薪能否雙漲？yes123 求職網「最低工資勞資看法調查」結果今 (25) 出爐，假如明年最低工資調漲，有 74,https://m.cnyes.com/news/id/6167392
369,6167016,Fed古爾斯比對進一步降息持保留態度 就業市場放緩不等於衰退,,https://m.cnyes.com/news/id/6167016
370,6167403,〈焦點股〉技嘉GB300伺服器啟動出貨 早盤放量股價攻上300元大關,PC 品牌技嘉 (2376-TW) 日前指出，隨著第四季到來，全新 AI 伺服器新品 GB 300 已經啟動出貨，且與客戶合作關係良好，高階產品領域拉貨力道強，第四季將為全年最高點，激勵今 (25) 日股價開高走高，一度攻上 300 元大關，,https://m.cnyes.com/news/id/6167403
371,6167049,阿里巴巴估值凸顯潛力 本益比仍低於亞馬遜 AI 投資或釋放長期紅利,阿里巴巴集團 (BABA-US) 近日宣布將進一步加碼其在人工智慧（AI）與雲端基礎設施的投資，此舉被視為中國科技業對 AI 賽道長期競爭的強烈信號。,https://m.cnyes.com/news/id/6167049
372,6167280,台灣再被點名！美財長：世界經濟最大風險 就是99%高端晶片在當地生產,,https://m.cnyes.com/news/id/6167280
373,6167390,〈焦點股〉華新得標台電強韌電網 線纜股三檔掛出漲停紅燈,台電強韌電網計畫持續釋單，近期釋出「161kV 交連 PE 電纜及附屬器材」標案，標案金額逾 190 億元，線纜廠華新為得標廠商之一，加上銅價噴漲、集團第三季做漲行情啟動，激勵華新今 (25) 日價量齊揚，攻上漲停板。,https://m.cnyes.com/news/id/6167390
374,6167290,驚天揭秘！德意志銀行警告：沒有輝達晶片 美國經濟早垮了,,https://m.cnyes.com/news/id/6167290
375,6167130,川普挺米雷伊 美國擬援助阿根廷200億美元穩經濟,美國計劃向阿根廷提供高達 200 億美元的貨幣互換額度，並準備購買該國外幣債券，以此向該國總統米雷伊 (Javier Milei) 提供急需的金融支持，助其重拾投資者信心並遏制披索擠兌。,https://m.cnyes.com/news/id/6167130
376,6167319,房市清淡建商密集籌資鞏固營運 聯上實業擬發CB籌資7億元,台灣央行自去年 9 月的第七波房市信用管制至今仍無調降利率及大幅放鬆管制，造成房市交易冷清且可能延續到今年底，建商密集籌資鞏固營運不斷，其中由聯上實業 (4113-TW) 擬發行可轉換公司債 (CB) 籌資 7 億元案。,https://m.cnyes.com/news/id/6167319
377,6167197,健忘理財法？NBA球星杜蘭特忘了BTC密碼 時隔10年拿回帳戶 立馬出貨3000枚賺3.5億美元,NBA 球星凱文杜蘭特在 2014 年或 2015 年在 Coinbase 上購買了 3000 多枚比特幣，但他遺忘密碼，直到近期透過聯繫官方與一系列驗證才拿回帳戶，套現高達 3.5 億美元，獲得了 180 倍的回報。,https://m.cnyes.com/news/id/6167197
378,6167241,〈台股開盤〉台積電小跌 跌逾150點拚翻紅 漲多震盪守穩2萬6,美股四大指數漲多休息，台指期夜盤也小跌 36 點，台股今日同樣修正整理，早盤以 26067.97 點開出後，呈現高檔震盪走勢，預估成交量也縮至 4200 億元。雖今天電子權值股多無表現，但線纜族群表現亮眼，成為盤面亮點。,https://m.cnyes.com/news/id/6167241
379,6167012,不是泡沫！美銀：美股「貴得合理」 高估值恐成新常態,,https://m.cnyes.com/news/id/6167012
380,6167061,AI編碼市場近飽和？谷歌2025年度DORA報告：9成工作者每天用2小時AI,根據谷歌 2025 年度 DORA 報告，調查近 5000 名技術專業人士後發現，90% 受訪者在工作中使用 AI，年增長了 14%。開發者現在平均每天花約 2 小時積極使用 AI 工具，顯示整個產業的工作方式正在徹底改變。,https://m.cnyes.com/news/id/6167061
381,6167177,2025全球最有價值十大航空公司排名出爐！阿聯酋航空連三冠 達美居次 中國南航擠掉日航,,https://m.cnyes.com/news/id/6167177
382,6167120,繼中日韓後 巨大自行車疑涉「強迫勞動」遭美禁輸 勞經兩部會緊急回應 ,經濟部昨今（24）日深夜，勞動部於今（25）日上午表示，高度重視美國海關暨邊境保護局（CBP）所公布之資訊，內容顯示該局合理懷疑巨大機械工業股份有限公司（簡稱巨大公司）在台灣製造的自行車、相關零件及配件涉及強迫勞動，故對,https://m.cnyes.com/news/id/6167120
383,6167129,澤倫斯基：烏克蘭決定開放武器出口,烏克蘭總統澤倫斯基周三（24 日）在第 80 屆聯合國大會一般性辯論上發言時表示，決定開放武器出口，向合作夥伴展示經過實戰檢驗的現代可靠武器系統。,https://m.cnyes.com/news/id/6167129
384,6164809,【Joe’s華爾街脈動】美股盤整之際，台灣憑藉半導體實力逆勢走強,,https://m.cnyes.com/news/id/6164809
385,6167127,習近平在聯合國氣候變化峰會發表視訊致辭 宣布中國新一輪國家自主貢獻,中國國家主席習近平周三（24 日）在聯合國氣候變化峰會發表視訊致辭，宣布中國新一輪國家自主貢獻。,https://m.cnyes.com/news/id/6167127
386,6167128,川普稱聯合國演講遭「三重破壞」美特勤局已展開調查,"美國總統川普周三 (24 日) 表示，特勤局 (United States Secret Service, USSS) 正在調查他所說的聯合國「破壞」事件，稱手扶梯故障、提詞機故障和音響問題干擾了他一天前在聯合國大會的亮相。",https://m.cnyes.com/news/id/6167128
387,6167124,馬克宏向川普喊話 提到諾貝爾和平獎,英國、加拿大、澳洲、法國等多個西方國家近日在第 80 屆聯合國大會期間宣布承認巴勒斯坦國，美國總統川普周二（23 日）則在這一多邊外交舞台上指責其他國家。,https://m.cnyes.com/news/id/6167124
388,6167055,美CBP發暫扣令 自行車廠巨大台製產品禁輸美可能影響集團營收4-5%,美國海關暨邊境保護局於美東時間 2025 年 9 月 24 日宣布，對巨大 (9921-TW) 在台灣生產的產品涉及存在「強迫勞動疑慮」發出暫扣令，禁止相關產品進口美國市場，巨大指出，可能影響集團營收 4-5%。,https://m.cnyes.com/news/id/6167055
389,6167046,川普政府啟動調查 機器人與醫療設備恐面臨新關稅,《彭博》24 日報導，美國川普政府啟動對機器人、工業機械及醫療設備進口展開調查，為加徵新一波關稅鋪路。,https://m.cnyes.com/news/id/6167046
390,6167032,大摩點名6檔現在最值得買AI股,據《Investing.com》周三 (24 日) 報導，摩根士丹利 (Morgan Stanley) 指出，目前值得買進的最佳人工智慧 (AI) 股票已經不再局限於傳統領先業者，而是進一步擴展至記憶體領域。,https://m.cnyes.com/news/id/6167032
391,6167030,美股重點新聞摘要2025年9月25日,美股重點新聞摘要 2025 年 9 月 25 日,https://m.cnyes.com/news/id/6167030
392,6167056,稀土戰升級！G7研議價格下限與中國碳稅措施,,https://m.cnyes.com/news/id/6167056
393,6167015,路透：川普10月亞洲行 擬增日本一站並會晤石破茂接班人,,https://m.cnyes.com/news/id/6167015
394,6167060,巨大遭美海關實施暫扣令 影響營收約4%~5%,美國海關及邊境保護局 (CBP)24 日宣布，基於可信資訊顯示自行車製造大廠巨大機械(Giant) 涉及「強迫勞動」，已對其在台灣生產的捷安特自行車及相關零組件發布暫扣令(WRO)，並立即生效。隨後，巨大機械發布公告，確認已收,https://m.cnyes.com/news/id/6167060
395,6167031,Fed戴莉：可能還需要進一步降息,據《路透》報導，舊金山聯準銀行總裁戴莉 (Mary Daly) 周三 (24 日) 表示，她「完全支持」聯準會 (Fed) 上周的降息決策，並指出未來可能還需要進一步降息。,https://m.cnyes.com/news/id/6167031
396,6165524,〈貴金屬盤後〉等待經濟數據 黃金從歷史高點下滑,,https://m.cnyes.com/news/id/6165524
397,6167039,川普「騙局說」後 美能源部擬取消130億美元綠能補助,美國能源部周三 (24 日) 宣布，擬取消拜登政府原先承諾用於補貼風能、太陽能、電池及電動車的資金逾 130 億美元。該部門表示，將這些資金返還給美國納稅人，以彰顯新政府支持更具成本效益、可靠及安全的美國能源政策。,https://m.cnyes.com/news/id/6167039
398,6166879,杜拜港務巨頭：美國關稅重塑全球貿易 非洲成新熱點,據《華爾街日報》周三 (24 日) 報導，全球最大港口營運商之一迪拜環球港務 (DP World) 執行長 Sultan Ahmed bin Sulayem 表示，儘管地緣政治緊張和關稅干擾貿易流向，但貿易本身具有韌性。,https://m.cnyes.com/news/id/6166879
399,6167029,分析師看旺：特斯拉Q3有望繳出亮眼成績,根據 Wolfe Research 的分析，特斯拉 (Tesla)(TSLA-US) 第三季有望繳出亮眼成績，交車量可能超出市場預期。特斯拉股價周三上漲 3.9%，至每股 442.79 美元。,https://m.cnyes.com/news/id/6167029
400,6167010,路透：川普週四將簽TikTok行政令,《路透社》週三 (24 日) 報導，白宮知情人士透露，美國總統川普將於美東時間週四 (24 日) 簽令，宣告白宮正在談判的 TikTok 美國業務出售協議，符合 2024 年法律所規定的要求。,https://m.cnyes.com/news/id/6167010
401,6166941,〈能源盤後〉美庫存意外下降 加劇供應擔憂 原油飆漲3%登7周高點,原油期貨價格周三 (24 日) 上漲約 3% 至 7 周高點，係因美國原油庫存意外下降，加劇了市場對伊拉克、委內瑞拉和俄羅斯出口問題導致供應收緊的擔憂。,https://m.cnyes.com/news/id/6166941
402,6166866,澳洲智庫報告：川普政策重創美國在東南亞影響力 中國趁勢崛起,據《彭博》周三 (24 日) 報導，澳洲智庫「羅伊國際政策研究院」(Lowy Institute) 最新報告顯示，川普的關稅、削減援助及簽證限制政策正削弱美國在東南亞影響力，中國已超越美國成為該區域最具影響力的外部夥伴。,https://m.cnyes.com/news/id/6166866
403,6167028,〈紐約匯市〉美元上漲 鮑爾釋出審慎降息展望,美元周三 (24 日) 上漲，此前聯準會 (Fed) 主席鮑爾 (Jerome Powell) 在前晚談話中對進一步寬鬆政策採取審慎態度。,https://m.cnyes.com/news/id/6167028
404,6167008,〈美股盤後〉英特爾嗨漲 阿里巴巴ADR飆升 四大指數卻集體收墨,自四月低點強勢反彈後，美股近日走勢顯露疲態，四大指數週三 (24 日) 集體收墨。,https://m.cnyes.com/news/id/6167008
405,6167009,歐盟盼與美重啟鋼鋁關稅談判,《彭博》報導，歐盟貿易事務專員塞夫柯維奇 (Maros Sefcovic) 本週將與美國貿易代表格里爾 (Jamieson Greer) 會晤，盼能推動已停滯的鋼鋁關稅談判重啟。,https://m.cnyes.com/news/id/6167009
406,6166987,〈台股盤前要聞〉指數盤踞2萬6山頂、前20大權值股權重比超過61%、銀樓飾金飆新高價,台股盤前要聞,https://m.cnyes.com/news/id/6166987
407,6167006,彭博：英特爾尋求蘋果資金挹注 股價聞訊飆升超6%,《彭博》週三 (24 日) 報導，英特爾近日已接觸蘋果，希望爭取資金挹注，以支撐這家陷入困境的晶片製造商重整業務。英特爾部分股權目前已由美國政府持有。,https://m.cnyes.com/news/id/6167006
408,6166784,"國際金價飆破3,800美元？分析師：「黃金投機熱」尚未到來","本周國際金價繼續上漲，已經突破每盎司 3,800 美元大關，強勁需求，持續的經濟不確定性，增強了這個避險資產的吸引力。",https://m.cnyes.com/news/id/6166784
409,6163941,【袁志峰專欄】北水加速買入阿里(9988),"今日推介 - 中國移動 (941, $85.7), 目標價 $93.0, 止損價 $82.5",https://m.cnyes.com/news/id/6163941
410,6166286,川普政府最頭疼問題之一 美國電費今冬預測將大幅上漲,當美國消費者對牛肉等食品價格飆升感到擔憂、對夏季電費賬單激增感到不解之際，一項新的預測報告警告，今年冬天美國家庭的取暖費用將會上漲。,https://m.cnyes.com/news/id/6166286
411,6166154,瑞銀上調特斯拉Q3交車量 預測有望創下單季歷史最高紀錄,市場普遍預期，美國稅收抵免在 9 月底到期，將刺激消費者加大購買力度，特斯拉（Tesla）等電動車製造商將在本季度迎來交車高峰。,https://m.cnyes.com/news/id/6166154
412,6165525,千億美元豪賭OpenAI 輝達陷「循環投資」爭議 AI泡沫警訊浮現？,,https://m.cnyes.com/news/id/6165525
413,6166945,美兌現與歐盟貿易協議承諾 歐盟汽車進口關稅降至15%,美國周三 (24 日) 正式調降歐盟汽車進口關稅至 15%，並追溯至 8 月 1 日生效，落實美國總統川普與歐盟執委會主席范德賴恩 7 月達成的貿易協議。,https://m.cnyes.com/news/id/6166945
414,6166839,SAP兩路並進攻歐洲主權市場 分別結盟OpenAI、AWS,據《彭博》周三 (24 日) 報導，德國企業軟體公司 SAP SE 宣布兩項重大合作，積極布局歐洲「數位主權」市場。,https://m.cnyes.com/news/id/6166839
415,6166920,OpenAI野心與現實落差：資金與供應鏈兩頭卡關,人工智慧 (AI) 熱潮推動 OpenAI 提出龐大的「星際之門」(Stargate)基礎建設計畫，目標在未來十年投入數千億美元打造資料中心與運算能力。執行長阿特曼 (Sam Altman) 近日宣布，與輝達(NVDA-US)、軟銀,https://m.cnyes.com/news/id/6166920
416,6166931,亞馬遜旗下Zoox要上路！無人駕駛車申請美國批准,《彭博》周三 (24 日) 報導，亞馬遜 (AMZN-US) 旗下自駕車公司 Zoox 正尋求美國監管機構批准，允許其部署沒有方向盤與踏板等傳統駕駛控制裝置的自駕車，顯示該公司正準備將商業營運擴展到更大規模。,https://m.cnyes.com/news/id/6166931
417,6166942,市場需求放緩！本田停產由通用代工電動休旅,根據《CNBC》周三 (24 日) 報導，本田汽車 (Honda Motor) 將終止在美國由通用汽車 (GM-US) 代工生產的 Acura ZDX 電動跨界休旅車，理由是電動車市場需求放緩與產品線調整。,https://m.cnyes.com/news/id/6166942
418,6166844,漢田生技執行買回庫藏股500張提前買齊 平均每股均價82.12元,漢田生技 (1294-TW) 自 8 月 8 日起執行的買回 500 張庫藏股護盤措施，在今 (24) 日提前執行完畢，平均每股買買回價格爲 82.12 元，今天的漢田生技收盤價爲 82.8 元，上漲 1.2 元作收。,https://m.cnyes.com/news/id/6166844
419,6166937,印尼礦場出事！Freeport宣布不可抗力 銅價暴漲,"根據《彭博》報導，銅價周三大幅上揚，美國礦業巨擘自由港麥克莫蘭公司 (Freeport-McMoRan, 簡稱自由港)(FCX-US) 表示，其位於印尼的格拉斯伯格 (Grasberg) 銅礦因事故影響，已對合約供應宣布不可抗力",https://m.cnyes.com/news/id/6166937
420,6166932,微軟與OpenAI夥伴關係生變？Copilot助理整合勁敵Anthropic的AI模型,身為 OpenAI 的主要投資者和關鍵雲端合作夥伴，微軟 (MSFT-US) 與其 AI 盟友的關係正變得複雜。該公司周三宣布，開始在其 Microsoft 365 Copilot 助理中使用 Anthropic 的 AI 模型。,https://m.cnyes.com/news/id/6166932
421,6166768,NHTSA調查Rivian逾1.7萬電動貨車 安全帶恐有缺陷,綜合外媒周三 (24 日) 報導，美國國家公路交通安全管理局 (NHTSA) 已對 Rivian Automotive Inc.(RIVN-US)的電動送貨車展開調查，原因是駕駛座安全帶固定系統出現潛在瑕疵，恐在碰撞時增加風險。,https://m.cnyes.com/news/id/6166768
422,6166884,川普政府擬入股加拿大鋰礦商 Lithium Americas股價早盤飆漲近95%,根據《CNBC》周三 (24 日) 報導，由於川普政府正尋求入股加拿大礦業公司 Lithium Americas（LAC-US），該公司股價早盤飆升近 95%。,https://m.cnyes.com/news/id/6166884
423,6166867,啤酒、龍舌蘭業者全力出手！酒業大戰WHO「沒有安全飲酒水準」立場,根據《路透》取得的信件與電郵內容，包括比利時釀酒業、墨西哥龍舌蘭業者與荷蘭啤酒大廠海尼根 (Heineken) 等，今夏加強遊說各國政府，抵制世界衛生組織 (WHO) 推動更嚴格的控酒措施。這些先前未曝光的行動顯示，規模達 1 兆美,https://m.cnyes.com/news/id/6166867
424,6166898,台股新高不止步？路博邁：資金技術雙引擎驅動 六大產業長線價值浮現,路博邁投信今 (24) 日釋出台股第四季展望，在 AI 創新驅動下，台股正迎來前所未有的結構性成長機會，今年以來加權指數屢創新高，路博邁台灣 5G 股票基金經理人黃煜表示，看好台股 AI、雲端、記憶體、PCB、軍工、機器,https://m.cnyes.com/news/id/6166898
425,6166865,安聯投信投資長預言：AI淘汰賽將至 全球20%上市公司5年後恐消失,據《彭博》周三（24 日）報導，安聯投信全球股票業務的投資長表示，AI 將引發「數位達爾文主義」時期，那些未能適應的企業將面臨殘酷挑戰。她預測，未來五年內，全球近五分之一的上市企業可能將不復存在。,https://m.cnyes.com/news/id/6166865
426,6166873,「我們不缺籌碼！」美財長點名航空引擎、化學品制衡中國,美國財政部長貝森特 (Scott Bessent) 周三 (24 日) 表示，美國在與中國談判時並非毫無籌碼，包括飛機引擎與零組件、特定化學品及塑膠、矽材料原料等關鍵產品，都是中國依賴美國的領域。,https://m.cnyes.com/news/id/6166873
427,6166878,貝森特稱當前利率過於緊縮 批鮑爾對降息不上心,據《彭博》周三 (24 日) 報導，美國財政部長貝森特 (Scott Bessent) 表示，他對聯準會主席鮑爾未能明確制定降息議程感到失望。,https://m.cnyes.com/news/id/6166878
428,6166766,〈美股早盤〉主要指數小幅走高 阿里巴巴推升AI樂觀情緒,美股主要指數周三 (24 日) 小幅走高，投資人消化聯準會 (Fed) 主席鮑爾釋出的謹慎談話，並關注本周稍晚即將公布的重要經濟數據。與此同時，阿里巴巴宣布加大人工智慧 (AI) 投資計畫，提振市場對 AI 題材的樂觀情緒，帶動科技股反彈,https://m.cnyes.com/news/id/6166766
429,6166823,泰國信評拉警報！惠譽將展望降至負向 評等仍維持BBB+,根據《彭博》報導，國際信評機構惠譽 (Fitch Ratings) 周三 (24 日) 將泰國的長期外幣發行人違約評等 (IDR) 展望由「穩定」下調至「負向」，理由是長期的政治不確定性與經濟成長前景疲弱，恐進一步侵蝕公共財政。泰國的,https://m.cnyes.com/news/id/6166823
430,6166735,美印貿易關係角力 印度擬擴大能源採購以換取關稅減免,在美國近期對印度商品祭出高額關稅後，兩國貿易關係陷入緊張。為尋求突破，印度商工部長戈亞爾 (Piyush Goyal) 在紐約表示，印度希望增加對美國石油和天然氣的採購，此舉旨在說服華盛頓當局降低對印度出口商品的關稅，並,https://m.cnyes.com/news/id/6166735
431,6166846,彭博：甲骨文擬發債150億美元籌資,據《彭博》周三 (24 日) 引述知情人士報導，甲骨文公司 (ORCL-US) 正尋求從美國投資級債券市場借貸 150 億美元，計劃發行多達七個部分的債券，包括罕見的 40 年期債券。,https://m.cnyes.com/news/id/6166846
432,6166821,Fed最新調查：美企業信心反彈 但明年物價更苦,《路透》周三 (24 日) 報導，根據亞特蘭大聯準銀行與里奇蒙聯準銀行聯合杜克大學富夸商學院所做的最新調查，美國企業財務長 (CFO) 對前景的樂觀情緒在第三季有所提升，先前因貿易政策不確定性而受壓的氛圍逐漸消散。不過，企業同時指,https://m.cnyes.com/news/id/6166821
433,6166822,信立出脫世紀*4020張股票  處分利益約4.39億元,"信立 (4303-TW) 今 (24) 日宣布，公司經董事長核決，進行投資組合調整，決議自本 (9) 月 2 日起至 24 日，處分世紀民生 (5314-TW) 普通股 4,020 張，每股均價為 110.9 元，處分利益為 4.39 億元。",https://m.cnyes.com/news/id/6166822
434,6166712,美國H-1B簽證政策丕變 德國向印度人才招手,在美國總統川普對 H-1B 簽證祭出嚴格打擊，嚴重衝擊印度軟體產業之際，德國正積極向印度技術人才招手。德國駐印度大使公開強調其移民政策的穩定與可預測性，與美國的突變形成鮮明對比，試圖在全球人才競逐中搶占先機。,https://m.cnyes.com/news/id/6166712
435,6166835,鉅亨速報 - Factset 最新調查：美光科技MU-US的目標價調升至180元，幅度約5.88%,FactSet 最新調查：美光科技MU-US目標價調升，最高估值、最低估值、中位數、綜合評級、近5日股價、標普、即時新聞資訊,https://m.cnyes.com/news/id/6166835
436,6166831,鉅亨速報 - Factset 最新調查：美光科技(MU-US)EPS預估上修至15.03元，預估目標價為180.00元,FactSet 最新調查：美光科技(MU-US)EPS預估上修，預估EPS、預估營收、目標價、歷史獲利表現、即時新聞資訊,https://m.cnyes.com/news/id/6166831
437,6166820,15家大型美企來台採購！台美攜手鏈結AI、5G與智慧製造商機,​​​​​​​2025 年「全球商機鏈結總動員－美國場」昨（23）日於台北國際會議中心登場，由經濟部與外貿協會攜手美國在台協會（AIT）及美國州政府辦事處協會（ASOA）共同主辦，聚焦 5G、物聯網、AI、資通訊、汽車零配件,https://m.cnyes.com/news/id/6166820
438,6166742,「錯過這波AI革命很浪費」 凱基投信持三大理由看2026股市更健康,台股近期站上 2 萬 6 大關，頻頻刷新歷史高點，市場關注多頭行情是否能延續？凱基投信投資管理處處長歐陽渭棠直言，「以這波 AI 產業革命來說，如果錯過了會非常浪費」，多頭往往跟隨經濟成長上升，目前僅約 3 年，不算太長,https://m.cnyes.com/news/id/6166742
439,6166770,黃金一錢都1萬4了還沒到頂？銀樓業者：最快今年底就見到1萬5天花板價,"國際金價近期不斷刷新紀錄，每盎司已突破 3800 美元大關，國內銀樓飾金價格今 (24) 日創每錢 14,180 元的新高。台北市金銀珠寶公會副理事長、金加家珠寶董事長石文信卻看好黃金還有兩年的大多頭行情。他指出，今年以來國際漲幅超",https://m.cnyes.com/news/id/6166770
440,6166788,從H-1B之爭看AI競賽：美國是否自斷科技新創發展手腳？,《CNBC》周三 (24 日) 報導，川普政府日前宣布調整 H-1B 簽證規則，對申請人徵收高達 10 萬美元的費用，並考慮未來改採「薪資加權」抽籤方式。這項政策震撼矽谷，科技業者警告將重創新創公司並加速人才外流，削弱美國在全球人工智,https://m.cnyes.com/news/id/6166788
441,6166705,美股已107天未見2%以上跌幅 自滿情緒正醖釀潛在風險,儘管面臨貿易緊張、經濟增長放緩和估值過高等多重挑戰，美國股市投資者似乎毫不畏懼，完全不影響標普 500 指數的漲勢。,https://m.cnyes.com/news/id/6166705
442,6166769,AI投資+輝達神助攻！阿里巴巴港美股價同步飆近一成,阿里巴巴周三 (24 日) 宣布與輝達 (NVDA-US) 合作、擴展海外資料中心並推出新一代人工智慧 (AI) 產品，帶動港股大漲近 10%，創下近四年新高，美股存託憑證 (ADR) 盤前股價也同步上揚近 10%，顯示投資人對其加碼 AI 戰略,https://m.cnyes.com/news/id/6166769
443,6166745,揚博科技：代理業務採取聚焦與合作策略並鎖定半導體產業,PCB 及半導體設備耗材供應商的揚博科技 (2493-TW) 今 (24) 日召開法人說明會，揚博對整體發展方向，在自製設備方面，將以朝向厚大板、高階載板及未來玻璃載板製程設備開發，以滿足高階產品市場製程需求。,https://m.cnyes.com/news/id/6166745
