,newsId,title,summary,link
347,6123897,蘋果首款摺疊iPhone將配四鏡頭與Touch ID！Gurman：明年登場,蘋果首款摺疊 iPhone 傳出將配備四鏡頭、採用 Touch ID，並具備「無摺痕」內螢幕設計。預計明年推出，展開後擁有大型內螢幕，成為蘋果摺疊手機市場的重要布局。,https://m.cnyes.com/news/id/6123897
348,6123896,三星傳欲與英特爾合作！力拚川普政府貿易紅利,南韓三星（Samsung）傳出計畫與美國晶片巨頭英特爾（Intel）展開戰略合作。消息指出，此舉不僅涉及技術交流，也與川普政府的半導體政策及美國政府貿易戰略密切相關，可能成為雙方在全球半導體競爭中的重要轉折點。,https://m.cnyes.com/news/id/6123896
349,6123885,比亞迪海獅07EV殺瘋了 香港街頭被中國新能源車佔領,香港街頭，已經被中國國產新能源車佔領。,https://m.cnyes.com/news/id/6123885
350,6123888,烏克蘭無人機攻擊俄羅斯核電廠！反應爐降載、燃料碼頭爆炸起火,烏克蘭無人機 8 月 24 日對俄羅斯多地發動攻擊，導致庫斯克核電廠反應爐容量驟降 50%，並在烏斯季盧加燃料出口碼頭引發大火。俄羅斯國防部稱當日共攔截至少 95 架烏克蘭無人機，核電廠輻射數據維持正常。,https://m.cnyes.com/news/id/6123888
351,6123843,蘋果控告跳槽至OPPO前員工 稱63份機密文件被竊取,據《彭博》等外媒上周六（23 日）報導，蘋果向美國加州北區聯邦法院提起訴訟，指控前 Apple Watch 感測器系統華裔架構師 Chen Shi 在離職前系統性竊取一系列核心商業機密，並跳槽到中國智慧手機製造商 OPPO，將這些資,https://m.cnyes.com/news/id/6123843
352,6123894,〈台股盤前要聞〉多頭揮軍重攻2萬4、大罷免失敗落幕、美政府不會入股台積電,台股盤前要聞,https://m.cnyes.com/news/id/6123894
353,6123860,輝達財報成本週市場關鍵風險事件！AI熱潮能否延續？,美國聯準會暗示降息，投資者情緒改善，輝達（Nvidia）即將公布季度財報。分析師認為其業績將影響 AI 市場熱潮及整體股市走勢，並關注中國市場挑戰與估值風險。,https://m.cnyes.com/news/id/6123860
354,6123867,正式開源Grok-2.5！馬斯克：xAI將超越谷歌 中國公司將是最強大競爭對手,,https://m.cnyes.com/news/id/6123867
355,6123722,〈走進中國〉上半年超過50%汽車經銷商虧損 僅30%完成銷售目標,中國新車銷售持續承壓，汽車經銷商虧損面擴大。近日中國汽車流通協會發布的 2025 年上半年全國汽車經銷商生存狀況調查報告顯示，上半年汽車經銷商虧損比例上升至 52.6%，持平比例 17.5%，盈利比例 29.9%。,https://m.cnyes.com/news/id/6123722
356,6123802,加拿大承諾烏克蘭和平時支援！卡尼：加拿大將會在烏克蘭身旁,加拿大總理卡尼首次訪問烏克蘭基輔，與澤倫斯基會面，強調任何與俄羅斯的和平協議都須以烏克蘭防禦與安全保障為基礎，並承諾逾 20 億加元支援烏克蘭軍事防禦。,https://m.cnyes.com/news/id/6123802
357,6123659,本週操盤筆記：美國PCE、GDP、消費者信心指數與輝達財報,本週市場焦點集中於美國利率前景，特別是即將發布的通膨數據，將深刻影響聯準會的貨幣政策決策。與此同時，晶片巨頭輝達即將發布的財報也備受關注，分析師普遍看好其業績表現。,https://m.cnyes.com/news/id/6123659
358,6122721,核三重啟只差66萬票！台電表示尊重投票結果 子法通過2年內完成自我安檢,針對昨 (23) 日核三重啟公投結果，同意票差近 66 萬票未達 1/4 通過門檻，台電表示尊重，並依法啟動自我安檢，另亦將持續發展多元能源滿足全民用電需求。依台電董事長曾文生日前所說，內部評估自我安檢時間約需 1.5 到 2 年。,https://m.cnyes.com/news/id/6122721
359,6123769,摩根大通同意支付3.3億美元！和解馬來西亞1MDB金融詐欺案,摩根大通（JPMorgan）同意支付 3.3 億美元，與馬來西亞政府達成 1MDB 案件和解，結束長達四年的金融糾紛。此次和解涉及瑞士子公司交易及馬來西亞主權財富基金資金流向問題。,https://m.cnyes.com/news/id/6123769
360,6123768,中國A股科技股飆升！DeepSeek引領新一輪漲勢、慢牛已經上路？,中國 A 股市場週五迎來歷史性時刻，滬指重返 3800 點。以 DeepSeek V3.1 為核心的科技股暴漲，政策支持、資金流入與供應鏈重構共同推動中國科技產業向自主化與長期價值成長轉型。,https://m.cnyes.com/news/id/6123768
361,6121997,全球經濟難逃降溫？專家從貿易、通膨與Fed政策困境等六大問題剖析川普關稅戰,,https://m.cnyes.com/news/id/6121997
362,6123750,Spotify漲價計畫曝光！同步推出新功能吸引全球用戶,Spotify 宣布自九月起在部分市場調漲訂閱費，聯合總裁 Norstrom 表示，此次漲價將搭配新功能推出，助力 Spotify 吸引全球 10 億用戶並提升盈利能力。,https://m.cnyes.com/news/id/6123750
363,6123779,阿里巴巴收縮戰線！從六大集團縮編為四大業務,中國阿里巴巴集團業務結構再度出現變動，業務結構正式從「1+6+N」正式收縮為四大業務，全面聚焦「電商、雲 + AI」。,https://m.cnyes.com/news/id/6123779
364,6123687,美國關稅新政衝擊！印度、法國、義大利等多國郵政暫停寄送包裹至美國,美國總統川普宣布 8 月 29 日起取消 800 美元以下包裹免稅，多國郵政如印度、法國、義大利、西班牙、瑞典及挪威已陸續暫停寄送包裹至美國，僅信件及小額禮品仍可寄遞。全球郵政業者要求美方澄清細節，跨境電商恐受衝擊。,https://m.cnyes.com/news/id/6123687
365,6123765,"中國股市衝上3,800點 新開戶不如924火爆 散戶仍畏高",近日在多家券商營業部，這樣「牛市中虧錢、剛解套就清倉」的例子比比皆是。當下投資者最關心的是：牛市已經走到了哪個階段？,https://m.cnyes.com/news/id/6123765
366,6123749,南韓在核電領域節節勝利！成為全球原子能出口領頭羊、超越美法,南韓憑藉先進核電技術與多年施工經驗，成功拓展海外市場，成為全球原子能出口的重要國家。巴拉卡核電站及歐洲項目驗證其施工效率與可靠性。,https://m.cnyes.com/news/id/6123749
367,6123742,馬斯克「巨硬」計畫模擬微軟的軟體運作！馬斯克：是真的,特斯拉執行長馬斯克宣布，AI 新創公司 xAI 將推出純 AI 軟體公司「巨硬」，計畫模擬微軟的軟體運作，涵蓋程式設計、遊戲及人工智慧應用。,https://m.cnyes.com/news/id/6123742
368,6123741,巴隆：聯準會9月或將降息  但別誤以為寬鬆週期要來了,聯準會主席鮑爾在傑克森霍爾經濟研討會釋放降息訊號，引發市場對 9 月降息的高度關注，但鮑爾強調貨幣政策仍非預設路徑，就業與通膨數據將影響後續行動。,https://m.cnyes.com/news/id/6123741
369,6123716,OpenAI首席產品長揭秘GPT-5！普及化策略與通往AGI的願景,近日，OpenAI 首席產品長 Kevin Weil 罕見地分享了 GPT-5 問世的幕後，以及 OpenAI 對於通用人工智慧（AGI）發展與未來技術趨勢的前瞻性洞見。,https://m.cnyes.com/news/id/6123716
370,6123715,DeepSeek揭示中國下一代AI晶片！「這些」公司可能成為供應商,人工智慧公司 DeepSeek 暗示中國下一代 AI 晶片即將問世，其 V3.1 模型採用 UE8M0 FP8 格式，顯著提升國產晶片在 AI 訓練與推理效率，推動中國 AI 晶片技術突破。,https://m.cnyes.com/news/id/6123715
371,6123697,以色列獲川普「全力支持」！要求「速戰速決」加薩問題,以色列在美國總統川普「全力支持」下加快攻打加薩城，限時完成軍事行動。哈瑪斯警告，以軍行動恐危及人質生命，並呼籲簽署停火協議。以色列國內爆發大規模示威，要求盡快與哈瑪斯達成換人協議。,https://m.cnyes.com/news/id/6123697
372,6123688,WSJ：五角大廈推翻拜登政策 阻止烏克蘭使用遠程飛彈攻擊俄羅斯,美國官員透露，美國五角大廈數月以來一直暗中阻止烏克蘭使用美製遠程飛彈襲擊俄羅斯境內目標，限制基輔使用這種威力強大的武器。,https://m.cnyes.com/news/id/6123688
373,6123684,川普不滿再出手！美財政部副部長法爾肯德被迫離職,美國財政部副部長法爾肯德因與川普 2.0 任期政策願景不符而離職。川普對財政部內部管理與人事安排不滿，凸顯其經濟團隊重組與政策方向轉變。,https://m.cnyes.com/news/id/6123684
374,6123685,歐洲對烏克蘭立場分歧？義大利副總理叫馬克宏「自己帶槍去烏克蘭」,法國外交部召見義大利大使，抗議副總理薩爾維尼針對馬克宏支持烏克蘭的言論。隨著俄羅斯與烏克蘭戰局持續，法國、義大利與歐洲盟友在安全保障與派兵問題上出現分歧。,https://m.cnyes.com/news/id/6123685
375,6123686,川普推動家具關稅調查！美國零售商股價重挫,川普宣布展開家具關稅調查，未來可能對進口家具加徵關稅，引發市場震盪。Wayfair、RH、威廉所諾馬等零售商股價大跌，唯獨 La-Z-Boy 股價逆勢上漲，本土製造商或將受益。,https://m.cnyes.com/news/id/6123686
376,6123683,印度、法國、義大利、瑞典等國宣布 暫停向美國寄送包裹,印度、法國、義大利、瑞典、挪威、比利時、西班牙等國宣布，暫停向美國寄送包裹。美國總統川普在 7 月 30 日簽署行政令，8 月 29 日起暫停對價值 800 美元及以下的進口包裹給予免稅待遇。,https://m.cnyes.com/news/id/6123683
377,6123561,傑克森霍爾聯準會全球央行年會要點：九月降息訊號、貨幣政策新框架,聯準會年度傑克森霍爾央行年會落幕，鮑爾暗示九月可能降息，並公布貨幣政策策略調整。白宮施壓與全球央行領袖觀點成焦點。,https://m.cnyes.com/news/id/6123561
378,6123560,南韓總統李在明首訪日本會晤石破茂！同意在挑戰加劇之際加強關係,南韓總統李在明首次訪問日本，與日本首相石破茂舉行雙邊會談，承諾加強日韓合作，推動北韓無核化與人工智慧議題，並促進與美國的三方合作。,https://m.cnyes.com/news/id/6123560
379,6123556,澤倫斯基：烏克蘭安全保障方案「即將」準備就緒,烏克蘭總統澤倫斯基表示，針對戰後烏克蘭的安全保障方案將在未來幾天完成，北約與盟友協助強化烏克蘭防衛，並施壓俄羅斯追求和平。,https://m.cnyes.com/news/id/6123556
380,6123660,大罷免32：0完封！國台辦回應來了,兩波大罷免結果出爐，31 名國民黨立委、新竹市長高虹安全部反罷免成功，以 32 比 0 收場，大陸國台辦周日（24 日）對此表示，任何「台獨」分裂和政治操弄都不得人心，必然失敗。,https://m.cnyes.com/news/id/6123660
381,6123537,空頭大逃亡！避險基金上周淨流入中國股票規模創7周新高 九成資金押多,,https://m.cnyes.com/news/id/6123537
382,6123143,史上罕見！川普如何把美股變成自己的政績舞台,,https://m.cnyes.com/news/id/6123143
383,6123532,〈台股風向球〉二個不安因素緩和 2萬4關卡吹響反攻號角,〈台股風向球〉二個不安因素緩和 2 萬 4 關卡吹響反攻號角,https://m.cnyes.com/news/id/6123532
384,6123076,〈觀察〉「卡王」重磅回歸！中信統一生態圈全面串接 掀零售金融新賽局,「卡王」中信銀行重磅回歸！與統一企業集團斡旋籌備長達 3 年的「uniopen 聯名卡」終於問世，下半年可望奪回發卡王寶座，首年百萬卡應不是問題，甚至可達 150 萬卡，不過，兩家龍頭並非單純追逐發卡目標，,https://m.cnyes.com/news/id/6123076
385,6123614,把握50年以來最弱美元！法人看好2大利多助攻 新興市場債今年漲幅逾7%,2025 年八月以來，新興市場債券持續吸引資金湧入，績效亮眼，年初至今平均漲幅達 6~7%，明顯優於其他全球各主要債券市場。美元在 2025 年以來創下 50 年以來最弱表現，帶動新興市場本地貨幣債表現優於其他固定收益資產，法人表示,https://m.cnyes.com/news/id/6123614
386,6123555,傑克森霍爾報告：美國債務或能達GDP 250%仍不推高利率！,最新研究指出，美國政府債務可能在不推高利率的情況下達到 GDP 的 250%，學者警告延遲財政調整可能增加債務風險。,https://m.cnyes.com/news/id/6123555
387,6123394,聯名卡、權益自選、訂閱制… 一文看懂五大發卡行創新戰略,台灣信用卡市場下半年進入新一輪競爭態勢，中國信託銀行以聯名卡為長期核心戰略，結盟統一集團力求打造高黏著度金融生態圈；國泰世華 CUBE 卡則以「數位自選」和「小樹點」生態圈搶攻數位回饋潮流,https://m.cnyes.com/news/id/6123394
388,6123387,熱度高 高技擬發行無擔保CB市場籌資20億元 25日起競拍,AI 伺服器的高度需求，各廠也加速擴張與市場籌資腳步，繼金像電 發行可轉換公司籌資高達 43 億元後，高技擬以發行無擔保可轉換公司債進行市場籌資 20 億元，在獲金管會申報生效後，明 (25) 日展開 17000 張的競拍投標。,https://m.cnyes.com/news/id/6123387
389,6123519,聯準會鮑爾暗示9月降息！但投資者仍對通膨與經濟停滯保持謹慎,美國聯準會主席鮑爾在傑克森霍爾全球央行年會上發表演說，暗示 9 月可能降息，為市場投資高風險資產開啟綠燈。雖然投資人對聯準會的鴿派訊號普遍樂觀，但仍對未來可能出現的停滯性通貨膨脹保持謹慎。,https://m.cnyes.com/news/id/6123519
390,6123340,〈熱門股〉印度政策帶動需求反轉向上 華夏周漲近10%攻上所有短均線,華夏 (1305-TW) 受惠於印度自 8 月 14 日起發布 PVC 反傾銷稅 (ADD) 終裁政策落實，營運展望轉趨樂觀，本周五開高走高，周漲 9.52%，連收 2 日紅 K，股價收 12.65 元，成交量增至萬張，股價站上短期均線，創下波段新高。,https://m.cnyes.com/news/id/6123340
391,6123284,〈熱門股〉佳世達獲外資連5買 挾無人機題材飆漲停創5個月高點,佳世達 (2352-TW) 近期獲外資連 5 買，加上機器人、無人機題材加持下，周五股價帶量突破整理區間，奔上漲停 30.35 元，相隔 5 個月股價再度重返 3 字頭，周漲 14.7%。,https://m.cnyes.com/news/id/6123284
392,6122397,iPhone 17 全面升級帶動供應鏈拉貨潮 : 台積電、大立光、晶技,,https://m.cnyes.com/news/id/6122397
393,5943662,拉貨潮引發消費性電子旺季不旺隱憂 板卡三雄下半年憑電競需求逆勢撐盤,由於關稅效應，導致大多數客戶提前拉貨，法人指出消費性電子第三季傳統旺季效應減弱，不過電競產品需求仍然強勁，輝達 RTX 50 系列 GPU 供貨放量，加上高階電競產品價格上漲一至兩成，法人看好電競趨勢將帶動華碩 (2357-TW),https://m.cnyes.com/news/id/5943662
394,6123487,川普對普丁耐心減弱？芬蘭總統：普丁與澤倫斯基會晤一週半內恐難以成行,芬蘭總統斯圖布表示，美國總統川普對俄羅斯在烏克蘭和平進程上的拖延已逐漸失去耐心，普丁與澤倫斯基會晤恐延後，歐洲領袖正努力促使美國提供烏克蘭安全保障。,https://m.cnyes.com/news/id/6123487
395,6123444,以太坊跑贏比特幣！摩根大通解析四大動能,摩根大通最新報告指出，以太坊（ETH）受益於 ETF 機制優化、企業持倉增加、監管態度轉暖與質押潛力，表現持續優於比特幣（BTC），有望重塑加密市場格局。,https://m.cnyes.com/news/id/6123444
396,6123476,聯準會鮑爾暗示降息在即！以太坊突破歷史新高,以太坊週六突破 4887 美元，24 小時漲幅 14%，市值超 5860 億美元。ETF 資金流入、PoS 質押機制、企業採用與 DeFi 生態齊推升以太坊潛力，顯示其逐步超越比特幣，成為數位經濟基礎設施。,https://m.cnyes.com/news/id/6123476
397,6122432,智慧眼鏡進入爆發前夜，Meta與Google卡位戰升溫，台廠供應鏈迎接下一波成長動能：玉晶光、亞光、鴻海、宏達電、聯發科,,https://m.cnyes.com/news/id/6122432
398,6123513,台美關稅談判籌碼曝光？賴清德：與事實有落差、談判結果一定送立院審議,"我國與美國在對等關稅內容曝光，指稱台灣為爭取關稅優惠，提出市場開放、投資及採購等多項承諾在 4 年內赴美投資 2,500 億美元，總統賴清德今 (23) 日晚間於表示，目前正值台美關稅談判期間，未經證實的報導應避免。",https://m.cnyes.com/news/id/6123513
399,6123488,大罷免大失敗 賴清德：卓揆留任、內閣將改組 核三需科學驗證解決,823 罷免立委投票結果於傍晚出爐，2 波大罷免立委投票以 32:0 慘遭完封，由於經濟部長等多位閣員於昨 (22) 日已先行宣布請辭，總統賴清哲今晚舉行記者時會時表示，將調整施政順序，也以經濟、民生、弱勢、青年四大優先。,https://m.cnyes.com/news/id/6123488
400,6123464,寒武紀股價再創新高！市值突破5000億、超越中芯國際僅次貴州茅台,週五，寒武紀股價強勢上漲，市值突破 5000 億元，成為中國半導體龍頭。隨著國產 AI 晶片需求增長及業績顯著復甦，寒武紀有望持續受益於本土創新及產業升級。,https://m.cnyes.com/news/id/6123464
401,6123459,川普撐腰英特爾沒用？分析師：14A製造工藝外部客戶才是關鍵,美國總統川普宣布，美國政府將注資近 89 億美元入股英特爾，成為最大股東，以支持其晶片代工業務。然而分析師警告，若缺乏外部客戶與良率突破，英特爾即使獲得政府資金，也難以重拾晶片製造領先地位。,https://m.cnyes.com/news/id/6123459
402,6123446,特斯拉股價勁揚6.22%、市值飆升644億美元！中國銷量承壓加速推平價電動車,特斯拉股價勁揚 6.22%，市值一夜暴增 644 億美元。面對銷量下滑與財報壓力，特斯拉加快布局中國市場，攜手火山引擎升級智慧座艙，並宣布上調 Cybertruck 售價與推出平價電動車，尋求突破電動車競爭困境。,https://m.cnyes.com/news/id/6123446
403,6123445,北溪管道爆炸：俄羅斯要求聯合國安理會召開緊急會議、烏克蘭嫌疑人義大利被捕,俄羅斯要求聯合國安理會於 8 月 26 日就北溪天然氣管道爆炸事件召開緊急會議，批評德國調查拖延並不透明。此前，一名涉嫌參與爆炸的烏克蘭男子在義大利被捕，正等待引渡。,https://m.cnyes.com/news/id/6123445
404,6123435,印度外長：印美貿易談判仍在進行 但「這些」紅線仍必須堅守,印度外交部長表示，印度與美國的貿易談判仍在進行，但新德里將堅守紅線。因印度增加購買俄羅斯石油，美國即將對印度商品加徵高達 50% 的關稅，可能影響印度經濟成長與全球製造業吸引力。,https://m.cnyes.com/news/id/6123435
405,6123380,特斯拉進軍現實世界資產代幣化！RWA上鍊72小時融資50億,2025 年 7 月，特斯拉完成 50 億美元鏈上融資，開啟現實世界資產（RWA）代幣化新時代。透過區塊鏈與智慧合約，資產管理與資本運作效率大幅提升，多行業加速 RWA 上鏈應用。,https://m.cnyes.com/news/id/6123380
406,6123378,聯準會宣布放棄高通脹框架回歸2%目標！WSJ：聯準會仍未承認錯誤,聯準會主席鮑爾週五宣布，聯準會將放棄 2020 年高通脹容忍政策框架，回歸傳統 2% 通脹目標，短期推動股市上漲，貨幣政策調整引發市場關注。,https://m.cnyes.com/news/id/6123378
407,6123373,中國股市創十年新高！分析師：漲勢有望持續,在中國人工智慧與半導體熱潮、政府產能調整及中美貿易休戰的推動下，中國股市近期持續上漲，吸引投資者關注科技股和 ETF 的投資機會。,https://m.cnyes.com/news/id/6123373
408,6123379,OpenAI奧特曼交出ChatGPT指揮棒！「這位」女執行長將接掌大權,OpenAI 進行重大權力調整，執行長奧特曼將專注超級計算與尖端研究，Fidji Simo 接手 ChatGPT 與消費科技業務日常運營，推動公司商業化與未來創新布局。,https://m.cnyes.com/news/id/6123379
409,6122517,輝達財報倒數！下一檔有望爆發的AI飆股會是誰?,,https://m.cnyes.com/news/id/6122517
410,6123374,中國擬出手管控網路平台價格！定價透明化或衝擊商業模式,中國國家發展和改革委員會（NDRC）擬推出網路平台新規範，強化價格透明度與監管，確保平台自主定價與消費者權益平衡。,https://m.cnyes.com/news/id/6123374
411,6123416,澤倫斯基：願在特定條件下討論領土 但不會將土地拱手讓人,烏克蘭總統澤倫斯基周六（23 日）表示，不會將領土拱手讓給俄羅斯，並稱西方國家只有與烏克蘭攜手合作，才能保障民主國家的安全。,https://m.cnyes.com/news/id/6123416
412,6123348,中國晶片政策：華為加速晶片自主化！「去美化」政策衝擊美國與輝達,中國持續推行「去美化」政策與大規模投資，扶植本土晶片產業。華為等企業快速研發先進 AI 晶片，逐步降低對美國與輝達依賴，全球晶片競爭格局生變。,https://m.cnyes.com/news/id/6123348
413,6123361,志在必得 國巨48小時內又加碼 四度調高對芝浦每股收購價至7130日元,不到 48 小時又加碼 國巨對芝浦電子收購價四度上調達每股 7130 日圓,https://m.cnyes.com/news/id/6123361
414,6123362,南韓李在明抵達日本！訪美前先訪日展現日韓友好,南韓總統李在明首次正式訪問日本，與首相石破茂會談加強南韓 - 日本在安全領域的合作，並為下週與美國總統川普峰會討論中國、北韓與駐韓美軍議題鋪路。,https://m.cnyes.com/news/id/6123362
415,6123353,李在明與川普峰會前瞻：南韓軍費、中國議題、北韓核武成焦點,南韓總統李在明將與美國總統川普舉行首次峰會，討論駐韓美軍軍費分擔、中國區域影響、北韓核武威脅以及印太安全合作。本文分析峰會對南韓安全政策與國防開支的影響。,https://m.cnyes.com/news/id/6123353
416,6123345,OpenAI奧特曼看好AI工作未來！現在是展開職涯「最令人興奮的時刻」,OpenAI 執行長奧特曼指出，人工智慧（AI）將創造全新產業與職位，帶給年輕人前所未有的職涯機會。然而，專家警告 AI 也可能導致裁員與就業壓力加劇。本文分析 AI 如何同時改變工作未來與職涯發展。,https://m.cnyes.com/news/id/6123345
417,6123341,Meta與Midjourney合作！強化AI模型與圖像生成技術,Meta 與 Midjourney 簽署合作協議，授權使用其 AI 美學技術，應用於未來 AI 模型與圖像生成產品。此舉助 Meta 提升影像品質，降低內容製作成本，並在 AI 競爭中對抗 OpenAI 與 Google。,https://m.cnyes.com/news/id/6123341
418,6123354,俄羅斯外長：目前沒有普丁、澤倫斯基會面計畫,據美國《NBC News》周五（22 日）報導，俄羅斯外交部長拉夫羅夫表示，目前沒有安排俄羅斯總統普丁和烏克蘭總統澤倫斯基會晤的計畫，這讓人不得不懷疑美國總統川普通過峰會結束烏克蘭戰爭的設想是否能夠落實。,https://m.cnyes.com/news/id/6123354
419,6123349,債務仍是困擾！惠譽維持美國「AA+」信用評級,國際信評機構惠譽周五（22 日）將美國的信用評級維持在「AA+」的水準，強調對債務不斷上升的擔憂。,https://m.cnyes.com/news/id/6123349
420,6123333,特斯拉不用自家Grok！轉攜手中國Deepseek與豆包AI,特斯拉宣布在中國電動車中引入 Deepseek 與字節跳動豆包 AI，強化語音助理功能，提供導航、娛樂與智慧互動服務。此舉凸顯特斯拉面臨本地競爭與法規壓力，加速 AI 在地化。,https://m.cnyes.com/news/id/6123333
421,6121298,各大投行建議做多白銀 36美元以下可加碼,隨著地緣政治動盪與抗通膨與避險需求，各大投行建議做多白銀，其中瑞銀集團 (UBS) 發布最新報告指出，建議投資人繼續持有白銀多單，並在價格回調至每盎司 36 美元以下時逢低加碼。,https://m.cnyes.com/news/id/6121298
422,6123298,與鮑爾不同調 Fed穆薩林：還需更多數據判斷9月是否降息,聖路易聯準銀行總裁穆薩林 (Alberto Musalem) 周五 (22 日) 表示，鑒於通膨仍高於聯準會 2% 的目標，且預期可能進一步上升，而勞動市場的風險尚未真正浮現，他需要更多數據才能決定是否在 9 月會議上支持降息。,https://m.cnyes.com/news/id/6123298
423,6123273,人形機器人邁入大規模商用階段？輝達重磅消息：機器人新大腦來了！,輝達 (NVDA-US) 發布重磅消息，執行長黃仁勳將在 8 月 25 日推出被稱為「機器人新大腦」的新產品，全球市場對此充滿期待，認為這將催化人形機器人產業進入大規模商用階段。,https://m.cnyes.com/news/id/6123273
