,newsId,title,summary,link
665,6273452,英特爾測試中資背景工具商設備 遭質疑技術外洩及破壞潛在風險,據《路透》報導，晶片製造商英特爾 (INTC-US) 今年測試了來自一家與中國有深厚淵源、且擁有受美國制裁單位的工具製造商的設備。根據兩位知情人士的說法，這家設備生產商是位於加州弗里蒙特的 ACM Research(盛美半導,https://m.cnyes.com/news/id/6273452
666,6271930,外資回頭買超166億元 偏愛兩檔記憶體股與金融族群,台股大盤今日漲 173.27 點，以 28198.02 點作收，未能站穩 5 日線，成交量 4748.06 億元。外資今天回頭買超 166.23 億元，其中，大舉敲進華邦電 9.1 萬張、力積電 6.8 萬張，同時也敲進多檔金融股。 ,https://m.cnyes.com/news/id/6271930
667,6273480,前十大晶圓代工Q3產值季增8.1% 台積電穩居龍頭市占微升至71%,研調機購 TrendForce 最新調查，2025 年第三季全球晶圓代工產業持續受 AI 高效能運算 (HPC)，和消費性電子新品主晶片與周邊 IC 需求帶動，以 7nm(含) 以下先進製程生產的高價晶圓貢獻營收最為顯著，加上中系廠得益於供,https://m.cnyes.com/news/id/6273480
668,6273450,Fed寬鬆周期支撐債市行情 國泰00933B規模躋身千億俱樂部,本周全球市場聚焦聯準會 FOMC 會議，拍板再降息 1 碼，下調聯邦基準利率至 3.5~3.75% 區間，符合市場預期，累計今年已降息 3 碼。國泰投信表示，在債市佈局上，投資人應以追逐債息收益為主要訴求，,https://m.cnyes.com/news/id/6273450
669,6273447,系統電估明年營運可望年增3成 BBU首季出貨CSP客戶,系統電估明年營運可望年增 3 成 BBU 首季出貨 CSP 客戶,https://m.cnyes.com/news/id/6273447
670,6273449,穩定幣正式入法！將成美元新武器？,,https://m.cnyes.com/news/id/6273449
671,6273445,華城四大動能支撐2026成長 看好明年AIDC營收占比超過10%,華城總經理許逸德指出，2026 年成長動能將來自台電強韌電網計畫、各國電力公司電網強韌計劃、綠能以及 AIDC。其中，AIDC 動能最為強勁，接單逾 120 億元，看好明年 AIDC 相關營收比重達 10% 以上。,https://m.cnyes.com/news/id/6273445
672,6273441,想反敗為勝來找大師兄、華邦電⊕、新盛力、洋基工⊕、智邦、台虹⊕、眾達-ky,,https://m.cnyes.com/news/id/6273441
673,6273415,〈航運指數〉SCFI強彈 四大長程線運價漲 但貨攬業中性看待,SCFI 強彈 四大長程線運價漲 但貨攬業中性看待,https://m.cnyes.com/news/id/6273415
674,6273159,「大賣空」原型再批AI泡沫 並警告何時破裂無法預測,如果你還在等 Michael Burry 告訴你人工智慧泡沫何時破裂，那就別抱太大希望了。,https://m.cnyes.com/news/id/6273159
675,6273414,聚隆旗下聚茂生技攻寵物保健市場推新品 持續擴大通路布局,聚隆旗下聚茂生技攻寵物保健市場推新品 持續擴大通路布局,https://m.cnyes.com/news/id/6273414
676,6273351,國網雲端算力中心啟用 賴清德：台灣將從硬體製造大國邁向人工智慧島,總統賴清德今 (12) 日在台南出席「國網雲端算力中心」啟用典禮，賴清德指出，中心的啟用，象徵台灣將從硬體製造大國邁向人工智慧島。,https://m.cnyes.com/news/id/6273351
677,6273349,【量大強漲股整理】迎接12月集團作帳行情啟動，華新、台塑、國巨哪一個最強?漲價概念股該如何掌握?,,https://m.cnyes.com/news/id/6273349
678,6273307,廣運旗下金運科技啟動IPO  擬明年Q2公發並登錄興櫃交易,廣運 (6125-TW) 今 (12) 日攜手在台、日本企業合作夥伴進行 AIDC 新產品發表會。廣運董事長謝明凱指出，金運科技啟動將進軍資本市場，將於明年第二季辦理股票公開發行並登錄興櫃交易。,https://m.cnyes.com/news/id/6273307
679,6273348,量縮震盪不是警訊，台股作夢行情正在輪動中：華城、昇陽半導體、雙鴻,,https://m.cnyes.com/news/id/6273348
680,6273208,電子業產損150億美元有解了！路透：印度放寬陸商務人士簽證限制 改善對中關係重要一步,,https://m.cnyes.com/news/id/6273208
681,6273079,CNN：川普關稅大刀下 中國靠市場戰略轉向 出口不減反增,據《CNN》報導，儘管美國總統川普曾誓言，因美國貿易逆差擴大，而對中國進口商品課徵懲罰性關稅，但在 1 年後，中國經濟展現出驚人的韌性。透過戰略轉向，中國的出口量不減反增。全球第二大經濟體在今年前 11 個月內，創下了高達 1 兆美,https://m.cnyes.com/news/id/6273079
682,6273301,〈台幣〉美維持寬鬆方向 收升6.6分至31.202元,〈台幣〉美維持寬鬆方向 收升 6.6 分至 31.202 元,https://m.cnyes.com/news/id/6273301
683,6273106,〈港股盤後〉大金融、科技股全面走強 推升恒指強漲1.75%,香港股市周五 (12 日) 主要指數高開高走。截至收盤，恒生指數收漲 1.75%，報 25976.79 點。恒生科技指數收漲 1.87%，報 5638.05 點；國企指數上漲 1.62%。當日大市成交額達 2426.57 億港元。,https://m.cnyes.com/news/id/6273106
684,6273160,〈陸股盤後〉中央經濟工作會議誓言撐經濟 三大指數全面反彈 滬指終止三連黑,,https://m.cnyes.com/news/id/6273160
685,6273211,鴻海楊秋瑾：高雄亞灣旗艦總部是未來十年新起點 聚焦AI科研、三大智慧平台,鴻海楊秋瑾：高雄亞灣旗艦總部是未來十年新起點 聚焦 AI 科研、三大智慧平台,https://m.cnyes.com/news/id/6273211
686,6273134,不再「大到不能倒」？彭博：中國監管機構拒絕直接救助萬科,曾被視為中國房地產行業中「模範公司」及長期倖存者的萬科企業 (02202-HK)，現正面臨嚴峻的債務危機。據《彭博》引述消息指出，大陸監管機構可能不願出手救助這家開發商，並且已開始制定計畫，以控制事態的發展。,https://m.cnyes.com/news/id/6273134
687,6273210,SpaceX明年IPO、Fed三度降息助攻 00910單日漲逾5%重演狂飆行情,近期太空衛星產業最值得矚目的二大消息，一是巨富馬斯克可望在明年中推動 SpaceX 進行 IPO，資金募集與投資火力備受期待，同時也帶動多檔太空衛星股同步飆漲；二是對全體金融市場挹注資金的政策,https://m.cnyes.com/news/id/6273210
688,6273177,全球電動車賣不動？歐美冷熱兩樣情 比亞迪出口創新高,,https://m.cnyes.com/news/id/6273177
689,6273212,華邦電、今國光、華泰，這些股票為何大漲？,,https://m.cnyes.com/news/id/6273212
690,6253954,華興深耕低溫照明擴大歐洲佈局 導入AIoT智慧節能看好2026營運成長,LED 封裝與照明模組廠華興電子 (6164-TW) 今 (12) 日召開法人說明會，針對 2026 年營運展望，華興董事長劉守雄表示，公司將持續聚焦利基型市場，除了鞏固美洲低溫照明市佔率外，更積極將業務版圖拓展至歐洲市場，並結合 AI,https://m.cnyes.com/news/id/6253954
691,6255863,燦坤攜手蔡司、小林眼鏡搶攻AI眼鏡千億商機 看待明年消費景氣「審慎保守」,燦坤 (2430-TW) 今 (12) 日宣佈與德國光學大廠蔡司（ZEISS）、小林眼鏡達成三方跨界結盟，正式啟動「EyeCare 護眼生態圈」戰略佈局 。首家「小林眼鏡燦坤內湖旗艦分公司」同步開幕，燦坤董事長林技典指出，這是全球,https://m.cnyes.com/news/id/6255863
692,6273105,谷歌突襲OpenAI GPT-5.2發表會！Gemini Deep Research重裝上陣 搶佔Agent入口,,https://m.cnyes.com/news/id/6273105
693,6273035,Reddit提出法律挑戰 質疑澳洲16歲以下社媒禁令,社群媒體平台 Reddit 近日向澳洲高等法院提出法律挑戰，質疑澳洲針對 16 歲以下青少年實施的社群媒體禁令的適用性與法律效力。這項禁令被譽為澳洲「全球領先」的法律，目標涵蓋了包括 Reddit 在內的 10 個主要平,https://m.cnyes.com/news/id/6273035
694,6273204,位階低+政策支持雙優勢，軍工與機器人族群值得關注,,https://m.cnyes.com/news/id/6273204
695,6273136,台灣人24%持有數位資產！富達：上鏈是趨勢 「代幣化基金」成新賽道,富達國際今（12）日發布 2026 年數位資產投資展望，指出數位資產在 2025 年迎來關鍵轉折點。隨著監管框架更清晰、投資管道改善，以及市場對比特幣在多元投資組合中獨特角色的認知提升，機構法人參與度已明顯提高。調查發現在台灣有,https://m.cnyes.com/news/id/6273136
696,6273176,台化配合中捷綠線延伸彰化段 擬處分資產招商科技業活化中山路南側廠區,台化 (1326-TW) 公司今 (12) 日宣布，配合台中捷運綠線延伸至彰化段，經董事會決議，將採公開招標或其他招商方式，處分台化所屬彰化市牛稠子段中庄子小段及山腳小段之土地，盼引進符合現化代之大型高科技產業，帶動地方繁榮。,https://m.cnyes.com/news/id/6273176
697,6272340,牛市再起？華爾街神準策略師：Fed助標普2026年衝7700點 加密貨幣迎歷史反彈,,https://m.cnyes.com/news/id/6272340
698,6273011,Netflix市值蒸發400億美元嚇不到散戶！反而逢跌大買,儘管市場對 Netflix(NFLX-US) 擬議收購華納兄弟探索 (WBD-US) 抱持疑慮，導致公司市值在短短 6 個交易日內蒸發了 400 億美元，但對於散戶投資者而言，這反而是強烈的「買入信號」。,https://m.cnyes.com/news/id/6273011
699,6273148,外資翻多回補166億 三大法人聯手買超255.22億元,,https://m.cnyes.com/news/id/6273148
700,6272829,台亞攜手伊藤忠簽署MOU 強化GaN、SiC半導體及血糖監測技術深化合作,台亞半導體 (2340-TW) 今 (12) 日與台灣伊藤忠（ITOCHU Taiwan）就「半導體供應鏈與資源共享合作」簽署合作意向書，未來雙方將聯手於「化合物半導體 SiC/GaN」與「非侵入式血糖監測技術」兩大領域展開深度合,https://m.cnyes.com/news/id/6272829
701,6273104,FED重啟購債QE，是送聖誕禮物還是緊急救援!?,,https://m.cnyes.com/news/id/6273104
702,6273005,川普關稅收入首見下滑 生活成本壓力促使食品關稅取消 11月稅收驟減,自美國總統川普於 4 月全面性的全球關稅計畫以來，美國的關稅收入就逐月增加，然而，最新出爐的 11 月份的關稅，卻首次出現了月率減少。,https://m.cnyes.com/news/id/6273005
703,6272742,五個交易日暴漲723%！摩爾線程緊急提示交易風險 誰在幕後推高？,,https://m.cnyes.com/news/id/6272742
704,6272872,出手救日元！市場一致押注日銀下周升息 利率終點指向1.25%,,https://m.cnyes.com/news/id/6272872
705,6272002,〈台股盤後〉SpaceX明年上市點火太空題材 漲173點收28198點,台股今日電子權值股漲跌互現，但台積電僅小有表態，大盤終場漲 173.27 點或 0.62%，以 28198.02 點作收，未能站穩 5 日線，成交量 4748.06 億元。今天盤面亮點，則轉為聚焦太空、線纜及重電族群。 ,https://m.cnyes.com/news/id/6272002
706,6272384,暫解Fed獨立性疑慮！11名聯準銀行全數獲連任,,https://m.cnyes.com/news/id/6272384
707,6272987,屋頂光電政策不限縮了！逾千坪新建物裝設強制裝設「1kW/20㎡」,針對近期市場關注新建物屋頂設置太陽光電標準擬限縮的傳言，經濟部能源署今（12）日發布重大澄清 ，確認與內政部已達成共識，新建物屋頂光電設置標準將不限縮：凡建築物之新建、增建或改建達建築面積 1000 平方公尺以上、應每,https://m.cnyes.com/news/id/6272987
708,6272982,ING樂觀預期黃金2026年續創新高 均達可達4325美元,荷蘭國際集團（ING）大宗商品策略師 Ewa Manthey 表示，儘管黃金價格已突破每盎司 4200 美元，且黃金 ETF 持有量接近歷史最高，但在總經利多因素和強勁基本面的支撐下，金價在 2026 年仍有進一步上漲的空間。,https://m.cnyes.com/news/id/6272982
709,6273006,鴻海高捷Y15聯開案正式簽約 斥159億元建旗艦總部2033年完工,鴻海高捷 Y15 聯開案簽約 斥 159 億元打造旗艦總部 2033 年完工,https://m.cnyes.com/news/id/6273006
710,6272981,〈焦點股〉光通訊股搭上AI太空資料中心題材 統新、東典光電聯袂漲停,「AI 新十大建設推動方案」規劃跨部會協調，執行三大發展主軸，關鍵技術涵蓋矽光子 (CPO) 光通訊，近期因 SpaceX 成功發射搭載輝達 H100 衛星上太空，激勵光通訊及薄膜濾光片供應鏈統新、東典光電攻上漲停板。,https://m.cnyes.com/news/id/6272981
711,6272402,法國工業明珠崩了！百年家電大廠白朗破產清算 700人飯碗不保,,https://m.cnyes.com/news/id/6272402
712,6272974,馬來西亞令吉兌美元升至4年多新高 今年已漲逾9%,馬來西亞令吉兌美元匯率創下 4 年多來最高，反映出市場對這個東南亞國家經濟的樂觀情緒，以及貿易緊張局勢的緩解。,https://m.cnyes.com/news/id/6272974
713,6272735,百億美元大單浮出水面！博通證實Anthropic本季擴大採購規模,,https://m.cnyes.com/news/id/6272735
714,6272741,比特幣週期定律失效中！木頭姐：機構資金入場 改寫波動與回徹的遊戲規則,,https://m.cnyes.com/news/id/6272741
715,6272385,降價衝量招式失靈 特斯拉11月美國銷量年減逾兩成、探四年低點 ,,https://m.cnyes.com/news/id/6272385
716,6272904,楊秋瑾：鴻海有多元保稅機制 墨西哥新關稅政策影響小,楊秋瑾：墨西哥新關稅政策對鴻海影響小 擁多元保稅機制,https://m.cnyes.com/news/id/6272904
717,6271805,〈焦點股〉Fed降息上修美國經濟成長預測 銅價攀升 線纜族群齊走揚,美國聯準會宣布降息 1 碼，並同步上修美國經濟成長預測，銅價隨之攀升，激勵線纜族群今 (12) 日紛紛走揚，包括華新 (1605-TW)、華榮 (1608-TW)、大亞 (1609-TW) 及億泰 (1616-TW) 皆紅通通。,https://m.cnyes.com/news/id/6271805
718,6272890,賴正鎰：北環科技廊帶啟動+都更黃金交叉成形 北投正複製「南港經驗」,台北發展的十年軸線正在北移。商總榮譽理事長、鄉林 (5531-TW) 集團董事長賴正鎰觀察，北投正複製十年前南港從「傳統住宅區」躍升為「科技與居住新都心」的軌跡。隨著北士科啟動、北環輕軌推進、都市重劃與都更量能同步放大。,https://m.cnyes.com/news/id/6272890
719,6272476,AI界最強鯰魚！DeepSeek兩年衝出兆元身價 市場為何又開始懷疑？ ,,https://m.cnyes.com/news/id/6272476
720,6272462,歐洲盟友被徹底拋棄！牛彈琴：美國打算組建C5 全世界大吃一驚,,https://m.cnyes.com/news/id/6272462
721,6272666,一文讀懂GPT-5.2 : 直指「經濟價值」沒有硬剛Gemini3劇碼,OpenAI 於 12 月 12 日發布了其最新的 GPT-5.2 模型，強調其在提升專業工作效率和經濟價值方面的卓越表現。根據官方數據，該模型在 74.1% 的業務任務中超越或持平於人類專家，展現出強大的商業潛力。,https://m.cnyes.com/news/id/6272666
722,6272866,〈焦點股〉Fed降息提振！00955漲逾2%創掛牌新高 登日股ETF規模冠軍,美國聯準會 (Fed) 如預期降息，政策基調轉向寬鬆，顯著提振投資人風險偏好。受此激勵，今 (12) 日亞洲股市普遍走揚，日經指數盤中氣勢如虹，一度突破 51000 點大關。,https://m.cnyes.com/news/id/6272866
723,6272871,〈房產〉央行第七波選擇性信用管制滿周年 房仲調查：近 7成民眾贊成政策續行,央行第七波選擇性信用管制已上路一周年，永慶房屋今 (12) 日發表最新網路會員調查報告。據調查結果顯示，有超過 5 成的消費者都認為第七波選擇性信用管制有助於「抑制房價上漲」和「打擊投機炒作」，更有近 7 成消費者支持該政策延續。,https://m.cnyes.com/news/id/6272871
724,6272334,Deepwater：AI多頭行情2026續航 小型科技股將跑贏大盤,Deepwater Asset Management 周四 (11 日) 發布 2026 年市場預測，預估在人工智慧 (AI) 投資持續強勁帶動下，那斯達克指數將上漲約 10%。,https://m.cnyes.com/news/id/6272334
725,6272864,momo會員制大升級 會員生態圈將採分級營運,momo 會員制大升級 會員生態圈將採分級營運,https://m.cnyes.com/news/id/6272864
726,6272830,台股近一月坐雲霄飛車 00981A奪量價雙冠王、高息ETF報酬失色,台股昨 (11) 日大跌後，今 (12) 日即反彈大漲超過 200 點。台股近一個月震盪劇烈，選股難度升高，投資人偏好交易一籃子股票的 ETF，觀察近一月交投最熱絡的十檔台股 ETF,https://m.cnyes.com/news/id/6272830
727,6272840,〈焦點股〉正文搭上AI、光通訊加速列車 法說行情助漲逾半根停板,網通廠正文 (4906-TW)11 日法說會釋出重大利多，董事長陳鴻文喊出明年 AI 相關產品營收佔比將挑戰 20% 目標 。受此消息激勵，正文今 (12) 日股價跳空開高，早盤一度大漲逾 9% 來到 29.75 元，逼近漲,https://m.cnyes.com/news/id/6272840
728,6272834,華通高毛利低軌道衛星板Q4爆大量出貨 挹注獲利能力跨大步成長,華通單季營收站上 200 億元並創新高，且在高毛利的低軌道衛星應用板第四季出貨爆增之下，更將推升獲利的亮麗表現 。,https://m.cnyes.com/news/id/6272834
729,6272842,PCB買氣爆棚＋五大資金行情齊發,,https://m.cnyes.com/news/id/6272842
730,6271459,〈焦點股〉台康生乳癌生物相似藥向美國FDA申請藥證失利 臉綠跌停,台康生技今日公告，美國 FDA 對授權夥伴 Sandoz 乳癌生物相似藥 EG12014 凍晶注射劑 150 毫克藥證申請，提出完全回覆信函 (CRL)，FDA 提出查廠時發現有關藥品生產的缺失，此一利空消息使台康生應聲鎖跌停。,https://m.cnyes.com/news/id/6271459
731,6272674,中國IPO市場熱翻天 散戶中籤率卻僅0.02%,,https://m.cnyes.com/news/id/6272674
732,6272780,薪資「卡關」3字頭 近7成上班族靠轉職加薪！專家點破：這時跳槽談判最有利,主計總處最新統計揭示了台灣年輕族群的薪資困境 。今年前 10 月，全體受僱員工的經常性薪資中位數為新台幣 3 萬元 。然而，未滿 30 歲族群的中位數僅略高於 3 萬元，顯示年輕人薪資長期在低檔徘徊 。人力銀行指出，有高達,https://m.cnyes.com/news/id/6272780
733,6272338,OpenAI推最強專業用模型！聊天機器人大戰反擊Google,OpenAI 剛剛發布了一款其稱為「目前最強大的專業用模型」。此舉正值 Google 的 Gemini 3 模型獲得高度讚譽後僅幾周，再度引發外界對「誰將贏得聊天機器人大戰」的討論。,https://m.cnyes.com/news/id/6272338
734,6272786,再度劍指Fed！大賣空本尊：擴表恰好表明美國銀行體系岌岌可危,,https://m.cnyes.com/news/id/6272786
735,6272323,新債王：整體市場氣氛與1995年相似,有「新債券天王」稱號的雙線資本公司 (DoubleLine Capital) 執行長岡拉克 (Jeffrey Gundlach) 表示，今年的債市走勢讓他聯想到 1995 年的市場環境，殖利率一度上探 5%，卻始終未能突破區,https://m.cnyes.com/news/id/6272323
736,6272751,Fed暗示暫停降息 美國非投資等級債迎『成長穩、降息緩』有利環境,,https://m.cnyes.com/news/id/6272751
737,6272778,看好旅遊蓬勃發展 台灣虎航釋出60個空服員職缺,看好旅遊蓬勃發展 台灣虎航釋出 60 個空服員職缺,https://m.cnyes.com/news/id/6272778
738,6272750,〈房產〉台中購屋坪數回升 近三年平均多出一個兒童房面積,台中房市購屋坪數出現回升，房仲業者依不動產資訊平台今年第二的最新資料，觀察近年同期台中住宅買賣移轉的平均面積變化，結果顯示，今年第二季台中的平均購屋坪數達 30.72 坪，比去年同期增加 0.81 坪。,https://m.cnyes.com/news/id/6272750
739,6271158,〈焦點股〉東元Q4營收展望正向 價量齊揚攻月線,東元 (1504-TW) 美國市場的傳統馬達業務第三季訂單量增加，且大馬達觸底反彈，加上進入年底的傳統工程旺季，法人預估，東元第四季營收季對季、年對年皆有望成長，激勵東元今 (12) 日價量齊揚，一舉站回月線。 ,https://m.cnyes.com/news/id/6271158
740,6272665,GPT-5.2震撼登場！超越人類專家的AI模型 辦公最佳夥伴,OpenAI 於 12 月 11 日發布了最新的人工智慧模型 GPT-5.2，這一模型被譽為地表最強的 AI，專為高難度知識型工作設計，並在多項基準測試中超越了競爭對手，顯示出其在專業領域的強大潛力。,https://m.cnyes.com/news/id/6272665
741,6272730,〈焦點股〉東森拚多處資產活化 股價衝上2年新高,〈焦點股〉東森拚多處資產活化 股價衝上 2 年新高,https://m.cnyes.com/news/id/6272730
742,6272659,比美股便宜30%！經濟學人：台日韓AI股股價淨值比不到3倍 但集中度過高引擔憂,,https://m.cnyes.com/news/id/6272659
743,6272478,〈台股開盤〉太空資料中心題材帶旺網通、低軌衛星股 反彈漲逾240點,"台股今 (12) 日早盤受權值股、網通、低軌衛星、金融類股激勵下，指數開高走高，早盤一度漲逾 242 點，最高來到 28,272 點，暫時成功收復 5 日線，盤中暫報 28,206 點漲 177 點或 0.63%，成交量為 1,971 億元。",https://m.cnyes.com/news/id/6272478
744,6272404,華盛頓州暴雨引發創紀錄洪災 10萬人被要求撤離,,https://m.cnyes.com/news/id/6272404
745,6272613,從漲4%到跌5%！博通超預期財報背後發生了什麼？,博通 (Broadcom)(AVGO-US) 第四季營收與獲利創新高，分別較去年同期成長近 30% 與 40%；第一季營收指引持平上季，AI 晶片營收較市場預期高出近 20%。博通將本財年季度股利提高 10%，年股利因此創歷史新高。,https://m.cnyes.com/news/id/6272613
746,6272383,美國醫療保險的困境：補貼能否解決根本問題？,在美國，醫療保險的高昂費用已成為家庭財務的重大負擔。耶魯大學的紮克庫柏指出，儘管政府正在討論補貼問題，但醫療支出的激增仍在加劇收入不平等，迫切需要有效的改革措施來應對這項挑戰。,https://m.cnyes.com/news/id/6272383
747,6272610,台灣無人機聯盟攜手波蘭 拓歐亞市場契機,台灣無人機聯盟攜手波蘭 拓歐亞市場契機,https://m.cnyes.com/news/id/6272610
748,6272604,〈焦點股〉今國光熱成像鏡頭銷售暢旺拚世界第一 股價漲停創19年新高,今國光 (6209-TW) 在 2025 年營運在熱成像鏡頭銷售暢旺推升獲利重大轉機，本周在單日都有萬張大量成交推升之下，今 (12) 日湧入大量買盤推升股價鎮住漲停價達 65.3 元，股價也改寫今國光 19 年來新高。,https://m.cnyes.com/news/id/6272604
749,6272403,不能被中國追上！川普命令全美AI一套規則 收回各州監管權,,https://m.cnyes.com/news/id/6272403
750,6272519,媒體直擊！WSJ：內蒙古草原藏著中國AI王牌 將改寫全球格局,,https://m.cnyes.com/news/id/6272519
751,6272461,美《國家安全戰略》外洩版：川普想拉攏這兩國脫歐,據英國《每日電訊報》10 日報導，美國《國家安全戰略》報告外洩的版本顯示，川普政府有意讓匈牙利和義大利脫離歐盟。,https://m.cnyes.com/news/id/6272461
752,6272541,「鳥叔」被警方強制調查 曾因《江南Style》紅遍全球,據多家韓媒周四（11 日）報導，韓國警方對涉嫌違規開精神類藥品及代收精神類藥品的歌手「鳥叔」PSY 展開強制調查。,https://m.cnyes.com/news/id/6272541
753,6272583,集邦：記憶體明年Q1續漲 手機、筆電品牌啟動價格上修與規格降級,研調機構 TrendForce 最新調查，由於預期 2026 年第一季記憶體價格將再顯著上漲，全球終端產品面臨艱鉅成本考驗，迫使智慧手機、筆電產業必須上修產品價格、調降規格，銷量展望再度下修已難避免，資源優勢將向少數龍頭品牌高度,https://m.cnyes.com/news/id/6272583
754,6272322,白銀今年大漲115% 下一步走勢為何？,黃金姊妹白銀今年強勢上漲，年內漲幅已達 115%，多次刷新歷史高點並大幅跑贏黃金。,https://m.cnyes.com/news/id/6272322
755,6272469,人工智慧狂飆時代的安全煞車！微軟AI主管科學家首提「威脅即停」鐵律,,https://m.cnyes.com/news/id/6272469
756,6272466,OTC：德宏股票今起列處置交易 每20分鐘撮合一次並預收款券,櫃檯買賣中心公布，由於德宏 (5475-TW) 最近 30 個營業日內曾發布處置，又因最近 10 個營業日內有 6 個營業日經 OTC 公布注意交易資訊，自今 (12) 日起 10 個交易日至 26 日的 10 個交易日交易，每 20 分鐘撮合一次並預收款券。,https://m.cnyes.com/news/id/6272466
757,6272460,中共召開中央經濟工作會議 為2026房地產政策定調,中共中央經濟工作會議 12 月 10 日至 11 日在北京舉行，部署 2026 年經濟工作，明確了八大重點任務，房地產仍是明年化解重點領域風險的重中之重。,https://m.cnyes.com/news/id/6272460
758,6272382,中國發布國產AI供應商名錄：寒武紀、華為入選 輝達被排除,中國政府制定的國產人工智慧硬供應商名錄正式發布，寒武紀與華為成為唯一入選的企業，標誌著中國在 AI 算力自主可控方面邁出了重要一步。此舉不僅是對外國廠商的回應，也為國產晶片的市場需求提供了保障。,https://m.cnyes.com/news/id/6272382
