,newsId,title,summary,link
659,6202913,〈財報〉AI熱潮救不了車用晶片！意法半導體下修全年財測 股價重挫,歐洲晶片製造商意法半導體 (STMicroelectronics) 周四 (23 日) 預估，今年營收將較去年下滑，顯示汽車與工業用晶片需求回溫速度不如預期，拖累巴黎股價盤初重挫逾 7%。,https://m.cnyes.com/news/id/6202913
660,6202787,美國加大對俄羅斯石油制裁 引發供應威脅 油價飆升,美國宣布對俄羅斯最大的石油生產商實施制裁，引發了對全球供應的威脅，並可能促使全球貿易流動出現重大重組。作為對此激進政策轉變的回應，布蘭特原油價格聞訊飆升至每桶 65 美元以上，過去兩天反彈 7%，創下兩年多來的最大漲幅。,https://m.cnyes.com/news/id/6202787
661,6202909,一周內斷料警報！安世半導體風暴蔓延全歐洲,根據《彭博》周四 (23 日) 報導，荷蘭政府近日出手接管中國聞泰科技 (Wingtech) 持股的晶片製造商安世半導體(Nexperia)，引發北京強烈反彈並切斷兩地工廠聯繫，恐導致歐洲汽車供應鏈在數日內斷裂。分析指出，此舉凸顯,https://m.cnyes.com/news/id/6202909
662,6202878,被動元件飆漲5業者公告自結 凱美Q3純益年增4成 立隆電9月成長56%,被動元件飆漲 5 業者公告自結 凱美 Q3 純益年增 4 成 立隆電 9 月成長 56%,https://m.cnyes.com/news/id/6202878
663,6202879,三商美邦招親案出價了？中信金重訊公告：董事會通過轉投資案,中信金 (2891-TW) 今 (23) 日傍晚發布重訊，公告董事會決議通過進行轉投資案，待交易確認後再行補充公告。市場傳出，三商美邦人壽 (2867-TW) 標售案正進行最後兩家金控出價階段，今天為出價最終截止日,https://m.cnyes.com/news/id/6202879
664,6202218,健喬引進日商口服新藥GnRH拮抗劑核准上市 明年Q1在台推出,健喬今日指出，引進由日本合作夥伴 Kissei 開發的創新口服新藥 GnRH 拮抗劑 Yselty(雅絲媞) 膜衣錠 100 毫克 (Linzagolix)，已在 10 月取得台灣 TFDA 核准上市，預計 2026 年第一季在台推出。,https://m.cnyes.com/news/id/6202218
665,6202895,臻鼎沈慶芳：PCB被重新看見 並成為驅動產業升級的關鍵力量,臻鼎董事長沈慶芳今日指出，所有電子產品的進化軌跡，都與 PCB 和半導體發展息息相關。隨著 AI 與先進封裝技術持續推進，PCB 不再只是默默支撐的角色，而是被重新看見、成為驅動產業升級的關鍵力量。,https://m.cnyes.com/news/id/6202895
666,6202891,信音斥9.5億元收購東莞國聯電子8成股權 強化車用布局,信音斥 9.5 億元收購東莞國聯電子 8 成股權 強化車用布局,https://m.cnyes.com/news/id/6202891
667,6202880,貿易衝突與避險情緒重燃 推動黃金價格反彈,黃金價格周四 (23 日) 在亞洲交易中上漲近 1%，收復了此前兩個交易日急劇下跌的部分失土，主因是美國與中國之間貿易緊張局勢的再次升溫，重新點燃了市場對避險資產的需求，同時投資者仍在等待關鍵的美國通膨數據。,https://m.cnyes.com/news/id/6202880
668,6202872,光復節連假這3縣市訂房率最高 國道車流尖峰時段易有壅塞,光復節 3 日連假於明 (24) 日起開始，依交通部觀光署公布訂房資料，連假首 2 日平均訂房率前 3 高的縣市，依序為連江縣、台北市及宜蘭縣，訂房率超過 6 成的縣市共有 6 個。高速公路局也研判，連假車流將以旅遊為主，尖峰時段路段易有壅塞。,https://m.cnyes.com/news/id/6202872
669,6202874,揚明光Q3陷虧損侵蝕上半年獲利 前三季每股虧損0.02元,揚明光今年來連二季的獲利卻抵不上第三季的單季虧損，揚明光今 (23) 日公布 2025 年最新財報，第三季稅後虧損 1008 萬元，較上季由盈轉虧並去年同期虧損擴大，單季每股虧損 0.09 元，前三季每股虧損 0.02 元。,https://m.cnyes.com/news/id/6202874
670,6202857,〈台幣〉連假前夕連3貶摜破30.8元關卡 探5個多月新低,連假前夕，台北股匯今 (23) 日持續走弱，外資偏向賣股匯出，新台幣兌美元匯率摜破 30.8 元關卡，終場收在 30.815 元，重貶 8.4 分，為連三貶，並創下 5 個多月新低，台北及元太外匯市場總成交值放大至 20,https://m.cnyes.com/news/id/6202857
671,6202779,下週先小後大，鴻海 南亞科 國巨 下個買點? 【星雲 第2】目標翻倍,,https://m.cnyes.com/news/id/6202779
672,6202544,矽晶圓的利基點,,https://m.cnyes.com/news/id/6202544
673,6202854,台股資金動能充足！證券劃撥存款餘額近3.9兆元創新高 M1B、M2年增率雙回升,中央銀行今（23）日公布 114 年 9 月金融情況，受惠股市交投熱絡，內外資資金湧入，象徵股市資金動能的 M1B 與代表整體流動性的 M2 年增率雙雙回升，且兩者差距微幅擴大，顯示資金活水持續向活期存款移動。且證券劃撥餘額也來到 3 兆 8,https://m.cnyes.com/news/id/6202854
674,6202811,AI股估值高 專家：泡沫論言之過早 美國企業基本面仍強勁,AI 股估值高 專家：泡沫論言之過早 美國企業基本面仍強勁,https://m.cnyes.com/news/id/6202811
675,6202852,非洲豬瘟疫情升溫 基米配合農業部提供定序及檢測完整方案,台灣爆發超過 20 年來首起疑似非洲豬瘟案例，基因定序廠基米 (4195-TW) 今 (23) 日表示，目前配合農業部與動植物防疫檢疫署的相關防疫措施，提供基因定序與賽默飛世爾的非洲豬瘟檢測試劑套組，防堵疫情擴散。 ,https://m.cnyes.com/news/id/6202852
676,6202873,中共四中全會閉幕：「十五五」規畫建議定調 聚焦科技自強與內需擴大,為期 4 天的中國共產黨第二十屆中央委員會第四次全體會議 (四中全會) 已於周四 (23 日) 在北京閉幕。本次會議審議並通過《中共中央關於制定國民經濟和社會發展第十五個五年規畫的建議》，以奠定中國在 2026 年至 2030 年的發展藍圖。,https://m.cnyes.com/news/id/6202873
677,6202807,興富發最大量體商辦案「國家壹號廣場」12月推出  總銷達300億元,上市建商興富發 (2542-TW) 將在 12 月推出目前手中最大量體規模的商辦案，位於新北新莊副都心「國家壹號廣場」商辦案，全案總銷並高達 300 億元，潛銷期間已接觸逾 100 組買家客戶，其中以科技業客戶達 50%。,https://m.cnyes.com/news/id/6202807
678,6202665,19紅！9月工業、製造業生產指數年增15.48%、16.9%雙創新高 電腦電子光學月增突出,經濟部統計處今（23）日公布 114 年 9 月工業生產統計，由於部分產業受市場需求疲軟影響減產，拉貨潮退燒，9 月工業生產指數為 115.38 點，較上月（8 月）微幅減少 1.05%，終止連續三個月的月增態勢，製造業生產指數也較上月減,https://m.cnyes.com/news/id/6202665
679,6202782,台股連假前失守5日線外資續砍239億元 連13賣0050共近68萬張,外資續砍 239 億元 連 13 賣 0050 逾近 68 萬張,https://m.cnyes.com/news/id/6202782
680,6202562,滙豐：ChatGPT Atlas瀏覽器對谷歌構不成威脅 維持Alphabet「買進」評等,,https://m.cnyes.com/news/id/6202562
681,6202781,至上、國巨、華新科、一檔「集團作帳飆股」請跟上、看懂節奏買對股真的賺很快！,,https://m.cnyes.com/news/id/6202781
682,6202774,錼創-KY Q4營運走強延續至明年 車用、穿戴MicroLED布局多點開花,MicroLED 廠錼創 (6854-TW) 上半年因韓系客戶 COC 驗證延遲以及匯兌損失，獲利出現虧損，不過在韓系大尺寸電視客戶重啟拉貨，以及高單價的巨量轉移設備銷售轉強，營運已揮別第二季谷底 ，法人看好錼創營運動能將持續升溫,https://m.cnyes.com/news/id/6202774
683,6202775,台幣貶破關鍵價！大型股休息、AI與PCB族群低檔轉強中：台積電、AES-KY、緯穎、台燿、雙鴻,,https://m.cnyes.com/news/id/6202775
684,6202742,高檔震盪不減熱度？！AI退場、電源與被動元件接棒領漲【證投顧觀點】,,https://m.cnyes.com/news/id/6202742
685,6202744,震盪盤總被洗出場？三種智慧單工具助您提升短線勝率！,,https://m.cnyes.com/news/id/6202744
686,6202703,〈TSIA年會〉台灣高階製造業赴美設廠 童子賢：還在摸著石頭過河、短期沒有標準答案,近期台廠陸續赴美設廠，市場擔憂可能造成半導體產業空洞化。對此和碩 (4938-TW) 董事長童子賢今 (23) 日指出，面對高階製造產業赴美設廠，現在還處於「摸著石頭過河」的階段，短期內沒有標準答案。,https://m.cnyes.com/news/id/6202703
687,6202678,基板危機解除、CW LD出貨穩定 法人估聯亞Q4營收重回季增軌道,聯亞 (3081-TW) 受惠於 Telecom 產品需求強勁，加上磷化銦 (Inp) 基板缺料問題解決，在 Datacom 應用原料緩解。法人預期，聯亞在出貨持續成長帶動下，有望推升今年第 4 季營收重回季增軌道。,https://m.cnyes.com/news/id/6202678
688,6202695,信邦前三季純益年減13% EPS 10.06元,連接線大廠信邦 (3023-TW) 今 (23) 日公告第三季財報，受到關稅政策的影響，稅後純益 7.32 億元，季減 3.57%、年減 22.88%；每股純益 3.05 元；累計信邦前三季純益 24.15 億元，年減 13.61%。,https://m.cnyes.com/news/id/6202695
689,6202664,「陶朱隱園」現首筆成交每坪近400萬元  房仲：恐造成延後豪宅貸款鬆綁,中工 (2515-TW) 持有的「陶朱隱園」在完工 7 年後，終於出現首筆非關係人交易，中工今 (23) 日公告以總價 12 億元，售出高樓層的 17 樓戶 4 個車位，換算單價近 400 萬元，超過前台灣央行總裁彭淮南設下的 300 萬元防線，房仲。,https://m.cnyes.com/news/id/6202664
690,6202621,研調：全球PC出貨量Q3年增8.1% 華碩消費型筆電挹注季增22%位居第五,研調機構 Counterpoint Research 報告指出，iPhone 17 系列在中國與美國開賣的前 10 天，銷售量較 iPhone 16 系列同期成長 14%。這兩大市場仍為 Apple 全球 iPhone 銷售的主要貢獻來源。,https://m.cnyes.com/news/id/6202621
691,6202542,從迷因股到黃金的波動性全面升級 因散戶熱錢成全球市場新常態,當前全球金融市場正經歷一場由個人散戶投資者主導的深刻變革，其龐大的「熱錢」正攪動著包括迷因股、加密貨幣乃至傳統避險資產黃金在內的多種資產類別，導致市場波動性成爲新的常態。,https://m.cnyes.com/news/id/6202542
692,6202536,記憶體缺瘋了！三星、SK海力士將漲價30% 客戶開始大囤貨,,https://m.cnyes.com/news/id/6202536
693,6202428,複製英特爾模式？傳川普政府擬入股量子運算企業 洽商IonQ、Rigetti等5家巨頭,,https://m.cnyes.com/news/id/6202428
694,6201947,人民幣升值情緒高漲 中國企業加速拋售美元,,https://m.cnyes.com/news/id/6201947
695,6202660,AI＋伺服器熱潮襲來，鴻海、廣達、緯創迎長線爆發,,https://m.cnyes.com/news/id/6202660
696,6202431,〈港股盤後〉恒指低開高走收漲0.72% 科網、內銀股領漲,香港股市主要指數周四 (23 日) 低開高走，市場早盤下挫，恒生指數盤中最低曾跌近 200 點，觸及 25591.66 點。然而，午後大市明顯回暖，恒指轉漲，科技指數也一度反彈漲逾 1%。,https://m.cnyes.com/news/id/6202431
697,6202619,〈TSIA年會〉童子賢：台灣科技產業在政策做出正確抉擇 使台廠較日韓更具優勢,和碩 (4938-TW) 董事長童子賢今 (23) 日出席台灣半導體產業協會年會，會後接受媒體訪問，談到台灣科技產業的優勢，指出台灣科技產業因在政策與人才上有正確抉擇，因此使得台灣科技產業近年較日本與韓國更為強勢。 ,https://m.cnyes.com/news/id/6202619
698,6201684,〈陸股盤後〉中美將在馬來西亞舉行經貿磋商 三大指數走高,中國股市三大指數周四（23 日）收盤走高，據美國《Fox Business》報導，美國財政部長貝森特周三接表示，他與美國貿易代表格里爾將前往馬來西亞，與中方官員會面，尋求緩和中方稀土出口管制升級態勢。,https://m.cnyes.com/news/id/6201684
699,6202549,高檔再創高的安費諾，示範AI科技股的財報標竿,,https://m.cnyes.com/news/id/6202549
700,6202503,羅奇籲中國「十五五」設定積極消費目標 促10年內提升消費占GDP比重至5成,知名經濟學家，也是前摩根士丹利亞洲區主席羅奇 (Stephen Roach) 表示，中國必須為即將到來的「十五五」規畫設定更加積極的目標。羅奇強烈呼籲，中國必須力爭在未來 10 年內實現消費占經濟總量的一半。他認為，中國需要新的,https://m.cnyes.com/news/id/6202503
701,6202500,悲觀情緒壓不住美股漲勢！Tom Lee：標普500指數今年底將至少漲至7000點,,https://m.cnyes.com/news/id/6202500
702,6201966,失控AI恐致人類滅絕！逾800位產商領袖聯合呼籲 立即停止開發「超級智慧」,,https://m.cnyes.com/news/id/6201966
703,6202538,〈房產〉輝達海外總部落腳北士科有譜  點燃周邊房市預售案行情熱度,輝達 (NVDA-US) 執行長黃仁勳 5 月間來台並宣布進駐北投士林科技園區有譜，新光人壽於 22 日宣布，同意與北市府合意解除地上權契約，以利輝達進駐，房仲業者指出，輝達宣布進駐北士科後，就點燃了北士科商辦及住宅交易熱。,https://m.cnyes.com/news/id/6202538
704,6202535,〈TSIA年會〉侯永清：政府綠電規劃足 但協會擔心的是執行力,隨著台灣能源轉型面臨挑戰，綠電供不應求，也衝擊台灣產業競爭力。台灣半導體產業協會 (TSIA) 理事長侯永清今 (23) 日對此回應，TSIA 已針對電力議題向政府提出三大訴求，預期台灣政府規劃的綠電裝置容量路徑圖能符合產業需求，,https://m.cnyes.com/news/id/6202535
705,6202344,消費防禦型股票重獲青睞？Gilman Hill首次建倉金百利-克拉克,文件顯示，Gilman Hill 基金今年第三季建立了金百利 - 克拉克 (KMB-US) 近千萬美元倉位。分析人士指出，Gilman Hill 的這項新行動，意味著在太多投資組合過度傾向於成長股的當下，部分投資人正重新將焦點轉,https://m.cnyes.com/news/id/6202344
706,6202502,〈TSIA年會〉台灣生態系赴美 侯永清：行政院已成立專責小組協助供應鏈落地,台灣半導體產業協會 (TSIA) 今 (23) 日舉辦年會，理事長暨台積電 (2330-TW)(TSM-US) 資深副總經理暨副共同營運長侯永清會後受訪表示，協會正彙整會員赴美所需，並透過夥伴向美國政府反映，以加速供應鏈落地，也,https://m.cnyes.com/news/id/6202502
707,6202422,〈TSIA年會〉盧超群：DRAM價格再漲半年 產業明年樂觀看,記憶體業者鈺創 (5351-TW) 董事長盧超群今 (23) 日出席 TSAI 年會，會前在採訪中表示，，自 6 月以來，台灣 DRAM 市場包括 DDR3、DDR4 明顯回溫，鈺創的高密度 DDR3 與 DDR4 需求同步轉強，展望下半年到明年整體樂,https://m.cnyes.com/news/id/6202422
708,6202067,中國AI應用領域最大單筆融資問世！成立快兩年的LiblibAI完成1.3億美元B輪融資,,https://m.cnyes.com/news/id/6202067
709,6202433,新加坡9月核心通膨高於預期 物價壓力持續升溫,新加坡官方數據顯示，9 月份的核心通膨率與整體通膨率均超出市場預期，反映出物價上漲速度加快。同時，新加坡第三季的經濟成長也表現強勁，優於預期。,https://m.cnyes.com/news/id/6202433
710,6202455,外資節前再提款239.42億 三大法人賣超249.14億元,,https://m.cnyes.com/news/id/6202455
711,6201975,越南金融市場大爆雷！地產巨頭挪用1.5兆盾遭檢辦 銀行也捲入,,https://m.cnyes.com/news/id/6201975
712,6202432,中國商務部：中美10/24至10/27在馬來西亞舉行經貿磋商,中國商務部新聞發言人周四（23 日）宣布，經中美雙方商定，中共中央政治局委員、中國國務院副總理何立峰將於 10 月 24 日至 27 日率團赴馬來西亞，與美方舉行經貿磋商。雙方將按照今年以來兩國元首歷次通話共識，磋商中美經貿關係重要問,https://m.cnyes.com/news/id/6202432
713,6202424,意法半導體第4季財測低於分析師預期 表明產業復甦停滯,意法半導體 (STMicroelectronics NV) 周四 (23 日) 發布財報，公司預測的第四季營收低於分析師預期，表明該行業期待已久的復甦，可能仍步履蹣跚。,https://m.cnyes.com/news/id/6202424
714,6202406,非洲豬瘟破功牽動民生物價？楊金龍：豬肉需求下滑 估短期不影響CPI,台灣非洲豬瘟防疫破功，央行總裁楊金龍今 (23) 日赴立法院財政委員會進行業務報告，並備質詢，立委關切原先豬肉價格就已偏高，未來是否進一步推升民生物價？楊金龍指出，雖然豬肉供給量下滑，但民眾需求也同步減少,https://m.cnyes.com/news/id/6202406
715,6202400,鴻海與北榮戰略合作 推動智慧醫療聚焦三大主軸,鴻海與北榮戰略合作 推動智慧醫療聚焦三大主軸,https://m.cnyes.com/news/id/6202400
716,6202374,南韓央行維持利率不變 謹慎信號抑制市場降息預期,南韓央行周四 (23 日) 宣布維持其基準 7 天期回購利率在 2.5% 不變。此決定與市場普遍預期一致。這已是南韓央行從 7 月以來，連續第 3 次按兵不動，而自去年 10 月之後，這家央行已 4 次降息。,https://m.cnyes.com/news/id/6202374
717,6202349,150億美元！OpenAI甲骨文攜手Vantage將在「星際之門」資料中心選址威斯康辛州 2028完工,,https://m.cnyes.com/news/id/6202349
718,6202304,美光送樣SOCAMM2模組 搶AI資料中心商機,DRAM 大廠美光 (MU-US) 今 (23) 日宣布，192GB SOCAMM2 (Small outline compression attached memory modules，小型壓縮附加記憶體模組) 已正式送樣給客,https://m.cnyes.com/news/id/6202304
719,6202371,宏碁獲日本Good Design大獎肯定 非PC事業獲利貢獻高助攻明年營運升溫,PC 品牌大廠宏碁 (2353-TW) 今 (23) 日宣布旗下多款產品以卓越設計，榮獲日本 2025 Good Design 設計大獎肯定。在產品設計獲獎的同時，宏碁持續擴展非 PC 事業與 AI 伺服器佈局，法人看好公司營運有,https://m.cnyes.com/news/id/6202371
720,6202354,〈台股盤後〉權值四大天王全走弱 連假前再跌116點 周線連九漲,〈台股盤後〉連假前下跌 116 點失守 5 日線 周線連九漲,https://m.cnyes.com/news/id/6202354
721,6202348,〈TSIA年會〉侯永清：今年台灣半導體產值6.5兆元 面對挑戰就是把自己做大做強,台灣半導體產業協會 (TSIA) 今 (23) 日舉辦年會，TSIA 理事長暨台積電 (2330-TW)(TSM-US) 資深副總經理暨副共同營運長侯永清表示，地緣政治以及市場不確定性仍然會存在，唯一能做的事就是將自己做得更強更大，在,https://m.cnyes.com/news/id/6202348
722,6201965,加速全球擴張腳步 百度年底在瑞士啟動Robotaxi測試,,https://m.cnyes.com/news/id/6201965
723,6202308,「快樂餐指標」亮警訊 反映低收入家庭承受巨大經濟壓力,過去在美國點購兒童餐，可能只是一種簡單、懷舊的樂趣，但如今，它卻預示著一個令人不安的趨勢——成人餐的價格高得離譜，而這種現象也被稱為「快樂餐指標」(Happy Meal Indicator)。,https://m.cnyes.com/news/id/6202308
724,6202296,漲價+無糖可樂賣爆！可口可樂Q3營收淨利俱增 將加碼中國市場投資,,https://m.cnyes.com/news/id/6202296
725,6202303,央行持有黃金424噸 市值約1.8兆元 楊金龍：外匯存底充裕會再考慮買入,中央銀行總裁楊金龍今 (23) 日赴立法院財委會業務報告並備質詢，多位立委關注央行持有黃金議題。目前央行持有黃金約 424 公噸，全球排名第 15 名，市值約 1.8 兆元新台幣，帳面獲利近十倍，未來「只買不賣」立場是否改變,https://m.cnyes.com/news/id/6202303
726,6202350,《價值型投資 最新產業研究報告》聯茂（6213-TW）AI伺服器材料獲大廠採用　營運迎來新成長動能,,https://m.cnyes.com/news/id/6202350
727,6201968,天王也踩雷！魔術師好友代操比特幣把2億變不見 周杰倫怒喊告,,https://m.cnyes.com/news/id/6201968
728,6202293,川普政府洽談入股量子計算公司 華府擴大干預關鍵產業,據《華爾街日報》引述知情人士的說法，美國川普政府正與多家量子計算公司進行洽談，討論以聯邦資金換取公司的股權，此舉表明川普政府正在擴大干預被視為關鍵的經濟領域。,https://m.cnyes.com/news/id/6202293
729,6202268,一個月17家申請上市！估值修復+流動性改善 港股醫藥股IPO迎罕見熱潮,,https://m.cnyes.com/news/id/6202268
730,6202294,〈焦點股〉美對俄展開石油制裁 台塑四寶堅挺領塑膠族群上揚,市場預期原油供應將進一步收緊，國際油價應聲上漲。激勵今 (23) 日油燃、塑膠指數強勁上揚，包括台塑 (1301-TW) 四寶量增上漲，成為族群上攻主力，台塑化 (6505-TW) 一度強漲半根漲停，領相關族群上攻走高。,https://m.cnyes.com/news/id/6202294
731,6201945,彭博：賴清德政府猛進「MAGA」圈大外宣 吸引川普目光,,https://m.cnyes.com/news/id/6201945
732,6202298,瑞鼎打入全球數百款車型 車用TDDI產品獲SGS認證 ,驅動 IC 業者瑞鼎 (3592-TW) 今 (23) 日宣布，車用 TDDI 產品獲 SGS 頒發 ISO 26262 ASIL B Ready 產品證書，彰顯公司車用 TDDI 產品開發符合車用功能安全高標準之可靠性，目前公司車用產品已經被,https://m.cnyes.com/news/id/6202298
733,6202279,AI專利爆量 大廠搶卡位！台灣躍居全球第9  AI國家隊由「這家」本土奪冠,人工智慧（AI）浪潮席捲全球，專利技術布局成為各國競逐 AI 核心技術、鞏固產業優勢的關鍵戰場。經濟部智慧財產局局長廖承威今（23）日年公布近年 AI 專利申請趨勢分析，揭示台灣在全球 AI 專利版圖中的重要地位日益提升，在全球 AI,https://m.cnyes.com/news/id/6202279
734,6202267,楊金龍：新台幣紙鈔改版涵蓋5面額 圖案不納政治人物、500元梅花鹿OUT,中央銀行總裁楊金龍今 (23) 日赴立法院財政委員會進行業務報告，央行已啟動新台幣紙鈔全面改版作業，引起朝野高度關注。楊金龍提到，此次改版涵蓋 5 種面額紙鈔，不含硬幣，成本大幅降低,https://m.cnyes.com/news/id/6202267
735,6201917,京東終於殺進香港保險市場！阿里騰訊京東首次「會軍」香江 傳統險企慌了？,,https://m.cnyes.com/news/id/6201917
736,6200915,〈焦點股〉非洲豬瘟疫情拉警報 動物藥廠永鴻生技亮燈漲停,台中市梧棲區一處養豬場死亡豬隻驗出非洲豬瘟病毒，2018 年以來嚴格的邊境管控恐怕已出現破口，非洲豬瘟疫情拉起警報，動物藥廠永鴻生技 (6936-TW) 受此題材激勵，今 (23) 日聞聲亮燈漲停。 ,https://m.cnyes.com/news/id/6200915
737,6200741,醫揚打入AI賦能內視鏡全球供應鏈 獲國際知名大廠量產委託,醫揚 (6569-TW) 憑藉 100% 專注醫療科技的核心策略與領先的醫療 AI 技術實力，近期成功打入全球 AI 賦能內視鏡供應鏈，獲得國際知名內視鏡大廠認證，取得醫療 AI 影像設備量產委託。 ,https://m.cnyes.com/news/id/6200741
738,6202179,iPhone17 Pro系列空降台灣9月銷售冠軍 安卓陣營受擠壓銷量衰退,根據市調機構數據，2025 年 9 月台灣實體通路智慧手機市場總銷售量達 48.1 萬部，較上月大增 33%，總銷售額更暴增 1.8 倍，寫下今年單月最大漲幅；傑昇通信指出，這蘋果不僅在銷售量、銷售額上奪冠，展現強大市場影響力，iPho,https://m.cnyes.com/news/id/6202179
739,6202167,楊金龍：今年台灣對美順差恐增至1200億美元 全力避免踩匯率操縱紅線,美國下半年匯率報告即將公布，時值台美關稅談判關鍵階段，外界關注台灣是否可能再度成為美方關切的焦點。中央銀行總裁楊金龍今 (23) 日赴立法院財政委員會進行業務報告時坦言,https://m.cnyes.com/news/id/6202167
740,6201967,量產倒數！三星HBM4月底亮相 力拚90%良率破局 能逆轉SK海力士62%的統治嗎？,,https://m.cnyes.com/news/id/6201967
741,6201637,就算是泡沫 美股牛市還能撐很久？,據《巴隆周刊》周三 (22 日) 報導，無論稱之為「泡沫」或「持續上攻的牛市」，美股漲勢可能還會再延續好幾年。,https://m.cnyes.com/news/id/6201637
742,6202168,國巨鉭電傳新一波漲價 領軍被動元件族群點火上攻,國巨鉭電傳新一波漲價 領漲帶旺被動元件族群點火上攻,https://m.cnyes.com/news/id/6202168
743,6202100,台股 28000 點不是夢！強者恆強！高點震盪是買點？,,https://m.cnyes.com/news/id/6202100
744,6201623,黃金暴跌後 接下來金價會怎麼走？,《Marketwatch》報導，黃金在週二大跌後，週三再度走弱，引發市場關注這波修正是否意味金價見頂，或只是漲勢過後的短暫調整。歷史紀錄顯示，黃金在類似暴跌後往往會出現小幅反彈。,https://m.cnyes.com/news/id/6201623
745,6202085,「斷保」就沒退休金？一次釐清勞保年資的真相,,https://m.cnyes.com/news/id/6202085
