,newsId,title,summary,link
334,6265275,宏達電XR大場域技術重現4500年前金字塔 沉浸式《消失的法老》首度登台,智慧型手機與虛擬實境平台及生態系創新領導者宏達電 (2498-TW) 今 (8) 宣布與台南奇美博物館、時藝多媒體分別合作，正式將全球矚目的沉浸式文化體驗《消失的法老 Horizon of Khufu－古夫金字塔沉浸式探索體驗》,https://m.cnyes.com/news/id/6265275
335,6265001,IBM擬斥資110億美元收購Confluent 強化雲端與AI布局,據美媒《華爾街日報》報導，IBM(IBM-US) 正與數據基礎設施公司 Confluent 進行深入談判，計畫以約 110 億美元的價格收購該公司。消息人士指出，這項交易最早可能在美國時間周一 (8 日) 宣布。,https://m.cnyes.com/news/id/6265001
336,6265270,記憶體漲價潮帶動 威剛11月營收19年來新高 調高庫存目標不變,記憶體廠威剛 (3260-TW) 今 (8) 日表示，受惠記憶體價格上漲，11 月營收達，55.98 億元，刷新 19 年來單月營收新高與歷史同期次高；累計今年前 11 個月營收達 472.33 億元，年增 27%，提前改寫年度營收新猷。,https://m.cnyes.com/news/id/6265270
337,6265242,聯電攜手imec布局矽光子取得iSiPP300技術授權 最快2026年試產,"半導體廠聯電 (2303-TW) 今 (8) 日宣布，與全球領先的先進半導體技術創新研發中心 imec 簽署技術授權協議，取得 imec iSiPP300 矽光子製程，該製程具備共封裝光學(Co-Packaged Optics, CPO",https://m.cnyes.com/news/id/6265242
338,6264888,「木頭姐」旗下投資公司ARK：到2030年 SpaceX市值將達2.5兆美元,,https://m.cnyes.com/news/id/6264888
339,6265241,威宏11月營收7.22億元與去年同期相當  輕奢、運動訂單能見度高,專業運動裝備及精品包袋製造商威宏 - KY(8442-TW) 今 (8) 日公布最新營收資訊，威宏 - KY2025 年 11 月合收為 7.22 億元，月減 6.35%，與去年同期相當，主要係泰國廠美系輕奢品牌軟殼拉桿行李箱訂單出貨動能延續。,https://m.cnyes.com/news/id/6265241
340,6265139,中國智造火力全開！特斯拉上海第400萬輛出廠 扛下全球交車半壁江山,,https://m.cnyes.com/news/id/6265139
341,6265055,中國2026年經濟戰略定調：內需主導、政策寬鬆 迎戰全球風險,中國中共中央政治局周一 (8 日) 召開會議，分析研究 2026 年經濟工作。會中定調，核心策略為強化國內需求，作為抵禦全球貿易風險的緩衝。,https://m.cnyes.com/news/id/6265055
342,6264726,〈電子五哥營收〉緯創喜迎AI伺服器出貨高峰 11月營收2806億元年增近2倍創高,緯創 (3231-TW) 今 (8) 日公告 11 月營收達 2806.24 億元，年月雙成長，其中，年增近 2 倍，累計今年前 11 月營收 1.93 兆元，年增逾 1 倍，同步寫新猷。緯創管理層指出，受惠 AI 伺服器 11 月迎來出貨高峰，帶動營收表現。,https://m.cnyes.com/news/id/6264726
343,6265037,中信銀：三大動能推升2026全球溫和成長 AI與政策成投資主軸,中信銀行今 (8) 日發布 2026 年投資展望指出，全球經濟有望在政策支持下需求復甦、製造業景氣再擴張與人工智慧 (AI) 投資熱潮等三大動能驅使下，將持續溫和成長格局,https://m.cnyes.com/news/id/6265037
344,6265057,雷諾支持在地化零件生產 警告歐盟不要矯枉過正,,https://m.cnyes.com/news/id/6265057
345,6265102,"營收速報  - 廣達(2382)11月營收1,929.47億元年增率高達36.5％","2025年11月廣達(2382-TW) 營收年增成長36.5% , 盤後股價為297.5元",https://m.cnyes.com/news/id/6265102
346,6265034,聯強受惠記憶體及AI需求成長 11月營收414億元年增16%續創同期新高,"聯強 (2347-TW) 今 (8) 日公告 11 月營收為 414 億元，月增 11.5%、年增 16%，若以固定匯率計算，更年增 22%，續創同期歷史新高，累計前 11 個月，聯強合併營收為 3,635 億元，以固定匯率計算，較同期略減 1%。聯強",https://m.cnyes.com/news/id/6265034
347,6265031,緩解關稅與低價衝擊 川普政府擬宣布120億美元農場援助計畫,據《彭博》引述白宮官員透露，川普政府計畫於周一 (8 日) 公布一項備受期待的農場援助方案，給因農作物價格低迷和總統關稅政策影響，而遭受重創的關鍵支持群體，提供總計 120 億美元的援助。,https://m.cnyes.com/news/id/6265031
348,6264874,美國不再將俄羅斯稱為「直接威脅」、盼展開合作！俄羅斯回應,美國特朗普政府公布新版《國家安全戰略》，刪除將俄羅斯列為「直接威脅」的表述，並提出有限合作可能。俄羅斯官方表示歡迎，但強調仍需進一步評估，同時美方仍關切烏克蘭局勢。,https://m.cnyes.com/news/id/6264874
349,6265042,台股重登2萬8關卡 三大法人同站多方買超191.17億元,,https://m.cnyes.com/news/id/6265042
350,6264846,記憶體晶片戰白熱化 三星Q4可望重奪DRAM龍頭,,https://m.cnyes.com/news/id/6264846
351,6264732,劃時代試驗！花旗SWIFT在以太幣測試網完成法幣與數位貨幣併行清算流程,,https://m.cnyes.com/news/id/6264732
352,6265027,〈房產〉2025年豪宅總價王 買家拿8.4億元霸氣買「皇翔御琚」兩層,高資產族布局豪宅仍不手軟房仲業者觀察今年豪宅總價交易排行，前五名集中在蛋黃區兩大豪宅，總金額最高的是信義計畫區今年 6 月出售的「皇翔御琚」一筆建商自家關係人交易，以 8.4 億買下 1、2 樓雙樓層戶共 376 坪。,https://m.cnyes.com/news/id/6265027
353,6265025,晶睿營運穩定11月營收5.4億元持續成長 推出全新AI快速球攝影機,安控廠晶睿 (3454-TW) 今 (8) 日公告 11 月營收 5.4 億元，受惠於代工與品牌事業持續穩定出貨，月增 4%、年減 16.9%。累計前 11 月營收 68.5 億元，較去年同期增 4.8%。,https://m.cnyes.com/news/id/6265025
354,6264861,市場異象：美債殖利率反隨Fed降息上漲 1990年代以來首見,美國聯準會預計的降息行動，在債券市場上引發了極不尋常的反應。通常當聯準會調整短期政策利率時，長期公債殖利率會跟進，然而這次卻出現明顯的背離——公債殖利率在央行降息之際反而攀升。有觀點認為，這種失聯現象，是自 1990 年代以,https://m.cnyes.com/news/id/6264861
355,6264011,人形機器人被過度炒作！大摩警告：電池、感應器與供應鏈才是關鍵,摩根士丹利分析指出，人形機器人在投資市場遭到過度炒作，但真正決定商業化成敗的關鍵在於電池、感應器、高精度零組件與製造供應鏈，這些底層技術卻長期被市場忽視。,https://m.cnyes.com/news/id/6264011
356,6264938,綠茵旺季需求強勁 1-11月營收8.11億元再創同期新高,生技保健食品原料研發生產廠綠茵 (6846-TW) 今 (8) 日公布營收資訊，2025 年 11 月營收 7319 萬元，較去年同期減少 13.46％；累計 1-11 月營收 8.11 億元，年增 3.94%，再創下歷年同期新高。,https://m.cnyes.com/news/id/6264938
357,6264863,口袋證券以AI模組 解析台灣50新成分股觀察重點,口袋證券以 AI 模組 解析台灣 50 新成分股觀察重點,https://m.cnyes.com/news/id/6264863
358,6264886,〈台股盤後〉台積電、記憶體股齊噴大漲322點 日K連五紅直攻歷史新點,台股今 (8) 日開盤指數即站上 2 萬 8000 點大關，盤中並由出現台積電 (2330-TW) 一支獨秀的大漲走勢、同時記憶體族群也有同步表現，集中市場加權股價走勢強，終場大漲 322.89 點，以 28303.78 點作收。,https://m.cnyes.com/news/id/6264886
359,6264937,"營收速報  - 緯創(3231)11月營收2,806.24億元年增率高達194.64％","2025年11月緯創(3231-TW) 營收年增成長194.64% , 盤後股價為149元",https://m.cnyes.com/news/id/6264937
360,6264880,日本Q3 GDP修正後下滑2.3% 超出預期 並創2023年以來最大降幅,根據日本內閣府周一 (8 日) 公布的修正數據，日本經濟在今年 7 月至 9 月期間的萎縮速度，比先前估計的更為嚴峻。,https://m.cnyes.com/news/id/6264880
361,6264010,OpenAI「紅色警戒」延燒！德銀點名ChatGPT三大結構風險,德意志銀行指出，OpenAI 雖用戶數持續成長，但訂閱放緩、Google Gemini 崛起與 1.4 兆美元資料中心投資，正構成三大結構性挑戰。執行長奧特曼緊急發布「紅色警戒」，全面聚焦 ChatGPT 應對生成式 A,https://m.cnyes.com/news/id/6264010
362,6264860,AI軍備競賽遇冷？矽谷掀起規模定律之爭 谷歌DeepMind執行長：這是實現AGI的關鍵！,,https://m.cnyes.com/news/id/6264860
363,6264855,〈焦點股〉Google AI眼鏡發布會倒數 宏達電股價搭順風車站穩5字頭,Google 年度重磅活動 Android XR 特別發布會將於美國時間 8 日登場，市場預期將結合旗下最強 AI 模型 Gemini 推出全新穿戴裝置生態系。受惠於 AI 眼鏡題材重獲市場關注，宏達電 (2498-TW) 今日股價表現穩健，股價,https://m.cnyes.com/news/id/6264855
364,6264009,歐洲企業看淡本土前景！調查：投資信心轉向美國、歐洲吸引力續降,調查顯示，歐洲企業對本土投資前景持續保守，投資信心轉向美國。歐盟改革進度緩慢，成為影響歐洲企業投資與競爭力的重要關鍵。,https://m.cnyes.com/news/id/6264009
365,6264844,市場策略大轉向！長期多頭老將建議減持「七巨頭」,華爾街資深研究機構 Yardeni Research 周日發表報告，建議投資者調整其市場策略，特別是針對以往強勢的科技股。,https://m.cnyes.com/news/id/6264844
366,6264775,〈焦點股〉800G光模組明年出貨放量 聯鈞擴量一度漲逾8%,聯鈞 (3450-TW) 憑藉雷射二極體封測技術優勢，已成功切入美系大廠 AOC 供應鏈，外界持續看好公司營收。聯鈞雖於近期遭列入注意股，但今 (8) 日盤中在大單敲進下，一度漲逾 8.45%，股價突破 280 元，創波段新高。,https://m.cnyes.com/news/id/6264775
367,6264819,國際廢鋼續穩 豐興廢鋼、鋼筋盤價連三平,國際廢鋼續穩 豐興廢鋼、鋼筋盤價連三平,https://m.cnyes.com/news/id/6264819
368,6264005,輝達黃仁勳駁斥「AI終結者」論調：人類不會被AI取代,輝達執行長黃仁勳指出，外界擔憂 AI 大型語言模型失控、取代人類甚至成為「終結者」的說法並不成立。他強調，雖然人工智慧進步神速，未來數年內可能生成全球九成知識，但 AI 不會超越人類成為頂級物種。,https://m.cnyes.com/news/id/6264005
369,6264734,馬斯克拋太空AI藍圖：每年發射100萬噸AI衛星+建月球工廠+電磁軌道炮顛覆算力格局,,https://m.cnyes.com/news/id/6264734
370,6264012,AI教父辛頓警告別放棄電腦科學：程式設計在「這些領域」大有用處,被譽為「人工智慧（AI）教父」的 Geoffrey Hinton 近日表示，即便 AI 正在改變程式設計產業，現在仍不是放棄電腦科學學位的時候。,https://m.cnyes.com/news/id/6264012
371,6264647,川普：俄羅斯對和平方案並無異議 澤倫斯基還沒讀,美國總統川普周日（7 日）表示，烏克蘭總統澤倫斯基還沒有讀美方提出的烏克蘭危機最新解決方案，他有點失望。,https://m.cnyes.com/news/id/6264647
372,6264727,核二核三重啟時程等太久？ 童子賢：需信賴專業 並重申核綠共存重要性,經濟部近日指出，在核二、核三進行自主安全檢查後，若一切順利，最快可望在 2028 年重啟。對於重啟時程是否過長，和碩 (4938-TW) 童子賢今 (6) 日再次強調「核綠共存」立場，並指出重啟時程需信賴專業。 ,https://m.cnyes.com/news/id/6264727
373,6264641,降息反推高美債殖利率！Fed遭遇市場信任危機 美元信用基石將鬆動？,,https://m.cnyes.com/news/id/6264641
374,6264596,洩密又殺人？美國防部長陷就職以來最大危機,,https://m.cnyes.com/news/id/6264596
375,6263754,中國出口回升 11月出口成長5.9%,最新數據顯示，以美元計，中國 11 月出口較一年前成長 5.9%，預估為 4%，前值為下滑 1.1%。進口增長 1.9%，前值為 1%。,https://m.cnyes.com/news/id/6263754
376,6264668,漢田營收連三月成長 11月營收年增30% 創歷史同期次高,軟袋保健飲品製造商漢田 (1294-TW) 公布最新營收資訊，漢田公布 2025 年 11 月營收達 7006 萬元，年增 30.35%，創興櫃以來同期次高，並已連續三個月維持超過 30% 的強勁年成長。,https://m.cnyes.com/news/id/6264668
377,6264669,12月不是反彈，而是回升起點：台股主流、籌碼與2026佈局指南,,https://m.cnyes.com/news/id/6264669
378,6264612,〈焦點股〉獲5千億規模0056納入 玉山金放量噴漲逾7%創近2個月新高,資產規模高達 5161 億元的大型台股 ETF－元大高股息 (0056-TW)，最新換股名單出爐，日前公告將併購三商美邦人壽 (2867-TW) 的玉山金 (2884-TW) 獲選納入，今 (8) 日在買盤湧入下，玉山金盤中一度,https://m.cnyes.com/news/id/6264612
379,6264654,2026年台股的多頭關鍵！提前卡位！就是現在！,,https://m.cnyes.com/news/id/6264654
380,6264607,華碩商用電腦Q3台灣市占蟬聯冠軍 P700桌機助攻AI部署驅動企業高效生產力,依據市調機構 IDC 最新報告公布，華碩商用電腦 2025 年第三季再度蟬聯台灣市佔冠軍，商用桌機以 41% 壓倒性市佔率橫掃市場；商用筆電以 31.6% 的市佔率穩居龍頭。其中政教領域表現尤為耀眼，商用桌機與商用筆電分別取得 48.5,https://m.cnyes.com/news/id/6264607
381,6264465,別再All In！橋水達利歐：AI一邊創造「生產力奇蹟」 一邊把泡沫推高,,https://m.cnyes.com/news/id/6264465
382,6264601,貨櫃海運市況偏弱 貨攬業憂明年仍不穩定運價有壓,貨櫃海運市況偏弱 貨攬業憂明年仍不穩定運價有壓,https://m.cnyes.com/news/id/6264601
383,6264044,泰柬邊境再爆衝突 雙方互控先開火 泰國啟動大撤離 ,,https://m.cnyes.com/news/id/6264044
384,6264560,中菲行11月營收創今年高 看好明年空運議約價格,中菲行 11 月營收創今年高 看好明年空運議約價格,https://m.cnyes.com/news/id/6264560
385,6263593,力拚全球虛擬資產中心！HashKey通過聆訊成「加密資產第一股」專家：香港欲爭Web3.0話語權,,https://m.cnyes.com/news/id/6263593
386,6263915,共信-KY獲准納入中國首版商保創新藥目錄 看好肺癌新藥銷量明年倍數成長,共信 - KY(6617-TW) 表示，旗下自主開發的肺癌新藥普羅先安 (PTS-302)，通過專家評審及價格協商，獲准納入中國首版商保創新藥目錄，為台股第一家取得資格的上櫃公司，PT-302 銷售看增，看好其銷量明年倍數成長。,https://m.cnyes.com/news/id/6263915
387,6264004,川普稱擔憂Netflix收購華納兄弟：將親自參與決策、曾與Netflix執行長會面,美國總統川普對 Netflix 計畫收購華納兄弟表示關注，指出合併可能引發反壟斷問題。交易估值 720 億美元，市場佔有率爭議引發監管關注。,https://m.cnyes.com/news/id/6264004
388,6264490,〈專訪〉北祥科服強打聯盟合作牌 加速AI落地 最快明年申請上櫃,〈專訪〉北祥科服強打聯盟合作牌 加速 AI 落地 最快明年申請上櫃,https://m.cnyes.com/news/id/6264490
389,6264535,年底FED降息1碼底定，點陣圖、日央藏有資金行情煞車玄機,,https://m.cnyes.com/news/id/6264535
390,6264344,食品價格壓不住！川普組供應鏈安全小組 盯上反競爭行為,,https://m.cnyes.com/news/id/6264344
391,6264371,〈台股開盤〉直接站上2萬8 台積電漲10元領軍大盤漲逾百點,台股今日早盤護國神山台積電 以 1465 元開出，在平盤之上小幅震盪，大盤早盤上漲逾 100 點，大盤最高 28106.64 點，證券分析師指出， 整體的看法是偏向正向，只要五日均線不跌破之前操作偏多。,https://m.cnyes.com/news/id/6264371
392,6264195,公股2金1銀前11月獲利出爐 兆豐金拚全年正成長 華南金、彰銀年增15.2%、23.4%,公股金融機構近期陸續公布 11 月自結盈餘，其中兆豐金控 (2886-TW) 雖面臨單月獲利月減壓力，但前 11 月累計稅後純益達 319.91 億元，每股純益（EPS）2.16 元，仍穩居公股金控的獲利龍頭寶座。值得注意的是，華南,https://m.cnyes.com/news/id/6264195
393,6263580,劍指SpaceX星鏈！中國三大萬顆星座計畫 推動商業航天領域進入高速發展期,,https://m.cnyes.com/news/id/6263580
394,6263394,藥華藥11月營收15億元連續3個月創高 2026年成長動能明確迎爆發期,藥華藥 (6446-TW) 公告 11 月營收 15.53 億元，年月雙成長，其中，年增超過 5 成，連續 3 個月創新高。藥華藥指出，美國與全球市場銷售持續成長，加上子公司與合作夥伴貢獻同步擴大，2026 年成長動能明確，有望迎來爆發期。 ,https://m.cnyes.com/news/id/6263394
395,6264253,台積電 聯發科非首選？ 拆解：TPU+GPU雙核心時代台廠三大贏家板塊！,,https://m.cnyes.com/news/id/6264253
396,6264191,馬斯克談每年發射100萬噸AI衛星,全球首富馬斯克周末在社交平台 X 上討論了每年向太空發射 100 萬噸 AI 衛星的可能性，以實現他之前談到的每年在太空部署 100 吉瓦人工智慧（AI）的目標。,https://m.cnyes.com/news/id/6264191
397,6263960,美國防長警告日本盟國：國防支出不足將「付出代價」,美國國防部長赫格塞斯警告日本及其他盟國，若國防支出未達標將付出代價。日本政府正推動防衛開支提升至 GDP 2%，引發社會對經濟與民生負擔的關注。,https://m.cnyes.com/news/id/6263960
398,6264187,Fed降息前 台積電、鴻海、廣達、緯創、緯穎、台達電、聯發科 買哪一檔比較好?,,https://m.cnyes.com/news/id/6264187
399,6264037,機器人概念股強勢崛起！市場焦點大轉移！短線資金追逐股有這些！,,https://m.cnyes.com/news/id/6264037
400,6264032,【台股投資週報】再戰28K，大戶加碼3產業，擔任反攻急先鋒,,https://m.cnyes.com/news/id/6264032
401,6264000,美國國家公園免票政策調整：新增川普生日、取消馬丁路德紀念日,美國國家公園管理局發布的消息顯示，明年起美國人可在美國總統川普的生日（6 月 14 日）當天免費進入國家公園，曾在免費開放日名單的解放黑奴紀念日（6 月 19 日）和馬丁路德紀念日（1 月的第三個星期一）則被取消。,https://m.cnyes.com/news/id/6264000
402,6264020,降息倒數！AI第二波大爆發？台股準備創新高！,,https://m.cnyes.com/news/id/6264020
403,6264013,記憶體超級循環正開始 群聯 南亞科 華邦電 加速轉強中 要買要賣？這次動作要快！,,https://m.cnyes.com/news/id/6264013
404,6263584,Netflix拿下華納對中國市場有何影響？專家曝「這模式」讓Netflix間接受益,,https://m.cnyes.com/news/id/6263584
405,6263841,歐洲質疑美國立場！馬克宏將訪倫敦會英、德領袖與澤倫斯基,法國總統馬克宏將於 12 月 8 日赴倫敦，與烏克蘭總統澤連斯基、英國首相施凱爾及德國總理默茨會談，討論俄烏衝突最新局勢、美方調停進程及歐洲安全合作。此次會晤凸顯歐洲在衝突第四年維護統一立場的重要性。,https://m.cnyes.com/news/id/6263841
406,6263886,英特爾承認晶圓供應不足！高層：要是產能夠我們就能賣出更多Lunar Lake,英特爾面臨晶圓供應緊張，Arrow Lake 與 Lunar Lake 處理器出貨受限。公司可能需要追加晶圓訂單以滿足市場需求，短期內成本保持穩定，但長期價格仍有變數。,https://m.cnyes.com/news/id/6263886
407,6263949,中日關係緊繃 金融時報：美國沉默 日本急得跳腳,英國《金融時報》上周六（7 日）援引多名現任和前任美日兩國官員的說法，稱在日本首相高市早苗發表涉台言論激怒中國後，日本對美國的支持力度不足感到沮喪，並敦促美方給予高市更多公開支持。,https://m.cnyes.com/news/id/6263949
408,6263582,美光放棄消費記憶體市場 陸國產快閃記憶體廠機會來了？,,https://m.cnyes.com/news/id/6263582
409,6263767,全球油價2026年或下跌！原油供過於求、川普撤銷阿拉斯加石油鑽探限制,美國總統川普簽署法案放寬阿拉斯加北坡國家石油儲備區鑽探限制，作為提升能源產量計畫的一部分。國際能源總署預測 2026 年全球原油供過於求或達每日 400 萬桶，摩根大通與麥格理銀行警告油價可能下跌，市場面臨挑戰。,https://m.cnyes.com/news/id/6263767
410,6263928,《動物方城市2》中國總票房突破30億 超越北美 躍全球第一大票倉,貓眼專業版的數據顯示，截至 12 月 7 日（周日）17 時 41 分，上映 12 天（從 11 月 26 日開始）《瘋狂動物城 2》（Zootopia 2，台灣稱動物方城市 2）中國內地總票房（含預售）突破人民幣（下同）30 億元，達到 30.20,https://m.cnyes.com/news/id/6263928
411,6263845,微策略目標價遭腰斬！華爾街為何仍喊「買入」？,華爾街 Cantor Fitzgerald 將微策略股價目標從 560 美元下調至 229 美元，但仍維持增持評級。分析師強調股價未來走勢主要取決於比特幣，並指出近期價格回落為健康修正。,https://m.cnyes.com/news/id/6263845
412,6263934,〈台股盤前要聞〉重返2萬8在望、鴻海創最強11月營收、華新海底電纜廠啟用,台股盤前要聞,https://m.cnyes.com/news/id/6263934
413,6263768,美國參議員警示中國華大基因崛起風險：基因強化士兵「太可怕」,美國參議員華納警告，中國華大基因 (BGI) 快速擴張，全球收集大量 DNA 資料，可能引發「DNA 軍備競賽」與國安疑慮。華大基因模式類似華為，美國國會正推《生物安全法案》限制中國生技公司在美運作。,https://m.cnyes.com/news/id/6263768
414,6263755,"年產1,000顆！中國衛星超級工廠即將投產 多枚火箭籌備首飛","在中國文昌國際航天城，年產 1,000 顆衛星的超級工廠即將投產，可實現「衛星出廠即發射」無縫銜接，目前 20 餘家產業鏈上下游企業已簽約落戶，火箭研發、衛星製造、發射測控全鏈條生態日趨完善，多枚火箭籌備首飛。",https://m.cnyes.com/news/id/6263755
415,6263805,俄羅斯缺勞動力 準備迎接無限量印度勞工,應印度總理莫迪邀請，俄羅斯總統普丁於 12 月 4 日至 5 日對印度進行國是訪問。據《今日俄羅斯》上周六（6 日）報導，普丁訪印期間俄印兩國簽署了勞動力流動協議。,https://m.cnyes.com/news/id/6263805
416,6263523,〈走進中國〉放「雪假」！中國多地滑雪場擠滿了學生,,https://m.cnyes.com/news/id/6263523
417,6263877,美國特使：俄烏和平協議「非常接近達成」！剩這「兩大」主要議題,美國烏克蘭特使凱洛格表示，結束俄烏戰爭的協議已接近完成，目前僅剩頓巴斯地區領土與扎波羅熱核電廠兩大懸而未決議題。戰爭傷亡已超過 200 萬人，和平談判正進入最後階段。,https://m.cnyes.com/news/id/6263877
418,6263258,本週操盤筆記：Fed料降息1碼、多國央行決策、再加速交易受矚,美國聯準會 (Fed) 決策將成為投資人本周焦點，市場普遍預期在近期美國就業數據疲軟後，央行將降息 1 碼。加拿大、澳洲和瑞士的央行決策也備受關注，此外，市場將觀察日本央行 (BoJ) 的言論，推測其何時會再次升息。,https://m.cnyes.com/news/id/6263258
419,6263839,今國光11月營收再上攀到4.08億元年增72% 創110個月來新高,今國光今 (7) 日公布最新營收資訊，2025 年 11 月營收再上攀到 4.08 億元，爲 2016 年 10 月以來的 110 個月單月新高，月增 0.64%，年增 72.7%。,https://m.cnyes.com/news/id/6263839
420,6263791,川普發怒！美國明尼蘇達社會福利詐騙案震動美國、涉案金額超10億美元,美國明尼蘇達州近期爆發多起社會福利詐騙案，涉案金額超過 10 億美元，非營利組織與移民社區牽涉其中，引發政治與監管爭議。川普與州長華茲均展開回應與調查。,https://m.cnyes.com/news/id/6263791
421,6263788,美烏談判之際！俄羅斯大規模飛彈與無人機襲擊烏克蘭、引發全國防空警報,週六凌晨，俄羅斯對烏克蘭發動大規模飛彈與無人機襲擊，烏克蘭全境防空警報響起。基輔與利沃夫等地受波及，能源設施遭打擊，雙方持續交火，局勢緊張。,https://m.cnyes.com/news/id/6263788
422,6263783,川普第二任期新版國家安全戰略：與以前有何不同、美國戰略專家評論,"美國近日正式發布新版《國家安全戰略》（National Security Strategy, NSS）。觀察人士指出，這份最終版文件顯示美國整體戰略正出現數十年來罕見的深刻轉向，不僅在地理重心上重新排序，也在對盟友定位、",https://m.cnyes.com/news/id/6263783
423,6263581,ChatGPT成長趨緩！市調機構示警市場接近飽和、Google Gemini急追,Sensor Tower 最新數據顯示，ChatGPT 成長動能逐漸降溫，全球月活躍用戶逼近 8.1 億，市占率開始下滑；Google Gemini 則受惠於影像生成模型 Nano Banana，用戶、下載量與使用時長全,https://m.cnyes.com/news/id/6263581
