,newsId,title,summary,link
945,6117895,傳iPhone 17e將捨棄「瀏海」升級動態島與A19晶片,蘋果平價 iPhone 系列可能迎來重大外觀變革，根據新浪微博知名爆料者數碼閒聊站，蘋果 2026 年將推出的 iPhone 17e 有望成為系列中首款搭載「動態島」設計的平價機型，並全面告別備受爭議的「瀏海」。,https://m.cnyes.com/news/id/6117895
946,6117823,〈台股盤前要聞〉三大法人山頂上齊撤、大聯大關稅轉嫁客戶、凌陽C5晶片搶攻AI機器人商機,台股盤前要聞,https://m.cnyes.com/news/id/6117823
947,6117832,紐時：烏克蘭安全保證是個「說易行難」現實考驗,《紐約時報》周二（19 日）分析，川普承諾美國將參與為烏克蘭提供安全保障，讓烏國和歐洲領導人感到滿意，但具體內容仍不明確，因為俄羅斯已明確拒絕任何 NATO 國家在烏克蘭駐軍的安排。,https://m.cnyes.com/news/id/6117832
948,6117758,瑞士外長：若普丁來日內瓦參加和談 可獲豁免權,據《法新社》報導，瑞士聯邦委員兼外長卡西斯周二（19 日）表示，儘管國際刑事法院（ICC）對俄羅斯總統普丁發出逮捕令，若普丁為俄烏和平談判而來瑞士，瑞士將授予豁免權。,https://m.cnyes.com/news/id/6117758
949,6117705,【袁志峰專欄】香港失業率持續上升,"今日推介 - 石藥集團 (1093, $10.64), 目標價 $11.5, 止損價 $10.0",https://m.cnyes.com/news/id/6117705
950,6117845,50%關稅清單暴增400項、閃亮金屬製品通通跑不掉 專家：物價恐雪上加霜,根據《CNBC》周二（19 日）的報導，川普政府悄悄將 50% 鋼鐵和鋁材關稅擴大至超過 400 個額外產品類別，大幅增加這項關稅措施的涵蓋範圍和影響，新關稅周一已生效。,https://m.cnyes.com/news/id/6117845
951,6117827,川普關稅奏效了？美國赤字飆升仍獲標普評級力挺 但Fed獨立性成隱憂,綜合外媒周二（19 日）報導，標普全球（SPGI-US）周一確認美國「AA+」信用評級，表示川普關稅收入將抵銷《大而美法案》的財政衝擊，預測政府赤字占 GDP 比重將從 2024 年的 7.5% 降至 2025-2028 年平均 6.0%。,https://m.cnyes.com/news/id/6117827
952,6117826,Meta AI大重組！四團隊分工追趕OpenAI和Google,據《彭博》周二（19 日）的報導，Meta（META-US）將新成立的 AI 部門拆分為包括大型語言模型、基礎研究、產品應用和基礎設施部門四個獨立團隊，並重新分配現有 AI 員工，希望更好地運用花費數十億美元挖角的頂尖人才，加速追,https://m.cnyes.com/news/id/6117826
953,6117767,川普豁免銅原料關稅 美電線廠商趁機漲價消費者買單,根據《彭博》周二（19 日）的報導，美國主要電線製造商在川普意外豁免基本銅材進口關稅數周後宣布漲價，顯示即使金屬價格暴跌，美國消費者仍可能面臨更高成本。,https://m.cnyes.com/news/id/6117767
954,6117664,AI熱潮下相對失色？亞馬遜投資價值再檢視,《彭博》周二 (19 日) 報導，在華爾街瘋狂追捧人工智慧 (AI) 投資之際，亞馬遜 (AMZN-US) 股價卻落後那斯達克 100 指數，今年僅漲 4.6%，不到大盤的一半。主因是 AWS 雲端業務增速不及微軟 (MSFT-US) 與 Googl,https://m.cnyes.com/news/id/6117664
955,6117840,德銀打臉美財長貝森特降息論 指Fed利率水準符合模型建議,根據《彭博》周二（19 日）的報導，德意志銀行（DB-US）利率策略師反駁財政部長貝森特關於聯準會利率過高的說法，認為現行利率水準符合 Fed 模型建議，最多僅需降息一碼，批貝森特聲稱應大降 150-175 個基點無根據。,https://m.cnyes.com/news/id/6117840
956,6117726,不只發USDC了！Circle推Arc要做穩定幣界的支付霸主,據《彭博》周二（19 日）的報導，穩定幣發行商 Circle 推出自有區塊鏈 Arc 處理穩定幣支付，直接挑戰 Visa 和萬事達卡等傳統支付巨頭，同時競爭對手 Stripe 也在暗中開發類似區塊鏈項目 Tempo，兩家公司都想控制數位貨幣,https://m.cnyes.com/news/id/6117726
957,6117820,蘋果供應鏈轉移加速 iPhone印度擴產遇美印貿易摩擦,蘋果據報已提升在印度的 iPhone 產量，背景則是美國白宮因印度持續購買俄羅斯石油而對其施壓。美國財政部長貝森特周二接受《CNBC》專訪時表示，華府計劃針對印度加徵關稅，理由是印度透過購買遭制裁的俄羅斯石油並轉售獲利，行為,https://m.cnyes.com/news/id/6117820
958,6117711,GPT-5才推出GPT-6已在路上 奧特曼：將具備個人化記憶功能,據《CNBC》周二（19 日）的報導，OpenAI 執行長奧特曼表示，GPT-5 剛推出，GPT-6 已在開發中，新版本將具備記憶功能並能適應用戶個人習慣，同時透露 GPT-6 推出時間將比 GPT-4 到 GPT-5 的間隔更短。,https://m.cnyes.com/news/id/6117711
959,6117819,中國用晶片B30A還只是傳聞？輝達不鬆口僅稱「產品評估中」,輝達 (NVDA-US) 周二 (19 日) 表示，公司正在評估多項產品，針對先前媒體報導該公司正為中國市場開發一款新人工智慧 (AI) 晶片的消息作出回應。據《路透》引述知情人士透露，這款新產品暫名為 B30A，預期將基於輝達最新的 B,https://m.cnyes.com/news/id/6117819
960,6117719,美國房市兩樣情！7月新屋開工衝上5個月高點 建照卻跌逾5年新低,綜合外媒周二 (19 日) 報導，美國 7 月新屋開工回升至 5 個月高點，顯示多戶住宅建設動能強勁，不過作為前瞻指標的建築許可證卻連續第四個月下滑，突顯房市前景依舊隱藏不確定性。,https://m.cnyes.com/news/id/6117719
961,6117730,DeepSeek推出V3.1模型 擴大對話與記憶能力,中國新創公司深度求索 (DeepSeek) 周二 (19 日) 宣布，推出其人工智慧 (AI) 模型 V3 的升級版 V3.1，並表示已經準備好進入測試階段。,https://m.cnyes.com/news/id/6117730
962,6117759,美商務部長證實洽談入股英特爾 晶片法案補助金擬改成股權投資,根據《彭博》報導，美國商務部長盧特尼克 (Howard Lutnick) 周二 (19 日) 證實，美國政府正與英特爾 (INTC-US) 洽談入股事宜，計劃將《晶片與科學法案》(Chips and Science Act)原本核撥的,https://m.cnyes.com/news/id/6117759
963,6117623,泡泡瑪特上半年業淨利潤狂飆近400% 毛絨產品與海外市場成兩大增長引擎,泡泡瑪特 (09992-HK) 周二 (19 日) 公布上半年財報，業績表現超越市場預期。報告顯示，公司總收入達 138.8 億元人民幣，同比激增 204.4%。歸母淨利潤更實現 45.7 億元，同比狂飆 396.5%，毛利率也從 64.0% 大,https://m.cnyes.com/news/id/6117623
964,6117548,應對旅遊困境 泰國推加密貨幣轉換計畫 盼吸引國際遊客,泰國為刺激其停滯的旅遊業，已啟動「TouristDigiPay」試點計畫，旨在簡化外國遊客將加密資產轉換為泰銖的流程，以促進當地消費。,https://m.cnyes.com/news/id/6117548
965,6117628,〈美股早盤〉零售財報開跑！主要指數漲跌互現 市場聚焦Fed政策訊號,美股主要指數周二 (19 日) 開盤漲跌互現，道瓊指數在家居零售商家得寶維持全年展望的提振下開高，但投資人整體情緒仍趨謹慎，聚焦本周稍晚聯準會 (Fed) 主席鮑爾於全球央行年會的談話。零售業財報季拉開序幕，市場同時消化最新業績與,https://m.cnyes.com/news/id/6117628
966,6117663,巴菲特再度減持蘋果股票 兩大看空訊號是什麼？,股神巴菲特的波克夏公司近期持續減持蘋果（AAPL-US）引發市場關注。雖然表面上這是基於風險管控和投資組合調整的理性操作，但分析師認為，這與巴菲特「價值投資、長期持有」的哲學相矛盾，暗示蘋果當前的風險報酬比已非最佳選擇。,https://m.cnyes.com/news/id/6117663
967,6117707,怎會空強勢股？金居爆違約交割1093萬元 上市櫃今年第八起,櫃買中心今 (19) 日公告，PCB 產業鏈銅箔廠金居 (8358-TW) 爆出違約交割事件，金額為 1093 萬 7500 元，由第一金證券經紀部通報，為櫃買今年以來的第七例，也是上市櫃公司今年來的第八起違約交割案例。,https://m.cnyes.com/news/id/6117707
968,6117723,佳能企業迎接AI推進激發光學元件需求 再加碼擴充海外新產能,佳能企業仍不斷進行包括在東莞寮步廠及越南新廠的擴充，迎接在 AI 發展的光學應用大增需求，董事長章孝祺指出，佳能 2024 年資本支出 1000 萬美元，今年繼續加碼到 1500 萬美元投資。,https://m.cnyes.com/news/id/6117723
969,6117586,中國國務院強調激發消費潛力與鞏固房市回穩 穩住經濟「主動脈」,中國國務院總理李強於 8 月 18 日主持召開國務院第九次全體會議，強調要「鞏固拓展經濟回升向好勢頭，努力完成全年經濟社會發展目標任務」。此次會議選在年中關鍵時點召開，旨在總結上半年經濟運行狀況，並為下半年衝刺全年目標謀篇佈局。,https://m.cnyes.com/news/id/6117586
970,6117710,川普急換聯準會主席拼降息 貝森特9月1日後面試11候選人,據《CNBC》周二（19 日）的報導，美國財政部長貝森特表示，將於勞動節後開始面試聯準會主席候選人，目前有 11 人競爭這個職位，包括現任理事、經濟學家及華爾街專家。,https://m.cnyes.com/news/id/6117710
971,6117631,〈財報〉家得寶連兩季獲利未達標 仍維持全年展望不變,美國家居零售巨擘家得寶 (Home Depot) 周二 (19 日) 美股盤前公布 2025 年度第二季 (截至 8/3) 財報，該季獲利與營收雙雙低於華爾街預期，這也是該公司自 2014 年以來首次連兩季未達標。不過，家得寶依然維持全年財測不,https://m.cnyes.com/news/id/6117631
972,6117665,業績連三年下滑 百思買推賣家平台效仿亞馬遜抽佣模式,據《CNBC》周二（19 日）的報導，因應銷售疲軟，美國電子零售商百思買（BBY-US）正式推出第三方市集平台，效仿亞馬遜和沃爾瑪商業模式，透過第三方賣家增加商品多樣性並抽取銷售佣金，以提振逐漸放緩的銷售表現。,https://m.cnyes.com/news/id/6117665
973,6117668,2025台灣米其林指南餐廳53家摘星 頤宮8度摘三星最風光,《台灣米其林指南》於今 (19) 日在公布入選餐廳名單，共 53 家餐廳榮獲星級殊榮，包含台北 43 家餐廳、台中 6 家及高雄 4 家餐廳上榜。,https://m.cnyes.com/news/id/6117668
974,6117669,南橫五口墜谷案 金管會：涉及2險種 非屬除外責任應依約理賠,台 20 線南橫公路日前發生一家五口車輛墜谷憾事，有媒體報導指稱，此案父親「明知危險而為之」可能無法獲得理賠，產、壽險公會已經對外澄清非事實，金管會今 (19) 日再度回應,https://m.cnyes.com/news/id/6117669
975,6117633,零跑汽車憑「性價比之王」逆襲 海外生產基地計畫揭示全球野心,中國新能源車企零跑汽車 18 日晚間公布其 2025 年上半年財報，展現出遠超市場預期的強勁表現。報告顯示，公司首次實現半年度淨利潤轉正，成為繼理想汽車之後，中國造車新勢力中第二家達成此里程碑的車企。,https://m.cnyes.com/news/id/6117633
976,6117672,輝達客製中國新晶片待川普放行 美議員憂損AI領先地位,根據《路透》週二（19 日）的報導，輝達（NVDA-US）正在為中國市場開發基於最新 Blackwell 架構的新款 AI 晶片「B30A」，運算能力將超越目前獲准在中國銷售的 H20 型號，但仍需美國監管機構批准，預計最快下月送樣測,https://m.cnyes.com/news/id/6117672
977,6117651,蘋果成功守住用戶隱私 英國放棄「開後門」計畫,根據《CNBC》周二 (19 日) 報導，蘋果 (AAPL-US) 在全球加密之戰取得關鍵勝利。美國政府周一宣布，英國同意撤回要求蘋果提供「後門」的計畫，意味著官員將無法存取使用者的加密資料。這場爭議原本牽動國家安全與隱私權之間的,https://m.cnyes.com/news/id/6117651
978,6117448,中國7月青年失業率再創新高 經濟壓力浮現,中國國家統計局公布的最新數據顯示，7 月份中國城鎮勞動市場的失業率呈現複雜且令人擔憂的趨勢，特別是年輕族群的失業情況持續惡化。,https://m.cnyes.com/news/id/6117448
979,6117654,後關稅時代：台灣投資人如何迎戰新變局？富達國際王陶沙揭資產配置5心法,儘管近期美國與歐盟等國家達成貿易協議，關稅不確定性稍降溫，但全球經濟仍處高關稅的「後關稅時代」。對台灣而言，美國加徵的 20% 對等關稅，以及未來可能面對的貿易障礙，都使得出口產業及供應鏈面臨嚴峻挑戰，不僅影響企業的營運，也,https://m.cnyes.com/news/id/6117654
980,6117645,憂關稅海嘯掀無薪假浪潮 金管會：金融三業已啟動協助措施,美國對全球實施對等關稅，台灣遭課暫時性關稅 20%，工具機等傳產首當其衝，外界憂心無薪假人數恐進一步攀升，金融三業是否備妥協助措施？金管會今 (19) 日表示,https://m.cnyes.com/news/id/6117645
981,6117630,俄烏戰爭迎轉折？美歐啟動安全保障 川普牽線普丁與澤倫斯基會晤,《彭博》周二 (19 日) 報導，美國與歐洲官員已著手規劃強化烏克蘭軍事的安全保障方案，為日後安排俄羅斯總統普丁與烏克蘭總統澤倫斯基的會晤鋪路。這項計畫在白宮舉行的峰會中獲得明確承諾，美國總統川普也在會後承諾，美國將協調歐洲提,https://m.cnyes.com/news/id/6117630
982,6117482,錯過Circle、Bullish？這三家加密「賣鏟者」IPO引人矚目,在 Circle (CRCL-US) 和 Bullish (BLSH-US) 成功上市並引發市場震動後，加密貨幣領域正迎來新一輪的首次公開募股 (IPO) 熱潮。投資者正積極湧向那些提供加密產業入口，而非直接加密資產的公司，這,https://m.cnyes.com/news/id/6117482
983,6117629,軟銀與美國政府雙重資金救援！英特爾翻身機會浮現,根據《彭博》周二 (19 日) 報導，美國總統川普日前才公開呼籲英特爾 (INTC-US) 執行長陳立武（Lip-Bu Tan）下台，不到兩周後情勢急轉直下，陳立武如今反而有望獲得美國政府與日本軟銀集團 (SoftBank) 的資金挹,https://m.cnyes.com/news/id/6117629
984,6117577,〈新代轉上市〉蔡尤鏗看台灣工具機陷困境 期盼智慧製造、壯大生態系走出國際,新代科技將於 9 月底前由興櫃轉上市，談及台灣工具機產業面臨匯率、關稅夾擊，已有廠商祭出「做四休三」來度過難關。對此，新代科技董事長蔡尤鏗表示，工具機產業近年面臨匯率、中國競爭挑戰，現在正是檢視困境、尋找突破的契機，,https://m.cnyes.com/news/id/6117577
985,6117625,〈財報〉小鵬汽車Q2營收交付創新高 虧損大幅收窄 惟Q3指引遜預期,小鵬汽車 (XPEV-US) 周二 (19 日) 公布 2025 年第二季度財報，總營收和汽車交付量雙雙創下歷史新高，同時淨虧損顯著收窄，展現其在激烈價格戰中加速邁向規模與盈利雙重轉捩點的實力。然而，公司對第三季的營收和交付指引卻略,https://m.cnyes.com/news/id/6117625
986,6117585,神基下半年營運逐季成長 機構件業績增幅上修至2成,神基下半年營運逐季成長 機構件業績增幅上修至 2 成,https://m.cnyes.com/news/id/6117585
987,6115150,三大法人由買轉賣186億元 外資、投信合砍南亞3.5萬張,"台股今 (19) 日開高走低，早盤雖創新高，盤中卻因隨著印刷電路板 (PCB) 等強勢股轉弱回檔，大盤由紅翻黑，終場下跌 129.02 點，終場收 24,353.5 點，失守 5 日均線，南亞 (1303-TW) 遭外資、投信賣 3.5 萬張最多。",https://m.cnyes.com/news/id/6115150
988,6117546,〈財報〉小米Q2表現亮眼：電動車銷售發威 營收獲利雙創新高,小米集團 (01810-HK) 周二 (19 日) 公布第二季財報，收入與盈利雙雙創下歷史新高，大幅超出市場預期。這份強勁的成績單，主要歸功於其智能電動車業務的迅速崛起，以及物聯網 (IoT) 和互聯網服務板塊的穩健成長。,https://m.cnyes.com/news/id/6117546
989,6117526,金居 台玻 富喬 下個買點?【國精化 第2】目標翻倍,,https://m.cnyes.com/news/id/6117526
990,6117296,AR眼鏡火熱，宏達電(2498-TW)與GOOGLE聯手，股價持續火燙,,https://m.cnyes.com/news/id/6117296
991,6117582,撼訊顯卡與AMD緊密合作  回收鋰事業獲Panasonic訂單將成第二動能,顯卡廠撼訊今 (19) 日召開法說會，總經理陳劍威表示，受惠 AMD 新款顯卡市占率從去年第四季 8% 提升至今年首季 17%，帶動公司顯卡業務成長；同時循環經濟事業傳出捷報，已取得日本 Panasoic 鋰電池再生材料訂單，下半年開始小,https://m.cnyes.com/news/id/6117582
992,6117447,「白宮版智鬥」落幕？川普淡化停火必要性 力推美俄烏三方會談,美國總統川普在白宮與烏克蘭總統澤倫斯基及多位歐洲領導人的會晤，這次會談旨在結束俄烏戰爭，但截至當地周一晚間，雙方仍未就安全保障或和平協議的具體步驟達成承諾。中國自媒體「牛彈琴」形容，這像是一場「白宮版智鬥」。,https://m.cnyes.com/news/id/6117447
993,6117547,新光三越中秋全檔期祭3成獨家 業績拚年增10%上看億元,新光三越中秋全檔期祭 3 成獨家 業績拚年增 10% 上看億元,https://m.cnyes.com/news/id/6117547
994,6117525,連巴菲特都搶進日股！首支台日跨境ETF上架 一文看懂日元貶值下3大投資優勢,全球總體經濟在 2025 年迎來嶄新格局，特別是日元匯率的持續貶值與日本企業治理改革的加速，讓「日本製造」再次在全球舞台上大放異彩，並為日本股市帶來前所未有的投資機遇。在此背景下，野村投信呼應政府打造台灣成為亞洲資產管理中心,https://m.cnyes.com/news/id/6117525
995,6117151,〈新代轉上市〉9月底前掛牌！布局智慧機器人「小腦」 營運拚優於產業平均,新代科技 (7750-TW) 將由興櫃轉為上市，預計 9 月底之前正式掛牌，董事長蔡尤鏗表示，新代主要有二大經營目標，包括整體表現優於產業平均、穩定提升市占率，而非單純追逐毛利率高低,https://m.cnyes.com/news/id/6117151
996,6117524,神隆三大領域穩步前進 樂觀看下半年營運,神隆 (1789-TW) 今 (19) 日召開線上法說會，指出公司持續加快自有製劑發展腳步，同時拓展自有原料藥的新客戶與新市場，加上 CDMO 業務陸續取得進展，對於下半年持樂觀態度，營運穩健。 ,https://m.cnyes.com/news/id/6117524
997,6117523,〈房產〉2025米其林摘星餐廳出爐  這商圈包辦8家居冠,2025 年米其林星級餐廳名單出爐，但僅台北、台中與高雄的餐廳成功摘星，總計獲得星級評等的餐聽共 53 間，其中有 8 家新面孔。以餐廳所在的區域來分，台北市中山區 19 間入榜居冠。,https://m.cnyes.com/news/id/6117523
998,6117492,臻鼎-KY旗下鵬鼎控股董事會通過淮安園區投資335億元,臻鼎 - KY(4958-TW) 今 (19) 日指出，臻鼎 - KY 旗下鵬鼎控股董事會通過淮安園區投資 2025 下半年至 2028 年將投入人民幣 80 億元 (約 335 億元新台幣) 擴充高階 PCB 產能，搶攻 AI 應用市場。,https://m.cnyes.com/news/id/6117492
999,6117201,南韓第三次年改明年上路！退休金替代率微調至43% 年輕一代負擔加重,,https://m.cnyes.com/news/id/6117201
1000,6117415,高鐵延伸宜蘭環評明召開遭民團批效率低 鐵道局：已備妥資料正面回應,「高鐵 (2633-TW) 延伸宜蘭計畫」環評會議預定明 (20) 日召開，但近期爭議不斷，民團強調將害台鐵少數百億元收入，呼籲交通部爭取直鐵，勿自毀台鐵改革。交通部鐵道局今 (19) 日表示，已備好相關數據、資料回應。,https://m.cnyes.com/news/id/6117415
1001,6117401,晨暉斥資6.5億取得望德斯30%股權 擴大台灣保健品市場,晨暉 (1271-TW) 今 (19) 日宣布，董事會通過策略投資望德斯，斥資新台幣 6.5 億元取得 30% 股權，預計 9 月交割並取得 1 席董事。雙方將透過此次合作，攜手擴大台灣保健品市占，同時分散晨暉既有的代理品牌集中與再授權風險。 ,https://m.cnyes.com/news/id/6117401
1002,6117439,工會不滿郭智輝「讓利說」 中鋼發3點聲明回應,工會不滿郭智輝「讓利說」 中鋼發 3 點聲明回應,https://m.cnyes.com/news/id/6117439
1003,6117413,〈大聯大法說〉Q3營收上看2650億元挑戰新高 關稅將轉嫁給客戶,"IC 通路大廠大聯大 (3702-TW) 今 (19) 日舉行法說會，公司表示，儘管關稅變化導致市場需求時序錯亂，使第二季表現淡季不淡，但在客戶需求驅動下，第三季仍將較上季成長，營收達 2,450-2,650 億元，挑戰單季新高，至於",https://m.cnyes.com/news/id/6117413
1004,6117398,碩禾旗下禾迅菲律賓60MW電廠動工 明年Q1完工併網,碩禾 (3691-TW) 今 (19) 日宣布，再生能源開發子公司禾迅綠電與菲律賓 Wyn Power Corporation 及 Edward Marcs Philippines Incorporated 攜手合作的 Taysa,https://m.cnyes.com/news/id/6117398
1005,6117302,美股廣度擴大 不再只看大型科技股？資金輪動為市場注入新動能,美股近期漲勢衝上歷史新高，顯示投資人除了定義市場的「大型科技股」之外，正開始將目光投向其他領域。這種市場廣度的擴大，預示著更健康的市場動態可能正在浮現。,https://m.cnyes.com/news/id/6117302
1006,6117383,沛波下半年展望樂觀 訂單能見度達明年Q1,沛波下半年展望樂觀 訂單能見度達明年 Q1,https://m.cnyes.com/news/id/6117383
1007,6117306,聯友金屬響應環境部政策 推動台灣關鍵金屬回收生態系,稀有金屬鎢、鈷回收冶煉大廠聯友金屬 (7610-TW) 今 (19) 日舉辦業績發表會，表態支持環境部推動「關鍵及戰略資源國家隊」政策，並宣布將持續強化本土回收技術與產業協作，致力打造台灣關鍵金屬回收再製的永續生態系，提升資源自,https://m.cnyes.com/news/id/6117306
1008,6116051,監測美國經濟衰退 聯準銀行推出「勞動力市場壓力」指標,,https://m.cnyes.com/news/id/6116051
1009,6117303,光隆繼越南、印尼之後將新增孟加拉生產基地 打造彈性與韌性,戶外機能服大廠光隆 (8916-TW) 今 (19) 日召開法人說明會，光隆董事長詹賀博強調，公司將持續推進多產地布局與 ODM 轉型，藉由產地多元化與產品組合優化，打造兼具彈性與韌性的「靈活成衣廠」。,https://m.cnyes.com/news/id/6117303
1010,6117414,台股創高翻黑！掌握輪動脈絡，低估成長股成為獲利關鍵：雙鴻、AES-KY、新應材、台特化、昇陽半,,https://m.cnyes.com/news/id/6117414
1011,6117299,〈凌陽集團法說〉凌陽C5晶片明年底前量產 大搶機器人Edge AI商機,IC 設計業者凌陽 (2401-TW) 今 (19) 日召開法說會，董事長黃洲杰指出，下一代 C5 系統級晶片 (SoC) 將於明年中完成設計定案 (Tape out)，並在明年底前進入量產，鎖定掃地機器人、長照監護、空拍機、無人機與自走機,https://m.cnyes.com/news/id/6117299
1012,6117274,集邦： 電競需求帶動2025年OLED顯示器出貨年增86% 關稅導致美國占比下降,研調機構 TrendForce 最新研究，由於電競需求強勁，加上面板廠、品牌廠積極推廣，帶動 2025 年各區域 OLED 監視器出貨量全面提升，然受到關稅影響，預估歐洲市場的出貨占比將提升至與北美相當，中國市場占比也增至 20% 以上,https://m.cnyes.com/news/id/6117274
1013,6117399,鴻海AI伺服器營收首度超越iPhone　轉型成果全面顯現,,https://m.cnyes.com/news/id/6117399
1014,6117273,研華斥資29億元建置北美新總部 明年Q3完工啟用,研華斥資 29 億元建置北美新總部 預計明年 Q3 完工啟用,https://m.cnyes.com/news/id/6117273
1015,6116993,摩根士丹利：AI熱潮 將讓美股市值將再增16兆美元,,https://m.cnyes.com/news/id/6116993
1016,6117334,美國半導體關稅 100% 底定！有「積」強彈助攻，主動式ETF 搶鏡,,https://m.cnyes.com/news/id/6117334
1017,6117037,美國關稅政策壓力下 印度進口俄油銳減 中國煉油商趁機撿便宜,據《彭博》報導，中國煉油商在 8 月份大幅增加對俄羅斯主力 Urals 原油的採購，抓住印度因華盛頓加徵貿易關稅而放棄的折扣貨源，此舉改變了全球原油流向。,https://m.cnyes.com/news/id/6117037
1018,6116994,AI教父预言成真！AI接手美國一半白領工作、牛津哈佛生或轉行做洗碗工,AI 正在快速取代白領工作，藍領職業卻逆勢走紅。微軟研究顯示，洗碗工、水管工、清潔員等藍領職業，比口譯員、撰稿人等白領更難被 AI 取代，Hinton 預言正在成真。,https://m.cnyes.com/news/id/6116994
1019,6117301,蘋果iPhone 17進入量產階段 鴻海鄭州廠啟動旺季招工,據《中國證券報》周二（19 日）報導，產業鏈人士表示，蘋果 iPhone 17 已進入大規模量產階段。,https://m.cnyes.com/news/id/6117301
