,newsId,title,summary,link
427,6346867,WEF 2026全球風險報告出爐！地緣經濟對抗登頂、AI與氣候危機成未來十年最大隱憂,世界經濟論壇發布《2026 全球風險報告》，指出地緣經濟對抗成當前最大風險，經濟衰退與通膨壓力升溫，AI 技術失控與極端氣候將成未來十年關鍵威脅。報告示警全球正面臨短期動盪與長期危機交織的雙重挑戰。,https://m.cnyes.com/news/id/6346867
428,6347002,OpenAI募資預計破千億美元、估值上看8500億！亞馬遜、軟銀、輝達、微軟齊押注,全球 AI 龍頭 OpenAI 傳出完成新一輪募資首階段，金額上看 1000 億美元，整體估值恐突破 8500 億美元。亞馬遜、軟銀、輝達與微軟成主要策略投資人，資金將投入 AI 基礎設施與雲端布局，創科技史上最大融資案之一。,https://m.cnyes.com/news/id/6347002
429,6347006,南韓前總統戒嚴風波落幕！尹錫悅內亂罪成立判無期徒刑,南韓前總統尹錫悅因 2024 年宣布戒嚴引發政治危機，遭法院判定內亂罪成立並判處無期徒刑。此案被視為檢驗南韓民主體制的重要審判，尹錫悅仍可提出上訴。,https://m.cnyes.com/news/id/6347006
430,6346936,AI資料中心需求爆發！村田製作所擬調漲高階MLCC：需求是產能兩倍,在 AI 基礎建設投資熱潮推動下，全球最大 MLCC 供應商村田製作所評估調漲高階電容價格。受惠於 AI 伺服器需求激增與輝達、AMD 新架構帶動，先進 MLCC 供應恐持續吃緊至 2026 年，市占率高達 70% 的村田成為關鍵受惠者。,https://m.cnyes.com/news/id/6346936
431,6346932,美國AI「壟斷神話」破功？分析師警告：中國「技術衝擊」才剛開始,美國在人工智慧領域的絕對主導地位，正受到前所未有的挑戰。TS Lombard 首席中國經濟學家兼亞洲研究主管 Rory Green 近日在 CNBC 的採訪中直言，美國對科技與 AI 的「被感知的壟斷」已經被中國打破，並警告,https://m.cnyes.com/news/id/6346932
432,6346923,科技股領銜衝鋒！南韓KOSPI指數首度破5600點 創歷史新高,"在春節長假結束後的首個交易日，南韓股市展現強勁爆發力。基準 KOSPI 指數周四 (19 日) 大漲逾 2%，至 5,642.37 點，這是南韓基準指數歷史上首次站上 5,600 點大關。 受到美股科技股隔夜反彈的激勵，南韓股市今年以來的累",https://m.cnyes.com/news/id/6346923
433,6346861,AI超級週期引爆！日經：五大半導體設備廠2026營收重返雙位數成長、訂單能見度看至2027,《日經亞洲》指出，受 AI 晶片擴產與先進製程投資推升，ASML、應用材料、科林研發等全球設備大廠 2026 年營收可望雙位數成長。2025-2027 年晶圓廠設備支出達 1560 億美元，美國成投資新重心，中國成熟製程需求穩健。,https://m.cnyes.com/news/id/6346861
434,6346967,2026中國春晚機器人表演 背後四家領軍企業定義「中國智造」,2026 年馬年春晚落下帷幕，一場名為《武 BOT》的武術節目成為焦點。這場被譽為「史上機器人濃度最高」的表演，交出了目前中國具身智能領域的硬核「科技答卷」。陸媒報導稱，本次節目背後，是 4 家中國機器人領軍企業的實力展現。,https://m.cnyes.com/news/id/6346967
435,6346860,Claude Opus 4.6逼近ASL-4安全門檻！Anthropic示警：AI自我逃逸恐引發全球失控危機,美國 AI 公司 Anthropic 發布《Sabotage Risk Report: Claude Opus 4.6》，警告其最新模型已逼近 ASL-4 安全門檻，可能出現自主逃逸與系統破壞風險。儘管目前風險低但不為零，AI 能,https://m.cnyes.com/news/id/6346860
436,6346815,美股2026年開局乏力 創1995年以來相對於全球市場最差表現,隨著 2026 年第一季度的展開，長期以來被視為全球經濟引擎的美國股市正陷入掙扎。根據高盛的最新數據，美股正經歷自 1995 年以來相對於全球市場表現最差的開局。,https://m.cnyes.com/news/id/6346815
437,6346840,Meta首款AI智慧手錶要來了！「Malibu 2」主打健康追蹤＋AI助理,社群巨頭 Meta 傳出將於今年推出首款 AI 智慧手錶「Malibu 2」，主打健康追蹤與內建 Meta AI 助理。隨著 AI 智慧眼鏡熱銷、AR 與 MR 裝置布局加速，Meta 正全面重啟穿戴式裝置戰略。,https://m.cnyes.com/news/id/6346840
438,6346814,蘋果股票成資金「避風港」！AI資本開支飆升、美股七巨頭股價承壓,"在 AI 資本支出激增、華爾街憂心投資回報之際，蘋果 (AAPL-US) 成為資金避風港。過去一年股價上漲 7.9%，表現優於微軟、亞馬遜與 Meta。隨著科技巨頭合計資本開支高達 6,500 億美元，市場關注蘋果低開支策略與 AI 合作布",https://m.cnyes.com/news/id/6346814
439,6342369,〈觀察〉三大關鍵因素助攻 成熟製程價格迎反彈,成熟製程產業歷經兩年修正後，市場近期明顯回溫，業界觀察指出，本波成熟製程走出谷底，背後有三大關鍵因素推動，包括某種程度的產能排擠效應、終端需求回溫，以及 AI 帶動電源應用放量，在三大關鍵因素匯聚下，產業結構正逐步好轉。,https://m.cnyes.com/news/id/6342369
440,6346922,美媒：美軍最快周末空襲伊朗 但川普尚未做最終決定,根據《CNN》等美媒報導，美軍已做好最快於本周末對伊朗發動軍事打擊的準備。雖然美國總統川普尚未做出最終授權決定，但白宮已獲悉，隨著近日中東地區海空軍力的顯著集結，美軍隨時可以行動。,https://m.cnyes.com/news/id/6346922
441,6346812,中國人形機器人震撼春晚！英媒齊驚呼「智慧革命來了」,數十台中國人形機器人登上春晚舞台，高難度翻跟頭、醉拳動作全程零失誤，引發《衛報》《經濟學人》等英媒震撼報導。宇樹科技展示多機協同與自主起身技術，摩根士丹利預測 2026 年銷量翻倍，馬斯克更直言中國是特斯拉 Optimus 最大,https://m.cnyes.com/news/id/6346812
442,6221336,記憶體推升成本 通訊行估2026年台灣手機均價漲3％ 品牌忠誠度面臨考驗,邁入 2026 年全球經濟與科技產業面臨轉型，受高階晶片與記憶體成本持續攀升影響，全台最大連鎖通訊門市傑昇通信預估今年智慧型手機平均售價將調升約百分之三 。這股由供應鏈轉嫁的成本壓力正直接衝擊終端市場，導致台灣智慧型手機,https://m.cnyes.com/news/id/6221336
443,6346791,陸媒：蘋果傳將長江存儲與長鑫存儲納入核心供應體系,根據中國科技產業媒體《快科技》報導，蘋果 (AAPL-US) 正考慮與中國半導體廠商長江存儲及長鑫存儲展開合作洽談。此舉旨在為即將推出的 iPhone 18 系列以及包含 MacBook 在內的 Mac 電腦產品線，尋求更穩,https://m.cnyes.com/news/id/6346791
444,6345023,〈馬年景氣展望〉液冷散熱趨勢已定 奇鋐、雙鴻及健策大啖商機,輝達新一代平台 Vera Rubin 預計今年下半年推出，原先 GB300 採用液冷與氣冷散熱併行，而 Vera Rubin 將採全液冷散熱，液冷散熱儼然成為主流趨勢。散熱廠奇鋐、雙鴻及健策可望大啖液冷散熱商機。,https://m.cnyes.com/news/id/6345023
445,6346813,加密貨幣避險神話破滅？巴隆：量化緊縮＋AI吸金潮重擊比特幣,在全球流動性收緊與 AI 基礎建設吸金效應下，黃金白銀價格走高，加密貨幣卻持續下跌。2025 年比特幣與以太坊錄得負報酬，市值蒸發 1.3 兆美元。《巴隆周刊》指出，資金正從虛擬資產轉向實體資產，量子運算與政治紅利退潮更為市場增添,https://m.cnyes.com/news/id/6346813
446,6343665,〈AFTEE總座專訪〉「瘋狂科學家」山崎竜彗在台八年的修煉 用技術重新定義BNPL,成立 26 年的日本 BNPL 領導品牌 Net Protections，2021 年於日本東京證交所風光掛牌上市，而進軍台灣 8 年的子公司 AFTEE 今年也迎來一位「技術宅」新任總經理—山崎 竜彗，他從僅有 3 人,https://m.cnyes.com/news/id/6343665
447,6343677,〈AFTEE總座專訪〉97%高通過率+AI風控的底氣 「擴張場景」成上任首要任務,AFTEE 先享後付進軍台灣市場 8 年，角元友樹今年榮升董事長，總座一職交棒給山崎竜彗，集團賦予的首要任務就是「擴大使用場景」，他認為，台灣 BNPL 市場要從開拓期邁向成熟期，尚需 2 至 3 年的時間，,https://m.cnyes.com/news/id/6343677
448,6346790,中國2026春節百億人民幣AI大戰 豆包逆襲笑到最後,2026 年春節，中國 AI 應用賽道競爭進入白熱化。根據最新數據，字節跳動旗下的 豆包 App 在蘋果 App Store 的排名已反超阿里系的千問與螞蟻阿福，成功登頂第一。,https://m.cnyes.com/news/id/6346790
449,6336805,〈名人書單〉廣運成立兩班讀書會 謝明凱推《關鍵決勝力》 並獲啟發,正式接任繼電器廠松川精密 (7788-TW) 總經理的吳頌仁及廣運 (6125-TW) 董事長謝明凱，則分別在訪問中推薦《生存之道》及由大聯大 (3702-TW) 永續長曾國棟所著的《關鍵決勝力》。,https://m.cnyes.com/news/id/6336805
450,6345437,〈名人書單〉新漢林茂昌二刷《資治通鑑》歷史智慧可避開致命錯誤,〈名人書單〉新漢林茂昌二刷《資治通鑑》歷史智慧可避開致命錯誤,https://m.cnyes.com/news/id/6345437
451,6346859,巴菲特卸任前最後布局！波克夏重押紐約時報的背後深意,「股神」Warren Buffett 卸任前最後一季，波克夏買進紐約時報約 510 萬股，市值 3.52 億美元。這筆投資不僅象徵巴菲特與報業的深厚淵源，也,https://m.cnyes.com/news/id/6346859
452,6343042,光通訊產業概述、最具爆發性成長潛力的五檔(一),,https://m.cnyes.com/news/id/6343042
453,6346843,哈塞特怒轟聯準會報告「最糟研究」、要求懲處作者！川普關稅成本90%由美國人埋單？,川普經濟顧問哈塞特批評 Fed 紐約分行報告，稱其研究指 90% 關稅成本由美國企業與消費者承擔的結論「令人羞恥」，並要求懲處作者。事件引發聯準會獨立性爭議，鮑爾、庫克調查與華許提名也成焦點。,https://m.cnyes.com/news/id/6346843
454,6345615,金馬年淘金尋找下一個熱門族群 分析師：創新板小而美具潛力,分析師點名，隨著 Fed 央行降息及貨幣寬鬆政策下，展望 2026 金馬年仍有高點可期，類股部分，投資人可留意創新版公司，在新春開盤，有望在資金、題材持續簇擁下，有望成為漲勢領頭羊。,https://m.cnyes.com/news/id/6345615
455,6346850,Google再掀AI戰火：Gemini音樂模型上線 一句話生成歌曲,Google 周三（18 日）在官網博客中宣布，Gemini 應用已配備旗下最先進音樂生成模型 Lyria 3，用戶可使用文本或圖像製作 30 秒音樂片段。,https://m.cnyes.com/news/id/6346850
456,6346811,〈貴金屬盤後〉金價強彈逾2%  Fed紀要暗示恐升息 美伊、俄烏局勢牽動「地緣政治溢價」,儘管聯準會（Fed）1 月會議紀要顯示暫停降息、甚至不排除未來升息，金價仍反彈逾 2%，站回每盎司 4977 美元。市場同時關注美伊談判與俄烏局勢進展，分析師指出，若地緣政治風險降溫，黃金「地緣政治溢價」恐進一步消退。,https://m.cnyes.com/news/id/6346811
457,6344133,〈馬年景氣展望〉NB及手機需求都可能下滑 光學元件產業看好機器人及無人機應用,由於記憶體缺貨且交易價格不斷向飆漲，市場一直擔心會對包括筆記型電腦及手機資通訊電子產品 2026 年銷售造成影響，研調機構也提出銷售的警訊，相對光學元件產業在應用於兩項資通訊產品的族群形成市場的干擾因素。,https://m.cnyes.com/news/id/6344133
458,6343360,旅平險+海外醫療成出國「標配」 班機延誤4小時即賠6000元超有感,農曆春節 9 天連假引發全民出國熱潮，2/14 桃園機場便湧現近 17 萬人次擠爆航廈，多數旅客目標直指日本，但日韓地區感冒與流感疫情升溫，保險業者提醒，出國天數長，民眾應優先確認旅平險是否包含「海外突發疾病醫療」，建議要含住院、,https://m.cnyes.com/news/id/6343360
459,6346810,〈美股盤後〉AI疑慮降溫美股反彈 那指漲近1%  費半走強、科技七巨頭回神,市場對 AI 顛覆疑慮降溫，美股週三全面反彈，那斯達克漲 0.78%、標普 500 升 0.56%、費城半導體指數上漲近 1%。科技七巨頭走強，資金轉向選股行情。沃爾瑪財報、美伊局勢與油金走勢成市場焦點，華爾街解析 AI 輪動與 2026 年,https://m.cnyes.com/news/id/6346810
460,6346789,〈紐約匯市〉聯準會會議紀要顯露彈性立場 助美元指數攀升至一周高位,在美國聯準會公布 1 月貨幣政策會議紀錄後，美元展現強勁走勢，美元指數攀升至 97.70 附近，創下近一周以來的高點。,https://m.cnyes.com/news/id/6346789
461,6346788,〈能源盤後〉美伊與俄烏局勢膠著 國際油價創10月以來最大單日漲幅,受全球地緣政治局勢高度緊張影響，國際原油價格周三 (18 日) 錄得自去年 10 月以來的最大單日漲幅。交易員正嚴密權衡美伊衝突的潛在風險，以及俄烏談判陷入僵局對全球能源供應的衝擊。,https://m.cnyes.com/news/id/6346788
462,6346787,FOMC會議紀要：內部分歧加大 官員不排除通膨回升時重啟升息,聯邦公開市場委員會 (FOMC) 周三 (18 日) 公布 1 月貨幣政策會議紀要，紀錄顯示，雖然絕大多數官員支持維持利率穩定，但內部對於未來的政策路徑存在明顯分歧。,https://m.cnyes.com/news/id/6346787
463,6346638,中國訪日遊客數量 1月銳減60.7%,,https://m.cnyes.com/news/id/6346638
464,6346567,日本內閣官房長官：上一屆高市內閣全體閣僚將留任,日本內閣官房長官木原稔周三（18 日）在記者會上宣布，第二屆高市早苗內閣中，上一屆內閣全體閣僚將留任。,https://m.cnyes.com/news/id/6346567
465,6345746,AI時代最不能忽視什麼？Anthropic總裁：人文學科,Anthropic 總裁 Daniela Amodei 近日受訪表示，隨著人工智慧 (AI) 快速進化，人文學科的重要性正被重新凸顯，甚至「比以往任何時候都更重要」。,https://m.cnyes.com/news/id/6345746
466,6346534,確定了！高市早苗再度當選日本首相,日本自民黨總裁高市早苗周三（18 日）經國會眾議院和參議院首相指名選舉當選第 105 任首相。,https://m.cnyes.com/news/id/6346534
467,6346351,散戶機會來了！可透過新基金投資SpaceX與Anthropic,Powerlaw (Powerlaw 公司) 計劃在紐約直接上市，讓散戶投資人也能透過公開市場參與 OpenAI、SpaceX、Anthropic 與 Anduril 等知名未上市企業的成長機會。,https://m.cnyes.com/news/id/6346351
468,6346430,輝達出清剩餘Arm持股 為無緣收購畫下句點,《彭博》報導指出，輝達已出售手中最後一批 Arm 持股，正式退出這家晶片技術公司的股東行列。,https://m.cnyes.com/news/id/6346430
469,6346352,洛杉磯港1月貨量年減12% 對陸外銷黃豆大減成主因,美國最大港口洛杉磯港 (Port of Los Angeles) 公布最新數據顯示，今年 1 月整體貨櫃處理量年減約 12%，創下近三年來最低單月表現,https://m.cnyes.com/news/id/6346352
470,6346364,軟體股賣壓後受惠者？分析師點名3檔資安股迎「AI大順風」,據《Yahoo Finance》報導，在 AI 驅動的軟體股拋售潮中，資安類股於 2026 年表現低迷。不過，Wedbush 分析師 Dan Ives 認為，這反而可能創造買進機會。,https://m.cnyes.com/news/id/6346364
471,6345740,美股多頭不安 多重風險訊號同步升溫,美股近期震盪加劇，引發投資人不安。《MarketWatch》指出，即使標普 500 指數距離歷史高點不遠，但那斯達克已連續 5 週收黑，創 2022 年以來最長週線跌勢，市場風險訊號正在升溫。,https://m.cnyes.com/news/id/6345740
472,6346157,日本衛浴巨頭TOTO竟成為AI供應鏈「隱形贏家」,英國維權投資基金 Palliser Capital 近日押注日本衛浴巨頭 TOTO，認為這家以免治馬桶聞名的傳統製造商，正悄悄成為 AI 晶片供應鏈中的「隱形贏家」，股價仍有超過 55% 的上漲空間。,https://m.cnyes.com/news/id/6346157
473,6346306,〈春節何處去〉馬上來走春！6條最新「北北基地質漫遊」秘境曝光 山河海一次擁有,經濟部地質調查及礦業管理中心（下稱地礦中心）於農曆新年前夕發布地質賞析之旅最新系列《北北基生活圈──登上大屯火山．從新角度遊山河海》，針對北北基地區量身打造 6 條主題路線，涵蓋陽明山與觀音山火山、岬灣海岸、南勢溪及基隆河上,https://m.cnyes.com/news/id/6346306
474,6346361,被AI嚇跌後轉向結盟 Infosys宣布攜手Anthropic,據《MarketWatch》報導，Infosys(INFY-US)似乎採取了「打不過就加入」策略，宣布與人工智慧 (AI) 研究公司 Anthropic 合作，協助為客戶部署 AI 代理(AI agents)。,https://m.cnyes.com/news/id/6346361
475,6341901,刮刮樂還有8個2000萬頭獎！財神送錢吉兆刮中1200萬 兄妹檔跟風刮走百萬,全台彩迷注意，目前 2000 萬超級紅包仍有 8 個頭獎尚未現蹤，而 1200 萬大吉利也還有 5 個頭獎機會。近期好運連發，不僅有兄妹檔在直擊他人中獎後，受氣氛感染集資刮中 100 萬元，更有高雄男子因店內財神爺裝飾卡掉落視為吉兆，果真幸,https://m.cnyes.com/news/id/6341901
476,6342304,台積電今年股息24元起跳 股東人數衝破198萬名,台積電 (2330-TW) 日前公布去年第四季每股將配發 6 元現金股利，並預計在今年 6 月 11 日除息，若以台積電過往配息政策穩健增加的路線來看，今年台積電股民每股可領到的現金股利將至少 24 元起跳。,https://m.cnyes.com/news/id/6342304
477,6346383,〈美股13F報告〉傳奇投資人泰珀加碼美光Meta 減持阿里巴巴Whirlpool,傳奇投資人 David Tepper 2025 年第四季 13F 持股申報顯示，他在當季加碼美光與 Meta，同時減碼阿里巴巴與 Whirlpool。,https://m.cnyes.com/news/id/6346383
478,6346422,特斯拉首輛Cybercab下線！沒有方向盤、踏板,特斯拉為自動駕駛計程車服務專門設計的無人駕駛車 Cybercab 已在美國德州超級工廠下線，這款雙門車完全沒有方向盤和踏板，象徵特斯拉在全自動駕駛領域邁出關鍵一步，但其商業化前景仍取決於監管審批進度。,https://m.cnyes.com/news/id/6346422
479,6344756,〈觀察〉電信三雄多角化布局 攻影視商機,電信三雄中華電信 (2412-TW)、台灣大 (3045-TW) 及遠傳 (4904-TW) 除在核心電信業務上表現穩健，也進行多角化布局，紛紛搶攻影視商機。 ,https://m.cnyes.com/news/id/6344756
480,6346378,「這個動作是真正的變盤訊號！」美銀王牌分析師最新示警,在距離美國中期選舉還有 9 個月之際，美銀王牌分析師 Michael Hartnett 在 2 月 15 日最新發布的〈Flow Show〉報告中，將他對市場的警告提升到了一個新的層級。,https://m.cnyes.com/news/id/6346378
481,6346423,美國軍事打擊以來 首個歐洲商業航班抵達委內瑞拉,委內瑞拉首都加拉加斯附近的邁克蒂亞西蒙 · 玻利瓦爾國際機場周二（17 日）顯示，西班牙歐羅巴航空公司一架飛機在當日 21 時許降落，這是自美國今年 1 月對委內瑞拉發動大規模軍事打擊以來首架抵委的歐洲商業航班。,https://m.cnyes.com/news/id/6346423
482,6346368,亞馬遜終止連九跌 此前市值蒸發超過4500億美元,"亞馬遜 (AMZN-US) 週二股價收漲逾 1%，結束連續 9 個交易日下跌走勢，終止一波罕見的長期回檔。此前 9 天跌勢讓亞馬遜市值蒸發超過 4,500 億美元，投資人對公司大幅提高 AI 資本支出的計畫感到憂心，成為",https://m.cnyes.com/news/id/6346368
483,6342882,2026~2027最有機會出現爆發性報酬的三檔股票,,https://m.cnyes.com/news/id/6342882
484,6346411,YouTube初二遭遇全球大規模當機災情,大年初二，YouTube 上午就發生全球性大規模故障，導致不少用戶無法正常觀看影片。,https://m.cnyes.com/news/id/6346411
485,6345384,新任聯準會主席提名掀金融震盪 基金專家：黃金長線仍看多,前聯準會 (Fed) 理事「鷹派代表」的華許獲提名為下任聯準會主席後，金融市場掀起劇烈震盪。華許過去重視通膨控制、講求財政紀律，這與美國川普偏好弱勢美元、低利率環境的政策目標存在落差，貴金屬與加密貨幣全面進入重新訂價。,https://m.cnyes.com/news/id/6345384
486,6346359,10年期美債逼近4% 透露市場對AI有多焦慮？,美股標普 500 指數周二 (17 日) 收盤距離 1 月底創下的歷史收盤高點僅約 1.9%，此前經歷一段明顯跌勢後，午盤在科技股反彈帶動下走高。,https://m.cnyes.com/news/id/6346359
487,6344958,易經解盤2026 陶文：買股不買市成主旋律 點名三大布局方向,以易經卦象解析市場走勢的財經專家陶文指出，【良為山】是 2026 年台股投資求財卦象，整體格局呈現「高檔震盪、個股表現分化」的結構，,https://m.cnyes.com/news/id/6344958
488,6346349,〈美股13F報告〉巴菲特掌舵波克夏最後一季 減碼蘋果 首買《紐約時報》,波克夏 · 海瑟威最新 13F 文件顯示，該公司在 2025 年第四季再度減碼蘋果 (AAPL-US) 持股，並首度建立《紐約時報》 (NYT-US) 新部位。這也是巴菲特卸任執行長前，最後一季的投資調整。,https://m.cnyes.com/news/id/6346349
489,6346350,川普政府宣布日本首波360億美元投資美國計畫,美國總統川普政府週二 (17 日) 宣布三項總值 360 億美元的重大投資計畫，將由日本提供資金，涵蓋能源與先進製造領域,https://m.cnyes.com/news/id/6346350
490,6346387,Sandisk盤後跌逾2% 威騰電子計劃出售持股,據《MarketWatch》報導，威騰電子 (Western Digital)(WDC-US) 正尋求透過出售約一年前分拆的 Sandisk(SNDK-US)持股來變現。消息公布後，Sandisk 股價在周二盤後交易下跌逾 2%。,https://m.cnyes.com/news/id/6346387
491,6346391,高市早苗今將連任首相 估第二屆內閣原班人馬上路,日本第 221 屆特別國會今 (18) 日召集，首相高市早苗預計將在眾參兩院的首相指名選舉中，再度當選首相，並於同日正式成立「第二屆高市內閣」，全體閣僚預料都會留任。,https://m.cnyes.com/news/id/6346391
492,6345459,〈馬年景氣展望〉落地應用成AI發展關鍵 工業電腦看好邊緣AI迎爆發年,落地應用成 AI 發展關鍵 工業電腦看好邊緣 AI 迎爆發年,https://m.cnyes.com/news/id/6345459
493,6345396,美期中選舉倒數 基金專家：2026多元配置穩中求勝,"美國期中選舉進入倒數，川普政府為鞏固民調全力衝刺經濟，推動「大而美法案」（OBBBA）減稅措施箭在弦上，所帶來紅利包括提高標準扣除額、增加兒童抵免、新增老年人扣除額 6,000 美元或青睞。",https://m.cnyes.com/news/id/6345396
494,6346379,春晚最熱場面！宇樹機器人「以武會春」空翻3公尺刷新全球紀錄,2026 年中國央視春晚，最讓人眼前一亮的不是歌舞盛宴，而是一群「iRON Man」驚人登場。宇樹機器人組團現身「舞 BOT」節目就是當晚絕對的「頂流」，直接洗版全網，成為春晚最熱的 AI 名場面。,https://m.cnyes.com/news/id/6346379
495,6346371,蘋果加速布局AI穿戴：智慧眼鏡、吊墜裝置、AirPods同步推進,蘋果正研發三款全新的 AI 穿戴裝置，涵蓋智慧眼鏡、吊墜式 AI 裝置，以及具備 AI 功能的 AirPods。報導稱，這三項產品都將與 iPhone 連動，以 Siri 為核心打造，並搭載相機系統，凸顯蘋果正在加速布局,https://m.cnyes.com/news/id/6346371
496,6346356,〈紐約匯市〉關鍵數據公布前 美元小漲,美元周二 (17 日) 上漲，投資人結束長周末後回到市場，準備迎接更多關鍵經濟數據。,https://m.cnyes.com/news/id/6346356
497,6346362,美伊重啟第二輪核談判 10年期美債殖利率測試4%關口,美國 10 年期公債殖利率週二 (17 日) 回落並逼近 4%，反映市場在 AI 顛覆疑慮升溫之際，資金正重新流向防禦型資產。,https://m.cnyes.com/news/id/6346362
498,6345747,美股正上演「AI驚嚇交易」白領工作末日論升溫,美股近期出現一波由人工智慧 (AI) 恐懼驅動的拋售潮，市場開始反映「AI 可能顛覆白領工作」的末日想像，使得賣壓從企業軟體一路擴散至保險經紀、財富管理、商用不動產，甚至貨運物流等傳統產業。,https://m.cnyes.com/news/id/6345747
499,6346345,輝達Meta擴大GPU合作 將追加數百萬顆AI晶片,輝達 (NVDA-US) 週二 (17 日) 宣布，已與 Meta Platforms (META-US) 簽署一項多年期合作協議，將向 Meta 供應數百萬顆現有與未來的人工智慧 (AI) 晶片，產品範圍不僅涵蓋 AI,https://m.cnyes.com/news/id/6346345
500,6346335,〈美股盤後〉蘋果勁揚超3% 軟體股續跌 道瓊標普近乎持平,美股週二 (17 日) 在震盪交投中小幅收高，投資人持續消化近幾週籠罩市場的 AI 相關不安情緒。科技股比重較高的那斯達克綜合指數盤中一度大跌，但尾盤翻紅，終場上漲 0.1%；標普 500 指數同樣小漲 0.1%；道瓊工業,https://m.cnyes.com/news/id/6346335
