,newsId,title,summary,link
258,6512593,荷姆茲海峽重新通航！WSJ：伊朗打算從海峽重開中 賺取數十億美元通行服務費,,https://m.cnyes.com/news/id/6512593
259,6512624,〈台股盤前要聞〉外資賣壓未止 台幣爆量摜破31.8元、.高通資料中心台廠供應鏈出列,台股盤前要聞,https://m.cnyes.com/news/id/6512624
260,6512654,星艦衝刺高頻發射！SpaceX打造專屬天然氣管線 發射成本再降一步,為支撐星艦發射頻率大幅提升，SpaceX 加速打造自有燃料供應體系，計畫興建長達 8 英里的天然氣管線，並在 Starbase 設置液化甲烷工廠，未來盼自行開採天然氣，以降低發射成本，為火星計畫與 Starlink 衛星部署奠定基礎。,https://m.cnyes.com/news/id/6512654
261,6512579,超預期！台積電2026中國技術論壇登場 估全球半導體今年破兆美元 N2與CoWoS產能狂飆,,https://m.cnyes.com/news/id/6512579
262,6512628,【袁志峰專欄】恒指盤中跌穿23000點,"今日推介 - 長和 (1, $68.5), 目標價 $75.0, 止損價 $65.0",https://m.cnyes.com/news/id/6512628
263,6512647,AI搶走記憶體！繼蘋果後 微軟宣布Xbox又得全面漲價 最高貴150美元,AI 熱潮推升記憶體價格持續飆漲，消費電子產品成本壓力進一步浮現。繼蘋果宣布調漲 MacBook 與 iPad 售價後，微軟也宣布 Xbox 主機 8 月起全面漲價，直言記憶體價格已較過去上漲逾 2.5 倍，且預估 2027 年前還將再翻倍。,https://m.cnyes.com/news/id/6512647
264,6512633,美方劃紅線！盧比歐稱荷姆茲通行費不可接受 美伊分歧仍深,美國國務卿盧比歐 (Marco Rubio) 周四 (25 日) 重申，美國希望透過談判與伊朗達成協議，為雙方衝突畫下句點，但不會「不惜任何代價」換取和平，並強調荷姆茲海峽 (Strait of Hormuz) 絕不應成為伊朗收取通行,https://m.cnyes.com/news/id/6512633
265,6512567,為特斯拉、Waymo自駕車鋪路！美媒：運輸部擬取消Robotaxi配備剎車踏板規定,,https://m.cnyes.com/news/id/6512567
266,6512632,蘋果晶片大轉彎！傳跳過M6高階版 全力衝刺AI導向M7系列,《彭博》周四 (25 日) 引述知情人士報導，蘋果 (AAPL-US) 正準備對 Mac 晶片發展策略進行歷來最大調整之一，計劃推出基礎版 M6 晶片後，罕見跳過 M6 Pro 與 M6 Max 等高階版本，改由全新 AI 導向的 M7 系列接棒，以加快,https://m.cnyes.com/news/id/6512632
267,6512625,伊朗開酸川普：美國只會出口黃豆、跳票承諾和講垃圾話,伊朗國會議長卡利巴夫 (Mohammad Bagher Ghalibaf) 周四 (25 日) 公開駁斥川普政府有關伊朗解凍資產將用於購買美國農產品的說法，並以嘲諷口吻批評美方多年來對伊朗的不信任與承諾落空，再度凸顯美伊雙方即便達,https://m.cnyes.com/news/id/6512625
268,6512614,鉅亨速報 - Factset 最新調查：高通QCOM-US的目標價調升至220元，幅度約4.76%,FactSet 最新調查：高通QCOM-US目標價調升，最高估值、最低估值、中位數、綜合評級、近5日股價、標普、即時新聞資訊,https://m.cnyes.com/news/id/6512614
269,6511254,川普政府替華許開綠燈升息？分析師：財長貝森特已釋放明確訊號,,https://m.cnyes.com/news/id/6511254
270,6511254,川普政府替華許開綠燈升息？分析師：財長貝森特已釋放明確訊號,,https://m.cnyes.com/news/id/6511254
271,6512531,美國5月核心資本財訂單勁升1.6% 企業投資動能強勁,美國商務部周四 (25 日) 公布數據顯示，被視為企業投資風向球的核心資本財訂單 (Core Capital Goods Orders) 在 5 月強勁反彈，增幅遠優於市場預期，顯示企業設備支出仍具韌性，並有望持續支撐美國第二季經濟成,https://m.cnyes.com/news/id/6512531
272,6512379,美上周初領失業金人數意外降至21.5萬 Fed鷹派預期升溫,美國勞工部周四 (25 日) 公布最新數據顯示，上周初領失業救濟金人數意外大幅下降，顯示美國就業市場依舊展現韌性，進一步支撐市場對聯準會 (Fed) 維持鷹派立場的預期。不過，持續申領失業救濟金人數攀升至 3 個月高點，也反映部分失業,https://m.cnyes.com/news/id/6512379
273,6512380,AI投資撐場！美國第一季GDP上修至2.1% 消費支出卻近乎停滯,美國商務部周四 (25 日) 公布第一季國內生產毛額 (GDP) 終值報告，顯示美國經濟成長速度較先前預估更為強勁，但作為經濟主要引擎的消費支出幾乎停滯，反映企業投資與人工智慧 (AI) 相關支出正成為支撐美國經濟的重要動能。,https://m.cnyes.com/news/id/6512380
274,6512532,香奈兒在列！26批進口化妝品入中國海關總署黑榜,近日中國海關總署公布的 5 月未准入境食品、化妝品訊息顯示，當月共有 26 批次進口化妝品未能通過檢驗檢疫，被依法退運或銷毀。,https://m.cnyes.com/news/id/6512532
275,6512557,AI需求續旺！美光開盤大漲近19% 市值一度超越Meta,美光 (MU-US) 受惠於人工智慧 (AI) 基礎建設需求持續升溫，第 3 季財報與本季財測雙雙優於市場預期，帶動股價周四 (25 日) 開盤後大漲近 19%，市值一度突破 1.39 兆美元，超越 Meta Platforms(META-US),https://m.cnyes.com/news/id/6512557
276,6512378,〈美股早盤〉美光財測點燃AI信心 主要指數開高科技股領漲,美股周四 (26 日) 開盤走高，美光 (Micron) 亮眼財報與樂觀展望提振市場對人工智慧 (AI) 投資熱潮的信心，高通 (Qualcomm) 同步上調長期營收目標，也進一步帶動晶片股走強。另一方面，美國 5 月 PCE 通膨數據符合市場預,https://m.cnyes.com/news/id/6512378
277,6512516,AI帶動記憶體飆漲！蘋果宣布多項產品漲價 成本轉嫁消費者,蘋果 (AAPL-US) 周四 (25 日) 宣布調漲多項硬體產品售價，包括 Mac、iPad、HomePod、Apple TV 以及 Vision Pro 頭戴裝置，理由是人工智慧 (AI) 資料中心建設熱潮推升記憶體與儲存晶片價格,https://m.cnyes.com/news/id/6512516
278,6512458,駕駛人注意了! 6/30起交通新制上路 無照重考需先至駕訓班上課、汽車筆試改全選擇題,交通部公路局今 (25) 日宣布，自下周 6 月 30 日起，實施「吊銷禁考 3 年以上重考前須完成駕駛訓練課程」及「汽車駕照筆試改採全選擇題考照，並首納危險感知情境影片題」共 2 項新制上路，也首度納入危險感知情境影片題與速度管理觀念。,https://m.cnyes.com/news/id/6512458
279,6512381,創逾3年高點！美5月PCE年增率衝上4.1% 市場續押Fed於9月升息,美國 5 月通膨升至逾三年來最高水準，但消費支出與所得同步成長，顯示在伊朗戰爭引發的能源價格衝擊下，美國家庭仍展現一定韌性。不過，持續升溫的物價壓力也讓市場進一步押注聯準會 (Fed) 今年將重啟升息，儘管近期油價已隨美伊和平談,https://m.cnyes.com/news/id/6512381
280,6512450,AI持續「燒錢」？PIMCO揭3大力量主導全球經濟 迎向14兆美元超級資本支出,全球主動式固定收益領導品牌 PIMCO（品浩）指出，未來 5 年將由地緣政治、分裂趨勢與 AI 人工智慧等關鍵力量持續主導全球經濟 。其中，AI 基礎建設的建置、國防支出提升以及能源安全投資，預計未來 5 年將帶動全球新增高達 14 兆美元,https://m.cnyes.com/news/id/6512450
281,6512416,不滿產量限制？伊拉克一度揚言退出OPEC,在石油輸出國組織 (OPEC) 與盟友正重新檢視成員國產能基準之際，伊拉克一度傳出可能因產量配額爭議退出 OPEC，引發市場關注。不過伊拉克政府隨後迅速出面澄清，強調退出 OPEC 並非官方立場，但同時重申，希望獲得更高的原,https://m.cnyes.com/news/id/6512416
282,6512454,金管會：檢查局進駐國泰投信金檢 兼職問題應回歸公司治理,國泰投信因利害關係人內控疏失導致旗下全委及基金慘賠，外界關切國泰金控 (2882-TW) 子公司是否出現橫向聯繫失靈，以及國泰世華銀行董事長郭明鑑兼職家數是否過多。對此，金管會官員今 (25) 日例會上表示，,https://m.cnyes.com/news/id/6512454
283,6512425,AI狂潮助攻！全體券商前5月狂賺1175億元 超越去年全年,AI 浪潮席捲台股，推升大盤指數頻創新高，更引爆市場交易屢創天量。根據證交所最新統計，全體證券商迎來大豐收，今年前 5 月累計稅後純益達 1175.18 億元，較去年同期狂飆 4.34 倍,https://m.cnyes.com/news/id/6512425
284,6512490,"鉅亨速報 - Factset 最新調查：美光科技(MU-US)EPS預估上修至73.1元，預估目標價為1,500.00元",FactSet 最新調查：美光科技(MU-US)EPS預估上修，預估EPS、預估營收、目標價、歷史獲利表現、即時新聞資訊,https://m.cnyes.com/news/id/6512490
285,6512483,鉅亨速報 - Factset 最新調查：美光科技MU-US的目標價調升至1500元，幅度約25%,FactSet 最新調查：美光科技MU-US目標價調升，最高估值、最低估值、中位數、綜合評級、近5日股價、標普、即時新聞資訊,https://m.cnyes.com/news/id/6512483
286,6512451,AI派對要散場了？美銀：這些被遺忘類股準備怒吼,美銀 (BofA)(BAC-US) 歐洲股票策略主管 Sebastian Raedler 警告，若當前由人工智慧 (AI) 帶動的市場熱潮出現鬆動跡象，投資人應將目光轉向防禦型類股，包括民生消費與製藥等傳統產業，因為這些產業的基本面,https://m.cnyes.com/news/id/6512451
287,6512375,〈台幣〉外資續倒貨！失守31.8貶至2個多月新低 再創史上第七大巨量,外資繼昨日狂賣台股 1744 億元後，今 (25) 日持續倒貨逾 400 億元，外資一面倒匯出，匯市也仍在消化昨日的賣壓，,https://m.cnyes.com/news/id/6512375
288,6512374,外資賣超405億元  高檔調節記憶體股大砍力積電8.7萬張 三天賣台積電4.7萬張,"台股最後一盤在台積電遭大砍 1.16 萬張賣壓下，終場以小漲 211 點作收，收 46,255 點，成交量縮減至 1.31 兆元。外資今日賣超台股 405.1 億元，已連 3 日大賣台股 2,565 億元，外資今日大砍力積電 8.79 萬張最高。",https://m.cnyes.com/news/id/6512374
289,6512420,東北亞搭上AI順風車！這家記憶體大廠超車豐田成日本市值第一,受惠於全球人工智慧基礎設施投資浪潮，日本半導體供應鏈展現強勁成長動能 。日本記憶體大廠鎧俠憑藉 NAND Flash、企業級 SSD 與 AI 資料中心儲存需求的急速崛起，市值在 6 月中旬正式超越豐田汽車，榮登日本市值排名第一的企業,https://m.cnyes.com/news/id/6512420
290,6512414,債市又誤判Fed？市場狂押升息 專家卻喊準備降息,美國聯準會 (Fed) 新任主席華許 (Kevin Warsh) 上任後展現強硬抗通膨立場，帶動市場重新評估利率路徑。然而，債券市場與華爾街機構對未來政策走向的看法卻出現明顯分歧。,https://m.cnyes.com/news/id/6512414
291,6512415,台船拚海鯤號下半年原型艦交艦 全年營運轉盈,台船拚海鯤號下半年原型艦交艦 全年營運轉盈,https://m.cnyes.com/news/id/6512415
292,6512370,輝達800V電源架構Q3起備貨 Rubin Ultra世代擴大採用,TrendForce 今 (25) 日表示，輝達 (NVDA-US) 正積極打造自家 800V HVDC Power Rack 方案，目標於 2026 年第三季完成備貨，提供客戶選配。從各機櫃的功耗設計來看，NVIDIA 800V Pow,https://m.cnyes.com/news/id/6512370
293,6512349,〈房產〉央行打炒房管制不動如山 不動產聯盟總會提七大建言籲政策回歸精準管理,央行在 6 月 18 日召開的理監事會並無對第七波房市信用管制措施，也讓相關不動產業者急跳腳，不動產聯盟總會今 (25) 日指出，全台不動產產業目前已缺乏流動性，部分政策已由抑制投機擴大至影響正常產業運作與合理居住需求。,https://m.cnyes.com/news/id/6512349
294,6512348,世紀風電換股100%併購世紀樺欣 並更名為「世紀能源設備」攻AI電力商機,世紀風電今日召開重訊記者會宣布將以發行新股方式，100% 併購世紀樺欣。同時，為從離岸風電跨足全方位能源設備市場，搶攻 AI 帶來的電力需求商機，同步決議修改公司章程，擬將公司更名為「世紀能源設備股份有限公司」。 ,https://m.cnyes.com/news/id/6512348
295,6512239,利關人疏失！國泰投信8檔基金從優補償逾5萬人、4.9億元 6/29起入帳,國泰金控 (2882-TW) 旗下國泰投信因「利害關係人內控疏失」導致基金誤買管制股票，公司先前已經針對全權委託帳戶認賠 4.54 億元，旗下 8 檔主動式基金也已重算淨值,https://m.cnyes.com/news/id/6512239
296,6512243,威強電高階專案相繼放量挹注動能 邊緣AI切入半導體設備管理,威強電高階專案相繼放量挹注動能 邊緣 AI 切入半導體設備管理,https://m.cnyes.com/news/id/6512243
297,6512280,IBM推出全球首款1奈米以下晶片技術 盤前股價噴超6%,IBM (IBM-US) 週四 (25 日) 宣布推出全球首款 1 奈米以下 (Sub-1nm) 晶片技術，採用全新 0.7 奈米 (7 埃) 製程節點與革命性的「Nanostack」三維電晶體架構,https://m.cnyes.com/news/id/6512280
298,6512240,華邦電、大立光、友達、七月黑馬股誰將接棒？,,https://m.cnyes.com/news/id/6512240
299,6512204,宏易更名天意能創 使命在打造「水與綠電能源」永續基礎建設整合,面對 AI、高科技製造擴張與淨零轉型潮，缺水、缺電與碳管理壓力已成為全球產業營運的新課題，上櫃的宏易 ((4530-TW) 配合企業策略轉型與營運整併，依昨日股東會決議，將申請變更登記為「天意能創股份有限公司」。,https://m.cnyes.com/news/id/6512204
300,6512004,華南銀行3分行前行員挪用客戶資金 金管會開罰800萬元,金管會今 (25) 日公布對華南銀行裁處案，因旗下 3 家分行陸續爆發行員挪用客戶款項、私自留置結帳溢額款項等事件,https://m.cnyes.com/news/id/6512004
301,6512209,童子賢：AI對精密度要求「倍增再倍增」 整體零組件產能比想像中更吃緊,和碩董事長童子賢今日指出，AI 帶動高速、精密運算需求，而客戶對精密度的要求也是倍增以上，甚至「double 再 double」，整體零組件產能比想像中還不足，除記憶體供貨吃緊，其他如散熱器、IC 載板等供貨也都面臨短缺。 ,https://m.cnyes.com/news/id/6512209
302,6512211,守住46000就安全？量價背離加劇外資空方佈局，技術性拉回究竟是陷阱還是下一波卡位契機？,,https://m.cnyes.com/news/id/6512211
303,6512068,OPEC創始會員國也想走？伊拉克不滿配額過低 不排除退群,,https://m.cnyes.com/news/id/6512068
304,6512069,減稅大紅包來了！明年未成年子女免稅額「倍增」至15.15萬 最高現省2.02萬,婚育家庭迎減稅大紅包。行政院院會今 (25) 日通過減稅利多，為幫育兒家庭減輕生活重擔，祭「有感」減稅措施，調高家中有未成年子女的免稅額度，幅度高達 50%。調整最快在明年 5 月報稅時適用，全台灣預計有 237 萬人可以享受到這筆減,https://m.cnyes.com/news/id/6512069
305,6512009,賴清德：今年中央總預算若通過 台灣經濟表現會更好,賴清德於南投出席「集集線全線通車典禮」時，對於今 (2026) 年度中央政府總預算案尚未通過，他希望朝野立委共同支持，讓中央總預算案盡速完成審議並通過，尤其目前台灣正值梅雨季，若發生災害，恐影響政府救災工作的推動。,https://m.cnyes.com/news/id/6512009
306,6512002,記憶體雙雄爭搶美國資本！今年狂漲800%的鎧俠 將與SK海力士連袂赴美發行ADR,,https://m.cnyes.com/news/id/6512002
307,6512003,台積電專利戰開打、半導體過熱？龔明鑫力挺法務團隊 點破免恐慌2大關鍵,經濟部長龔明鑫今（25）日表示，針對市場關切的 AI 與半導體過熱疑慮，強調短期波動難免，但基本面依舊穩健且成長快速。同時，面對台積電 (2330-TW) （TSM-US) 在美面臨專利訴訟，他對其法務團隊表達高度信心，認為,https://m.cnyes.com/news/id/6512003
308,6511996,漢翔拓高階航空複材版圖 洽談海外新商機,漢翔拓高階航空複材版圖 洽談海外新商機,https://m.cnyes.com/news/id/6511996
309,6511156,〈陸港盤後〉滬指一度轉跌 三大指數走高,中國 A 股三大指數 25 日（周四）開盤漲跌互見，盤初指數分化，滬指窄幅震盪，深市衝高回落，創指一度轉跌。午前券商股拉升，帶動兩市攜手上漲。午後指數重回分化走勢，滬指一度轉跌，深市則震盪上行。,https://m.cnyes.com/news/id/6511156
310,6511945,觀光國家隊前進澳紐三城 吸引300位澳紐旅遊業者參與,觀光署看準澳紐市場強勁復甦動能，於 6 月 17 日至今 (25) 日，攜手旅行社、飯店、航空公司及文化團體等，前往澳洲雪梨、墨爾本及紐西蘭奧克蘭舉辦三場「台灣觀光推廣會」。,https://m.cnyes.com/news/id/6511945
311,6511947,研調：2026年GenAI智慧型手機將占全球出貨量45% Gemini逐步為核心架構,研調機構 Counterpoint Research 指出，具備生成式 AI（GenAI）功能的智慧型手機預計將占 2026 年全球智慧型手機出貨量的 45%，高於 2025 年的 36%。不過，記憶體供應持續緊張，預計將使 2026 年全球,https://m.cnyes.com/news/id/6511947
312,6511940,台亞強攻第三代半導體不打價格戰 兩大子公司下半年接棒登資本市場,台亞 (2340-TW) 今日召開股東常會，首度與旗下星亞視覺 (7753-TW)、和亞智慧 (7825-TW) 及積亞半導體 (7787-TW) 與冠亞半導體等子公司共同召開。董事長李國光面對財務虧損表示，這並非經營衰退,https://m.cnyes.com/news/id/6511940
313,6511427,黃金跌入技術性熊市 ETF湧賣壓、只剩央行苦撐,,https://m.cnyes.com/news/id/6511427
314,6511899,銀樓黃金爆買氣 晚5個月買1兩現省2.1萬元 石文信喴國際金價4000美元就該搶啦,國際現貨金價因受到美國聯準會（Fed）年底可能轉向鷹派升息的預期衝擊，導致市場沉重賣壓湧現，金價大跌突破每盎司 4000 美元整數關卡，今（25）日最低一度下探至 3958.76 美元，終場收在 4000.42 美元。新台幣計價的黃,https://m.cnyes.com/news/id/6511899
315,6511907,鉅亨投資雷達》AI浪潮接棒弱日圓紅利，日股基金迎來基本面行情,,https://m.cnyes.com/news/id/6511907
316,6511274,短期供過於求！受困油輪陸續解封 布蘭特原油罕見轉正價差 ,,https://m.cnyes.com/news/id/6511274
317,6511903,市場快訊》AI行情熄火了嗎？美股重挫背後的三個關鍵訊號,,https://m.cnyes.com/news/id/6511903
318,6511894,營邦聚焦AI基建三大動能 看好今年成長雙位數,機殼廠營邦 (3693-TW) 今 (25) 日召開股東會，指出受惠 AI、雲端以及高效能運算需求持續成長，持續聚焦 AI 基礎設施三大成長動能，並深化與全球策略夥伴合作，推動長期穩健成長，預期今年將成長雙位數百分比。 ,https://m.cnyes.com/news/id/6511894
319,6511815,谷歌AI防線失守！Transformer元老集體出走 半個AI圈成為親手養的對手,,https://m.cnyes.com/news/id/6511815
320,6511850,星舟快充推SPASS充電訂閱方案 瞄準通勤商機,泓德能源 (6873-TW) 旗下星舟快充今 (25) 日宣布推出全新充電訂閱方案「SPASS（STAR CHARGER PASS）」，搶攻純電車主高頻通勤族，以「充電月票」概念鎖定北、中、南逾 117 座核心生活圈與停車場充電,https://m.cnyes.com/news/id/6511850
321,6511239,金價跌破4000美元 但還不是逢低「淘金」的時候,"黃金今年開局氣勢如虹，延續去年強勁漲勢，截至 1 月底盤中一度飆升近 30%，創下每盎司約 5,600 美元歷史新高。如今，這個高點彷彿已成遙遠回憶。",https://m.cnyes.com/news/id/6511239
322,6511827,AI帶動儲能需求 立凱-KY建10萬噸產能 拚2028年轉盈,鋰電池材料廠立凱 - KY (5227-TW) 今 (25) 日舉行股東會，董事長張聖時表示，美國等市場正迎來儲能電池爆發性成長，加上 AI 資料中心用電需求提升，帶動太陽能搭配儲能方案加速發展，立凱 - KY 也加速推進台灣磷酸鐵前驅體建,https://m.cnyes.com/news/id/6511827
323,6511824,工研院菁英獎出爐 AI、衛星通訊與淨零技術受矚,工研院今 (25) 日公布素有「工研院奧斯卡獎」美譽的工研菁英獎得獎名單，今年共有 3 項「傑出研究獎」及 2 項「產業化貢獻獎」金獎技術脫穎而出。獲獎技術橫跨 AI、次世代通訊與淨零永續等關鍵領域，精準切入廠商核心痛點。,https://m.cnyes.com/news/id/6511824
324,6511820,凌巨股東會臨時動議通過提前改選董事 將在9月底前全面改選,中小型面板廠凌巨 (8105-TW) 今 (25) 日召開股會，會中除通過 114 年度營業報告書、財務報表及盈餘分派案等多項重要議案外，也完成股東提案解任董事呂昕晨，以及臨時動議股東提案全面改選董事，將在 9 月底前全面改選。,https://m.cnyes.com/news/id/6511820
325,6511779,高通AI資料中心報捷 供應鏈聯電、南亞科受惠,高通 (QCOM-US) 今 (25) 日宣布資料中心解決方案獲得 META 採用，雙方達成多年策略合作，內文點出 35 家供應商，當中包含多家台廠，如聯電(2303-TW)(UMC-US)、南亞科(2408-TW)、仁寶(2324-T,https://m.cnyes.com/news/id/6511779
326,6511787,國泰金高層風暴未歇 蔡鎮宇以股東、霖園蔡家成員身分發出沉重聲明,國泰金控 (2882-TW) 高層肢體衝突事件後持續延燒！前副董事長蔡鎮宇於 23 日前往國泰世華辦公大樓，與銀行董事長郭明鑑發生口角並肢體拉扯，驚動警方到場處理。雖然國泰世華銀 24 日緊急發表四點聲明澄清,https://m.cnyes.com/news/id/6511787
327,6511746,〈台股盤後〉台積電尾盤遭狙擊摜至平盤 漲點收斂至211點 堅守4萬6大關,"台股在 &#39; 記憶體、ABF 載板及被動元件族群的強勢表態下，開盤大漲近 750 點、攻上達 46,785 點，觸及 5 日線，盤中在權值股賣壓沉重下維持高檔震盪上揚，終場收 46,255.26 點、上漲 211.66 點或 0.46%。",https://m.cnyes.com/news/id/6511746
328,6511816,美光史上最強財報出爐 千億美元長約在手、平息AI泡沫疑慮,記憶體大廠美光 (MU-US) 週三 (25 日) 盤後釋出超強業績成績單，讓市場重新評估 AI 投資熱潮的基本面支撐，也暫時平息外界對 AI 泡沫化的疑慮。,https://m.cnyes.com/news/id/6511816
329,6511777,市值排位賽爭奪老六 聯電4天飆漲27%後整理 國巨大漲高調擊退,晶圓代工廠聯電 (2303-TW) 近期股價動能極為強勁，拉出連續四日上漲的噴發行情，短線波段漲幅已高達 27.14%，帶動市值衝上 2.24 兆元來到台股市值排行第七名，而位於第六名的國巨 (2327-TW)，今日逼近漲停，市值衝,https://m.cnyes.com/news/id/6511777
330,6511814,AI掀併購狂潮！高盛半年狂吸逾1兆美元 震撼華爾街,,https://m.cnyes.com/news/id/6511814
331,6511780,微信這次賭上全部！AI助理小微上線 14億用戶流量秩序重寫,,https://m.cnyes.com/news/id/6511780
332,6511776,〈燁輝股東會〉內銷短期面臨庫存壓力Q3求穩 外銷衝刺美國及中東市場,燁輝內銷短期面臨庫存壓力 Q3 求穩 外銷衝刺美國及中東市場,https://m.cnyes.com/news/id/6511776
333,6511676,超過40億千瓦！全球能源領域又一里程碑,截至 2026 年 5 月底，中國發電裝機容量達到 40.1 億千瓦，超過美國、歐盟、印度、日本、俄羅斯發電裝機總和。,https://m.cnyes.com/news/id/6511676
334,6511215,市場憂AI泡沫 Stifel反喊「續抱AI資本支出概念股」,"投行 Stifel 仍選擇站在多頭陣營，並上調標普 500 指數年底目標至 7,800 點，認為企業獲利成長動能足以支撐美股續創新高。",https://m.cnyes.com/news/id/6511215
335,6511718,海空都熱！捷迅樂看美線海運一路旺至年底 空運將再漲價,海空都熱！捷迅樂看美線海運一路旺至年底 空運將再漲價,https://m.cnyes.com/news/id/6511718
336,6511711,〈台灣醫療展開展〉AI手術盤點與抗癌新藥亮相！10項台灣專利搶高齡與數位醫療商機,經濟部智慧財產局表示，為促進台灣創新技術加速商品化並鏈結產業通路，將於 6 月 25 日至 27 日的台灣國際醫療暨健康照護展設立台灣專利超級站專館，今年針對全球高齡化與數位醫療趨勢，再度精選 10 項兼具創新性與商品化潛力的優良專利，,https://m.cnyes.com/news/id/6511711
337,6511712,興櫃明添新兵悍將 碩通去年賺近2個股本 已打入散熱模組大廠供應鏈,碩通將於明日登錄興櫃，受惠 AI 伺服器需求暢旺，碩通 2025 年營收 9.16 億元，稅後純益 1.98 億元，每股純益 19.55 元。碩通指出，目前已是 Tier 1 液冷大廠的主力供應商，也陸續打入多家國內外指標散熱模組廠的供應鏈。 ,https://m.cnyes.com/news/id/6511712
338,6511681,〈台灣醫療展開展〉貿協：AI加速導入醫療有望領台灣邁向下個科技世代,醫療暨健康照護展今 (25) 日起至 27 日於台北世貿一館登場，今年共來自 13 個國家及地區業者參展，預計帶來 700 位國際買主。貿協董事長黃志芳表示，今年醫療展結合 AI 科技應用，共同打造三大主題館。,https://m.cnyes.com/news/id/6511681
