,newsId,title,summary,link
504,6509944,每月10萬職缺搶AI人才！104曝關鍵「硬」技能：這種人非工程職卻起薪溢價69%,104 人力銀行旗下「104 學習」今 (24) 日發布《104 AI 人才趨勢報告》，2026 年企業每月平均招募 AI 人才高達 10 萬人，其中非工程職的需求急起直追，專案或產品管理、業務銷售等職缺的 AI 月均工作機會在 5 年內成長超過 2,https://m.cnyes.com/news/id/6509944
505,6509896,中砂鑽石碟、再生晶圓兩大業務擴產 全年營收戰百億元,中砂 (1560-TW) 受惠 AI 帶動半導體需求提升，為因應鑽石碟、再生晶圓等半導體業務訂單熱絡，包括鑽石碟、再生晶圓都已啟動擴產，預期下半年隨著新產能開出，下半年營運將優於上半年，法人預估，中砂今年營收將挑戰百億元大關。,https://m.cnyes.com/news/id/6509896
506,6509955,千點拉回免驚，緊抱這產業幫你提前卡位Q3行情！,,https://m.cnyes.com/news/id/6509955
507,6509917,AI熱潮燒到2028年 三星飆漲逾10%領軍韓股反攻 美銀大幅上調半導體目標價,韓國記憶體雙雄 24 日強勢反攻，三星電子盤中一度飆逾 10%，SK 海力士漲逾 5%，帶動韓股漲逾 4%。市場除押注三星庫藏股計畫外，多家華爾街投行同步上調半導體產業展望，看好 AI 投資熱潮將延續至 2028 年甚至更久。,https://m.cnyes.com/news/id/6509917
508,6509561,史上第一人！C羅連六屆世界盃進球,美加墨世界盃 K 組第二輪，C 羅對陣烏茲別克破門，打進個人本屆世界盃第一個進球！隨後 C 羅又接 B 費助攻，低射破門梅開二度！,https://m.cnyes.com/news/id/6509561
509,6509918,豆包正式推出付費專業版！月費最高人民幣500元  在校大學生享38元特惠,,https://m.cnyes.com/news/id/6509918
510,6509560,以色列證實向伊朗偷運數萬「星鏈」 試圖顛覆伊朗政權,以色列前總理貝內特 23 日（周二）在耶路撒冷的一場公開活動上承認，2021 年至 2022 年擔任總理期間曾採購數萬台「星鏈」接收器，並偷運入伊朗，幫助反政府抗議者推翻伊朗政權。,https://m.cnyes.com/news/id/6509560
511,6509569,晶片股血洗！那指蒸發1兆美元 專家激辯：AI泡沫將破裂還是「最佳買點」？,全球晶片股遭遇獲利了結賣壓，SK 海力士、三星電子、美光、AMD 與英特爾股價重挫，那斯達克 100 市值一度蒸發逾 1 兆美元。面對 AI 概念股大跌，華爾街包括 Jim Paulsen、Andrew Slimmon、Dan Ives 與,https://m.cnyes.com/news/id/6509569
512,6507060,〈焦點股〉川普簽署量子運算行政命令 金寶爆量衝漲停,美國總統川普簽署 2 項聚焦量子電腦運算的行政命令，目標在 2028 年前，打造商業級量子電腦。金寶董事長許介立指出，量子電腦是金寶想發展的重要方向，且已投資美國量子硬體製造商 SEEQC，激勵金寶今 (24) 日爆量衝漲停。 ,https://m.cnyes.com/news/id/6507060
513,6509644,〈台股開盤〉崩跌千點 電子權值股賣壓沉重 退守4萬6,"台股今 (24) 日受美股四大指數皆收黑，科技股為主的費半更崩跌近 8%，開盤受電子權值股走弱影響，隨即爆跌 1,053 點跌破 4 萬 7 千點大關，最低來到 46,047 點跌幅超過 2%，也跌破 5 日線。",https://m.cnyes.com/news/id/6509644
514,6509815,A股PCB族群反彈在望！輝達出面闢謠要求降價10% 勝宏科技亦駁斥Rubin延期傳聞,,https://m.cnyes.com/news/id/6509815
515,6509875,韓亞航空12/16退出星空聯盟 旅客權益一次看,韓亞航空 12/16 退出星空聯盟 旅客權益一次看,https://m.cnyes.com/news/id/6509875
516,6509849,〈焦點股〉艾笛森漲價效應發酵 股價連4日飆漲逾2成創波段新高,LED 廠艾笛森 (3591-TW) 受惠於近期宣布第二度漲價，市場看好帶動艾笛森獲利走強，近期吸引買盤進駐，今 (24) 日早盤最高攻上 38.8 元，漲逾 3%，自 6/17 起漲以來，連四個交易日股價漲幅逾 21%。,https://m.cnyes.com/news/id/6509849
517,6509590,紐時記者新書披露！馬斯克極擔憂共軍攻台風險,根據周二（23 日）出版一本關於美國總統川普第二任期的最新著作，全球首富馬斯克去年在白宮舉行的一場科技業執行長會議上，極為擔憂台灣在晶片市場的壟斷地位，以及共軍攻打台灣的風險。,https://m.cnyes.com/news/id/6509590
518,6509862,台股拉回不是危機！下一波資金將流向這些族群,,https://m.cnyes.com/news/id/6509862
519,6509745,美財長貝森特重塑「強勢美元」定義：非關匯率  重點在投資環境,,https://m.cnyes.com/news/id/6509745
520,6509625,全球晶片股遭遇黑色星期二 AI交易只是技術性調整？,全球晶片股周二 (23 日) 被韓國打了個措手不及。一位華爾街策略師將這場暴跌稱為「晶片慘劇」（chip-wreck）。最先崩盤的是今年的「全球最牛股市」——韓國 KOSPI 指數單日暴跌 10%，多次觸發熔斷。,https://m.cnyes.com/news/id/6509625
521,6507059,喬山股東會通過4.5元現金股利 2-4年內拚全球商用市占70%、家用市占30%,健身器材廠喬山 (1736-TW) 今 (24) 日召開股東會，會中通過盈餘分派案，配發每股 4.5 元現金股利。董事長羅崑泉指出，2025 年喬山全球商用市場年增 20%，將以全球商用市占 70%、家用中長期市占 30% 為目標。 ,https://m.cnyes.com/news/id/6507059
522,6509624,進泰電子營收轉正成長 擬發行7000張現增股籌資案申報生效,音訊產品供應商進泰電子 (3465-TW) 擬發行 7000 張現增股自市場籌資，在近期向金管會送件後於今 (24) 日申報生效，進泰電子的此一籌資案主辦券商爲富邦證券，現增案暫訂以每股 28 元溢價發行。,https://m.cnyes.com/news/id/6509624
523,6509396,界霖AI訂單看到明年 本月起漲價1至3成,功率導線架廠界霖 (5285-TW) 受惠 AI 伺服器電源管理架構升級、車用 SiC 逆變器放量，加上 6 月起產品陸續調漲 10% 至 30%，董事長蔡上元看好，隨著過去耕耘的新產品逐步發酵，今年下半年營收將逐季上揚，部分訂單,https://m.cnyes.com/news/id/6509396
524,6509556,字節放大招！Seedance2.5捅破AI影音天花板,字節又在影音大模型上放出王炸新品，火山引擎總裁譚待 23 日（周二）在 2026 火山引擎 FORCE 原動力大會上正式公布豆包影音生成模型 Seedance 2.5。,https://m.cnyes.com/news/id/6509556
525,6504219,永豐台股基金今年大漲逾70%！績效勝主動式ETF　投研團隊怎麼做到？,,https://m.cnyes.com/news/id/6504219
526,6509525,AI巨頭熱潮降溫 高股息策略重回市場 Thornburg趁勢推THOR 主打收益與防禦,在 AI 七雄連年領漲後，市場資金出現輪動跡象。管理規模約 600 億美元的 Thornburg 推出全新股息與選擇權 ETF「THOR」，主打收益與防禦兼具的投資策略。隨著投資人擔憂大型科技股估值偏高，高股息與國際股票重新受到關注。,https://m.cnyes.com/news/id/6509525
527,6503178,巨生醫今年臨床與授權雙軌並進收割期 兩大產品2028年起申請藥證,巨生醫 (6827-TW) 旗下兩大核心產品 MPB-1523 以及 MPB-1734 皆進入臨床中後期，預計 2028 年開始陸續提出藥證申請，可望推動公司營運成長。巨生醫指出，隨著產品線逐步成熟，今年起邁入臨床與授權並行的收穫階段。,https://m.cnyes.com/news/id/6503178
528,6509679,跌越兇越要買！投信作帳黑馬股曝光，洗盤後準備再創高？,,https://m.cnyes.com/news/id/6509679
529,6509562,川普：伊朗已同意接受最高級別核查 無期限限制,美國總統川普 23 日（周二）表示，伊朗已同意接受最高級別核查。基於伊朗作出重大讓步，美方允許荷姆茲海峽保持開放，不再實施海上封鎖。美國解凍的伊朗資金，將專門用於從美國購買食品和醫療物資。,https://m.cnyes.com/news/id/6509562
530,6509557,涉AI大模型「五眼聯盟」情報單位罕見發聯合聲明,「五眼聯盟」情報單位在一份罕見聯合聲明中警告，能夠對政府和企業發動毀滅性網路攻擊的強大人工智慧（AI）模型，可能在幾個月內就會出現，「五眼聯盟」敦促各國立即採取行動。,https://m.cnyes.com/news/id/6509557
531,6509522,MSCI打槍！南韓升級夢碎 續留新興市場 印尼面臨降級風險 ,,https://m.cnyes.com/news/id/6509522
532,6509604,韓股早盤大漲4% 三星勁揚8% 未受美光股價暴跌影響,"韓國 KOSPI 指數周三（24 日）早盤漲幅擴大至 4%，報 8,534.03 點，SK 海力士大漲 5.24%，三星電子勁揚 8.06%。",https://m.cnyes.com/news/id/6509604
533,6509506,「科技七巨頭」股價修正 或許反而是美股健康訊號,《MarketWatch》報導，AI 支出持續飆升，加上市場對通膨頑固不退的擔憂，導致華爾街大型科技股出現一年多來最快跌勢之一，也讓追蹤「科技七巨頭」的 ETF 正式進入修正區間。,https://m.cnyes.com/news/id/6509506
534,6509486,記憶體全面漲價！第二季LPDDR飆89%、DRAM漲逾五成,市場研究機構 Sigmaintell (群智諮詢) 最新報告指出，今年第二季消費性 DRAM 與 NAND 價格全面走高，其中 LPDDR5X 12GB 價格較第一季大漲 89%,https://m.cnyes.com/news/id/6509486
535,6509497,SpaceX跌破IPO開盤價後翻紅 終結三連黑 市值守住2兆美元,在連續三個交易日重挫後，SpaceX (SPCX-US) 週二 (23 日) 終於止跌回穩，盤中雖一度跌破上市首日開盤價，但尾盤在買盤湧入下豬羊變色，終場驚險收紅 0.98% 至每股 156.11 美元，結束連三跌走勢。,https://m.cnyes.com/news/id/6509497
536,6509328,美股重點新聞摘要2026年6月24日,美股重點新聞摘要 2026 年 6 月 24 日,https://m.cnyes.com/news/id/6509328
537,6509540,荷姆茲海峽通行量回升 高運價吸引油輪重返戰區 ,,https://m.cnyes.com/news/id/6509540
538,6509484,川普「免費通行」承諾淪口號？伊朗、阿曼研議荷姆茲收費機制,根據伊朗與阿曼本週發布的聯合聲明，雙方已就海峽管理權、相關服務以及收費機制展開討論，顯示這條全球最重要能源運輸通道未來可能進入收費時代。,https://m.cnyes.com/news/id/6509484
539,6509519,道瓊成分股換血 Alphabet取代Verizon 6月29日開盤前生效,Alphabet (GOOGL-US) 將取代 Verizon (VZ-US) 成為道瓊 30 檔成分股之一,https://m.cnyes.com/news/id/6509519
540,6509508,美股AI全線殺跌 那斯達克蒸發超1兆美元,美股週二（23 日）開盤，AI 產業鏈全線殺跌。費城半導體指數盤中一度重挫 7.6%，收窄後仍跌約 7.3%；那斯達克 100 指數若維持當日跌幅，市值將蒸發超過 1 兆美元。,https://m.cnyes.com/news/id/6509508
541,6509515,〈貴金屬盤後〉金價下挫 升息預期把美元拱上一年高點,,https://m.cnyes.com/news/id/6509515
542,6509485,VIX失靈？「科技股恐慌指標」逼近20年高點 AI熱潮暗藏風險,聚焦科技股的那斯達克波動率指數 (VXN)，其相對 VIX 的比值已逼近近 20 年高點，顯示投資人正加速為科技股可能出現的劇烈波動進行避險。,https://m.cnyes.com/news/id/6509485
543,6507954,華爾街警告美股恐回調20%！揭「六大風險」預警訊號,華爾街資深策略師 Jim Paulsen 警告，美股雖持續創高，但多項市場指標已顯示過熱跡象，標普 500 未來數月可能面臨 10% 至 20% 回調風險。他指出，經濟政策轉趨緊縮、油價觸頂、消費信心下滑、股市與經濟脫鉤、投資人過度樂觀,https://m.cnyes.com/news/id/6507954
544,6509507,美光重挫13% 記憶體晶片股賣壓與這份報告有關？,隨著科技股賣壓持續擴大，記憶體晶片大廠美光科技周二 (23 日) 股價重挫 13%，遭遇一年多來最大單日跌幅。同為記憶體晶片大廠的 SK 海力士 (SK Hynix) 與三星電子此前也同步下跌。,https://m.cnyes.com/news/id/6509507
545,6509502,全球科技股遭遇拋售海嘯 美股周二暴跌原因曝光,美股週二 (23 日) 遭遇大幅拋售，科技股與半導體族群成為重災區，那斯達克指數重挫逾 2%，費半狂瀉近 9%。,https://m.cnyes.com/news/id/6509502
546,6507953,高盛前CEO Blankfein曝投資組合！98%押注高風險資產、看多科技股,高盛前執行長 Lloyd Blankfein 首度公開個人投資邏輯，透露投資組合約 98% 配置於高風險資產，並長期聚焦科技、能源與金融服務三大產業。儘管曾警告私募信貸風險與金融危機可能重演，他仍持續看多大型科技股與雲端運算龍頭,https://m.cnyes.com/news/id/6507953
547,6509491,美參院50比48通過象徵性決議案 要求川普撤出伊朗軍事行動,美國參議院週二 (23 日) 以 50 票贊成、48 票反對，通過一項要求總統川普 (Donald Trump) 撤回參與伊朗衝突美軍部隊的決議案,https://m.cnyes.com/news/id/6509491
548,6509411,研究：iPhone折疊機上市一年後恐貶值最多達1300美元  但保值率仍贏安卓折疊機,,https://m.cnyes.com/news/id/6509411
549,6509512,韓國科技股暴跌引爆半導體ETF遭血洗 美光財報成AI交易關鍵考驗,美股半導體 ETF 週二 (23 日) 承壓，因韓國科技板塊遭遇猛烈拋售，拖累美國晶片股走低，引發市場擔憂——在美光科技 (MU-US) 即將發布備受關注的業績之前，AI 推動的漲勢能否持續。,https://m.cnyes.com/news/id/6509512
550,6509327,〈紐約匯市〉美元維持逾一年高點 升息預期較一周前大幅升溫,美元周二 (23 日) 走強，維持在逾一年來高點附近，市場持續消化美國聯準會 (Fed) 上周意外轉趨鷹派的訊號。此外，全球科技股遭拋售，也促使投資人從風險性股票轉向包括貨幣在內的其他資產。,https://m.cnyes.com/news/id/6509327
551,6509527,〈美光財報前瞻〉HBM供不應求 美光獲利盼再創紀錄 華爾街喊買進但勸先獲利了結,AI 記憶體龍頭美光即將公布第三季財報，市場預期營收與獲利再創新高。不過，在股價一年暴漲近 8 倍、今年飆升 243% 後，部分分析師開始提醒投資人獲利了結。市場焦點將集中在 HBM 需求、供應緊張程度及財測能否再次超越預期。,https://m.cnyes.com/news/id/6509527
552,6509513,周二半導體股暴跌超乎預期？美光財報將迎真正考驗,AI 交易是否槓桿過高，反而危及自身？據《Benzinga》，週二 (23 日) 晶片股的拋售不僅僅是因為市場對 AI 的熱情有所降溫。,https://m.cnyes.com/news/id/6509513
553,6509421,〈能源盤後〉美伊談判再傳進展 原油連跌2日至近4個月低點,美伊和平談判持續推進，市場開始押注荷姆茲海峽逐步恢復正常運作，帶動國際油價連續第二天下跌。儘管部分油輪與液化天然氣船已重返航道，但戰爭造成的基礎設施損害、地雷威脅與運輸瓶頸，仍讓全球能源供應全面復甦面臨挑戰。,https://m.cnyes.com/news/id/6509421
554,6509520,AI催生超級併購潮！全球2026年總交易額上看4兆美元、巨型交易占近半,,https://m.cnyes.com/news/id/6509520
555,6509460,〈台股盤前要聞〉半導體股集體高空跳水 4萬7難守、 PC下半年再漲價5%見頂,台股盤前要聞,https://m.cnyes.com/news/id/6509460
556,6509288,〈美股盤後〉獲利了結潮湧現 美光財報前夕暴跌超13% 費半下殺近8%,美股週二 (23 日) 全面走低，記憶體晶片族群遭遇沉重賣壓，引發市場對人工智慧 (AI) 題材估值過高的疑慮,https://m.cnyes.com/news/id/6509288
557,6509416,【袁志峰專欄】南向資金淨買入逾百億元,"今日推介 - 比亞迪 (1211, $75.85), 目標價 $83.5, 止損價 $72.0",https://m.cnyes.com/news/id/6509416
558,6509483,阿里巴巴狀告美國防部 要求移出「中國軍企黑名單」,中國電商與雲端服務巨頭阿里巴巴週二 (23 日) 向美國聯邦法院提起訴訟，挑戰美國國防部 (Pentagon) 將其列入「中國軍事企業」(Chinese Military Companies) 名單的決定，並要求法院撤銷相關認,https://m.cnyes.com/news/id/6509483
559,6509444,複製美國成功模式 禮來搶攻歐洲肥胖治療商機 最晚2027年初前開賣,減重藥市場競爭持續升溫，禮來計劃最快於今年下半年、最晚 2027 年初在歐洲與英國推出口服減重藥，並複製美國模式，透過遠距醫療與直接面向消費者銷售。隨著各國肥胖治療需求攀升，歐洲市場將成為下一個兵家必爭之地。,https://m.cnyes.com/news/id/6509444
560,6507945,高喊拿掉眼罩、拒當市場主導者！華許師法葛林斯潘 模糊溝通策略藏著什麼隱憂？,,https://m.cnyes.com/news/id/6507945
561,6509446,華爾街開始做空SpaceX？4000萬股遭放空,"SpaceX(SPCX-US) 上市後股價劇烈波動，吸引不少投資人押注股價回檔。金融數據分析機構 S3 Partners 最新估計顯示，目前約有 5% 至 7% 的流通股遭放空，約相當於 4,000 萬股，反映市場對這家由馬斯克領導的太空",https://m.cnyes.com/news/id/6509446
562,6509445,川普藥價政策發威？禮來坦言影響減重藥歐洲布局,"《路透》周二 (23 日) 報導，美國製藥巨擘禮來 (Eli Lilly) 表示，受到川普政府推動的「最惠國價格」(Most-Favored-Nation, MFN) 藥價政策影響，公司未來在歐洲市場推出新藥時，將面臨更複雜的定價與",https://m.cnyes.com/news/id/6509445
563,6509447,AI熱潮降溫？反向槓桿ETF爆量 市場押注晶片股續跌,《CNBC》周二 (23 日) 報導，在全球半導體類股遭遇重挫之際，市場資金正快速湧向一項熱門避險工具。追蹤費城半導體指數反向三倍報酬的 Direxion Daily Semiconductor Bear 3X Shares(S,https://m.cnyes.com/news/id/6509447
564,6509332,AI時代搜尋版圖鬆動！Google網路霸主地位出現裂痕,儘管 Google(GOOGL-US) 近年成功挺過生成式 AI 浪潮衝擊，並持續穩坐全球搜尋市場龍頭地位，但隨著使用者習慣改變、AI 聊天機器人崛起，以及部分用戶對 AI 功能產生反感，這家搜尋巨擘的核心業務正逐漸出現鬆動跡象。,https://m.cnyes.com/news/id/6509332
565,6507922,韓媒爆SK海力士反直覺策略！今年HBM產能全售罄 變心改賺嚴重短缺傳統DRAM財,,https://m.cnyes.com/news/id/6507922
566,6509277,馬斯克終極布局？華爾街瘋猜特斯拉與SpaceX將合併,SpaceX(SPCX-US)完成史上最大首次公開發行 (IPO) 後，市場焦點逐漸從上市首日的狂熱交易，轉向另一個更具想像空間的話題：馬斯克是否最終會推動 SpaceX 與特斯拉 (TSLA-US) 合併。,https://m.cnyes.com/news/id/6509277
567,6509414,烏克蘭狂炸煉油廠！加油站大排長龍 俄羅斯考慮進口燃料,據《Vedomosti》周二（23 日）報導，兩名匿名消息人士透露，俄羅斯考慮進口燃料，以緩解烏克蘭襲擊煉油廠而導致的柴汽油供應中斷。,https://m.cnyes.com/news/id/6509414
568,6509406,持續加碼穿戴裝置！Meta發表299美元入門智慧眼鏡  砍價搶客積極搶攻AI硬體入口,,https://m.cnyes.com/news/id/6509406
569,6509338,囤貨效應發威！美6月綜合PMI創五個月新高 製造業就業卻寫6年來最慘表現,美國 6 月企業活動擴張速度加快，在製造業需求強勁回升帶動下，綜合採購經理人指數 (PMI) 創下五個月來新高。不過，企業因擔憂供應鏈中斷及成本上漲而提前囤貨，也推升製造業景氣表現，與此同時工廠就業卻跌至六年來低點，反映企業對成,https://m.cnyes.com/news/id/6509338
570,6509402,史無前例！「這一國」總統因未被列為政府代表團成員 竟提告自家政府,,https://m.cnyes.com/news/id/6509402
571,6509400,鉅亨速報 - Factset 最新調查：SpaceX(SPCX-US)EPS預估下修至-0.94元，預估目標價為227.00元,FactSet 最新調查：SpaceX(SPCX-US)EPS預估下修，預估EPS、預估營收、目標價、歷史獲利表現、即時新聞資訊,https://m.cnyes.com/news/id/6509400
572,6509393,SpaceX熱潮退燒？股價一度跌破上市首日開盤價 市值短暫失守2兆美元,太空探索公司 SpaceX(SPCX-US)股價周二 (23 日) 盤中一度跌破 150 美元，失守上市首日開盤價，市值也短暫跌破 2 兆美元大關。不過，隨後買盤進場，股價由跌轉升，顯示市場對這家由馬斯克領導的太空與 AI 企業看法仍存在分,https://m.cnyes.com/news/id/6509393
573,6509229,〈美股早盤〉科技股賣壓擴大！主要指數開低、費半崩逾7%,美股周二 (23 日) 開盤走低，科技股賣壓持續擴大，拖累主要指數全面下挫。市場對 AI 熱潮是否過度膨脹的疑慮升溫，加上投資人擔憂 Fed 主席華許 (Kevin Warsh) 可能採取更強硬的抗通膨立場，以及科技巨頭持續透過舉債擴大 A,https://m.cnyes.com/news/id/6509229
574,6508373,央行憂「四貸同堂」買股太瘋狂 金管會：金融風險可控、與雙卡風暴大不同,台股多頭勢不可擋，許多民眾透過房貸、信貸、理財周轉金及股票質押等工具高度財務槓桿投入股市，形成「四貸同堂」現象，就連央行也在理監事會後示警。對此，金管會強調，目前銀行放款仍以企業金融為主,https://m.cnyes.com/news/id/6508373
575,6509279,ASML爭議未阻合作！荷蘭宣布加入美國AI供應鏈聯盟,根據《路透》報導，荷蘭政府周二 (23 日) 宣布，將加入由美國主導的人工智慧 (AI) 供應鏈合作倡議「Pax Silica」，成為協調 AI 關鍵技術與供應鏈安全的最新成員國。儘管荷蘭與美國近來在對中國出口管制議題上存在分歧，但此,https://m.cnyes.com/news/id/6509279
576,6509296,金管會准了！7家壽險發放246.49億元現金股利 創史上次高,金管會保險局今 (23) 日揭露國內壽險業申請發放現金股利的最終審核結果。今年共計有 7 家壽險公司 (包含 5 家本土、2 家外商) 向金管會遞件申請，全數獲得核准，總發放金額高達 246.49 億元,https://m.cnyes.com/news/id/6509296
577,6509075,2026年「超級聖嬰」現象來襲 科學家警告恐創史上最強紀錄,根據最新科學觀測，2026 年 6 月太平洋正醞釀一場可能打破歷史紀錄的「超級聖嬰」(Super El Niño) 現象。美國國家海洋暨大氣總署 (NOAA) 已於 6 月 11 日正式宣告聖嬰現象成形，各界專家正密切關注其發展強度。,https://m.cnyes.com/news/id/6509075
578,6509244,滑不停不是意外？歐盟擬升級調查Meta 指臉書、IG刻意設計讓兒童成癮,歐盟對 Meta 監管力道持續升級。《彭博》周二 (23 日) 援引知情人士消息報導，歐盟執委會正準備公布對 Meta Platforms(META-US)初步調查結果，指控旗下臉書 (Facebook) 與 Instagram 涉嫌利用具,https://m.cnyes.com/news/id/6509244
579,6509074,歐盟強化調查Meta 指控其「剝削設計」危害兒童健康,歐盟執行委員會近期正準備針對 Meta(META-US) 平台發布初步調查結果，指控其旗下的 Facebook 和 Instagram 刻意使用「剝削性設計技術」，使青少年用戶過度沉迷。這項行動象徵著歐盟對美國社群媒體巨,https://m.cnyes.com/news/id/6509074
580,6509247,研揚發表嵌入式系統新品 支援Super Mode聚焦高效AI邊緣運算,研揚發表嵌入式系統新品 支援 Super Mode 聚焦高效 AI 邊緣運算,https://m.cnyes.com/news/id/6509247
581,6509230,台股市值躍全球第4助攻！吸引高資產落腳 證交所：建構台灣為「亞太資產管理平台」,在全球供應鏈重組及地緣政治變局下，台灣憑藉 AI 與半導體產業優勢，台股總市值已挺進全球第四名。為協助企業掌握全球布局趨勢，證交所積極推動台灣轉型為亞太地區重要的資產管理平台。證交所企劃研究,https://m.cnyes.com/news/id/6509230
582,6509236,勞動市場穩定 台灣5月失業率3.27% 失業人數減少4000人,勞動市場穩定 台灣 5 月失業率 3.27% 失業人數減少 4000 人,https://m.cnyes.com/news/id/6509236
583,6509207,長興5月稅前盈餘年增近4倍 每股稅前盈餘0.33元,長興 5 月稅前盈餘年增近 4 倍 每股稅前盈餘 0.33 元,https://m.cnyes.com/news/id/6509207
584,6509237,伊朗做出重大讓步！川普曝美伊談判最新進展,美國總統川普周二 (23 日) 表示，伊朗已同意未來接受最高層級的核設施檢查，並將相關核查機制長期維持下去，以確保伊朗遵守核不擴散承諾。川普強調，若伊朗拒絕接受這項安排，美伊雙方將不會繼續推進後續談判。,https://m.cnyes.com/news/id/6509237
585,6509070,全球科技股遭遇3月以來最大跌幅 AI驅動的漲勢再遭質疑,全球科技股周二 (23 日) 遭遇劇烈拋售，跌幅創下自 3 月以來的最高紀錄。亞洲科技股基準指數大跌 6%，這是自 3 月 9 日伊朗戰爭引發恐慌性賣壓以來的最大單日跌幅。其中，作為 AI 貿易風向球的南韓綜合股價指數 (Kos,https://m.cnyes.com/news/id/6509070
586,6509196,〈台幣〉台股衝4萬8震盪 驚險翻升收31.625元,台股開高攻上 48000 點大關後隨即震盪走跌，日韓股市跳水重挫，亞幣也普遍走弱，新台幣兌美元一度翻黑下探 31.68 元，但在央行出手穩匯下,https://m.cnyes.com/news/id/6509196
587,6508994,裕民訂造2艘21萬噸級散裝船 總運力首度突破千萬噸,裕民訂造 2 艘 21 萬噸級散裝船 總運力首度突破千萬噸,https://m.cnyes.com/news/id/6508994
