,newsId,title,summary,link
342,6364083,一艘貨櫃船在荷姆茲海峽被擊中 機艙起火,在中東局勢急劇升級之際，一艘運力 1800TEU、懸掛馬爾他國旗的貨櫃船周三（4 日）穿越荷姆茲海峽時遭炮彈擊中，機艙起火，成為過去 24 小時內該水域第四起商船遭襲事件。,https://m.cnyes.com/news/id/6364083
343,6364052,黃仁勳：需求從非常高變成更高 不考慮投資OpenAI 1000億美元,輝達執行長黃仁勳表示，AI 需求已從「非常高」升至更高水準，完成對 OpenAI 300 億美元投資，並預言未來算力將等同企業營收與 GDP。,https://m.cnyes.com/news/id/6364052
344,6363921,美國防長放話一周內完全控制領空 伊朗公布最新戰果,美國國防部長赫格塞思和美國參謀長聯席會議主席丹 · 凱恩周三（4 日）舉行記者會，據《紐約時報》報道，赫格塞思通報，美國潛艇在印度擊沉一艘伊朗軍艦，美國和以色列將在一周之內「完全控制伊朗領空」。,https://m.cnyes.com/news/id/6363921
345,6363273,美伊開火迄今日元卻跌1% 套利交易反常冷靜 避險神話為何失效？,,https://m.cnyes.com/news/id/6363273
346,6364084,LME鋁價飆近4年高！中東衝突致斷供加劇 花旗上調0-3月目標價至每噸3600美元,,https://m.cnyes.com/news/id/6364084
347,6364038,美股重點新聞摘要2026年3月5日,美股重點新聞摘要 2026 年 3 月 5 日,https://m.cnyes.com/news/id/6364038
348,6364085,營收速報 - 2026年3月5日台股大型公司2月營收一覽（新增3家）,2月台股營收公布，2026年3月針對大型公司前一日公布3家營收。截至目前2月營收公布共計7家，其中營收年增大於+25％有2家，年增小於-20％有0家。| Anue鉅亨- 台股營收,https://m.cnyes.com/news/id/6364085
349,6364031,Google面臨首起AI致死訴訟 Gemini涉嫌教唆自殺 家屬提告求償,美國科技巨頭 Google 正面臨首起人工智慧 (AI) 致死訴訟，一名 36 歲佛羅里達州男子 Jonathan Gavalas 在與聊天機器人 Gemini 長時間互動後身亡。,https://m.cnyes.com/news/id/6364031
350,6364050,輝達、Google等科技巨頭聯名致函五角大廈 抗議供應鏈風險標籤,五角大廈將美國 AI 公司列為供應鏈風險，引發科技業強烈反彈。輝達與 Google 等企業所屬團體致函國防部，警告濫用國安工具恐衝擊產業與法治程序。,https://m.cnyes.com/news/id/6364050
351,6364064,美參議院47比53否決「伊朗戰爭權力決議」,美國參議院週三 (3 日) 否決一項限制總統川普對伊朗進一步動武的決議案。儘管民主黨議員幾乎全面支持，但在共和黨多數反對下，該案最終以 47 票對 53 票未能過關。,https://m.cnyes.com/news/id/6364064
352,6364040,比特幣突破7.3萬美元創一個月高點 帶動加密幣股票大漲,比特幣本周重新站上關鍵價位，為近一個月來首見，顯示在中東緊張局勢升溫之際，全球最大加密貨幣仍展現韌性。,https://m.cnyes.com/news/id/6364040
353,6363780,"聯想下發漲價函！部分電腦漲幅超過台幣4,500元",2026 年初一場由上游核心元器件驅動的漲價風暴正席捲整個消費電子市場。,https://m.cnyes.com/news/id/6363780
354,6364003,〈貴金屬盤後〉黃金反彈 美元升勢止步且中東衝突加劇,,https://m.cnyes.com/news/id/6364003
355,6364051,紐時：伊朗透過第三國向美國釋談判訊號 盼結束戰爭, 《紐約時報》報導，伊朗已就結束戰爭的談判與美國接觸，華爾街情緒有所改善。,https://m.cnyes.com/news/id/6364051
356,6364033,中東戰火推升運輸成本 美國柴油飆破4美元 創近兩年新高 民生物價恐全面上漲,美國柴油均價突破每加侖 4 美元，創近兩年新高。中東衝突擾亂能源供應，全球庫存偏低，運輸與食品成本恐進一步上揚，通膨壓力再度升溫。,https://m.cnyes.com/news/id/6364033
357,6364039,〈財報〉博通AI營收翻倍 財報財測超預期 盤後一度飆5%,晶片製造商博通 (Broadcom) 周三 (4 日) 盤後公布 2026 會計年度第一季財報 ，獲利與營收均優於市場預期，並對本季給出強勁展望，顯示公司持續受惠於人工智慧 (AI) 熱潮，帶動盤後股價續揚，一度大漲 5%。,https://m.cnyes.com/news/id/6364039
358,6363782,中國外長王毅：中方將派中東問題特使赴地區國家斡旋,中共中央政治局委員、中國外交部長王毅周三（4 日）同沙烏地阿拉伯外交大臣費薩爾通話，他表示，中方將派中東問題特使赴地區國家斡旋。,https://m.cnyes.com/news/id/6363782
359,6364006,Fed褐皮書：美經濟溫和成長 不確定性拖累消費者支出,,https://m.cnyes.com/news/id/6364006
360,6364027,〈美股盤後〉國際油價持穩 那指回升超1.2% 費半勁揚約2%,美股週三 (4 日) 止跌反彈，投資人對伊朗衝突可能降溫的預期升溫，加上美國民間就業數據優於市場預期，帶動市場情緒回穩。科技股領軍上攻，晶片股表現強勢，比特幣則同步大漲，觸及逾一個月高點。,https://m.cnyes.com/news/id/6364027
361,6362110,AI侵權日益嚴重！中國針對AIGC濫用推出首個法規標準 開放參與起草,,https://m.cnyes.com/news/id/6362110
362,6364037,〈紐約匯市〉美元自數月高點回落 中東局勢轉趨樂觀,美元周三 (4 日) 下跌，自前一交易日觸及的數月高點回落，隨著市場對中東衝突可能比先前預期更快結束的希望升溫，投資人解除避險部位。,https://m.cnyes.com/news/id/6364037
363,6364032,美聯邦貿易法官下令 停止對進口商計算IEEPA關稅,美國國際貿易法院法官 Richard Eaton 週三 (4 日) 要求川普政府加快向進口商退還關稅的進度，相關關稅已在上個月被美國最高法院裁定為違法。,https://m.cnyes.com/news/id/6364032
364,6363888,〈能源盤後〉荷姆茲海峽封鎖第五天 原油連兩日登一年多新高,美伊衝突升溫、荷姆茲海峽連續第五天受阻，全球近三分之一原油供應面臨風險，國際油價連兩日收在一年多高點，市場警戒油價上看 100 美元。,https://m.cnyes.com/news/id/6363888
365,6363898,伊朗即將選出新最高領袖 哈米尼之子可能接班,伊朗最高領袖哈米尼遇襲身亡後，負責選舉、監督、罷黜最高領袖的伊朗專家會議已開始討論新的最高領袖人選。,https://m.cnyes.com/news/id/6363898
366,6349844,〈台股盤前要聞〉3天崩跌2586點搶反彈、天然氣3月底前供應無虞、Q2 DRAM將跳漲,台股盤前要聞,https://m.cnyes.com/news/id/6349844
367,6363887,【袁志峰專欄】港股連跌3日，技術反彈可期,"今日推介 - 石藥集團 (1093, $8.99), 目標價 $10.0, 止損價 $8.5",https://m.cnyes.com/news/id/6363887
368,6363897,穩定幣收益大戰：川普倒戈加密貨幣陣營 銀行急喊危險：金融體系血液將被抽乾,,https://m.cnyes.com/news/id/6363897
369,6363993,OpenAI衝IPO！黃仁勳：輝達300億美元投資恐成「最後一次」,綜合外媒周三 (4 日) 報導，輝達 (NVDA-US) 執行長黃仁勳表示，公司對人工智慧 (AI) 公司 OpenAI 的最新投資，可能是最後一次大規模入股，主因是 OpenAI 正朝首次公開發行 (IPO) 邁進，最快可能在今年底上市。,https://m.cnyes.com/news/id/6363993
370,6363959,Fed理事米蘭：伊朗衝突不影響降息路徑 今年仍應降息4次,聯準會 (Fed) 理事米蘭 (Stephen Miran) 周三 (4 日) 接受《彭博》訪問時表示，美國與伊朗的軍事衝突雖然帶來新的不確定性，但不足以改變聯準會今年持續降息的政策方向。他認為能源價格上漲對核心通膨的影響有限，而就業,https://m.cnyes.com/news/id/6363959
371,6363971,Anthropic與五角大廈僵局加劇 傳投資人急出手降溫,《路透》周三 (4 日) 獨家報導，人工智慧 (AI) 公司 Anthropic 與美國國防部之間的爭議持續升溫，部分主要投資人正積極出面協調，希望緩解與五角大廈的緊張關係，避免衝突進一步衝擊公司業務。知情人士指出，投資人擔心若爭端持,https://m.cnyes.com/news/id/6363971
372,6363976,川普正式提名華許接替鮑爾 聯準會人事案送交參議院,《CNBC》報導，美國總統川普周三 (4 日) 正式提名前聯準會 (Fed) 理事華許 (Kevin Warsh) 出任聯準會主席，若提名獲參議院通過，華許將接替現任主席鮑爾(Jerome Powell)，任期四年。,https://m.cnyes.com/news/id/6363976
373,6363975,英特爾重新評估18A製程 陳立武考慮對外開放代工,《路透》報導，英特爾 (INTC-US) 財務長辛斯納 (David Zinsner) 周三 (5 日) 表示，執行長陳立武 (Lip-Bu Tan) 正重新評估公司 18A 先進製程的定位，開始考慮將這項技術提供給外部客戶。這一態度轉變，可,https://m.cnyes.com/news/id/6363975
374,6363925,中東戰事與AI衝擊不用怕？高盛：股市回檔就是買點,《彭博》周三 (4 日) 報導，高盛策略師表示，投資人應將近期股市回檔視為布局機會，而非新一輪熊市的開始。儘管中東戰事與人工智慧 (AI) 對企業商業模式的衝擊帶來不確定性，但在經濟基本面具韌性、企業獲利持續成長的支撐下，股市修正,https://m.cnyes.com/news/id/6363925
375,6363933,需求回升！美國2月服務業強勁擴張 ISM指數創逾3年半高點,美國服務業 2 月活動強勁擴張，顯示在需求回升帶動下，全球最大經濟體的主要動能仍具韌性。供應管理協會 (ISM) 周三 (4 日) 公布，2 月非製造業指數升至 56.1，不僅高於市場預期，也創 2022 年 7 月以來最高水準。,https://m.cnyes.com/news/id/6363933
376,6362764,中東能源通道陷癱瘓！航商憂：美軍護航難擋伊朗奇襲,,https://m.cnyes.com/news/id/6362764
377,6363858,濕製程設備廠敘豐去年EPS 5.9元 暫訂上櫃承銷價120元,濕製程設備廠敘豐 (3485-TW) 的上櫃申請案已獲 OTC 審議通過，敍豐主要從事自動化及載板濕製程設備的研發、製造及銷售，敍豐今 (4) 日通過 2025 年稅後純益 2.02 億元，每股純益 5.9 元。,https://m.cnyes.com/news/id/6363858
378,6363886,你好，Neo！蘋果推出平價MacBook Neo 搶攻入門筆電市場,蘋果 (AAPL-US) 周三 (4 日) 推出全新入門筆電 MacBook Neo，起售價 599 美元，成為該公司歷來價格最低的新世代 Mac 筆電之一。這款產品象徵著蘋果罕見地大舉進軍低價筆電市場，試圖挑戰以 Chromebook 與 Wi,https://m.cnyes.com/news/id/6363886
379,6363823,應對中東戰火威脅 鄭麗君：天然氣3月底前供應無虞 油價雙緩漲、力保CPI低於2%,行政院副院長鄭麗君今（4）日緊急召開穩定物價小組會議，針對中東戰事引發的國際油氣價格劇烈波動研擬對策。鄭麗君指出，為因應國際能源風險，即日起穩定物價小組將每週加開臨時會報，並由經濟部啟動能源供應緊急應變小組，確保 3 月,https://m.cnyes.com/news/id/6363823
380,6363824,廣運去年轉虧爲盈EPS 0.1元 擬超額配發股息0.5元,廣運 (6125-TW) 在持續深化智慧製造、智慧物流、半導體與資料中心等高科技應用場域中，2025 年財報今 (4) 日出爐。全年稅後純益 2618 萬元，每股純益 0.1 元，同時，廣運董事會決議對去年股利超額配 0.5 元現金。　,https://m.cnyes.com/news/id/6363824
381,6363779,客戶需求強烈且產能足 南俊2月營收2.52億元改寫歷史次高,南俊雲端 CSP 客戶的 GB 系列 AI 伺服器導軌持續出貨並且通用型伺服器導軌出貨增溫，且新產能順利開出足以因應需求之下，南俊 2 月營收 2.52 億元改寫歷史次高。,https://m.cnyes.com/news/id/6363779
382,6363778,康舒通過ASPICE流程評鑑 強化進軍國際車廠關鍵門檻,康舒通過 ASPICE 流程評鑑 強化進軍國際車廠關鍵門檻,https://m.cnyes.com/news/id/6363778
383,6363753,波斯灣油運受威脅 美國準備護航油輪穩供應,美國財政部長貝森特 (Scott Bessent) 周三 (4 日) 表示，華府將推出一系列措施，以支持波斯灣地區的石油運輸並穩定市場，顯示在伊朗衝突升溫之際，美國政府準備介入維持全球最重要能源航道之一的運作。,https://m.cnyes.com/news/id/6363753
384,6363612,〈美股早盤〉中東戰事有望降溫 主要指數開高、油價回吐漲幅,美股主要指數周三 (月 4 日) 開盤走高，市場押注伊朗衝突可能較預期更快降溫，帶動投資人風險情緒回升。稍早有報導指出伊朗已透過間接管道與美國接觸，尋求討論結束衝突的可能性，加上美國總統川普承諾將採取措施穩定油市，提振市場信心。,https://m.cnyes.com/news/id/6363612
385,6363822,全球油市鬆口氣？美國承諾護航油輪 油價終於回跌,在美國對伊朗發動軍事行動後連續數日大漲的油價周三 (4 日) 出現回落，市場在美國政府承諾支援波斯灣油輪航運後情緒稍微降溫。投資人同時持續關注荷姆茲海峽 (Strait of Hormuz) 航運安全與伊朗可能的報復行動，評估衝突,https://m.cnyes.com/news/id/6363822
386,6363754,美國就業回溫？2月小非農優於預期 仍現結構隱憂,美國就業市場顯示出逐步回穩跡象。根據薪資處理機構 ADP 於周三 (4 日) 公布、被市場稱為「小非農」的就業報告顯示，美國 2 月民間企業新增就業 6.3 萬人，高於市場預期的 5 萬人，也較 1 月大幅上修前的 1.1 萬人明顯回升，創,https://m.cnyes.com/news/id/6363754
387,6363765,〈第一金法說〉搶財管商機！馬年聚焦跨境服務、高資產理財 強化亞灣私人銀行願景,展望 2026 年，第一金（2892-TW）於今（４）日法說會揭最新經營重點放在「跨境服務」與「高資產理財」，因應全球關稅變動與供應鏈重組，積極支持企業向外發展。集團計畫利用亞灣區法規鬆綁契機，擴大高資產財富管理範疇。面對國,https://m.cnyes.com/news/id/6363765
388,6363659,〈財報前瞻〉AI訂單與毛利率成焦點 博通能否打破概念股魔咒？,博通 (AVGO-US) 即將在周三 (4 日) 美股盤後公布最新財報，華爾街普遍預期這家人工智慧 (AI) 晶片供應商將交出強勁成績單。然而，在投資人對 AI 投資回報產生疑慮之際，即使財報優於預期，也未必能扭轉股價近期的疲弱走勢。,https://m.cnyes.com/news/id/6363659
389,6363763,川普15%全球關稅最快本周啟動！美財長：5個月內回到原稅率,綜合外電周三 (4 日) 報導，美國財政部長貝森特 (Scott Bessent) 表示，總統川普近期宣布將把全球關稅稅率從 10% 提高至 15%，預計最快將於本周開始實施，同時政府也計畫透過其他法律工具，在約五個月內重建先前被最高法,https://m.cnyes.com/news/id/6363763
390,6363611,歐洲央行部落格：AI目前可能正在創造而非摧毀就業機會,隨著人工智慧 (AI) 技術席捲全球職場，外界普遍擔憂機器將取代人力導致失業。然而，歐洲央行 (ECB) 經濟學家周三 (4 日) 發表的一篇部落格文章指出，目前 AI 在歐洲更像是就業的「盟友」而非「敵人」。研究顯示，密集使用或投資,https://m.cnyes.com/news/id/6363611
391,6363663,杜拜機場滯留旅客返台 共275名台灣旅客安抵國門,中東局勢升溫，也讓連接歐、亞、非和北美的阿拉伯聯合大公國機場及海灣交通大亂。其中，杜拜機場於今 (4) 日部分開放航班，飛往台灣之 EK366 航班已於今日下午 4 時許抵達桃園機場，該航班共 501 名旅客。,https://m.cnyes.com/news/id/6363663
392,6363664,〈第一金法說〉一銀房貸業務可望穩健成長5-6% 估今年房市「量縮、價可議」,第一金控今 (4) 日舉行線上法說會報告集團營運概況，子公司第一銀行 2025 年核心業務表現亮眼，淨手收在財管業務成長 21.5% 帶動下年增 9.2%。面對房市管制與降息預期，銀行將放款重心轉向利差較高的中小企業與外幣授信，中小企,https://m.cnyes.com/news/id/6363664
393,6363652,〈第一金法說〉股利政策提前曝光！今年將優於去年的1.2元、現金股利「保底」這個數,第一金控 (2892-TW) 與旗下第一銀行獲利雙雙再攀高峰，2025 年金控稅後淨利 269.33 億元，年增 6.2%，每股稅後盈餘 1.87 元．第一金副總經理李淑玲表示，反映獲利創高，承諾現金股利配,https://m.cnyes.com/news/id/6363652
394,6363651,美製車零關稅進口 二手車商：新古車、新車價格恐鬆動,台美對等貿易協定 (ART) 承諾美製車進口零關稅，對於二手車市是否造成影響? 中古車商棋勝汽車今 (4) 日表示，零關稅政策可能影響新古車及入門新車款，中古車市影響有限，遭壓抑的購車需求將釋放，至於中古車交易量預期有望提升。,https://m.cnyes.com/news/id/6363651
395,6363647,智冠去年純益創10年高 EPS7.93元擬配息7.5元,智冠去年純益創 10 年高 EPS7.93 元擬配息 7.5 元,https://m.cnyes.com/news/id/6363647
396,6363613,通膨陰影未散、降息夢碎？Fed官員：利率可能卡在高檔很久,《紐約時報》(NYT)周三 (4 日) 報導，克里夫蘭聯邦準備銀行總裁哈瑪克 (Beth Hammack) 表示，在通膨仍高於目標且經濟前景存在不確定性的情況下，聯準會 (Fed) 沒有急於降息的必要，利率可能需要在目前水準維持「相當,https://m.cnyes.com/news/id/6363613
397,6363508,地緣政治紅利消散？知名分析師預警黃金牛市已近終局,全球黃金市場自 2022 年初以來經歷了一場幾乎前所未有的狂飆，截至今年 3 月 3 日，金價已累計飆升 161%，報每盎司 5151 美元。然而，這波長期漲勢可能正傳出警訊。,https://m.cnyes.com/news/id/6363508
398,6363636,外資史上第三大賣超964億元 鴻海、台積電成提款機 回補3檔記憶體股,台股今 (4) 日爆量收在最低點 32828 點，下挫 1494 點，創史上第 3 大跌點，一舉摜破月線大關，外資也持續站賣方，大賣 964 億元，為歷史第 3 大賣超金額，尤其瞄準台積電與鴻海進行提款，兩檔合計達 6.2 萬張，但,https://m.cnyes.com/news/id/6363636
399,6363639,遠傳井琪於MWC與微軟、西班牙電信代表對談 交流AI如何重塑網路營運,遠傳總經理井琪於 MWC 受邀與微軟客戶體驗事業群企業副總裁 Kevin Shatzkamer、西班牙電信網路 / IT 與電視業務總監 Juan Jose Marfil 同台對談，交流 AI 如何在真實場景重塑網路營運。,https://m.cnyes.com/news/id/6363639
400,6363634,加密貨幣里程碑！Kraken拿下Fed主帳戶 首家接入央行支付系統,《華爾街日報》(WSJ)周三 (4 日) 報導，加密貨幣交易所 Kraken 旗下銀行部門已獲准接入美國聯準會 (Fed) 的核心支付系統，成為首家取得 Fed「主帳戶」(Master Account)的加密貨幣公司，使其能透過與銀行相,https://m.cnyes.com/news/id/6363634
401,6363496,中東戰事持續 亞洲能源買家面臨壓力 區域供應進一步緊縮,隨著中東地區戰事爆發，全球最重要的能源航道之一荷姆茲海峽，已經實質上遭到封鎖，導致亞洲石油與燃料買家陷入大範圍的恐慌。,https://m.cnyes.com/news/id/6363496
402,6363615,神盾衛星攜手Sateliot 推全球混合衛星物聯網,神盾 (6462-TW) 旗下神盾衛星 (Creative5) 今 (4) 日宣布與歐洲 3GPP 標準低軌衛星通訊營運商 Sateliot 建立策略合作，整合 Hestia-X IoT Gateway 與 Sateliot 5G N,https://m.cnyes.com/news/id/6363615
403,6363604,台股史上第3慘還不救嗎？國安基金操盤手：已上緊發條 護盤先看這「關鍵」,中東地緣政治危機急遽惡化，美以對伊朗軍事行動擴大引發全球金融市場劇烈動盪。台股今（4）日慘遭恐慌性拋售，重跌近 1500 點，終場收在 32828.88 點，創下史上第 3 大跌幅。財政部表示正嚴密監控情勢，特別是荷姆茲海峽封鎖疑慮,https://m.cnyes.com/news/id/6363604
404,6363616,福壽去年稅後賺1.55億元EPS 0.45元 營運將平穩向上,飼料及肉品加工廠福壽 (1219-TW) 今 (4) 日公布最新獲利資訊，2025 年全年營收 143.82 億元，稅後純益爲 1.55 億元，年減 14.29%，每股純益爲 0.45 元。福壽 2026 年營運可望向上。,https://m.cnyes.com/news/id/6363616
405,6363513,星舟快充首座高功率專用站啟用 創下苗栗快充站規模新高,泓德能源 (6873-TW) 旗下星舟快充近日宣布啟用「竹南可愛專用站」，成為苗栗地區規模最大快充站，進一步強化區域電動車充電基礎建設布局。同步推出限時新春充電優惠，全台逾百座站點費率調降，快充每度最低至 5.5 元，站點擴張與,https://m.cnyes.com/news/id/6363513
406,6361312,蘋果平價MacBook倒數登場？MacBook Neo名稱意外曝光,蘋果平價筆電新品可能即將亮相。外媒發現，一款名為「MacBook Neo」的裝置曾短暫出現在蘋果官方網站文件中，外界推測這可能就是蘋果即將推出的入門級 MacBook。,https://m.cnyes.com/news/id/6361312
407,6363506,希華看好業績成長 去年EPS 0.65元擬超額配發0.7元股息,頻率元件廠希華晶體 (2484-TW) 今 (4) 日發布最新獲利資訊，2025 年全年財報稅後純益 1.04 億元，每股純益 0.65 元，董事會決議超額 0.7 元現金股息。,https://m.cnyes.com/news/id/6363506
408,6363512,〈研華法說〉發表WEDA開發者架構 啟動Physical AI成長新動能,研華發表 WEDA 開發者架構 啟動 Physical AI 成長新動能,https://m.cnyes.com/news/id/6363512
409,6363308,中東戰火重燃衝擊金融市場 華爾街：TACO交易這次恐怕不管用,隨著美國與以色列對伊朗發動攻擊，中東局勢陷入劇烈動盪，全球金融市場受衝擊加大。儘管周二 (3 日) 的美股交易中，美股在跌深後收復大部分失地，但多位華爾街策略師警告，面對這場伊朗戰爭，TACO 交易可能難以奏效。,https://m.cnyes.com/news/id/6363308
410,6362691,AI引爆「SaaS末日」！私募信貸巨頭集體陷焦慮 黑石、KKR與阿波羅也頂不住了,,https://m.cnyes.com/news/id/6362691
411,6363509,〈研華法說〉Q1淡季不淡「非常強勁」 營收可望挑戰單季新高,研華 Q1 淡季不淡「非常強勁」 營收可望挑戰單季新高,https://m.cnyes.com/news/id/6363509
412,6363307,南亞科：DRAM到明年上半年都供不應求 Q2價格進一步Jump,DRAM 業者南亞科 (2408-TW) 總經理李培瑛今 (4) 日表示，受惠 AI 需求快速擴張與新增產能有限影響，DRAM 市場至 2027 年上半年將維持供不應求，也針對個別客戶進行議價，將分別依單月、單季逐步調漲，預期第一季價格將逐,https://m.cnyes.com/news/id/6363307
413,6363490,能源衝擊對亞洲最顯著？星展上看油價到150美元 軍工類股將迎「超級週期」,美伊情勢急遽惡化，星展集團今（4）發布最新投資總監觀點，解析美伊軍事行動對全球市場的衝擊。美國總統川普在缺乏國會與北約支持下發動攻擊，市場擔憂長期衝突將擾亂供應鏈並推升通膨。星展建議，投資人應關注油價波動對亞洲、包括台灣,https://m.cnyes.com/news/id/6363490
414,6363495,中東局勢動盪航班大亂 觀光署：籲旅行業者近期避免組團前往中東,"美、以聯軍於伊朗發動空襲後，伊朗展開大規模報復，中東航班大亂，對目前在歐洲或中東地區之旅行團當地現況，據交通部觀光署調查，截至昨 (3) 日國內仍 46 團、1,240 人尚未返國，觀光署也籲請旅行業者，近期儘量避免組團前往旅遊，",https://m.cnyes.com/news/id/6363495
415,6362978,特斯拉大股東豪砸1.8億美元買進100萬股輝達！喊信AI「非泡沫」,前特斯拉最大個人股東之一廖凱原宣布買進 100 萬股輝達（NVDA），斥資約 1.8 億美元，並計畫再加碼 100 萬股，強調 AI 不是泡沫。同時看好特斯拉能源、Cybercab 與機器人潛力，相關投資布局引發市場熱議。,https://m.cnyes.com/news/id/6362978
416,6363288,倍利科3月下旬掛牌上市 今年營收估增雙位數再創高,檢測設備廠倍利科 (7822-TW) 即將在 3 月下旬掛牌上市，展望今年，董事長林坤禧表示，受惠 AI、HPC 帶動先進封裝需求升溫，不僅晶圓廠擴大資本支出，封測廠也積極投入，預期今年營收將有雙位數成長，毛利率也將盡力維持去,https://m.cnyes.com/news/id/6363288
417,6363299,中東戰火預計延長 比特幣卻逆勢上攻 重返7.1萬美元,全球金融市場周三 (4 日) 因伊朗衝突陷入動盪之際，比特幣卻意外上揚，突破 71000 美元大關。,https://m.cnyes.com/news/id/6363299
418,6363285,低軌衛星需求強  昇達科去年EPS7.83元擬配息6.8元,低軌衛星與高頻通訊零組件廠昇達科 (3491-TW) 今 (4) 日公布 2025 年財報。稅後純益 5.18 億元，每股純益達 7.83 元，董事會決議對去年股利每股配發 6.8 元現金股利， 盈餘配發率達 86.85%，股利配發創歷年新高。,https://m.cnyes.com/news/id/6363285
419,6361436,前TOPGUN飛行員：伊朗軍力已被壓制 最大風險是「友軍誤擊」,一名前美國海軍 TOPGUN 戰鬥機飛行員表示，在美軍掌握全面制空權的情況下，伊朗幾乎已沒有反制選項，但目前戰場上最大的風險反而來自「友軍誤擊」。,https://m.cnyes.com/news/id/6361436
