,newsId,title,summary,link
815,6207221,今年港股最大車廠IPO要來了！賽力斯 獲頂級資本護航 擬募資逾130億港元、11月5日上市,,https://m.cnyes.com/news/id/6207221
816,6207380,日元跌不下去了？川普訪日助威 153可能是極限底部,,https://m.cnyes.com/news/id/6207380
817,6207361,安徽超越廣東 躍居中國汽車生產龍頭地位,根據中國國家統計局的最新數據，中國汽車產量格局發生了歷史性變動。今年前三季，安徽省汽車產量以 240.44 萬輛的成績，超越了長期居於首位的廣東省 (208.84 萬輛)，領先幅度超過 30 萬輛，預計安徽將首次登頂全國汽車產量第一,https://m.cnyes.com/news/id/6207361
818,6207309,泓德能源全球儲能與光電布局9.4GW 明年營運爆發,泓德能源 (6873-TW) 總經理周仕昌今 (28) 日表示，隨著 AI 與資料中心的需求快速成長，能源將是未來世界最重要的資源，集團著眼未來市場需求，預計至 2028 年集團在全球的總開發容量約 9.4GW，包括台、日、澳，其中又以儲,https://m.cnyes.com/news/id/6207309
819,6207441,外資縮手提款271億、投信終止連15賣 三大法人賣超237.57億元,,https://m.cnyes.com/news/id/6207441
820,6207249,川普盛讚盟友日本！願意向高市早苗提供「任何想要的東西」,美國總統川普週二在東京與日本首位女性首相高市早苗會面，雙方討論美日同盟、貿易協議及國防合作。此次會面也涉及 5500 億美元投資及關鍵礦產合作，彰顯兩國關係持續加深。,https://m.cnyes.com/news/id/6207249
821,6207315,美國財長貝森特呼籲日本實施「穩健」的貨幣政策,美國財政部周二 (28 日) 表示，財長貝森特 (Scott Bessent) 與日本財務大臣片山皋月討論了匯率問題，貝森特強調了穩健貨幣政策的作用。外界解讀認為，這是對日本央行緩慢的升息腳步提出最新的批評。,https://m.cnyes.com/news/id/6207315
822,6207288,7500萬鎂！小摩啟動「美國優先」戰略投資基金 首筆投向關鍵礦產「銻」,,https://m.cnyes.com/news/id/6207288
823,6207303,比爾蓋茲：中國在核能的投資超「全球其他國家總和的兩倍」、美國遇挑戰,比爾蓋茲指出，中國在核能與核反應爐研發上投資驚人，正挑戰美國主導地位。隨著 AI 與資料中心用電激增，核能將成為未來關鍵電力來源。,https://m.cnyes.com/news/id/6207303
824,6207305,南韓經濟復甦超預期 財政部暗示上修2025年成長率至1%,南韓財政部於周二 (28 日) 表示，可能會將今年的經濟成長預期，從原先的 0.9% 上調 0.1 個百分點至 1%。此一暗示的背景是，中央銀行數據顯示，南韓經濟在第 3 季以 6 季以來最快的速度增長。,https://m.cnyes.com/news/id/6207305
825,6207258,阿根廷總統米雷伊掃除國會障礙 加速經濟「休克療法」,,https://m.cnyes.com/news/id/6207258
826,6207310,債蛙迎風起跳！Fed鴿聲不停 20檔投等債ETF殖利率誘人,聯準會啟動降息循環，帶動投等債 ETF 買氣回溫，56 檔在台掛牌之 ETF 近 3 月報酬率衝上雙位數，其中 20 檔平均到期殖利率超過 5.5%。,https://m.cnyes.com/news/id/6207310
827,6207316,〈台股盤後〉2萬8過關拉回跌44點 散熱、記憶體及矽光子氣勢如虹,台股今 (28) 日卻近關情卻，呈高檔震盪走勢，台積電收跌，且其他電子權值股較無表現，終場跌 44.52 點或 0.16%，收 27949.11 點，成交量 5330.28 億元。不過今天散熱、記憶體及矽光子氣勢如虹，成為盤面亮點。 ,https://m.cnyes.com/news/id/6207316
828,6207281,〈財報〉法律準備金拖累稅前利潤下滑 但匯豐上調盈利前景指引,歐洲最大銀行滙豐控股 (00005-HK) 周二 (28 日) 公布第三季財報，儘管受到一筆意外的法律準備金影響，導致其報告稅前利潤 (PBT) 較去年同期下降了約 14%，但其基本業務表現穩健，且優於市場預期，促使該行上調了 2025 年,https://m.cnyes.com/news/id/6207281
829,6207008,WSJ：中國稀土出口受限催生稀土公司投資熱潮,隨著中國限制稀土出口，美國與盟國加速建立非中方供應鏈，政府與私人資金湧入西方稀土產業。川普與習近平會晤將聚焦稀土議題，西方公司股價與投資熱潮持續升溫。,https://m.cnyes.com/news/id/6207008
830,6207250,前瞻能源二廠明年放量 搶AI伺服器電力革命商機,前瞻能源科技二廠已在今年正式啟用，預計將在明年進入量產階段，展望未來，隨著 AI 資料中心不斷升級，電力系統迎來大改革，包括 UPS、BBU 都成為新商機，前瞻能源已布局相關應用，大搶電力革命商機。,https://m.cnyes.com/news/id/6207250
831,6207312,避開「捨不得」陷阱 自由工作者必須重建的資產安全網,,https://m.cnyes.com/news/id/6207312
832,6207311,《價值型投資 最新產業研究報告》聯茂（6213-TW）,,https://m.cnyes.com/news/id/6207311
833,6207270,Metals Focus年度報告：看漲黃金明年衝破5000美元 白銀上看60美元,獨立研究機構 Metals Focus 本周發布其年度《貴金屬投資焦點報告》，對黃金和白銀市場維持堅定看漲立場。報告明確指出，當前的金價回調只是長期牛市中的健康整固，黃金的牛市遠未結束。Metals Focus 預計，黃金價格,https://m.cnyes.com/news/id/6207270
834,6207260,東擎興櫃首日蜜月甜漲逾8成 看好2026年IPC、雲端遊戲動能,和碩 (4938-TW) 集團旗下、華擎 (3515-TW) 子公司東擎 (7710-TW) 於今（28）日以每股 180 元登錄興櫃市場。公司股價早盤以 226 元開出後，盤中最高一度衝上 330 元，相較認購價格漲幅高達 83.,https://m.cnyes.com/news/id/6207260
835,6207261,〈焦點股〉科技巨頭紛紛導入最新液冷散熱技術 奇鋐、雙鴻攜手飆天價,AI 伺服器算力持續提升，同步帶動散熱需求，科技巨頭輝達與蘋果皆傳出可能導入最新液冷散熱技術，以提升散熱效能，激勵奇鋐 (3017-TW) 與雙鴻 (3324-TW) 今 (28) 日攜手飆天價，站穩千金。,https://m.cnyes.com/news/id/6207261
836,6207219,胡潤2025中國百富榜出爐！農夫山泉鍾晱晱5300億人民幣身價四度登頂 雷軍睽違10年重返前五,,https://m.cnyes.com/news/id/6207219
837,6207139,普丁會北韓外長：雙邊戰略夥伴關係「一切按計畫進行」,俄羅斯總統普丁在克里姆林宮會見北韓外交部長崔善姬，請她向金正恩轉達訊息，稱俄朝關係穩定且一切按計畫進行。北韓已派兵、彈藥及飛彈支援俄羅斯在烏克蘭的軍事行動。,https://m.cnyes.com/news/id/6207139
838,6207248,〈房產〉「陶朱隱園」首戶對外12億元成交 十大豪宅總價榜只排上第二,「陶朱隱園」近期傳出 17 樓 戶以 12 億元成交，令十大豪宅排行榜再度洗牌。房仲業者觀察實價登錄，盤整歷年來成交總價最高的北市十處豪宅社區，其中此次成交的「陶朱隱園」17 樓戶，首次成交即排入第二名，第一名爲「文華苑」拿下。,https://m.cnyes.com/news/id/6207248
839,6207247,〈焦點股〉AI傳輸需求升溫、政策助攻 矽光子股環宇-KY、華星光閃亮漲停,輝達 (NVDA-US)GTC DC 大會舉行，加上經濟部將向行政院報告矽光子 (CPO) 國家隊規劃，目標 2028 年供應鏈自主，買盤集中也湧入族群。包括環宇 - KY(4991 -TW)、華星光 (4991 -TW) 一度亮燈漲停。,https://m.cnyes.com/news/id/6207247
840,6207121,砍價搶市！三星HBM4發布前夕推舊款降價30%策略 專家：難撼DRAM行情,,https://m.cnyes.com/news/id/6207121
841,6207213,〈焦點股〉松川精密生產區位完成調整 股價爆量漲停創IPO來新高,老牌繼電器廠商松川在第三季完成產品生產區位的調整，預料將可從容因應美國的高關稅，以及中國大陸的對稀土原料管制出口，也得以透過改變設計及改變生產區位從容因應，預估第四季營運回到正常水準，股價今創 IPO 以來新高。,https://m.cnyes.com/news/id/6207213
842,6207134,押注AI投資！沙烏地阿拉伯力拚經濟轉型 非油產業GDP占比已過半,以「石油王國」聞名的沙烏地阿拉伯，正邁向歷史性的經濟轉型。隨著非油產業比重超過一半，政府積極投資人工智慧、觀光與體育產業，以打造多元成長引擎。這場「去石油化」賭局，不僅改寫國家命運，也將決定該國能否在 AI 時代中再創繁榮。,https://m.cnyes.com/news/id/6207134
843,6207090,逾500家上市櫃企業「水資訊」揭露有破口！安永拋3路徑打通水資源管理,根據最新的 ESG 數位平台資料顯示，台灣上市櫃企業在水資源資訊揭露上仍存在嚴重缺口。截至 2024 年，竟有超過 500 家企業未主動揭露關鍵的「用水密集度」資訊。安永聯合會計師事務所對此指出，上市櫃企業在 ESG 水資訊揭露方面面臨,https://m.cnyes.com/news/id/6207090
844,6207010,川普本月曾接受核磁共振檢查：一切都很完美,美國總統川普近日在 Walter Reed 接受核磁共振檢查，並公開表示健康狀況良好。今年已第二次健康檢查，引發外界對川普健康的關注。,https://m.cnyes.com/news/id/6207010
845,6206574,美股五大科技巨頭財報將登場 業績重點一次看,本周迎來美股科技股重量級財報，Alphabet、Meta、微軟、亞馬遜與蘋果都將陸續公布業績。這不僅關乎這些巨頭企業的規模，更關乎它們在人工智慧 (AI) 競賽中的位置。本文為本周財報最值得關注重點。,https://m.cnyes.com/news/id/6206574
846,6207115,皇家可口今在台IPO 推升南僑成跨兩岸的「T+T+A」三掛牌公司,由南僑轉投資皇家可口旗下冰品與急凍熟麵業務目前在市場有高市占率，今在台上市掛牌交易，早盤最高價達 84.5 元，漲幅達 17.36%，在皇家可口今掛牌交易後，南僑正式成為跨兩岸的「T+T+A」三掛牌公司。,https://m.cnyes.com/news/id/6207115
847,6207111,〈焦點股〉主動台股ETF股王再發威 00981A站上15元 逆勢漲近2%力壓群雄,主動式台股 ETF 股王－主動統一台股增長 (00981A-TW) 再度展現王者風範，掛牌剛滿 5 個月，上市以來漲幅約 5 成，儘管大盤今 (28) 日震盪翻黑，但 00981A 逆勢走強,https://m.cnyes.com/news/id/6207111
848,6206911,中國團隊稱破解晶片光阻劑缺陷難​​題！晶片良率提升超99%,中國科研團隊利用 Cryo-ET 技術成功解析光阻劑微觀結構，提出可減少超過 99% 晶片圖案缺陷的產業化方案。受此利好消息刺激，中國光阻劑概念股週一飄紅，推動半導體製造技術加速進步。,https://m.cnyes.com/news/id/6206911
849,6206934,美加密貨幣ETF掀擴容潮！Solana等四隻山寨幣本周上市 香港又領先美早一天發行,,https://m.cnyes.com/news/id/6206934
850,6206618,韓元快變衛生紙！3500億美元協議掀恐慌 韓國人搶買美元、黃金自救,,https://m.cnyes.com/news/id/6206618
851,6207089,記憶體超級循環，撐起台股半邊天！漲價潮下的獲利爆發力！,,https://m.cnyes.com/news/id/6207089
852,6207063,招親傳聞滿天飛！三商壽、玉山金公告不證實 中信金宣告：投標已結束,三商美邦人壽 (2867-TW) 招親案如火如荼進行中，中信金 (2891-TW) 今 (28) 日上午最新公告 10/23 董事會決議轉投資之投標案已結束,https://m.cnyes.com/news/id/6207063
853,6206637,三大因素共振 人民幣年底前有望升破7,,https://m.cnyes.com/news/id/6206637
854,6207022,佳格宣布投資東南亞數位健康平台HHG 強化東南亞數位健康策略藍圖,佳格於健康產業持續布局，今宣布與亞洲領先的數位健康與保健平台 Hello Health Group (HHG) 建立戰略合作夥伴關係。佳格食品作為 HHG Pre-Series A 輪融資的策略投資人。,https://m.cnyes.com/news/id/6207022
855,6206622,荷蘭接管安世半導體原因曝光：前CEO暗自將生產轉移中國,,https://m.cnyes.com/news/id/6206622
856,6207001,"睽違十年！中國股市再度站上4,000點","據《財聯社》報導，中國 A 股持續走高，上證指數周二（28 日）盤中睽違十年再度站上 4,000 點，寫下 2015 年 8 月 19 日以來新高。",https://m.cnyes.com/news/id/6207001
857,6206994,WSJ：川普若在台灣問題上讓步習近平 將削弱美國嚇阻力,美國總統川普將於南韓與中國國家主席習近平會晤，習近平意圖施壓美國削弱對台灣的支持。專家指出，台灣在地緣政治與價值觀上符合美國利益，川普若堅守立場，可維護世界和平。,https://m.cnyes.com/news/id/6206994
858,6206928,終結進口依賴！中科院突破「人造太陽」核心材料，哈氏合金基帶實現噸級量產,,https://m.cnyes.com/news/id/6206928
859,6206995,大陸公安機關出手！決定對台獨頑固分子沈伯洋立案偵查,據《新華社》報導，中國重慶市公安局周二（28 日）發布警情通報，表示為堅決打擊沈伯洋通過發起、建立「台獨」分裂組織「黑熊學院」等方式從事分裂國家犯罪活動，決定對沈伯洋涉嫌分裂國家犯罪立案偵查。,https://m.cnyes.com/news/id/6206995
860,6206806,科技7巨頭明起密集公佈Q3財報成績 歷史新高的美股能否迎來新爆點？,,https://m.cnyes.com/news/id/6206806
861,6206903,新華社連兩天發署名文章 提愛國者治台、高度自治,大陸上周六舉辦紀念台灣光復 80 周年大會後，官媒《新華社》連續兩天刊發署名「鍾台文」的文章，主張兩岸和平統一後，台灣現行社會制度和生活方式等將得到充分尊重，北京實行「愛國者治台」，台灣高度自治。,https://m.cnyes.com/news/id/6206903
862,6206617,AI聯盟再升級！黃仁勳30日首爾見李在鎔與鄭義宣,,https://m.cnyes.com/news/id/6206617
863,6206891,〈台股開盤〉開小高後未續攻新高 2萬8關卡先安營紮寨,美股四大指數昨日全面收紅，不過台股在昨日創高後，今日呈現高檔震盪走勢，早盤以 28041.01 點開高後翻黑走低，最低跌至 27946.6 點，不過隨後翻紅，最高漲至 28083.86 點，力拚站穩 2 萬 8，預估成交量 5700 億元。,https://m.cnyes.com/news/id/6206891
864,6206641,蘋果20週年紀念「iPhone XX」傳聞一次看：全玻璃設計、2奈米晶片與螢幕下Face ID,蘋果正籌備 2027 年推出的 iPhone 20 週年紀念版「iPhone XX」，據傳將採用全玻璃無邊框設計、螢幕下 Face ID、2 奈米 A21 晶片與新一代 OLED 技術，象徵 iPhone 的重大革新。,https://m.cnyes.com/news/id/6206641
865,6206743,不敵AI衝擊 線上教育平台Chegg砍近半人力自救求生,生成式 AI 的興起正在重塑教育產業版圖。曾是線上學習代表的 Chegg，如今面臨搜尋流量銳減與收入崩跌的雙重壓力。為求生存，公司再度大裁員並迎回前執行長，試圖在 AI 時代中尋找新出路。,https://m.cnyes.com/news/id/6206743
866,6206573,美中休戰樂觀情緒高漲 麥格理警告：真正協議仍遙不可及,周末的新聞再度點燃市場對改變局勢的美中貿易協議的期待，但麥格理 (Macquarie) 警告，高層談判雖有助於延緩衝突升級，卻難以化解華府與北京之間的戰略分歧，真正的貿易協議仍遙不可及。,https://m.cnyes.com/news/id/6206573
867,6206629,鴻海斥420億元採購AI算力設備 超算中心2026年完工,鴻海斥 420 億元採購 AI 算力設備 超算中心 2026 年完工,https://m.cnyes.com/news/id/6206629
868,6206744,馬斯克的AI百科全書來了！Grokipedia周一上線 收錄超過88.5萬篇文章,,https://m.cnyes.com/news/id/6206744
869,6206745,政府停擺！美國2天超過1萬次航班延誤,"美國聯邦政府持續停擺，空中交通管制員缺勤人數激增，周一（27 日）全美超過 5,600 個航班延誤，周日也有超過 8,800 個航班延誤。",https://m.cnyes.com/news/id/6206745
870,6206749,【豐搜】國巨爆量上攻，資金轉向被動元件！漲價概念股名單與未來投資趨勢一次看,,https://m.cnyes.com/news/id/6206749
871,6206638,美核潛艇已部署俄海岸外！川普警告普丁：應結束戰爭而非試射飛彈,美國總統川普呼籲俄羅斯總統普丁結束烏克蘭戰爭，批評其進行核武飛彈試射不當，並透露美國核潛艇已部署在俄羅斯海岸外，強調美俄關係不應因核試而惡化。,https://m.cnyes.com/news/id/6206638
872,6206616,分潤爭議升溫 迪士尼恐自YouTube TV撤下ABC與ESPN頻道 1000萬用戶恐遭波及,"迪士尼與 YouTube TV 在分潤與內容整合上分歧嚴重，迪士尼警告，若未能在 10 月 30 日午夜前達成新協議，旗下 ABC 與 ESPN 等頻道將自 YouTube TV 平台下架，恐影響約 1,000 萬名用戶的觀影權益。",https://m.cnyes.com/news/id/6206616
873,6193784,【Joe’s華爾街脈動】宏觀利多助攻，美股創紀錄漲勢,,https://m.cnyes.com/news/id/6193784
874,6206640,墨西哥總統：美國將把貿易談判期限延長數周,墨西哥總統克辛鮑姆周一（27 日）表示，美國將把與墨西哥達成貿易協議的期限延長數周。這是美國總統川普對其南部鄰國的最新一次暫緩舉措。,https://m.cnyes.com/news/id/6206640
875,6206619,應對中國出口管制 美日將簽署確保稀土供應聯合文件,日本首相高市早苗 (Sanae Takaichi) 與美國總統川普正進入最後階段，準備簽署一份有關確保稀土及其他關鍵礦物供應、加強供應鏈的聯合文件。,https://m.cnyes.com/news/id/6206619
876,6206611,輝達推進歐洲AI布局 將與德國電信合建資料中心,最新消息顯示，美國人工智慧（AI）晶片巨頭輝達（Nvidia）和德國電信（Deutsche Telekom AG）準備在德國建設一座價值 10 億歐元（約合 11.6 億美元）的資料中心。,https://m.cnyes.com/news/id/6206611
877,6206430,美股重點新聞摘要2025年10月28日,,https://m.cnyes.com/news/id/6206430
878,6206582,電力就是新石油！OpenAI：美國應年增100GW電力 保持領先中國地位,,https://m.cnyes.com/news/id/6206582
879,6206605,AI與iPhone雙引擎推動 小摩看多蘋果：年底或挑戰290美元,小摩看好蘋果 iPhone 17 強勁需求與服務業務成長，將其目標股價由 280 美元上調至 290 美元，並預測蘋果下季營收將達 1030 億美元，iPhone 營收上看 761 億美元，並預期 AI 技術與新產品周期將推動明年的成長。,https://m.cnyes.com/news/id/6206605
880,6206564,高通進軍AI資料中心市場 Humain成為首家客戶,高通週一 (27 日) 表示，未來將致力於每年推出一代全新的人工智慧資料中心產品。來自沙烏地阿拉伯的 Humain 公司是高通 AI 資料中心產品的首批客戶之一,https://m.cnyes.com/news/id/6206564
881,6206550,措手不及！美中關稅休戰有望延長 美企早就提前囤貨春季商品,,https://m.cnyes.com/news/id/6206550
882,6206590,AI能耗飆升  Google攜手NextEra重啟核能 杜安阿諾電廠預計2029年復運,Google 宣布將購買愛荷華州杜安阿諾核電廠的電力，作為其數據中心的能源來源，該核電廠預計於 2029 年重啟。隨著 AI 運算帶動電力需求激增，科技巨頭正紛紛轉向穩定的低碳能源，核能因此再度成為能源轉型的重要選項。,https://m.cnyes.com/news/id/6206590
883,6206578,經濟學家：這兩個州可能決定美國是否陷入衰退,美國政治圈有句老話：「俄亥俄州怎麼走，全國就怎麼走。」但就經濟而言，現在這句話或許該改成：「紐約州與加州怎麼走，美國就怎麼走。」穆迪分析經濟學家特別關注這兩個州的經濟走向。,https://m.cnyes.com/news/id/6206578
884,6206545,AI熱潮推升市值 蘋果、微軟將與輝達同列4兆美元俱樂部,,https://m.cnyes.com/news/id/6206545
885,6206575,特斯拉升超4% 大摩分析師：自駕問題已「解決」,摩根士丹利 (Morgan Stanley) 分析師周一 (27 日) 表示，自駕車時代已經來臨，並準備大展身手。他對馬斯克 (Elon Musk) 帶領的特斯拉信心滿滿，認為該公司已經有效「解決」自駕問題。,https://m.cnyes.com/news/id/6206575
886,6206563,投行：iPhone Air訂單減產消息可能並不屬實,蘋果並未調整 iPhone Air 的生產計畫，近期減產傳聞遭投行 TD Cowen 駁斥。,https://m.cnyes.com/news/id/6206563
887,6206283,「超級央行週」來了！外資：看好新興市場投資機會 聚焦科技類股、大宗商品族群,,https://m.cnyes.com/news/id/6206283
888,6206429,〈紐約匯市〉美元走弱 貿易樂觀情緒推升風險胃納,,https://m.cnyes.com/news/id/6206429
889,6206586,2026上線！AI+3D技術 谷歌讓駐外軍人「瞬間回家」團聚,Google 宣布與美國軍人服務組織（USO）合作，將於 2026 年啟動 AI 驅動的 3D 通訊平台「Google Beam」試行計畫，協助駐外軍人與家人即時互動，象徵科技在人與人情感連結上的新里程碑。,https://m.cnyes.com/news/id/6206586
890,6206369,〈能源盤後〉油市拉鋸小幅收跌 OPEC增產、美中談判與俄制裁三方角力,在沙烏地阿拉伯推動 OPEC + 於 12 月再次增產的消息傳出後，國際油價於週一小幅收低。市場同時聚焦本週美中領導人會晤，期待能為貿易緊張局勢降溫，而美國對俄羅斯的新制裁則為油價提供潛在支撐。,https://m.cnyes.com/news/id/6206369
891,6206538,〈貴金屬盤後〉美中貿易會談有進展 金價盤中跌破4000美元,,https://m.cnyes.com/news/id/6206538
892,6206368,【袁志峰專欄】內地9月工業利潤高速增長,"今日推介 - 中國移動 (941, $85.2), 目標價 $92.0, 止損價 $82.0",https://m.cnyes.com/news/id/6206368
893,6206566,倫敦戰略智庫警告：台積電成全球AI命運關鍵,倫敦戰略研究機構 Sibylline 發出最新警告，指出全球正朝向一場「多重危機」(polycrisis) 發展，地緣政治、科技與經濟衝突將在 2027 年同步爆發，並可能重塑國際秩序。,https://m.cnyes.com/news/id/6206566
894,6206553,〈美股盤後〉美中有望達貿易協議 三大指數齊創收盤新高,"投資人對美中即將達成貿易協議的憧憬，激勵市場氣氛，美股週一 (27 日) 強勢收紅。高通、AMD 等多檔重量級個股出現明顯波動。不過，隨著避險需求減弱，金價跌破每盎司 4,000 美元。",https://m.cnyes.com/news/id/6206553
895,6206498,〈台股盤前要聞〉法人拱火再攻2萬8、國巨市值衝破5100億、長榮大手筆租3.3萬只貨櫃,台股盤前要聞,https://m.cnyes.com/news/id/6206498
896,6206437,《天才法案》上路3個月！美穩定幣支付暴增70% 企業端扛起成長大旗,,https://m.cnyes.com/news/id/6206437
897,6206329,川習會談什麼？從稀土、TikTok到關稅 8大焦點一次掌握,美國總統川普與中國國家主席習近平本周四的南韓會談，能否化解中美貿易僵局？《彭博》周一 (27 日) 報導，雙方周末已敲定協議框架。從稀土、關稅到 TikTok，本文帶你一次看懂川習會八大焦點議題。,https://m.cnyes.com/news/id/6206329
898,6206562,波克夏罕見獲得「賣出」評級 巴菲特即將卸任CEO,KBW 將波克夏 A 股目標價從 74 萬美元降至 70 萬美元。,https://m.cnyes.com/news/id/6206562
899,6206463,川普：不想跟加拿大總理見面 美加貿易協議順其自然,近日加拿大安大略省政府發布了一則反關稅廣告，引用美國前總統雷根的言論，抨擊美國總統川普的關稅政策。這則廣告激怒了川普，他宣布終止與加拿大的所有貿易談判，還揚言要對加拿大額外加徵 10% 關稅。,https://m.cnyes.com/news/id/6206463
900,6206542,路透：亞馬遜傳周二起裁員3萬人 近10%辦公室白領受影響,《路透》周一 (27 日) 引述三位知情人士報導稱，亞馬遜 (AMZN-US) 計劃從周二起裁減多達 3 萬個辦公室職位，以削減成本並修正疫情期間過度招聘。,https://m.cnyes.com/news/id/6206542
901,6206391,王毅同美國國務卿通話 盼相向而行 為中美高層互動做準備,中共中央政治局委員、中國外交部長王毅周一（27 日）同美國國務卿魯比歐通話，王毅希望雙方相向而行，為中美高層互動做好準備。,https://m.cnyes.com/news/id/6206391
902,6206301,美財長罵陸「不尊重」？紐時：中國還有一張比稀土能讓美國更痛的王牌,,https://m.cnyes.com/news/id/6206301
903,6206541,祖克柏力拼AI競賽！Meta元宇宙主管轉戰AI部門,據《彭博》周一 (27 日) 報導，Meta(META-US) 將元宇宙業務最高主管 Vishal Shah 調任負責 AI 產品，顯示該公司正重整團隊架構，以便在激烈的 AI 競賽中投入更多資源。,https://m.cnyes.com/news/id/6206541
904,6206533,川普昨抵日先見天皇、今會高市！5500億美元投資、國防支出成焦點,據《路透》周一 (27 日) 報導，美國總統川普周一抵達日本，展開亞洲五日行程。日本已承諾 5500 億美元投資換取關稅減免，首相高市早苗周二預計將進一步承諾採購美國皮卡、大豆和天然氣，並加速國防支出。,https://m.cnyes.com/news/id/6206533
905,6206438,政府關門影響數據公布！芝加哥Fed預估：美10月失業率維持4.35%,據《華爾街日報》周一 (27 日) 報導，芝加哥聯邦準備銀行預估，美國 10 月失業率為 4.35%，與 9 月的 4.34% 大致持平。,https://m.cnyes.com/news/id/6206438
